------[ CPUID Registers / Logical CPU #0 ]------
CPUID 00000000: 00000023-756E6547-6C65746E-49656E69 [GenuineIntel]
CPUID 00000001: 000B06D1-00800800-7FFAFBFF-BFEBFBFF
CPUID 00000002: 00FEFF01-000000F0-00000000-00000000
CPUID 00000003: 00000000-00000000-00000000-00000000
CPUID 00000004: FC004121-02C0003F-0000003F-00000000 [SL 00] [L1D: 48+192 KB]
CPUID 00000004: FC004122-03C0003F-0000003F-00000000 [SL 01] [L1I: 64 KB]
CPUID 00000004: FC01C143-0240003F-00000FFF-00000000 [SL 02] [L2U: 2560 KB]
CPUID 00000004: FC0FC163-02C0003F-00003FFF-00000004 [SL 03] [L3U: 12 MB]
CPUID 00000005: 00000040-00000040-00000003-10002020
CPUID 00000006: 00DFCFF7-00000002-00000409-00000003
CPUID 00000007: 00000002-239CA7EB-994027AC-FC1CC430 [SL 00]
CPUID 00000007: 44C009D7-00000003-00000000-00040430 [SL 01]
CPUID 00000007: 00000000-00000000-00000000-000000BF [SL 02]
CPUID 00000008: 00000000-00000000-00000000-00000000
CPUID 00000009: 00000000-00000000-00000000-00000000
CPUID 0000000A: 0D300806-00000280-00000007-00008603
CPUID 0000000B: 00000001-00000001-00000100-00000000 [SL 00]
CPUID 0000000B: 00000007-00000008-00000201-00000000 [SL 01]
CPUID 0000000C: 00000000-00000000-00000000-00000000
CPUID 0000000D: 00000207-00000340-00000A88-00000000 [SL 00] [x87]
CPUID 0000000D: 0000000F-000003D0-0001D900-00000000 [SL 01] [SSE]
CPUID 0000000D: 00000100-00000240-00000000-00000000 [SL 02] [AVX]
CPUID 0000000D: 00000080-00000000-00000001-00000000 [SL 08] [PT]
CPUID 0000000D: 00000008-00000A80-00000000-00000000 [SL 09] [PKRU]
CPUID 0000000D: 00000010-00000000-00000001-00000000 [SL 0B] [CET_U]
CPUID 0000000D: 00000018-00000000-00000001-00000000 [SL 0C] [CET_S]
CPUID 0000000D: 00000030-00000000-00000001-00000000 [SL 0E] [UINTR]
CPUID 0000000D: 00000328-00000000-00000001-00000000 [SL 0F] [LBR]
CPUID 0000000D: 00000008-00000000-00000001-00000000 [SL 10] [HWP]
CPUID 0000000E: 00000000-00000000-00000000-00000000
CPUID 0000000F: 00000000-00000000-00000000-00000000 [SL 00]
CPUID 0000000F: 00000000-00000000-00000000-00000000 [SL 01]
CPUID 00000010: 00000000-00000040-00000000-00000000 [SL 00]
CPUID 00000010: 00000000-00000000-00000000-00000000 [SL 01]
CPUID 00000011: 00000000-00000000-00000000-00000000
CPUID 00000012: 00000000-00000000-00000000-00000000 [SL 00]
CPUID 00000012: 00000000-00000000-00000000-00000000 [SL 01]
CPUID 00000013: 00000000-00000000-00000000-00000000
CPUID 00000014: 00000001-0000015F-00000007-00000000 [SL 00]
CPUID 00000014: 02490002-003F003F-00000000-00000000 [SL 01]
CPUID 00000015: 00000002-000000AC-0249F000-00000000 [86.00x / 38400000 / 3302.40]
CPUID 00000016: 00000CE4-000013EC-00000064-00000000 [3300 / 5100 / 100]
CPUID 00000017: 00000000-00000000-00000000-00000000 [SL 00]
CPUID 00000018: 00000008-00000000-00000000-00000000 [SL 00]
CPUID 00000018: 00000000-00080001-00000020-00004022 [SL 01]
CPUID 00000018: 00000000-00080006-00000004-00004022 [SL 02]
CPUID 00000018: 00000000-0010000F-00000001-00004125 [SL 03]
CPUID 00000018: 00000000-00080001-00000010-00004024 [SL 04]
CPUID 00000018: 00000000-00040006-00000008-00004024 [SL 05]
CPUID 00000018: 00000000-00080008-00000001-00004124 [SL 06]
CPUID 00000018: 00000000-00080007-00000080-00004043 [SL 07]
CPUID 00000018: 00000000-00080009-00000080-00004043 [SL 08]
CPUID 00000019: 00000000-00000000-00000000-00000000
CPUID 0000001A: 40000003-00000000-00000000-00000000 [Core: Lion Cove]
CPUID 0000001B: 00000001-00000001-00000002-00000000 [SL 00]
CPUID 0000001C: 4000000B-00000007-000F0007-00000000
CPUID 0000001D: 00000000-00000000-00000000-00000000 [SL 00]
CPUID 0000001E: 00000000-00000000-00000000-00000000 [SL 00]
CPUID 0000001F: 00000001-00000001-00000100-00000000 [SL 00]
CPUID 0000001F: 00000003-00000001-00000201-00000000 [SL 01]
CPUID 0000001F: 00000007-00000008-00000302-00000000 [SL 02]
CPUID 00000020: 00000000-00000001-00000000-00000000 [SL 00]
CPUID 00000021: 00000000-00000000-00000000-00000000
CPUID 00000022: 00000000-00000000-00000000-00000000
CPUID 00000023: 0000000B-00000003-00000000-00000000 [SL 00]
CPUID 00000023: 000003FF-0000000F-00000000-00000000 [SL 01]
CPUID 00000023: 00000000-00000000-00000000-00000000 [SL 02]
CPUID 00000023: 00001DFF-00000000-00000000-00000000 [SL 03]
CPUID 00000023: 00000000-00000000-00000000-00000000 [SL 04]
CPUID 00000023: 00000000-00000000-00000000-00000000 [SL 05]
CPUID 00000023: 00000000-00000000-00000000-00000000 [SL 06]
CPUID 00000023: 00000000-00000000-00000000-00000000 [SL 07]
CPUID 00000023: 00000000-00000000-00000000-00000000 [SL 08]
CPUID 00000023: 00000000-00000000-00000000-00000000 [SL 09]
CPUID 00000023: 00000000-00000000-00000000-00000000 [SL 0A]
CPUID 00000023: 00000000-00000000-00000000-00000000 [SL 0B]
CPUID 80000000: 80000008-00000000-00000000-00000000
CPUID 80000001: 00000000-00000000-00000121-2C100000
CPUID 80000002: 65746E49-2952286C-726F4320-4D542865 [Intel(R) Core(TM]
CPUID 80000003: 6C552029-20617274-38322039-00005638 [) Ultra 9 288V]
CPUID 80000004: 00000000-00000000-00000000-00000000 []
CPUID 80000005: 00000000-00000000-00000000-00000000 [L1D: 0 KB / L1I: 0 KB]
CPUID 80000006: 00000000-00000000-0A007040-00000000 [L2: 2560 KB / L3: 0 KB]
CPUID 80000007: 00000000-00000000-00000000-00000100
CPUID 80000008: 0000302A-00000200-00000000-00000000
------[ CPUID Registers / Logical CPU #1 ]------
CPUID 00000000: 00000023-756E6547-6C65746E-49656E69 [GenuineIntel]
CPUID 00000001: 000B06D1-08800800-7FFAFBFF-BFEBFBFF
CPUID 00000002: 00FEFF01-000000F0-00000000-00000000
CPUID 00000003: 00000000-00000000-00000000-00000000
CPUID 00000004: FC004121-02C0003F-0000003F-00000000 [SL 00] [L1D: 48+192 KB]
CPUID 00000004: FC004122-03C0003F-0000003F-00000000 [SL 01] [L1I: 64 KB]
CPUID 00000004: FC01C143-0240003F-00000FFF-00000000 [SL 02] [L2U: 2560 KB]
CPUID 00000004: FC0FC163-02C0003F-00003FFF-00000004 [SL 03] [L3U: 12 MB]
CPUID 00000005: 00000040-00000040-00000003-10002020
CPUID 00000006: 00DFCFF7-00000002-00000409-00010003
CPUID 00000007: 00000002-239CA7EB-994027AC-FC1CC430 [SL 00]
CPUID 00000007: 44C009D7-00000003-00000000-00040430 [SL 01]
CPUID 00000007: 00000000-00000000-00000000-000000BF [SL 02]
CPUID 00000008: 00000000-00000000-00000000-00000000
CPUID 00000009: 00000000-00000000-00000000-00000000
CPUID 0000000A: 0D300806-00000280-00000007-00008603
CPUID 0000000B: 00000001-00000001-00000100-00000008 [SL 00]
CPUID 0000000B: 00000007-00000008-00000201-00000008 [SL 01]
CPUID 0000000C: 00000000-00000000-00000000-00000000
CPUID 0000000D: 00000207-00000340-00000A88-00000000 [SL 00] [x87]
CPUID 0000000D: 0000000F-000003D0-0001D900-00000000 [SL 01] [SSE]
CPUID 0000000D: 00000100-00000240-00000000-00000000 [SL 02] [AVX]
CPUID 0000000D: 00000080-00000000-00000001-00000000 [SL 08] [PT]
CPUID 0000000D: 00000008-00000A80-00000000-00000000 [SL 09] [PKRU]
CPUID 0000000D: 00000010-00000000-00000001-00000000 [SL 0B] [CET_U]
CPUID 0000000D: 00000018-00000000-00000001-00000000 [SL 0C] [CET_S]
CPUID 0000000D: 00000030-00000000-00000001-00000000 [SL 0E] [UINTR]
CPUID 0000000D: 00000328-00000000-00000001-00000000 [SL 0F] [LBR]
CPUID 0000000D: 00000008-00000000-00000001-00000000 [SL 10] [HWP]
CPUID 0000000E: 00000000-00000000-00000000-00000000
CPUID 0000000F: 00000000-00000000-00000000-00000000 [SL 00]
CPUID 0000000F: 00000000-00000000-00000000-00000000 [SL 01]
CPUID 00000010: 00000000-00000040-00000000-00000000 [SL 00]
CPUID 00000010: 00000000-00000000-00000000-00000000 [SL 01]
CPUID 00000011: 00000000-00000000-00000000-00000000
CPUID 00000012: 00000000-00000000-00000000-00000000 [SL 00]
CPUID 00000012: 00000000-00000000-00000000-00000000 [SL 01]
CPUID 00000013: 00000000-00000000-00000000-00000000
CPUID 00000014: 00000001-0000015F-00000007-00000000 [SL 00]
CPUID 00000014: 02490002-003F003F-00000000-00000000 [SL 01]
CPUID 00000015: 00000002-000000AC-0249F000-00000000 [86.00x / 38400000 / 3302.40]
CPUID 00000016: 00000CE4-000013EC-00000064-00000000 [3300 / 5100 / 100]
CPUID 00000017: 00000000-00000000-00000000-00000000 [SL 00]
CPUID 00000018: 00000008-00000000-00000000-00000000 [SL 00]
CPUID 00000018: 00000000-00080001-00000020-00004022 [SL 01]
CPUID 00000018: 00000000-00080006-00000004-00004022 [SL 02]
CPUID 00000018: 00000000-0010000F-00000001-00004125 [SL 03]
CPUID 00000018: 00000000-00080001-00000010-00004024 [SL 04]
CPUID 00000018: 00000000-00040006-00000008-00004024 [SL 05]
CPUID 00000018: 00000000-00080008-00000001-00004124 [SL 06]
CPUID 00000018: 00000000-00080007-00000080-00004043 [SL 07]
CPUID 00000018: 00000000-00080009-00000080-00004043 [SL 08]
CPUID 00000019: 00000000-00000000-00000000-00000000
CPUID 0000001A: 40000003-00000000-00000000-00000000 [Core: Lion Cove]
CPUID 0000001B: 00000001-00000001-00000002-00000000 [SL 00]
CPUID 0000001C: 4000000B-00000007-000F0007-00000000
CPUID 0000001D: 00000000-00000000-00000000-00000000 [SL 00]
CPUID 0000001E: 00000000-00000000-00000000-00000000 [SL 00]
CPUID 0000001F: 00000001-00000001-00000100-00000008 [SL 00]
CPUID 0000001F: 00000003-00000001-00000201-00000008 [SL 01]
CPUID 0000001F: 00000007-00000008-00000302-00000008 [SL 02]
CPUID 00000020: 00000000-00000001-00000000-00000000 [SL 00]
CPUID 00000021: 00000000-00000000-00000000-00000000
CPUID 00000022: 00000000-00000000-00000000-00000000
CPUID 00000023: 0000000B-00000003-00000000-00000000 [SL 00]
CPUID 00000023: 000003FF-0000000F-00000000-00000000 [SL 01]
CPUID 00000023: 00000000-00000000-00000000-00000000 [SL 02]
CPUID 00000023: 00001DFF-00000000-00000000-00000000 [SL 03]
CPUID 00000023: 00000000-00000000-00000000-00000000 [SL 04]
CPUID 00000023: 00000000-00000000-00000000-00000000 [SL 05]
CPUID 00000023: 00000000-00000000-00000000-00000000 [SL 06]
CPUID 00000023: 00000000-00000000-00000000-00000000 [SL 07]
CPUID 00000023: 00000000-00000000-00000000-00000000 [SL 08]
CPUID 00000023: 00000000-00000000-00000000-00000000 [SL 09]
CPUID 00000023: 00000000-00000000-00000000-00000000 [SL 0A]
CPUID 00000023: 00000000-00000000-00000000-00000000 [SL 0B]
CPUID 80000000: 80000008-00000000-00000000-00000000
CPUID 80000001: 00000000-00000000-00000121-2C100000
CPUID 80000002: 65746E49-2952286C-726F4320-4D542865 [Intel(R) Core(TM]
CPUID 80000003: 6C552029-20617274-38322039-00005638 [) Ultra 9 288V]
CPUID 80000004: 00000000-00000000-00000000-00000000 []
CPUID 80000005: 00000000-00000000-00000000-00000000 [L1D: 0 KB / L1I: 0 KB]
CPUID 80000006: 00000000-00000000-0A007040-00000000 [L2: 2560 KB / L3: 0 KB]
CPUID 80000007: 00000000-00000000-00000000-00000100
CPUID 80000008: 0000302A-00000200-00000000-00000000
------[ CPUID Registers / Logical CPU #2 ]------
CPUID 00000000: 00000023-756E6547-6C65746E-49656E69 [GenuineIntel]
CPUID 00000001: 000B06D1-10800800-7FFAFBFF-BFEBFBFF
CPUID 00000002: 00FEFF01-000000F0-00000000-00000000
CPUID 00000003: 00000000-00000000-00000000-00000000
CPUID 00000004: FC004121-02C0003F-0000003F-00000000 [SL 00] [L1D: 48+192 KB]
CPUID 00000004: FC004122-03C0003F-0000003F-00000000 [SL 01] [L1I: 64 KB]
CPUID 00000004: FC01C143-0240003F-00000FFF-00000000 [SL 02] [L2U: 2560 KB]
CPUID 00000004: FC0FC163-02C0003F-00003FFF-00000004 [SL 03] [L3U: 12 MB]
CPUID 00000005: 00000040-00000040-00000003-10002020
CPUID 00000006: 00DFCFF7-00000002-00000409-00020003
CPUID 00000007: 00000002-239CA7EB-994027AC-FC1CC430 [SL 00]
CPUID 00000007: 44C009D7-00000003-00000000-00040430 [SL 01]
CPUID 00000007: 00000000-00000000-00000000-000000BF [SL 02]
CPUID 00000008: 00000000-00000000-00000000-00000000
CPUID 00000009: 00000000-00000000-00000000-00000000
CPUID 0000000A: 0D300806-00000280-00000007-00008603
CPUID 0000000B: 00000001-00000001-00000100-00000010 [SL 00]
CPUID 0000000B: 00000007-00000008-00000201-00000010 [SL 01]
CPUID 0000000C: 00000000-00000000-00000000-00000000
CPUID 0000000D: 00000207-00000340-00000A88-00000000 [SL 00] [x87]
CPUID 0000000D: 0000000F-000003D0-0001D900-00000000 [SL 01] [SSE]
CPUID 0000000D: 00000100-00000240-00000000-00000000 [SL 02] [AVX]
CPUID 0000000D: 00000080-00000000-00000001-00000000 [SL 08] [PT]
CPUID 0000000D: 00000008-00000A80-00000000-00000000 [SL 09] [PKRU]
CPUID 0000000D: 00000010-00000000-00000001-00000000 [SL 0B] [CET_U]
CPUID 0000000D: 00000018-00000000-00000001-00000000 [SL 0C] [CET_S]
CPUID 0000000D: 00000030-00000000-00000001-00000000 [SL 0E] [UINTR]
CPUID 0000000D: 00000328-00000000-00000001-00000000 [SL 0F] [LBR]
CPUID 0000000D: 00000008-00000000-00000001-00000000 [SL 10] [HWP]
CPUID 0000000E: 00000000-00000000-00000000-00000000
CPUID 0000000F: 00000000-00000000-00000000-00000000 [SL 00]
CPUID 0000000F: 00000000-00000000-00000000-00000000 [SL 01]
CPUID 00000010: 00000000-00000040-00000000-00000000 [SL 00]
CPUID 00000010: 00000000-00000000-00000000-00000000 [SL 01]
CPUID 00000011: 00000000-00000000-00000000-00000000
CPUID 00000012: 00000000-00000000-00000000-00000000 [SL 00]
CPUID 00000012: 00000000-00000000-00000000-00000000 [SL 01]
CPUID 00000013: 00000000-00000000-00000000-00000000
CPUID 00000014: 00000001-0000015F-00000007-00000000 [SL 00]
CPUID 00000014: 02490002-003F003F-00000000-00000000 [SL 01]
CPUID 00000015: 00000002-000000AC-0249F000-00000000 [86.00x / 38400000 / 3302.40]
CPUID 00000016: 00000CE4-000013EC-00000064-00000000 [3300 / 5100 / 100]
CPUID 00000017: 00000000-00000000-00000000-00000000 [SL 00]
CPUID 00000018: 00000008-00000000-00000000-00000000 [SL 00]
CPUID 00000018: 00000000-00080001-00000020-00004022 [SL 01]
CPUID 00000018: 00000000-00080006-00000004-00004022 [SL 02]
CPUID 00000018: 00000000-0010000F-00000001-00004125 [SL 03]
CPUID 00000018: 00000000-00080001-00000010-00004024 [SL 04]
CPUID 00000018: 00000000-00040006-00000008-00004024 [SL 05]
CPUID 00000018: 00000000-00080008-00000001-00004124 [SL 06]
CPUID 00000018: 00000000-00080007-00000080-00004043 [SL 07]
CPUID 00000018: 00000000-00080009-00000080-00004043 [SL 08]
CPUID 00000019: 00000000-00000000-00000000-00000000
CPUID 0000001A: 40000003-00000000-00000000-00000000 [Core: Lion Cove]
CPUID 0000001B: 00000001-00000001-00000002-00000000 [SL 00]
CPUID 0000001C: 4000000B-00000007-000F0007-00000000
CPUID 0000001D: 00000000-00000000-00000000-00000000 [SL 00]
CPUID 0000001E: 00000000-00000000-00000000-00000000 [SL 00]
CPUID 0000001F: 00000001-00000001-00000100-00000010 [SL 00]
CPUID 0000001F: 00000003-00000001-00000201-00000010 [SL 01]
CPUID 0000001F: 00000007-00000008-00000302-00000010 [SL 02]
CPUID 00000020: 00000000-00000001-00000000-00000000 [SL 00]
CPUID 00000021: 00000000-00000000-00000000-00000000
CPUID 00000022: 00000000-00000000-00000000-00000000
CPUID 00000023: 0000000B-00000003-00000000-00000000 [SL 00]
CPUID 00000023: 000003FF-0000000F-00000000-00000000 [SL 01]
CPUID 00000023: 00000000-00000000-00000000-00000000 [SL 02]
CPUID 00000023: 00001DFF-00000000-00000000-00000000 [SL 03]
CPUID 00000023: 00000000-00000000-00000000-00000000 [SL 04]
CPUID 00000023: 00000000-00000000-00000000-00000000 [SL 05]
CPUID 00000023: 00000000-00000000-00000000-00000000 [SL 06]
CPUID 00000023: 00000000-00000000-00000000-00000000 [SL 07]
CPUID 00000023: 00000000-00000000-00000000-00000000 [SL 08]
CPUID 00000023: 00000000-00000000-00000000-00000000 [SL 09]
CPUID 00000023: 00000000-00000000-00000000-00000000 [SL 0A]
CPUID 00000023: 00000000-00000000-00000000-00000000 [SL 0B]
CPUID 80000000: 80000008-00000000-00000000-00000000
CPUID 80000001: 00000000-00000000-00000121-2C100000
CPUID 80000002: 65746E49-2952286C-726F4320-4D542865 [Intel(R) Core(TM]
CPUID 80000003: 6C552029-20617274-38322039-00005638 [) Ultra 9 288V]
CPUID 80000004: 00000000-00000000-00000000-00000000 []
CPUID 80000005: 00000000-00000000-00000000-00000000 [L1D: 0 KB / L1I: 0 KB]
CPUID 80000006: 00000000-00000000-0A007040-00000000 [L2: 2560 KB / L3: 0 KB]
CPUID 80000007: 00000000-00000000-00000000-00000100
CPUID 80000008: 0000302A-00000200-00000000-00000000
------[ CPUID Registers / Logical CPU #3 ]------
CPUID 00000000: 00000023-756E6547-6C65746E-49656E69 [GenuineIntel]
CPUID 00000001: 000B06D1-18800800-7FFAFBFF-BFEBFBFF
CPUID 00000002: 00FEFF01-000000F0-00000000-00000000
CPUID 00000003: 00000000-00000000-00000000-00000000
CPUID 00000004: FC004121-02C0003F-0000003F-00000000 [SL 00] [L1D: 48+192 KB]
CPUID 00000004: FC004122-03C0003F-0000003F-00000000 [SL 01] [L1I: 64 KB]
CPUID 00000004: FC01C143-0240003F-00000FFF-00000000 [SL 02] [L2U: 2560 KB]
CPUID 00000004: FC0FC163-02C0003F-00003FFF-00000004 [SL 03] [L3U: 12 MB]
CPUID 00000005: 00000040-00000040-00000003-10002020
CPUID 00000006: 00DFCFF7-00000002-00000409-00030003
CPUID 00000007: 00000002-239CA7EB-994027AC-FC1CC430 [SL 00]
CPUID 00000007: 44C009D7-00000003-00000000-00040430 [SL 01]
CPUID 00000007: 00000000-00000000-00000000-000000BF [SL 02]
CPUID 00000008: 00000000-00000000-00000000-00000000
CPUID 00000009: 00000000-00000000-00000000-00000000
CPUID 0000000A: 0D300806-00000280-00000007-00008603
CPUID 0000000B: 00000001-00000001-00000100-00000018 [SL 00]
CPUID 0000000B: 00000007-00000008-00000201-00000018 [SL 01]
CPUID 0000000C: 00000000-00000000-00000000-00000000
CPUID 0000000D: 00000207-00000340-00000A88-00000000 [SL 00] [x87]
CPUID 0000000D: 0000000F-000003D0-0001D900-00000000 [SL 01] [SSE]
CPUID 0000000D: 00000100-00000240-00000000-00000000 [SL 02] [AVX]
CPUID 0000000D: 00000080-00000000-00000001-00000000 [SL 08] [PT]
CPUID 0000000D: 00000008-00000A80-00000000-00000000 [SL 09] [PKRU]
CPUID 0000000D: 00000010-00000000-00000001-00000000 [SL 0B] [CET_U]
CPUID 0000000D: 00000018-00000000-00000001-00000000 [SL 0C] [CET_S]
CPUID 0000000D: 00000030-00000000-00000001-00000000 [SL 0E] [UINTR]
CPUID 0000000D: 00000328-00000000-00000001-00000000 [SL 0F] [LBR]
CPUID 0000000D: 00000008-00000000-00000001-00000000 [SL 10] [HWP]
CPUID 0000000E: 00000000-00000000-00000000-00000000
CPUID 0000000F: 00000000-00000000-00000000-00000000 [SL 00]
CPUID 0000000F: 00000000-00000000-00000000-00000000 [SL 01]
CPUID 00000010: 00000000-00000040-00000000-00000000 [SL 00]
CPUID 00000010: 00000000-00000000-00000000-00000000 [SL 01]
CPUID 00000011: 00000000-00000000-00000000-00000000
CPUID 00000012: 00000000-00000000-00000000-00000000 [SL 00]
CPUID 00000012: 00000000-00000000-00000000-00000000 [SL 01]
CPUID 00000013: 00000000-00000000-00000000-00000000
CPUID 00000014: 00000001-0000015F-00000007-00000000 [SL 00]
CPUID 00000014: 02490002-003F003F-00000000-00000000 [SL 01]
CPUID 00000015: 00000002-000000AC-0249F000-00000000 [86.00x / 38400000 / 3302.40]
CPUID 00000016: 00000CE4-000013EC-00000064-00000000 [3300 / 5100 / 100]
CPUID 00000017: 00000000-00000000-00000000-00000000 [SL 00]
CPUID 00000018: 00000008-00000000-00000000-00000000 [SL 00]
CPUID 00000018: 00000000-00080001-00000020-00004022 [SL 01]
CPUID 00000018: 00000000-00080006-00000004-00004022 [SL 02]
CPUID 00000018: 00000000-0010000F-00000001-00004125 [SL 03]
CPUID 00000018: 00000000-00080001-00000010-00004024 [SL 04]
CPUID 00000018: 00000000-00040006-00000008-00004024 [SL 05]
CPUID 00000018: 00000000-00080008-00000001-00004124 [SL 06]
CPUID 00000018: 00000000-00080007-00000080-00004043 [SL 07]
CPUID 00000018: 00000000-00080009-00000080-00004043 [SL 08]
CPUID 00000019: 00000000-00000000-00000000-00000000
CPUID 0000001A: 40000003-00000000-00000000-00000000 [Core: Lion Cove]
CPUID 0000001B: 00000001-00000001-00000002-00000000 [SL 00]
CPUID 0000001C: 4000000B-00000007-000F0007-00000000
CPUID 0000001D: 00000000-00000000-00000000-00000000 [SL 00]
CPUID 0000001E: 00000000-00000000-00000000-00000000 [SL 00]
CPUID 0000001F: 00000001-00000001-00000100-00000018 [SL 00]
CPUID 0000001F: 00000003-00000001-00000201-00000018 [SL 01]
CPUID 0000001F: 00000007-00000008-00000302-00000018 [SL 02]
CPUID 00000020: 00000000-00000001-00000000-00000000 [SL 00]
CPUID 00000021: 00000000-00000000-00000000-00000000
CPUID 00000022: 00000000-00000000-00000000-00000000
CPUID 00000023: 0000000B-00000003-00000000-00000000 [SL 00]
CPUID 00000023: 000003FF-0000000F-00000000-00000000 [SL 01]
CPUID 00000023: 00000000-00000000-00000000-00000000 [SL 02]
CPUID 00000023: 00001DFF-00000000-00000000-00000000 [SL 03]
CPUID 00000023: 00000000-00000000-00000000-00000000 [SL 04]
CPUID 00000023: 00000000-00000000-00000000-00000000 [SL 05]
CPUID 00000023: 00000000-00000000-00000000-00000000 [SL 06]
CPUID 00000023: 00000000-00000000-00000000-00000000 [SL 07]
CPUID 00000023: 00000000-00000000-00000000-00000000 [SL 08]
CPUID 00000023: 00000000-00000000-00000000-00000000 [SL 09]
CPUID 00000023: 00000000-00000000-00000000-00000000 [SL 0A]
CPUID 00000023: 00000000-00000000-00000000-00000000 [SL 0B]
CPUID 80000000: 80000008-00000000-00000000-00000000
CPUID 80000001: 00000000-00000000-00000121-2C100000
CPUID 80000002: 65746E49-2952286C-726F4320-4D542865 [Intel(R) Core(TM]
CPUID 80000003: 6C552029-20617274-38322039-00005638 [) Ultra 9 288V]
CPUID 80000004: 00000000-00000000-00000000-00000000 []
CPUID 80000005: 00000000-00000000-00000000-00000000 [L1D: 0 KB / L1I: 0 KB]
CPUID 80000006: 00000000-00000000-0A007040-00000000 [L2: 2560 KB / L3: 0 KB]
CPUID 80000007: 00000000-00000000-00000000-00000100
CPUID 80000008: 0000302A-00000200-00000000-00000000
------[ CPUID Registers / Logical CPU #4 ]------
CPUID 00000000: 00000023-756E6547-6C65746E-49656E69 [GenuineIntel]
CPUID 00000001: 000B06D1-40800800-7FFAFBFF-BFEBFBFF
CPUID 00000002: 00FEFF01-000000F0-00000000-00000000
CPUID 00000003: 00000000-00000000-00000000-00000000
CPUID 00000004: FC000121-01C0003F-0000003F-00000001 [SL 00] [L1D: 32 KB]
CPUID 00000004: FC000122-01C0003F-0000007F-00000001 [SL 01] [L1I: 64 KB]
CPUID 00000004: FC01C143-03C0003F-00000FFF-00000001 [SL 02] [L2U: 4 MB]
CPUID 00000005: 00000040-00000040-00000003-10002020
CPUID 00000006: 00DFCFF7-00000002-00000409-00040003
CPUID 00000007: 00000002-239CA7EB-994027AC-FC1CC430 [SL 00]
CPUID 00000007: 44C009D7-00000003-00000000-00040430 [SL 01]
CPUID 00000007: 00000000-00000000-00000000-000000BF [SL 02]
CPUID 00000008: 00000000-00000000-00000000-00000000
CPUID 00000009: 00000000-00000000-00000000-00000000
CPUID 0000000A: 0D300806-00000280-00000007-00008603
CPUID 0000000B: 00000001-00000001-00000100-00000040 [SL 00]
CPUID 0000000B: 00000007-00000008-00000201-00000040 [SL 01]
CPUID 0000000C: 00000000-00000000-00000000-00000000
CPUID 0000000D: 00000207-00000340-00000A88-00000000 [SL 00] [x87]
CPUID 0000000D: 0000000F-000003D0-0001D900-00000000 [SL 01] [SSE]
CPUID 0000000D: 00000100-00000240-00000000-00000000 [SL 02] [AVX]
CPUID 0000000D: 00000080-00000000-00000001-00000000 [SL 08] [PT]
CPUID 0000000D: 00000008-00000A80-00000000-00000000 [SL 09] [PKRU]
CPUID 0000000D: 00000010-00000000-00000001-00000000 [SL 0B] [CET_U]
CPUID 0000000D: 00000018-00000000-00000001-00000000 [SL 0C] [CET_S]
CPUID 0000000D: 00000030-00000000-00000001-00000000 [SL 0E] [UINTR]
CPUID 0000000D: 00000328-00000000-00000001-00000000 [SL 0F] [LBR]
CPUID 0000000D: 00000008-00000000-00000001-00000000 [SL 10] [HWP]
CPUID 0000000E: 00000000-00000000-00000000-00000000
CPUID 0000000F: 00000000-00000000-00000000-00000000 [SL 00]
CPUID 0000000F: 00000000-00000000-00000000-00000000 [SL 01]
CPUID 00000010: 00000000-00000040-00000000-00000000 [SL 00]
CPUID 00000010: 00000000-00000000-00000000-00000000 [SL 01]
CPUID 00000011: 00000000-00000000-00000000-00000000
CPUID 00000012: 00000000-00000000-00000000-00000000 [SL 00]
CPUID 00000012: 00000000-00000000-00000000-00000000 [SL 01]
CPUID 00000013: 00000000-00000000-00000000-00000000
CPUID 00000014: 00000001-0000015F-80000007-00000000 [SL 00]
CPUID 00000014: 02490002-003F003F-00000000-00000000 [SL 01]
CPUID 00000015: 00000002-000000AC-0249F000-00000000 [86.00x / 38400000 / 3302.40]
CPUID 00000016: 00000CE4-00000E74-00000064-00000000 [3300 / 3700 / 100]
CPUID 00000017: 00000000-00000000-00000000-00000000 [SL 00]
CPUID 00000018: 00000004-00000000-00000000-00000000 [SL 00]
CPUID 00000018: 00000000-00300003-00000001-00000121 [SL 01]
CPUID 00000018: 00000000-00040003-00000400-00000043 [SL 02]
CPUID 00000018: 00000000-00800001-00000001-00000122 [SL 03]
CPUID 00000018: 00000000-00080008-00000001-00000143 [SL 04]
CPUID 00000019: 00000000-00000000-00000000-00000000
CPUID 0000001A: 20000003-00000000-00000000-00000000 [Atom: Skymont]
CPUID 0000001B: 00000001-00000001-00000002-00000000 [SL 00]
CPUID 0000001C: C000000B-00000007-000F0007-00000000
CPUID 0000001D: 00000000-00000000-00000000-00000000 [SL 00]
CPUID 0000001E: 00000000-00000000-00000000-00000000 [SL 00]
CPUID 0000001F: 00000001-00000001-00000100-00000040 [SL 00]
CPUID 0000001F: 00000003-00000004-00000201-00000040 [SL 01]
CPUID 0000001F: 00000007-00000008-00000302-00000040 [SL 02]
CPUID 00000020: 00000000-00000001-00000000-00000000 [SL 00]
CPUID 00000021: 00000000-00000000-00000000-00000000
CPUID 00000022: 00000000-00000000-00000000-00000000
CPUID 00000023: 0000000F-00000003-00000008-00000000 [SL 00]
CPUID 00000023: 000000FF-00000077-00000000-00000000 [SL 01]
CPUID 00000023: 000000FC-00000003-000000FC-00000003 [SL 02]
CPUID 00000023: 00001F7F-00000000-00000000-00000000 [SL 03]
CPUID 00000023: 00000000-00000000-00000000-00000000 [SL 04]
CPUID 00000023: 00000000-00000000-00000000-00000000 [SL 05]
CPUID 00000023: 00000000-00000000-00000000-00000000 [SL 06]
CPUID 00000023: 00000000-00000000-00000000-00000000 [SL 07]
CPUID 00000023: 00000000-00000000-00000000-00000000 [SL 08]
CPUID 00000023: 00000000-00000000-00000000-00000000 [SL 09]
CPUID 00000023: 00000000-00000000-00000000-00000000 [SL 0A]
CPUID 00000023: 00000000-00000000-00000000-00000000 [SL 0B]
CPUID 00000023: 00000000-00000000-00000000-00000000 [SL 0C]
CPUID 00000023: 00000000-00000000-00000000-00000000 [SL 0D]
CPUID 00000023: 00000000-00000000-00000000-00000000 [SL 0E]
CPUID 00000023: 00000000-00000000-00000000-00000000 [SL 0F]
CPUID 80000000: 80000008-00000000-00000000-00000000
CPUID 80000001: 00000000-00000000-00000121-2C100000
CPUID 80000002: 65746E49-2952286C-726F4320-4D542865 [Intel(R) Core(TM]
CPUID 80000003: 6C552029-20617274-38322039-00005638 [) Ultra 9 288V]
CPUID 80000004: 00000000-00000000-00000000-00000000 []
CPUID 80000005: 00000000-00000000-00000000-00000000 [L1D: 0 KB / L1I: 0 KB]
CPUID 80000006: 00000000-00000000-10008040-00000000 [L2: 4096 KB / L3: 0 KB]
CPUID 80000007: 00000000-00000000-00000000-00000100
CPUID 80000008: 0000302A-00000200-00000000-00000000
------[ CPUID Registers / Logical CPU #5 ]------
CPUID 00000000: 00000023-756E6547-6C65746E-49656E69 [GenuineIntel]
CPUID 00000001: 000B06D1-42800800-7FFAFBFF-BFEBFBFF
CPUID 00000002: 00FEFF01-000000F0-00000000-00000000
CPUID 00000003: 00000000-00000000-00000000-00000000
CPUID 00000004: FC000121-01C0003F-0000003F-00000001 [SL 00] [L1D: 32 KB]
CPUID 00000004: FC000122-01C0003F-0000007F-00000001 [SL 01] [L1I: 64 KB]
CPUID 00000004: FC01C143-03C0003F-00000FFF-00000001 [SL 02] [L2U: 4 MB]
CPUID 00000005: 00000040-00000040-00000003-10002020
CPUID 00000006: 00DFCFF7-00000002-00000409-00050003
CPUID 00000007: 00000002-239CA7EB-994027AC-FC1CC430 [SL 00]
CPUID 00000007: 44C009D7-00000003-00000000-00040430 [SL 01]
CPUID 00000007: 00000000-00000000-00000000-000000BF [SL 02]
CPUID 00000008: 00000000-00000000-00000000-00000000
CPUID 00000009: 00000000-00000000-00000000-00000000
CPUID 0000000A: 0D300806-00000280-00000007-00008603
CPUID 0000000B: 00000001-00000001-00000100-00000042 [SL 00]
CPUID 0000000B: 00000007-00000008-00000201-00000042 [SL 01]
CPUID 0000000C: 00000000-00000000-00000000-00000000
CPUID 0000000D: 00000207-00000340-00000A88-00000000 [SL 00] [x87]
CPUID 0000000D: 0000000F-000003D0-0001D900-00000000 [SL 01] [SSE]
CPUID 0000000D: 00000100-00000240-00000000-00000000 [SL 02] [AVX]
CPUID 0000000D: 00000080-00000000-00000001-00000000 [SL 08] [PT]
CPUID 0000000D: 00000008-00000A80-00000000-00000000 [SL 09] [PKRU]
CPUID 0000000D: 00000010-00000000-00000001-00000000 [SL 0B] [CET_U]
CPUID 0000000D: 00000018-00000000-00000001-00000000 [SL 0C] [CET_S]
CPUID 0000000D: 00000030-00000000-00000001-00000000 [SL 0E] [UINTR]
CPUID 0000000D: 00000328-00000000-00000001-00000000 [SL 0F] [LBR]
CPUID 0000000D: 00000008-00000000-00000001-00000000 [SL 10] [HWP]
CPUID 0000000E: 00000000-00000000-00000000-00000000
CPUID 0000000F: 00000000-00000000-00000000-00000000 [SL 00]
CPUID 0000000F: 00000000-00000000-00000000-00000000 [SL 01]
CPUID 00000010: 00000000-00000040-00000000-00000000 [SL 00]
CPUID 00000010: 00000000-00000000-00000000-00000000 [SL 01]
CPUID 00000011: 00000000-00000000-00000000-00000000
CPUID 00000012: 00000000-00000000-00000000-00000000 [SL 00]
CPUID 00000012: 00000000-00000000-00000000-00000000 [SL 01]
CPUID 00000013: 00000000-00000000-00000000-00000000
CPUID 00000014: 00000001-0000015F-80000007-00000000 [SL 00]
CPUID 00000014: 02490002-003F003F-00000000-00000000 [SL 01]
CPUID 00000015: 00000002-000000AC-0249F000-00000000 [86.00x / 38400000 / 3302.40]
CPUID 00000016: 00000CE4-00000E74-00000064-00000000 [3300 / 3700 / 100]
CPUID 00000017: 00000000-00000000-00000000-00000000 [SL 00]
CPUID 00000018: 00000004-00000000-00000000-00000000 [SL 00]
CPUID 00000018: 00000000-00300003-00000001-00000121 [SL 01]
CPUID 00000018: 00000000-00040003-00000400-00000043 [SL 02]
CPUID 00000018: 00000000-00800001-00000001-00000122 [SL 03]
CPUID 00000018: 00000000-00080008-00000001-00000143 [SL 04]
CPUID 00000019: 00000000-00000000-00000000-00000000
CPUID 0000001A: 20000003-00000000-00000000-00000000 [Atom: Skymont]
CPUID 0000001B: 00000001-00000001-00000002-00000000 [SL 00]
CPUID 0000001C: C000000B-00000007-000F0007-00000000
CPUID 0000001D: 00000000-00000000-00000000-00000000 [SL 00]
CPUID 0000001E: 00000000-00000000-00000000-00000000 [SL 00]
CPUID 0000001F: 00000001-00000001-00000100-00000042 [SL 00]
CPUID 0000001F: 00000003-00000004-00000201-00000042 [SL 01]
CPUID 0000001F: 00000007-00000008-00000302-00000042 [SL 02]
CPUID 00000020: 00000000-00000001-00000000-00000000 [SL 00]
CPUID 00000021: 00000000-00000000-00000000-00000000
CPUID 00000022: 00000000-00000000-00000000-00000000
CPUID 00000023: 0000000F-00000003-00000008-00000000 [SL 00]
CPUID 00000023: 000000FF-00000077-00000000-00000000 [SL 01]
CPUID 00000023: 000000FC-00000003-000000FC-00000003 [SL 02]
CPUID 00000023: 00001F7F-00000000-00000000-00000000 [SL 03]
CPUID 00000023: 00000000-00000000-00000000-00000000 [SL 04]
CPUID 00000023: 00000000-00000000-00000000-00000000 [SL 05]
CPUID 00000023: 00000000-00000000-00000000-00000000 [SL 06]
CPUID 00000023: 00000000-00000000-00000000-00000000 [SL 07]
CPUID 00000023: 00000000-00000000-00000000-00000000 [SL 08]
CPUID 00000023: 00000000-00000000-00000000-00000000 [SL 09]
CPUID 00000023: 00000000-00000000-00000000-00000000 [SL 0A]
CPUID 00000023: 00000000-00000000-00000000-00000000 [SL 0B]
CPUID 00000023: 00000000-00000000-00000000-00000000 [SL 0C]
CPUID 00000023: 00000000-00000000-00000000-00000000 [SL 0D]
CPUID 00000023: 00000000-00000000-00000000-00000000 [SL 0E]
CPUID 00000023: 00000000-00000000-00000000-00000000 [SL 0F]
CPUID 80000000: 80000008-00000000-00000000-00000000
CPUID 80000001: 00000000-00000000-00000121-2C100000
CPUID 80000002: 65746E49-2952286C-726F4320-4D542865 [Intel(R) Core(TM]
CPUID 80000003: 6C552029-20617274-38322039-00005638 [) Ultra 9 288V]
CPUID 80000004: 00000000-00000000-00000000-00000000 []
CPUID 80000005: 00000000-00000000-00000000-00000000 [L1D: 0 KB / L1I: 0 KB]
CPUID 80000006: 00000000-00000000-10008040-00000000 [L2: 4096 KB / L3: 0 KB]
CPUID 80000007: 00000000-00000000-00000000-00000100
CPUID 80000008: 0000302A-00000200-00000000-00000000
------[ CPUID Registers / Logical CPU #6 ]------
CPUID 00000000: 00000023-756E6547-6C65746E-49656E69 [GenuineIntel]
CPUID 00000001: 000B06D1-44800800-7FFAFBFF-BFEBFBFF
CPUID 00000002: 00FEFF01-000000F0-00000000-00000000
CPUID 00000003: 00000000-00000000-00000000-00000000
CPUID 00000004: FC000121-01C0003F-0000003F-00000001 [SL 00] [L1D: 32 KB]
CPUID 00000004: FC000122-01C0003F-0000007F-00000001 [SL 01] [L1I: 64 KB]
CPUID 00000004: FC01C143-03C0003F-00000FFF-00000001 [SL 02] [L2U: 4 MB]
CPUID 00000005: 00000040-00000040-00000003-10002020
CPUID 00000006: 00DFCFF7-00000002-00000409-00060003
CPUID 00000007: 00000002-239CA7EB-994027AC-FC1CC430 [SL 00]
CPUID 00000007: 44C009D7-00000003-00000000-00040430 [SL 01]
CPUID 00000007: 00000000-00000000-00000000-000000BF [SL 02]
CPUID 00000008: 00000000-00000000-00000000-00000000
CPUID 00000009: 00000000-00000000-00000000-00000000
CPUID 0000000A: 0D300806-00000280-00000007-00008603
CPUID 0000000B: 00000001-00000001-00000100-00000044 [SL 00]
CPUID 0000000B: 00000007-00000008-00000201-00000044 [SL 01]
CPUID 0000000C: 00000000-00000000-00000000-00000000
CPUID 0000000D: 00000207-00000340-00000A88-00000000 [SL 00] [x87]
CPUID 0000000D: 0000000F-000003D0-0001D900-00000000 [SL 01] [SSE]
CPUID 0000000D: 00000100-00000240-00000000-00000000 [SL 02] [AVX]
CPUID 0000000D: 00000080-00000000-00000001-00000000 [SL 08] [PT]
CPUID 0000000D: 00000008-00000A80-00000000-00000000 [SL 09] [PKRU]
CPUID 0000000D: 00000010-00000000-00000001-00000000 [SL 0B] [CET_U]
CPUID 0000000D: 00000018-00000000-00000001-00000000 [SL 0C] [CET_S]
CPUID 0000000D: 00000030-00000000-00000001-00000000 [SL 0E] [UINTR]
CPUID 0000000D: 00000328-00000000-00000001-00000000 [SL 0F] [LBR]
CPUID 0000000D: 00000008-00000000-00000001-00000000 [SL 10] [HWP]
CPUID 0000000E: 00000000-00000000-00000000-00000000
CPUID 0000000F: 00000000-00000000-00000000-00000000 [SL 00]
CPUID 0000000F: 00000000-00000000-00000000-00000000 [SL 01]
CPUID 00000010: 00000000-00000040-00000000-00000000 [SL 00]
CPUID 00000010: 00000000-00000000-00000000-00000000 [SL 01]
CPUID 00000011: 00000000-00000000-00000000-00000000
CPUID 00000012: 00000000-00000000-00000000-00000000 [SL 00]
CPUID 00000012: 00000000-00000000-00000000-00000000 [SL 01]
CPUID 00000013: 00000000-00000000-00000000-00000000
CPUID 00000014: 00000001-0000015F-80000007-00000000 [SL 00]
CPUID 00000014: 02490002-003F003F-00000000-00000000 [SL 01]
CPUID 00000015: 00000002-000000AC-0249F000-00000000 [86.00x / 38400000 / 3302.40]
CPUID 00000016: 00000CE4-00000E74-00000064-00000000 [3300 / 3700 / 100]
CPUID 00000017: 00000000-00000000-00000000-00000000 [SL 00]
CPUID 00000018: 00000004-00000000-00000000-00000000 [SL 00]
CPUID 00000018: 00000000-00300003-00000001-00000121 [SL 01]
CPUID 00000018: 00000000-00040003-00000400-00000043 [SL 02]
CPUID 00000018: 00000000-00800001-00000001-00000122 [SL 03]
CPUID 00000018: 00000000-00080008-00000001-00000143 [SL 04]
CPUID 00000019: 00000000-00000000-00000000-00000000
CPUID 0000001A: 20000003-00000000-00000000-00000000 [Atom: Skymont]
CPUID 0000001B: 00000001-00000001-00000002-00000000 [SL 00]
CPUID 0000001C: C000000B-00000007-000F0007-00000000
CPUID 0000001D: 00000000-00000000-00000000-00000000 [SL 00]
CPUID 0000001E: 00000000-00000000-00000000-00000000 [SL 00]
CPUID 0000001F: 00000001-00000001-00000100-00000044 [SL 00]
CPUID 0000001F: 00000003-00000004-00000201-00000044 [SL 01]
CPUID 0000001F: 00000007-00000008-00000302-00000044 [SL 02]
CPUID 00000020: 00000000-00000001-00000000-00000000 [SL 00]
CPUID 00000021: 00000000-00000000-00000000-00000000
CPUID 00000022: 00000000-00000000-00000000-00000000
CPUID 00000023: 0000000F-00000003-00000008-00000000 [SL 00]
CPUID 00000023: 000000FF-00000077-00000000-00000000 [SL 01]
CPUID 00000023: 000000FC-00000003-000000FC-00000003 [SL 02]
CPUID 00000023: 00001F7F-00000000-00000000-00000000 [SL 03]
CPUID 00000023: 00000000-00000000-00000000-00000000 [SL 04]
CPUID 00000023: 00000000-00000000-00000000-00000000 [SL 05]
CPUID 00000023: 00000000-00000000-00000000-00000000 [SL 06]
CPUID 00000023: 00000000-00000000-00000000-00000000 [SL 07]
CPUID 00000023: 00000000-00000000-00000000-00000000 [SL 08]
CPUID 00000023: 00000000-00000000-00000000-00000000 [SL 09]
CPUID 00000023: 00000000-00000000-00000000-00000000 [SL 0A]
CPUID 00000023: 00000000-00000000-00000000-00000000 [SL 0B]
CPUID 00000023: 00000000-00000000-00000000-00000000 [SL 0C]
CPUID 00000023: 00000000-00000000-00000000-00000000 [SL 0D]
CPUID 00000023: 00000000-00000000-00000000-00000000 [SL 0E]
CPUID 00000023: 00000000-00000000-00000000-00000000 [SL 0F]
CPUID 80000000: 80000008-00000000-00000000-00000000
CPUID 80000001: 00000000-00000000-00000121-2C100000
CPUID 80000002: 65746E49-2952286C-726F4320-4D542865 [Intel(R) Core(TM]
CPUID 80000003: 6C552029-20617274-38322039-00005638 [) Ultra 9 288V]
CPUID 80000004: 00000000-00000000-00000000-00000000 []
CPUID 80000005: 00000000-00000000-00000000-00000000 [L1D: 0 KB / L1I: 0 KB]
CPUID 80000006: 00000000-00000000-10008040-00000000 [L2: 4096 KB / L3: 0 KB]
CPUID 80000007: 00000000-00000000-00000000-00000100
CPUID 80000008: 0000302A-00000200-00000000-00000000
------[ CPUID Registers / Logical CPU #7 ]------
CPUID 00000000: 00000023-756E6547-6C65746E-49656E69 [GenuineIntel]
CPUID 00000001: 000B06D1-46800800-7FFAFBFF-BFEBFBFF
CPUID 00000002: 00FEFF01-000000F0-00000000-00000000
CPUID 00000003: 00000000-00000000-00000000-00000000
CPUID 00000004: FC000121-01C0003F-0000003F-00000001 [SL 00] [L1D: 32 KB]
CPUID 00000004: FC000122-01C0003F-0000007F-00000001 [SL 01] [L1I: 64 KB]
CPUID 00000004: FC01C143-03C0003F-00000FFF-00000001 [SL 02] [L2U: 4 MB]
CPUID 00000005: 00000040-00000040-00000003-10002020
CPUID 00000006: 00DFCFF7-00000002-00000409-00070003
CPUID 00000007: 00000002-239CA7EB-994027AC-FC1CC430 [SL 00]
CPUID 00000007: 44C009D7-00000003-00000000-00040430 [SL 01]
CPUID 00000007: 00000000-00000000-00000000-000000BF [SL 02]
CPUID 00000008: 00000000-00000000-00000000-00000000
CPUID 00000009: 00000000-00000000-00000000-00000000
CPUID 0000000A: 0D300806-00000280-00000007-00008603
CPUID 0000000B: 00000001-00000001-00000100-00000046 [SL 00]
CPUID 0000000B: 00000007-00000008-00000201-00000046 [SL 01]
CPUID 0000000C: 00000000-00000000-00000000-00000000
CPUID 0000000D: 00000207-00000340-00000A88-00000000 [SL 00] [x87]
CPUID 0000000D: 0000000F-000003D0-0001D900-00000000 [SL 01] [SSE]
CPUID 0000000D: 00000100-00000240-00000000-00000000 [SL 02] [AVX]
CPUID 0000000D: 00000080-00000000-00000001-00000000 [SL 08] [PT]
CPUID 0000000D: 00000008-00000A80-00000000-00000000 [SL 09] [PKRU]
CPUID 0000000D: 00000010-00000000-00000001-00000000 [SL 0B] [CET_U]
CPUID 0000000D: 00000018-00000000-00000001-00000000 [SL 0C] [CET_S]
CPUID 0000000D: 00000030-00000000-00000001-00000000 [SL 0E] [UINTR]
CPUID 0000000D: 00000328-00000000-00000001-00000000 [SL 0F] [LBR]
CPUID 0000000D: 00000008-00000000-00000001-00000000 [SL 10] [HWP]
CPUID 0000000E: 00000000-00000000-00000000-00000000
CPUID 0000000F: 00000000-00000000-00000000-00000000 [SL 00]
CPUID 0000000F: 00000000-00000000-00000000-00000000 [SL 01]
CPUID 00000010: 00000000-00000040-00000000-00000000 [SL 00]
CPUID 00000010: 00000000-00000000-00000000-00000000 [SL 01]
CPUID 00000011: 00000000-00000000-00000000-00000000
CPUID 00000012: 00000000-00000000-00000000-00000000 [SL 00]
CPUID 00000012: 00000000-00000000-00000000-00000000 [SL 01]
CPUID 00000013: 00000000-00000000-00000000-00000000
CPUID 00000014: 00000001-0000015F-80000007-00000000 [SL 00]
CPUID 00000014: 02490002-003F003F-00000000-00000000 [SL 01]
CPUID 00000015: 00000002-000000AC-0249F000-00000000 [86.00x / 38400000 / 3302.40]
CPUID 00000016: 00000CE4-00000E74-00000064-00000000 [3300 / 3700 / 100]
CPUID 00000017: 00000000-00000000-00000000-00000000 [SL 00]
CPUID 00000018: 00000004-00000000-00000000-00000000 [SL 00]
CPUID 00000018: 00000000-00300003-00000001-00000121 [SL 01]
CPUID 00000018: 00000000-00040003-00000400-00000043 [SL 02]
CPUID 00000018: 00000000-00800001-00000001-00000122 [SL 03]
CPUID 00000018: 00000000-00080008-00000001-00000143 [SL 04]
CPUID 00000019: 00000000-00000000-00000000-00000000
CPUID 0000001A: 20000003-00000000-00000000-00000000 [Atom: Skymont]
CPUID 0000001B: 00000001-00000001-00000002-00000000 [SL 00]
CPUID 0000001C: C000000B-00000007-000F0007-00000000
CPUID 0000001D: 00000000-00000000-00000000-00000000 [SL 00]
CPUID 0000001E: 00000000-00000000-00000000-00000000 [SL 00]
CPUID 0000001F: 00000001-00000001-00000100-00000046 [SL 00]
CPUID 0000001F: 00000003-00000004-00000201-00000046 [SL 01]
CPUID 0000001F: 00000007-00000008-00000302-00000046 [SL 02]
CPUID 00000020: 00000000-00000001-00000000-00000000 [SL 00]
CPUID 00000021: 00000000-00000000-00000000-00000000
CPUID 00000022: 00000000-00000000-00000000-00000000
CPUID 00000023: 0000000F-00000003-00000008-00000000 [SL 00]
CPUID 00000023: 000000FF-00000077-00000000-00000000 [SL 01]
CPUID 00000023: 000000FC-00000003-000000FC-00000003 [SL 02]
CPUID 00000023: 00001F7F-00000000-00000000-00000000 [SL 03]
CPUID 00000023: 00000000-00000000-00000000-00000000 [SL 04]
CPUID 00000023: 00000000-00000000-00000000-00000000 [SL 05]
CPUID 00000023: 00000000-00000000-00000000-00000000 [SL 06]
CPUID 00000023: 00000000-00000000-00000000-00000000 [SL 07]
CPUID 00000023: 00000000-00000000-00000000-00000000 [SL 08]
CPUID 00000023: 00000000-00000000-00000000-00000000 [SL 09]
CPUID 00000023: 00000000-00000000-00000000-00000000 [SL 0A]
CPUID 00000023: 00000000-00000000-00000000-00000000 [SL 0B]
CPUID 00000023: 00000000-00000000-00000000-00000000 [SL 0C]
CPUID 00000023: 00000000-00000000-00000000-00000000 [SL 0D]
CPUID 00000023: 00000000-00000000-00000000-00000000 [SL 0E]
CPUID 00000023: 00000000-00000000-00000000-00000000 [SL 0F]
CPUID 80000000: 80000008-00000000-00000000-00000000
CPUID 80000001: 00000000-00000000-00000121-2C100000
CPUID 80000002: 65746E49-2952286C-726F4320-4D542865 [Intel(R) Core(TM]
CPUID 80000003: 6C552029-20617274-38322039-00005638 [) Ultra 9 288V]
CPUID 80000004: 00000000-00000000-00000000-00000000 []
CPUID 80000005: 00000000-00000000-00000000-00000000 [L1D: 0 KB / L1I: 0 KB]
CPUID 80000006: 00000000-00000000-10008040-00000000 [L2: 4096 KB / L3: 0 KB]
CPUID 80000007: 00000000-00000000-00000000-00000100
CPUID 80000008: 0000302A-00000200-00000000-00000000
--------------------------------------------------------------------------------
x86
x86-64-v3
performance
6
13
1
6
189
4
4
48
64
2560
12288
-1
12
16
10
12
-1
64
64
64
64
-1
4
4
4
1
0
128 (non-authoritative)
Core Ultra 9 (Lunar Lake-V)
fpu vme de pse tsc msr pae mce cx8 apic mtrr sep pge mca cmov pat pse36 clflush dts acpi mmx fxsr sse sse2 ss ht tm pbe pni pclmul dts64 monitor ds_cpl vmx smx est tm2 ssse3 cx16 xtpr pdcm sse4_1 sse4_2 xd movbe popcnt aes xsave osxsave avx rdtscp lm lahf_lm abm constant_tsc fma3 f16c rdrand x2apic avx2 bmi1 bmi2 sha_ni rdseed adx
--------------------------------------------------------------------------------
x86
x86-64-v3
low-power efficiency
6
13
1
6
189
4
4
32
64
4096
-1
-1
8
8
16
-1
-1
64
64
64
-1
-1
4
4
1
0
0
128 (non-authoritative)
Core Ultra 9 (Lunar Lake-V)
fpu vme de pse tsc msr pae mce cx8 apic mtrr sep pge mca cmov pat pse36 clflush dts acpi mmx fxsr sse sse2 ss ht tm pbe pni pclmul dts64 monitor ds_cpl vmx smx est tm2 ssse3 cx16 xtpr pdcm sse4_1 sse4_2 xd movbe popcnt aes xsave osxsave avx rdtscp lm lahf_lm abm constant_tsc fma3 f16c rdrand x2apic avx2 bmi1 bmi2 sha_ni rdseed adx
