------[ Logical CPU #0 ]------
CPUID 00000000: 00000002-756E6547-6C65746E-49656E69
CPUID 00000001: 000006D8-00000816-00000180-AFE9FBFF
CPUID 00000002: 02B3B001-000000F0-00000000-2C04307D
CPUID 80000000: 80000008-00000000-00000000-00000000
CPUID 80000001: 00000000-00000000-00000000-00100000
CPUID 80000002: 20202020-20202020-65746E49-2952286C
CPUID 80000003: 6E655020-6D756974-20295228-7270204D
CPUID 80000004: 7365636F-20726F73-30362E31-007A4847
CPUID 80000005: 00000000-00000000-00000000-00000000
CPUID 80000006: 00000000-00000000-08006040-00000000
CPUID 80000007: 00000000-00000000-00000000-00000000
CPUID 80000008: 00002020-00000000-00000000-00000000
--------------------------------------------------------------------------------
x86
i686
general
6
13
8
6
13
1
1
32
32
2048
-1
-1
8
8
8
-1
-1
64
64
64
-1
-1
-1
-1
-1
-1
-1
64 (non-authoritative)
Pentium M (Dothan)
90 nm
fpu vme de pse tsc msr pae mce cx8 apic mtrr sep pge mca cmov pat clflush dts acpi mmx fxsr sse sse2 ss tm pbe est tm2 xd
