------[ Logical CPU #0 ]------
CPUID 00000000: 0000000A-756E6547-6C65746E-49656E69
CPUID 00000001: 000006E8-00010800-0000C109-AFE9FBFF
CPUID 00000002: 02B3B001-000000F0-00000000-2C04307F
CPUID 00000003: 00000000-00000000-00000000-00000000
CPUID 00000004: 00000121-01C0003F-0000003F-00000001
CPUID 00000004: 00000122-01C0003F-0000003F-00000001
CPUID 00000004: 00000143-0040003F-00000FFF-00000001
CPUID 00000005: 00000040-00000040-00000003-00000010
CPUID 00000006: 00000001-00000002-00000001-00000000
CPUID 00000007: 00000000-00000000-00000000-00000000
CPUID 00000008: 00000000-00000000-00000000-00000000
CPUID 00000009: 00000000-00000000-00000000-00000000
CPUID 0000000A: 07280201-00000000-00000000-00000000
CPUID 80000000: 80000008-00000000-00000000-00000000
CPUID 80000001: 00000000-00000000-00000000-00100000
CPUID 80000002: 65746E49-2952286C-6C654320-6E6F7265
CPUID 80000003: 20295228-20555043-20202020-20202020
CPUID 80000004: 35313220-20402020-33332E31-007A4847
CPUID 80000005: 00000000-00000000-00000000-00000000
CPUID 80000006: 00000000-00000000-02002040-00000000
CPUID 80000007: 00000000-00000000-00000000-00000000
CPUID 80000008: 00002020-00000000-00000000-00000000
--------------------------------------------------------------------------------
x86
i686
general
6
14
8
6
14
1
1
-1
-1
-1
-1
-1
-1
-1
-1
-1
-1
-1
-1
-1
-1
-1
-1
-1
-1
-1
-1
64 (non-authoritative)
Celeron (Yonah-512)
65 nm
fpu vme de pse tsc msr pae mce cx8 apic mtrr sep pge mca cmov pat clflush dts acpi mmx fxsr sse sse2 ss tm pbe pni monitor tm2 xtpr pdcm xd
