CPUID Registers (CPU #1):
CPUID 00000000  	00000005-756E6547-6C65746E-49656E69
CPUID 00000001  	00000F34-00020800-0000441D-BFEBFBFF
CPUID 00000002  	605B5001-00000000-00000000-007C7040
CPUID 00000003  	00000000-00000000-00000000-00000000
CPUID 00000004  	00004121-01C0003F-0000001F-00000000
CPUID 00000004  	00004143-01C0103F-000003FF-00000000
CPUID 00000005  	00000040-00000040-00000000-00000000
CPUID 80000000  	80000008-00000000-00000000-00000000
CPUID 80000001  	00000000-00000000-00000000-00000000
CPUID 80000002  	20202020-20202020-20202020-6E492020
CPUID 80000003  	286C6574-50202952-69746E65-52286D75
CPUID 80000004  	20342029-20555043-30302E33-007A4847
CPUID 80000005  	00000000-00000000-00000000-00000000
CPUID 80000006  	00000000-00000000-04006040-00000000
CPUID 80000007  	00000000-00000000-00000000-00000000
CPUID 80000008  	00002024-00000000-00000000-00000000
CPUID Registers (CPU #2 Virtual):
CPUID 00000000  	00000005-756E6547-6C65746E-49656E69
CPUID 00000001  	00000F34-01020800-0000441D-BFEBFBFF
CPUID 00000002  	605B5001-00000000-00000000-007C7040
CPUID 00000003  	00000000-00000000-00000000-00000000
CPUID 00000004  	00004121-01C0003F-0000001F-00000000
CPUID 00000004  	00004143-01C0103F-000003FF-00000000
CPUID 00000005  	00000040-00000040-00000000-00000000
CPUID 80000000  	80000008-00000000-00000000-00000000
CPUID 80000001  	00000000-00000000-00000000-00000000
CPUID 80000002  	20202020-20202020-20202020-6E492020
CPUID 80000003  	286C6574-50202952-69746E65-52286D75
CPUID 80000004  	20342029-20555043-30302E33-007A4847
CPUID 80000005  	00000000-00000000-00000000-00000000
CPUID 80000006  	00000000-00000000-04006040-00000000
CPUID 80000007  	00000000-00000000-00000000-00000000
CPUID 80000008  	00002024-00000000-00000000-00000000
--------------------------------------------------------------------------------
x86
i686
general
15
3
4
15
3
1
2
-1
-1
-1
-1
-1
-1
-1
-1
-1
-1
-1
-1
-1
-1
-1
-1
-1
-1
-1
-1
64 (non-authoritative)
Pentium 4 (Prescott)
90 nm
fpu vme de pse tsc msr pae mce cx8 apic mtrr sep pge mca cmov pat pse36 clflush dts acpi mmx fxsr sse sse2 ss ht tm pbe pni dts64 monitor ds_cpl cid xtpr
