------[ Logical CPU #0 ]------
CPUID 00000000: 00000002-756E6547-6C65746E-49656E69
CPUID 00000001: 00000F29-00020809-00004400-BFEBFBFF
CPUID 00000002: 665B5001-00000000-00000000-007B7040
CPUID 80000000: 80000004-00000000-00000000-00000000
CPUID 80000001: 00000000-00000000-00000000-00000000
CPUID 80000002: 20202020-20202020-20202020-6E492020
CPUID 80000003: 286C6574-50202952-69746E65-52286D75
CPUID 80000004: 20342029-20555043-30382E32-007A4847
------[ Logical CPU #1 ]------
CPUID 00000000: 00000002-756E6547-6C65746E-49656E69
CPUID 00000001: 00000F29-01020809-00004400-BFEBFBFF
CPUID 00000002: 665B5001-00000000-00000000-007B7040
CPUID 80000000: 80000004-00000000-00000000-00000000
CPUID 80000001: 00000000-00000000-00000000-00000000
CPUID 80000002: 20202020-20202020-20202020-6E492020
CPUID 80000003: 286C6574-50202952-69746E65-52286D75
CPUID 80000004: 20342029-20555043-30382E32-007A4847
--------------------------------------------------------------------------------
x86
i686
general
15
2
9
15
2
1
2
8
12
512
0
-1
4
8
8
-1
-1
64
-1
64
-1
-1
-1
-1
-1
-1
-1
64 (non-authoritative)
Pentium 4 (Northwood)
0.13 µm
fpu vme de pse tsc msr pae mce cx8 apic mtrr sep pge mca cmov pat pse36 clflush dts acpi mmx fxsr sse sse2 ss ht tm pbe cid xtpr
