------[ CPUID Registers / Logical CPU #0 ]------
CPUID 00000000: 0000001B-756E6547-6C65746E-49656E69 [GenuineIntel]
CPUID 00000001: 000806C1-00100800-7FFAFBBF-BFEBFBFF
CPUID 00000002: 00FEFF01-000000F0-00000000-00000000
CPUID 00000003: 00000000-00000000-00000000-00000000
CPUID 00000004: 1C004121-02C0003F-0000003F-00000000 [SL 00] [L1D: 48 KB]
CPUID 00000004: 1C004122-01C0003F-0000003F-00000000 [SL 01] [L1I: 32 KB]
CPUID 00000004: 1C004143-04C0003F-000003FF-00000000 [SL 02] [L2U: 1280 KB]
CPUID 00000004: 1C03C163-01C0003F-00001FFF-00000004 [SL 03] [L3U: 4 MB]
CPUID 00000005: 00000040-00000040-00000003-11121020
CPUID 00000006: 0017EFF7-00000002-00000009-00000000
CPUID 00000007: 00000000-F3BFA7EB-18C05FCE-FC100510 [SL 00]
CPUID 00000008: 00000000-00000000-00000000-00000000
CPUID 00000009: 00000000-00000000-00000000-00000000
CPUID 0000000A: 08300805-00000000-0000000F-00008604
CPUID 0000000B: 00000001-00000002-00000100-00000000 [SL 00]
CPUID 0000000B: 00000004-00000004-00000201-00000000 [SL 01]
CPUID 0000000C: 00000000-00000000-00000000-00000000
CPUID 0000000D: 000002E7-00000A80-00000A88-00000000 [SL 00] [x87]
CPUID 0000000D: 0000000F-00000A10-00003900-00000000 [SL 01] [SSE]
CPUID 0000000D: 00000100-00000240-00000000-00000000 [SL 02] [AVX]
CPUID 0000000D: 00000040-00000440-00000000-00000000 [SL 05] [AVX-512 Opmask]
CPUID 0000000D: 00000200-00000480-00000000-00000000 [SL 06] [AVX-512 Hi256]
CPUID 0000000D: 00000400-00000680-00000000-00000000 [SL 07] [AVX-512 Hi16]
CPUID 0000000D: 00000080-00000000-00000001-00000000 [SL 08] [PT]
CPUID 0000000D: 00000008-00000A80-00000000-00000000 [SL 09] [PKRU]
CPUID 0000000D: 00000010-00000000-00000001-00000000 [SL 0B]
CPUID 0000000D: 00000018-00000000-00000001-00000000 [SL 0C]
CPUID 0000000D: 00000008-00000000-00000001-00000000 [SL 0D]
CPUID 0000000E: 00000000-00000000-00000000-00000000
CPUID 0000000F: 00000000-00000000-00000000-00000000 [SL 00]
CPUID 0000000F: 00000000-00000000-00000000-00000000 [SL 01]
CPUID 00000010: 00000000-00000004-00000000-00000000 [SL 00]
CPUID 00000010: 00000000-00000000-00000000-00000000 [SL 01]
CPUID 00000011: 00000000-00000000-00000000-00000000
CPUID 00000012: 00000000-00000000-00000000-00000000 [SL 00]
CPUID 00000012: 00000000-00000000-00000000-00000000 [SL 01]
CPUID 00000013: 00000000-00000000-00000000-00000000
CPUID 00000014: 00000001-0000004F-00000007-00000000 [SL 00]
CPUID 00000014: 02490002-003F1FFF-00000000-00000000 [SL 01]
CPUID 00000015: 00000002-00000068-0249F000-00000000 [52.00x / 38400000]
CPUID 00000016: 000007D0-00000DAC-00000064-00000000 [2000 / 3500 / 100]
CPUID 00000017: 00000000-00000000-00000000-00000000 [SL 00]
CPUID 00000018: 00000008-00000000-00000000-00000000 [SL 00]
CPUID 00000018: 00000000-00080001-00000010-00004022 [SL 01]
CPUID 00000018: 00000000-00080006-00000002-00004022 [SL 02]
CPUID 00000018: 00000000-0010000F-00000001-00004125 [SL 03]
CPUID 00000018: 00000000-00040001-00000010-00004024 [SL 04]
CPUID 00000018: 00000000-00040006-00000008-00004024 [SL 05]
CPUID 00000018: 00000000-00080008-00000001-00004124 [SL 06]
CPUID 00000018: 00000000-00080007-00000080-00004043 [SL 07]
CPUID 00000018: 00000000-00080009-00000080-00004043 [SL 08]
CPUID 00000019: 00000007-00000014-00000003-00000000
CPUID 0000001A: 00000000-00000000-00000000-00000000
CPUID 0000001B: 00000000-00000000-00000000-00000000
CPUID 80000000: 80000008-00000000-00000000-00000000
CPUID 80000001: 00000000-00000000-00000121-2C100000
CPUID 80000002: 65746E49-2952286C-6E655020-6D756974 [Intel(R) Pentium]
CPUID 80000003: 20295228-646C6F47-30353720-20402035 [(R) Gold 7505 @ ]
CPUID 80000004: 30302E32-007A4847-00000000-00000000 [2.00GHz]
CPUID 80000005: 00000000-00000000-00000000-00000000 [L1D: 0 KB / L1I: 0 KB]
CPUID 80000006: 00000000-00000000-01007040-00000000 [L2: 256 KB] / L3: 0 KB]
CPUID 80000007: 00000000-00000000-00000000-00000100
CPUID 80000008: 00003027-00000000-00000000-00000000
------[ CPUID Registers / Logical CPU #1 ]------
CPUID 00000000: 0000001B-756E6547-6C65746E-49656E69 [GenuineIntel]
CPUID 00000001: 000806C1-01100800-7FFAFBBF-BFEBFBFF
CPUID 00000002: 00FEFF01-000000F0-00000000-00000000
CPUID 00000003: 00000000-00000000-00000000-00000000
CPUID 00000004: 1C004121-02C0003F-0000003F-00000000 [SL 00] [L1D: 48 KB]
CPUID 00000004: 1C004122-01C0003F-0000003F-00000000 [SL 01] [L1I: 32 KB]
CPUID 00000004: 1C004143-04C0003F-000003FF-00000000 [SL 02] [L2U: 1280 KB]
CPUID 00000004: 1C03C163-01C0003F-00001FFF-00000004 [SL 03] [L3U: 4 MB]
CPUID 00000005: 00000040-00000040-00000003-11121020
CPUID 00000006: 0017EFF7-00000002-00000009-00000000
CPUID 00000007: 00000000-F3BFA7EB-18C05FCE-FC100510 [SL 00]
CPUID 00000008: 00000000-00000000-00000000-00000000
CPUID 00000009: 00000000-00000000-00000000-00000000
CPUID 0000000A: 08300805-00000000-0000000F-00008604
CPUID 0000000B: 00000001-00000002-00000100-00000001 [SL 00]
CPUID 0000000B: 00000004-00000004-00000201-00000001 [SL 01]
CPUID 0000000C: 00000000-00000000-00000000-00000000
CPUID 0000000D: 000002E7-00000A80-00000A88-00000000 [SL 00] [x87]
CPUID 0000000D: 0000000F-00000A10-00003900-00000000 [SL 01] [SSE]
CPUID 0000000D: 00000100-00000240-00000000-00000000 [SL 02] [AVX]
CPUID 0000000D: 00000040-00000440-00000000-00000000 [SL 05] [AVX-512 Opmask]
CPUID 0000000D: 00000200-00000480-00000000-00000000 [SL 06] [AVX-512 Hi256]
CPUID 0000000D: 00000400-00000680-00000000-00000000 [SL 07] [AVX-512 Hi16]
CPUID 0000000D: 00000080-00000000-00000001-00000000 [SL 08] [PT]
CPUID 0000000D: 00000008-00000A80-00000000-00000000 [SL 09] [PKRU]
CPUID 0000000D: 00000010-00000000-00000001-00000000 [SL 0B]
CPUID 0000000D: 00000018-00000000-00000001-00000000 [SL 0C]
CPUID 0000000D: 00000008-00000000-00000001-00000000 [SL 0D]
CPUID 0000000E: 00000000-00000000-00000000-00000000
CPUID 0000000F: 00000000-00000000-00000000-00000000 [SL 00]
CPUID 0000000F: 00000000-00000000-00000000-00000000 [SL 01]
CPUID 00000010: 00000000-00000004-00000000-00000000 [SL 00]
CPUID 00000010: 00000000-00000000-00000000-00000000 [SL 01]
CPUID 00000011: 00000000-00000000-00000000-00000000
CPUID 00000012: 00000000-00000000-00000000-00000000 [SL 00]
CPUID 00000012: 00000000-00000000-00000000-00000000 [SL 01]
CPUID 00000013: 00000000-00000000-00000000-00000000
CPUID 00000014: 00000001-0000004F-00000007-00000000 [SL 00]
CPUID 00000014: 02490002-003F1FFF-00000000-00000000 [SL 01]
CPUID 00000015: 00000002-00000068-0249F000-00000000 [52.00x / 38400000]
CPUID 00000016: 000007D0-00000DAC-00000064-00000000 [2000 / 3500 / 100]
CPUID 00000017: 00000000-00000000-00000000-00000000 [SL 00]
CPUID 00000018: 00000008-00000000-00000000-00000000 [SL 00]
CPUID 00000018: 00000000-00080001-00000010-00004022 [SL 01]
CPUID 00000018: 00000000-00080006-00000002-00004022 [SL 02]
CPUID 00000018: 00000000-0010000F-00000001-00004125 [SL 03]
CPUID 00000018: 00000000-00040001-00000010-00004024 [SL 04]
CPUID 00000018: 00000000-00040006-00000008-00004024 [SL 05]
CPUID 00000018: 00000000-00080008-00000001-00004124 [SL 06]
CPUID 00000018: 00000000-00080007-00000080-00004043 [SL 07]
CPUID 00000018: 00000000-00080009-00000080-00004043 [SL 08]
CPUID 00000019: 00000007-00000014-00000003-00000000
CPUID 0000001A: 00000000-00000000-00000000-00000000
CPUID 0000001B: 00000000-00000000-00000000-00000000
CPUID 80000000: 80000008-00000000-00000000-00000000
CPUID 80000001: 00000000-00000000-00000121-2C100000
CPUID 80000002: 65746E49-2952286C-6E655020-6D756974 [Intel(R) Pentium]
CPUID 80000003: 20295228-646C6F47-30353720-20402035 [(R) Gold 7505 @ ]
CPUID 80000004: 30302E32-007A4847-00000000-00000000 [2.00GHz]
CPUID 80000005: 00000000-00000000-00000000-00000000 [L1D: 0 KB / L1I: 0 KB]
CPUID 80000006: 00000000-00000000-01007040-00000000 [L2: 256 KB] / L3: 0 KB]
CPUID 80000007: 00000000-00000000-00000000-00000100
CPUID 80000008: 00003027-00000000-00000000-00000000
------[ CPUID Registers / Logical CPU #2 ]------
CPUID 00000000: 0000001B-756E6547-6C65746E-49656E69 [GenuineIntel]
CPUID 00000001: 000806C1-02100800-7FFAFBBF-BFEBFBFF
CPUID 00000002: 00FEFF01-000000F0-00000000-00000000
CPUID 00000003: 00000000-00000000-00000000-00000000
CPUID 00000004: 1C004121-02C0003F-0000003F-00000000 [SL 00] [L1D: 48 KB]
CPUID 00000004: 1C004122-01C0003F-0000003F-00000000 [SL 01] [L1I: 32 KB]
CPUID 00000004: 1C004143-04C0003F-000003FF-00000000 [SL 02] [L2U: 1280 KB]
CPUID 00000004: 1C03C163-01C0003F-00001FFF-00000004 [SL 03] [L3U: 4 MB]
CPUID 00000005: 00000040-00000040-00000003-11121020
CPUID 00000006: 0017EFF7-00000002-00000009-00000000
CPUID 00000007: 00000000-F3BFA7EB-18C05FCE-FC100510 [SL 00]
CPUID 00000008: 00000000-00000000-00000000-00000000
CPUID 00000009: 00000000-00000000-00000000-00000000
CPUID 0000000A: 08300805-00000000-0000000F-00008604
CPUID 0000000B: 00000001-00000002-00000100-00000002 [SL 00]
CPUID 0000000B: 00000004-00000004-00000201-00000002 [SL 01]
CPUID 0000000C: 00000000-00000000-00000000-00000000
CPUID 0000000D: 000002E7-00000A80-00000A88-00000000 [SL 00] [x87]
CPUID 0000000D: 0000000F-00000A10-00003900-00000000 [SL 01] [SSE]
CPUID 0000000D: 00000100-00000240-00000000-00000000 [SL 02] [AVX]
CPUID 0000000D: 00000040-00000440-00000000-00000000 [SL 05] [AVX-512 Opmask]
CPUID 0000000D: 00000200-00000480-00000000-00000000 [SL 06] [AVX-512 Hi256]
CPUID 0000000D: 00000400-00000680-00000000-00000000 [SL 07] [AVX-512 Hi16]
CPUID 0000000D: 00000080-00000000-00000001-00000000 [SL 08] [PT]
CPUID 0000000D: 00000008-00000A80-00000000-00000000 [SL 09] [PKRU]
CPUID 0000000D: 00000010-00000000-00000001-00000000 [SL 0B]
CPUID 0000000D: 00000018-00000000-00000001-00000000 [SL 0C]
CPUID 0000000D: 00000008-00000000-00000001-00000000 [SL 0D]
CPUID 0000000E: 00000000-00000000-00000000-00000000
CPUID 0000000F: 00000000-00000000-00000000-00000000 [SL 00]
CPUID 0000000F: 00000000-00000000-00000000-00000000 [SL 01]
CPUID 00000010: 00000000-00000004-00000000-00000000 [SL 00]
CPUID 00000010: 00000000-00000000-00000000-00000000 [SL 01]
CPUID 00000011: 00000000-00000000-00000000-00000000
CPUID 00000012: 00000000-00000000-00000000-00000000 [SL 00]
CPUID 00000012: 00000000-00000000-00000000-00000000 [SL 01]
CPUID 00000013: 00000000-00000000-00000000-00000000
CPUID 00000014: 00000001-0000004F-00000007-00000000 [SL 00]
CPUID 00000014: 02490002-003F1FFF-00000000-00000000 [SL 01]
CPUID 00000015: 00000002-00000068-0249F000-00000000 [52.00x / 38400000]
CPUID 00000016: 000007D0-00000DAC-00000064-00000000 [2000 / 3500 / 100]
CPUID 00000017: 00000000-00000000-00000000-00000000 [SL 00]
CPUID 00000018: 00000008-00000000-00000000-00000000 [SL 00]
CPUID 00000018: 00000000-00080001-00000010-00004022 [SL 01]
CPUID 00000018: 00000000-00080006-00000002-00004022 [SL 02]
CPUID 00000018: 00000000-0010000F-00000001-00004125 [SL 03]
CPUID 00000018: 00000000-00040001-00000010-00004024 [SL 04]
CPUID 00000018: 00000000-00040006-00000008-00004024 [SL 05]
CPUID 00000018: 00000000-00080008-00000001-00004124 [SL 06]
CPUID 00000018: 00000000-00080007-00000080-00004043 [SL 07]
CPUID 00000018: 00000000-00080009-00000080-00004043 [SL 08]
CPUID 00000019: 00000007-00000014-00000003-00000000
CPUID 0000001A: 00000000-00000000-00000000-00000000
CPUID 0000001B: 00000000-00000000-00000000-00000000
CPUID 80000000: 80000008-00000000-00000000-00000000
CPUID 80000001: 00000000-00000000-00000121-2C100000
CPUID 80000002: 65746E49-2952286C-6E655020-6D756974 [Intel(R) Pentium]
CPUID 80000003: 20295228-646C6F47-30353720-20402035 [(R) Gold 7505 @ ]
CPUID 80000004: 30302E32-007A4847-00000000-00000000 [2.00GHz]
CPUID 80000005: 00000000-00000000-00000000-00000000 [L1D: 0 KB / L1I: 0 KB]
CPUID 80000006: 00000000-00000000-01007040-00000000 [L2: 256 KB] / L3: 0 KB]
CPUID 80000007: 00000000-00000000-00000000-00000100
CPUID 80000008: 00003027-00000000-00000000-00000000
------[ CPUID Registers / Logical CPU #3 ]------
CPUID 00000000: 0000001B-756E6547-6C65746E-49656E69 [GenuineIntel]
CPUID 00000001: 000806C1-03100800-7FFAFBBF-BFEBFBFF
CPUID 00000002: 00FEFF01-000000F0-00000000-00000000
CPUID 00000003: 00000000-00000000-00000000-00000000
CPUID 00000004: 1C004121-02C0003F-0000003F-00000000 [SL 00] [L1D: 48 KB]
CPUID 00000004: 1C004122-01C0003F-0000003F-00000000 [SL 01] [L1I: 32 KB]
CPUID 00000004: 1C004143-04C0003F-000003FF-00000000 [SL 02] [L2U: 1280 KB]
CPUID 00000004: 1C03C163-01C0003F-00001FFF-00000004 [SL 03] [L3U: 4 MB]
CPUID 00000005: 00000040-00000040-00000003-11121020
CPUID 00000006: 0017EFF7-00000002-00000009-00000000
CPUID 00000007: 00000000-F3BFA7EB-18C05FCE-FC100510 [SL 00]
CPUID 00000008: 00000000-00000000-00000000-00000000
CPUID 00000009: 00000000-00000000-00000000-00000000
CPUID 0000000A: 08300805-00000000-0000000F-00008604
CPUID 0000000B: 00000001-00000002-00000100-00000003 [SL 00]
CPUID 0000000B: 00000004-00000004-00000201-00000003 [SL 01]
CPUID 0000000C: 00000000-00000000-00000000-00000000
CPUID 0000000D: 000002E7-00000A80-00000A88-00000000 [SL 00] [x87]
CPUID 0000000D: 0000000F-00000A10-00003900-00000000 [SL 01] [SSE]
CPUID 0000000D: 00000100-00000240-00000000-00000000 [SL 02] [AVX]
CPUID 0000000D: 00000040-00000440-00000000-00000000 [SL 05] [AVX-512 Opmask]
CPUID 0000000D: 00000200-00000480-00000000-00000000 [SL 06] [AVX-512 Hi256]
CPUID 0000000D: 00000400-00000680-00000000-00000000 [SL 07] [AVX-512 Hi16]
CPUID 0000000D: 00000080-00000000-00000001-00000000 [SL 08] [PT]
CPUID 0000000D: 00000008-00000A80-00000000-00000000 [SL 09] [PKRU]
CPUID 0000000D: 00000010-00000000-00000001-00000000 [SL 0B]
CPUID 0000000D: 00000018-00000000-00000001-00000000 [SL 0C]
CPUID 0000000D: 00000008-00000000-00000001-00000000 [SL 0D]
CPUID 0000000E: 00000000-00000000-00000000-00000000
CPUID 0000000F: 00000000-00000000-00000000-00000000 [SL 00]
CPUID 0000000F: 00000000-00000000-00000000-00000000 [SL 01]
CPUID 00000010: 00000000-00000004-00000000-00000000 [SL 00]
CPUID 00000010: 00000000-00000000-00000000-00000000 [SL 01]
CPUID 00000011: 00000000-00000000-00000000-00000000
CPUID 00000012: 00000000-00000000-00000000-00000000 [SL 00]
CPUID 00000012: 00000000-00000000-00000000-00000000 [SL 01]
CPUID 00000013: 00000000-00000000-00000000-00000000
CPUID 00000014: 00000001-0000004F-00000007-00000000 [SL 00]
CPUID 00000014: 02490002-003F1FFF-00000000-00000000 [SL 01]
CPUID 00000015: 00000002-00000068-0249F000-00000000 [52.00x / 38400000]
CPUID 00000016: 000007D0-00000DAC-00000064-00000000 [2000 / 3500 / 100]
CPUID 00000017: 00000000-00000000-00000000-00000000 [SL 00]
CPUID 00000018: 00000008-00000000-00000000-00000000 [SL 00]
CPUID 00000018: 00000000-00080001-00000010-00004022 [SL 01]
CPUID 00000018: 00000000-00080006-00000002-00004022 [SL 02]
CPUID 00000018: 00000000-0010000F-00000001-00004125 [SL 03]
CPUID 00000018: 00000000-00040001-00000010-00004024 [SL 04]
CPUID 00000018: 00000000-00040006-00000008-00004024 [SL 05]
CPUID 00000018: 00000000-00080008-00000001-00004124 [SL 06]
CPUID 00000018: 00000000-00080007-00000080-00004043 [SL 07]
CPUID 00000018: 00000000-00080009-00000080-00004043 [SL 08]
CPUID 00000019: 00000007-00000014-00000003-00000000
CPUID 0000001A: 00000000-00000000-00000000-00000000
CPUID 0000001B: 00000000-00000000-00000000-00000000
CPUID 80000000: 80000008-00000000-00000000-00000000
CPUID 80000001: 00000000-00000000-00000121-2C100000
CPUID 80000002: 65746E49-2952286C-6E655020-6D756974 [Intel(R) Pentium]
CPUID 80000003: 20295228-646C6F47-30353720-20402035 [(R) Gold 7505 @ ]
CPUID 80000004: 30302E32-007A4847-00000000-00000000 [2.00GHz]
CPUID 80000005: 00000000-00000000-00000000-00000000 [L1D: 0 KB / L1I: 0 KB]
CPUID 80000006: 00000000-00000000-01007040-00000000 [L2: 256 KB] / L3: 0 KB]
CPUID 80000007: 00000000-00000000-00000000-00000100
CPUID 80000008: 00003027-00000000-00000000-00000000
--------------------------------------------------------------------------------
x86
x86-64-v4
general
6
12
1
6
140
2
4
48
32
1280
4096
-1
12
8
20
8
-1
64
64
64
64
-1
2
2
2
1
0
128 (non-authoritative)
Pentium Gold (Tiger Lake-UP3)
10SF
fpu vme de pse tsc msr pae mce cx8 apic mtrr sep pge mca cmov pat pse36 clflush dts acpi mmx fxsr sse sse2 ss ht tm pbe pni pclmul dts64 monitor ds_cpl vmx est tm2 ssse3 cx16 xtpr pdcm sse4_1 sse4_2 xd movbe popcnt aes xsave osxsave avx rdtscp lm lahf_lm abm constant_tsc fma3 f16c rdrand x2apic avx2 bmi1 bmi2 avx512f avx512dq avx512cd sha_ni avx512bw avx512vl rdseed adx avx512vnni avx512vbmi avx512vbmi2
