------[ Logical CPU #0 ]------
CPUID 00000000: 00000015-756E6547-6C65746E-49656E69 [GenuineIntel]
CPUID 00000001: 000506C9-00200800-4FF8EBBF-BFEBFBFF
CPUID 00000002: 6164A001-0000FFC4-00000000-00000000
CPUID 00000003: 00000000-00000000-00000000-00000000
CPUID 00000004: 3C000121-0140003F-0000003F-00000001 [SL 00]
CPUID 00000004: 3C000122-01C0003F-0000003F-00000001 [SL 01]
CPUID 00000004: 3C00C143-03C0003F-000003FF-00000001 [SL 02]
CPUID 00000005: 00000040-00000040-00000003-11242020
CPUID 00000006: 00000057-00000002-00000001-00000000
CPUID 00000007: 00000000-2294E283-00000000-00000000
CPUID 00000008: 00000000-00000000-00000000-00000000
CPUID 00000009: 00000000-00000000-00000000-00000000
CPUID 0000000A: 07300404-00000000-00000000-00000603
CPUID 0000000B: 00000001-00000001-00000100-00000000 [SL 00]
CPUID 0000000B: 00000005-00000004-00000201-00000000 [SL 01]
CPUID 0000000C: 00000000-00000000-00000000-00000000
CPUID 0000000D: 0000001B-00000440-00000440-00000000 [SL 00]
CPUID 0000000D: 0000000F-000002C0-00000100-00000000 [SL 01]
CPUID 0000000E: 00000000-00000000-00000000-00000000
CPUID 0000000F: 00000000-00000000-00000000-00000000 [SL 00]
CPUID 0000000F: 00000000-00000000-00000000-00000000 [SL 01]
CPUID 00000010: 00000000-00000004-00000000-00000000 [SL 00]
CPUID 00000010: 00000000-00000000-00000000-00000000 [SL 01]
CPUID 00000011: 00000000-00000000-00000000-00000000
CPUID 00000012: 00000000-00000000-00000000-00000000 [SL 00]
CPUID 00000012: 00000000-00000000-00000000-00000000 [SL 01]
CPUID 00000013: 00000000-00000000-00000000-00000000
CPUID 00000014: 00000001-0000000F-80000007-00000000 [SL 00]
CPUID 00000014: 02490002-003FFFFF-00000000-00000000 [SL 01]
CPUID 00000015: 00000003-000000EA-0124F800-00000000 [78.00x / 19200000]
CPUID 80000000: 80000008-00000000-00000000-00000000
CPUID 80000001: 00000000-00000000-00000101-2C100000
CPUID 80000002: 65746E49-2952286C-6C654320-6E6F7265 [Intel(R) Celeron]
CPUID 80000003: 20295228-20555043-3534334A-20402035 [(R) CPU J3455 @ ]
CPUID 80000004: 30352E31-007A4847-00000000-00000000 [1.50GHz]
CPUID 80000005: 00000000-00000000-00000000-00000000
CPUID 80000006: 00000000-00000000-04008040-00000000
CPUID 80000007: 00000000-00000000-00000000-00000100
CPUID 80000008: 00003027-00000000-00000000-00000000
------[ Logical CPU #1 ]------
CPUID 00000000: 00000015-756E6547-6C65746E-49656E69 [GenuineIntel]
CPUID 00000001: 000506C9-02200800-4FF8EBBF-BFEBFBFF
CPUID 00000002: 6164A001-0000FFC4-00000000-00000000
CPUID 00000003: 00000000-00000000-00000000-00000000
CPUID 00000004: 3C000121-0140003F-0000003F-00000001 [SL 00]
CPUID 00000004: 3C000122-01C0003F-0000003F-00000001 [SL 01]
CPUID 00000004: 3C00C143-03C0003F-000003FF-00000001 [SL 02]
CPUID 00000005: 00000040-00000040-00000003-11242020
CPUID 00000006: 00000057-00000002-00000001-00000000
CPUID 00000007: 00000000-2294E283-00000000-00000000
CPUID 00000008: 00000000-00000000-00000000-00000000
CPUID 00000009: 00000000-00000000-00000000-00000000
CPUID 0000000A: 07300404-00000000-00000000-00000603
CPUID 0000000B: 00000001-00000001-00000100-00000002 [SL 00]
CPUID 0000000B: 00000005-00000004-00000201-00000002 [SL 01]
CPUID 0000000C: 00000000-00000000-00000000-00000000
CPUID 0000000D: 0000001B-00000440-00000440-00000000 [SL 00]
CPUID 0000000D: 0000000F-000002C0-00000100-00000000 [SL 01]
CPUID 0000000E: 00000000-00000000-00000000-00000000
CPUID 0000000F: 00000000-00000000-00000000-00000000 [SL 00]
CPUID 0000000F: 00000000-00000000-00000000-00000000 [SL 01]
CPUID 00000010: 00000000-00000004-00000000-00000000 [SL 00]
CPUID 00000010: 00000000-00000000-00000000-00000000 [SL 01]
CPUID 00000011: 00000000-00000000-00000000-00000000
CPUID 00000012: 00000000-00000000-00000000-00000000 [SL 00]
CPUID 00000012: 00000000-00000000-00000000-00000000 [SL 01]
CPUID 00000013: 00000000-00000000-00000000-00000000
CPUID 00000014: 00000001-0000000F-80000007-00000000 [SL 00]
CPUID 00000014: 02490002-003FFFFF-00000000-00000000 [SL 01]
CPUID 00000015: 00000003-000000EA-0124F800-00000000 [78.00x / 19200000]
CPUID 80000000: 80000008-00000000-00000000-00000000
CPUID 80000001: 00000000-00000000-00000101-2C100000
CPUID 80000002: 65746E49-2952286C-6C654320-6E6F7265 [Intel(R) Celeron]
CPUID 80000003: 20295228-20555043-3534334A-20402035 [(R) CPU J3455 @ ]
CPUID 80000004: 30352E31-007A4847-00000000-00000000 [1.50GHz]
CPUID 80000005: 00000000-00000000-00000000-00000000
CPUID 80000006: 00000000-00000000-04008040-00000000
CPUID 80000007: 00000000-00000000-00000000-00000100
CPUID 80000008: 00003027-00000000-00000000-00000000
------[ Logical CPU #2 ]------
CPUID 00000000: 00000015-756E6547-6C65746E-49656E69 [GenuineIntel]
CPUID 00000001: 000506C9-04200800-4FF8EBBF-BFEBFBFF
CPUID 00000002: 6164A001-0000FFC4-00000000-00000000
CPUID 00000003: 00000000-00000000-00000000-00000000
CPUID 00000004: 3C000121-0140003F-0000003F-00000001 [SL 00]
CPUID 00000004: 3C000122-01C0003F-0000003F-00000001 [SL 01]
CPUID 00000004: 3C00C143-03C0003F-000003FF-00000001 [SL 02]
CPUID 00000005: 00000040-00000040-00000003-11242020
CPUID 00000006: 00000057-00000002-00000001-00000000
CPUID 00000007: 00000000-2294E283-00000000-00000000
CPUID 00000008: 00000000-00000000-00000000-00000000
CPUID 00000009: 00000000-00000000-00000000-00000000
CPUID 0000000A: 07300404-00000000-00000000-00000603
CPUID 0000000B: 00000001-00000001-00000100-00000004 [SL 00]
CPUID 0000000B: 00000005-00000004-00000201-00000004 [SL 01]
CPUID 0000000C: 00000000-00000000-00000000-00000000
CPUID 0000000D: 0000001B-00000440-00000440-00000000 [SL 00]
CPUID 0000000D: 0000000F-000002C0-00000100-00000000 [SL 01]
CPUID 0000000E: 00000000-00000000-00000000-00000000
CPUID 0000000F: 00000000-00000000-00000000-00000000 [SL 00]
CPUID 0000000F: 00000000-00000000-00000000-00000000 [SL 01]
CPUID 00000010: 00000000-00000004-00000000-00000000 [SL 00]
CPUID 00000010: 00000000-00000000-00000000-00000000 [SL 01]
CPUID 00000011: 00000000-00000000-00000000-00000000
CPUID 00000012: 00000000-00000000-00000000-00000000 [SL 00]
CPUID 00000012: 00000000-00000000-00000000-00000000 [SL 01]
CPUID 00000013: 00000000-00000000-00000000-00000000
CPUID 00000014: 00000001-0000000F-80000007-00000000 [SL 00]
CPUID 00000014: 02490002-003FFFFF-00000000-00000000 [SL 01]
CPUID 00000015: 00000003-000000EA-0124F800-00000000 [78.00x / 19200000]
CPUID 80000000: 80000008-00000000-00000000-00000000
CPUID 80000001: 00000000-00000000-00000101-2C100000
CPUID 80000002: 65746E49-2952286C-6C654320-6E6F7265 [Intel(R) Celeron]
CPUID 80000003: 20295228-20555043-3534334A-20402035 [(R) CPU J3455 @ ]
CPUID 80000004: 30352E31-007A4847-00000000-00000000 [1.50GHz]
CPUID 80000005: 00000000-00000000-00000000-00000000
CPUID 80000006: 00000000-00000000-04008040-00000000
CPUID 80000007: 00000000-00000000-00000000-00000100
CPUID 80000008: 00003027-00000000-00000000-00000000
------[ Logical CPU #3 ]------
CPUID 00000000: 00000015-756E6547-6C65746E-49656E69 [GenuineIntel]
CPUID 00000001: 000506C9-06200800-4FF8EBBF-BFEBFBFF
CPUID 00000002: 6164A001-0000FFC4-00000000-00000000
CPUID 00000003: 00000000-00000000-00000000-00000000
CPUID 00000004: 3C000121-0140003F-0000003F-00000001 [SL 00]
CPUID 00000004: 3C000122-01C0003F-0000003F-00000001 [SL 01]
CPUID 00000004: 3C00C143-03C0003F-000003FF-00000001 [SL 02]
CPUID 00000005: 00000040-00000040-00000003-11242020
CPUID 00000006: 00000057-00000002-00000001-00000000
CPUID 00000007: 00000000-2294E283-00000000-00000000
CPUID 00000008: 00000000-00000000-00000000-00000000
CPUID 00000009: 00000000-00000000-00000000-00000000
CPUID 0000000A: 07300404-00000000-00000000-00000603
CPUID 0000000B: 00000001-00000001-00000100-00000006 [SL 00]
CPUID 0000000B: 00000005-00000004-00000201-00000006 [SL 01]
CPUID 0000000C: 00000000-00000000-00000000-00000000
CPUID 0000000D: 0000001B-00000440-00000440-00000000 [SL 00]
CPUID 0000000D: 0000000F-000002C0-00000100-00000000 [SL 01]
CPUID 0000000E: 00000000-00000000-00000000-00000000
CPUID 0000000F: 00000000-00000000-00000000-00000000 [SL 00]
CPUID 0000000F: 00000000-00000000-00000000-00000000 [SL 01]
CPUID 00000010: 00000000-00000004-00000000-00000000 [SL 00]
CPUID 00000010: 00000000-00000000-00000000-00000000 [SL 01]
CPUID 00000011: 00000000-00000000-00000000-00000000
CPUID 00000012: 00000000-00000000-00000000-00000000 [SL 00]
CPUID 00000012: 00000000-00000000-00000000-00000000 [SL 01]
CPUID 00000013: 00000000-00000000-00000000-00000000
CPUID 00000014: 00000001-0000000F-80000007-00000000 [SL 00]
CPUID 00000014: 02490002-003FFFFF-00000000-00000000 [SL 01]
CPUID 00000015: 00000003-000000EA-0124F800-00000000 [78.00x / 19200000]
CPUID 80000000: 80000008-00000000-00000000-00000000
CPUID 80000001: 00000000-00000000-00000101-2C100000
CPUID 80000002: 65746E49-2952286C-6C654320-6E6F7265 [Intel(R) Celeron]
CPUID 80000003: 20295228-20555043-3534334A-20402035 [(R) CPU J3455 @ ]
CPUID 80000004: 30352E31-007A4847-00000000-00000000 [1.50GHz]
CPUID 80000005: 00000000-00000000-00000000-00000000
CPUID 80000006: 00000000-00000000-04008040-00000000
CPUID 80000007: 00000000-00000000-00000000-00000100
CPUID 80000008: 00003027-00000000-00000000-00000000
--------------------------------------------------------------------------------
x86
x86-64-v3
general
6
12
9
6
92
4
4
24
32
1024
-1
-1
6
8
16
-1
-1
64
64
64
-1
-1
4
4
2
0
0
128 (non-authoritative)
Celeron (Apollo Lake)
14 nm
fpu vme de pse tsc msr pae mce cx8 apic mtrr sep pge mca cmov pat pse36 clflush dts acpi mmx fxsr sse sse2 ss ht tm pbe pni pclmul dts64 monitor ds_cpl vmx est tm2 ssse3 cx16 xtpr pdcm sse4_1 sse4_2 xd movbe popcnt aes xsave osxsave rdtscp lm lahf_lm constant_tsc rdrand x2apic sha_ni rdseed
