------[ Logical CPU #0 ]------
CPUID 00000000 00000001-68747541-444D4163-69746E65
CPUID 00000001 00200F31-00020800-00002001-178BFBFF
CPUID 80000000 8000001A-68747541-444D4163-69746E65
CPUID 80000001 00200F31-20000520-0000131F-EBD3FBFF
CPUID 80000002 20444D41-69727554-74286E6F-5820296D
CPUID 80000003 6C552032-20617274-6C617544-726F432D
CPUID 80000004 6F4D2065-656C6962-2D4D5A20-00003238
CPUID 80000005 FF08FF08-FF20FF20-40020140-40020140
CPUID 80000006 00000000-42004200-04008140-00000000
CPUID 80000007 00000000-00000000-00000000-000001F9
CPUID 80000008 00003028-00000000-00001001-00000000
CPUID 80000009 00000000-00000000-00000000-00000000
CPUID 8000000A 00000001-00000040-00000000-0000000E
CPUID 8000000B 00000000-00000000-00000000-00000000
CPUID 8000000C 00000000-00000000-00000000-00000000
CPUID 8000000D 00000000-00000000-00000000-00000000
CPUID 8000000E 00000000-00000000-00000000-00000000
CPUID 8000000F 00000000-00000000-00000000-00000000
CPUID 80000010 00000000-00000000-00000000-00000000
CPUID 80000011 00000000-00000000-00000000-00000000
CPUID 80000012 00000000-00000000-00000000-00000000
CPUID 80000013 00000000-00000000-00000000-00000000
CPUID 80000014 00000000-00000000-00000000-00000000
CPUID 80000015 00000000-00000000-00000000-00000000
CPUID 80000016 00000000-00000000-00000000-00000000
CPUID 80000017 00000000-00000000-00000000-00000000
CPUID 80000018 00000000-00000000-00000000-00000000
CPUID 80000019 00000000-00000000-00000000-00000000
CPUID 8000001A 00000000-00000000-00000000-00000000
------[ Logical CPU #1 ]------
CPUID 00000000 00000001-68747541-444D4163-69746E65
CPUID 00000001 00200F31-01020800-00002001-178BFBFF
CPUID 80000000 8000001A-68747541-444D4163-69746E65
CPUID 80000001 00200F31-20000520-0000131F-EBD3FBFF
CPUID 80000002 20444D41-69727554-74286E6F-5820296D
CPUID 80000003 6C552032-20617274-6C617544-726F432D
CPUID 80000004 6F4D2065-656C6962-2D4D5A20-00003238
CPUID 80000005 FF08FF08-FF20FF20-40020140-40020140
CPUID 80000006 00000000-42004200-04008140-00000000
CPUID 80000007 00000000-00000000-00000000-000001F9
CPUID 80000008 00003028-00000000-00001001-00000000
CPUID 80000009 00000000-00000000-00000000-00000000
CPUID 8000000A 00000001-00000040-00000000-0000000E
CPUID 8000000B 00000000-00000000-00000000-00000000
CPUID 8000000C 00000000-00000000-00000000-00000000
CPUID 8000000D 00000000-00000000-00000000-00000000
CPUID 8000000E 00000000-00000000-00000000-00000000
CPUID 8000000F 00000000-00000000-00000000-00000000
CPUID 80000010 00000000-00000000-00000000-00000000
CPUID 80000011 00000000-00000000-00000000-00000000
CPUID 80000012 00000000-00000000-00000000-00000000
CPUID 80000013 00000000-00000000-00000000-00000000
CPUID 80000014 00000000-00000000-00000000-00000000
CPUID 80000015 00000000-00000000-00000000-00000000
CPUID 80000016 00000000-00000000-00000000-00000000
CPUID 80000017 00000000-00000000-00000000-00000000
CPUID 80000018 00000000-00000000-00000000-00000000
CPUID 80000019 00000000-00000000-00000000-00000000
CPUID 8000001A 00000000-00000000-00000000-00000000
--------------------------------------------------------------------------------
x86
x86-64-v1
general
15
3
1
17
3
2
2
64
64
1024
-1
-1
2
2
16
-1
-1
64
64
64
-1
-1
-1
-1
-1
-1
-1
64 (authoritative)
Turion X2 (Griffin/1024K)
65 nm
fpu vme de pse tsc msr pae mce cx8 apic mtrr sep pge mca cmov pat pse36 clflush mmx fxsr sse sse2 ht pni cx16 syscall mmxext 3dnow 3dnowext nx fxsr_opt rdtscp lm lahf_lm cmp_legacy svm 3dnowprefetch osvw skinit ts ttp tm_amd stc 100mhzsteps hwpstate constant_tsc
