------[ Logical CPU #0 ]------
CPUID 00000000: 00000001-68747541-444D4163-69746E65
CPUID 00000001: 00020FB1-00020800-00000001-178BFBFF
CPUID 80000000: 80000018-68747541-444D4163-69746E65
CPUID 80000001: 00020FB1-00000150-00000003-E3D3FBFF
CPUID 80000002: 20444D41-6C687441-74286E6F-3620296D
CPUID 80000003: 32582034-61754420-6F43206C-50206572
CPUID 80000004: 65636F72-726F7373-30383320-00002B30
CPUID 80000005: FF08FF08-FF20FF20-40020140-40020140
CPUID 80000006: 00000000-42004200-02008140-00000000
CPUID 80000007: 00000000-00000000-00000000-0000000F
CPUID 80000008: 00003028-00000000-00000001-00000000
CPUID 80000009: 00000000-00000000-00000000-00000000
CPUID 8000000A: 00000000-00000000-00000000-00000000
CPUID 8000000B: 00000000-00000000-00000000-00000000
CPUID 8000000C: 00000000-00000000-00000000-00000000
CPUID 8000000D: 00000000-00000000-00000000-00000000
CPUID 8000000E: 00000000-00000000-00000000-00000000
CPUID 8000000F: 00000000-00000000-00000000-00000000
CPUID 80000010: 00000000-00000000-00000000-00000000
CPUID 80000011: 00000000-00000000-00000000-00000000
CPUID 80000012: 00000000-00000000-00000000-00000000
CPUID 80000013: 00000000-00000000-00000000-00000000
CPUID 80000014: 00000000-00000000-00000000-00000000
CPUID 80000015: 00000000-00000000-00000000-00000000
CPUID 80000016: 00000000-00000000-00000000-00000000
CPUID 80000017: 00000000-00000000-00000000-00000000
CPUID 80000018: 00000000-00000000-00000000-00000000
CPUID 8FFFFFFF: 53275449-4D414820-2052454D-454D4954
------[ Logical CPU #1 ]------
CPUID 00000000: 00000001-68747541-444D4163-69746E65
CPUID 00000001: 00020FB1-01020800-00000001-178BFBFF
CPUID 80000000: 80000018-68747541-444D4163-69746E65
CPUID 80000001: 00020FB1-00000150-00000003-E3D3FBFF
CPUID 80000002: 20444D41-6C687441-74286E6F-3620296D
CPUID 80000003: 32582034-61754420-6F43206C-50206572
CPUID 80000004: 65636F72-726F7373-30383320-00002B30
CPUID 80000005: FF08FF08-FF20FF20-40020140-40020140
CPUID 80000006: 00000000-42004200-02008140-00000000
CPUID 80000007: 00000000-00000000-00000000-0000000F
CPUID 80000008: 00003028-00000000-00000001-00000000
CPUID 80000009: 00000000-00000000-00000000-00000000
CPUID 8000000A: 00000000-00000000-00000000-00000000
CPUID 8000000B: 00000000-00000000-00000000-00000000
CPUID 8000000C: 00000000-00000000-00000000-00000000
CPUID 8000000D: 00000000-00000000-00000000-00000000
CPUID 8000000E: 00000000-00000000-00000000-00000000
CPUID 8000000F: 00000000-00000000-00000000-00000000
CPUID 80000010: 00000000-00000000-00000000-00000000
CPUID 80000011: 00000000-00000000-00000000-00000000
CPUID 80000012: 00000000-00000000-00000000-00000000
CPUID 80000013: 00000000-00000000-00000000-00000000
CPUID 80000014: 00000000-00000000-00000000-00000000
CPUID 80000015: 00000000-00000000-00000000-00000000
CPUID 80000016: 00000000-00000000-00000000-00000000
CPUID 80000017: 00000000-00000000-00000000-00000000
CPUID 80000018: 00000000-00000000-00000000-00000000
CPUID 8FFFFFFF: 53275449-4D414820-2052454D-454D4954
--------------------------------------------------------------------------------
x86
x86-64-v1
general
15
11
1
15
43
2
2
64
64
512
-1
-1
2
2
16
-1
-1
64
64
64
-1
-1
-1
-1
-1
-1
-1
64 (non-authoritative)
Athlon 64 X2 (Manchester/512K)
90 nm
fpu vme de pse tsc msr pae mce cx8 apic mtrr sep pge mca cmov pat pse36 clflush mmx fxsr sse sse2 ht pni syscall mmxext 3dnow 3dnowext nx fxsr_opt lm lahf_lm cmp_legacy ts fid vid ttp
