------[ Logical CPU #0 ]------
CPUID 00000000: 00000001-68747541-444D4163-69746E65
CPUID 00000001: 00040F12-00020800-00002001-178BFBFF
CPUID 80000000: 80000018-68747541-444D4163-69746E65
CPUID 80000001: 00040F12-000002CB-0000001F-EBD3FBFF
CPUID 80000002: 6C617544-726F432D-4D412065-704F2044
CPUID 80000003: 6F726574-6D74286E-72502029-7365636F
CPUID 80000004: 20726F73-30313232-00454820-00000000
CPUID 80000005: FF08FF08-FF20FF20-40020140-40020140
CPUID 80000006: 00000000-42004200-04008140-00000000
CPUID 80000007: 00000000-00000000-00000000-0000003F
CPUID 80000008: 00003028-00000000-00000001-00000000
CPUID 80000009: 00000000-00000000-00000000-00000000
CPUID 8000000A: 00000001-00000040-00000000-00000000
CPUID 8000000B: 00000000-00000000-00000000-00000000
CPUID 8000000C: 00000000-00000000-00000000-00000000
CPUID 8000000D: 00000000-00000000-00000000-00000000
CPUID 8000000E: 00000000-00000000-00000000-00000000
CPUID 8000000F: 00000000-00000000-00000000-00000000
CPUID 80000010: 00000000-00000000-00000000-00000000
CPUID 80000011: 00000000-00000000-00000000-00000000
CPUID 80000012: 00000000-00000000-00000000-00000000
CPUID 80000013: 00000000-00000000-00000000-00000000
CPUID 80000014: 00000000-00000000-00000000-00000000
CPUID 80000015: 00000000-00000000-00000000-00000000
CPUID 80000016: 00000000-00000000-00000000-00000000
CPUID 80000017: 00000000-00000000-00000000-00000000
CPUID 80000018: 00000000-00000000-00000000-00000000
CPUID 8FFFFFFF: 00000000-00000000-00000000-00000000
------[ Logical CPU #1 ]------
CPUID 00000000: 00000001-68747541-444D4163-69746E65
CPUID 00000001: 00040F12-01020800-00002001-178BFBFF
CPUID 80000000: 80000018-68747541-444D4163-69746E65
CPUID 80000001: 00040F12-000002CB-0000001F-EBD3FBFF
CPUID 80000002: 6C617544-726F432D-4D412065-704F2044
CPUID 80000003: 6F726574-6D74286E-72502029-7365636F
CPUID 80000004: 20726F73-30313232-00454820-00000000
CPUID 80000005: FF08FF08-FF20FF20-40020140-40020140
CPUID 80000006: 00000000-42004200-04008140-00000000
CPUID 80000007: 00000000-00000000-00000000-0000003F
CPUID 80000008: 00003028-00000000-00000001-00000000
CPUID 80000009: 00000000-00000000-00000000-00000000
CPUID 8000000A: 00000001-00000040-00000000-00000000
CPUID 8000000B: 00000000-00000000-00000000-00000000
CPUID 8000000C: 00000000-00000000-00000000-00000000
CPUID 8000000D: 00000000-00000000-00000000-00000000
CPUID 8000000E: 00000000-00000000-00000000-00000000
CPUID 8000000F: 00000000-00000000-00000000-00000000
CPUID 80000010: 00000000-00000000-00000000-00000000
CPUID 80000011: 00000000-00000000-00000000-00000000
CPUID 80000012: 00000000-00000000-00000000-00000000
CPUID 80000013: 00000000-00000000-00000000-00000000
CPUID 80000014: 00000000-00000000-00000000-00000000
CPUID 80000015: 00000000-00000000-00000000-00000000
CPUID 80000016: 00000000-00000000-00000000-00000000
CPUID 80000017: 00000000-00000000-00000000-00000000
CPUID 80000018: 00000000-00000000-00000000-00000000
CPUID 8FFFFFFF: 00000000-00000000-00000000-00000000
------[ Logical CPU #2 ]------
CPUID 00000000: 00000001-68747541-444D4163-69746E65
CPUID 00000001: 00040F12-02020800-00002001-178BFBFF
CPUID 80000000: 80000018-68747541-444D4163-69746E65
CPUID 80000001: 00040F12-000002CB-0000001F-EBD3FBFF
CPUID 80000002: 6C617544-726F432D-4D412065-704F2044
CPUID 80000003: 6F726574-6D74286E-72502029-7365636F
CPUID 80000004: 20726F73-30313232-00454820-00000000
CPUID 80000005: FF08FF08-FF20FF20-40020140-40020140
CPUID 80000006: 00000000-42004200-04008140-00000000
CPUID 80000007: 00000000-00000000-00000000-0000003F
CPUID 80000008: 00003028-00000000-00000001-00000000
CPUID 80000009: 00000000-00000000-00000000-00000000
CPUID 8000000A: 00000001-00000040-00000000-00000000
CPUID 8000000B: 00000000-00000000-00000000-00000000
CPUID 8000000C: 00000000-00000000-00000000-00000000
CPUID 8000000D: 00000000-00000000-00000000-00000000
CPUID 8000000E: 00000000-00000000-00000000-00000000
CPUID 8000000F: 00000000-00000000-00000000-00000000
CPUID 80000010: 00000000-00000000-00000000-00000000
CPUID 80000011: 00000000-00000000-00000000-00000000
CPUID 80000012: 00000000-00000000-00000000-00000000
CPUID 80000013: 00000000-00000000-00000000-00000000
CPUID 80000014: 00000000-00000000-00000000-00000000
CPUID 80000015: 00000000-00000000-00000000-00000000
CPUID 80000016: 00000000-00000000-00000000-00000000
CPUID 80000017: 00000000-00000000-00000000-00000000
CPUID 80000018: 00000000-00000000-00000000-00000000
CPUID 8FFFFFFF: 00000000-00000000-00000000-00000000
------[ Logical CPU #3 ]------
CPUID 00000000: 00000001-68747541-444D4163-69746E65
CPUID 00000001: 00040F12-03020800-00002001-178BFBFF
CPUID 80000000: 80000018-68747541-444D4163-69746E65
CPUID 80000001: 00040F12-000002CB-0000001F-EBD3FBFF
CPUID 80000002: 6C617544-726F432D-4D412065-704F2044
CPUID 80000003: 6F726574-6D74286E-72502029-7365636F
CPUID 80000004: 20726F73-30313232-00454820-00000000
CPUID 80000005: FF08FF08-FF20FF20-40020140-40020140
CPUID 80000006: 00000000-42004200-04008140-00000000
CPUID 80000007: 00000000-00000000-00000000-0000003F
CPUID 80000008: 00003028-00000000-00000001-00000000
CPUID 80000009: 00000000-00000000-00000000-00000000
CPUID 8000000A: 00000001-00000040-00000000-00000000
CPUID 8000000B: 00000000-00000000-00000000-00000000
CPUID 8000000C: 00000000-00000000-00000000-00000000
CPUID 8000000D: 00000000-00000000-00000000-00000000
CPUID 8000000E: 00000000-00000000-00000000-00000000
CPUID 8000000F: 00000000-00000000-00000000-00000000
CPUID 80000010: 00000000-00000000-00000000-00000000
CPUID 80000011: 00000000-00000000-00000000-00000000
CPUID 80000012: 00000000-00000000-00000000-00000000
CPUID 80000013: 00000000-00000000-00000000-00000000
CPUID 80000014: 00000000-00000000-00000000-00000000
CPUID 80000015: 00000000-00000000-00000000-00000000
CPUID 80000016: 00000000-00000000-00000000-00000000
CPUID 80000017: 00000000-00000000-00000000-00000000
CPUID 80000018: 00000000-00000000-00000000-00000000
CPUID 8FFFFFFF: 00000000-00000000-00000000-00000000
--------------------------------------------------------------------------------
x86
x86-64-v1
general
15
1
2
15
65
2
4
64
64
1024
-1
-1
2
2
16
-1
-1
64
64
64
-1
-1
-1
-1
-1
-1
-1
64 (non-authoritative)
Opteron (Santa Rosa)
90 nm
fpu vme de pse tsc msr pae mce cx8 apic mtrr sep pge mca cmov pat pse36 clflush mmx fxsr sse sse2 ht pni cx16 syscall mmxext 3dnow 3dnowext nx fxsr_opt rdtscp lm lahf_lm cmp_legacy svm ts fid vid ttp tm_amd stc
