basic_cpuid[0]=00000001 68747541 444d4163 69746e65
basic_cpuid[1]=00020f32 01020800 00000001 178bfbff
basic_cpuid[2]=00000000 00000000 00000000 00000000
basic_cpuid[3]=00000000 00000000 00000000 00000000
basic_cpuid[4]=00000000 00000000 00000000 00000000
basic_cpuid[5]=00000000 00000000 00000000 00000000
basic_cpuid[6]=00000000 00000000 00000000 00000000
basic_cpuid[7]=00000000 00000000 00000000 00000000
basic_cpuid[8]=00000000 00000000 00000000 00000000
basic_cpuid[9]=00000000 00000000 00000000 00000000
basic_cpuid[10]=00000000 00000000 00000000 00000000
basic_cpuid[11]=00000000 00000000 00000000 00000000
basic_cpuid[12]=00000000 00000000 00000000 00000000
basic_cpuid[13]=00000000 00000000 00000000 00000000
basic_cpuid[14]=00000000 00000000 00000000 00000000
basic_cpuid[15]=00000000 00000000 00000000 00000000
basic_cpuid[16]=00000000 00000000 00000000 00000000
basic_cpuid[17]=00000000 00000000 00000000 00000000
basic_cpuid[18]=00000000 00000000 00000000 00000000
basic_cpuid[19]=00000000 00000000 00000000 00000000
basic_cpuid[20]=00000000 00000000 00000000 00000000
basic_cpuid[21]=00000000 00000000 00000000 00000000
basic_cpuid[22]=00000000 00000000 00000000 00000000
basic_cpuid[23]=00000000 00000000 00000000 00000000
basic_cpuid[24]=00000000 00000000 00000000 00000000
basic_cpuid[25]=00000000 00000000 00000000 00000000
basic_cpuid[26]=00000000 00000000 00000000 00000000
basic_cpuid[27]=00000000 00000000 00000000 00000000
basic_cpuid[28]=00000000 00000000 00000000 00000000
basic_cpuid[29]=00000000 00000000 00000000 00000000
basic_cpuid[30]=00000000 00000000 00000000 00000000
basic_cpuid[31]=00000000 00000000 00000000 00000000
ext_cpuid[0]=80000018 68747541 444d4163 69746e65
ext_cpuid[1]=00020f32 00000b04 00000003 e3d3fbff
ext_cpuid[2]=6c617544 726f4320 4d412065 704f2044
ext_cpuid[3]=6f726574 6d74286e 72502029 7365636f
ext_cpuid[4]=20726f73 00353631 00000000 00000000
ext_cpuid[5]=ff08ff08 ff20ff20 40020140 40020140
ext_cpuid[6]=00000000 42004200 04008140 00000000
ext_cpuid[7]=00000000 00000000 00000000 0000000f
ext_cpuid[8]=00003028 00000000 00000001 00000000
ext_cpuid[9]=00000000 00000000 00000000 00000000
ext_cpuid[10]=00000000 00000000 00000000 00000000
ext_cpuid[11]=00000000 00000000 00000000 00000000
ext_cpuid[12]=00000000 00000000 00000000 00000000
ext_cpuid[13]=00000000 00000000 00000000 00000000
ext_cpuid[14]=00000000 00000000 00000000 00000000
ext_cpuid[15]=00000000 00000000 00000000 00000000
ext_cpuid[16]=00000000 00000000 00000000 00000000
ext_cpuid[17]=00000000 00000000 00000000 00000000
ext_cpuid[18]=00000000 00000000 00000000 00000000
ext_cpuid[19]=00000000 00000000 00000000 00000000
ext_cpuid[20]=00000000 00000000 00000000 00000000
ext_cpuid[21]=00000000 00000000 00000000 00000000
ext_cpuid[22]=00000000 00000000 00000000 00000000
ext_cpuid[23]=00000000 00000000 00000000 00000000
ext_cpuid[24]=00000000 00000000 00000000 00000000
ext_cpuid[25]=00000000 00000000 00000000 00000000
ext_cpuid[26]=00000000 00000000 00000000 00000000
ext_cpuid[27]=00000000 00000000 00000000 00000000
ext_cpuid[28]=00000000 00000000 00000000 00000000
ext_cpuid[29]=00000000 00000000 00000000 00000000
ext_cpuid[30]=00000000 00000000 00000000 00000000
ext_cpuid[31]=00000000 00000000 00000000 00000000
intel_fn4[0]=00000000 00000000 00000000 00000000
intel_fn4[1]=00000000 00000000 00000000 00000000
intel_fn4[2]=00000000 00000000 00000000 00000000
intel_fn4[3]=00000000 00000000 00000000 00000000
--------------------------------------------------------------------------------
15
3
2
15
35
2
2
64
64
1024
0
-1
2
16
-1
-1
64
64
-1
-1
64 (non-authoritative)
Opteron (Dual Core)
fpu vme de pse tsc msr pae mce cx8 apic mtrr sep pge mca cmov pat pse36 clflush mmx fxsr sse sse2 ht pni syscall mmxext 3dnow 3dnowext nx fxsr_opt lm lahf_lm cmp_legacy ts fid vid ttp
