basic_cpuid[0]=00000001 68747541 444d4163 69746e65
basic_cpuid[1]=00020f42 00000800 00000001 078bfbff
basic_cpuid[2]=00000000 00000000 00000000 00000000
basic_cpuid[3]=00000000 00000000 00000000 00000000
basic_cpuid[4]=00000000 00000000 00000000 00000000
basic_cpuid[5]=00000000 00000000 00000000 00000000
basic_cpuid[6]=00000000 00000000 00000000 00000000
basic_cpuid[7]=00000000 00000000 00000000 00000000
basic_cpuid[8]=00000000 00000000 00000000 00000000
basic_cpuid[9]=00000000 00000000 00000000 00000000
basic_cpuid[10]=00000000 00000000 00000000 00000000
basic_cpuid[11]=00000000 00000000 00000000 00000000
basic_cpuid[12]=00000000 00000000 00000000 00000000
basic_cpuid[13]=00000000 00000000 00000000 00000000
basic_cpuid[14]=00000000 00000000 00000000 00000000
basic_cpuid[15]=00000000 00000000 00000000 00000000
basic_cpuid[16]=00000000 00000000 00000000 00000000
basic_cpuid[17]=00000000 00000000 00000000 00000000
basic_cpuid[18]=00000000 00000000 00000000 00000000
basic_cpuid[19]=00000000 00000000 00000000 00000000
basic_cpuid[20]=00000000 00000000 00000000 00000000
basic_cpuid[21]=00000000 00000000 00000000 00000000
basic_cpuid[22]=00000000 00000000 00000000 00000000
basic_cpuid[23]=00000000 00000000 00000000 00000000
basic_cpuid[24]=00000000 00000000 00000000 00000000
basic_cpuid[25]=00000000 00000000 00000000 00000000
basic_cpuid[26]=00000000 00000000 00000000 00000000
basic_cpuid[27]=00000000 00000000 00000000 00000000
basic_cpuid[28]=00000000 00000000 00000000 00000000
basic_cpuid[29]=00000000 00000000 00000000 00000000
basic_cpuid[30]=00000000 00000000 00000000 00000000
basic_cpuid[31]=00000000 00000000 00000000 00000000
ext_cpuid[0]=80000018 68747541 444d4163 69746e65
ext_cpuid[1]=00020f42 0000028c 00000001 e3d3fbff
ext_cpuid[2]=20444d41 69727554 74286e6f 3620296d
ext_cpuid[3]=6f4d2034 656c6962 63655420 6c6f6e68
ext_cpuid[4]=2079676f 332d4c4d 00000034 00000000
ext_cpuid[5]=ff08ff08 ff20ff20 40020140 40020140
ext_cpuid[6]=00000000 42004200 04008140 00000000
ext_cpuid[7]=00000000 00000000 00000000 0000003f
ext_cpuid[8]=00003028 00000000 00000000 00000000
ext_cpuid[9]=00000000 00000000 00000000 00000000
ext_cpuid[10]=00000000 00000000 00000000 00000000
ext_cpuid[11]=00000000 00000000 00000000 00000000
ext_cpuid[12]=00000000 00000000 00000000 00000000
ext_cpuid[13]=00000000 00000000 00000000 00000000
ext_cpuid[14]=00000000 00000000 00000000 00000000
ext_cpuid[15]=00000000 00000000 00000000 00000000
ext_cpuid[16]=00000000 00000000 00000000 00000000
ext_cpuid[17]=00000000 00000000 00000000 00000000
ext_cpuid[18]=00000000 00000000 00000000 00000000
ext_cpuid[19]=00000000 00000000 00000000 00000000
ext_cpuid[20]=00000000 00000000 00000000 00000000
ext_cpuid[21]=00000000 00000000 00000000 00000000
ext_cpuid[22]=00000000 00000000 00000000 00000000
ext_cpuid[23]=00000000 00000000 00000000 00000000
ext_cpuid[24]=00000000 00000000 00000000 00000000
ext_cpuid[25]=00000000 00000000 00000000 00000000
ext_cpuid[26]=00000000 00000000 00000000 00000000
ext_cpuid[27]=00000000 00000000 00000000 00000000
ext_cpuid[28]=00000000 00000000 00000000 00000000
ext_cpuid[29]=00000000 00000000 00000000 00000000
ext_cpuid[30]=00000000 00000000 00000000 00000000
ext_cpuid[31]=00000000 00000000 00000000 00000000
intel_fn4[0]=00000000 00000000 00000000 00000000
intel_fn4[1]=00000000 00000000 00000000 00000000
intel_fn4[2]=00000000 00000000 00000000 00000000
intel_fn4[3]=00000000 00000000 00000000 00000000
--------------------------------------------------------------------------------
15
4
2
15
36
1
1
64
64
1024
0
-1
2
16
-1
-1
64
64
-1
-1
64 (non-authoritative)
Turion 64 (Lancaster/1024K)
fpu vme de pse tsc msr pae mce cx8 apic mtrr sep pge mca cmov pat pse36 clflush mmx fxsr sse sse2 pni syscall mmxext 3dnow 3dnowext nx fxsr_opt lm lahf_lm ts fid vid ttp tm_amd stc
