------[ Logical CPU #0 ]------
CPUID 00000000: 0000000A-756E6547-6C65746E-49656E69
CPUID 00000001: 00030661-00020800-0040E31D-BFEBFBFF
CPUID 00000002: 4FBA5901-0E3080C0-00000000-00000000
CPUID 00000003: 00000000-00000000-00000000-00000000
CPUID 00000004: 04000121-0140003F-0000003F-00000001
CPUID 00000004: 04000122-01C0003F-0000003F-00000001
CPUID 00000004: 04000143-01C0003F-000003FF-00000001
CPUID 00000005: 00000040-00000040-00000003-00000010
CPUID 00000006: 00000005-00000002-00000003-00000000
CPUID 00000007: 00000000-00000000-00000000-00000000
CPUID 00000008: 00000000-00000000-00000000-00000000
CPUID 00000009: 00000000-00000000-00000000-00000000
CPUID 0000000A: 07280203-00000000-00000000-00000503
CPUID 80000000: 80000008-00000000-00000000-00000000
CPUID 80000001: 00000000-00000000-00000001-20100000
CPUID 80000002: 20202020-20202020-65746E49-2952286C
CPUID 80000003: 6F744120-4D54286D-50432029-32442055
CPUID 80000004: 20303035-20402020-36382E31-007A4847
CPUID 80000005: 00000000-00000000-00000000-00000000
CPUID 80000006: 00000000-00000000-02006040-00000000
CPUID 80000007: 00000000-00000000-00000000-00000100
CPUID 80000008: 00003024-00000000-00000000-00000000
------[ Logical CPU #1 ]------
CPUID 00000000: 0000000A-756E6547-6C65746E-49656E69
CPUID 00000001: 00030661-01020800-0040E31D-BFEBFBFF
CPUID 00000002: 4FBA5901-0E3080C0-00000000-00000000
CPUID 00000003: 00000000-00000000-00000000-00000000
CPUID 00000004: 04000121-0140003F-0000003F-00000001
CPUID 00000004: 04000122-01C0003F-0000003F-00000001
CPUID 00000004: 04000143-01C0003F-000003FF-00000001
CPUID 00000005: 00000040-00000040-00000003-00000010
CPUID 00000006: 00000005-00000002-00000003-00000000
CPUID 00000007: 00000000-00000000-00000000-00000000
CPUID 00000008: 00000000-00000000-00000000-00000000
CPUID 00000009: 00000000-00000000-00000000-00000000
CPUID 0000000A: 07280203-00000000-00000000-00000503
CPUID 80000000: 80000008-00000000-00000000-00000000
CPUID 80000001: 00000000-00000000-00000001-20100000
CPUID 80000002: 20202020-20202020-65746E49-2952286C
CPUID 80000003: 6F744120-4D54286D-50432029-32442055
CPUID 80000004: 20303035-20402020-36382E31-007A4847
CPUID 80000005: 00000000-00000000-00000000-00000000
CPUID 80000006: 00000000-00000000-02006040-00000000
CPUID 80000007: 00000000-00000000-00000000-00000100
CPUID 80000008: 00003024-00000000-00000000-00000000
--------------------------------------------------------------------------------
x86
x86-64-v2
general
6
6
1
6
54
2
2
-1
-1
-1
-1
-1
-1
-1
-1
-1
-1
-1
-1
-1
-1
-1
-1
-1
-1
-1
-1
128 (non-authoritative)
Atom (Cedarview)
32 nm
fpu vme de pse tsc msr pae mce cx8 apic mtrr sep pge mca cmov pat pse36 clflush dts acpi mmx fxsr sse sse2 ss ht tm pbe pni dts64 monitor ds_cpl tm2 ssse3 cx16 xtpr pdcm xd movbe lm lahf_lm constant_tsc
