------[ Logical CPU #0 ]------
CPUID 00000000: 0000000A-756E6547-6C65746E-49656E69 [GenuineIntel]
CPUID 00000001: 00020672-00020800-0040C3BD-BFE9FBFF
CPUID 00000002: 4FBA5901-0E3080C0-00000000-00000000
CPUID 00000003: 00000000-00000000-00000000-00000000
CPUID 00000004: 00004121-0140003F-0000003F-00000001 [SL 00]
CPUID 00000004: 00004122-01C0003F-0000003F-00000001 [SL 01]
CPUID 00000004: 00004143-01C0003F-000003FF-00000001 [SL 02]
CPUID 00000005: 00000040-00000040-00000003-03020220
CPUID 00000006: 00000005-00000002-00000003-00000000
CPUID 00000007: 00000000-00000000-00000000-00000000
CPUID 00000008: 00000000-00000000-00000000-00000000
CPUID 00000009: 00000000-00000000-00000000-00000000
CPUID 0000000A: 07280203-00000000-00000000-00000503
CPUID 80000000: 80000008-00000000-00000000-00000000
CPUID 80000001: 00000000-00000000-00000001-00100000
CPUID 80000002: 20202020-20202020-746E4920-52286C65 [Intel(R]
CPUID 80000003: 74412029-54286D6F-4320294D-5A205550 [) Atom(TM) CPU Z]
CPUID 80000004: 30363432-20402020-30362E31-007A4847 [2460 @ 1.60GHz]
CPUID 80000005: 00000000-00000000-00000000-00000000
CPUID 80000006: 00000000-00000000-02006040-00000000
CPUID 80000007: 00000000-00000000-00000000-00000100
CPUID 80000008: 00002020-00000000-00000000-00000000
--------------------------------------------------------------------------------
x86
i686
general
6
7
2
6
39
1
1
24
32
512
-1
-1
6
8
8
-1
-1
64
64
64
-1
-1
-1
-1
-1
-1
-1
128 (non-authoritative)
Atom (Penwell)
32 nm
fpu vme de pse tsc msr pae mce cx8 apic mtrr sep pge mca cmov pat clflush dts acpi mmx fxsr sse sse2 ss ht tm pbe pni dts64 monitor ds_cpl vmx est tm2 ssse3 xtpr pdcm xd movbe lahf_lm constant_tsc
