------[ Logical CPU #0 ]------
CPUID 00000000: 00000006-68747541-444D4163-69746E65
CPUID 00000001: 00300F10-00040800-00802009-178BFBFF
CPUID 00000002: 00000000-00000000-00000000-00000000
CPUID 00000003: 00000000-00000000-00000000-00000000
CPUID 00000005: 00000040-00000040-00000003-00000000
CPUID 00000006: 00000000-00000000-00000001-00000000
CPUID 80000000: 8000001B-68747541-444D4163-69746E65
CPUID 80000001: 00300F10-20002B31-000037FF-EFD3FBFF
CPUID 80000002: 20444D41-332D3841-20303538-20555041
CPUID 80000003: 68746977-64615220-286E6F65-20296D74
CPUID 80000004: 47204448-68706172-00736369-00000000
CPUID 80000005: FF30FF10-FF30FF20-40020140-40020140
CPUID 80000006: 20800000-44004200-04008140-00000000
CPUID 80000007: 00000000-00000000-00000000-000001F9
CPUID 80000008: 00003028-00000000-00002003-00000000
CPUID 80000009: 00000000-00000000-00000000-00000000
CPUID 8000000A: 00000001-00000040-00000000-0000040F
CPUID 8000000B: 00000000-00000000-00000000-00000000
CPUID 8000000C: 00000000-00000000-00000000-00000000
CPUID 8000000D: 00000000-00000000-00000000-00000000
CPUID 8000000E: 00000000-00000000-00000000-00000000
CPUID 8000000F: 00000000-00000000-00000000-00000000
CPUID 80000010: 00000000-00000000-00000000-00000000
CPUID 80000011: 00000000-00000000-00000000-00000000
CPUID 80000012: 00000000-00000000-00000000-00000000
CPUID 80000013: 00000000-00000000-00000000-00000000
CPUID 80000014: 00000000-00000000-00000000-00000000
CPUID 80000015: 00000000-00000000-00000000-00000000
CPUID 80000016: 00000000-00000000-00000000-00000000
CPUID 80000017: 00000000-00000000-00000000-00000000
CPUID 80000018: 00000000-00000000-00000000-00000000
CPUID 80000019: F0300000-60100000-00000000-00000000
CPUID 8000001A: 00000003-00000000-00000000-00000000
CPUID 8000001B: 000000FF-00000000-00000000-00000000
CPUID 8FFFFFFF: 00000000-00000000-00000000-00000000
------[ Logical CPU #1 ]------
CPUID 00000000: 00000006-68747541-444D4163-69746E65
CPUID 00000001: 00300F10-02040800-00802009-178BFBFF
CPUID 00000002: 00000000-00000000-00000000-00000000
CPUID 00000003: 00000000-00000000-00000000-00000000
CPUID 00000005: 00000040-00000040-00000003-00000000
CPUID 00000006: 00000000-00000000-00000001-00000000
CPUID 80000000: 8000001B-68747541-444D4163-69746E65
CPUID 80000001: 00300F10-20002B31-000037FF-EFD3FBFF
CPUID 80000002: 20444D41-332D3841-20303538-20555041
CPUID 80000003: 68746977-64615220-286E6F65-20296D74
CPUID 80000004: 47204448-68706172-00736369-00000000
CPUID 80000005: FF30FF10-FF30FF20-40020140-40020140
CPUID 80000006: 20800000-44004200-04008140-00000000
CPUID 80000007: 00000000-00000000-00000000-000001F9
CPUID 80000008: 00003028-00000000-00002003-00000000
CPUID 80000009: 00000000-00000000-00000000-00000000
CPUID 8000000A: 00000001-00000040-00000000-0000040F
CPUID 8000000B: 00000000-00000000-00000000-00000000
CPUID 8000000C: 00000000-00000000-00000000-00000000
CPUID 8000000D: 00000000-00000000-00000000-00000000
CPUID 8000000E: 00000000-00000000-00000000-00000000
CPUID 8000000F: 00000000-00000000-00000000-00000000
CPUID 80000010: 00000000-00000000-00000000-00000000
CPUID 80000011: 00000000-00000000-00000000-00000000
CPUID 80000012: 00000000-00000000-00000000-00000000
CPUID 80000013: 00000000-00000000-00000000-00000000
CPUID 80000014: 00000000-00000000-00000000-00000000
CPUID 80000015: 00000000-00000000-00000000-00000000
CPUID 80000016: 00000000-00000000-00000000-00000000
CPUID 80000017: 00000000-00000000-00000000-00000000
CPUID 80000018: 00000000-00000000-00000000-00000000
CPUID 80000019: F0300000-60100000-00000000-00000000
CPUID 8000001A: 00000003-00000000-00000000-00000000
CPUID 8000001B: 000000FF-00000000-00000000-00000000
CPUID 8FFFFFFF: 00000000-00000000-00000000-00000000
------[ Logical CPU #2 ]------
CPUID 00000000: 00000006-68747541-444D4163-69746E65
CPUID 00000001: 00300F10-01040800-00802009-178BFBFF
CPUID 00000002: 00000000-00000000-00000000-00000000
CPUID 00000003: 00000000-00000000-00000000-00000000
CPUID 00000005: 00000040-00000040-00000003-00000000
CPUID 00000006: 00000000-00000000-00000001-00000000
CPUID 80000000: 8000001B-68747541-444D4163-69746E65
CPUID 80000001: 00300F10-20002B31-000037FF-EFD3FBFF
CPUID 80000002: 20444D41-332D3841-20303538-20555041
CPUID 80000003: 68746977-64615220-286E6F65-20296D74
CPUID 80000004: 47204448-68706172-00736369-00000000
CPUID 80000005: FF30FF10-FF30FF20-40020140-40020140
CPUID 80000006: 20800000-44004200-04008140-00000000
CPUID 80000007: 00000000-00000000-00000000-000001F9
CPUID 80000008: 00003028-00000000-00002003-00000000
CPUID 80000009: 00000000-00000000-00000000-00000000
CPUID 8000000A: 00000001-00000040-00000000-0000040F
CPUID 8000000B: 00000000-00000000-00000000-00000000
CPUID 8000000C: 00000000-00000000-00000000-00000000
CPUID 8000000D: 00000000-00000000-00000000-00000000
CPUID 8000000E: 00000000-00000000-00000000-00000000
CPUID 8000000F: 00000000-00000000-00000000-00000000
CPUID 80000010: 00000000-00000000-00000000-00000000
CPUID 80000011: 00000000-00000000-00000000-00000000
CPUID 80000012: 00000000-00000000-00000000-00000000
CPUID 80000013: 00000000-00000000-00000000-00000000
CPUID 80000014: 00000000-00000000-00000000-00000000
CPUID 80000015: 00000000-00000000-00000000-00000000
CPUID 80000016: 00000000-00000000-00000000-00000000
CPUID 80000017: 00000000-00000000-00000000-00000000
CPUID 80000018: 00000000-00000000-00000000-00000000
CPUID 80000019: F0300000-60100000-00000000-00000000
CPUID 8000001A: 00000003-00000000-00000000-00000000
CPUID 8000001B: 000000FF-00000000-00000000-00000000
CPUID 8FFFFFFF: 00000000-00000000-00000000-00000000
------[ Logical CPU #3 ]------
CPUID 00000000: 00000006-68747541-444D4163-69746E65
CPUID 00000001: 00300F10-03040800-00802009-178BFBFF
CPUID 00000002: 00000000-00000000-00000000-00000000
CPUID 00000003: 00000000-00000000-00000000-00000000
CPUID 00000005: 00000040-00000040-00000003-00000000
CPUID 00000006: 00000000-00000000-00000001-00000000
CPUID 80000000: 8000001B-68747541-444D4163-69746E65
CPUID 80000001: 00300F10-20002B31-000037FF-EFD3FBFF
CPUID 80000002: 20444D41-332D3841-20303538-20555041
CPUID 80000003: 68746977-64615220-286E6F65-20296D74
CPUID 80000004: 47204448-68706172-00736369-00000000
CPUID 80000005: FF30FF10-FF30FF20-40020140-40020140
CPUID 80000006: 20800000-44004200-04008140-00000000
CPUID 80000007: 00000000-00000000-00000000-000001F9
CPUID 80000008: 00003028-00000000-00002003-00000000
CPUID 80000009: 00000000-00000000-00000000-00000000
CPUID 8000000A: 00000001-00000040-00000000-0000040F
CPUID 8000000B: 00000000-00000000-00000000-00000000
CPUID 8000000C: 00000000-00000000-00000000-00000000
CPUID 8000000D: 00000000-00000000-00000000-00000000
CPUID 8000000E: 00000000-00000000-00000000-00000000
CPUID 8000000F: 00000000-00000000-00000000-00000000
CPUID 80000010: 00000000-00000000-00000000-00000000
CPUID 80000011: 00000000-00000000-00000000-00000000
CPUID 80000012: 00000000-00000000-00000000-00000000
CPUID 80000013: 00000000-00000000-00000000-00000000
CPUID 80000014: 00000000-00000000-00000000-00000000
CPUID 80000015: 00000000-00000000-00000000-00000000
CPUID 80000016: 00000000-00000000-00000000-00000000
CPUID 80000017: 00000000-00000000-00000000-00000000
CPUID 80000018: 00000000-00000000-00000000-00000000
CPUID 80000019: F0300000-60100000-00000000-00000000
CPUID 8000001A: 00000003-00000000-00000000-00000000
CPUID 8000001B: 000000FF-00000000-00000000-00000000
CPUID 8FFFFFFF: 00000000-00000000-00000000-00000000
--------------------------------------------------------------------------------
x86
x86-64-v1
general
15
1
0
18
1
4
4
64
64
1024
-1
-1
2
2
16
-1
-1
64
64
64
-1
-1
-1
-1
-1
-1
-1
128 (authoritative)
A-Series (Llano)
GF 32SHP
fpu vme de pse tsc msr pae mce cx8 apic mtrr sep pge mca cmov pat pse36 clflush mmx fxsr sse sse2 ht pni monitor cx16 syscall popcnt mmxext 3dnow 3dnowext nx fxsr_opt rdtscp lm lahf_lm cmp_legacy svm abm misalignsse sse4a 3dnowprefetch osvw ibs skinit wdt ts ttp tm_amd stc 100mhzsteps hwpstate constant_tsc
