CPUID Registers (CPU #1):
CPUID 00000000  	00000005-68747541-444D4163-69746E65
CPUID 00000001  	00100F52-00040800-00802009-178BFBFF
CPUID 00000002  	00000000-00000000-00000000-00000000
CPUID 00000003  	00000000-00000000-00000000-00000000
CPUID 00000005  	00000040-00000040-00000003-00000000
CPUID 80000000  	8000001B-68747541-444D4163-69746E65
CPUID 80000001  	00100F52-10005146-000037FF-EFD3FBFF
CPUID 80000002  	20444D41-6C687441-74286E6F-4920296D
CPUID 80000003  	34582049-30323620-6F725020-73736563
CPUID 80000004  	0000726F-00000000-00000000-00000000
CPUID 80000005  	FF30FF10-FF30FF20-40020140-40020140
CPUID 80000006  	20800000-42004200-02008140-00000000
CPUID 80000007  	00000000-00000000-00000000-000001F9
CPUID 80000008  	00003030-00000000-00002003-00000000
CPUID 80000009  	00000000-00000000-00000000-00000000
CPUID 8000000A  	00000001-00000040-00000000-0000000F
CPUID 8000000B  	00000000-00000000-00000000-00000000
CPUID 8000000C  	00000000-00000000-00000000-00000000
CPUID 8000000D  	00000000-00000000-00000000-00000000
CPUID 8000000E  	00000000-00000000-00000000-00000000
CPUID 8000000F  	00000000-00000000-00000000-00000000
CPUID 80000010  	00000000-00000000-00000000-00000000
CPUID 80000011  	00000000-00000000-00000000-00000000
CPUID 80000012  	00000000-00000000-00000000-00000000
CPUID 80000013  	00000000-00000000-00000000-00000000
CPUID 80000014  	00000000-00000000-00000000-00000000
CPUID 80000015  	00000000-00000000-00000000-00000000
CPUID 80000016  	00000000-00000000-00000000-00000000
CPUID 80000017  	00000000-00000000-00000000-00000000
CPUID 80000018  	00000000-00000000-00000000-00000000
CPUID 80000019  	F0300000-60100000-00000000-00000000
CPUID 8000001A  	00000003-00000000-00000000-00000000
CPUID 8000001B  	0000001F-00000000-00000000-00000000
CPUID Registers (CPU #2):
CPUID 00000000  	00000005-68747541-444D4163-69746E65
CPUID 00000001  	00100F52-01040800-00802009-178BFBFF
CPUID 00000002  	00000000-00000000-00000000-00000000
CPUID 00000003  	00000000-00000000-00000000-00000000
CPUID 00000005  	00000040-00000040-00000003-00000000
CPUID 80000000  	8000001B-68747541-444D4163-69746E65
CPUID 80000001  	00100F52-10005146-000037FF-EFD3FBFF
CPUID 80000002  	20444D41-6C687441-74286E6F-4920296D
CPUID 80000003  	34582049-30323620-6F725020-73736563
CPUID 80000004  	0000726F-00000000-00000000-00000000
CPUID 80000005  	FF30FF10-FF30FF20-40020140-40020140
CPUID 80000006  	20800000-42004200-02008140-00000000
CPUID 80000007  	00000000-00000000-00000000-000001F9
CPUID 80000008  	00003030-00000000-00002003-00000000
CPUID 80000009  	00000000-00000000-00000000-00000000
CPUID 8000000A  	00000001-00000040-00000000-0000000F
CPUID 8000000B  	00000000-00000000-00000000-00000000
CPUID 8000000C  	00000000-00000000-00000000-00000000
CPUID 8000000D  	00000000-00000000-00000000-00000000
CPUID 8000000E  	00000000-00000000-00000000-00000000
CPUID 8000000F  	00000000-00000000-00000000-00000000
CPUID 80000010  	00000000-00000000-00000000-00000000
CPUID 80000011  	00000000-00000000-00000000-00000000
CPUID 80000012  	00000000-00000000-00000000-00000000
CPUID 80000013  	00000000-00000000-00000000-00000000
CPUID 80000014  	00000000-00000000-00000000-00000000
CPUID 80000015  	00000000-00000000-00000000-00000000
CPUID 80000016  	00000000-00000000-00000000-00000000
CPUID 80000017  	00000000-00000000-00000000-00000000
CPUID 80000018  	00000000-00000000-00000000-00000000
CPUID 80000019  	F0300000-60100000-00000000-00000000
CPUID 8000001A  	00000003-00000000-00000000-00000000
CPUID 8000001B  	0000001F-00000000-00000000-00000000
CPUID Registers (CPU #3):
CPUID 00000000  	00000005-68747541-444D4163-69746E65
CPUID 00000001  	00100F52-02040800-00802009-178BFBFF
CPUID 00000002  	00000000-00000000-00000000-00000000
CPUID 00000003  	00000000-00000000-00000000-00000000
CPUID 00000005  	00000040-00000040-00000003-00000000
CPUID 80000000  	8000001B-68747541-444D4163-69746E65
CPUID 80000001  	00100F52-10005146-000037FF-EFD3FBFF
CPUID 80000002  	20444D41-6C687441-74286E6F-4920296D
CPUID 80000003  	34582049-30323620-6F725020-73736563
CPUID 80000004  	0000726F-00000000-00000000-00000000
CPUID 80000005  	FF30FF10-FF30FF20-40020140-40020140
CPUID 80000006  	20800000-42004200-02008140-00000000
CPUID 80000007  	00000000-00000000-00000000-000001F9
CPUID 80000008  	00003030-00000000-00002003-00000000
CPUID 80000009  	00000000-00000000-00000000-00000000
CPUID 8000000A  	00000001-00000040-00000000-0000000F
CPUID 8000000B  	00000000-00000000-00000000-00000000
CPUID 8000000C  	00000000-00000000-00000000-00000000
CPUID 8000000D  	00000000-00000000-00000000-00000000
CPUID 8000000E  	00000000-00000000-00000000-00000000
CPUID 8000000F  	00000000-00000000-00000000-00000000
CPUID 80000010  	00000000-00000000-00000000-00000000
CPUID 80000011  	00000000-00000000-00000000-00000000
CPUID 80000012  	00000000-00000000-00000000-00000000
CPUID 80000013  	00000000-00000000-00000000-00000000
CPUID 80000014  	00000000-00000000-00000000-00000000
CPUID 80000015  	00000000-00000000-00000000-00000000
CPUID 80000016  	00000000-00000000-00000000-00000000
CPUID 80000017  	00000000-00000000-00000000-00000000
CPUID 80000018  	00000000-00000000-00000000-00000000
CPUID 80000019  	F0300000-60100000-00000000-00000000
CPUID 8000001A  	00000003-00000000-00000000-00000000
CPUID 8000001B  	0000001F-00000000-00000000-00000000
CPUID Registers (CPU #4):
CPUID 00000000  	00000005-68747541-444D4163-69746E65
CPUID 00000001  	00100F52-03040800-00802009-178BFBFF
CPUID 00000002  	00000000-00000000-00000000-00000000
CPUID 00000003  	00000000-00000000-00000000-00000000
CPUID 00000005  	00000040-00000040-00000003-00000000
CPUID 80000000  	8000001B-68747541-444D4163-69746E65
CPUID 80000001  	00100F52-10005146-000037FF-EFD3FBFF
CPUID 80000002  	20444D41-6C687441-74286E6F-4920296D
CPUID 80000003  	34582049-30323620-6F725020-73736563
CPUID 80000004  	0000726F-00000000-00000000-00000000
CPUID 80000005  	FF30FF10-FF30FF20-40020140-40020140
CPUID 80000006  	20800000-42004200-02008140-00000000
CPUID 80000007  	00000000-00000000-00000000-000001F9
CPUID 80000008  	00003030-00000000-00002003-00000000
CPUID 80000009  	00000000-00000000-00000000-00000000
CPUID 8000000A  	00000001-00000040-00000000-0000000F
CPUID 8000000B  	00000000-00000000-00000000-00000000
CPUID 8000000C  	00000000-00000000-00000000-00000000
CPUID 8000000D  	00000000-00000000-00000000-00000000
CPUID 8000000E  	00000000-00000000-00000000-00000000
CPUID 8000000F  	00000000-00000000-00000000-00000000
CPUID 80000010  	00000000-00000000-00000000-00000000
CPUID 80000011  	00000000-00000000-00000000-00000000
CPUID 80000012  	00000000-00000000-00000000-00000000
CPUID 80000013  	00000000-00000000-00000000-00000000
CPUID 80000014  	00000000-00000000-00000000-00000000
CPUID 80000015  	00000000-00000000-00000000-00000000
CPUID 80000016  	00000000-00000000-00000000-00000000
CPUID 80000017  	00000000-00000000-00000000-00000000
CPUID 80000018  	00000000-00000000-00000000-00000000
CPUID 80000019  	F0300000-60100000-00000000-00000000
CPUID 8000001A  	00000003-00000000-00000000-00000000
CPUID 8000001B  	0000001F-00000000-00000000-00000000
--------------------------------------------------------------------------------
x86
x86-64-v1
general
15
5
2
16
5
4
4
64
64
512
-1
-1
2
2
16
-1
-1
64
64
64
-1
-1
-1
-1
-1
-1
-1
128 (authoritative)
Athlon II X4 (Propus)
45 nm
fpu vme de pse tsc msr pae mce cx8 apic mtrr sep pge mca cmov pat pse36 clflush mmx fxsr sse sse2 ht pni monitor cx16 syscall popcnt mmxext 3dnow 3dnowext nx fxsr_opt rdtscp lm lahf_lm cmp_legacy svm abm misalignsse sse4a 3dnowprefetch osvw ibs skinit wdt ts ttp tm_amd stc 100mhzsteps hwpstate constant_tsc
