------[ Logical CPU #0 ]------
CPUID 00000000: 00000005-68747541-444D4163-69746E65
CPUID 00000001: 00100F2A-00040800-00802009-178BFBFF
CPUID 00000002: 00000000-00000000-00000000-00000000
CPUID 00000003: 00000000-00000000-00000000-00000000
CPUID 00000005: 00000040-00000040-00000003-00000000
CPUID 80000000: 8000001A-68747541-444D4163-69746E65
CPUID 80000001: 00100F2A-00000ACB-000007FF-EFD3FBFF
CPUID 80000002: 64617551-726F432D-4D412065-704F2044
CPUID 80000003: 6F726574-6D74286E-72502029-7365636F
CPUID 80000004: 20726F73-34343332-00454820-00000000
CPUID 80000005: FF30FF10-FF30FF20-40020140-40020140
CPUID 80000006: 20800000-42004200-02008140-0010A140
CPUID 80000007: 00000000-00000000-00000000-000001F9
CPUID 80000008: 00003030-00000000-00002003-00000000
CPUID 80000009: 00000000-00000000-00000000-00000000
CPUID 8000000A: 00000001-00000040-00000000-00000007
CPUID 8000000B: 00000000-00000000-00000000-00000000
CPUID 8000000C: 00000000-00000000-00000000-00000000
CPUID 8000000D: 00000000-00000000-00000000-00000000
CPUID 8000000E: 00000000-00000000-00000000-00000000
CPUID 8000000F: 00000000-00000000-00000000-00000000
CPUID 80000010: 00000000-00000000-00000000-00000000
CPUID 80000011: 00000000-00000000-00000000-00000000
CPUID 80000012: 00000000-00000000-00000000-00000000
CPUID 80000013: 00000000-00000000-00000000-00000000
CPUID 80000014: 00000000-00000000-00000000-00000000
CPUID 80000015: 00000000-00000000-00000000-00000000
CPUID 80000016: 00000000-00000000-00000000-00000000
CPUID 80000017: 00000000-00000000-00000000-00000000
CPUID 80000018: 00000000-00000000-00000000-00000000
CPUID 80000019: F0300000-00000000-00000000-00000000
CPUID 8000001A: 00000003-00000000-00000000-00000000
CPUID 8FFFFFFF: 00000000-00000000-00000000-00000000
------[ Logical CPU #1 ]------
CPUID 00000000: 00000005-68747541-444D4163-69746E65
CPUID 00000001: 00100F2A-01040800-00802009-178BFBFF
CPUID 00000002: 00000000-00000000-00000000-00000000
CPUID 00000003: 00000000-00000000-00000000-00000000
CPUID 00000005: 00000040-00000040-00000003-00000000
CPUID 80000000: 8000001A-68747541-444D4163-69746E65
CPUID 80000001: 00100F2A-00000ACB-000007FF-EFD3FBFF
CPUID 80000002: 64617551-726F432D-4D412065-704F2044
CPUID 80000003: 6F726574-6D74286E-72502029-7365636F
CPUID 80000004: 20726F73-34343332-00454820-00000000
CPUID 80000005: FF30FF10-FF30FF20-40020140-40020140
CPUID 80000006: 20800000-42004200-02008140-0010A140
CPUID 80000007: 00000000-00000000-00000000-000001F9
CPUID 80000008: 00003030-00000000-00002003-00000000
CPUID 80000009: 00000000-00000000-00000000-00000000
CPUID 8000000A: 00000001-00000040-00000000-00000007
CPUID 8000000B: 00000000-00000000-00000000-00000000
CPUID 8000000C: 00000000-00000000-00000000-00000000
CPUID 8000000D: 00000000-00000000-00000000-00000000
CPUID 8000000E: 00000000-00000000-00000000-00000000
CPUID 8000000F: 00000000-00000000-00000000-00000000
CPUID 80000010: 00000000-00000000-00000000-00000000
CPUID 80000011: 00000000-00000000-00000000-00000000
CPUID 80000012: 00000000-00000000-00000000-00000000
CPUID 80000013: 00000000-00000000-00000000-00000000
CPUID 80000014: 00000000-00000000-00000000-00000000
CPUID 80000015: 00000000-00000000-00000000-00000000
CPUID 80000016: 00000000-00000000-00000000-00000000
CPUID 80000017: 00000000-00000000-00000000-00000000
CPUID 80000018: 00000000-00000000-00000000-00000000
CPUID 80000019: F0300000-00000000-00000000-00000000
CPUID 8000001A: 00000003-00000000-00000000-00000000
CPUID 8FFFFFFF: 00000000-00000000-00000000-00000000
------[ Logical CPU #2 ]------
CPUID 00000000: 00000005-68747541-444D4163-69746E65
CPUID 00000001: 00100F2A-02040800-00802009-178BFBFF
CPUID 00000002: 00000000-00000000-00000000-00000000
CPUID 00000003: 00000000-00000000-00000000-00000000
CPUID 00000005: 00000040-00000040-00000003-00000000
CPUID 80000000: 8000001A-68747541-444D4163-69746E65
CPUID 80000001: 00100F2A-00000ACB-000007FF-EFD3FBFF
CPUID 80000002: 64617551-726F432D-4D412065-704F2044
CPUID 80000003: 6F726574-6D74286E-72502029-7365636F
CPUID 80000004: 20726F73-34343332-00454820-00000000
CPUID 80000005: FF30FF10-FF30FF20-40020140-40020140
CPUID 80000006: 20800000-42004200-02008140-0010A140
CPUID 80000007: 00000000-00000000-00000000-000001F9
CPUID 80000008: 00003030-00000000-00002003-00000000
CPUID 80000009: 00000000-00000000-00000000-00000000
CPUID 8000000A: 00000001-00000040-00000000-00000007
CPUID 8000000B: 00000000-00000000-00000000-00000000
CPUID 8000000C: 00000000-00000000-00000000-00000000
CPUID 8000000D: 00000000-00000000-00000000-00000000
CPUID 8000000E: 00000000-00000000-00000000-00000000
CPUID 8000000F: 00000000-00000000-00000000-00000000
CPUID 80000010: 00000000-00000000-00000000-00000000
CPUID 80000011: 00000000-00000000-00000000-00000000
CPUID 80000012: 00000000-00000000-00000000-00000000
CPUID 80000013: 00000000-00000000-00000000-00000000
CPUID 80000014: 00000000-00000000-00000000-00000000
CPUID 80000015: 00000000-00000000-00000000-00000000
CPUID 80000016: 00000000-00000000-00000000-00000000
CPUID 80000017: 00000000-00000000-00000000-00000000
CPUID 80000018: 00000000-00000000-00000000-00000000
CPUID 80000019: F0300000-00000000-00000000-00000000
CPUID 8000001A: 00000003-00000000-00000000-00000000
CPUID 8FFFFFFF: 00000000-00000000-00000000-00000000
------[ Logical CPU #3 ]------
CPUID 00000000: 00000005-68747541-444D4163-69746E65
CPUID 00000001: 00100F2A-03040800-00802009-178BFBFF
CPUID 00000002: 00000000-00000000-00000000-00000000
CPUID 00000003: 00000000-00000000-00000000-00000000
CPUID 00000005: 00000040-00000040-00000003-00000000
CPUID 80000000: 8000001A-68747541-444D4163-69746E65
CPUID 80000001: 00100F2A-00000ACB-000007FF-EFD3FBFF
CPUID 80000002: 64617551-726F432D-4D412065-704F2044
CPUID 80000003: 6F726574-6D74286E-72502029-7365636F
CPUID 80000004: 20726F73-34343332-00454820-00000000
CPUID 80000005: FF30FF10-FF30FF20-40020140-40020140
CPUID 80000006: 20800000-42004200-02008140-0010A140
CPUID 80000007: 00000000-00000000-00000000-000001F9
CPUID 80000008: 00003030-00000000-00002003-00000000
CPUID 80000009: 00000000-00000000-00000000-00000000
CPUID 8000000A: 00000001-00000040-00000000-00000007
CPUID 8000000B: 00000000-00000000-00000000-00000000
CPUID 8000000C: 00000000-00000000-00000000-00000000
CPUID 8000000D: 00000000-00000000-00000000-00000000
CPUID 8000000E: 00000000-00000000-00000000-00000000
CPUID 8000000F: 00000000-00000000-00000000-00000000
CPUID 80000010: 00000000-00000000-00000000-00000000
CPUID 80000011: 00000000-00000000-00000000-00000000
CPUID 80000012: 00000000-00000000-00000000-00000000
CPUID 80000013: 00000000-00000000-00000000-00000000
CPUID 80000014: 00000000-00000000-00000000-00000000
CPUID 80000015: 00000000-00000000-00000000-00000000
CPUID 80000016: 00000000-00000000-00000000-00000000
CPUID 80000017: 00000000-00000000-00000000-00000000
CPUID 80000018: 00000000-00000000-00000000-00000000
CPUID 80000019: F0300000-00000000-00000000-00000000
CPUID 8000001A: 00000003-00000000-00000000-00000000
CPUID 8FFFFFFF: 00000000-00000000-00000000-00000000
------[ Logical CPU #4 ]------
CPUID 00000000: 00000005-68747541-444D4163-69746E65
CPUID 00000001: 00100F2A-04040800-00802009-178BFBFF
CPUID 00000002: 00000000-00000000-00000000-00000000
CPUID 00000003: 00000000-00000000-00000000-00000000
CPUID 00000005: 00000040-00000040-00000003-00000000
CPUID 80000000: 8000001A-68747541-444D4163-69746E65
CPUID 80000001: 00100F2A-00000ACB-000007FF-EFD3FBFF
CPUID 80000002: 64617551-726F432D-4D412065-704F2044
CPUID 80000003: 6F726574-6D74286E-72502029-7365636F
CPUID 80000004: 20726F73-34343332-00454820-00000000
CPUID 80000005: FF30FF10-FF30FF20-40020140-40020140
CPUID 80000006: 20800000-42004200-02008140-0010A140
CPUID 80000007: 00000000-00000000-00000000-000001F9
CPUID 80000008: 00003030-00000000-00002003-00000000
CPUID 80000009: 00000000-00000000-00000000-00000000
CPUID 8000000A: 00000001-00000040-00000000-00000007
CPUID 8000000B: 00000000-00000000-00000000-00000000
CPUID 8000000C: 00000000-00000000-00000000-00000000
CPUID 8000000D: 00000000-00000000-00000000-00000000
CPUID 8000000E: 00000000-00000000-00000000-00000000
CPUID 8000000F: 00000000-00000000-00000000-00000000
CPUID 80000010: 00000000-00000000-00000000-00000000
CPUID 80000011: 00000000-00000000-00000000-00000000
CPUID 80000012: 00000000-00000000-00000000-00000000
CPUID 80000013: 00000000-00000000-00000000-00000000
CPUID 80000014: 00000000-00000000-00000000-00000000
CPUID 80000015: 00000000-00000000-00000000-00000000
CPUID 80000016: 00000000-00000000-00000000-00000000
CPUID 80000017: 00000000-00000000-00000000-00000000
CPUID 80000018: 00000000-00000000-00000000-00000000
CPUID 80000019: F0300000-00000000-00000000-00000000
CPUID 8000001A: 00000003-00000000-00000000-00000000
CPUID 8FFFFFFF: 00000000-00000000-00000000-00000000
------[ Logical CPU #5 ]------
CPUID 00000000: 00000005-68747541-444D4163-69746E65
CPUID 00000001: 00100F2A-05040800-00802009-178BFBFF
CPUID 00000002: 00000000-00000000-00000000-00000000
CPUID 00000003: 00000000-00000000-00000000-00000000
CPUID 00000005: 00000040-00000040-00000003-00000000
CPUID 80000000: 8000001A-68747541-444D4163-69746E65
CPUID 80000001: 00100F2A-00000ACB-000007FF-EFD3FBFF
CPUID 80000002: 64617551-726F432D-4D412065-704F2044
CPUID 80000003: 6F726574-6D74286E-72502029-7365636F
CPUID 80000004: 20726F73-34343332-00454820-00000000
CPUID 80000005: FF30FF10-FF30FF20-40020140-40020140
CPUID 80000006: 20800000-42004200-02008140-0010A140
CPUID 80000007: 00000000-00000000-00000000-000001F9
CPUID 80000008: 00003030-00000000-00002003-00000000
CPUID 80000009: 00000000-00000000-00000000-00000000
CPUID 8000000A: 00000001-00000040-00000000-00000007
CPUID 8000000B: 00000000-00000000-00000000-00000000
CPUID 8000000C: 00000000-00000000-00000000-00000000
CPUID 8000000D: 00000000-00000000-00000000-00000000
CPUID 8000000E: 00000000-00000000-00000000-00000000
CPUID 8000000F: 00000000-00000000-00000000-00000000
CPUID 80000010: 00000000-00000000-00000000-00000000
CPUID 80000011: 00000000-00000000-00000000-00000000
CPUID 80000012: 00000000-00000000-00000000-00000000
CPUID 80000013: 00000000-00000000-00000000-00000000
CPUID 80000014: 00000000-00000000-00000000-00000000
CPUID 80000015: 00000000-00000000-00000000-00000000
CPUID 80000016: 00000000-00000000-00000000-00000000
CPUID 80000017: 00000000-00000000-00000000-00000000
CPUID 80000018: 00000000-00000000-00000000-00000000
CPUID 80000019: F0300000-00000000-00000000-00000000
CPUID 8000001A: 00000003-00000000-00000000-00000000
CPUID 8FFFFFFF: 00000000-00000000-00000000-00000000
------[ Logical CPU #6 ]------
CPUID 00000000: 00000005-68747541-444D4163-69746E65
CPUID 00000001: 00100F2A-06040800-00802009-178BFBFF
CPUID 00000002: 00000000-00000000-00000000-00000000
CPUID 00000003: 00000000-00000000-00000000-00000000
CPUID 00000005: 00000040-00000040-00000003-00000000
CPUID 80000000: 8000001A-68747541-444D4163-69746E65
CPUID 80000001: 00100F2A-00000ACB-000007FF-EFD3FBFF
CPUID 80000002: 64617551-726F432D-4D412065-704F2044
CPUID 80000003: 6F726574-6D74286E-72502029-7365636F
CPUID 80000004: 20726F73-34343332-00454820-00000000
CPUID 80000005: FF30FF10-FF30FF20-40020140-40020140
CPUID 80000006: 20800000-42004200-02008140-0010A140
CPUID 80000007: 00000000-00000000-00000000-000001F9
CPUID 80000008: 00003030-00000000-00002003-00000000
CPUID 80000009: 00000000-00000000-00000000-00000000
CPUID 8000000A: 00000001-00000040-00000000-00000007
CPUID 8000000B: 00000000-00000000-00000000-00000000
CPUID 8000000C: 00000000-00000000-00000000-00000000
CPUID 8000000D: 00000000-00000000-00000000-00000000
CPUID 8000000E: 00000000-00000000-00000000-00000000
CPUID 8000000F: 00000000-00000000-00000000-00000000
CPUID 80000010: 00000000-00000000-00000000-00000000
CPUID 80000011: 00000000-00000000-00000000-00000000
CPUID 80000012: 00000000-00000000-00000000-00000000
CPUID 80000013: 00000000-00000000-00000000-00000000
CPUID 80000014: 00000000-00000000-00000000-00000000
CPUID 80000015: 00000000-00000000-00000000-00000000
CPUID 80000016: 00000000-00000000-00000000-00000000
CPUID 80000017: 00000000-00000000-00000000-00000000
CPUID 80000018: 00000000-00000000-00000000-00000000
CPUID 80000019: F0300000-00000000-00000000-00000000
CPUID 8000001A: 00000003-00000000-00000000-00000000
CPUID 8FFFFFFF: 00000000-00000000-00000000-00000000
------[ Logical CPU #7 ]------
CPUID 00000000: 00000005-68747541-444D4163-69746E65
CPUID 00000001: 00100F2A-07040800-00802009-178BFBFF
CPUID 00000002: 00000000-00000000-00000000-00000000
CPUID 00000003: 00000000-00000000-00000000-00000000
CPUID 00000005: 00000040-00000040-00000003-00000000
CPUID 80000000: 8000001A-68747541-444D4163-69746E65
CPUID 80000001: 00100F2A-00000ACB-000007FF-EFD3FBFF
CPUID 80000002: 64617551-726F432D-4D412065-704F2044
CPUID 80000003: 6F726574-6D74286E-72502029-7365636F
CPUID 80000004: 20726F73-34343332-00454820-00000000
CPUID 80000005: FF30FF10-FF30FF20-40020140-40020140
CPUID 80000006: 20800000-42004200-02008140-0010A140
CPUID 80000007: 00000000-00000000-00000000-000001F9
CPUID 80000008: 00003030-00000000-00002003-00000000
CPUID 80000009: 00000000-00000000-00000000-00000000
CPUID 8000000A: 00000001-00000040-00000000-00000007
CPUID 8000000B: 00000000-00000000-00000000-00000000
CPUID 8000000C: 00000000-00000000-00000000-00000000
CPUID 8000000D: 00000000-00000000-00000000-00000000
CPUID 8000000E: 00000000-00000000-00000000-00000000
CPUID 8000000F: 00000000-00000000-00000000-00000000
CPUID 80000010: 00000000-00000000-00000000-00000000
CPUID 80000011: 00000000-00000000-00000000-00000000
CPUID 80000012: 00000000-00000000-00000000-00000000
CPUID 80000013: 00000000-00000000-00000000-00000000
CPUID 80000014: 00000000-00000000-00000000-00000000
CPUID 80000015: 00000000-00000000-00000000-00000000
CPUID 80000016: 00000000-00000000-00000000-00000000
CPUID 80000017: 00000000-00000000-00000000-00000000
CPUID 80000018: 00000000-00000000-00000000-00000000
CPUID 80000019: F0300000-00000000-00000000-00000000
CPUID 8000001A: 00000003-00000000-00000000-00000000
CPUID 8FFFFFFF: 00000000-00000000-00000000-00000000
--------------------------------------------------------------------------------
x86
x86-64-v1
general
15
2
10
16
2
4
8
64
64
512
2048
-1
2
2
16
32
-1
64
64
64
64
-1
-1
-1
-1
-1
-1
128 (authoritative)
Opteron (Barcelona)
45 nm
fpu vme de pse tsc msr pae mce cx8 apic mtrr sep pge mca cmov pat pse36 clflush mmx fxsr sse sse2 ht pni monitor cx16 syscall popcnt mmxext 3dnow 3dnowext nx fxsr_opt rdtscp lm lahf_lm cmp_legacy svm abm misalignsse sse4a 3dnowprefetch osvw ibs ts ttp tm_amd stc 100mhzsteps hwpstate constant_tsc
