------[ CPUID Registers / Logical CPU #0 ]------
CPUID 00000000: 00000016-756E6547-6C65746E-49656E69 [GenuineIntel]
CPUID 00000001: 000806E9-00100800-4FFAEBBF-BFEBFBFF
CPUID 00000002: 76036301-00F0B5FF-00000000-00C30000
CPUID 00000003: 00000000-00000000-00000000-00000000
CPUID 00000004: 1C004121-01C0003F-0000003F-00000000 [SL 00] [L1D: 32 KB]
CPUID 00000004: 1C004122-01C0003F-0000003F-00000000 [SL 01] [L1I: 32 KB]
CPUID 00000004: 1C004143-00C0003F-000003FF-00000000 [SL 02] [L2U: 256 KB]
CPUID 00000004: 1C03C163-01C0003F-00000FFF-00000006 [SL 03] [L3U: 2 MB]
CPUID 00000005: 00000040-00000040-00000003-11142120
CPUID 00000006: 000027F5-00000002-00000009-00000000
CPUID 00000007: 00000000-02946687-00000000-9C002400
CPUID 00000008: 00000000-00000000-00000000-00000000
CPUID 00000009: 00000000-00000000-00000000-00000000
CPUID 0000000A: 07300404-00000000-00000000-00000603
CPUID 0000000B: 00000001-00000002-00000100-00000000 [SL 00]
CPUID 0000000B: 00000004-00000004-00000201-00000000 [SL 01]
CPUID 0000000C: 00000000-00000000-00000000-00000000
CPUID 0000000D: 0000001B-00000440-00000440-00000000 [SL 00] [x87]
CPUID 0000000D: 0000000F-00000340-00000100-00000000 [SL 01] [SSE]
CPUID 0000000D: 00000040-000003C0-00000000-00000000 [SL 03] [MPX BNDREGS]
CPUID 0000000D: 00000040-00000400-00000000-00000000 [SL 04] [MPX BNDCSR]
CPUID 0000000D: 00000080-00000000-00000001-00000000 [SL 08] [PT]
CPUID 0000000E: 00000000-00000000-00000000-00000000
CPUID 0000000F: 00000000-00000000-00000000-00000000 [SL 00]
CPUID 0000000F: 00000000-00000000-00000000-00000000 [SL 01]
CPUID 00000010: 00000000-00000000-00000000-00000000 [SL 00]
CPUID 00000010: 00000000-00000000-00000000-00000000 [SL 01]
CPUID 00000011: 00000000-00000000-00000000-00000000
CPUID 00000012: 00000000-00000000-00000000-00000000 [SL 00]
CPUID 00000012: 00000000-00000000-00000000-00000000 [SL 01]
CPUID 00000013: 00000000-00000000-00000000-00000000
CPUID 00000014: 00000001-0000000F-00000007-00000000 [SL 00]
CPUID 00000014: 02490002-003F3FFF-00000000-00000000 [SL 01]
CPUID 00000015: 00000002-0000008E-00000000-00000000 [71.00x / 0]
CPUID 00000016: 000006A4-000006A4-00000064-00000000 [1700 / 1700 / 100]
CPUID 80000000: 80000008-00000000-00000000-00000000
CPUID 80000001: 00000000-00000000-00000121-2C100000
CPUID 80000002: 65746E49-2952286C-6E655020-6D756974 [Intel(R) Pentium]
CPUID 80000003: 20295228-20555043-35323434-20402059 [(R) CPU 4425Y @ ]
CPUID 80000004: 30372E31-007A4847-00000000-00000000 [1.70GHz]
CPUID 80000005: 00000000-00000000-00000000-00000000 [L1D: 0 KB / L1I: 0 KB]
CPUID 80000006: 00000000-00000000-01006040-00000000 [L2: 256 KB] / L3: 0 KB]
CPUID 80000007: 00000000-00000000-00000000-00000100
CPUID 80000008: 00003027-00000000-00000000-00000000
------[ CPUID Registers / Logical CPU #1 ]------
CPUID 00000000: 00000016-756E6547-6C65746E-49656E69 [GenuineIntel]
CPUID 00000001: 000806E9-01100800-4FFAEBBF-BFEBFBFF
CPUID 00000002: 76036301-00F0B5FF-00000000-00C30000
CPUID 00000003: 00000000-00000000-00000000-00000000
CPUID 00000004: 1C004121-01C0003F-0000003F-00000000 [SL 00] [L1D: 32 KB]
CPUID 00000004: 1C004122-01C0003F-0000003F-00000000 [SL 01] [L1I: 32 KB]
CPUID 00000004: 1C004143-00C0003F-000003FF-00000000 [SL 02] [L2U: 256 KB]
CPUID 00000004: 1C03C163-01C0003F-00000FFF-00000006 [SL 03] [L3U: 2 MB]
CPUID 00000005: 00000040-00000040-00000003-11142120
CPUID 00000006: 000027F5-00000002-00000009-00000000
CPUID 00000007: 00000000-02946687-00000000-9C002400
CPUID 00000008: 00000000-00000000-00000000-00000000
CPUID 00000009: 00000000-00000000-00000000-00000000
CPUID 0000000A: 07300404-00000000-00000000-00000603
CPUID 0000000B: 00000001-00000002-00000100-00000001 [SL 00]
CPUID 0000000B: 00000004-00000004-00000201-00000001 [SL 01]
CPUID 0000000C: 00000000-00000000-00000000-00000000
CPUID 0000000D: 0000001B-00000440-00000440-00000000 [SL 00] [x87]
CPUID 0000000D: 0000000F-00000340-00000100-00000000 [SL 01] [SSE]
CPUID 0000000D: 00000040-000003C0-00000000-00000000 [SL 03] [MPX BNDREGS]
CPUID 0000000D: 00000040-00000400-00000000-00000000 [SL 04] [MPX BNDCSR]
CPUID 0000000D: 00000080-00000000-00000001-00000000 [SL 08] [PT]
CPUID 0000000E: 00000000-00000000-00000000-00000000
CPUID 0000000F: 00000000-00000000-00000000-00000000 [SL 00]
CPUID 0000000F: 00000000-00000000-00000000-00000000 [SL 01]
CPUID 00000010: 00000000-00000000-00000000-00000000 [SL 00]
CPUID 00000010: 00000000-00000000-00000000-00000000 [SL 01]
CPUID 00000011: 00000000-00000000-00000000-00000000
CPUID 00000012: 00000000-00000000-00000000-00000000 [SL 00]
CPUID 00000012: 00000000-00000000-00000000-00000000 [SL 01]
CPUID 00000013: 00000000-00000000-00000000-00000000
CPUID 00000014: 00000001-0000000F-00000007-00000000 [SL 00]
CPUID 00000014: 02490002-003F3FFF-00000000-00000000 [SL 01]
CPUID 00000015: 00000002-0000008E-00000000-00000000 [71.00x / 0]
CPUID 00000016: 000006A4-000006A4-00000064-00000000 [1700 / 1700 / 100]
CPUID 80000000: 80000008-00000000-00000000-00000000
CPUID 80000001: 00000000-00000000-00000121-2C100000
CPUID 80000002: 65746E49-2952286C-6E655020-6D756974 [Intel(R) Pentium]
CPUID 80000003: 20295228-20555043-35323434-20402059 [(R) CPU 4425Y @ ]
CPUID 80000004: 30372E31-007A4847-00000000-00000000 [1.70GHz]
CPUID 80000005: 00000000-00000000-00000000-00000000 [L1D: 0 KB / L1I: 0 KB]
CPUID 80000006: 00000000-00000000-01006040-00000000 [L2: 256 KB] / L3: 0 KB]
CPUID 80000007: 00000000-00000000-00000000-00000100
CPUID 80000008: 00003027-00000000-00000000-00000000
------[ CPUID Registers / Logical CPU #2 ]------
CPUID 00000000: 00000016-756E6547-6C65746E-49656E69 [GenuineIntel]
CPUID 00000001: 000806E9-02100800-4FFAEBBF-BFEBFBFF
CPUID 00000002: 76036301-00F0B5FF-00000000-00C30000
CPUID 00000003: 00000000-00000000-00000000-00000000
CPUID 00000004: 1C004121-01C0003F-0000003F-00000000 [SL 00] [L1D: 32 KB]
CPUID 00000004: 1C004122-01C0003F-0000003F-00000000 [SL 01] [L1I: 32 KB]
CPUID 00000004: 1C004143-00C0003F-000003FF-00000000 [SL 02] [L2U: 256 KB]
CPUID 00000004: 1C03C163-01C0003F-00000FFF-00000006 [SL 03] [L3U: 2 MB]
CPUID 00000005: 00000040-00000040-00000003-11142120
CPUID 00000006: 000027F5-00000002-00000009-00000000
CPUID 00000007: 00000000-02946687-00000000-9C002400
CPUID 00000008: 00000000-00000000-00000000-00000000
CPUID 00000009: 00000000-00000000-00000000-00000000
CPUID 0000000A: 07300404-00000000-00000000-00000603
CPUID 0000000B: 00000001-00000002-00000100-00000002 [SL 00]
CPUID 0000000B: 00000004-00000004-00000201-00000002 [SL 01]
CPUID 0000000C: 00000000-00000000-00000000-00000000
CPUID 0000000D: 0000001B-00000440-00000440-00000000 [SL 00] [x87]
CPUID 0000000D: 0000000F-00000340-00000100-00000000 [SL 01] [SSE]
CPUID 0000000D: 00000040-000003C0-00000000-00000000 [SL 03] [MPX BNDREGS]
CPUID 0000000D: 00000040-00000400-00000000-00000000 [SL 04] [MPX BNDCSR]
CPUID 0000000D: 00000080-00000000-00000001-00000000 [SL 08] [PT]
CPUID 0000000E: 00000000-00000000-00000000-00000000
CPUID 0000000F: 00000000-00000000-00000000-00000000 [SL 00]
CPUID 0000000F: 00000000-00000000-00000000-00000000 [SL 01]
CPUID 00000010: 00000000-00000000-00000000-00000000 [SL 00]
CPUID 00000010: 00000000-00000000-00000000-00000000 [SL 01]
CPUID 00000011: 00000000-00000000-00000000-00000000
CPUID 00000012: 00000000-00000000-00000000-00000000 [SL 00]
CPUID 00000012: 00000000-00000000-00000000-00000000 [SL 01]
CPUID 00000013: 00000000-00000000-00000000-00000000
CPUID 00000014: 00000001-0000000F-00000007-00000000 [SL 00]
CPUID 00000014: 02490002-003F3FFF-00000000-00000000 [SL 01]
CPUID 00000015: 00000002-0000008E-00000000-00000000 [71.00x / 0]
CPUID 00000016: 000006A4-000006A4-00000064-00000000 [1700 / 1700 / 100]
CPUID 80000000: 80000008-00000000-00000000-00000000
CPUID 80000001: 00000000-00000000-00000121-2C100000
CPUID 80000002: 65746E49-2952286C-6E655020-6D756974 [Intel(R) Pentium]
CPUID 80000003: 20295228-20555043-35323434-20402059 [(R) CPU 4425Y @ ]
CPUID 80000004: 30372E31-007A4847-00000000-00000000 [1.70GHz]
CPUID 80000005: 00000000-00000000-00000000-00000000 [L1D: 0 KB / L1I: 0 KB]
CPUID 80000006: 00000000-00000000-01006040-00000000 [L2: 256 KB] / L3: 0 KB]
CPUID 80000007: 00000000-00000000-00000000-00000100
CPUID 80000008: 00003027-00000000-00000000-00000000
------[ CPUID Registers / Logical CPU #3 ]------
CPUID 00000000: 00000016-756E6547-6C65746E-49656E69 [GenuineIntel]
CPUID 00000001: 000806E9-03100800-4FFAEBBF-BFEBFBFF
CPUID 00000002: 76036301-00F0B5FF-00000000-00C30000
CPUID 00000003: 00000000-00000000-00000000-00000000
CPUID 00000004: 1C004121-01C0003F-0000003F-00000000 [SL 00] [L1D: 32 KB]
CPUID 00000004: 1C004122-01C0003F-0000003F-00000000 [SL 01] [L1I: 32 KB]
CPUID 00000004: 1C004143-00C0003F-000003FF-00000000 [SL 02] [L2U: 256 KB]
CPUID 00000004: 1C03C163-01C0003F-00000FFF-00000006 [SL 03] [L3U: 2 MB]
CPUID 00000005: 00000040-00000040-00000003-11142120
CPUID 00000006: 000027F5-00000002-00000009-00000000
CPUID 00000007: 00000000-02946687-00000000-9C002400
CPUID 00000008: 00000000-00000000-00000000-00000000
CPUID 00000009: 00000000-00000000-00000000-00000000
CPUID 0000000A: 07300404-00000000-00000000-00000603
CPUID 0000000B: 00000001-00000002-00000100-00000003 [SL 00]
CPUID 0000000B: 00000004-00000004-00000201-00000003 [SL 01]
CPUID 0000000C: 00000000-00000000-00000000-00000000
CPUID 0000000D: 0000001B-00000440-00000440-00000000 [SL 00] [x87]
CPUID 0000000D: 0000000F-00000340-00000100-00000000 [SL 01] [SSE]
CPUID 0000000D: 00000040-000003C0-00000000-00000000 [SL 03] [MPX BNDREGS]
CPUID 0000000D: 00000040-00000400-00000000-00000000 [SL 04] [MPX BNDCSR]
CPUID 0000000D: 00000080-00000000-00000001-00000000 [SL 08] [PT]
CPUID 0000000E: 00000000-00000000-00000000-00000000
CPUID 0000000F: 00000000-00000000-00000000-00000000 [SL 00]
CPUID 0000000F: 00000000-00000000-00000000-00000000 [SL 01]
CPUID 00000010: 00000000-00000000-00000000-00000000 [SL 00]
CPUID 00000010: 00000000-00000000-00000000-00000000 [SL 01]
CPUID 00000011: 00000000-00000000-00000000-00000000
CPUID 00000012: 00000000-00000000-00000000-00000000 [SL 00]
CPUID 00000012: 00000000-00000000-00000000-00000000 [SL 01]
CPUID 00000013: 00000000-00000000-00000000-00000000
CPUID 00000014: 00000001-0000000F-00000007-00000000 [SL 00]
CPUID 00000014: 02490002-003F3FFF-00000000-00000000 [SL 01]
CPUID 00000015: 00000002-0000008E-00000000-00000000 [71.00x / 0]
CPUID 00000016: 000006A4-000006A4-00000064-00000000 [1700 / 1700 / 100]
CPUID 80000000: 80000008-00000000-00000000-00000000
CPUID 80000001: 00000000-00000000-00000121-2C100000
CPUID 80000002: 65746E49-2952286C-6E655020-6D756974 [Intel(R) Pentium]
CPUID 80000003: 20295228-20555043-35323434-20402059 [(R) CPU 4425Y @ ]
CPUID 80000004: 30372E31-007A4847-00000000-00000000 [1.70GHz]
CPUID 80000005: 00000000-00000000-00000000-00000000 [L1D: 0 KB / L1I: 0 KB]
CPUID 80000006: 00000000-00000000-01006040-00000000 [L2: 256 KB] / L3: 0 KB]
CPUID 80000007: 00000000-00000000-00000000-00000100
CPUID 80000008: 00003027-00000000-00000000-00000000
--------------------------------------------------------------------------------
x86
x86-64-v3
general
6
14
9
6
142
2
4
32
32
256
2048
-1
8
8
4
8
-1
64
64
64
64
-1
2
2
2
1
0
128 (non-authoritative)
Pentium Gold (Amber Lake-Y)
14+ nm
fpu vme de pse tsc msr pae mce cx8 apic mtrr sep pge mca cmov pat pse36 clflush dts acpi mmx fxsr sse sse2 ss ht tm pbe pni pclmul dts64 monitor ds_cpl vmx est tm2 ssse3 cx16 xtpr pdcm sse4_1 sse4_2 xd movbe popcnt aes xsave osxsave rdtscp lm lahf_lm abm constant_tsc rdrand x2apic sgx rdseed
