------[ Logical CPU #0 ]------
CPUID 00000000: 00000001-68747541-444D4163-69746E65
CPUID 00000001: 00000591-00000000-00000000-008021BF
CPUID 80000000: 80000006-00000000-00000000-00000000
CPUID 80000001: 00000691-00000000-00000000-808029BF
CPUID 80000002: 2D444D41-7428364B-3320296D-50202B44
CPUID 80000003: 65636F72-726F7373-00000000-00000000
CPUID 80000004: 00000000-00000000-00000000-00000000
CPUID 80000005: 00000000-02800140-20020220-20020220
CPUID 80000006: 00000000-00000000-01004220-00000000
CPUID 8FFFFFFF: 4778654E-72656E65-6F697461-444D416E
--------------------------------------------------------------------------------
x86
i586
general
5
9
1
5
9
1
1
32
32
256
-1
-1
2
2
4
-1
-1
32
32
32
-1
-1
-1
-1
-1
-1
-1
-1 (non-authoritative)
K6-III (Sharptooth)
250 nm
fpu vme de pse tsc msr mce cx8 pge mmx syscall 3dnow
