------[ Logical CPU #0 ]------
CPUID 00000000: 00000001-68747541-444D4163-69746E65
CPUID 00000001: 000005D0-00000000-00000000-008021BF
CPUID 80000000: 80000007-00000000-00000000-00000000
CPUID 80000001: 000006D0-00000000-00000000-C08029BF
CPUID 80000002: 2D444D41-7428364B-492D296D-50204949
CPUID 80000003: 65636F72-726F7373-00000000-00000000
CPUID 80000004: 00000000-00000000-00000000-00000000
CPUID 80000005: 00000000-02800140-20020220-20020220
CPUID 80000006: 00000000-00000000-01004220-00000000
CPUID 80000007: 00000000-00000000-00000000-00000007
CPUID 8FFFFFFF: 4778654E-72656E65-6F697461-444D416E
--------------------------------------------------------------------------------
x86
i586
general
5
13
0
5
13
1
1
32
32
256
-1
-1
2
2
4
-1
-1
32
32
32
-1
-1
-1
-1
-1
-1
-1
-1 (non-authoritative)
K6-III+
180 nm
fpu vme de pse tsc msr mce cx8 pge mmx syscall 3dnow 3dnowext ts fid vid
