basic_cpuid[0]=00000005 756e6547 6c65746e 49656e69
basic_cpuid[1]=00000f34 00010800 0000441d bfebfbff
basic_cpuid[2]=605b5101 00000000 00000000 003c7040
basic_cpuid[3]=00000000 00000000 00000000 00000000
basic_cpuid[4]=00000121 01c0003f 0000001f 00000000
basic_cpuid[5]=00000040 00000040 00000000 00000000
basic_cpuid[6]=00000040 00000040 00000000 00000000
basic_cpuid[7]=00000040 00000040 00000000 00000000
basic_cpuid[8]=00000040 00000040 00000000 00000000
basic_cpuid[9]=00000040 00000040 00000000 00000000
basic_cpuid[10]=00000040 00000040 00000000 00000000
basic_cpuid[11]=00000040 00000040 00000000 00000000
basic_cpuid[12]=00000040 00000040 00000000 00000000
basic_cpuid[13]=00000040 00000040 00000000 00000000
basic_cpuid[14]=00000040 00000040 00000000 00000000
basic_cpuid[15]=00000040 00000040 00000000 00000000
basic_cpuid[16]=00000040 00000040 00000000 00000000
basic_cpuid[17]=00000040 00000040 00000000 00000000
basic_cpuid[18]=00000040 00000040 00000000 00000000
basic_cpuid[19]=00000040 00000040 00000000 00000000
basic_cpuid[20]=00000040 00000040 00000000 00000000
basic_cpuid[21]=00000040 00000040 00000000 00000000
basic_cpuid[22]=00000040 00000040 00000000 00000000
basic_cpuid[23]=00000040 00000040 00000000 00000000
basic_cpuid[24]=00000040 00000040 00000000 00000000
basic_cpuid[25]=00000040 00000040 00000000 00000000
basic_cpuid[26]=00000040 00000040 00000000 00000000
basic_cpuid[27]=00000040 00000040 00000000 00000000
basic_cpuid[28]=00000040 00000040 00000000 00000000
basic_cpuid[29]=00000040 00000040 00000000 00000000
basic_cpuid[30]=00000040 00000040 00000000 00000000
basic_cpuid[31]=00000040 00000040 00000000 00000000
ext_cpuid[0]=80000008 00000000 00000000 00000000
ext_cpuid[1]=00000000 00000000 00000000 00000000
ext_cpuid[2]=20202020 20202020 20202020 20202020
ext_cpuid[3]=65746e49 2952286c 6c654320 6e6f7265
ext_cpuid[4]=20295228 20555043 30342e32 007a4847
ext_cpuid[5]=00000000 00000000 00000000 00000000
ext_cpuid[6]=00000000 00000000 01004040 00000000
ext_cpuid[7]=00000000 00000000 00000000 00000000
ext_cpuid[8]=00002024 00000000 00000000 00000000
ext_cpuid[9]=00000040 00000040 00000000 00000000
ext_cpuid[10]=00000040 00000040 00000000 00000000
ext_cpuid[11]=00000040 00000040 00000000 00000000
ext_cpuid[12]=00000040 00000040 00000000 00000000
ext_cpuid[13]=00000040 00000040 00000000 00000000
ext_cpuid[14]=00000040 00000040 00000000 00000000
ext_cpuid[15]=00000040 00000040 00000000 00000000
ext_cpuid[16]=00000040 00000040 00000000 00000000
ext_cpuid[17]=00000040 00000040 00000000 00000000
ext_cpuid[18]=00000040 00000040 00000000 00000000
ext_cpuid[19]=00000040 00000040 00000000 00000000
ext_cpuid[20]=00000040 00000040 00000000 00000000
ext_cpuid[21]=00000040 00000040 00000000 00000000
ext_cpuid[22]=00000040 00000040 00000000 00000000
ext_cpuid[23]=00000040 00000040 00000000 00000000
ext_cpuid[24]=00000040 00000040 00000000 00000000
ext_cpuid[25]=00000040 00000040 00000000 00000000
ext_cpuid[26]=00000040 00000040 00000000 00000000
ext_cpuid[27]=00000040 00000040 00000000 00000000
ext_cpuid[28]=00000040 00000040 00000000 00000000
ext_cpuid[29]=00000040 00000040 00000000 00000000
ext_cpuid[30]=00000040 00000040 00000000 00000000
ext_cpuid[31]=00000040 00000040 00000000 00000000
intel_fn4[0]=00000121 01c0003f 0000001f 00000000
intel_fn4[1]=00000143 00c0103f 000001ff 00000000
intel_fn4[2]=00000000 00000000 00000000 00000000
intel_fn4[3]=00000000 00000000 00000000 00000000
--------------------------------------------------------------------------------
15
3
4
15
3
1
1
16
-1
256
-1
-1
8
4
-1
-1
64
64
-1
-1
64 (non-authoritative)
P-4 Celeron D (Prescott)
fpu vme de pse tsc msr pae mce cx8 apic mtrr sep pge mca cmov pat pse36 clflush dts acpi mmx fxsr sse sse2 ss tm pbe pni dts64 monitor ds_cpl cid xtpr
