basic_cpuid[0]=00000005 756e6547 6c65746e 49656e69
basic_cpuid[1]=00000f34 01020800 0000441d bfebfbff
basic_cpuid[2]=605b5001 00000000 00000000 007c7040
basic_cpuid[3]=00000000 00000000 00000000 00000000
basic_cpuid[4]=00004121 01c0003f 0000001f 00000000
basic_cpuid[5]=00000040 00000040 00000000 00000000
basic_cpuid[6]=00000040 00000040 00000000 00000000
basic_cpuid[7]=00000040 00000040 00000000 00000000
basic_cpuid[8]=00000040 00000040 00000000 00000000
basic_cpuid[9]=00000040 00000040 00000000 00000000
basic_cpuid[10]=00000040 00000040 00000000 00000000
basic_cpuid[11]=00000040 00000040 00000000 00000000
basic_cpuid[12]=00000040 00000040 00000000 00000000
basic_cpuid[13]=00000040 00000040 00000000 00000000
basic_cpuid[14]=00000040 00000040 00000000 00000000
basic_cpuid[15]=00000040 00000040 00000000 00000000
basic_cpuid[16]=00000040 00000040 00000000 00000000
basic_cpuid[17]=00000040 00000040 00000000 00000000
basic_cpuid[18]=00000040 00000040 00000000 00000000
basic_cpuid[19]=00000040 00000040 00000000 00000000
basic_cpuid[20]=00000040 00000040 00000000 00000000
basic_cpuid[21]=00000040 00000040 00000000 00000000
basic_cpuid[22]=00000040 00000040 00000000 00000000
basic_cpuid[23]=00000040 00000040 00000000 00000000
basic_cpuid[24]=00000040 00000040 00000000 00000000
basic_cpuid[25]=00000040 00000040 00000000 00000000
basic_cpuid[26]=00000040 00000040 00000000 00000000
basic_cpuid[27]=00000040 00000040 00000000 00000000
basic_cpuid[28]=00000040 00000040 00000000 00000000
basic_cpuid[29]=00000040 00000040 00000000 00000000
basic_cpuid[30]=00000040 00000040 00000000 00000000
basic_cpuid[31]=00000040 00000040 00000000 00000000
ext_cpuid[0]=80000008 00000000 00000000 00000000
ext_cpuid[1]=00000000 00000000 00000000 00000000
ext_cpuid[2]=20202020 20202020 20202020 6e492020
ext_cpuid[3]=286c6574 50202952 69746e65 52286d75
ext_cpuid[4]=20342029 20555043 30322e33 007a4847
ext_cpuid[5]=00000000 00000000 00000000 00000000
ext_cpuid[6]=00000000 00000000 04006040 00000000
ext_cpuid[7]=00000000 00000000 00000000 00000000
ext_cpuid[8]=00002024 00000000 00000000 00000000
ext_cpuid[9]=00000040 00000040 00000000 00000000
ext_cpuid[10]=00000040 00000040 00000000 00000000
ext_cpuid[11]=00000040 00000040 00000000 00000000
ext_cpuid[12]=00000040 00000040 00000000 00000000
ext_cpuid[13]=00000040 00000040 00000000 00000000
ext_cpuid[14]=00000040 00000040 00000000 00000000
ext_cpuid[15]=00000040 00000040 00000000 00000000
ext_cpuid[16]=00000040 00000040 00000000 00000000
ext_cpuid[17]=00000040 00000040 00000000 00000000
ext_cpuid[18]=00000040 00000040 00000000 00000000
ext_cpuid[19]=00000040 00000040 00000000 00000000
ext_cpuid[20]=00000040 00000040 00000000 00000000
ext_cpuid[21]=00000040 00000040 00000000 00000000
ext_cpuid[22]=00000040 00000040 00000000 00000000
ext_cpuid[23]=00000040 00000040 00000000 00000000
ext_cpuid[24]=00000040 00000040 00000000 00000000
ext_cpuid[25]=00000040 00000040 00000000 00000000
ext_cpuid[26]=00000040 00000040 00000000 00000000
ext_cpuid[27]=00000040 00000040 00000000 00000000
ext_cpuid[28]=00000040 00000040 00000000 00000000
ext_cpuid[29]=00000040 00000040 00000000 00000000
ext_cpuid[30]=00000040 00000040 00000000 00000000
ext_cpuid[31]=00000040 00000040 00000000 00000000
intel_fn4[0]=00004121 01c0003f 0000001f 00000000
intel_fn4[1]=00004143 01c0103f 000003ff 00000000
intel_fn4[2]=00000000 00000000 00000000 00000000
intel_fn4[3]=00000000 00000000 00000000 00000000
intel_fn11[0]=00000040 00000040 00000000 00000000
intel_fn11[1]=00000040 00000040 00000000 00000000
intel_fn11[2]=00000040 00000040 00000000 00000000
intel_fn11[3]=00000040 00000040 00000000 00000000
--------------------------------------------------------------------------------
15
3
4
15
3
1
2
16
-1
1024
-1
-1
8
8
-1
-1
64
64
-1
-1
64 (non-authoritative)
Pentium 4 (Prescott)
fpu vme de pse tsc msr pae mce cx8 apic mtrr sep pge mca cmov pat pse36 clflush dts acpi mmx fxsr sse sse2 ss ht tm pbe pni dts64 monitor ds_cpl cid xtpr
