------[ CPUID Registers / Logical CPU #0 ]------
CPUID 00000000: 0000001B-756E6547-6C65746E-49656E69 [GenuineIntel]
CPUID 00000001: 000806A1-00100800-4FD8EBBF-BFEBFBFF
CPUID 00000002: 00FEFF01-00000000-00000000-00000000
CPUID 00000003: 00000000-00000000-00000000-00000000
CPUID 00000004: 1C000121-01C0003F-0000003F-00000000 [SL 00] [L1D: 32 KB]
CPUID 00000004: 1C000122-01C0003F-0000003F-00000000 [SL 01] [L1I: 32 KB]
CPUID 00000004: 1C01C143-02C0003F-000007FF-00000000 [SL 02] [L2U: 1536 KB]
CPUID 00000004: 1C03C163-03C0003F-00000FFF-00000006 [SL 03] [L3U: 4 MB]
CPUID 00000005: 00000040-00000040-00000003-11122020
CPUID 00000006: 001F8FF7-00000002-00000009-00000003
CPUID 00000007: 00000000-239422C3-00400104-BC008400 [SL 00]
CPUID 00000008: 00000000-00000000-00000000-00000000
CPUID 00000009: 00000000-00000000-00000000-00000000
CPUID 0000000A: 07300405-00000004-00000007-00008603
CPUID 0000000B: 00000001-00000001-00000100-00000000 [SL 00]
CPUID 0000000B: 00000004-00000005-00000201-00000000 [SL 01]
CPUID 0000000C: 00000000-00000000-00000000-00000000
CPUID 0000000D: 00000003-00000240-00000240-00000000 [SL 00] [x87]
CPUID 0000000D: 0000000F-000002C0-00000100-00000000 [SL 01] [SSE]
CPUID 0000000D: 00000080-00000000-00000001-00000000 [SL 08] [PT]
CPUID 0000000E: 00000000-00000000-00000000-00000000
CPUID 0000000F: 00000000-00000000-00000000-00000000 [SL 00]
CPUID 0000000F: 00000000-00000000-00000000-00000000 [SL 01]
CPUID 00000010: 00000000-00000000-00000000-00000000 [SL 00]
CPUID 00000010: 00000000-00000000-00000000-00000000 [SL 01]
CPUID 00000011: 00000000-00000000-00000000-00000000
CPUID 00000012: 00000000-00000000-00000000-00000000 [SL 00]
CPUID 00000012: 00000000-00000000-00000000-00000000 [SL 01]
CPUID 00000013: 00000000-00000000-00000000-00000000
CPUID 00000014: 00000001-0000000F-80000007-00000000 [SL 00]
CPUID 00000014: 02490002-003F1FFF-00000000-00000000 [SL 01]
CPUID 00000015: 00000002-00000048-0249F000-00000000 [36.00x / 38400000]
CPUID 00000016: 00000578-00000BB8-00000064-00000000 [1400 / 3000 / 100]
CPUID 00000017: 00000000-00000000-00000000-00000000 [SL 00]
CPUID 00000018: 00000005-00000000-00000000-00000000 [SL 00]
CPUID 00000018: 00000000-00300001-00000001-00000121 [SL 01]
CPUID 00000018: 00000000-00040001-00000100-00000043 [SL 02]
CPUID 00000018: 00000000-00040006-00000010-00000043 [SL 03]
CPUID 00000018: 00000000-00300001-00000001-00000122 [SL 04]
CPUID 00000018: 00000000-00000000-00000000-00000000 [SL 05]
CPUID 00000019: 00000000-00000000-00000000-00000000
CPUID 0000001A: 20000000-00000000-00000000-00000000
CPUID 0000001B: 00000000-00000000-00000000-00000000
CPUID 80000000: 80000008-00000000-00000000-00000000
CPUID 80000001: 00000000-00000000-00000101-28100000
CPUID 80000002: 65746E49-2952286C-726F4320-4D542865 [Intel(R) Core(TM]
CPUID 80000003: 35692029-36314C2D-43203747-40205550 [) i5-L16G7 CPU @]
CPUID 80000004: 342E3120-7A484730-00000000-00000000 [ 1.40GHz]
CPUID 80000005: 00000000-00000000-00000000-00000000 [L1D: 0 KB / L1I: 0 KB]
CPUID 80000006: 00000000-00000000-06006040-00000000 [L2: 1536 KB] / L3: 0 KB]
CPUID 80000007: 00000000-00000000-00000000-00000100
CPUID 80000008: 00003027-00000000-00000000-00000000
------[ CPUID Registers / Logical CPU #1 ]------
CPUID 00000000: 0000001B-756E6547-6C65746E-49656E69 [GenuineIntel]
CPUID 00000001: 000806A1-02100800-4FD8EBBF-BFEBFBFF
CPUID 00000002: 00FEFF01-00000000-00000000-00000000
CPUID 00000003: 00000000-00000000-00000000-00000000
CPUID 00000004: 1C000121-01C0003F-0000003F-00000000 [SL 00] [L1D: 32 KB]
CPUID 00000004: 1C000122-01C0003F-0000003F-00000000 [SL 01] [L1I: 32 KB]
CPUID 00000004: 1C01C143-02C0003F-000007FF-00000000 [SL 02] [L2U: 1536 KB]
CPUID 00000004: 1C03C163-03C0003F-00000FFF-00000006 [SL 03] [L3U: 4 MB]
CPUID 00000005: 00000040-00000040-00000003-11122020
CPUID 00000006: 001F8FF7-00000002-00000009-00010003
CPUID 00000007: 00000000-239422C3-00400104-BC008400 [SL 00]
CPUID 00000008: 00000000-00000000-00000000-00000000
CPUID 00000009: 00000000-00000000-00000000-00000000
CPUID 0000000A: 07300405-00000004-00000007-00008603
CPUID 0000000B: 00000001-00000001-00000100-00000002 [SL 00]
CPUID 0000000B: 00000004-00000005-00000201-00000002 [SL 01]
CPUID 0000000C: 00000000-00000000-00000000-00000000
CPUID 0000000D: 00000003-00000240-00000240-00000000 [SL 00] [x87]
CPUID 0000000D: 0000000F-000002C0-00000100-00000000 [SL 01] [SSE]
CPUID 0000000D: 00000080-00000000-00000001-00000000 [SL 08] [PT]
CPUID 0000000E: 00000000-00000000-00000000-00000000
CPUID 0000000F: 00000000-00000000-00000000-00000000 [SL 00]
CPUID 0000000F: 00000000-00000000-00000000-00000000 [SL 01]
CPUID 00000010: 00000000-00000000-00000000-00000000 [SL 00]
CPUID 00000010: 00000000-00000000-00000000-00000000 [SL 01]
CPUID 00000011: 00000000-00000000-00000000-00000000
CPUID 00000012: 00000000-00000000-00000000-00000000 [SL 00]
CPUID 00000012: 00000000-00000000-00000000-00000000 [SL 01]
CPUID 00000013: 00000000-00000000-00000000-00000000
CPUID 00000014: 00000001-0000000F-80000007-00000000 [SL 00]
CPUID 00000014: 02490002-003F1FFF-00000000-00000000 [SL 01]
CPUID 00000015: 00000002-00000048-0249F000-00000000 [36.00x / 38400000]
CPUID 00000016: 00000578-00000BB8-00000064-00000000 [1400 / 3000 / 100]
CPUID 00000017: 00000000-00000000-00000000-00000000 [SL 00]
CPUID 00000018: 00000005-00000000-00000000-00000000 [SL 00]
CPUID 00000018: 00000000-00300001-00000001-00000121 [SL 01]
CPUID 00000018: 00000000-00040001-00000100-00000043 [SL 02]
CPUID 00000018: 00000000-00040006-00000010-00000043 [SL 03]
CPUID 00000018: 00000000-00300001-00000001-00000122 [SL 04]
CPUID 00000018: 00000000-00000000-00000000-00000000 [SL 05]
CPUID 00000019: 00000000-00000000-00000000-00000000
CPUID 0000001A: 20000000-00000000-00000000-00000000
CPUID 0000001B: 00000000-00000000-00000000-00000000
CPUID 80000000: 80000008-00000000-00000000-00000000
CPUID 80000001: 00000000-00000000-00000101-28100000
CPUID 80000002: 65746E49-2952286C-726F4320-4D542865 [Intel(R) Core(TM]
CPUID 80000003: 35692029-36314C2D-43203747-40205550 [) i5-L16G7 CPU @]
CPUID 80000004: 342E3120-7A484730-00000000-00000000 [ 1.40GHz]
CPUID 80000005: 00000000-00000000-00000000-00000000 [L1D: 0 KB / L1I: 0 KB]
CPUID 80000006: 00000000-00000000-06006040-00000000 [L2: 1536 KB] / L3: 0 KB]
CPUID 80000007: 00000000-00000000-00000000-00000100
CPUID 80000008: 00003027-00000000-00000000-00000000
------[ CPUID Registers / Logical CPU #2 ]------
CPUID 00000000: 0000001B-756E6547-6C65746E-49656E69 [GenuineIntel]
CPUID 00000001: 000806A1-04100800-4FD8EBBF-BFEBFBFF
CPUID 00000002: 00FEFF01-00000000-00000000-00000000
CPUID 00000003: 00000000-00000000-00000000-00000000
CPUID 00000004: 1C000121-01C0003F-0000003F-00000000 [SL 00] [L1D: 32 KB]
CPUID 00000004: 1C000122-01C0003F-0000003F-00000000 [SL 01] [L1I: 32 KB]
CPUID 00000004: 1C01C143-02C0003F-000007FF-00000000 [SL 02] [L2U: 1536 KB]
CPUID 00000004: 1C03C163-03C0003F-00000FFF-00000006 [SL 03] [L3U: 4 MB]
CPUID 00000005: 00000040-00000040-00000003-11122020
CPUID 00000006: 001F8FF7-00000002-00000009-00020003
CPUID 00000007: 00000000-239422C3-00400104-BC008400 [SL 00]
CPUID 00000008: 00000000-00000000-00000000-00000000
CPUID 00000009: 00000000-00000000-00000000-00000000
CPUID 0000000A: 07300405-00000004-00000007-00008603
CPUID 0000000B: 00000001-00000001-00000100-00000004 [SL 00]
CPUID 0000000B: 00000004-00000005-00000201-00000004 [SL 01]
CPUID 0000000C: 00000000-00000000-00000000-00000000
CPUID 0000000D: 00000003-00000240-00000240-00000000 [SL 00] [x87]
CPUID 0000000D: 0000000F-000002C0-00000100-00000000 [SL 01] [SSE]
CPUID 0000000D: 00000080-00000000-00000001-00000000 [SL 08] [PT]
CPUID 0000000E: 00000000-00000000-00000000-00000000
CPUID 0000000F: 00000000-00000000-00000000-00000000 [SL 00]
CPUID 0000000F: 00000000-00000000-00000000-00000000 [SL 01]
CPUID 00000010: 00000000-00000000-00000000-00000000 [SL 00]
CPUID 00000010: 00000000-00000000-00000000-00000000 [SL 01]
CPUID 00000011: 00000000-00000000-00000000-00000000
CPUID 00000012: 00000000-00000000-00000000-00000000 [SL 00]
CPUID 00000012: 00000000-00000000-00000000-00000000 [SL 01]
CPUID 00000013: 00000000-00000000-00000000-00000000
CPUID 00000014: 00000001-0000000F-80000007-00000000 [SL 00]
CPUID 00000014: 02490002-003F1FFF-00000000-00000000 [SL 01]
CPUID 00000015: 00000002-00000048-0249F000-00000000 [36.00x / 38400000]
CPUID 00000016: 00000578-00000BB8-00000064-00000000 [1400 / 3000 / 100]
CPUID 00000017: 00000000-00000000-00000000-00000000 [SL 00]
CPUID 00000018: 00000005-00000000-00000000-00000000 [SL 00]
CPUID 00000018: 00000000-00300001-00000001-00000121 [SL 01]
CPUID 00000018: 00000000-00040001-00000100-00000043 [SL 02]
CPUID 00000018: 00000000-00040006-00000010-00000043 [SL 03]
CPUID 00000018: 00000000-00300001-00000001-00000122 [SL 04]
CPUID 00000018: 00000000-00000000-00000000-00000000 [SL 05]
CPUID 00000019: 00000000-00000000-00000000-00000000
CPUID 0000001A: 20000000-00000000-00000000-00000000
CPUID 0000001B: 00000000-00000000-00000000-00000000
CPUID 80000000: 80000008-00000000-00000000-00000000
CPUID 80000001: 00000000-00000000-00000101-28100000
CPUID 80000002: 65746E49-2952286C-726F4320-4D542865 [Intel(R) Core(TM]
CPUID 80000003: 35692029-36314C2D-43203747-40205550 [) i5-L16G7 CPU @]
CPUID 80000004: 342E3120-7A484730-00000000-00000000 [ 1.40GHz]
CPUID 80000005: 00000000-00000000-00000000-00000000 [L1D: 0 KB / L1I: 0 KB]
CPUID 80000006: 00000000-00000000-06006040-00000000 [L2: 1536 KB] / L3: 0 KB]
CPUID 80000007: 00000000-00000000-00000000-00000100
CPUID 80000008: 00003027-00000000-00000000-00000000
------[ CPUID Registers / Logical CPU #3 ]------
CPUID 00000000: 0000001B-756E6547-6C65746E-49656E69 [GenuineIntel]
CPUID 00000001: 000806A1-06100800-4FD8EBBF-BFEBFBFF
CPUID 00000002: 00FEFF01-00000000-00000000-00000000
CPUID 00000003: 00000000-00000000-00000000-00000000
CPUID 00000004: 1C000121-01C0003F-0000003F-00000000 [SL 00] [L1D: 32 KB]
CPUID 00000004: 1C000122-01C0003F-0000003F-00000000 [SL 01] [L1I: 32 KB]
CPUID 00000004: 1C01C143-02C0003F-000007FF-00000000 [SL 02] [L2U: 1536 KB]
CPUID 00000004: 1C03C163-03C0003F-00000FFF-00000006 [SL 03] [L3U: 4 MB]
CPUID 00000005: 00000040-00000040-00000003-11122020
CPUID 00000006: 001F8FF7-00000002-00000009-00030003
CPUID 00000007: 00000000-239422C3-00400104-BC008400 [SL 00]
CPUID 00000008: 00000000-00000000-00000000-00000000
CPUID 00000009: 00000000-00000000-00000000-00000000
CPUID 0000000A: 07300405-00000004-00000007-00008603
CPUID 0000000B: 00000001-00000001-00000100-00000006 [SL 00]
CPUID 0000000B: 00000004-00000005-00000201-00000006 [SL 01]
CPUID 0000000C: 00000000-00000000-00000000-00000000
CPUID 0000000D: 00000003-00000240-00000240-00000000 [SL 00] [x87]
CPUID 0000000D: 0000000F-000002C0-00000100-00000000 [SL 01] [SSE]
CPUID 0000000D: 00000080-00000000-00000001-00000000 [SL 08] [PT]
CPUID 0000000E: 00000000-00000000-00000000-00000000
CPUID 0000000F: 00000000-00000000-00000000-00000000 [SL 00]
CPUID 0000000F: 00000000-00000000-00000000-00000000 [SL 01]
CPUID 00000010: 00000000-00000000-00000000-00000000 [SL 00]
CPUID 00000010: 00000000-00000000-00000000-00000000 [SL 01]
CPUID 00000011: 00000000-00000000-00000000-00000000
CPUID 00000012: 00000000-00000000-00000000-00000000 [SL 00]
CPUID 00000012: 00000000-00000000-00000000-00000000 [SL 01]
CPUID 00000013: 00000000-00000000-00000000-00000000
CPUID 00000014: 00000001-0000000F-80000007-00000000 [SL 00]
CPUID 00000014: 02490002-003F1FFF-00000000-00000000 [SL 01]
CPUID 00000015: 00000002-00000048-0249F000-00000000 [36.00x / 38400000]
CPUID 00000016: 00000578-00000BB8-00000064-00000000 [1400 / 3000 / 100]
CPUID 00000017: 00000000-00000000-00000000-00000000 [SL 00]
CPUID 00000018: 00000005-00000000-00000000-00000000 [SL 00]
CPUID 00000018: 00000000-00300001-00000001-00000121 [SL 01]
CPUID 00000018: 00000000-00040001-00000100-00000043 [SL 02]
CPUID 00000018: 00000000-00040006-00000010-00000043 [SL 03]
CPUID 00000018: 00000000-00300001-00000001-00000122 [SL 04]
CPUID 00000018: 00000000-00000000-00000000-00000000 [SL 05]
CPUID 00000019: 00000000-00000000-00000000-00000000
CPUID 0000001A: 20000000-00000000-00000000-00000000
CPUID 0000001B: 00000000-00000000-00000000-00000000
CPUID 80000000: 80000008-00000000-00000000-00000000
CPUID 80000001: 00000000-00000000-00000101-28100000
CPUID 80000002: 65746E49-2952286C-726F4320-4D542865 [Intel(R) Core(TM]
CPUID 80000003: 35692029-36314C2D-43203747-40205550 [) i5-L16G7 CPU @]
CPUID 80000004: 342E3120-7A484730-00000000-00000000 [ 1.40GHz]
CPUID 80000005: 00000000-00000000-00000000-00000000 [L1D: 0 KB / L1I: 0 KB]
CPUID 80000006: 00000000-00000000-06006040-00000000 [L2: 1536 KB] / L3: 0 KB]
CPUID 80000007: 00000000-00000000-00000000-00000100
CPUID 80000008: 00003027-00000000-00000000-00000000
------[ CPUID Registers / Logical CPU #4 ]------
CPUID 00000000: 0000001B-756E6547-6C65746E-49656E69 [GenuineIntel]
CPUID 00000001: 000806A1-08100800-4FD8EBBF-BFEBFBFF
CPUID 00000002: 00FEFF01-000000F0-00000000-00000000
CPUID 00000003: 00000000-00000000-00000000-00000000
CPUID 00000004: 1C004121-02C0003F-0000003F-00000000 [SL 00] [L1D: 48 KB]
CPUID 00000004: 1C004122-01C0003F-0000003F-00000000 [SL 01] [L1I: 32 KB]
CPUID 00000004: 1C004143-01C0003F-000003FF-00000000 [SL 02] [L2U: 512 KB]
CPUID 00000004: 1C03C163-03C0003F-00000FFF-00000006 [SL 03] [L3U: 4 MB]
CPUID 00000005: 00000040-00000040-00000003-11122020
CPUID 00000006: 001F8FF7-00000002-00000001-00040003
CPUID 00000007: 00000000-239422C3-00400104-BC008400 [SL 00]
CPUID 00000008: 00000000-00000000-00000000-00000000
CPUID 00000009: 00000000-00000000-00000000-00000000
CPUID 0000000A: 07300405-00000004-00000007-00008603
CPUID 0000000B: 00000001-00000001-00000100-00000008 [SL 00]
CPUID 0000000B: 00000004-00000005-00000201-00000008 [SL 01]
CPUID 0000000C: 00000000-00000000-00000000-00000000
CPUID 0000000D: 00000003-00000240-00000240-00000000 [SL 00] [x87]
CPUID 0000000D: 0000000F-000002C0-00000100-00000000 [SL 01] [SSE]
CPUID 0000000D: 00000080-00000000-00000001-00000000 [SL 08] [PT]
CPUID 0000000E: 00000000-00000000-00000000-00000000
CPUID 0000000F: 00000000-00000000-00000000-00000000 [SL 00]
CPUID 0000000F: 00000000-00000000-00000000-00000000 [SL 01]
CPUID 00000010: 00000000-00000000-00000000-00000000 [SL 00]
CPUID 00000010: 00000000-00000000-00000000-00000000 [SL 01]
CPUID 00000011: 00000000-00000000-00000000-00000000
CPUID 00000012: 00000000-00000000-00000000-00000000 [SL 00]
CPUID 00000012: 00000000-00000000-00000000-00000000 [SL 01]
CPUID 00000013: 00000000-00000000-00000000-00000000
CPUID 00000014: 00000001-0000000F-00000007-00000000 [SL 00]
CPUID 00000014: 02490002-003F1FFF-00000000-00000000 [SL 01]
CPUID 00000015: 00000002-00000048-0249F000-00000000 [36.00x / 38400000]
CPUID 00000016: 00000578-00000BB8-00000064-00000000 [1400 / 3000 / 100]
CPUID 00000017: 00000000-00000000-00000000-00000000 [SL 00]
CPUID 00000018: 00000007-00000000-00000000-00000000 [SL 00]
CPUID 00000018: 00000000-00080007-00000001-00004122 [SL 01]
CPUID 00000018: 00000000-00100007-00000001-00004125 [SL 02]
CPUID 00000018: 00000000-00040001-00000010-00004024 [SL 03]
CPUID 00000018: 00000000-00040006-00000008-00004024 [SL 04]
CPUID 00000018: 00000000-00000000-00000000-00000000 [SL 05]
CPUID 00000018: 00000000-00080007-00000080-00004043 [SL 06]
CPUID 00000018: 00000000-00080001-00000080-00004043 [SL 07]
CPUID 00000019: 00000000-00000000-00000000-00000000
CPUID 0000001A: 40000000-00000000-00000000-00000000
CPUID 0000001B: 00000000-00000000-00000000-00000000
CPUID 80000000: 80000008-00000000-00000000-00000000
CPUID 80000001: 00000000-00000000-00000101-28100000
CPUID 80000002: 65746E49-2952286C-726F4320-4D542865 [Intel(R) Core(TM]
CPUID 80000003: 35692029-36314C2D-43203747-40205550 [) i5-L16G7 CPU @]
CPUID 80000004: 342E3120-7A484730-00000000-00000000 [ 1.40GHz]
CPUID 80000005: 00000000-00000000-00000000-00000000 [L1D: 0 KB / L1I: 0 KB]
CPUID 80000006: 00000000-00000000-01006040-00000000 [L2: 256 KB] / L3: 0 KB]
CPUID 80000007: 00000000-00000000-00000000-00000100
CPUID 80000008: 00003027-00000000-00000000-00000000
--------------------------------------------------------------------------------
x86
efficiency
6
10
1
6
138
4
4
32
32
1536
4096
-1
8
8
12
16
-1
64
64
64
64
-1
4
4
1
1
0
128 (non-authoritative)
Lakefield (Core i5)
fpu vme de pse tsc msr pae mce cx8 apic mtrr sep pge mca cmov pat pse36 clflush dts acpi mmx fxsr sse sse2 ss ht tm pbe pni pclmul dts64 monitor ds_cpl vmx est tm2 ssse3 cx16 xtpr pdcm sse4_1 sse4_2 xd movbe popcnt aes xsave osxsave rdtscp lm lahf_lm constant_tsc rdrand sha_ni rdseed
--------------------------------------------------------------------------------
x86
performance
6
10
1
6
138
1
1
48
32
512
4096
-1
12
8
8
16
-1
64
64
64
64
-1
1
1
1
1
0
128 (non-authoritative)
Lakefield (Core i5)
fpu vme de pse tsc msr pae mce cx8 apic mtrr sep pge mca cmov pat pse36 clflush dts acpi mmx fxsr sse sse2 ss ht tm pbe pni pclmul dts64 monitor ds_cpl vmx est tm2 ssse3 cx16 xtpr pdcm sse4_1 sse4_2 xd movbe popcnt aes xsave osxsave rdtscp lm lahf_lm constant_tsc rdrand sha_ni rdseed
