------[ Logical CPU #0 ]------
CPUID 00000000: 0000000D-746E6543-736C7561-48727561 [CentaurHauls]
CPUID 00000001: 000006FE-00040800-76DA63AB-BFCBFBFF
CPUID 00000002: 00000001-00000000-00000000-00000000
CPUID 00000003: 00000000-00000000-00000000-00000000
CPUID 00000004: 0C000121-01C0003F-0000003F-00000000 [SL 00] [L1D: 32 KB]
CPUID 00000004: 0C000122-01C0003F-0000003F-00000000 [SL 01] [L1I: 32 KB]
CPUID 00000004: 0C00C143-03C0003F-000007FF-00000000 [SL 02] [L2U: 2 MB]
CPUID 00000005: 00000040-00000040-00000003-00022220
CPUID 00000006: 00000003-00000000-00000000-00000000
CPUID 00000007: 00000000-000C25AB-00000000-00000000
CPUID 00000008: 00000000-00000000-00000000-00000000
CPUID 00000009: 00000000-00000000-00000000-00000000
CPUID 0000000A: 06280202-00000000-00000000-00000503
CPUID 0000000B: 00000000-00000001-00000100-00000000 [SL 00]
CPUID 0000000B: 00000002-00000004-00000201-00000000 [SL 01]
CPUID 0000000C: 00000000-00000000-00000000-00000000
CPUID 0000000D: 00000007-00000240-00000340-00000000 [SL 00] [x87]
CPUID 0000000D: 00000001-00000000-00000000-00000000 [SL 01] [SSE]
CPUID 0000000D: 00000100-00000240-00000000-00000000 [SL 02] [AVX]
CPUID 80000000: 80000008-00000000-00000000-00000000
CPUID 80000001: 00000000-00000000-00000121-2C100800
CPUID 80000002: 20202020-20202020-20202020-4F41485A [            ZHAO]
CPUID 80000003: 204E4958-5869614B-206E6169-432D585A [XIN KaiXian ZX-C]
CPUID 80000004: 3443202B-40303835-33382E31-007A4847 [+ C4580@1.83GHz]
CPUID 80000005: 04200420-06600660-20080140-20080140 [L1D: 32 KB / L1I: 32 KB]
CPUID 80000006: 00000000-00000000-08008140-00000000 [L2: 2048 KB] / L3: 0 KB]
CPUID 80000007: 00000000-00000000-00000000-00000000
CPUID 80000008: 00003024-00000000-00000000-00000000
CPUID C0000000: C0000004-00000000-00000000-00000000
CPUID C0000001: 000006FE-00000000-00000000-1EC33DFC
CPUID C0000002: 00000000-00000000-00000000-00000000
CPUID C0000003: 00000000-00000000-00000000-00000000
CPUID C0000004: 00000028-08000B5C-08510B5B-00000000
------[ Logical CPU #1 ]------
CPUID 00000000: 0000000D-746E6543-736C7561-48727561 [CentaurHauls]
CPUID 00000001: 000006FE-01040800-76DA63AB-BFCBFBFF
CPUID 00000002: 00000001-00000000-00000000-00000000
CPUID 00000003: 00000000-00000000-00000000-00000000
CPUID 00000004: 0C000121-01C0003F-0000003F-00000000 [SL 00] [L1D: 32 KB]
CPUID 00000004: 0C000122-01C0003F-0000003F-00000000 [SL 01] [L1I: 32 KB]
CPUID 00000004: 0C00C143-03C0003F-000007FF-00000000 [SL 02] [L2U: 2 MB]
CPUID 00000005: 00000040-00000040-00000003-00022220
CPUID 00000006: 00000003-00000000-00000000-00000000
CPUID 00000007: 00000000-000C25AB-00000000-00000000
CPUID 00000008: 00000000-00000000-00000000-00000000
CPUID 00000009: 00000000-00000000-00000000-00000000
CPUID 0000000A: 06280202-00000000-00000000-00000503
CPUID 0000000B: 00000000-00000001-00000100-00000001 [SL 00]
CPUID 0000000B: 00000002-00000004-00000201-00000001 [SL 01]
CPUID 0000000C: 00000000-00000000-00000000-00000000
CPUID 0000000D: 00000007-00000240-00000340-00000000 [SL 00] [x87]
CPUID 0000000D: 00000001-00000000-00000000-00000000 [SL 01] [SSE]
CPUID 0000000D: 00000100-00000240-00000000-00000000 [SL 02] [AVX]
CPUID 80000000: 80000008-00000000-00000000-00000000
CPUID 80000001: 00000000-00000000-00000121-2C100800
CPUID 80000002: 20202020-20202020-20202020-4F41485A [            ZHAO]
CPUID 80000003: 204E4958-5869614B-206E6169-432D585A [XIN KaiXian ZX-C]
CPUID 80000004: 3443202B-40303835-33382E31-007A4847 [+ C4580@1.83GHz]
CPUID 80000005: 04200420-06600660-20080140-20080140 [L1D: 32 KB / L1I: 32 KB]
CPUID 80000006: 00000000-00000000-08008140-00000000 [L2: 2048 KB] / L3: 0 KB]
CPUID 80000007: 00000000-00000000-00000000-00000000
CPUID 80000008: 00003024-00000000-00000000-00000000
CPUID C0000000: C0000004-00000000-00000000-00000000
CPUID C0000001: 000006FE-00000000-00000000-1EC33DFC
CPUID C0000002: 00000000-00000000-00000000-00000000
CPUID C0000003: 00000000-00000000-00000000-00000000
CPUID C0000004: 00000028-08000B5C-08510B5B-00000000
------[ Logical CPU #2 ]------
CPUID 00000000: 0000000D-746E6543-736C7561-48727561 [CentaurHauls]
CPUID 00000001: 000006FE-02040800-76DA63AB-BFCBFBFF
CPUID 00000002: 00000001-00000000-00000000-00000000
CPUID 00000003: 00000000-00000000-00000000-00000000
CPUID 00000004: 0C000121-01C0003F-0000003F-00000000 [SL 00] [L1D: 32 KB]
CPUID 00000004: 0C000122-01C0003F-0000003F-00000000 [SL 01] [L1I: 32 KB]
CPUID 00000004: 0C00C143-03C0003F-000007FF-00000000 [SL 02] [L2U: 2 MB]
CPUID 00000005: 00000040-00000040-00000003-00022220
CPUID 00000006: 00000003-00000000-00000000-00000000
CPUID 00000007: 00000000-000C25AB-00000000-00000000
CPUID 00000008: 00000000-00000000-00000000-00000000
CPUID 00000009: 00000000-00000000-00000000-00000000
CPUID 0000000A: 06280202-00000000-00000000-00000503
CPUID 0000000B: 00000000-00000001-00000100-00000002 [SL 00]
CPUID 0000000B: 00000002-00000004-00000201-00000002 [SL 01]
CPUID 0000000C: 00000000-00000000-00000000-00000000
CPUID 0000000D: 00000007-00000240-00000340-00000000 [SL 00] [x87]
CPUID 0000000D: 00000001-00000000-00000000-00000000 [SL 01] [SSE]
CPUID 0000000D: 00000100-00000240-00000000-00000000 [SL 02] [AVX]
CPUID 80000000: 80000008-00000000-00000000-00000000
CPUID 80000001: 00000000-00000000-00000121-2C100800
CPUID 80000002: 20202020-20202020-20202020-4F41485A [            ZHAO]
CPUID 80000003: 204E4958-5869614B-206E6169-432D585A [XIN KaiXian ZX-C]
CPUID 80000004: 3443202B-40303835-33382E31-007A4847 [+ C4580@1.83GHz]
CPUID 80000005: 04200420-06600660-20080140-20080140 [L1D: 32 KB / L1I: 32 KB]
CPUID 80000006: 00000000-00000000-08008140-00000000 [L2: 2048 KB] / L3: 0 KB]
CPUID 80000007: 00000000-00000000-00000000-00000000
CPUID 80000008: 00003024-00000000-00000000-00000000
CPUID C0000000: C0000004-00000000-00000000-00000000
CPUID C0000001: 000006FE-00000000-00000000-1EC33DFC
CPUID C0000002: 00000000-00000000-00000000-00000000
CPUID C0000003: 00000000-00000000-00000000-00000000
CPUID C0000004: 00000028-08000B5C-08510B5B-00000000
------[ Logical CPU #3 ]------
CPUID 00000000: 0000000D-746E6543-736C7561-48727561 [CentaurHauls]
CPUID 00000001: 000006FE-03040800-76DA63AB-BFCBFBFF
CPUID 00000002: 00000001-00000000-00000000-00000000
CPUID 00000003: 00000000-00000000-00000000-00000000
CPUID 00000004: 0C000121-01C0003F-0000003F-00000000 [SL 00] [L1D: 32 KB]
CPUID 00000004: 0C000122-01C0003F-0000003F-00000000 [SL 01] [L1I: 32 KB]
CPUID 00000004: 0C00C143-03C0003F-000007FF-00000000 [SL 02] [L2U: 2 MB]
CPUID 00000005: 00000040-00000040-00000003-00022220
CPUID 00000006: 00000003-00000000-00000000-00000000
CPUID 00000007: 00000000-000C25AB-00000000-00000000
CPUID 00000008: 00000000-00000000-00000000-00000000
CPUID 00000009: 00000000-00000000-00000000-00000000
CPUID 0000000A: 06280202-00000000-00000000-00000503
CPUID 0000000B: 00000000-00000001-00000100-00000003 [SL 00]
CPUID 0000000B: 00000002-00000004-00000201-00000003 [SL 01]
CPUID 0000000C: 00000000-00000000-00000000-00000000
CPUID 0000000D: 00000007-00000240-00000340-00000000 [SL 00] [x87]
CPUID 0000000D: 00000001-00000000-00000000-00000000 [SL 01] [SSE]
CPUID 0000000D: 00000100-00000240-00000000-00000000 [SL 02] [AVX]
CPUID 80000000: 80000008-00000000-00000000-00000000
CPUID 80000001: 00000000-00000000-00000121-2C100800
CPUID 80000002: 20202020-20202020-20202020-4F41485A [            ZHAO]
CPUID 80000003: 204E4958-5869614B-206E6169-432D585A [XIN KaiXian ZX-C]
CPUID 80000004: 3443202B-40303835-33382E31-007A4847 [+ C4580@1.83GHz]
CPUID 80000005: 04200420-06600660-20080140-20080140 [L1D: 32 KB / L1I: 32 KB]
CPUID 80000006: 00000000-00000000-08008140-00000000 [L2: 2048 KB] / L3: 0 KB]
CPUID 80000007: 00000000-00000000-00000000-00000000
CPUID 80000008: 00003024-00000000-00000000-00000000
CPUID C0000000: C0000004-00000000-00000000-00000000
CPUID C0000001: 000006FE-00000000-00000000-1EC33DFC
CPUID C0000002: 00000000-00000000-00000000-00000000
CPUID C0000003: 00000000-00000000-00000000-00000000
CPUID C0000004: 00000028-08000B5C-08510B5B-00000000
--------------------------------------------------------------------------------
x86
general
6
15
14
6
15
4
4
32
32
2048
-1
-1
8
8
16
-1
-1
64
64
64
-1
-1
-1
-1
-1
-1
-1
-1 (non-authoritative)
Zhaoxin KaiXian (ZhangJiang)
fpu vme de pse tsc msr pae mce cx8 apic mtrr sep pge mca cmov pat pse36 clflush mmx fxsr sse sse2 ht pni pclmul monitor ssse3 cx16 sse4_1 sse4_2 syscall movbe popcnt aes xsave avx rdtscp lm lahf_lm abm f16c rdrand avx2 bmi1 bmi2 rdseed adx
