basic_cpuid[0]=00000002 756e6547 6c65746e 49656e69
basic_cpuid[1]=00000f25 0602080b 00004400 bfebfbff
basic_cpuid[2]=665b5001 00000000 00000000 007b7040
basic_cpuid[3]=665b5001 00000000 00000000 007b7040
basic_cpuid[4]=665b5001 00000000 00000000 007b7040
basic_cpuid[5]=665b5001 00000000 00000000 007b7040
basic_cpuid[6]=665b5001 00000000 00000000 007b7040
basic_cpuid[7]=665b5001 00000000 00000000 007b7040
basic_cpuid[8]=665b5001 00000000 00000000 007b7040
basic_cpuid[9]=665b5001 00000000 00000000 007b7040
basic_cpuid[10]=665b5001 00000000 00000000 007b7040
basic_cpuid[11]=665b5001 00000000 00000000 007b7040
basic_cpuid[12]=665b5001 00000000 00000000 007b7040
basic_cpuid[13]=665b5001 00000000 00000000 007b7040
basic_cpuid[14]=665b5001 00000000 00000000 007b7040
basic_cpuid[15]=665b5001 00000000 00000000 007b7040
basic_cpuid[16]=665b5001 00000000 00000000 007b7040
basic_cpuid[17]=665b5001 00000000 00000000 007b7040
basic_cpuid[18]=665b5001 00000000 00000000 007b7040
basic_cpuid[19]=665b5001 00000000 00000000 007b7040
basic_cpuid[20]=665b5001 00000000 00000000 007b7040
basic_cpuid[21]=665b5001 00000000 00000000 007b7040
basic_cpuid[22]=665b5001 00000000 00000000 007b7040
basic_cpuid[23]=665b5001 00000000 00000000 007b7040
basic_cpuid[24]=665b5001 00000000 00000000 007b7040
basic_cpuid[25]=665b5001 00000000 00000000 007b7040
basic_cpuid[26]=665b5001 00000000 00000000 007b7040
basic_cpuid[27]=665b5001 00000000 00000000 007b7040
basic_cpuid[28]=665b5001 00000000 00000000 007b7040
basic_cpuid[29]=665b5001 00000000 00000000 007b7040
basic_cpuid[30]=665b5001 00000000 00000000 007b7040
basic_cpuid[31]=665b5001 00000000 00000000 007b7040
ext_cpuid[0]=80000004 00000000 00000000 00000000
ext_cpuid[1]=00000000 00000000 00000000 00000000
ext_cpuid[2]=20202020 20202020 20202020 20202020
ext_cpuid[3]=6e492020 286c6574 58202952 286e6f65
ext_cpuid[4]=20294d54 20555043 30342e32 007a4847
ext_cpuid[5]=665b5001 00000000 00000000 007b7040
ext_cpuid[6]=665b5001 00000000 00000000 007b7040
ext_cpuid[7]=665b5001 00000000 00000000 007b7040
ext_cpuid[8]=665b5001 00000000 00000000 007b7040
ext_cpuid[9]=665b5001 00000000 00000000 007b7040
ext_cpuid[10]=665b5001 00000000 00000000 007b7040
ext_cpuid[11]=665b5001 00000000 00000000 007b7040
ext_cpuid[12]=665b5001 00000000 00000000 007b7040
ext_cpuid[13]=665b5001 00000000 00000000 007b7040
ext_cpuid[14]=665b5001 00000000 00000000 007b7040
ext_cpuid[15]=665b5001 00000000 00000000 007b7040
ext_cpuid[16]=665b5001 00000000 00000000 007b7040
ext_cpuid[17]=665b5001 00000000 00000000 007b7040
ext_cpuid[18]=665b5001 00000000 00000000 007b7040
ext_cpuid[19]=665b5001 00000000 00000000 007b7040
ext_cpuid[20]=665b5001 00000000 00000000 007b7040
ext_cpuid[21]=665b5001 00000000 00000000 007b7040
ext_cpuid[22]=665b5001 00000000 00000000 007b7040
ext_cpuid[23]=665b5001 00000000 00000000 007b7040
ext_cpuid[24]=665b5001 00000000 00000000 007b7040
ext_cpuid[25]=665b5001 00000000 00000000 007b7040
ext_cpuid[26]=665b5001 00000000 00000000 007b7040
ext_cpuid[27]=665b5001 00000000 00000000 007b7040
ext_cpuid[28]=665b5001 00000000 00000000 007b7040
ext_cpuid[29]=665b5001 00000000 00000000 007b7040
ext_cpuid[30]=665b5001 00000000 00000000 007b7040
ext_cpuid[31]=665b5001 00000000 00000000 007b7040
intel_fn4[0]=665b5001 00000000 00000000 007b7040
intel_fn4[1]=665b5001 00000000 00000000 007b7040
intel_fn4[2]=665b5001 00000000 00000000 007b7040
intel_fn4[3]=665b5001 00000000 00000000 007b7040
--------------------------------------------------------------------------------
15
2
5
15
2
1
2
8
12
512
0
4
8
-1
64
64
-1
Xeon (Prestonia)
fpu vme de pse tsc msr pae mce cx8 apic mtrr sep pge mca cmov pat pse36 clflush dts acpi mmx fxsr sse sse2 ss ht tm pbe cid xtpr
--------------------------------------------------------------------------------
basic_cpuid[0]=00000001 68747541 444d4163 69746e65
basic_cpuid[1]=00020f32 01020800 00000001 178bfbff
basic_cpuid[2]=00000000 00000000 00000000 00000000
basic_cpuid[3]=00000000 00000000 00000000 00000000
basic_cpuid[4]=00000000 00000000 00000000 00000000
basic_cpuid[5]=00000000 00000000 00000000 00000000
basic_cpuid[6]=00000000 00000000 00000000 00000000
basic_cpuid[7]=00000000 00000000 00000000 00000000
basic_cpuid[8]=00000000 00000000 00000000 00000000
basic_cpuid[9]=00000000 00000000 00000000 00000000
basic_cpuid[10]=00000000 00000000 00000000 00000000
basic_cpuid[11]=00000000 00000000 00000000 00000000
basic_cpuid[12]=00000000 00000000 00000000 00000000
basic_cpuid[13]=00000000 00000000 00000000 00000000
basic_cpuid[14]=00000000 00000000 00000000 00000000
basic_cpuid[15]=00000000 00000000 00000000 00000000
basic_cpuid[16]=00000000 00000000 00000000 00000000
basic_cpuid[17]=00000000 00000000 00000000 00000000
basic_cpuid[18]=00000000 00000000 00000000 00000000
basic_cpuid[19]=00000000 00000000 00000000 00000000
basic_cpuid[20]=00000000 00000000 00000000 00000000
basic_cpuid[21]=00000000 00000000 00000000 00000000
basic_cpuid[22]=00000000 00000000 00000000 00000000
basic_cpuid[23]=00000000 00000000 00000000 00000000
basic_cpuid[24]=00000000 00000000 00000000 00000000
basic_cpuid[25]=00000000 00000000 00000000 00000000
basic_cpuid[26]=00000000 00000000 00000000 00000000
basic_cpuid[27]=00000000 00000000 00000000 00000000
basic_cpuid[28]=00000000 00000000 00000000 00000000
basic_cpuid[29]=00000000 00000000 00000000 00000000
basic_cpuid[30]=00000000 00000000 00000000 00000000
basic_cpuid[31]=00000000 00000000 00000000 00000000
ext_cpuid[0]=80000018 68747541 444d4163 69746e65
ext_cpuid[1]=00020f32 00000b04 00000003 e3d3fbff
ext_cpuid[2]=6c617544 726f4320 4d412065 704f2044
ext_cpuid[3]=6f726574 6d74286e 72502029 7365636f
ext_cpuid[4]=20726f73 00353631 00000000 00000000
ext_cpuid[5]=ff08ff08 ff20ff20 40020140 40020140
ext_cpuid[6]=00000000 42004200 04008140 00000000
ext_cpuid[7]=00000000 00000000 00000000 0000000f
ext_cpuid[8]=00003028 00000000 00000001 00000000
ext_cpuid[9]=00000000 00000000 00000000 00000000
ext_cpuid[10]=00000000 00000000 00000000 00000000
ext_cpuid[11]=00000000 00000000 00000000 00000000
ext_cpuid[12]=00000000 00000000 00000000 00000000
ext_cpuid[13]=00000000 00000000 00000000 00000000
ext_cpuid[14]=00000000 00000000 00000000 00000000
ext_cpuid[15]=00000000 00000000 00000000 00000000
ext_cpuid[16]=00000000 00000000 00000000 00000000
ext_cpuid[17]=00000000 00000000 00000000 00000000
ext_cpuid[18]=00000000 00000000 00000000 00000000
ext_cpuid[19]=00000000 00000000 00000000 00000000
ext_cpuid[20]=00000000 00000000 00000000 00000000
ext_cpuid[21]=00000000 00000000 00000000 00000000
ext_cpuid[22]=00000000 00000000 00000000 00000000
ext_cpuid[23]=00000000 00000000 00000000 00000000
ext_cpuid[24]=00000000 00000000 00000000 00000000
ext_cpuid[25]=00000000 00000000 00000000 00000000
ext_cpuid[26]=00000000 00000000 00000000 00000000
ext_cpuid[27]=00000000 00000000 00000000 00000000
ext_cpuid[28]=00000000 00000000 00000000 00000000
ext_cpuid[29]=00000000 00000000 00000000 00000000
ext_cpuid[30]=00000000 00000000 00000000 00000000
ext_cpuid[31]=00000000 00000000 00000000 00000000
intel_fn4[0]=00000000 00000000 00000000 00000000
intel_fn4[1]=00000000 00000000 00000000 00000000
intel_fn4[2]=00000000 00000000 00000000 00000000
intel_fn4[3]=00000000 00000000 00000000 00000000
--------------------------------------------------------------------------------
15
3
2
15
35
2
2
64
64
1024
0
2
16
-1
64
64
-1
Opteron (Dual Core)
fpu vme de pse tsc msr pae mce cx8 apic mtrr sep pge mca cmov pat pse36 clflush mmx fxsr sse sse2 ht pni syscall mmxext 3dnow 3dnowext nx fxsr_opt lm lahf_lm cmp_legacy ts fid vid ttp
--------------------------------------------------------------------------------
basic_cpuid[0]=0000000a 756e6547 6c65746e 49656e69
basic_cpuid[1]=000006f6 00020800 0000e3bd bfebfbff
basic_cpuid[2]=05b0b101 005657f0 00000000 2cb43049
basic_cpuid[3]=00000000 00000000 00000000 00000000
basic_cpuid[4]=04000121 01c0003f 0000003f 00000001
basic_cpuid[5]=00000040 00000040 00000003 00000020
basic_cpuid[6]=00000001 00000002 00000001 00000000
basic_cpuid[7]=00000000 00000000 00000000 00000000
basic_cpuid[8]=00000400 00000000 00000000 00000000
basic_cpuid[9]=00000000 00000000 00000000 00000000
basic_cpuid[10]=07280202 00000000 00000000 00000000
basic_cpuid[11]=07280202 00000000 00000000 00000000
basic_cpuid[12]=07280202 00000000 00000000 00000000
basic_cpuid[13]=07280202 00000000 00000000 00000000
basic_cpuid[14]=07280202 00000000 00000000 00000000
basic_cpuid[15]=07280202 00000000 00000000 00000000
basic_cpuid[16]=07280202 00000000 00000000 00000000
basic_cpuid[17]=07280202 00000000 00000000 00000000
basic_cpuid[18]=07280202 00000000 00000000 00000000
basic_cpuid[19]=07280202 00000000 00000000 00000000
basic_cpuid[20]=07280202 00000000 00000000 00000000
basic_cpuid[21]=07280202 00000000 00000000 00000000
basic_cpuid[22]=07280202 00000000 00000000 00000000
basic_cpuid[23]=07280202 00000000 00000000 00000000
basic_cpuid[24]=07280202 00000000 00000000 00000000
basic_cpuid[25]=07280202 00000000 00000000 00000000
basic_cpuid[26]=07280202 00000000 00000000 00000000
basic_cpuid[27]=07280202 00000000 00000000 00000000
basic_cpuid[28]=07280202 00000000 00000000 00000000
basic_cpuid[29]=07280202 00000000 00000000 00000000
basic_cpuid[30]=07280202 00000000 00000000 00000000
basic_cpuid[31]=07280202 00000000 00000000 00000000
ext_cpuid[0]=80000008 00000000 00000000 00000000
ext_cpuid[1]=00000000 00000000 00000001 20100000
ext_cpuid[2]=65746e49 2952286c 726f4320 4d542865
ext_cpuid[3]=43203229 20205550 20202020 20202020
ext_cpuid[4]=30323436 20402020 33312e32 007a4847
ext_cpuid[5]=00000000 00000000 00000000 00000000
ext_cpuid[6]=00000000 00000000 10008040 00000000
ext_cpuid[7]=00000000 00000000 00000000 00000000
ext_cpuid[8]=00003024 00000000 00000000 00000000
ext_cpuid[9]=07280202 00000000 00000000 00000000
ext_cpuid[10]=07280202 00000000 00000000 00000000
ext_cpuid[11]=07280202 00000000 00000000 00000000
ext_cpuid[12]=07280202 00000000 00000000 00000000
ext_cpuid[13]=07280202 00000000 00000000 00000000
ext_cpuid[14]=07280202 00000000 00000000 00000000
ext_cpuid[15]=07280202 00000000 00000000 00000000
ext_cpuid[16]=07280202 00000000 00000000 00000000
ext_cpuid[17]=07280202 00000000 00000000 00000000
ext_cpuid[18]=07280202 00000000 00000000 00000000
ext_cpuid[19]=07280202 00000000 00000000 00000000
ext_cpuid[20]=07280202 00000000 00000000 00000000
ext_cpuid[21]=07280202 00000000 00000000 00000000
ext_cpuid[22]=07280202 00000000 00000000 00000000
ext_cpuid[23]=07280202 00000000 00000000 00000000
ext_cpuid[24]=07280202 00000000 00000000 00000000
ext_cpuid[25]=07280202 00000000 00000000 00000000
ext_cpuid[26]=07280202 00000000 00000000 00000000
ext_cpuid[27]=07280202 00000000 00000000 00000000
ext_cpuid[28]=07280202 00000000 00000000 00000000
ext_cpuid[29]=07280202 00000000 00000000 00000000
ext_cpuid[30]=07280202 00000000 00000000 00000000
ext_cpuid[31]=07280202 00000000 00000000 00000000
intel_fn4[0]=04000121 01c0003f 0000003f 00000001
intel_fn4[1]=04000122 01c0003f 0000003f 00000001
intel_fn4[2]=04004143 03c0003f 00000fff 00000001
intel_fn4[3]=00000000 00000000 00000000 00000000
--------------------------------------------------------------------------------
6
15
6
6
15
2
2
32
32
4096
-1
8
16
-1
64
64
-1
Conroe (Core 2 Duo)
fpu vme de pse tsc msr pae mce cx8 apic mtrr sep pge mca cmov pat pse36 clflush dts acpi mmx fxsr sse sse2 ss ht tm pbe pni dts64 monitor ds_cpl vmx est tm2 ssse3 cx16 xtpr pdcm xd lm lahf_lm
--------------------------------------------------------------------------------
basic_cpuid[0]=0000000a 756e6547 6c65746e 49656e69
basic_cpuid[1]=00010676 01020800 0000e39d bfebfbff
basic_cpuid[2]=05b0b101 005657f0 00000000 2cb4307d
basic_cpuid[3]=00000000 00000000 00000000 00000000
basic_cpuid[4]=04000121 01c0003f 0000003f 00000001
basic_cpuid[5]=00000040 00000040 00000003 00022220
basic_cpuid[6]=00000001 00000002 00000001 00000000
basic_cpuid[7]=00000000 00000000 00000000 00000000
basic_cpuid[8]=00000400 00000000 00000000 00000000
basic_cpuid[9]=00000000 00000000 00000000 00000000
basic_cpuid[10]=07280202 00000000 00000000 00000503
basic_cpuid[11]=07280202 00000000 00000000 00000503
basic_cpuid[12]=07280202 00000000 00000000 00000503
basic_cpuid[13]=07280202 00000000 00000000 00000503
basic_cpuid[14]=07280202 00000000 00000000 00000503
basic_cpuid[15]=07280202 00000000 00000000 00000503
basic_cpuid[16]=07280202 00000000 00000000 00000503
basic_cpuid[17]=07280202 00000000 00000000 00000503
basic_cpuid[18]=07280202 00000000 00000000 00000503
basic_cpuid[19]=07280202 00000000 00000000 00000503
basic_cpuid[20]=07280202 00000000 00000000 00000503
basic_cpuid[21]=07280202 00000000 00000000 00000503
basic_cpuid[22]=07280202 00000000 00000000 00000503
basic_cpuid[23]=07280202 00000000 00000000 00000503
basic_cpuid[24]=07280202 00000000 00000000 00000503
basic_cpuid[25]=07280202 00000000 00000000 00000503
basic_cpuid[26]=07280202 00000000 00000000 00000503
basic_cpuid[27]=07280202 00000000 00000000 00000503
basic_cpuid[28]=07280202 00000000 00000000 00000503
basic_cpuid[29]=07280202 00000000 00000000 00000503
basic_cpuid[30]=07280202 00000000 00000000 00000503
basic_cpuid[31]=07280202 00000000 00000000 00000503
ext_cpuid[0]=80000008 00000000 00000000 00000000
ext_cpuid[1]=00000000 00000000 00000001 20100000
ext_cpuid[2]=746e6550 286d7569 44202952 2d6c6175
ext_cpuid[3]=65726f43 50432020 20202055 45202020
ext_cpuid[4]=30303235 20402020 30352e32 007a4847
ext_cpuid[5]=00000000 00000000 00000000 00000000
ext_cpuid[6]=00000000 00000000 08006040 00000000
ext_cpuid[7]=00000000 00000000 00000000 00000000
ext_cpuid[8]=00003024 00000000 00000000 00000000
ext_cpuid[9]=07280202 00000000 00000000 00000503
ext_cpuid[10]=07280202 00000000 00000000 00000503
ext_cpuid[11]=07280202 00000000 00000000 00000503
ext_cpuid[12]=07280202 00000000 00000000 00000503
ext_cpuid[13]=07280202 00000000 00000000 00000503
ext_cpuid[14]=07280202 00000000 00000000 00000503
ext_cpuid[15]=07280202 00000000 00000000 00000503
ext_cpuid[16]=07280202 00000000 00000000 00000503
ext_cpuid[17]=07280202 00000000 00000000 00000503
ext_cpuid[18]=07280202 00000000 00000000 00000503
ext_cpuid[19]=07280202 00000000 00000000 00000503
ext_cpuid[20]=07280202 00000000 00000000 00000503
ext_cpuid[21]=07280202 00000000 00000000 00000503
ext_cpuid[22]=07280202 00000000 00000000 00000503
ext_cpuid[23]=07280202 00000000 00000000 00000503
ext_cpuid[24]=07280202 00000000 00000000 00000503
ext_cpuid[25]=07280202 00000000 00000000 00000503
ext_cpuid[26]=07280202 00000000 00000000 00000503
ext_cpuid[27]=07280202 00000000 00000000 00000503
ext_cpuid[28]=07280202 00000000 00000000 00000503
ext_cpuid[29]=07280202 00000000 00000000 00000503
ext_cpuid[30]=07280202 00000000 00000000 00000503
ext_cpuid[31]=07280202 00000000 00000000 00000503
intel_fn4[0]=04000121 01c0003f 0000003f 00000001
intel_fn4[1]=04000122 01c0003f 0000003f 00000001
intel_fn4[2]=04004143 01c0003f 00000fff 00000001
intel_fn4[3]=00000000 00000000 00000000 00000000
--------------------------------------------------------------------------------
6
7
6
6
23
2
2
32
32
2048
-1
8
8
-1
64
64
-1
Wolfdale (Core 2 Duo) 2M
fpu vme de pse tsc msr pae mce cx8 apic mtrr sep pge mca cmov pat pse36 clflush dts acpi mmx fxsr sse sse2 ss ht tm pbe pni dts64 monitor ds_cpl est tm2 ssse3 cx16 xtpr pdcm xd lm lahf_lm
--------------------------------------------------------------------------------
basic_cpuid[0]=0000000a 756e6547 6c65746e 49656e69
basic_cpuid[1]=000006fd 01020800 0000e39d bfebfbff
basic_cpuid[2]=05b0b101 005657f0 00000000 2cb4307d
basic_cpuid[3]=00000000 00000000 00000000 00000000
basic_cpuid[4]=04000121 01c0003f 0000003f 00000001
basic_cpuid[5]=00000040 00000040 00000003 00000220
basic_cpuid[6]=00000001 00000002 00000001 00000000
basic_cpuid[7]=00000000 00000000 00000000 00000000
basic_cpuid[8]=00000400 00000000 00000000 00000000
basic_cpuid[9]=00000000 00000000 00000000 00000000
basic_cpuid[10]=07280202 00000000 00000000 00000503
basic_cpuid[11]=07280202 00000000 00000000 00000503
basic_cpuid[12]=07280202 00000000 00000000 00000503
basic_cpuid[13]=07280202 00000000 00000000 00000503
basic_cpuid[14]=07280202 00000000 00000000 00000503
basic_cpuid[15]=07280202 00000000 00000000 00000503
basic_cpuid[16]=07280202 00000000 00000000 00000503
basic_cpuid[17]=07280202 00000000 00000000 00000503
basic_cpuid[18]=07280202 00000000 00000000 00000503
basic_cpuid[19]=07280202 00000000 00000000 00000503
basic_cpuid[20]=07280202 00000000 00000000 00000503
basic_cpuid[21]=07280202 00000000 00000000 00000503
basic_cpuid[22]=07280202 00000000 00000000 00000503
basic_cpuid[23]=07280202 00000000 00000000 00000503
basic_cpuid[24]=07280202 00000000 00000000 00000503
basic_cpuid[25]=07280202 00000000 00000000 00000503
basic_cpuid[26]=07280202 00000000 00000000 00000503
basic_cpuid[27]=07280202 00000000 00000000 00000503
basic_cpuid[28]=07280202 00000000 00000000 00000503
basic_cpuid[29]=07280202 00000000 00000000 00000503
basic_cpuid[30]=07280202 00000000 00000000 00000503
basic_cpuid[31]=07280202 00000000 00000000 00000503
ext_cpuid[0]=80000008 00000000 00000000 00000000
ext_cpuid[1]=00000000 00000000 00000001 20100000
ext_cpuid[2]=65746e49 2952286c 726f4320 4d542865
ext_cpuid[3]=44203229 43206f75 20205550 45202020
ext_cpuid[4]=30303534 20402020 30322e32 007a4847
ext_cpuid[5]=00000000 00000000 00000000 00000000
ext_cpuid[6]=00000000 00000000 08006040 00000000
ext_cpuid[7]=00000000 00000000 00000000 00000000
ext_cpuid[8]=00003024 00000000 00000000 00000000
ext_cpuid[9]=07280202 00000000 00000000 00000503
ext_cpuid[10]=07280202 00000000 00000000 00000503
ext_cpuid[11]=07280202 00000000 00000000 00000503
ext_cpuid[12]=07280202 00000000 00000000 00000503
ext_cpuid[13]=07280202 00000000 00000000 00000503
ext_cpuid[14]=07280202 00000000 00000000 00000503
ext_cpuid[15]=07280202 00000000 00000000 00000503
ext_cpuid[16]=07280202 00000000 00000000 00000503
ext_cpuid[17]=07280202 00000000 00000000 00000503
ext_cpuid[18]=07280202 00000000 00000000 00000503
ext_cpuid[19]=07280202 00000000 00000000 00000503
ext_cpuid[20]=07280202 00000000 00000000 00000503
ext_cpuid[21]=07280202 00000000 00000000 00000503
ext_cpuid[22]=07280202 00000000 00000000 00000503
ext_cpuid[23]=07280202 00000000 00000000 00000503
ext_cpuid[24]=07280202 00000000 00000000 00000503
ext_cpuid[25]=07280202 00000000 00000000 00000503
ext_cpuid[26]=07280202 00000000 00000000 00000503
ext_cpuid[27]=07280202 00000000 00000000 00000503
ext_cpuid[28]=07280202 00000000 00000000 00000503
ext_cpuid[29]=07280202 00000000 00000000 00000503
ext_cpuid[30]=07280202 00000000 00000000 00000503
ext_cpuid[31]=07280202 00000000 00000000 00000503
intel_fn4[0]=04000121 01c0003f 0000003f 00000001
intel_fn4[1]=04000122 01c0003f 0000003f 00000001
intel_fn4[2]=04004143 01c0003f 00000fff 00000001
intel_fn4[3]=00000000 00000000 00000000 00000000
--------------------------------------------------------------------------------
6
15
13
6
15
2
2
32
32
2048
-1
8
8
-1
64
64
-1
Allendale (Core 2 Duo)
fpu vme de pse tsc msr pae mce cx8 apic mtrr sep pge mca cmov pat pse36 clflush dts acpi mmx fxsr sse sse2 ss ht tm pbe pni dts64 monitor ds_cpl est tm2 ssse3 cx16 xtpr pdcm xd lm lahf_lm
--------------------------------------------------------------------------------
basic_cpuid[0]=00000002 756e6547 6c65746e 49656e69
basic_cpuid[1]=0000068a 00000002 00000000 0383fbff
basic_cpuid[2]=03020101 00000000 00000000 0c040882
basic_cpuid[3]=03020101 00000000 00000000 0c040882
basic_cpuid[4]=03020101 00000000 00000000 0c040882
basic_cpuid[5]=03020101 00000000 00000000 0c040882
basic_cpuid[6]=03020101 00000000 00000000 0c040882
basic_cpuid[7]=03020101 00000000 00000000 0c040882
basic_cpuid[8]=03020101 00000000 00000000 0c040882
basic_cpuid[9]=03020101 00000000 00000000 0c040882
basic_cpuid[10]=03020101 00000000 00000000 0c040882
basic_cpuid[11]=03020101 00000000 00000000 0c040882
basic_cpuid[12]=03020101 00000000 00000000 0c040882
basic_cpuid[13]=03020101 00000000 00000000 0c040882
basic_cpuid[14]=03020101 00000000 00000000 0c040882
basic_cpuid[15]=03020101 00000000 00000000 0c040882
basic_cpuid[16]=03020101 00000000 00000000 0c040882
basic_cpuid[17]=03020101 00000000 00000000 0c040882
basic_cpuid[18]=03020101 00000000 00000000 0c040882
basic_cpuid[19]=03020101 00000000 00000000 0c040882
basic_cpuid[20]=03020101 00000000 00000000 0c040882
basic_cpuid[21]=03020101 00000000 00000000 0c040882
basic_cpuid[22]=03020101 00000000 00000000 0c040882
basic_cpuid[23]=03020101 00000000 00000000 0c040882
basic_cpuid[24]=03020101 00000000 00000000 0c040882
basic_cpuid[25]=03020101 00000000 00000000 0c040882
basic_cpuid[26]=03020101 00000000 00000000 0c040882
basic_cpuid[27]=03020101 00000000 00000000 0c040882
basic_cpuid[28]=03020101 00000000 00000000 0c040882
basic_cpuid[29]=03020101 00000000 00000000 0c040882
basic_cpuid[30]=03020101 00000000 00000000 0c040882
basic_cpuid[31]=03020101 00000000 00000000 0c040882
ext_cpuid[0]=03020101 00000000 00000000 0c040882
ext_cpuid[1]=03020101 00000000 00000000 0c040882
ext_cpuid[2]=03020101 00000000 00000000 0c040882
ext_cpuid[3]=03020101 00000000 00000000 0c040882
ext_cpuid[4]=03020101 00000000 00000000 0c040882
ext_cpuid[5]=03020101 00000000 00000000 0c040882
ext_cpuid[6]=03020101 00000000 00000000 0c040882
ext_cpuid[7]=03020101 00000000 00000000 0c040882
ext_cpuid[8]=03020101 00000000 00000000 0c040882
ext_cpuid[9]=03020101 00000000 00000000 0c040882
ext_cpuid[10]=03020101 00000000 00000000 0c040882
ext_cpuid[11]=03020101 00000000 00000000 0c040882
ext_cpuid[12]=03020101 00000000 00000000 0c040882
ext_cpuid[13]=03020101 00000000 00000000 0c040882
ext_cpuid[14]=03020101 00000000 00000000 0c040882
ext_cpuid[15]=03020101 00000000 00000000 0c040882
ext_cpuid[16]=03020101 00000000 00000000 0c040882
ext_cpuid[17]=03020101 00000000 00000000 0c040882
ext_cpuid[18]=03020101 00000000 00000000 0c040882
ext_cpuid[19]=03020101 00000000 00000000 0c040882
ext_cpuid[20]=03020101 00000000 00000000 0c040882
ext_cpuid[21]=03020101 00000000 00000000 0c040882
ext_cpuid[22]=03020101 00000000 00000000 0c040882
ext_cpuid[23]=03020101 00000000 00000000 0c040882
ext_cpuid[24]=03020101 00000000 00000000 0c040882
ext_cpuid[25]=03020101 00000000 00000000 0c040882
ext_cpuid[26]=03020101 00000000 00000000 0c040882
ext_cpuid[27]=03020101 00000000 00000000 0c040882
ext_cpuid[28]=03020101 00000000 00000000 0c040882
ext_cpuid[29]=03020101 00000000 00000000 0c040882
ext_cpuid[30]=03020101 00000000 00000000 0c040882
ext_cpuid[31]=03020101 00000000 00000000 0c040882
intel_fn4[0]=03020101 00000000 00000000 0c040882
intel_fn4[1]=03020101 00000000 00000000 0c040882
intel_fn4[2]=03020101 00000000 00000000 0c040882
intel_fn4[3]=03020101 00000000 00000000 0c040882
--------------------------------------------------------------------------------
6
8
10
6
8
1
1
16
16
256
-1
4
8
-1
32
32
-1
Pentium III (Coppermine)
fpu vme de pse tsc msr pae mce cx8 apic mtrr sep pge mca cmov pat pse36 mmx fxsr sse syscall
--------------------------------------------------------------------------------
basic_cpuid[0]=00000005 756e6547 6c65746e 49656e69
basic_cpuid[1]=00000f34 00010800 0000441d bfebfbff
basic_cpuid[2]=605b5101 00000000 00000000 003c7040
basic_cpuid[3]=00000000 00000000 00000000 00000000
basic_cpuid[4]=00000121 01c0003f 0000001f 00000000
basic_cpuid[5]=00000040 00000040 00000000 00000000
basic_cpuid[6]=00000040 00000040 00000000 00000000
basic_cpuid[7]=00000040 00000040 00000000 00000000
basic_cpuid[8]=00000040 00000040 00000000 00000000
basic_cpuid[9]=00000040 00000040 00000000 00000000
basic_cpuid[10]=00000040 00000040 00000000 00000000
basic_cpuid[11]=00000040 00000040 00000000 00000000
basic_cpuid[12]=00000040 00000040 00000000 00000000
basic_cpuid[13]=00000040 00000040 00000000 00000000
basic_cpuid[14]=00000040 00000040 00000000 00000000
basic_cpuid[15]=00000040 00000040 00000000 00000000
basic_cpuid[16]=00000040 00000040 00000000 00000000
basic_cpuid[17]=00000040 00000040 00000000 00000000
basic_cpuid[18]=00000040 00000040 00000000 00000000
basic_cpuid[19]=00000040 00000040 00000000 00000000
basic_cpuid[20]=00000040 00000040 00000000 00000000
basic_cpuid[21]=00000040 00000040 00000000 00000000
basic_cpuid[22]=00000040 00000040 00000000 00000000
basic_cpuid[23]=00000040 00000040 00000000 00000000
basic_cpuid[24]=00000040 00000040 00000000 00000000
basic_cpuid[25]=00000040 00000040 00000000 00000000
basic_cpuid[26]=00000040 00000040 00000000 00000000
basic_cpuid[27]=00000040 00000040 00000000 00000000
basic_cpuid[28]=00000040 00000040 00000000 00000000
basic_cpuid[29]=00000040 00000040 00000000 00000000
basic_cpuid[30]=00000040 00000040 00000000 00000000
basic_cpuid[31]=00000040 00000040 00000000 00000000
ext_cpuid[0]=80000008 00000000 00000000 00000000
ext_cpuid[1]=00000000 00000000 00000000 00000000
ext_cpuid[2]=20202020 20202020 20202020 20202020
ext_cpuid[3]=65746e49 2952286c 6c654320 6e6f7265
ext_cpuid[4]=20295228 20555043 30342e32 007a4847
ext_cpuid[5]=00000000 00000000 00000000 00000000
ext_cpuid[6]=00000000 00000000 01004040 00000000
ext_cpuid[7]=00000000 00000000 00000000 00000000
ext_cpuid[8]=00002024 00000000 00000000 00000000
ext_cpuid[9]=00000040 00000040 00000000 00000000
ext_cpuid[10]=00000040 00000040 00000000 00000000
ext_cpuid[11]=00000040 00000040 00000000 00000000
ext_cpuid[12]=00000040 00000040 00000000 00000000
ext_cpuid[13]=00000040 00000040 00000000 00000000
ext_cpuid[14]=00000040 00000040 00000000 00000000
ext_cpuid[15]=00000040 00000040 00000000 00000000
ext_cpuid[16]=00000040 00000040 00000000 00000000
ext_cpuid[17]=00000040 00000040 00000000 00000000
ext_cpuid[18]=00000040 00000040 00000000 00000000
ext_cpuid[19]=00000040 00000040 00000000 00000000
ext_cpuid[20]=00000040 00000040 00000000 00000000
ext_cpuid[21]=00000040 00000040 00000000 00000000
ext_cpuid[22]=00000040 00000040 00000000 00000000
ext_cpuid[23]=00000040 00000040 00000000 00000000
ext_cpuid[24]=00000040 00000040 00000000 00000000
ext_cpuid[25]=00000040 00000040 00000000 00000000
ext_cpuid[26]=00000040 00000040 00000000 00000000
ext_cpuid[27]=00000040 00000040 00000000 00000000
ext_cpuid[28]=00000040 00000040 00000000 00000000
ext_cpuid[29]=00000040 00000040 00000000 00000000
ext_cpuid[30]=00000040 00000040 00000000 00000000
ext_cpuid[31]=00000040 00000040 00000000 00000000
intel_fn4[0]=00000121 01c0003f 0000001f 00000000
intel_fn4[1]=00000143 00c0103f 000001ff 00000000
intel_fn4[2]=00000000 00000000 00000000 00000000
intel_fn4[3]=00000000 00000000 00000000 00000000
--------------------------------------------------------------------------------
15
3
4
15
3
1
2
16
-1
256
-1
8
4
-1
64
64
-1
Celeron D
fpu vme de pse tsc msr pae mce cx8 apic mtrr sep pge mca cmov pat pse36 clflush dts acpi mmx fxsr sse sse2 ss ht tm pbe pni dts64 monitor ds_cpl cid xtpr
--------------------------------------------------------------------------------
basic_cpuid[0]=00000001 68747541 444d4163 69746e65
basic_cpuid[1]=00000681 00000000 00000000 0383fbff
basic_cpuid[2]=00000000 00000000 00000000 00000000
basic_cpuid[3]=00000000 00000000 00000000 00000000
basic_cpuid[4]=00000000 00000000 00000000 00000000
basic_cpuid[5]=00000000 00000000 00000000 00000000
basic_cpuid[6]=00000000 00000000 00000000 00000000
basic_cpuid[7]=00000000 00000000 00000000 00000000
basic_cpuid[8]=00000000 00000000 00000000 00000000
basic_cpuid[9]=00000000 00000000 00000000 00000000
basic_cpuid[10]=00000000 00000000 00000000 00000000
basic_cpuid[11]=00000000 00000000 00000000 00000000
basic_cpuid[12]=00000000 00000000 00000000 00000000
basic_cpuid[13]=00000000 00000000 00000000 00000000
basic_cpuid[14]=00000000 00000000 00000000 00000000
basic_cpuid[15]=00000000 00000000 00000000 00000000
basic_cpuid[16]=00000000 00000000 00000000 00000000
basic_cpuid[17]=00000000 00000000 00000000 00000000
basic_cpuid[18]=00000000 00000000 00000000 00000000
basic_cpuid[19]=00000000 00000000 00000000 00000000
basic_cpuid[20]=00000000 00000000 00000000 00000000
basic_cpuid[21]=00000000 00000000 00000000 00000000
basic_cpuid[22]=00000000 00000000 00000000 00000000
basic_cpuid[23]=00000000 00000000 00000000 00000000
basic_cpuid[24]=00000000 00000000 00000000 00000000
basic_cpuid[25]=00000000 00000000 00000000 00000000
basic_cpuid[26]=00000000 00000000 00000000 00000000
basic_cpuid[27]=00000000 00000000 00000000 00000000
basic_cpuid[28]=00000000 00000000 00000000 00000000
basic_cpuid[29]=00000000 00000000 00000000 00000000
basic_cpuid[30]=00000000 00000000 00000000 00000000
basic_cpuid[31]=00000000 00000000 00000000 00000000
ext_cpuid[0]=80000008 68747541 444d4163 69746e65
ext_cpuid[1]=00000781 00000000 00000000 c1c3fbff
ext_cpuid[2]=20444d41 6f727544 6d74286e 72702029
ext_cpuid[3]=7365636f 00726f73 00000000 00000000
ext_cpuid[4]=00000000 00000000 00000000 00000000
ext_cpuid[5]=0408ff08 ff20ff10 40020140 40020140
ext_cpuid[6]=00000000 41004100 00408140 00000000
ext_cpuid[7]=00000000 00000000 00000000 00000001
ext_cpuid[8]=00002022 00000000 00000000 00000000
ext_cpuid[9]=00000000 00000000 00000000 00000000
ext_cpuid[10]=00000000 00000000 00000000 00000000
ext_cpuid[11]=00000000 00000000 00000000 00000000
ext_cpuid[12]=00000000 00000000 00000000 00000000
ext_cpuid[13]=00000000 00000000 00000000 00000000
ext_cpuid[14]=00000000 00000000 00000000 00000000
ext_cpuid[15]=00000000 00000000 00000000 00000000
ext_cpuid[16]=00000000 00000000 00000000 00000000
ext_cpuid[17]=00000000 00000000 00000000 00000000
ext_cpuid[18]=00000000 00000000 00000000 00000000
ext_cpuid[19]=00000000 00000000 00000000 00000000
ext_cpuid[20]=00000000 00000000 00000000 00000000
ext_cpuid[21]=00000000 00000000 00000000 00000000
ext_cpuid[22]=00000000 00000000 00000000 00000000
ext_cpuid[23]=00000000 00000000 00000000 00000000
ext_cpuid[24]=00000000 00000000 00000000 00000000
ext_cpuid[25]=00000000 00000000 00000000 00000000
ext_cpuid[26]=00000000 00000000 00000000 00000000
ext_cpuid[27]=00000000 00000000 00000000 00000000
ext_cpuid[28]=00000000 00000000 00000000 00000000
ext_cpuid[29]=00000000 00000000 00000000 00000000
ext_cpuid[30]=00000000 00000000 00000000 00000000
ext_cpuid[31]=00000000 00000000 00000000 00000000
intel_fn4[0]=00000000 00000000 00000000 00000000
intel_fn4[1]=00000000 00000000 00000000 00000000
intel_fn4[2]=00000000 00000000 00000000 00000000
intel_fn4[3]=00000000 00000000 00000000 00000000
--------------------------------------------------------------------------------
6
8
1
6
8
1
1
64
64
64
0
2
16
-1
64
64
-1
Duron (Applebred)
fpu vme de pse tsc msr pae mce cx8 apic mtrr sep pge mca cmov pat pse36 mmx fxsr sse syscall mmxext 3dnow 3dnowext ts
--------------------------------------------------------------------------------
basic_cpuid[0]=0000000a 756e6547 6c65746e 49656e69
basic_cpuid[1]=000106c2 00020800 0040c39d bfe9fbff
basic_cpuid[2]=4fba5901 0e3080c0 00000000 00000000
basic_cpuid[3]=00000000 00000000 00000000 00000000
basic_cpuid[4]=00004121 0140003f 0000003f 00000001
basic_cpuid[5]=00000040 00000040 00000003 00020220
basic_cpuid[6]=00000001 00000002 00000001 00000000
basic_cpuid[7]=00000000 00000000 00000000 00000000
basic_cpuid[8]=00000000 00000000 00000000 00000000
basic_cpuid[9]=00000000 00000000 00000000 00000000
basic_cpuid[10]=07280203 00000000 00000000 00002501
basic_cpuid[11]=07280203 00000000 00000000 00002501
basic_cpuid[12]=07280203 00000000 00000000 00002501
basic_cpuid[13]=07280203 00000000 00000000 00002501
basic_cpuid[14]=07280203 00000000 00000000 00002501
basic_cpuid[15]=07280203 00000000 00000000 00002501
basic_cpuid[16]=07280203 00000000 00000000 00002501
basic_cpuid[17]=07280203 00000000 00000000 00002501
basic_cpuid[18]=07280203 00000000 00000000 00002501
basic_cpuid[19]=07280203 00000000 00000000 00002501
basic_cpuid[20]=07280203 00000000 00000000 00002501
basic_cpuid[21]=07280203 00000000 00000000 00002501
basic_cpuid[22]=07280203 00000000 00000000 00002501
basic_cpuid[23]=07280203 00000000 00000000 00002501
basic_cpuid[24]=07280203 00000000 00000000 00002501
basic_cpuid[25]=07280203 00000000 00000000 00002501
basic_cpuid[26]=07280203 00000000 00000000 00002501
basic_cpuid[27]=07280203 00000000 00000000 00002501
basic_cpuid[28]=07280203 00000000 00000000 00002501
basic_cpuid[29]=07280203 00000000 00000000 00002501
basic_cpuid[30]=07280203 00000000 00000000 00002501
basic_cpuid[31]=07280203 00000000 00000000 00002501
ext_cpuid[0]=80000008 00000000 00000000 00000000
ext_cpuid[1]=00000000 00000000 00000001 00100000
ext_cpuid[2]=20202020 20202020 746e4920 52286c65
ext_cpuid[3]=74412029 54286d6f 4320294d 4e205550
ext_cpuid[4]=20303732 20402020 30362e31 007a4847
ext_cpuid[5]=00000000 00000000 00000000 00000000
ext_cpuid[6]=00000000 00000000 02008040 00000000
ext_cpuid[7]=00000000 00000000 00000000 00000000
ext_cpuid[8]=00002020 00000000 00000000 00000000
ext_cpuid[9]=07280203 00000000 00000000 00002501
ext_cpuid[10]=07280203 00000000 00000000 00002501
ext_cpuid[11]=07280203 00000000 00000000 00002501
ext_cpuid[12]=07280203 00000000 00000000 00002501
ext_cpuid[13]=07280203 00000000 00000000 00002501
ext_cpuid[14]=07280203 00000000 00000000 00002501
ext_cpuid[15]=07280203 00000000 00000000 00002501
ext_cpuid[16]=07280203 00000000 00000000 00002501
ext_cpuid[17]=07280203 00000000 00000000 00002501
ext_cpuid[18]=07280203 00000000 00000000 00002501
ext_cpuid[19]=07280203 00000000 00000000 00002501
ext_cpuid[20]=07280203 00000000 00000000 00002501
ext_cpuid[21]=07280203 00000000 00000000 00002501
ext_cpuid[22]=07280203 00000000 00000000 00002501
ext_cpuid[23]=07280203 00000000 00000000 00002501
ext_cpuid[24]=07280203 00000000 00000000 00002501
ext_cpuid[25]=07280203 00000000 00000000 00002501
ext_cpuid[26]=07280203 00000000 00000000 00002501
ext_cpuid[27]=07280203 00000000 00000000 00002501
ext_cpuid[28]=07280203 00000000 00000000 00002501
ext_cpuid[29]=07280203 00000000 00000000 00002501
ext_cpuid[30]=07280203 00000000 00000000 00002501
ext_cpuid[31]=07280203 00000000 00000000 00002501
intel_fn4[0]=00004121 0140003f 0000003f 00000001
intel_fn4[1]=00004122 01c0003f 0000003f 00000001
intel_fn4[2]=00004143 01c0003f 000003ff 00000001
intel_fn4[3]=00000000 00000000 00000000 00000000
--------------------------------------------------------------------------------
6
12
2
6
28
1
2
24
32
512
-1
6
8
-1
64
64
-1
Atom (Diamondville)
fpu vme de pse tsc msr pae mce cx8 apic mtrr sep pge mca cmov pat clflush dts acpi mmx fxsr sse sse2 ss ht tm pbe pni dts64 monitor ds_cpl est tm2 ssse3 xtpr pdcm xd movbe lahf_lm
--------------------------------------------------------------------------------
basic_cpuid[0]=0000000a 756e6547 6c65746e 49656e69
basic_cpuid[1]=000006fa 00020800 0000e3bd bfebfbff
basic_cpuid[2]=05b0b101 005657f0 00000000 2cb43049
basic_cpuid[3]=00000000 00000000 00000000 00000000
basic_cpuid[4]=04000121 01c0003f 0000003f 00000001
basic_cpuid[5]=00000040 00000040 00000003 00022220
basic_cpuid[6]=00000003 00000002 00000001 00000000
basic_cpuid[7]=00000000 00000000 00000000 00000000
basic_cpuid[8]=00000400 00000000 00000000 00000000
basic_cpuid[9]=00000000 00000000 00000000 00000000
basic_cpuid[10]=07280202 00000000 00000000 00000503
basic_cpuid[11]=07280202 00000000 00000000 00000503
basic_cpuid[12]=07280202 00000000 00000000 00000503
basic_cpuid[13]=07280202 00000000 00000000 00000503
basic_cpuid[14]=07280202 00000000 00000000 00000503
basic_cpuid[15]=07280202 00000000 00000000 00000503
basic_cpuid[16]=07280202 00000000 00000000 00000503
basic_cpuid[17]=07280202 00000000 00000000 00000503
basic_cpuid[18]=07280202 00000000 00000000 00000503
basic_cpuid[19]=07280202 00000000 00000000 00000503
basic_cpuid[20]=07280202 00000000 00000000 00000503
basic_cpuid[21]=07280202 00000000 00000000 00000503
basic_cpuid[22]=07280202 00000000 00000000 00000503
basic_cpuid[23]=07280202 00000000 00000000 00000503
basic_cpuid[24]=07280202 00000000 00000000 00000503
basic_cpuid[25]=07280202 00000000 00000000 00000503
basic_cpuid[26]=07280202 00000000 00000000 00000503
basic_cpuid[27]=07280202 00000000 00000000 00000503
basic_cpuid[28]=07280202 00000000 00000000 00000503
basic_cpuid[29]=07280202 00000000 00000000 00000503
basic_cpuid[30]=07280202 00000000 00000000 00000503
basic_cpuid[31]=07280202 00000000 00000000 00000503
ext_cpuid[0]=80000008 00000000 00000000 00000000
ext_cpuid[1]=00000000 00000000 00000001 20100000
ext_cpuid[2]=65746e49 2952286c 726f4320 4d542865
ext_cpuid[3]=44203229 43206f75 20205550 54202020
ext_cpuid[4]=30303537 20402020 30322e32 007a4847
ext_cpuid[5]=00000000 00000000 00000000 00000000
ext_cpuid[6]=00000000 00000000 10008040 00000000
ext_cpuid[7]=00000000 00000000 00000000 00000000
ext_cpuid[8]=00003024 00000000 00000000 00000000
ext_cpuid[9]=07280202 00000000 00000000 00000503
ext_cpuid[10]=07280202 00000000 00000000 00000503
ext_cpuid[11]=07280202 00000000 00000000 00000503
ext_cpuid[12]=07280202 00000000 00000000 00000503
ext_cpuid[13]=07280202 00000000 00000000 00000503
ext_cpuid[14]=07280202 00000000 00000000 00000503
ext_cpuid[15]=07280202 00000000 00000000 00000503
ext_cpuid[16]=07280202 00000000 00000000 00000503
ext_cpuid[17]=07280202 00000000 00000000 00000503
ext_cpuid[18]=07280202 00000000 00000000 00000503
ext_cpuid[19]=07280202 00000000 00000000 00000503
ext_cpuid[20]=07280202 00000000 00000000 00000503
ext_cpuid[21]=07280202 00000000 00000000 00000503
ext_cpuid[22]=07280202 00000000 00000000 00000503
ext_cpuid[23]=07280202 00000000 00000000 00000503
ext_cpuid[24]=07280202 00000000 00000000 00000503
ext_cpuid[25]=07280202 00000000 00000000 00000503
ext_cpuid[26]=07280202 00000000 00000000 00000503
ext_cpuid[27]=07280202 00000000 00000000 00000503
ext_cpuid[28]=07280202 00000000 00000000 00000503
ext_cpuid[29]=07280202 00000000 00000000 00000503
ext_cpuid[30]=07280202 00000000 00000000 00000503
ext_cpuid[31]=07280202 00000000 00000000 00000503
intel_fn4[0]=04000121 01c0003f 0000003f 00000001
intel_fn4[1]=04000122 01c0003f 0000003f 00000001
intel_fn4[2]=04004143 03c0003f 00000fff 00000001
intel_fn4[3]=00000000 00000000 00000000 00000000
--------------------------------------------------------------------------------
6
15
10
6
15
2
2
32
32
4096
-1
8
16
-1
64
64
-1
Merom (Core 2 Duo) 4096K
fpu vme de pse tsc msr pae mce cx8 apic mtrr sep pge mca cmov pat pse36 clflush dts acpi mmx fxsr sse sse2 ss ht tm pbe pni dts64 monitor ds_cpl vmx est tm2 ssse3 cx16 xtpr pdcm xd lm lahf_lm
--------------------------------------------------------------------------------
basic_cpuid[0]=00000001 68747541 444d4163 69746e65
basic_cpuid[1]=00040fc2 00000800 00002001 078bfbff
basic_cpuid[2]=00000000 00000000 00000000 00000000
basic_cpuid[3]=00000000 00000000 00000000 00000000
basic_cpuid[4]=00000000 00000000 00000000 00000000
basic_cpuid[5]=00000000 00000000 00000000 00000000
basic_cpuid[6]=00000000 00000000 00000000 00000000
basic_cpuid[7]=00000000 00000000 00000000 00000000
basic_cpuid[8]=00000000 00000000 00000000 00000000
basic_cpuid[9]=00000000 00000000 00000000 00000000
basic_cpuid[10]=00000000 00000000 00000000 00000000
basic_cpuid[11]=00000000 00000000 00000000 00000000
basic_cpuid[12]=00000000 00000000 00000000 00000000
basic_cpuid[13]=00000000 00000000 00000000 00000000
basic_cpuid[14]=00000000 00000000 00000000 00000000
basic_cpuid[15]=00000000 00000000 00000000 00000000
basic_cpuid[16]=00000000 00000000 00000000 00000000
basic_cpuid[17]=00000000 00000000 00000000 00000000
basic_cpuid[18]=00000000 00000000 00000000 00000000
basic_cpuid[19]=00000000 00000000 00000000 00000000
basic_cpuid[20]=00000000 00000000 00000000 00000000
basic_cpuid[21]=00000000 00000000 00000000 00000000
basic_cpuid[22]=00000000 00000000 00000000 00000000
basic_cpuid[23]=00000000 00000000 00000000 00000000
basic_cpuid[24]=00000000 00000000 00000000 00000000
basic_cpuid[25]=00000000 00000000 00000000 00000000
basic_cpuid[26]=00000000 00000000 00000000 00000000
basic_cpuid[27]=00000000 00000000 00000000 00000000
basic_cpuid[28]=00000000 00000000 00000000 00000000
basic_cpuid[29]=00000000 00000000 00000000 00000000
basic_cpuid[30]=00000000 00000000 00000000 00000000
basic_cpuid[31]=00000000 00000000 00000000 00000000
ext_cpuid[0]=80000018 68747541 444d4163 69746e65
ext_cpuid[1]=00040fc2 000006c9 00000019 ebd3fbff
ext_cpuid[2]=69626f4d 4120656c 5320444d 72706d65
ext_cpuid[3]=74286e6f 5020296d 65636f72 726f7373
ext_cpuid[4]=30353320 00002b30 00000000 00000000
ext_cpuid[5]=ff08ff08 ff20ff20 40020140 40020140
ext_cpuid[6]=00000000 42004200 02008140 00000000
ext_cpuid[7]=00000000 00000000 00000000 0000003f
ext_cpuid[8]=00003028 00000000 00000000 00000000
ext_cpuid[9]=00000000 00000000 00000000 00000000
ext_cpuid[10]=00000000 00000000 00000000 00000000
ext_cpuid[11]=00000000 00000000 00000000 00000000
ext_cpuid[12]=00000000 00000000 00000000 00000000
ext_cpuid[13]=00000000 00000000 00000000 00000000
ext_cpuid[14]=00000000 00000000 00000000 00000000
ext_cpuid[15]=00000000 00000000 00000000 00000000
ext_cpuid[16]=00000000 00000000 00000000 00000000
ext_cpuid[17]=00000000 00000000 00000000 00000000
ext_cpuid[18]=00000000 00000000 00000000 00000000
ext_cpuid[19]=00000000 00000000 00000000 00000000
ext_cpuid[20]=00000000 00000000 00000000 00000000
ext_cpuid[21]=00000000 00000000 00000000 00000000
ext_cpuid[22]=00000000 00000000 00000000 00000000
ext_cpuid[23]=00000000 00000000 00000000 00000000
ext_cpuid[24]=00000000 00000000 00000000 00000000
ext_cpuid[25]=00000000 00000000 00000000 00000000
ext_cpuid[26]=00000000 00000000 00000000 00000000
ext_cpuid[27]=00000000 00000000 00000000 00000000
ext_cpuid[28]=00000000 00000000 00000000 00000000
ext_cpuid[29]=00000000 00000000 00000000 00000000
ext_cpuid[30]=00000000 00000000 00000000 00000000
ext_cpuid[31]=00000000 00000000 00000000 00000000
intel_fn4[0]=00000000 00000000 00000000 00000000
intel_fn4[1]=00000000 00000000 00000000 00000000
intel_fn4[2]=00000000 00000000 00000000 00000000
intel_fn4[3]=00000000 00000000 00000000 00000000
--------------------------------------------------------------------------------
15
12
2
15
76
1
1
64
64
512
0
2
16
-1
64
64
-1
Mobile Sempron 64 (Keene/512K)
fpu vme de pse tsc msr pae mce cx8 apic mtrr sep pge mca cmov pat pse36 clflush mmx fxsr sse sse2 pni cx16 syscall mmxext 3dnow 3dnowext nx fxsr_opt rdtscp lm lahf_lm ts fid vid ttp tm_amd stc
--------------------------------------------------------------------------------
basic_cpuid[0]=0000000a 756e6547 6c65746e 49656e69
basic_cpuid[1]=000006fd 01020800 0000e39d bfebfbff
basic_cpuid[2]=05b0b101 005657f0 00000000 2cb43078
basic_cpuid[3]=00000000 00000000 00000000 00000000
basic_cpuid[4]=04000121 01c0003f 0000003f 00000001
basic_cpuid[5]=00000040 00000040 00000003 00000220
basic_cpuid[6]=00000001 00000002 00000001 00000000
basic_cpuid[7]=00000000 00000000 00000000 00000000
basic_cpuid[8]=00000400 00000000 00000000 00000000
basic_cpuid[9]=00000000 00000000 00000000 00000000
basic_cpuid[10]=07280202 00000000 00000000 00000503
basic_cpuid[11]=07280202 00000000 00000000 00000503
basic_cpuid[12]=07280202 00000000 00000000 00000503
basic_cpuid[13]=07280202 00000000 00000000 00000503
basic_cpuid[14]=07280202 00000000 00000000 00000503
basic_cpuid[15]=07280202 00000000 00000000 00000503
basic_cpuid[16]=07280202 00000000 00000000 00000503
basic_cpuid[17]=07280202 00000000 00000000 00000503
basic_cpuid[18]=07280202 00000000 00000000 00000503
basic_cpuid[19]=07280202 00000000 00000000 00000503
basic_cpuid[20]=07280202 00000000 00000000 00000503
basic_cpuid[21]=07280202 00000000 00000000 00000503
basic_cpuid[22]=07280202 00000000 00000000 00000503
basic_cpuid[23]=07280202 00000000 00000000 00000503
basic_cpuid[24]=07280202 00000000 00000000 00000503
basic_cpuid[25]=07280202 00000000 00000000 00000503
basic_cpuid[26]=07280202 00000000 00000000 00000503
basic_cpuid[27]=07280202 00000000 00000000 00000503
basic_cpuid[28]=07280202 00000000 00000000 00000503
basic_cpuid[29]=07280202 00000000 00000000 00000503
basic_cpuid[30]=07280202 00000000 00000000 00000503
basic_cpuid[31]=07280202 00000000 00000000 00000503
ext_cpuid[0]=80000008 00000000 00000000 00000000
ext_cpuid[1]=00000000 00000000 00000001 20100000
ext_cpuid[2]=65746e49 2952286c 6e655020 6d756974
ext_cpuid[3]=20295228 6c617544 50432020 45202055
ext_cpuid[4]=30363132 20402020 30382e31 007a4847
ext_cpuid[5]=00000000 00000000 00000000 00000000
ext_cpuid[6]=00000000 00000000 04004040 00000000
ext_cpuid[7]=00000000 00000000 00000000 00000000
ext_cpuid[8]=00003024 00000000 00000000 00000000
ext_cpuid[9]=07280202 00000000 00000000 00000503
ext_cpuid[10]=07280202 00000000 00000000 00000503
ext_cpuid[11]=07280202 00000000 00000000 00000503
ext_cpuid[12]=07280202 00000000 00000000 00000503
ext_cpuid[13]=07280202 00000000 00000000 00000503
ext_cpuid[14]=07280202 00000000 00000000 00000503
ext_cpuid[15]=07280202 00000000 00000000 00000503
ext_cpuid[16]=07280202 00000000 00000000 00000503
ext_cpuid[17]=07280202 00000000 00000000 00000503
ext_cpuid[18]=07280202 00000000 00000000 00000503
ext_cpuid[19]=07280202 00000000 00000000 00000503
ext_cpuid[20]=07280202 00000000 00000000 00000503
ext_cpuid[21]=07280202 00000000 00000000 00000503
ext_cpuid[22]=07280202 00000000 00000000 00000503
ext_cpuid[23]=07280202 00000000 00000000 00000503
ext_cpuid[24]=07280202 00000000 00000000 00000503
ext_cpuid[25]=07280202 00000000 00000000 00000503
ext_cpuid[26]=07280202 00000000 00000000 00000503
ext_cpuid[27]=07280202 00000000 00000000 00000503
ext_cpuid[28]=07280202 00000000 00000000 00000503
ext_cpuid[29]=07280202 00000000 00000000 00000503
ext_cpuid[30]=07280202 00000000 00000000 00000503
ext_cpuid[31]=07280202 00000000 00000000 00000503
intel_fn4[0]=04000121 01c0003f 0000003f 00000001
intel_fn4[1]=04000122 01c0003f 0000003f 00000001
intel_fn4[2]=04004143 00c0003f 00000fff 00000001
intel_fn4[3]=00000000 00000000 00000000 00000000
--------------------------------------------------------------------------------
6
15
13
6
15
2
2
32
32
1024
-1
8
4
-1
64
64
-1
Conroe (Core 2 Duo) 1024K
fpu vme de pse tsc msr pae mce cx8 apic mtrr sep pge mca cmov pat pse36 clflush dts acpi mmx fxsr sse sse2 ss ht tm pbe pni dts64 monitor ds_cpl est tm2 ssse3 cx16 xtpr pdcm xd lm lahf_lm
--------------------------------------------------------------------------------
basic_cpuid[0]=00000001 68747541 444d4163 69746e65
basic_cpuid[1]=00070ff1 00000800 00002001 078bfbff
basic_cpuid[2]=00000000 00000000 00000000 00000000
basic_cpuid[3]=00000000 00000000 00000000 00000000
basic_cpuid[4]=00000000 00000000 00000000 00000000
basic_cpuid[5]=00000000 00000000 00000000 00000000
basic_cpuid[6]=00000000 00000000 00000000 00000000
basic_cpuid[7]=00000000 00000000 00000000 00000000
basic_cpuid[8]=00000000 00000000 00000000 00000000
basic_cpuid[9]=00000000 00000000 00000000 00000000
basic_cpuid[10]=00000000 00000000 00000000 00000000
basic_cpuid[11]=00000000 00000000 00000000 00000000
basic_cpuid[12]=00000000 00000000 00000000 00000000
basic_cpuid[13]=00000000 00000000 00000000 00000000
basic_cpuid[14]=00000000 00000000 00000000 00000000
basic_cpuid[15]=00000000 00000000 00000000 00000000
basic_cpuid[16]=00000000 00000000 00000000 00000000
basic_cpuid[17]=00000000 00000000 00000000 00000000
basic_cpuid[18]=00000000 00000000 00000000 00000000
basic_cpuid[19]=00000000 00000000 00000000 00000000
basic_cpuid[20]=00000000 00000000 00000000 00000000
basic_cpuid[21]=00000000 00000000 00000000 00000000
basic_cpuid[22]=00000000 00000000 00000000 00000000
basic_cpuid[23]=00000000 00000000 00000000 00000000
basic_cpuid[24]=00000000 00000000 00000000 00000000
basic_cpuid[25]=00000000 00000000 00000000 00000000
basic_cpuid[26]=00000000 00000000 00000000 00000000
basic_cpuid[27]=00000000 00000000 00000000 00000000
basic_cpuid[28]=00000000 00000000 00000000 00000000
basic_cpuid[29]=00000000 00000000 00000000 00000000
basic_cpuid[30]=00000000 00000000 00000000 00000000
basic_cpuid[31]=00000000 00000000 00000000 00000000
ext_cpuid[0]=80000018 68747541 444d4163 69746e65
ext_cpuid[1]=00070ff1 0000428b 00000119 ebd3fbff
ext_cpuid[2]=20444d41 706d6553 286e6f72 20296d74
ext_cpuid[3]=636f7250 6f737365 454c2072 3031312d
ext_cpuid[4]=00000030 00000000 00000000 00000000
ext_cpuid[5]=ff08ff08 ff20ff20 40020140 40020140
ext_cpuid[6]=00000000 42004200 01008140 00000000
ext_cpuid[7]=00000000 00000000 00000000 0000007f
ext_cpuid[8]=00003028 00000000 00000000 00000000
ext_cpuid[9]=00000000 00000000 00000000 00000000
ext_cpuid[10]=00000000 00000000 00000000 00000000
ext_cpuid[11]=00000000 00000000 00000000 00000000
ext_cpuid[12]=00000000 00000000 00000000 00000000
ext_cpuid[13]=00000000 00000000 00000000 00000000
ext_cpuid[14]=00000000 00000000 00000000 00000000
ext_cpuid[15]=00000000 00000000 00000000 00000000
ext_cpuid[16]=00000000 00000000 00000000 00000000
ext_cpuid[17]=00000000 00000000 00000000 00000000
ext_cpuid[18]=00000000 00000000 00000000 00000000
ext_cpuid[19]=00000000 00000000 00000000 00000000
ext_cpuid[20]=00000000 00000000 00000000 00000000
ext_cpuid[21]=00000000 00000000 00000000 00000000
ext_cpuid[22]=00000000 00000000 00000000 00000000
ext_cpuid[23]=00000000 00000000 00000000 00000000
ext_cpuid[24]=00000000 00000000 00000000 00000000
ext_cpuid[25]=00000000 00000000 00000000 00000000
ext_cpuid[26]=00000000 00000000 00000000 00000000
ext_cpuid[27]=00000000 00000000 00000000 00000000
ext_cpuid[28]=00000000 00000000 00000000 00000000
ext_cpuid[29]=00000000 00000000 00000000 00000000
ext_cpuid[30]=00000000 00000000 00000000 00000000
ext_cpuid[31]=00000000 00000000 00000000 00000000
intel_fn4[0]=00000000 00000000 00000000 00000000
intel_fn4[1]=00000000 00000000 00000000 00000000
intel_fn4[2]=00000000 00000000 00000000 00000000
intel_fn4[3]=00000000 00000000 00000000 00000000
--------------------------------------------------------------------------------
15
15
1
15
127
1
1
64
64
256
0
2
16
-1
64
64
-1
Sempron 64 (Sparta/256K)
fpu vme de pse tsc msr pae mce cx8 apic mtrr sep pge mca cmov pat pse36 clflush mmx fxsr sse sse2 pni cx16 syscall mmxext 3dnow 3dnowext nx fxsr_opt rdtscp lm lahf_lm 3dnowprefetch ts fid vid ttp tm_amd stc 100mhzsteps
--------------------------------------------------------------------------------
basic_cpuid[0]=0000000a 756e6547 6c65746e 49656e69
basic_cpuid[1]=00010676 01020800 0008e3fd bfebfbff
basic_cpuid[2]=05b0b101 005657f0 00000000 2cb4304e
basic_cpuid[3]=00000000 00000000 00000000 00000000
basic_cpuid[4]=04000121 01c0003f 0000003f 00000001
basic_cpuid[5]=00000040 00000040 00000003 00022220
basic_cpuid[6]=00000001 00000002 00000001 00000000
basic_cpuid[7]=00000000 00000000 00000000 00000000
basic_cpuid[8]=00000400 00000000 00000000 00000000
basic_cpuid[9]=00000000 00000000 00000000 00000000
basic_cpuid[10]=07280202 00000000 00000000 00000503
basic_cpuid[11]=07280202 00000000 00000000 00000503
basic_cpuid[12]=07280202 00000000 00000000 00000503
basic_cpuid[13]=07280202 00000000 00000000 00000503
basic_cpuid[14]=07280202 00000000 00000000 00000503
basic_cpuid[15]=07280202 00000000 00000000 00000503
basic_cpuid[16]=07280202 00000000 00000000 00000503
basic_cpuid[17]=07280202 00000000 00000000 00000503
basic_cpuid[18]=07280202 00000000 00000000 00000503
basic_cpuid[19]=07280202 00000000 00000000 00000503
basic_cpuid[20]=07280202 00000000 00000000 00000503
basic_cpuid[21]=07280202 00000000 00000000 00000503
basic_cpuid[22]=07280202 00000000 00000000 00000503
basic_cpuid[23]=07280202 00000000 00000000 00000503
basic_cpuid[24]=07280202 00000000 00000000 00000503
basic_cpuid[25]=07280202 00000000 00000000 00000503
basic_cpuid[26]=07280202 00000000 00000000 00000503
basic_cpuid[27]=07280202 00000000 00000000 00000503
basic_cpuid[28]=07280202 00000000 00000000 00000503
basic_cpuid[29]=07280202 00000000 00000000 00000503
basic_cpuid[30]=07280202 00000000 00000000 00000503
basic_cpuid[31]=07280202 00000000 00000000 00000503
ext_cpuid[0]=80000008 00000000 00000000 00000000
ext_cpuid[1]=00000000 00000000 00000001 20100000
ext_cpuid[2]=65746e49 2952286c 6f655820 2952286e
ext_cpuid[3]=55504320 20202020 20202020 45202020
ext_cpuid[4]=30313133 20402020 30302e33 007a4847
ext_cpuid[5]=00000000 00000000 00000000 00000000
ext_cpuid[6]=00000000 00000000 18008040 00000000
ext_cpuid[7]=00000000 00000000 00000000 00000000
ext_cpuid[8]=00003024 00000000 00000000 00000000
ext_cpuid[9]=07280202 00000000 00000000 00000503
ext_cpuid[10]=07280202 00000000 00000000 00000503
ext_cpuid[11]=07280202 00000000 00000000 00000503
ext_cpuid[12]=07280202 00000000 00000000 00000503
ext_cpuid[13]=07280202 00000000 00000000 00000503
ext_cpuid[14]=07280202 00000000 00000000 00000503
ext_cpuid[15]=07280202 00000000 00000000 00000503
ext_cpuid[16]=07280202 00000000 00000000 00000503
ext_cpuid[17]=07280202 00000000 00000000 00000503
ext_cpuid[18]=07280202 00000000 00000000 00000503
ext_cpuid[19]=07280202 00000000 00000000 00000503
ext_cpuid[20]=07280202 00000000 00000000 00000503
ext_cpuid[21]=07280202 00000000 00000000 00000503
ext_cpuid[22]=07280202 00000000 00000000 00000503
ext_cpuid[23]=07280202 00000000 00000000 00000503
ext_cpuid[24]=07280202 00000000 00000000 00000503
ext_cpuid[25]=07280202 00000000 00000000 00000503
ext_cpuid[26]=07280202 00000000 00000000 00000503
ext_cpuid[27]=07280202 00000000 00000000 00000503
ext_cpuid[28]=07280202 00000000 00000000 00000503
ext_cpuid[29]=07280202 00000000 00000000 00000503
ext_cpuid[30]=07280202 00000000 00000000 00000503
ext_cpuid[31]=07280202 00000000 00000000 00000503
intel_fn4[0]=04000121 01c0003f 0000003f 00000001
intel_fn4[1]=04000122 01c0003f 0000003f 00000001
intel_fn4[2]=04004143 05c0003f 00000fff 00000001
intel_fn4[3]=00000000 00000000 00000000 00000000
--------------------------------------------------------------------------------
6
7
6
6
23
2
2
32
32
6144
-1
8
24
-1
64
64
-1
Xeon (Wolfdale)
fpu vme de pse tsc msr pae mce cx8 apic mtrr sep pge mca cmov pat pse36 clflush dts acpi mmx fxsr sse sse2 ss ht tm pbe pni dts64 monitor ds_cpl vmx smx est tm2 ssse3 cx16 xtpr pdcm sse4_1 xd lm lahf_lm
--------------------------------------------------------------------------------
basic_cpuid[0]=0000000a 756e6547 6c65746e 49656e69
basic_cpuid[1]=000006fd 01020800 0000e39d bfebfbff
basic_cpuid[2]=05b0b101 005657f0 00000000 2cb4307f
basic_cpuid[3]=00000000 00000000 00000000 00000000
basic_cpuid[4]=04000121 01c0003f 0000003f 00000001
basic_cpuid[5]=00000040 00000040 00000003 00000220
basic_cpuid[6]=00000001 00000002 00000001 00000000
basic_cpuid[7]=00000000 00000000 00000000 00000000
basic_cpuid[8]=00000400 00000000 00000000 00000000
basic_cpuid[9]=00000000 00000000 00000000 00000000
basic_cpuid[10]=07280202 00000000 00000000 00000503
basic_cpuid[11]=07280202 00000000 00000000 00000503
basic_cpuid[12]=07280202 00000000 00000000 00000503
basic_cpuid[13]=07280202 00000000 00000000 00000503
basic_cpuid[14]=07280202 00000000 00000000 00000503
basic_cpuid[15]=07280202 00000000 00000000 00000503
basic_cpuid[16]=07280202 00000000 00000000 00000503
basic_cpuid[17]=07280202 00000000 00000000 00000503
basic_cpuid[18]=07280202 00000000 00000000 00000503
basic_cpuid[19]=07280202 00000000 00000000 00000503
basic_cpuid[20]=07280202 00000000 00000000 00000503
basic_cpuid[21]=07280202 00000000 00000000 00000503
basic_cpuid[22]=07280202 00000000 00000000 00000503
basic_cpuid[23]=07280202 00000000 00000000 00000503
basic_cpuid[24]=07280202 00000000 00000000 00000503
basic_cpuid[25]=07280202 00000000 00000000 00000503
basic_cpuid[26]=07280202 00000000 00000000 00000503
basic_cpuid[27]=07280202 00000000 00000000 00000503
basic_cpuid[28]=07280202 00000000 00000000 00000503
basic_cpuid[29]=07280202 00000000 00000000 00000503
basic_cpuid[30]=07280202 00000000 00000000 00000503
basic_cpuid[31]=07280202 00000000 00000000 00000503
ext_cpuid[0]=80000008 00000000 00000000 00000000
ext_cpuid[1]=00000000 00000000 00000001 20000000
ext_cpuid[2]=65746e49 2952286c 6c654320 6e6f7265
ext_cpuid[3]=20295228 20555043 20202020 45202020
ext_cpuid[4]=30303231 20402020 30362e31 007a4847
ext_cpuid[5]=00000000 00000000 00000000 00000000
ext_cpuid[6]=00000000 00000000 02002040 00000000
ext_cpuid[7]=00000000 00000000 00000000 00000000
ext_cpuid[8]=00003024 00000000 00000000 00000000
ext_cpuid[9]=07280202 00000000 00000000 00000503
ext_cpuid[10]=07280202 00000000 00000000 00000503
ext_cpuid[11]=07280202 00000000 00000000 00000503
ext_cpuid[12]=07280202 00000000 00000000 00000503
ext_cpuid[13]=07280202 00000000 00000000 00000503
ext_cpuid[14]=07280202 00000000 00000000 00000503
ext_cpuid[15]=07280202 00000000 00000000 00000503
ext_cpuid[16]=07280202 00000000 00000000 00000503
ext_cpuid[17]=07280202 00000000 00000000 00000503
ext_cpuid[18]=07280202 00000000 00000000 00000503
ext_cpuid[19]=07280202 00000000 00000000 00000503
ext_cpuid[20]=07280202 00000000 00000000 00000503
ext_cpuid[21]=07280202 00000000 00000000 00000503
ext_cpuid[22]=07280202 00000000 00000000 00000503
ext_cpuid[23]=07280202 00000000 00000000 00000503
ext_cpuid[24]=07280202 00000000 00000000 00000503
ext_cpuid[25]=07280202 00000000 00000000 00000503
ext_cpuid[26]=07280202 00000000 00000000 00000503
ext_cpuid[27]=07280202 00000000 00000000 00000503
ext_cpuid[28]=07280202 00000000 00000000 00000503
ext_cpuid[29]=07280202 00000000 00000000 00000503
ext_cpuid[30]=07280202 00000000 00000000 00000503
ext_cpuid[31]=07280202 00000000 00000000 00000503
intel_fn4[0]=04000121 01c0003f 0000003f 00000001
intel_fn4[1]=04000122 01c0003f 0000003f 00000001
intel_fn4[2]=04004143 0040003f 00000fff 00000001
intel_fn4[3]=00000000 00000000 00000000 00000000
--------------------------------------------------------------------------------
6
15
13
6
15
2
2
32
32
512
-1
8
2
-1
64
64
-1
Conroe-L (Celeron)
fpu vme de pse tsc msr pae mce cx8 apic mtrr sep pge mca cmov pat pse36 clflush dts acpi mmx fxsr sse sse2 ss ht tm pbe pni dts64 monitor ds_cpl est tm2 ssse3 cx16 xtpr pdcm lm lahf_lm
--------------------------------------------------------------------------------
basic_cpuid[0]=00000002 756e6547 6c65746e 49656e69
basic_cpuid[1]=00000f29 0001080e 00004400 bfebf9ff
basic_cpuid[2]=665b5101 00000000 00000000 007b7040
basic_cpuid[3]=665b5101 00000000 00000000 007b7040
basic_cpuid[4]=665b5101 00000000 00000000 007b7040
basic_cpuid[5]=665b5101 00000000 00000000 007b7040
basic_cpuid[6]=665b5101 00000000 00000000 007b7040
basic_cpuid[7]=665b5101 00000000 00000000 007b7040
basic_cpuid[8]=665b5101 00000000 00000000 007b7040
basic_cpuid[9]=665b5101 00000000 00000000 007b7040
basic_cpuid[10]=665b5101 00000000 00000000 007b7040
basic_cpuid[11]=665b5101 00000000 00000000 007b7040
basic_cpuid[12]=665b5101 00000000 00000000 007b7040
basic_cpuid[13]=665b5101 00000000 00000000 007b7040
basic_cpuid[14]=665b5101 00000000 00000000 007b7040
basic_cpuid[15]=665b5101 00000000 00000000 007b7040
basic_cpuid[16]=665b5101 00000000 00000000 007b7040
basic_cpuid[17]=665b5101 00000000 00000000 007b7040
basic_cpuid[18]=665b5101 00000000 00000000 007b7040
basic_cpuid[19]=665b5101 00000000 00000000 007b7040
basic_cpuid[20]=665b5101 00000000 00000000 007b7040
basic_cpuid[21]=665b5101 00000000 00000000 007b7040
basic_cpuid[22]=665b5101 00000000 00000000 007b7040
basic_cpuid[23]=665b5101 00000000 00000000 007b7040
basic_cpuid[24]=665b5101 00000000 00000000 007b7040
basic_cpuid[25]=665b5101 00000000 00000000 007b7040
basic_cpuid[26]=665b5101 00000000 00000000 007b7040
basic_cpuid[27]=665b5101 00000000 00000000 007b7040
basic_cpuid[28]=665b5101 00000000 00000000 007b7040
basic_cpuid[29]=665b5101 00000000 00000000 007b7040
basic_cpuid[30]=665b5101 00000000 00000000 007b7040
basic_cpuid[31]=665b5101 00000000 00000000 007b7040
ext_cpuid[0]=80000004 00000000 00000000 00000000
ext_cpuid[1]=00000000 00000000 00000000 00000000
ext_cpuid[2]=4d202020 6c69626f 6e492065 286c6574
ext_cpuid[3]=50202952 69746e65 52286d75 20342029
ext_cpuid[4]=204d202d 20555043 30322e32 007a4847
ext_cpuid[5]=665b5101 00000000 00000000 007b7040
ext_cpuid[6]=665b5101 00000000 00000000 007b7040
ext_cpuid[7]=665b5101 00000000 00000000 007b7040
ext_cpuid[8]=665b5101 00000000 00000000 007b7040
ext_cpuid[9]=665b5101 00000000 00000000 007b7040
ext_cpuid[10]=665b5101 00000000 00000000 007b7040
ext_cpuid[11]=665b5101 00000000 00000000 007b7040
ext_cpuid[12]=665b5101 00000000 00000000 007b7040
ext_cpuid[13]=665b5101 00000000 00000000 007b7040
ext_cpuid[14]=665b5101 00000000 00000000 007b7040
ext_cpuid[15]=665b5101 00000000 00000000 007b7040
ext_cpuid[16]=665b5101 00000000 00000000 007b7040
ext_cpuid[17]=665b5101 00000000 00000000 007b7040
ext_cpuid[18]=665b5101 00000000 00000000 007b7040
ext_cpuid[19]=665b5101 00000000 00000000 007b7040
ext_cpuid[20]=665b5101 00000000 00000000 007b7040
ext_cpuid[21]=665b5101 00000000 00000000 007b7040
ext_cpuid[22]=665b5101 00000000 00000000 007b7040
ext_cpuid[23]=665b5101 00000000 00000000 007b7040
ext_cpuid[24]=665b5101 00000000 00000000 007b7040
ext_cpuid[25]=665b5101 00000000 00000000 007b7040
ext_cpuid[26]=665b5101 00000000 00000000 007b7040
ext_cpuid[27]=665b5101 00000000 00000000 007b7040
ext_cpuid[28]=665b5101 00000000 00000000 007b7040
ext_cpuid[29]=665b5101 00000000 00000000 007b7040
ext_cpuid[30]=665b5101 00000000 00000000 007b7040
ext_cpuid[31]=665b5101 00000000 00000000 007b7040
intel_fn4[0]=665b5101 00000000 00000000 007b7040
intel_fn4[1]=665b5101 00000000 00000000 007b7040
intel_fn4[2]=665b5101 00000000 00000000 007b7040
intel_fn4[3]=665b5101 00000000 00000000 007b7040
--------------------------------------------------------------------------------
15
2
9
15
2
1
2
8
12
512
0
4
8
-1
64
64
-1
Mobile P-4 (Northwood)
fpu vme de pse tsc msr pae mce cx8 mtrr sep pge mca cmov pat pse36 clflush dts acpi mmx fxsr sse sse2 ss ht tm pbe cid xtpr
--------------------------------------------------------------------------------
basic_cpuid[0]=00000001 68747541 444d4163 69746e65
basic_cpuid[1]=00020fc2 00000800 00000001 078bfbff
basic_cpuid[2]=00000000 00000000 00000000 00000000
basic_cpuid[3]=00000000 00000000 00000000 00000000
basic_cpuid[4]=00000000 00000000 00000000 00000000
basic_cpuid[5]=00000000 00000000 00000000 00000000
basic_cpuid[6]=00000000 00000000 00000000 00000000
basic_cpuid[7]=00000000 00000000 00000000 00000000
basic_cpuid[8]=00000000 00000000 00000000 00000000
basic_cpuid[9]=00000000 00000000 00000000 00000000
basic_cpuid[10]=00000000 00000000 00000000 00000000
basic_cpuid[11]=00000000 00000000 00000000 00000000
basic_cpuid[12]=00000000 00000000 00000000 00000000
basic_cpuid[13]=00000000 00000000 00000000 00000000
basic_cpuid[14]=00000000 00000000 00000000 00000000
basic_cpuid[15]=00000000 00000000 00000000 00000000
basic_cpuid[16]=00000000 00000000 00000000 00000000
basic_cpuid[17]=00000000 00000000 00000000 00000000
basic_cpuid[18]=00000000 00000000 00000000 00000000
basic_cpuid[19]=00000000 00000000 00000000 00000000
basic_cpuid[20]=00000000 00000000 00000000 00000000
basic_cpuid[21]=00000000 00000000 00000000 00000000
basic_cpuid[22]=00000000 00000000 00000000 00000000
basic_cpuid[23]=00000000 00000000 00000000 00000000
basic_cpuid[24]=00000000 00000000 00000000 00000000
basic_cpuid[25]=00000000 00000000 00000000 00000000
basic_cpuid[26]=00000000 00000000 00000000 00000000
basic_cpuid[27]=00000000 00000000 00000000 00000000
basic_cpuid[28]=00000000 00000000 00000000 00000000
basic_cpuid[29]=00000000 00000000 00000000 00000000
basic_cpuid[30]=00000000 00000000 00000000 00000000
basic_cpuid[31]=00000000 00000000 00000000 00000000
ext_cpuid[0]=80000018 68747541 444d4163 69746e65
ext_cpuid[1]=00020fc2 00000108 00000001 e3d3fbff
ext_cpuid[2]=20444d41 6c687441 74286e6f 3620296d
ext_cpuid[3]=72502034 7365636f 20726f73 30303033
ext_cpuid[4]=0000002b 00000000 00000000 00000000
ext_cpuid[5]=ff08ff08 ff20ff20 40020140 40020140
ext_cpuid[6]=00000000 42004200 02008140 00000000
ext_cpuid[7]=00000000 00000000 00000000 0000003f
ext_cpuid[8]=00003028 00000000 00000000 00000000
ext_cpuid[9]=00000000 00000000 00000000 00000000
ext_cpuid[10]=00000000 00000000 00000000 00000000
ext_cpuid[11]=00000000 00000000 00000000 00000000
ext_cpuid[12]=00000000 00000000 00000000 00000000
ext_cpuid[13]=00000000 00000000 00000000 00000000
ext_cpuid[14]=00000000 00000000 00000000 00000000
ext_cpuid[15]=00000000 00000000 00000000 00000000
ext_cpuid[16]=00000000 00000000 00000000 00000000
ext_cpuid[17]=00000000 00000000 00000000 00000000
ext_cpuid[18]=00000000 00000000 00000000 00000000
ext_cpuid[19]=00000000 00000000 00000000 00000000
ext_cpuid[20]=00000000 00000000 00000000 00000000
ext_cpuid[21]=00000000 00000000 00000000 00000000
ext_cpuid[22]=00000000 00000000 00000000 00000000
ext_cpuid[23]=00000000 00000000 00000000 00000000
ext_cpuid[24]=00000000 00000000 00000000 00000000
ext_cpuid[25]=00000000 00000000 00000000 00000000
ext_cpuid[26]=00000000 00000000 00000000 00000000
ext_cpuid[27]=00000000 00000000 00000000 00000000
ext_cpuid[28]=00000000 00000000 00000000 00000000
ext_cpuid[29]=00000000 00000000 00000000 00000000
ext_cpuid[30]=00000000 00000000 00000000 00000000
ext_cpuid[31]=00000000 00000000 00000000 00000000
intel_fn4[0]=00000000 00000000 00000000 00000000
intel_fn4[1]=00000000 00000000 00000000 00000000
intel_fn4[2]=00000000 00000000 00000000 00000000
intel_fn4[3]=00000000 00000000 00000000 00000000
--------------------------------------------------------------------------------
15
12
2
15
44
1
1
64
64
512
0
2
16
-1
64
64
-1
Athlon 64 (Venice/512K)
fpu vme de pse tsc msr pae mce cx8 apic mtrr sep pge mca cmov pat pse36 clflush mmx fxsr sse sse2 pni syscall mmxext 3dnow 3dnowext nx fxsr_opt lm lahf_lm ts fid vid ttp tm_amd stc
--------------------------------------------------------------------------------
basic_cpuid[0]=00000001 68747541 444d4163 69746e65
basic_cpuid[1]=00060fb2 01020800 00002001 178bfbff
basic_cpuid[2]=00000000 00000000 00000000 00000000
basic_cpuid[3]=00000000 00000000 00000000 00000000
basic_cpuid[4]=00000000 00000000 00000000 00000000
basic_cpuid[5]=00000000 00000000 00000000 00000000
basic_cpuid[6]=00000000 00000000 00000000 00000000
basic_cpuid[7]=00000000 00000000 00000000 00000000
basic_cpuid[8]=00000000 00000000 00000000 00000000
basic_cpuid[9]=00000000 00000000 00000000 00000000
basic_cpuid[10]=00000000 00000000 00000000 00000000
basic_cpuid[11]=00000000 00000000 00000000 00000000
basic_cpuid[12]=00000000 00000000 00000000 00000000
basic_cpuid[13]=00000000 00000000 00000000 00000000
basic_cpuid[14]=00000000 00000000 00000000 00000000
basic_cpuid[15]=00000000 00000000 00000000 00000000
basic_cpuid[16]=00000000 00000000 00000000 00000000
basic_cpuid[17]=00000000 00000000 00000000 00000000
basic_cpuid[18]=00000000 00000000 00000000 00000000
basic_cpuid[19]=00000000 00000000 00000000 00000000
basic_cpuid[20]=00000000 00000000 00000000 00000000
basic_cpuid[21]=00000000 00000000 00000000 00000000
basic_cpuid[22]=00000000 00000000 00000000 00000000
basic_cpuid[23]=00000000 00000000 00000000 00000000
basic_cpuid[24]=00000000 00000000 00000000 00000000
basic_cpuid[25]=00000000 00000000 00000000 00000000
basic_cpuid[26]=00000000 00000000 00000000 00000000
basic_cpuid[27]=00000000 00000000 00000000 00000000
basic_cpuid[28]=00000000 00000000 00000000 00000000
basic_cpuid[29]=00000000 00000000 00000000 00000000
basic_cpuid[30]=00000000 00000000 00000000 00000000
basic_cpuid[31]=00000000 00000000 00000000 00000000
ext_cpuid[0]=80000018 68747541 444d4163 69746e65
ext_cpuid[1]=00060fb2 000008db 0000011f ebd3fbff
ext_cpuid[2]=20444d41 6c687441 74286e6f 3620296d
ext_cpuid[3]=32582034 61754420 6f43206c 50206572
ext_cpuid[4]=65636f72 726f7373 30323520 00002b30
ext_cpuid[5]=ff08ff08 ff20ff20 40020140 40020140
ext_cpuid[6]=00000000 42004200 02008140 00000000
ext_cpuid[7]=00000000 00000000 00000000 0000007f
ext_cpuid[8]=00003028 00000000 00000001 00000000
ext_cpuid[9]=00000000 00000000 00000000 00000000
ext_cpuid[10]=00000001 00000040 00000000 00000002
ext_cpuid[11]=00000000 00000000 00000000 00000000
ext_cpuid[12]=00000000 00000000 00000000 00000000
ext_cpuid[13]=00000000 00000000 00000000 00000000
ext_cpuid[14]=00000000 00000000 00000000 00000000
ext_cpuid[15]=00000000 00000000 00000000 00000000
ext_cpuid[16]=00000000 00000000 00000000 00000000
ext_cpuid[17]=00000000 00000000 00000000 00000000
ext_cpuid[18]=00000000 00000000 00000000 00000000
ext_cpuid[19]=00000000 00000000 00000000 00000000
ext_cpuid[20]=00000000 00000000 00000000 00000000
ext_cpuid[21]=00000000 00000000 00000000 00000000
ext_cpuid[22]=00000000 00000000 00000000 00000000
ext_cpuid[23]=00000000 00000000 00000000 00000000
ext_cpuid[24]=00000000 00000000 00000000 00000000
ext_cpuid[25]=00000000 00000000 00000000 00000000
ext_cpuid[26]=00000000 00000000 00000000 00000000
ext_cpuid[27]=00000000 00000000 00000000 00000000
ext_cpuid[28]=00000000 00000000 00000000 00000000
ext_cpuid[29]=00000000 00000000 00000000 00000000
ext_cpuid[30]=00000000 00000000 00000000 00000000
ext_cpuid[31]=00000000 00000000 00000000 00000000
intel_fn4[0]=00000000 00000000 00000000 00000000
intel_fn4[1]=00000000 00000000 00000000 00000000
intel_fn4[2]=00000000 00000000 00000000 00000000
intel_fn4[3]=00000000 00000000 00000000 00000000
--------------------------------------------------------------------------------
15
11
2
15
107
2
2
64
64
512
0
2
16
-1
64
64
-1
Athlon 64 X2 (Brisbane/512K)
fpu vme de pse tsc msr pae mce cx8 apic mtrr sep pge mca cmov pat pse36 clflush mmx fxsr sse sse2 ht pni cx16 syscall mmxext 3dnow 3dnowext nx fxsr_opt rdtscp lm lahf_lm cmp_legacy svm 3dnowprefetch ts fid vid ttp tm_amd stc 100mhzsteps
--------------------------------------------------------------------------------
basic_cpuid[0]=0000000a 756e6547 6c65746e 49656e69
basic_cpuid[1]=000006e8 01020800 0000c1a9 bfe9fbff
basic_cpuid[2]=02b3b001 000000f0 00000000 2c04307d
basic_cpuid[3]=00000000 00000000 00000000 00000000
basic_cpuid[4]=04000121 01c0003f 0000003f 00000001
basic_cpuid[5]=00000040 00000040 00000003 00022220
basic_cpuid[6]=00000001 00000002 00000001 00000000
basic_cpuid[7]=00000000 00000000 00000000 00000000
basic_cpuid[8]=00000000 00000000 00000000 00000000
basic_cpuid[9]=00000000 00000000 00000000 00000000
basic_cpuid[10]=07280201 00000000 00000000 00000000
basic_cpuid[11]=07280201 00000000 00000000 00000000
basic_cpuid[12]=07280201 00000000 00000000 00000000
basic_cpuid[13]=07280201 00000000 00000000 00000000
basic_cpuid[14]=07280201 00000000 00000000 00000000
basic_cpuid[15]=07280201 00000000 00000000 00000000
basic_cpuid[16]=07280201 00000000 00000000 00000000
basic_cpuid[17]=07280201 00000000 00000000 00000000
basic_cpuid[18]=07280201 00000000 00000000 00000000
basic_cpuid[19]=07280201 00000000 00000000 00000000
basic_cpuid[20]=07280201 00000000 00000000 00000000
basic_cpuid[21]=07280201 00000000 00000000 00000000
basic_cpuid[22]=07280201 00000000 00000000 00000000
basic_cpuid[23]=07280201 00000000 00000000 00000000
basic_cpuid[24]=07280201 00000000 00000000 00000000
basic_cpuid[25]=07280201 00000000 00000000 00000000
basic_cpuid[26]=07280201 00000000 00000000 00000000
basic_cpuid[27]=07280201 00000000 00000000 00000000
basic_cpuid[28]=07280201 00000000 00000000 00000000
basic_cpuid[29]=07280201 00000000 00000000 00000000
basic_cpuid[30]=07280201 00000000 00000000 00000000
basic_cpuid[31]=07280201 00000000 00000000 00000000
ext_cpuid[0]=80000008 00000000 00000000 00000000
ext_cpuid[1]=00000000 00000000 00000000 00100000
ext_cpuid[2]=756e6547 20656e69 65746e49 2952286c
ext_cpuid[3]=55504320 20202020 20202020 54202020
ext_cpuid[4]=30303432 20402020 33382e31 007a4847
ext_cpuid[5]=00000000 00000000 00000000 00000000
ext_cpuid[6]=00000000 00000000 08006040 00000000
ext_cpuid[7]=00000000 00000000 00000000 00000000
ext_cpuid[8]=00002020 00000000 00000000 00000000
ext_cpuid[9]=07280201 00000000 00000000 00000000
ext_cpuid[10]=07280201 00000000 00000000 00000000
ext_cpuid[11]=07280201 00000000 00000000 00000000
ext_cpuid[12]=07280201 00000000 00000000 00000000
ext_cpuid[13]=07280201 00000000 00000000 00000000
ext_cpuid[14]=07280201 00000000 00000000 00000000
ext_cpuid[15]=07280201 00000000 00000000 00000000
ext_cpuid[16]=07280201 00000000 00000000 00000000
ext_cpuid[17]=07280201 00000000 00000000 00000000
ext_cpuid[18]=07280201 00000000 00000000 00000000
ext_cpuid[19]=07280201 00000000 00000000 00000000
ext_cpuid[20]=07280201 00000000 00000000 00000000
ext_cpuid[21]=07280201 00000000 00000000 00000000
ext_cpuid[22]=07280201 00000000 00000000 00000000
ext_cpuid[23]=07280201 00000000 00000000 00000000
ext_cpuid[24]=07280201 00000000 00000000 00000000
ext_cpuid[25]=07280201 00000000 00000000 00000000
ext_cpuid[26]=07280201 00000000 00000000 00000000
ext_cpuid[27]=07280201 00000000 00000000 00000000
ext_cpuid[28]=07280201 00000000 00000000 00000000
ext_cpuid[29]=07280201 00000000 00000000 00000000
ext_cpuid[30]=07280201 00000000 00000000 00000000
ext_cpuid[31]=07280201 00000000 00000000 00000000
intel_fn4[0]=04000121 01c0003f 0000003f 00000001
intel_fn4[1]=04000122 01c0003f 0000003f 00000001
intel_fn4[2]=04004143 01c0003f 00000fff 00000001
intel_fn4[3]=00000000 00000000 00000000 00000000
--------------------------------------------------------------------------------
6
14
8
6
14
2
2
32
32
2048
-1
8
8
-1
64
64
-1
Yonah (Core Duo)
fpu vme de pse tsc msr pae mce cx8 apic mtrr sep pge mca cmov pat clflush dts acpi mmx fxsr sse sse2 ss ht tm pbe pni monitor vmx est tm2 xtpr pdcm xd
--------------------------------------------------------------------------------
basic_cpuid[0]=0000000a 756e6547 6c65746e 49656e69
basic_cpuid[1]=000106c2 03040800 0040e31d bfe9fbff
basic_cpuid[2]=4fba5901 0e3080c0 00000000 00000000
basic_cpuid[3]=00000000 00000000 00000000 00000000
basic_cpuid[4]=04004121 0140003f 0000003f 00000001
basic_cpuid[5]=00000040 00000040 00000003 00000010
basic_cpuid[6]=00000001 00000002 00000001 00000000
basic_cpuid[7]=00000000 00000000 00000000 00000000
basic_cpuid[8]=00000000 00000000 00000000 00000000
basic_cpuid[9]=00000000 00000000 00000000 00000000
basic_cpuid[10]=07280203 00000000 00000000 00002501
basic_cpuid[11]=07280203 00000000 00000000 00002501
basic_cpuid[12]=07280203 00000000 00000000 00002501
basic_cpuid[13]=07280203 00000000 00000000 00002501
basic_cpuid[14]=07280203 00000000 00000000 00002501
basic_cpuid[15]=07280203 00000000 00000000 00002501
basic_cpuid[16]=07280203 00000000 00000000 00002501
basic_cpuid[17]=07280203 00000000 00000000 00002501
basic_cpuid[18]=07280203 00000000 00000000 00002501
basic_cpuid[19]=07280203 00000000 00000000 00002501
basic_cpuid[20]=07280203 00000000 00000000 00002501
basic_cpuid[21]=07280203 00000000 00000000 00002501
basic_cpuid[22]=07280203 00000000 00000000 00002501
basic_cpuid[23]=07280203 00000000 00000000 00002501
basic_cpuid[24]=07280203 00000000 00000000 00002501
basic_cpuid[25]=07280203 00000000 00000000 00002501
basic_cpuid[26]=07280203 00000000 00000000 00002501
basic_cpuid[27]=07280203 00000000 00000000 00002501
basic_cpuid[28]=07280203 00000000 00000000 00002501
basic_cpuid[29]=07280203 00000000 00000000 00002501
basic_cpuid[30]=07280203 00000000 00000000 00002501
basic_cpuid[31]=07280203 00000000 00000000 00002501
ext_cpuid[0]=80000008 00000000 00000000 00000000
ext_cpuid[1]=00000000 00000000 00000001 20100000
ext_cpuid[2]=20202020 20202020 746e4920 52286c65
ext_cpuid[3]=74412029 54286d6f 4320294d 20205550
ext_cpuid[4]=20303333 20402020 30362e31 007a4847
ext_cpuid[5]=00000000 00000000 00000000 00000000
ext_cpuid[6]=00000000 00000000 02008040 00000000
ext_cpuid[7]=00000000 00000000 00000000 00000000
ext_cpuid[8]=00003020 00000000 00000000 00000000
ext_cpuid[9]=07280203 00000000 00000000 00002501
ext_cpuid[10]=07280203 00000000 00000000 00002501
ext_cpuid[11]=07280203 00000000 00000000 00002501
ext_cpuid[12]=07280203 00000000 00000000 00002501
ext_cpuid[13]=07280203 00000000 00000000 00002501
ext_cpuid[14]=07280203 00000000 00000000 00002501
ext_cpuid[15]=07280203 00000000 00000000 00002501
ext_cpuid[16]=07280203 00000000 00000000 00002501
ext_cpuid[17]=07280203 00000000 00000000 00002501
ext_cpuid[18]=07280203 00000000 00000000 00002501
ext_cpuid[19]=07280203 00000000 00000000 00002501
ext_cpuid[20]=07280203 00000000 00000000 00002501
ext_cpuid[21]=07280203 00000000 00000000 00002501
ext_cpuid[22]=07280203 00000000 00000000 00002501
ext_cpuid[23]=07280203 00000000 00000000 00002501
ext_cpuid[24]=07280203 00000000 00000000 00002501
ext_cpuid[25]=07280203 00000000 00000000 00002501
ext_cpuid[26]=07280203 00000000 00000000 00002501
ext_cpuid[27]=07280203 00000000 00000000 00002501
ext_cpuid[28]=07280203 00000000 00000000 00002501
ext_cpuid[29]=07280203 00000000 00000000 00002501
ext_cpuid[30]=07280203 00000000 00000000 00002501
ext_cpuid[31]=07280203 00000000 00000000 00002501
intel_fn4[0]=04004121 0140003f 0000003f 00000001
intel_fn4[1]=04004122 01c0003f 0000003f 00000001
intel_fn4[2]=04004143 01c0003f 000003ff 00000001
intel_fn4[3]=00000000 00000000 00000000 00000000
--------------------------------------------------------------------------------
6
12
2
6
28
2
4
24
32
512
-1
6
8
-1
64
64
-1
Atom Dual-Core (Diamondville)
fpu vme de pse tsc msr pae mce cx8 apic mtrr sep pge mca cmov pat clflush dts acpi mmx fxsr sse sse2 ss ht tm pbe pni dts64 monitor ds_cpl tm2 ssse3 cx16 xtpr pdcm xd movbe lm lahf_lm
--------------------------------------------------------------------------------
basic_cpuid[0]=0000000a 756e6547 6c65746e 49656e69
basic_cpuid[1]=00010677 01040800 0008e3fd bfebfbff
basic_cpuid[2]=05b0b101 005657f0 00000000 2cb4304e
basic_cpuid[3]=00000000 00000000 00000000 00000000
basic_cpuid[4]=0c000121 01c0003f 0000003f 00000001
basic_cpuid[5]=00000040 00000040 00000003 00000020
basic_cpuid[6]=00000001 00000002 00000001 00000000
basic_cpuid[7]=00000000 00000000 00000000 00000000
basic_cpuid[8]=00000400 00000000 00000000 00000000
basic_cpuid[9]=00000000 00000000 00000000 00000000
basic_cpuid[10]=07280202 00000000 00000000 00000503
basic_cpuid[11]=07280202 00000000 00000000 00000503
basic_cpuid[12]=07280202 00000000 00000000 00000503
basic_cpuid[13]=07280202 00000000 00000000 00000503
basic_cpuid[14]=07280202 00000000 00000000 00000503
basic_cpuid[15]=07280202 00000000 00000000 00000503
basic_cpuid[16]=07280202 00000000 00000000 00000503
basic_cpuid[17]=07280202 00000000 00000000 00000503
basic_cpuid[18]=07280202 00000000 00000000 00000503
basic_cpuid[19]=07280202 00000000 00000000 00000503
basic_cpuid[20]=07280202 00000000 00000000 00000503
basic_cpuid[21]=07280202 00000000 00000000 00000503
basic_cpuid[22]=07280202 00000000 00000000 00000503
basic_cpuid[23]=07280202 00000000 00000000 00000503
basic_cpuid[24]=07280202 00000000 00000000 00000503
basic_cpuid[25]=07280202 00000000 00000000 00000503
basic_cpuid[26]=07280202 00000000 00000000 00000503
basic_cpuid[27]=07280202 00000000 00000000 00000503
basic_cpuid[28]=07280202 00000000 00000000 00000503
basic_cpuid[29]=07280202 00000000 00000000 00000503
basic_cpuid[30]=07280202 00000000 00000000 00000503
basic_cpuid[31]=07280202 00000000 00000000 00000503
ext_cpuid[0]=80000008 00000000 00000000 00000000
ext_cpuid[1]=00000000 00000000 00000001 20100000
ext_cpuid[2]=65746e49 2952286c 726f4320 4d542865
ext_cpuid[3]=51203229 20646175 55504320 51202020
ext_cpuid[4]=30353439 20402020 36362e32 007a4847
ext_cpuid[5]=00000000 00000000 00000000 00000000
ext_cpuid[6]=00000000 00000000 18008040 00000000
ext_cpuid[7]=00000000 00000000 00000000 00000000
ext_cpuid[8]=00003024 00000000 00000000 00000000
ext_cpuid[9]=07280202 00000000 00000000 00000503
ext_cpuid[10]=07280202 00000000 00000000 00000503
ext_cpuid[11]=07280202 00000000 00000000 00000503
ext_cpuid[12]=07280202 00000000 00000000 00000503
ext_cpuid[13]=07280202 00000000 00000000 00000503
ext_cpuid[14]=07280202 00000000 00000000 00000503
ext_cpuid[15]=07280202 00000000 00000000 00000503
ext_cpuid[16]=07280202 00000000 00000000 00000503
ext_cpuid[17]=07280202 00000000 00000000 00000503
ext_cpuid[18]=07280202 00000000 00000000 00000503
ext_cpuid[19]=07280202 00000000 00000000 00000503
ext_cpuid[20]=07280202 00000000 00000000 00000503
ext_cpuid[21]=07280202 00000000 00000000 00000503
ext_cpuid[22]=07280202 00000000 00000000 00000503
ext_cpuid[23]=07280202 00000000 00000000 00000503
ext_cpuid[24]=07280202 00000000 00000000 00000503
ext_cpuid[25]=07280202 00000000 00000000 00000503
ext_cpuid[26]=07280202 00000000 00000000 00000503
ext_cpuid[27]=07280202 00000000 00000000 00000503
ext_cpuid[28]=07280202 00000000 00000000 00000503
ext_cpuid[29]=07280202 00000000 00000000 00000503
ext_cpuid[30]=07280202 00000000 00000000 00000503
ext_cpuid[31]=07280202 00000000 00000000 00000503
intel_fn4[0]=0c000121 01c0003f 0000003f 00000001
intel_fn4[1]=0c000122 01c0003f 0000003f 00000001
intel_fn4[2]=0c004143 05c0003f 00000fff 00000001
intel_fn4[3]=00000000 00000000 00000000 00000000
--------------------------------------------------------------------------------
6
7
7
6
23
4
4
32
32
6144
-1
8
24
-1
64
64
-1
Yorkfield (Core 2 Quad) 6M
fpu vme de pse tsc msr pae mce cx8 apic mtrr sep pge mca cmov pat pse36 clflush dts acpi mmx fxsr sse sse2 ss ht tm pbe pni dts64 monitor ds_cpl vmx smx est tm2 ssse3 cx16 xtpr pdcm sse4_1 xd lm lahf_lm
--------------------------------------------------------------------------------
basic_cpuid[0]=00000002 756e6547 6c65746e 49656e69
basic_cpuid[1]=000006d6 00000816 00000180 afe9f9bf
basic_cpuid[2]=02b3b001 000000f0 00000000 2c04307d
basic_cpuid[3]=02b3b001 000000f0 00000000 2c04307d
basic_cpuid[4]=02b3b001 000000f0 00000000 2c04307d
basic_cpuid[5]=02b3b001 000000f0 00000000 2c04307d
basic_cpuid[6]=02b3b001 000000f0 00000000 2c04307d
basic_cpuid[7]=02b3b001 000000f0 00000000 2c04307d
basic_cpuid[8]=02b3b001 000000f0 00000000 2c04307d
basic_cpuid[9]=02b3b001 000000f0 00000000 2c04307d
basic_cpuid[10]=02b3b001 000000f0 00000000 2c04307d
basic_cpuid[11]=02b3b001 000000f0 00000000 2c04307d
basic_cpuid[12]=02b3b001 000000f0 00000000 2c04307d
basic_cpuid[13]=02b3b001 000000f0 00000000 2c04307d
basic_cpuid[14]=02b3b001 000000f0 00000000 2c04307d
basic_cpuid[15]=02b3b001 000000f0 00000000 2c04307d
basic_cpuid[16]=02b3b001 000000f0 00000000 2c04307d
basic_cpuid[17]=02b3b001 000000f0 00000000 2c04307d
basic_cpuid[18]=02b3b001 000000f0 00000000 2c04307d
basic_cpuid[19]=02b3b001 000000f0 00000000 2c04307d
basic_cpuid[20]=02b3b001 000000f0 00000000 2c04307d
basic_cpuid[21]=02b3b001 000000f0 00000000 2c04307d
basic_cpuid[22]=02b3b001 000000f0 00000000 2c04307d
basic_cpuid[23]=02b3b001 000000f0 00000000 2c04307d
basic_cpuid[24]=02b3b001 000000f0 00000000 2c04307d
basic_cpuid[25]=02b3b001 000000f0 00000000 2c04307d
basic_cpuid[26]=02b3b001 000000f0 00000000 2c04307d
basic_cpuid[27]=02b3b001 000000f0 00000000 2c04307d
basic_cpuid[28]=02b3b001 000000f0 00000000 2c04307d
basic_cpuid[29]=02b3b001 000000f0 00000000 2c04307d
basic_cpuid[30]=02b3b001 000000f0 00000000 2c04307d
basic_cpuid[31]=02b3b001 000000f0 00000000 2c04307d
ext_cpuid[0]=80000004 00000000 00000000 00000000
ext_cpuid[1]=00000000 00000000 00000000 00000000
ext_cpuid[2]=20202020 20202020 65746e49 2952286c
ext_cpuid[3]=6e655020 6d756974 20295228 7270204d
ext_cpuid[4]=7365636f 20726f73 30362e31 007a4847
ext_cpuid[5]=02b3b001 000000f0 00000000 2c04307d
ext_cpuid[6]=02b3b001 000000f0 00000000 2c04307d
ext_cpuid[7]=02b3b001 000000f0 00000000 2c04307d
ext_cpuid[8]=02b3b001 000000f0 00000000 2c04307d
ext_cpuid[9]=02b3b001 000000f0 00000000 2c04307d
ext_cpuid[10]=02b3b001 000000f0 00000000 2c04307d
ext_cpuid[11]=02b3b001 000000f0 00000000 2c04307d
ext_cpuid[12]=02b3b001 000000f0 00000000 2c04307d
ext_cpuid[13]=02b3b001 000000f0 00000000 2c04307d
ext_cpuid[14]=02b3b001 000000f0 00000000 2c04307d
ext_cpuid[15]=02b3b001 000000f0 00000000 2c04307d
ext_cpuid[16]=02b3b001 000000f0 00000000 2c04307d
ext_cpuid[17]=02b3b001 000000f0 00000000 2c04307d
ext_cpuid[18]=02b3b001 000000f0 00000000 2c04307d
ext_cpuid[19]=02b3b001 000000f0 00000000 2c04307d
ext_cpuid[20]=02b3b001 000000f0 00000000 2c04307d
ext_cpuid[21]=02b3b001 000000f0 00000000 2c04307d
ext_cpuid[22]=02b3b001 000000f0 00000000 2c04307d
ext_cpuid[23]=02b3b001 000000f0 00000000 2c04307d
ext_cpuid[24]=02b3b001 000000f0 00000000 2c04307d
ext_cpuid[25]=02b3b001 000000f0 00000000 2c04307d
ext_cpuid[26]=02b3b001 000000f0 00000000 2c04307d
ext_cpuid[27]=02b3b001 000000f0 00000000 2c04307d
ext_cpuid[28]=02b3b001 000000f0 00000000 2c04307d
ext_cpuid[29]=02b3b001 000000f0 00000000 2c04307d
ext_cpuid[30]=02b3b001 000000f0 00000000 2c04307d
ext_cpuid[31]=02b3b001 000000f0 00000000 2c04307d
intel_fn4[0]=02b3b001 000000f0 00000000 2c04307d
intel_fn4[1]=02b3b001 000000f0 00000000 2c04307d
intel_fn4[2]=02b3b001 000000f0 00000000 2c04307d
intel_fn4[3]=02b3b001 000000f0 00000000 2c04307d
--------------------------------------------------------------------------------
6
13
6
6
13
1
1
32
32
2048
-1
8
8
-1
64
64
-1
Pentium M (Dothan)
fpu vme de pse tsc msr mce cx8 mtrr sep pge mca cmov pat clflush dts acpi mmx fxsr sse sse2 ss tm pbe est tm2
--------------------------------------------------------------------------------
basic_cpuid[0]=00000005 68747541 444d4163 69746e65
basic_cpuid[1]=00100f23 00040800 00802009 178bfbff
basic_cpuid[2]=00000000 00000000 00000000 00000000
basic_cpuid[3]=00000000 00000000 00000000 00000000
basic_cpuid[4]=00000000 00000000 00000000 00000000
basic_cpuid[5]=00000040 00000040 00000003 00000000
basic_cpuid[6]=00000000 00000000 00000000 00000000
basic_cpuid[7]=00000000 00000000 00000000 00000000
basic_cpuid[8]=00000000 00000000 00000000 00000000
basic_cpuid[9]=00000000 00000000 00000000 00000000
basic_cpuid[10]=00000000 00000000 00000000 00000000
basic_cpuid[11]=00000000 00000000 00000000 00000000
basic_cpuid[12]=00000000 00000000 00000000 00000000
basic_cpuid[13]=00000000 00000000 00000000 00000000
basic_cpuid[14]=00000000 00000000 00000000 00000000
basic_cpuid[15]=00000000 00000000 00000000 00000000
basic_cpuid[16]=00000000 00000000 00000000 00000000
basic_cpuid[17]=00000000 00000000 00000000 00000000
basic_cpuid[18]=00000000 00000000 00000000 00000000
basic_cpuid[19]=00000000 00000000 00000000 00000000
basic_cpuid[20]=00000000 00000000 00000000 00000000
basic_cpuid[21]=00000000 00000000 00000000 00000000
basic_cpuid[22]=00000000 00000000 00000000 00000000
basic_cpuid[23]=00000000 00000000 00000000 00000000
basic_cpuid[24]=00000000 00000000 00000000 00000000
basic_cpuid[25]=00000000 00000000 00000000 00000000
basic_cpuid[26]=00000000 00000000 00000000 00000000
basic_cpuid[27]=00000000 00000000 00000000 00000000
basic_cpuid[28]=00000000 00000000 00000000 00000000
basic_cpuid[29]=00000000 00000000 00000000 00000000
basic_cpuid[30]=00000000 00000000 00000000 00000000
basic_cpuid[31]=00000000 00000000 00000000 00000000
ext_cpuid[0]=8000001a 68747541 444d4163 69746e65
ext_cpuid[1]=00100f23 10001623 000007ff efd3fbff
ext_cpuid[2]=20444d41 6e656850 74286d6f 3920296d
ext_cpuid[3]=20303538 64617551 726f432d 72502065
ext_cpuid[4]=7365636f 00726f73 00000000 00000000
ext_cpuid[5]=ff30ff10 ff30ff20 40020140 40020140
ext_cpuid[6]=20800000 42004200 02008140 0010a140
ext_cpuid[7]=00000000 00000000 00000000 000001f9
ext_cpuid[8]=00003030 00000000 00002003 00000000
ext_cpuid[9]=00000000 00000000 00000000 00000000
ext_cpuid[10]=00000001 00000040 00000000 00000007
ext_cpuid[11]=00000000 00000000 00000000 00000000
ext_cpuid[12]=00000000 00000000 00000000 00000000
ext_cpuid[13]=00000000 00000000 00000000 00000000
ext_cpuid[14]=00000000 00000000 00000000 00000000
ext_cpuid[15]=00000000 00000000 00000000 00000000
ext_cpuid[16]=00000000 00000000 00000000 00000000
ext_cpuid[17]=00000000 00000000 00000000 00000000
ext_cpuid[18]=00000000 00000000 00000000 00000000
ext_cpuid[19]=00000000 00000000 00000000 00000000
ext_cpuid[20]=00000000 00000000 00000000 00000000
ext_cpuid[21]=00000000 00000000 00000000 00000000
ext_cpuid[22]=00000000 00000000 00000000 00000000
ext_cpuid[23]=00000000 00000000 00000000 00000000
ext_cpuid[24]=00000000 00000000 00000000 00000000
ext_cpuid[25]=f0300000 00000000 00000000 00000000
ext_cpuid[26]=00000003 00000000 00000000 00000000
ext_cpuid[27]=00000000 00000000 00000000 00000000
ext_cpuid[28]=00000000 00000000 00000000 00000000
ext_cpuid[29]=00000000 00000000 00000000 00000000
ext_cpuid[30]=00000000 00000000 00000000 00000000
ext_cpuid[31]=00000000 00000000 00000000 00000000
intel_fn4[0]=00000000 00000000 00000000 00000000
intel_fn4[1]=00000000 00000000 00000000 00000000
intel_fn4[2]=00000000 00000000 00000000 00000000
intel_fn4[3]=00000000 00000000 00000000 00000000
--------------------------------------------------------------------------------
15
2
3
16
2
4
4
64
64
512
2048
2
16
32
64
64
64
Phenom X4 (Agena/512K)
fpu vme de pse tsc msr pae mce cx8 apic mtrr sep pge mca cmov pat pse36 clflush mmx fxsr sse sse2 ht pni monitor cx16 syscall popcnt mmxext 3dnow 3dnowext nx fxsr_opt rdtscp lm lahf_lm cmp_legacy svm abm misalignsse sse4a 3dnowprefetch osvw ibs ts ttp tm_amd stc 100mhzsteps hwpstate constant_tsc
--------------------------------------------------------------------------------
basic_cpuid[0]=0000000a 756e6547 6c65746e 49656e69
basic_cpuid[1]=00010676 05040800 000ce3bd bfebfbff
basic_cpuid[2]=05b0b101 005657f0 00000000 2cb4304e
basic_cpuid[3]=00000000 00000000 00000000 00000000
basic_cpuid[4]=0c000121 01c0003f 0000003f 00000001
basic_cpuid[5]=00000040 00000040 00000003 00002220
basic_cpuid[6]=00000001 00000002 00000001 00000000
basic_cpuid[7]=00000000 00000000 00000000 00000000
basic_cpuid[8]=00000400 00000000 00000000 00000000
basic_cpuid[9]=00000000 00000000 00000000 00000000
basic_cpuid[10]=07280202 00000000 00000000 00000503
basic_cpuid[11]=07280202 00000000 00000000 00000503
basic_cpuid[12]=07280202 00000000 00000000 00000503
basic_cpuid[13]=07280202 00000000 00000000 00000503
basic_cpuid[14]=07280202 00000000 00000000 00000503
basic_cpuid[15]=07280202 00000000 00000000 00000503
basic_cpuid[16]=07280202 00000000 00000000 00000503
basic_cpuid[17]=07280202 00000000 00000000 00000503
basic_cpuid[18]=07280202 00000000 00000000 00000503
basic_cpuid[19]=07280202 00000000 00000000 00000503
basic_cpuid[20]=07280202 00000000 00000000 00000503
basic_cpuid[21]=07280202 00000000 00000000 00000503
basic_cpuid[22]=07280202 00000000 00000000 00000503
basic_cpuid[23]=07280202 00000000 00000000 00000503
basic_cpuid[24]=07280202 00000000 00000000 00000503
basic_cpuid[25]=07280202 00000000 00000000 00000503
basic_cpuid[26]=07280202 00000000 00000000 00000503
basic_cpuid[27]=07280202 00000000 00000000 00000503
basic_cpuid[28]=07280202 00000000 00000000 00000503
basic_cpuid[29]=07280202 00000000 00000000 00000503
basic_cpuid[30]=07280202 00000000 00000000 00000503
basic_cpuid[31]=07280202 00000000 00000000 00000503
ext_cpuid[0]=80000008 00000000 00000000 00000000
ext_cpuid[1]=00000000 00000000 00000001 20100000
ext_cpuid[2]=65746e49 2952286c 6f655820 2952286e
ext_cpuid[3]=55504320 20202020 20202020 45202020
ext_cpuid[4]=30323435 20402020 30352e32 007a4847
ext_cpuid[5]=00000000 00000000 00000000 00000000
ext_cpuid[6]=00000000 00000000 18008040 00000000
ext_cpuid[7]=00000000 00000000 00000000 00000000
ext_cpuid[8]=00003026 00000000 00000000 00000000
ext_cpuid[9]=07280202 00000000 00000000 00000503
ext_cpuid[10]=07280202 00000000 00000000 00000503
ext_cpuid[11]=07280202 00000000 00000000 00000503
ext_cpuid[12]=07280202 00000000 00000000 00000503
ext_cpuid[13]=07280202 00000000 00000000 00000503
ext_cpuid[14]=07280202 00000000 00000000 00000503
ext_cpuid[15]=07280202 00000000 00000000 00000503
ext_cpuid[16]=07280202 00000000 00000000 00000503
ext_cpuid[17]=07280202 00000000 00000000 00000503
ext_cpuid[18]=07280202 00000000 00000000 00000503
ext_cpuid[19]=07280202 00000000 00000000 00000503
ext_cpuid[20]=07280202 00000000 00000000 00000503
ext_cpuid[21]=07280202 00000000 00000000 00000503
ext_cpuid[22]=07280202 00000000 00000000 00000503
ext_cpuid[23]=07280202 00000000 00000000 00000503
ext_cpuid[24]=07280202 00000000 00000000 00000503
ext_cpuid[25]=07280202 00000000 00000000 00000503
ext_cpuid[26]=07280202 00000000 00000000 00000503
ext_cpuid[27]=07280202 00000000 00000000 00000503
ext_cpuid[28]=07280202 00000000 00000000 00000503
ext_cpuid[29]=07280202 00000000 00000000 00000503
ext_cpuid[30]=07280202 00000000 00000000 00000503
ext_cpuid[31]=07280202 00000000 00000000 00000503
intel_fn4[0]=0c000121 01c0003f 0000003f 00000001
intel_fn4[1]=0c000122 01c0003f 0000003f 00000001
intel_fn4[2]=0c004143 05c0003f 00000fff 00000001
intel_fn4[3]=00000000 00000000 00000000 00000000
--------------------------------------------------------------------------------
6
7
6
6
23
4
4
32
32
6144
-1
8
24
-1
64
64
-1
Xeon (Harpertown)
fpu vme de pse tsc msr pae mce cx8 apic mtrr sep pge mca cmov pat pse36 clflush dts acpi mmx fxsr sse sse2 ss ht tm pbe pni dts64 monitor ds_cpl vmx est tm2 ssse3 cx16 xtpr pdcm dca sse4_1 xd lm lahf_lm
--------------------------------------------------------------------------------
basic_cpuid[0]=00000001 68747541 444d4163 69746e65
basic_cpuid[1]=00000681 00000000 00000000 0383fbff
basic_cpuid[2]=00000000 00000000 00000000 00000000
basic_cpuid[3]=00000000 00000000 00000000 00000000
basic_cpuid[4]=00000000 00000000 00000000 00000000
basic_cpuid[5]=00000000 00000000 00000000 00000000
basic_cpuid[6]=00000000 00000000 00000000 00000000
basic_cpuid[7]=00000000 00000000 00000000 00000000
basic_cpuid[8]=00000000 00000000 00000000 00000000
basic_cpuid[9]=00000000 00000000 00000000 00000000
basic_cpuid[10]=00000000 00000000 00000000 00000000
basic_cpuid[11]=00000000 00000000 00000000 00000000
basic_cpuid[12]=00000000 00000000 00000000 00000000
basic_cpuid[13]=00000000 00000000 00000000 00000000
basic_cpuid[14]=00000000 00000000 00000000 00000000
basic_cpuid[15]=00000000 00000000 00000000 00000000
basic_cpuid[16]=00000000 00000000 00000000 00000000
basic_cpuid[17]=00000000 00000000 00000000 00000000
basic_cpuid[18]=00000000 00000000 00000000 00000000
basic_cpuid[19]=00000000 00000000 00000000 00000000
basic_cpuid[20]=00000000 00000000 00000000 00000000
basic_cpuid[21]=00000000 00000000 00000000 00000000
basic_cpuid[22]=00000000 00000000 00000000 00000000
basic_cpuid[23]=00000000 00000000 00000000 00000000
basic_cpuid[24]=00000000 00000000 00000000 00000000
basic_cpuid[25]=00000000 00000000 00000000 00000000
basic_cpuid[26]=00000000 00000000 00000000 00000000
basic_cpuid[27]=00000000 00000000 00000000 00000000
basic_cpuid[28]=00000000 00000000 00000000 00000000
basic_cpuid[29]=00000000 00000000 00000000 00000000
basic_cpuid[30]=00000000 00000000 00000000 00000000
basic_cpuid[31]=00000000 00000000 00000000 00000000
ext_cpuid[0]=80000008 68747541 444d4163 69746e65
ext_cpuid[1]=00000781 00000000 00000000 c1c3fbff
ext_cpuid[2]=20444d41 6c687441 74286e6f 5820296d
ext_cpuid[3]=00000050 00000000 00000000 00000000
ext_cpuid[4]=00000000 00000000 00000000 00000000
ext_cpuid[5]=0408ff08 ff20ff10 40020140 40020140
ext_cpuid[6]=00000000 41004100 01008140 00000000
ext_cpuid[7]=00000000 00000000 00000000 00000001
ext_cpuid[8]=00002022 00000000 00000000 00000000
ext_cpuid[9]=00000000 00000000 00000000 00000000
ext_cpuid[10]=00000000 00000000 00000000 00000000
ext_cpuid[11]=00000000 00000000 00000000 00000000
ext_cpuid[12]=00000000 00000000 00000000 00000000
ext_cpuid[13]=00000000 00000000 00000000 00000000
ext_cpuid[14]=00000000 00000000 00000000 00000000
ext_cpuid[15]=00000000 00000000 00000000 00000000
ext_cpuid[16]=00000000 00000000 00000000 00000000
ext_cpuid[17]=00000000 00000000 00000000 00000000
ext_cpuid[18]=00000000 00000000 00000000 00000000
ext_cpuid[19]=00000000 00000000 00000000 00000000
ext_cpuid[20]=00000000 00000000 00000000 00000000
ext_cpuid[21]=00000000 00000000 00000000 00000000
ext_cpuid[22]=00000000 00000000 00000000 00000000
ext_cpuid[23]=00000000 00000000 00000000 00000000
ext_cpuid[24]=00000000 00000000 00000000 00000000
ext_cpuid[25]=00000000 00000000 00000000 00000000
ext_cpuid[26]=00000000 00000000 00000000 00000000
ext_cpuid[27]=00000000 00000000 00000000 00000000
ext_cpuid[28]=00000000 00000000 00000000 00000000
ext_cpuid[29]=00000000 00000000 00000000 00000000
ext_cpuid[30]=00000000 00000000 00000000 00000000
ext_cpuid[31]=00000000 00000000 00000000 00000000
intel_fn4[0]=00000000 00000000 00000000 00000000
intel_fn4[1]=00000000 00000000 00000000 00000000
intel_fn4[2]=00000000 00000000 00000000 00000000
intel_fn4[3]=00000000 00000000 00000000 00000000
--------------------------------------------------------------------------------
6
8
1
6
8
1
1
64
64
256
0
2
16
-1
64
64
-1
Athlon XP (Thoroughbred)
fpu vme de pse tsc msr pae mce cx8 apic mtrr sep pge mca cmov pat pse36 mmx fxsr sse syscall mmxext 3dnow 3dnowext ts
--------------------------------------------------------------------------------
basic_cpuid[0]=0000000a 756e6547 6c65746e 49656e69
basic_cpuid[1]=000006f7 03040800 0004e33d bfebfbff
basic_cpuid[2]=05b0b101 005657f0 00000000 2cb43049
basic_cpuid[3]=00000000 00000000 00000000 00000000
basic_cpuid[4]=0c000121 01c0003f 0000003f 00000001
basic_cpuid[5]=00000040 00000040 00000003 00000020
basic_cpuid[6]=00000001 00000002 00000001 00000000
basic_cpuid[7]=00000000 00000000 00000000 00000000
basic_cpuid[8]=00000400 00000000 00000000 00000000
basic_cpuid[9]=00000000 00000000 00000000 00000000
basic_cpuid[10]=07280202 00000000 00000000 00000000
basic_cpuid[11]=07280202 00000000 00000000 00000000
basic_cpuid[12]=07280202 00000000 00000000 00000000
basic_cpuid[13]=07280202 00000000 00000000 00000000
basic_cpuid[14]=07280202 00000000 00000000 00000000
basic_cpuid[15]=07280202 00000000 00000000 00000000
basic_cpuid[16]=07280202 00000000 00000000 00000000
basic_cpuid[17]=07280202 00000000 00000000 00000000
basic_cpuid[18]=07280202 00000000 00000000 00000000
basic_cpuid[19]=07280202 00000000 00000000 00000000
basic_cpuid[20]=07280202 00000000 00000000 00000000
basic_cpuid[21]=07280202 00000000 00000000 00000000
basic_cpuid[22]=07280202 00000000 00000000 00000000
basic_cpuid[23]=07280202 00000000 00000000 00000000
basic_cpuid[24]=07280202 00000000 00000000 00000000
basic_cpuid[25]=07280202 00000000 00000000 00000000
basic_cpuid[26]=07280202 00000000 00000000 00000000
basic_cpuid[27]=07280202 00000000 00000000 00000000
basic_cpuid[28]=07280202 00000000 00000000 00000000
basic_cpuid[29]=07280202 00000000 00000000 00000000
basic_cpuid[30]=07280202 00000000 00000000 00000000
basic_cpuid[31]=07280202 00000000 00000000 00000000
ext_cpuid[0]=80000008 00000000 00000000 00000000
ext_cpuid[1]=00000000 00000000 00000001 20100000
ext_cpuid[2]=65746e49 2952286c 6f655820 2952286e
ext_cpuid[3]=55504320 20202020 20202020 45202020
ext_cpuid[4]=35333335 20402020 30302e32 007a4847
ext_cpuid[5]=00000000 00000000 00000000 00000000
ext_cpuid[6]=00000000 00000000 10008040 00000000
ext_cpuid[7]=00000000 00000000 00000000 00000000
ext_cpuid[8]=00003024 00000000 00000000 00000000
ext_cpuid[9]=07280202 00000000 00000000 00000000
ext_cpuid[10]=07280202 00000000 00000000 00000000
ext_cpuid[11]=07280202 00000000 00000000 00000000
ext_cpuid[12]=07280202 00000000 00000000 00000000
ext_cpuid[13]=07280202 00000000 00000000 00000000
ext_cpuid[14]=07280202 00000000 00000000 00000000
ext_cpuid[15]=07280202 00000000 00000000 00000000
ext_cpuid[16]=07280202 00000000 00000000 00000000
ext_cpuid[17]=07280202 00000000 00000000 00000000
ext_cpuid[18]=07280202 00000000 00000000 00000000
ext_cpuid[19]=07280202 00000000 00000000 00000000
ext_cpuid[20]=07280202 00000000 00000000 00000000
ext_cpuid[21]=07280202 00000000 00000000 00000000
ext_cpuid[22]=07280202 00000000 00000000 00000000
ext_cpuid[23]=07280202 00000000 00000000 00000000
ext_cpuid[24]=07280202 00000000 00000000 00000000
ext_cpuid[25]=07280202 00000000 00000000 00000000
ext_cpuid[26]=07280202 00000000 00000000 00000000
ext_cpuid[27]=07280202 00000000 00000000 00000000
ext_cpuid[28]=07280202 00000000 00000000 00000000
ext_cpuid[29]=07280202 00000000 00000000 00000000
ext_cpuid[30]=07280202 00000000 00000000 00000000
ext_cpuid[31]=07280202 00000000 00000000 00000000
intel_fn4[0]=0c000121 01c0003f 0000003f 00000001
intel_fn4[1]=0c000122 01c0003f 0000003f 00000001
intel_fn4[2]=0c004143 03c0003f 00000fff 00000001
intel_fn4[3]=00000000 00000000 00000000 00000000
--------------------------------------------------------------------------------
6
15
7
6
15
4
4
32
32
4096
-1
8
16
-1
64
64
-1
Xeon (Clovertown)
fpu vme de pse tsc msr pae mce cx8 apic mtrr sep pge mca cmov pat pse36 clflush dts acpi mmx fxsr sse sse2 ss ht tm pbe pni dts64 monitor ds_cpl vmx tm2 ssse3 cx16 xtpr pdcm dca xd lm lahf_lm
--------------------------------------------------------------------------------
basic_cpuid[0]=0000000a 756e6547 6c65746e 49656e69
basic_cpuid[1]=000006f6 01020800 0000e3bd bfebfbff
basic_cpuid[2]=05b0b101 005657f0 00000000 2cb4307d
basic_cpuid[3]=00000000 00000000 00000000 00000000
basic_cpuid[4]=04000121 01c0003f 0000003f 00000001
basic_cpuid[5]=00000040 00000040 00000003 00022220
basic_cpuid[6]=00000001 00000002 00000001 00000000
basic_cpuid[7]=00000000 00000000 00000000 00000000
basic_cpuid[8]=00000400 00000000 00000000 00000000
basic_cpuid[9]=00000000 00000000 00000000 00000000
basic_cpuid[10]=07280202 00000000 00000000 00000000
basic_cpuid[11]=07280202 00000000 00000000 00000000
basic_cpuid[12]=07280202 00000000 00000000 00000000
basic_cpuid[13]=07280202 00000000 00000000 00000000
basic_cpuid[14]=07280202 00000000 00000000 00000000
basic_cpuid[15]=07280202 00000000 00000000 00000000
basic_cpuid[16]=07280202 00000000 00000000 00000000
basic_cpuid[17]=07280202 00000000 00000000 00000000
basic_cpuid[18]=07280202 00000000 00000000 00000000
basic_cpuid[19]=07280202 00000000 00000000 00000000
basic_cpuid[20]=07280202 00000000 00000000 00000000
basic_cpuid[21]=07280202 00000000 00000000 00000000
basic_cpuid[22]=07280202 00000000 00000000 00000000
basic_cpuid[23]=07280202 00000000 00000000 00000000
basic_cpuid[24]=07280202 00000000 00000000 00000000
basic_cpuid[25]=07280202 00000000 00000000 00000000
basic_cpuid[26]=07280202 00000000 00000000 00000000
basic_cpuid[27]=07280202 00000000 00000000 00000000
basic_cpuid[28]=07280202 00000000 00000000 00000000
basic_cpuid[29]=07280202 00000000 00000000 00000000
basic_cpuid[30]=07280202 00000000 00000000 00000000
basic_cpuid[31]=07280202 00000000 00000000 00000000
ext_cpuid[0]=80000008 00000000 00000000 00000000
ext_cpuid[1]=00000000 00000000 00000001 20100000
ext_cpuid[2]=65746e49 2952286c 726f4320 4d542865
ext_cpuid[3]=43203229 20205550 20202020 54202020
ext_cpuid[4]=30303635 20402020 33382e31 007a4847
ext_cpuid[5]=00000000 00000000 00000000 00000000
ext_cpuid[6]=00000000 00000000 08006040 00000000
ext_cpuid[7]=00000000 00000000 00000000 00000000
ext_cpuid[8]=00003024 00000000 00000000 00000000
ext_cpuid[9]=07280202 00000000 00000000 00000000
ext_cpuid[10]=07280202 00000000 00000000 00000000
ext_cpuid[11]=07280202 00000000 00000000 00000000
ext_cpuid[12]=07280202 00000000 00000000 00000000
ext_cpuid[13]=07280202 00000000 00000000 00000000
ext_cpuid[14]=07280202 00000000 00000000 00000000
ext_cpuid[15]=07280202 00000000 00000000 00000000
ext_cpuid[16]=07280202 00000000 00000000 00000000
ext_cpuid[17]=07280202 00000000 00000000 00000000
ext_cpuid[18]=07280202 00000000 00000000 00000000
ext_cpuid[19]=07280202 00000000 00000000 00000000
ext_cpuid[20]=07280202 00000000 00000000 00000000
ext_cpuid[21]=07280202 00000000 00000000 00000000
ext_cpuid[22]=07280202 00000000 00000000 00000000
ext_cpuid[23]=07280202 00000000 00000000 00000000
ext_cpuid[24]=07280202 00000000 00000000 00000000
ext_cpuid[25]=07280202 00000000 00000000 00000000
ext_cpuid[26]=07280202 00000000 00000000 00000000
ext_cpuid[27]=07280202 00000000 00000000 00000000
ext_cpuid[28]=07280202 00000000 00000000 00000000
ext_cpuid[29]=07280202 00000000 00000000 00000000
ext_cpuid[30]=07280202 00000000 00000000 00000000
ext_cpuid[31]=07280202 00000000 00000000 00000000
intel_fn4[0]=04000121 01c0003f 0000003f 00000001
intel_fn4[1]=04000122 01c0003f 0000003f 00000001
intel_fn4[2]=04004143 01c0003f 00000fff 00000001
intel_fn4[3]=00000000 00000000 00000000 00000000
--------------------------------------------------------------------------------
6
15
6
6
15
2
2
32
32
2048
-1
8
8
-1
64
64
-1
Merom (Core 2 Duo) 2048K
fpu vme de pse tsc msr pae mce cx8 apic mtrr sep pge mca cmov pat pse36 clflush dts acpi mmx fxsr sse sse2 ss ht tm pbe pni dts64 monitor ds_cpl vmx est tm2 ssse3 cx16 xtpr pdcm xd lm lahf_lm
--------------------------------------------------------------------------------
basic_cpuid[0]=0000000a 756e6547 6c65746e 49656e69
basic_cpuid[1]=00010676 00020800 0008e3bd bfebfbff
basic_cpuid[2]=05b0b101 005657f0 00000000 2cb43048
basic_cpuid[3]=00000000 00000000 00000000 00000000
basic_cpuid[4]=04000121 01c0003f 0000003f 00000001
basic_cpuid[5]=00000040 00000040 00000003 03122220
basic_cpuid[6]=00000003 00000002 00000001 00000000
basic_cpuid[7]=00000000 00000000 00000000 00000000
basic_cpuid[8]=00000400 00000000 00000000 00000000
basic_cpuid[9]=00000000 00000000 00000000 00000000
basic_cpuid[10]=07280202 00000000 00000000 00000503
basic_cpuid[11]=07280202 00000000 00000000 00000503
basic_cpuid[12]=07280202 00000000 00000000 00000503
basic_cpuid[13]=07280202 00000000 00000000 00000503
basic_cpuid[14]=07280202 00000000 00000000 00000503
basic_cpuid[15]=07280202 00000000 00000000 00000503
basic_cpuid[16]=07280202 00000000 00000000 00000503
basic_cpuid[17]=07280202 00000000 00000000 00000503
basic_cpuid[18]=07280202 00000000 00000000 00000503
basic_cpuid[19]=07280202 00000000 00000000 00000503
basic_cpuid[20]=07280202 00000000 00000000 00000503
basic_cpuid[21]=07280202 00000000 00000000 00000503
basic_cpuid[22]=07280202 00000000 00000000 00000503
basic_cpuid[23]=07280202 00000000 00000000 00000503
basic_cpuid[24]=07280202 00000000 00000000 00000503
basic_cpuid[25]=07280202 00000000 00000000 00000503
basic_cpuid[26]=07280202 00000000 00000000 00000503
basic_cpuid[27]=07280202 00000000 00000000 00000503
basic_cpuid[28]=07280202 00000000 00000000 00000503
basic_cpuid[29]=07280202 00000000 00000000 00000503
basic_cpuid[30]=07280202 00000000 00000000 00000503
basic_cpuid[31]=07280202 00000000 00000000 00000503
ext_cpuid[0]=80000008 00000000 00000000 00000000
ext_cpuid[1]=00000000 00000000 00000001 20100000
ext_cpuid[2]=65746e49 2952286c 726f4320 4d542865
ext_cpuid[3]=44203229 43206f75 20205550 54202020
ext_cpuid[4]=30303138 20402020 30312e32 007a4847
ext_cpuid[5]=00000000 00000000 00000000 00000000
ext_cpuid[6]=00000000 00000000 0c006040 00000000
ext_cpuid[7]=00000000 00000000 00000000 00000000
ext_cpuid[8]=00003024 00000000 00000000 00000000
ext_cpuid[9]=07280202 00000000 00000000 00000503
ext_cpuid[10]=07280202 00000000 00000000 00000503
ext_cpuid[11]=07280202 00000000 00000000 00000503
ext_cpuid[12]=07280202 00000000 00000000 00000503
ext_cpuid[13]=07280202 00000000 00000000 00000503
ext_cpuid[14]=07280202 00000000 00000000 00000503
ext_cpuid[15]=07280202 00000000 00000000 00000503
ext_cpuid[16]=07280202 00000000 00000000 00000503
ext_cpuid[17]=07280202 00000000 00000000 00000503
ext_cpuid[18]=07280202 00000000 00000000 00000503
ext_cpuid[19]=07280202 00000000 00000000 00000503
ext_cpuid[20]=07280202 00000000 00000000 00000503
ext_cpuid[21]=07280202 00000000 00000000 00000503
ext_cpuid[22]=07280202 00000000 00000000 00000503
ext_cpuid[23]=07280202 00000000 00000000 00000503
ext_cpuid[24]=07280202 00000000 00000000 00000503
ext_cpuid[25]=07280202 00000000 00000000 00000503
ext_cpuid[26]=07280202 00000000 00000000 00000503
ext_cpuid[27]=07280202 00000000 00000000 00000503
ext_cpuid[28]=07280202 00000000 00000000 00000503
ext_cpuid[29]=07280202 00000000 00000000 00000503
ext_cpuid[30]=07280202 00000000 00000000 00000503
ext_cpuid[31]=07280202 00000000 00000000 00000503
intel_fn4[0]=04000121 01c0003f 0000003f 00000001
intel_fn4[1]=04000122 01c0003f 0000003f 00000001
intel_fn4[2]=04004143 02c0003f 00000fff 00000001
intel_fn4[3]=00000000 00000000 00000000 00000000
--------------------------------------------------------------------------------
6
7
6
6
23
2
2
32
32
3072
-1
8
12
-1
64
64
-1
Penryn (Core 2 Duo) 3M
fpu vme de pse tsc msr pae mce cx8 apic mtrr sep pge mca cmov pat pse36 clflush dts acpi mmx fxsr sse sse2 ss ht tm pbe pni dts64 monitor ds_cpl vmx est tm2 ssse3 cx16 xtpr pdcm sse4_1 xd lm lahf_lm
--------------------------------------------------------------------------------
basic_cpuid[0]=00000002 756e6547 6c65746e 49656e69
basic_cpuid[1]=0000066a 00000000 00000000 0183f9ff
basic_cpuid[2]=03020101 00000000 00000000 0c040842
basic_cpuid[3]=03020101 00000000 00000000 0c040842
basic_cpuid[4]=03020101 00000000 00000000 0c040842
basic_cpuid[5]=03020101 00000000 00000000 0c040842
basic_cpuid[6]=03020101 00000000 00000000 0c040842
basic_cpuid[7]=03020101 00000000 00000000 0c040842
basic_cpuid[8]=03020101 00000000 00000000 0c040842
basic_cpuid[9]=03020101 00000000 00000000 0c040842
basic_cpuid[10]=03020101 00000000 00000000 0c040842
basic_cpuid[11]=03020101 00000000 00000000 0c040842
basic_cpuid[12]=03020101 00000000 00000000 0c040842
basic_cpuid[13]=03020101 00000000 00000000 0c040842
basic_cpuid[14]=03020101 00000000 00000000 0c040842
basic_cpuid[15]=03020101 00000000 00000000 0c040842
basic_cpuid[16]=03020101 00000000 00000000 0c040842
basic_cpuid[17]=03020101 00000000 00000000 0c040842
basic_cpuid[18]=03020101 00000000 00000000 0c040842
basic_cpuid[19]=03020101 00000000 00000000 0c040842
basic_cpuid[20]=03020101 00000000 00000000 0c040842
basic_cpuid[21]=03020101 00000000 00000000 0c040842
basic_cpuid[22]=03020101 00000000 00000000 0c040842
basic_cpuid[23]=03020101 00000000 00000000 0c040842
basic_cpuid[24]=03020101 00000000 00000000 0c040842
basic_cpuid[25]=03020101 00000000 00000000 0c040842
basic_cpuid[26]=03020101 00000000 00000000 0c040842
basic_cpuid[27]=03020101 00000000 00000000 0c040842
basic_cpuid[28]=03020101 00000000 00000000 0c040842
basic_cpuid[29]=03020101 00000000 00000000 0c040842
basic_cpuid[30]=03020101 00000000 00000000 0c040842
basic_cpuid[31]=03020101 00000000 00000000 0c040842
ext_cpuid[0]=03020101 00000000 00000000 0c040842
ext_cpuid[1]=03020101 00000000 00000000 0c040842
ext_cpuid[2]=03020101 00000000 00000000 0c040842
ext_cpuid[3]=03020101 00000000 00000000 0c040842
ext_cpuid[4]=03020101 00000000 00000000 0c040842
ext_cpuid[5]=03020101 00000000 00000000 0c040842
ext_cpuid[6]=03020101 00000000 00000000 0c040842
ext_cpuid[7]=03020101 00000000 00000000 0c040842
ext_cpuid[8]=03020101 00000000 00000000 0c040842
ext_cpuid[9]=03020101 00000000 00000000 0c040842
ext_cpuid[10]=03020101 00000000 00000000 0c040842
ext_cpuid[11]=03020101 00000000 00000000 0c040842
ext_cpuid[12]=03020101 00000000 00000000 0c040842
ext_cpuid[13]=03020101 00000000 00000000 0c040842
ext_cpuid[14]=03020101 00000000 00000000 0c040842
ext_cpuid[15]=03020101 00000000 00000000 0c040842
ext_cpuid[16]=03020101 00000000 00000000 0c040842
ext_cpuid[17]=03020101 00000000 00000000 0c040842
ext_cpuid[18]=03020101 00000000 00000000 0c040842
ext_cpuid[19]=03020101 00000000 00000000 0c040842
ext_cpuid[20]=03020101 00000000 00000000 0c040842
ext_cpuid[21]=03020101 00000000 00000000 0c040842
ext_cpuid[22]=03020101 00000000 00000000 0c040842
ext_cpuid[23]=03020101 00000000 00000000 0c040842
ext_cpuid[24]=03020101 00000000 00000000 0c040842
ext_cpuid[25]=03020101 00000000 00000000 0c040842
ext_cpuid[26]=03020101 00000000 00000000 0c040842
ext_cpuid[27]=03020101 00000000 00000000 0c040842
ext_cpuid[28]=03020101 00000000 00000000 0c040842
ext_cpuid[29]=03020101 00000000 00000000 0c040842
ext_cpuid[30]=03020101 00000000 00000000 0c040842
ext_cpuid[31]=03020101 00000000 00000000 0c040842
intel_fn4[0]=03020101 00000000 00000000 0c040842
intel_fn4[1]=03020101 00000000 00000000 0c040842
intel_fn4[2]=03020101 00000000 00000000 0c040842
intel_fn4[3]=03020101 00000000 00000000 0c040842
--------------------------------------------------------------------------------
6
6
10
6
6
1
1
16
16
256
-1
4
4
-1
32
32
-1
Pentium II (Dixon)
fpu vme de pse tsc msr pae mce cx8 mtrr sep pge mca cmov pat pse36 mmx fxsr syscall
--------------------------------------------------------------------------------
basic_cpuid[0]=00000001 68747541 444d4163 69746e65
basic_cpuid[1]=000006a0 00000000 00000000 0383fbff
basic_cpuid[2]=00000000 00000000 00000000 00000000
basic_cpuid[3]=00000000 00000000 00000000 00000000
basic_cpuid[4]=00000000 00000000 00000000 00000000
basic_cpuid[5]=00000000 00000000 00000000 00000000
basic_cpuid[6]=00000000 00000000 00000000 00000000
basic_cpuid[7]=00000000 00000000 00000000 00000000
basic_cpuid[8]=00000000 00000000 00000000 00000000
basic_cpuid[9]=00000000 00000000 00000000 00000000
basic_cpuid[10]=00000000 00000000 00000000 00000000
basic_cpuid[11]=00000000 00000000 00000000 00000000
basic_cpuid[12]=00000000 00000000 00000000 00000000
basic_cpuid[13]=00000000 00000000 00000000 00000000
basic_cpuid[14]=00000000 00000000 00000000 00000000
basic_cpuid[15]=00000000 00000000 00000000 00000000
basic_cpuid[16]=00000000 00000000 00000000 00000000
basic_cpuid[17]=00000000 00000000 00000000 00000000
basic_cpuid[18]=00000000 00000000 00000000 00000000
basic_cpuid[19]=00000000 00000000 00000000 00000000
basic_cpuid[20]=00000000 00000000 00000000 00000000
basic_cpuid[21]=00000000 00000000 00000000 00000000
basic_cpuid[22]=00000000 00000000 00000000 00000000
basic_cpuid[23]=00000000 00000000 00000000 00000000
basic_cpuid[24]=00000000 00000000 00000000 00000000
basic_cpuid[25]=00000000 00000000 00000000 00000000
basic_cpuid[26]=00000000 00000000 00000000 00000000
basic_cpuid[27]=00000000 00000000 00000000 00000000
basic_cpuid[28]=00000000 00000000 00000000 00000000
basic_cpuid[29]=00000000 00000000 00000000 00000000
basic_cpuid[30]=00000000 00000000 00000000 00000000
basic_cpuid[31]=00000000 00000000 00000000 00000000
ext_cpuid[0]=80000008 68747541 444d4163 69746e65
ext_cpuid[1]=000007a0 00000000 00000000 c1cbfbff
ext_cpuid[2]=20444d41 706d6553 286e6f72 20296d74
ext_cpuid[3]=30303320 00002b30 00000000 00000000
ext_cpuid[4]=00000000 00000000 00000000 00000000
ext_cpuid[5]=0408ff08 ff20ff10 40020140 40020140
ext_cpuid[6]=00000000 41004100 02008140 00000000
ext_cpuid[7]=00000000 00000000 00000000 00000007
ext_cpuid[8]=00002022 00000000 00000000 00000000
ext_cpuid[9]=00000000 00000000 00000000 00000000
ext_cpuid[10]=00000000 00000000 00000000 00000000
ext_cpuid[11]=00000000 00000000 00000000 00000000
ext_cpuid[12]=00000000 00000000 00000000 00000000
ext_cpuid[13]=00000000 00000000 00000000 00000000
ext_cpuid[14]=00000000 00000000 00000000 00000000
ext_cpuid[15]=00000000 00000000 00000000 00000000
ext_cpuid[16]=00000000 00000000 00000000 00000000
ext_cpuid[17]=00000000 00000000 00000000 00000000
ext_cpuid[18]=00000000 00000000 00000000 00000000
ext_cpuid[19]=00000000 00000000 00000000 00000000
ext_cpuid[20]=00000000 00000000 00000000 00000000
ext_cpuid[21]=00000000 00000000 00000000 00000000
ext_cpuid[22]=00000000 00000000 00000000 00000000
ext_cpuid[23]=00000000 00000000 00000000 00000000
ext_cpuid[24]=00000000 00000000 00000000 00000000
ext_cpuid[25]=00000000 00000000 00000000 00000000
ext_cpuid[26]=00000000 00000000 00000000 00000000
ext_cpuid[27]=00000000 00000000 00000000 00000000
ext_cpuid[28]=00000000 00000000 00000000 00000000
ext_cpuid[29]=00000000 00000000 00000000 00000000
ext_cpuid[30]=00000000 00000000 00000000 00000000
ext_cpuid[31]=00000000 00000000 00000000 00000000
intel_fn4[0]=00000000 00000000 00000000 00000000
intel_fn4[1]=00000000 00000000 00000000 00000000
intel_fn4[2]=00000000 00000000 00000000 00000000
intel_fn4[3]=00000000 00000000 00000000 00000000
--------------------------------------------------------------------------------
6
10
0
6
10
1
1
64
64
512
0
2
16
-1
64
64
-1
Sempron (Barton)
fpu vme de pse tsc msr pae mce cx8 apic mtrr sep pge mca cmov pat pse36 mmx fxsr sse syscall mmxext 3dnow 3dnowext ts fid vid
--------------------------------------------------------------------------------
basic_cpuid[0]=00000001 68747541 444d4163 69746e65
basic_cpuid[1]=00020f42 00000800 00000001 078bfbff
basic_cpuid[2]=00000000 00000000 00000000 00000000
basic_cpuid[3]=00000000 00000000 00000000 00000000
basic_cpuid[4]=00000000 00000000 00000000 00000000
basic_cpuid[5]=00000000 00000000 00000000 00000000
basic_cpuid[6]=00000000 00000000 00000000 00000000
basic_cpuid[7]=00000000 00000000 00000000 00000000
basic_cpuid[8]=00000000 00000000 00000000 00000000
basic_cpuid[9]=00000000 00000000 00000000 00000000
basic_cpuid[10]=00000000 00000000 00000000 00000000
basic_cpuid[11]=00000000 00000000 00000000 00000000
basic_cpuid[12]=00000000 00000000 00000000 00000000
basic_cpuid[13]=00000000 00000000 00000000 00000000
basic_cpuid[14]=00000000 00000000 00000000 00000000
basic_cpuid[15]=00000000 00000000 00000000 00000000
basic_cpuid[16]=00000000 00000000 00000000 00000000
basic_cpuid[17]=00000000 00000000 00000000 00000000
basic_cpuid[18]=00000000 00000000 00000000 00000000
basic_cpuid[19]=00000000 00000000 00000000 00000000
basic_cpuid[20]=00000000 00000000 00000000 00000000
basic_cpuid[21]=00000000 00000000 00000000 00000000
basic_cpuid[22]=00000000 00000000 00000000 00000000
basic_cpuid[23]=00000000 00000000 00000000 00000000
basic_cpuid[24]=00000000 00000000 00000000 00000000
basic_cpuid[25]=00000000 00000000 00000000 00000000
basic_cpuid[26]=00000000 00000000 00000000 00000000
basic_cpuid[27]=00000000 00000000 00000000 00000000
basic_cpuid[28]=00000000 00000000 00000000 00000000
basic_cpuid[29]=00000000 00000000 00000000 00000000
basic_cpuid[30]=00000000 00000000 00000000 00000000
basic_cpuid[31]=00000000 00000000 00000000 00000000
ext_cpuid[0]=80000018 68747541 444d4163 69746e65
ext_cpuid[1]=00020f42 0000028c 00000001 e3d3fbff
ext_cpuid[2]=20444d41 69727554 74286e6f 3620296d
ext_cpuid[3]=6f4d2034 656c6962 63655420 6c6f6e68
ext_cpuid[4]=2079676f 332d4c4d 00000034 00000000
ext_cpuid[5]=ff08ff08 ff20ff20 40020140 40020140
ext_cpuid[6]=00000000 42004200 04008140 00000000
ext_cpuid[7]=00000000 00000000 00000000 0000003f
ext_cpuid[8]=00003028 00000000 00000000 00000000
ext_cpuid[9]=00000000 00000000 00000000 00000000
ext_cpuid[10]=00000000 00000000 00000000 00000000
ext_cpuid[11]=00000000 00000000 00000000 00000000
ext_cpuid[12]=00000000 00000000 00000000 00000000
ext_cpuid[13]=00000000 00000000 00000000 00000000
ext_cpuid[14]=00000000 00000000 00000000 00000000
ext_cpuid[15]=00000000 00000000 00000000 00000000
ext_cpuid[16]=00000000 00000000 00000000 00000000
ext_cpuid[17]=00000000 00000000 00000000 00000000
ext_cpuid[18]=00000000 00000000 00000000 00000000
ext_cpuid[19]=00000000 00000000 00000000 00000000
ext_cpuid[20]=00000000 00000000 00000000 00000000
ext_cpuid[21]=00000000 00000000 00000000 00000000
ext_cpuid[22]=00000000 00000000 00000000 00000000
ext_cpuid[23]=00000000 00000000 00000000 00000000
ext_cpuid[24]=00000000 00000000 00000000 00000000
ext_cpuid[25]=00000000 00000000 00000000 00000000
ext_cpuid[26]=00000000 00000000 00000000 00000000
ext_cpuid[27]=00000000 00000000 00000000 00000000
ext_cpuid[28]=00000000 00000000 00000000 00000000
ext_cpuid[29]=00000000 00000000 00000000 00000000
ext_cpuid[30]=00000000 00000000 00000000 00000000
ext_cpuid[31]=00000000 00000000 00000000 00000000
intel_fn4[0]=00000000 00000000 00000000 00000000
intel_fn4[1]=00000000 00000000 00000000 00000000
intel_fn4[2]=00000000 00000000 00000000 00000000
intel_fn4[3]=00000000 00000000 00000000 00000000
--------------------------------------------------------------------------------
15
4
2
15
36
1
1
64
64
1024
0
2
16
-1
64
64
-1
Turion 64 (Lancaster/1024K)
fpu vme de pse tsc msr pae mce cx8 apic mtrr sep pge mca cmov pat pse36 clflush mmx fxsr sse sse2 pni syscall mmxext 3dnow 3dnowext nx fxsr_opt lm lahf_lm ts fid vid ttp tm_amd stc
--------------------------------------------------------------------------------
basic_cpuid[0]=00000001 68747541 444d4163 69746e65
basic_cpuid[1]=00010fc0 00000800 00000000 078bfbff
basic_cpuid[2]=00000000 00000000 00000000 00000000
basic_cpuid[3]=00000000 00000000 00000000 00000000
basic_cpuid[4]=00000000 00000000 00000000 00000000
basic_cpuid[5]=00000000 00000000 00000000 00000000
basic_cpuid[6]=00000000 00000000 00000000 00000000
basic_cpuid[7]=00000000 00000000 00000000 00000000
basic_cpuid[8]=00000000 00000000 00000000 00000000
basic_cpuid[9]=00000000 00000000 00000000 00000000
basic_cpuid[10]=00000000 00000000 00000000 00000000
basic_cpuid[11]=00000000 00000000 00000000 00000000
basic_cpuid[12]=00000000 00000000 00000000 00000000
basic_cpuid[13]=00000000 00000000 00000000 00000000
basic_cpuid[14]=00000000 00000000 00000000 00000000
basic_cpuid[15]=00000000 00000000 00000000 00000000
basic_cpuid[16]=00000000 00000000 00000000 00000000
basic_cpuid[17]=00000000 00000000 00000000 00000000
basic_cpuid[18]=00000000 00000000 00000000 00000000
basic_cpuid[19]=00000000 00000000 00000000 00000000
basic_cpuid[20]=00000000 00000000 00000000 00000000
basic_cpuid[21]=00000000 00000000 00000000 00000000
basic_cpuid[22]=00000000 00000000 00000000 00000000
basic_cpuid[23]=00000000 00000000 00000000 00000000
basic_cpuid[24]=00000000 00000000 00000000 00000000
basic_cpuid[25]=00000000 00000000 00000000 00000000
basic_cpuid[26]=00000000 00000000 00000000 00000000
basic_cpuid[27]=00000000 00000000 00000000 00000000
basic_cpuid[28]=00000000 00000000 00000000 00000000
basic_cpuid[29]=00000000 00000000 00000000 00000000
basic_cpuid[30]=00000000 00000000 00000000 00000000
basic_cpuid[31]=00000000 00000000 00000000 00000000
ext_cpuid[0]=80000018 68747541 444d4163 69746e65
ext_cpuid[1]=00010fc0 00000849 00000001 c3d3fbff
ext_cpuid[2]=69626f4d 4120656c 5320444d 72706d65
ext_cpuid[3]=74286e6f 5020296d 65636f72 726f7373
ext_cpuid[4]=30333320 00002b30 00000000 00000000
ext_cpuid[5]=ff08ff08 ff20ff20 40020140 40020140
ext_cpuid[6]=00000000 42004200 00808140 00000000
ext_cpuid[7]=00000000 00000000 00000000 0000000f
ext_cpuid[8]=00002028 00000000 00000000 00000000
ext_cpuid[9]=00000000 00000000 00000000 00000000
ext_cpuid[10]=00000000 00000000 00000000 00000000
ext_cpuid[11]=00000000 00000000 00000000 00000000
ext_cpuid[12]=00000000 00000000 00000000 00000000
ext_cpuid[13]=00000000 00000000 00000000 00000000
ext_cpuid[14]=00000000 00000000 00000000 00000000
ext_cpuid[15]=00000000 00000000 00000000 00000000
ext_cpuid[16]=00000000 00000000 00000000 00000000
ext_cpuid[17]=00000000 00000000 00000000 00000000
ext_cpuid[18]=00000000 00000000 00000000 00000000
ext_cpuid[19]=00000000 00000000 00000000 00000000
ext_cpuid[20]=00000000 00000000 00000000 00000000
ext_cpuid[21]=00000000 00000000 00000000 00000000
ext_cpuid[22]=00000000 00000000 00000000 00000000
ext_cpuid[23]=00000000 00000000 00000000 00000000
ext_cpuid[24]=00000000 00000000 00000000 00000000
ext_cpuid[25]=00000000 00000000 00000000 00000000
ext_cpuid[26]=00000000 00000000 00000000 00000000
ext_cpuid[27]=00000000 00000000 00000000 00000000
ext_cpuid[28]=00000000 00000000 00000000 00000000
ext_cpuid[29]=00000000 00000000 00000000 00000000
ext_cpuid[30]=00000000 00000000 00000000 00000000
ext_cpuid[31]=00000000 00000000 00000000 00000000
intel_fn4[0]=00000000 00000000 00000000 00000000
intel_fn4[1]=00000000 00000000 00000000 00000000
intel_fn4[2]=00000000 00000000 00000000 00000000
intel_fn4[3]=00000000 00000000 00000000 00000000
--------------------------------------------------------------------------------
15
12
0
15
28
1
1
64
64
128
0
2
16
-1
64
64
-1
Mobile Sempron 64 (Sonora/128K)
fpu vme de pse tsc msr pae mce cx8 apic mtrr sep pge mca cmov pat pse36 clflush mmx fxsr sse sse2 syscall mmxext 3dnow 3dnowext nx fxsr_opt lahf_lm ts fid vid ttp
--------------------------------------------------------------------------------
basic_cpuid[0]=00000006 756e6547 6c65746e 49656e69
basic_cpuid[1]=000006e8 00020800 0000c1a9 bfe9fbff
basic_cpuid[2]=02b3b001 000000f0 00000000 2c04307d
basic_cpuid[3]=00000000 00000000 00000000 00000000
basic_cpuid[4]=04000121 01c0003f 0000003f 00000001
basic_cpuid[5]=00000040 00000040 00000003 00022220
basic_cpuid[6]=00000001 00000002 00000001 00000000
basic_cpuid[7]=00000001 00000002 00000001 00000000
basic_cpuid[8]=00000001 00000002 00000001 00000000
basic_cpuid[9]=00000001 00000002 00000001 00000000
basic_cpuid[10]=00000001 00000002 00000001 00000000
basic_cpuid[11]=00000001 00000002 00000001 00000000
basic_cpuid[12]=00000001 00000002 00000001 00000000
basic_cpuid[13]=00000001 00000002 00000001 00000000
basic_cpuid[14]=00000001 00000002 00000001 00000000
basic_cpuid[15]=00000001 00000002 00000001 00000000
basic_cpuid[16]=00000001 00000002 00000001 00000000
basic_cpuid[17]=00000001 00000002 00000001 00000000
basic_cpuid[18]=00000001 00000002 00000001 00000000
basic_cpuid[19]=00000001 00000002 00000001 00000000
basic_cpuid[20]=00000001 00000002 00000001 00000000
basic_cpuid[21]=00000001 00000002 00000001 00000000
basic_cpuid[22]=00000001 00000002 00000001 00000000
basic_cpuid[23]=00000001 00000002 00000001 00000000
basic_cpuid[24]=00000001 00000002 00000001 00000000
basic_cpuid[25]=00000001 00000002 00000001 00000000
basic_cpuid[26]=00000001 00000002 00000001 00000000
basic_cpuid[27]=00000001 00000002 00000001 00000000
basic_cpuid[28]=00000001 00000002 00000001 00000000
basic_cpuid[29]=00000001 00000002 00000001 00000000
basic_cpuid[30]=00000001 00000002 00000001 00000000
basic_cpuid[31]=00000001 00000002 00000001 00000000
ext_cpuid[0]=80000008 00000000 00000000 00000000
ext_cpuid[1]=00000000 00000000 00000000 00100000
ext_cpuid[2]=756e6547 20656e69 65746e49 2952286c
ext_cpuid[3]=55504320 20202020 20202020 20202020
ext_cpuid[4]=30303331 20402020 36362e31 007a4847
ext_cpuid[5]=00000000 00000000 00000000 00000000
ext_cpuid[6]=00000000 00000000 08006040 00000000
ext_cpuid[7]=00000000 00000000 00000000 00000000
ext_cpuid[8]=00002020 00000000 00000000 00000000
ext_cpuid[9]=00000001 00000002 00000001 00000000
ext_cpuid[10]=00000001 00000002 00000001 00000000
ext_cpuid[11]=00000001 00000002 00000001 00000000
ext_cpuid[12]=00000001 00000002 00000001 00000000
ext_cpuid[13]=00000001 00000002 00000001 00000000
ext_cpuid[14]=00000001 00000002 00000001 00000000
ext_cpuid[15]=00000001 00000002 00000001 00000000
ext_cpuid[16]=00000001 00000002 00000001 00000000
ext_cpuid[17]=00000001 00000002 00000001 00000000
ext_cpuid[18]=00000001 00000002 00000001 00000000
ext_cpuid[19]=00000001 00000002 00000001 00000000
ext_cpuid[20]=00000001 00000002 00000001 00000000
ext_cpuid[21]=00000001 00000002 00000001 00000000
ext_cpuid[22]=00000001 00000002 00000001 00000000
ext_cpuid[23]=00000001 00000002 00000001 00000000
ext_cpuid[24]=00000001 00000002 00000001 00000000
ext_cpuid[25]=00000001 00000002 00000001 00000000
ext_cpuid[26]=00000001 00000002 00000001 00000000
ext_cpuid[27]=00000001 00000002 00000001 00000000
ext_cpuid[28]=00000001 00000002 00000001 00000000
ext_cpuid[29]=00000001 00000002 00000001 00000000
ext_cpuid[30]=00000001 00000002 00000001 00000000
ext_cpuid[31]=00000001 00000002 00000001 00000000
intel_fn4[0]=04000121 01c0003f 0000003f 00000001
intel_fn4[1]=04000122 01c0003f 0000003f 00000001
intel_fn4[2]=04004143 01c0003f 00000fff 00000001
intel_fn4[3]=00000000 00000000 00000000 00000000
--------------------------------------------------------------------------------
6
14
8
6
14
2
2
32
32
2048
-1
8
8
-1
64
64
-1
Yonah (Core Duo)
fpu vme de pse tsc msr pae mce cx8 apic mtrr sep pge mca cmov pat clflush dts acpi mmx fxsr sse sse2 ss ht tm pbe pni monitor vmx est tm2 xtpr pdcm xd
--------------------------------------------------------------------------------
