------[ Logical CPU #0 ]------
CPUID 00000000: 0000000B-756E6547-6C65746E-49656E69
CPUID 00000001: 000206C2-00200800-029AE3BF-BFEBFBFF
CPUID 00000002: 55035A01-00F0B2FF-00000000-00CA0000
CPUID 00000003: 00000000-00000000-00000000-00000000
CPUID 00000004: 3C004121-01C0003F-0000003F-00000000
CPUID 00000004: 3C004122-00C0003F-0000007F-00000000
CPUID 00000004: 3C004143-01C0003F-000001FF-00000000
CPUID 00000004: 3C07C163-03C0003F-00002FFF-00000002
CPUID 00000005: 00000040-00000040-00000003-00001120
CPUID 00000006: 00000005-00000002-00000001-00000000
CPUID 00000007: 00000000-00000000-00000000-00000000
CPUID 00000008: 00000000-00000000-00000000-00000000
CPUID 00000009: 00000000-00000000-00000000-00000000
CPUID 0000000A: 07300403-00000004-00000000-00000603
CPUID 0000000B: 00000001-00000002-00000100-00000000
CPUID 0000000B: 00000005-0000000C-00000201-00000000
CPUID 80000000: 80000008-00000000-00000000-00000000
CPUID 80000001: 00000000-00000000-00000001-2C100000
CPUID 80000002: 65746E49-2952286C-726F4320-4D542865
CPUID 80000003: 37692029-55504320-20202020-58202020
CPUID 80000004: 30393920-20402020-37342E33-007A4847
CPUID 80000005: 00000000-00000000-00000000-00000000
CPUID 80000006: 00000000-00000000-01006040-00000000
CPUID 80000007: 00000000-00000000-00000000-00000100
CPUID 80000008: 00003024-00000000-00000000-00000000
------[ Logical CPU #1 ]------
CPUID 00000000: 0000000B-756E6547-6C65746E-49656E69
CPUID 00000001: 000206C2-01200800-029AE3BF-BFEBFBFF
CPUID 00000002: 55035A01-00F0B2FF-00000000-00CA0000
CPUID 00000003: 00000000-00000000-00000000-00000000
CPUID 00000004: 3C004121-01C0003F-0000003F-00000000
CPUID 00000004: 3C004122-00C0003F-0000007F-00000000
CPUID 00000004: 3C004143-01C0003F-000001FF-00000000
CPUID 00000004: 3C07C163-03C0003F-00002FFF-00000002
CPUID 00000005: 00000040-00000040-00000003-00001120
CPUID 00000006: 00000005-00000002-00000001-00000000
CPUID 00000007: 00000000-00000000-00000000-00000000
CPUID 00000008: 00000000-00000000-00000000-00000000
CPUID 00000009: 00000000-00000000-00000000-00000000
CPUID 0000000A: 07300403-00000004-00000000-00000603
CPUID 0000000B: 00000001-00000002-00000100-00000001
CPUID 0000000B: 00000005-0000000C-00000201-00000001
CPUID 80000000: 80000008-00000000-00000000-00000000
CPUID 80000001: 00000000-00000000-00000001-2C100000
CPUID 80000002: 65746E49-2952286C-726F4320-4D542865
CPUID 80000003: 37692029-55504320-20202020-58202020
CPUID 80000004: 30393920-20402020-37342E33-007A4847
CPUID 80000005: 00000000-00000000-00000000-00000000
CPUID 80000006: 00000000-00000000-01006040-00000000
CPUID 80000007: 00000000-00000000-00000000-00000100
CPUID 80000008: 00003024-00000000-00000000-00000000
------[ Logical CPU #2 ]------
CPUID 00000000: 0000000B-756E6547-6C65746E-49656E69
CPUID 00000001: 000206C2-02200800-029AE3BF-BFEBFBFF
CPUID 00000002: 55035A01-00F0B2FF-00000000-00CA0000
CPUID 00000003: 00000000-00000000-00000000-00000000
CPUID 00000004: 3C004121-01C0003F-0000003F-00000000
CPUID 00000004: 3C004122-00C0003F-0000007F-00000000
CPUID 00000004: 3C004143-01C0003F-000001FF-00000000
CPUID 00000004: 3C07C163-03C0003F-00002FFF-00000002
CPUID 00000005: 00000040-00000040-00000003-00001120
CPUID 00000006: 00000005-00000002-00000001-00000000
CPUID 00000007: 00000000-00000000-00000000-00000000
CPUID 00000008: 00000000-00000000-00000000-00000000
CPUID 00000009: 00000000-00000000-00000000-00000000
CPUID 0000000A: 07300403-00000004-00000000-00000603
CPUID 0000000B: 00000001-00000002-00000100-00000002
CPUID 0000000B: 00000005-0000000C-00000201-00000002
CPUID 80000000: 80000008-00000000-00000000-00000000
CPUID 80000001: 00000000-00000000-00000001-2C100000
CPUID 80000002: 65746E49-2952286C-726F4320-4D542865
CPUID 80000003: 37692029-55504320-20202020-58202020
CPUID 80000004: 30393920-20402020-37342E33-007A4847
CPUID 80000005: 00000000-00000000-00000000-00000000
CPUID 80000006: 00000000-00000000-01006040-00000000
CPUID 80000007: 00000000-00000000-00000000-00000100
CPUID 80000008: 00003024-00000000-00000000-00000000
------[ Logical CPU #3 ]------
CPUID 00000000: 0000000B-756E6547-6C65746E-49656E69
CPUID 00000001: 000206C2-03200800-029AE3BF-BFEBFBFF
CPUID 00000002: 55035A01-00F0B2FF-00000000-00CA0000
CPUID 00000003: 00000000-00000000-00000000-00000000
CPUID 00000004: 3C004121-01C0003F-0000003F-00000000
CPUID 00000004: 3C004122-00C0003F-0000007F-00000000
CPUID 00000004: 3C004143-01C0003F-000001FF-00000000
CPUID 00000004: 3C07C163-03C0003F-00002FFF-00000002
CPUID 00000005: 00000040-00000040-00000003-00001120
CPUID 00000006: 00000005-00000002-00000001-00000000
CPUID 00000007: 00000000-00000000-00000000-00000000
CPUID 00000008: 00000000-00000000-00000000-00000000
CPUID 00000009: 00000000-00000000-00000000-00000000
CPUID 0000000A: 07300403-00000004-00000000-00000603
CPUID 0000000B: 00000001-00000002-00000100-00000003
CPUID 0000000B: 00000005-0000000C-00000201-00000003
CPUID 80000000: 80000008-00000000-00000000-00000000
CPUID 80000001: 00000000-00000000-00000001-2C100000
CPUID 80000002: 65746E49-2952286C-726F4320-4D542865
CPUID 80000003: 37692029-55504320-20202020-58202020
CPUID 80000004: 30393920-20402020-37342E33-007A4847
CPUID 80000005: 00000000-00000000-00000000-00000000
CPUID 80000006: 00000000-00000000-01006040-00000000
CPUID 80000007: 00000000-00000000-00000000-00000100
CPUID 80000008: 00003024-00000000-00000000-00000000
------[ Logical CPU #4 ]------
CPUID 00000000: 0000000B-756E6547-6C65746E-49656E69
CPUID 00000001: 000206C2-04200800-029AE3BF-BFEBFBFF
CPUID 00000002: 55035A01-00F0B2FF-00000000-00CA0000
CPUID 00000003: 00000000-00000000-00000000-00000000
CPUID 00000004: 3C004121-01C0003F-0000003F-00000000
CPUID 00000004: 3C004122-00C0003F-0000007F-00000000
CPUID 00000004: 3C004143-01C0003F-000001FF-00000000
CPUID 00000004: 3C07C163-03C0003F-00002FFF-00000002
CPUID 00000005: 00000040-00000040-00000003-00001120
CPUID 00000006: 00000005-00000002-00000001-00000000
CPUID 00000007: 00000000-00000000-00000000-00000000
CPUID 00000008: 00000000-00000000-00000000-00000000
CPUID 00000009: 00000000-00000000-00000000-00000000
CPUID 0000000A: 07300403-00000004-00000000-00000603
CPUID 0000000B: 00000001-00000002-00000100-00000004
CPUID 0000000B: 00000005-0000000C-00000201-00000004
CPUID 80000000: 80000008-00000000-00000000-00000000
CPUID 80000001: 00000000-00000000-00000001-2C100000
CPUID 80000002: 65746E49-2952286C-726F4320-4D542865
CPUID 80000003: 37692029-55504320-20202020-58202020
CPUID 80000004: 30393920-20402020-37342E33-007A4847
CPUID 80000005: 00000000-00000000-00000000-00000000
CPUID 80000006: 00000000-00000000-01006040-00000000
CPUID 80000007: 00000000-00000000-00000000-00000100
CPUID 80000008: 00003024-00000000-00000000-00000000
------[ Logical CPU #5 ]------
CPUID 00000000: 0000000B-756E6547-6C65746E-49656E69
CPUID 00000001: 000206C2-05200800-029AE3BF-BFEBFBFF
CPUID 00000002: 55035A01-00F0B2FF-00000000-00CA0000
CPUID 00000003: 00000000-00000000-00000000-00000000
CPUID 00000004: 3C004121-01C0003F-0000003F-00000000
CPUID 00000004: 3C004122-00C0003F-0000007F-00000000
CPUID 00000004: 3C004143-01C0003F-000001FF-00000000
CPUID 00000004: 3C07C163-03C0003F-00002FFF-00000002
CPUID 00000005: 00000040-00000040-00000003-00001120
CPUID 00000006: 00000005-00000002-00000001-00000000
CPUID 00000007: 00000000-00000000-00000000-00000000
CPUID 00000008: 00000000-00000000-00000000-00000000
CPUID 00000009: 00000000-00000000-00000000-00000000
CPUID 0000000A: 07300403-00000004-00000000-00000603
CPUID 0000000B: 00000001-00000002-00000100-00000005
CPUID 0000000B: 00000005-0000000C-00000201-00000005
CPUID 80000000: 80000008-00000000-00000000-00000000
CPUID 80000001: 00000000-00000000-00000001-2C100000
CPUID 80000002: 65746E49-2952286C-726F4320-4D542865
CPUID 80000003: 37692029-55504320-20202020-58202020
CPUID 80000004: 30393920-20402020-37342E33-007A4847
CPUID 80000005: 00000000-00000000-00000000-00000000
CPUID 80000006: 00000000-00000000-01006040-00000000
CPUID 80000007: 00000000-00000000-00000000-00000100
CPUID 80000008: 00003024-00000000-00000000-00000000
------[ Logical CPU #6 ]------
CPUID 00000000: 0000000B-756E6547-6C65746E-49656E69
CPUID 00000001: 000206C2-10200800-029AE3BF-BFEBFBFF
CPUID 00000002: 55035A01-00F0B2FF-00000000-00CA0000
CPUID 00000003: 00000000-00000000-00000000-00000000
CPUID 00000004: 3C004121-01C0003F-0000003F-00000000
CPUID 00000004: 3C004122-00C0003F-0000007F-00000000
CPUID 00000004: 3C004143-01C0003F-000001FF-00000000
CPUID 00000004: 3C07C163-03C0003F-00002FFF-00000002
CPUID 00000005: 00000040-00000040-00000003-00001120
CPUID 00000006: 00000005-00000002-00000001-00000000
CPUID 00000007: 00000000-00000000-00000000-00000000
CPUID 00000008: 00000000-00000000-00000000-00000000
CPUID 00000009: 00000000-00000000-00000000-00000000
CPUID 0000000A: 07300403-00000004-00000000-00000603
CPUID 0000000B: 00000001-00000002-00000100-00000010
CPUID 0000000B: 00000005-0000000C-00000201-00000010
CPUID 80000000: 80000008-00000000-00000000-00000000
CPUID 80000001: 00000000-00000000-00000001-2C100000
CPUID 80000002: 65746E49-2952286C-726F4320-4D542865
CPUID 80000003: 37692029-55504320-20202020-58202020
CPUID 80000004: 30393920-20402020-37342E33-007A4847
CPUID 80000005: 00000000-00000000-00000000-00000000
CPUID 80000006: 00000000-00000000-01006040-00000000
CPUID 80000007: 00000000-00000000-00000000-00000100
CPUID 80000008: 00003024-00000000-00000000-00000000
------[ Logical CPU #7 ]------
CPUID 00000000: 0000000B-756E6547-6C65746E-49656E69
CPUID 00000001: 000206C2-11200800-029AE3BF-BFEBFBFF
CPUID 00000002: 55035A01-00F0B2FF-00000000-00CA0000
CPUID 00000003: 00000000-00000000-00000000-00000000
CPUID 00000004: 3C004121-01C0003F-0000003F-00000000
CPUID 00000004: 3C004122-00C0003F-0000007F-00000000
CPUID 00000004: 3C004143-01C0003F-000001FF-00000000
CPUID 00000004: 3C07C163-03C0003F-00002FFF-00000002
CPUID 00000005: 00000040-00000040-00000003-00001120
CPUID 00000006: 00000005-00000002-00000001-00000000
CPUID 00000007: 00000000-00000000-00000000-00000000
CPUID 00000008: 00000000-00000000-00000000-00000000
CPUID 00000009: 00000000-00000000-00000000-00000000
CPUID 0000000A: 07300403-00000004-00000000-00000603
CPUID 0000000B: 00000001-00000002-00000100-00000011
CPUID 0000000B: 00000005-0000000C-00000201-00000011
CPUID 80000000: 80000008-00000000-00000000-00000000
CPUID 80000001: 00000000-00000000-00000001-2C100000
CPUID 80000002: 65746E49-2952286C-726F4320-4D542865
CPUID 80000003: 37692029-55504320-20202020-58202020
CPUID 80000004: 30393920-20402020-37342E33-007A4847
CPUID 80000005: 00000000-00000000-00000000-00000000
CPUID 80000006: 00000000-00000000-01006040-00000000
CPUID 80000007: 00000000-00000000-00000000-00000100
CPUID 80000008: 00003024-00000000-00000000-00000000
------[ Logical CPU #8 ]------
CPUID 00000000: 0000000B-756E6547-6C65746E-49656E69
CPUID 00000001: 000206C2-12200800-029AE3BF-BFEBFBFF
CPUID 00000002: 55035A01-00F0B2FF-00000000-00CA0000
CPUID 00000003: 00000000-00000000-00000000-00000000
CPUID 00000004: 3C004121-01C0003F-0000003F-00000000
CPUID 00000004: 3C004122-00C0003F-0000007F-00000000
CPUID 00000004: 3C004143-01C0003F-000001FF-00000000
CPUID 00000004: 3C07C163-03C0003F-00002FFF-00000002
CPUID 00000005: 00000040-00000040-00000003-00001120
CPUID 00000006: 00000005-00000002-00000001-00000000
CPUID 00000007: 00000000-00000000-00000000-00000000
CPUID 00000008: 00000000-00000000-00000000-00000000
CPUID 00000009: 00000000-00000000-00000000-00000000
CPUID 0000000A: 07300403-00000004-00000000-00000603
CPUID 0000000B: 00000001-00000002-00000100-00000012
CPUID 0000000B: 00000005-0000000C-00000201-00000012
CPUID 80000000: 80000008-00000000-00000000-00000000
CPUID 80000001: 00000000-00000000-00000001-2C100000
CPUID 80000002: 65746E49-2952286C-726F4320-4D542865
CPUID 80000003: 37692029-55504320-20202020-58202020
CPUID 80000004: 30393920-20402020-37342E33-007A4847
CPUID 80000005: 00000000-00000000-00000000-00000000
CPUID 80000006: 00000000-00000000-01006040-00000000
CPUID 80000007: 00000000-00000000-00000000-00000100
CPUID 80000008: 00003024-00000000-00000000-00000000
------[ Logical CPU #9 ]------
CPUID 00000000: 0000000B-756E6547-6C65746E-49656E69
CPUID 00000001: 000206C2-13200800-029AE3BF-BFEBFBFF
CPUID 00000002: 55035A01-00F0B2FF-00000000-00CA0000
CPUID 00000003: 00000000-00000000-00000000-00000000
CPUID 00000004: 3C004121-01C0003F-0000003F-00000000
CPUID 00000004: 3C004122-00C0003F-0000007F-00000000
CPUID 00000004: 3C004143-01C0003F-000001FF-00000000
CPUID 00000004: 3C07C163-03C0003F-00002FFF-00000002
CPUID 00000005: 00000040-00000040-00000003-00001120
CPUID 00000006: 00000005-00000002-00000001-00000000
CPUID 00000007: 00000000-00000000-00000000-00000000
CPUID 00000008: 00000000-00000000-00000000-00000000
CPUID 00000009: 00000000-00000000-00000000-00000000
CPUID 0000000A: 07300403-00000004-00000000-00000603
CPUID 0000000B: 00000001-00000002-00000100-00000013
CPUID 0000000B: 00000005-0000000C-00000201-00000013
CPUID 80000000: 80000008-00000000-00000000-00000000
CPUID 80000001: 00000000-00000000-00000001-2C100000
CPUID 80000002: 65746E49-2952286C-726F4320-4D542865
CPUID 80000003: 37692029-55504320-20202020-58202020
CPUID 80000004: 30393920-20402020-37342E33-007A4847
CPUID 80000005: 00000000-00000000-00000000-00000000
CPUID 80000006: 00000000-00000000-01006040-00000000
CPUID 80000007: 00000000-00000000-00000000-00000100
CPUID 80000008: 00003024-00000000-00000000-00000000
------[ Logical CPU #10 ]------
CPUID 00000000: 0000000B-756E6547-6C65746E-49656E69
CPUID 00000001: 000206C2-14200800-029AE3BF-BFEBFBFF
CPUID 00000002: 55035A01-00F0B2FF-00000000-00CA0000
CPUID 00000003: 00000000-00000000-00000000-00000000
CPUID 00000004: 3C004121-01C0003F-0000003F-00000000
CPUID 00000004: 3C004122-00C0003F-0000007F-00000000
CPUID 00000004: 3C004143-01C0003F-000001FF-00000000
CPUID 00000004: 3C07C163-03C0003F-00002FFF-00000002
CPUID 00000005: 00000040-00000040-00000003-00001120
CPUID 00000006: 00000005-00000002-00000001-00000000
CPUID 00000007: 00000000-00000000-00000000-00000000
CPUID 00000008: 00000000-00000000-00000000-00000000
CPUID 00000009: 00000000-00000000-00000000-00000000
CPUID 0000000A: 07300403-00000004-00000000-00000603
CPUID 0000000B: 00000001-00000002-00000100-00000014
CPUID 0000000B: 00000005-0000000C-00000201-00000014
CPUID 80000000: 80000008-00000000-00000000-00000000
CPUID 80000001: 00000000-00000000-00000001-2C100000
CPUID 80000002: 65746E49-2952286C-726F4320-4D542865
CPUID 80000003: 37692029-55504320-20202020-58202020
CPUID 80000004: 30393920-20402020-37342E33-007A4847
CPUID 80000005: 00000000-00000000-00000000-00000000
CPUID 80000006: 00000000-00000000-01006040-00000000
CPUID 80000007: 00000000-00000000-00000000-00000100
CPUID 80000008: 00003024-00000000-00000000-00000000
------[ Logical CPU #11 ]------
CPUID 00000000: 0000000B-756E6547-6C65746E-49656E69
CPUID 00000001: 000206C2-15200800-029AE3BF-BFEBFBFF
CPUID 00000002: 55035A01-00F0B2FF-00000000-00CA0000
CPUID 00000003: 00000000-00000000-00000000-00000000
CPUID 00000004: 3C004121-01C0003F-0000003F-00000000
CPUID 00000004: 3C004122-00C0003F-0000007F-00000000
CPUID 00000004: 3C004143-01C0003F-000001FF-00000000
CPUID 00000004: 3C07C163-03C0003F-00002FFF-00000002
CPUID 00000005: 00000040-00000040-00000003-00001120
CPUID 00000006: 00000005-00000002-00000001-00000000
CPUID 00000007: 00000000-00000000-00000000-00000000
CPUID 00000008: 00000000-00000000-00000000-00000000
CPUID 00000009: 00000000-00000000-00000000-00000000
CPUID 0000000A: 07300403-00000004-00000000-00000603
CPUID 0000000B: 00000001-00000002-00000100-00000015
CPUID 0000000B: 00000005-0000000C-00000201-00000015
CPUID 80000000: 80000008-00000000-00000000-00000000
CPUID 80000001: 00000000-00000000-00000001-2C100000
CPUID 80000002: 65746E49-2952286C-726F4320-4D542865
CPUID 80000003: 37692029-55504320-20202020-58202020
CPUID 80000004: 30393920-20402020-37342E33-007A4847
CPUID 80000005: 00000000-00000000-00000000-00000000
CPUID 80000006: 00000000-00000000-01006040-00000000
CPUID 80000007: 00000000-00000000-00000000-00000100
CPUID 80000008: 00003024-00000000-00000000-00000000
--------------------------------------------------------------------------------
x86
x86-64-v2
general
6
12
2
6
44
12
12
-1
-1
-1
-1
-1
-1
-1
-1
-1
-1
-1
-1
-1
-1
-1
-1
-1
-1
-1
-1
128 (non-authoritative)
Core i7 Extreme (Gulftown)
32 nm
fpu vme de pse tsc msr pae mce cx8 apic mtrr sep pge mca cmov pat pse36 clflush dts acpi mmx fxsr sse sse2 ss ht tm pbe pni pclmul dts64 monitor ds_cpl vmx est tm2 ssse3 cx16 xtpr pdcm sse4_1 sse4_2 xd popcnt aes rdtscp lm lahf_lm constant_tsc
