CPUID Registers (CPU #1):
CPUID 00000000  	0000000B-756E6547-6C65746E-49656E69
CPUID 00000001  	000106E5-00100800-0098E3FD-BFEBFBFF
CPUID 00000002  	55035A01-00F0B2DE-00000000-09CA212C
CPUID 00000003  	00000000-00000000-00000000-00000000
CPUID 00000004  	1C004121-01C0003F-0000003F-00000000
CPUID 00000004  	1C004122-00C0003F-0000007F-00000000
CPUID 00000004  	1C004143-01C0003F-000001FF-00000000
CPUID 00000004  	1C03C163-02C0003F-00001FFF-00000002
CPUID 00000005  	00000040-00000040-00000003-00001120
CPUID 00000006  	00000003-00000002-00000001-00000000
CPUID 00000007  	00000000-00000000-00000000-00000000
CPUID 00000008  	00000000-00000000-00000000-00000000
CPUID 00000009  	00000000-00000000-00000000-00000000
CPUID 0000000A  	07300403-00000044-00000000-00000603
CPUID 0000000B  	00000001-00000002-00000100-00000000
CPUID 0000000B  	00000004-00000008-00000201-00000000
CPUID 80000000  	80000008-00000000-00000000-00000000
CPUID 80000001  	00000000-00000000-00000001-28100000
CPUID 80000002  	65746E49-2952286C-726F4320-4D542865
CPUID 80000003  	37692029-55504320-20202020-51202020
CPUID 80000004  	30323720-20402020-30362E31-007A4847
CPUID 80000005  	00000000-00000000-00000000-00000000
CPUID 80000006  	00000000-00000000-01006040-00000000
CPUID 80000007  	00000000-00000000-00000000-00000100
CPUID 80000008  	00003024-00000000-00000000-00000000
CPUID Registers (CPU #2 Virtual):
CPUID 00000000  	0000000B-756E6547-6C65746E-49656E69
CPUID 00000001  	000106E5-01100800-0098E3FD-BFEBFBFF
CPUID 00000002  	55035A01-00F0B2DE-00000000-09CA212C
CPUID 00000003  	00000000-00000000-00000000-00000000
CPUID 00000004  	1C004121-01C0003F-0000003F-00000000
CPUID 00000004  	1C004122-00C0003F-0000007F-00000000
CPUID 00000004  	1C004143-01C0003F-000001FF-00000000
CPUID 00000004  	1C03C163-02C0003F-00001FFF-00000002
CPUID 00000005  	00000040-00000040-00000003-00001120
CPUID 00000006  	00000003-00000002-00000001-00000000
CPUID 00000007  	00000000-00000000-00000000-00000000
CPUID 00000008  	00000000-00000000-00000000-00000000
CPUID 00000009  	00000000-00000000-00000000-00000000
CPUID 0000000A  	07300403-00000044-00000000-00000603
CPUID 0000000B  	00000001-00000002-00000100-00000001
CPUID 0000000B  	00000004-00000008-00000201-00000001
CPUID 80000000  	80000008-00000000-00000000-00000000
CPUID 80000001  	00000000-00000000-00000001-28100000
CPUID 80000002  	65746E49-2952286C-726F4320-4D542865
CPUID 80000003  	37692029-55504320-20202020-51202020
CPUID 80000004  	30323720-20402020-30362E31-007A4847
CPUID 80000005  	00000000-00000000-00000000-00000000
CPUID 80000006  	00000000-00000000-01006040-00000000
CPUID 80000007  	00000000-00000000-00000000-00000100
CPUID 80000008  	00003024-00000000-00000000-00000000
CPUID Registers (CPU #3):
CPUID 00000000  	0000000B-756E6547-6C65746E-49656E69
CPUID 00000001  	000106E5-02100800-0098E3FD-BFEBFBFF
CPUID 00000002  	55035A01-00F0B2DE-00000000-09CA212C
CPUID 00000003  	00000000-00000000-00000000-00000000
CPUID 00000004  	1C004121-01C0003F-0000003F-00000000
CPUID 00000004  	1C004122-00C0003F-0000007F-00000000
CPUID 00000004  	1C004143-01C0003F-000001FF-00000000
CPUID 00000004  	1C03C163-02C0003F-00001FFF-00000002
CPUID 00000005  	00000040-00000040-00000003-00001120
CPUID 00000006  	00000003-00000002-00000001-00000000
CPUID 00000007  	00000000-00000000-00000000-00000000
CPUID 00000008  	00000000-00000000-00000000-00000000
CPUID 00000009  	00000000-00000000-00000000-00000000
CPUID 0000000A  	07300403-00000044-00000000-00000603
CPUID 0000000B  	00000001-00000002-00000100-00000002
CPUID 0000000B  	00000004-00000008-00000201-00000002
CPUID 80000000  	80000008-00000000-00000000-00000000
CPUID 80000001  	00000000-00000000-00000001-28100000
CPUID 80000002  	65746E49-2952286C-726F4320-4D542865
CPUID 80000003  	37692029-55504320-20202020-51202020
CPUID 80000004  	30323720-20402020-30362E31-007A4847
CPUID 80000005  	00000000-00000000-00000000-00000000
CPUID 80000006  	00000000-00000000-01006040-00000000
CPUID 80000007  	00000000-00000000-00000000-00000100
CPUID 80000008  	00003024-00000000-00000000-00000000
CPUID Registers (CPU #4 Virtual):
CPUID 00000000  	0000000B-756E6547-6C65746E-49656E69
CPUID 00000001  	000106E5-03100800-0098E3FD-BFEBFBFF
CPUID 00000002  	55035A01-00F0B2DE-00000000-09CA212C
CPUID 00000003  	00000000-00000000-00000000-00000000
CPUID 00000004  	1C004121-01C0003F-0000003F-00000000
CPUID 00000004  	1C004122-00C0003F-0000007F-00000000
CPUID 00000004  	1C004143-01C0003F-000001FF-00000000
CPUID 00000004  	1C03C163-02C0003F-00001FFF-00000002
CPUID 00000005  	00000040-00000040-00000003-00001120
CPUID 00000006  	00000003-00000002-00000001-00000000
CPUID 00000007  	00000000-00000000-00000000-00000000
CPUID 00000008  	00000000-00000000-00000000-00000000
CPUID 00000009  	00000000-00000000-00000000-00000000
CPUID 0000000A  	07300403-00000044-00000000-00000603
CPUID 0000000B  	00000001-00000002-00000100-00000003
CPUID 0000000B  	00000004-00000008-00000201-00000003
CPUID 80000000  	80000008-00000000-00000000-00000000
CPUID 80000001  	00000000-00000000-00000001-28100000
CPUID 80000002  	65746E49-2952286C-726F4320-4D542865
CPUID 80000003  	37692029-55504320-20202020-51202020
CPUID 80000004  	30323720-20402020-30362E31-007A4847
CPUID 80000005  	00000000-00000000-00000000-00000000
CPUID 80000006  	00000000-00000000-01006040-00000000
CPUID 80000007  	00000000-00000000-00000000-00000100
CPUID 80000008  	00003024-00000000-00000000-00000000
CPUID Registers (CPU #5):
CPUID 00000000  	0000000B-756E6547-6C65746E-49656E69
CPUID 00000001  	000106E5-04100800-0098E3FD-BFEBFBFF
CPUID 00000002  	55035A01-00F0B2DE-00000000-09CA212C
CPUID 00000003  	00000000-00000000-00000000-00000000
CPUID 00000004  	1C004121-01C0003F-0000003F-00000000
CPUID 00000004  	1C004122-00C0003F-0000007F-00000000
CPUID 00000004  	1C004143-01C0003F-000001FF-00000000
CPUID 00000004  	1C03C163-02C0003F-00001FFF-00000002
CPUID 00000005  	00000040-00000040-00000003-00001120
CPUID 00000006  	00000003-00000002-00000001-00000000
CPUID 00000007  	00000000-00000000-00000000-00000000
CPUID 00000008  	00000000-00000000-00000000-00000000
CPUID 00000009  	00000000-00000000-00000000-00000000
CPUID 0000000A  	07300403-00000044-00000000-00000603
CPUID 0000000B  	00000001-00000002-00000100-00000004
CPUID 0000000B  	00000004-00000008-00000201-00000004
CPUID 80000000  	80000008-00000000-00000000-00000000
CPUID 80000001  	00000000-00000000-00000001-28100000
CPUID 80000002  	65746E49-2952286C-726F4320-4D542865
CPUID 80000003  	37692029-55504320-20202020-51202020
CPUID 80000004  	30323720-20402020-30362E31-007A4847
CPUID 80000005  	00000000-00000000-00000000-00000000
CPUID 80000006  	00000000-00000000-01006040-00000000
CPUID 80000007  	00000000-00000000-00000000-00000100
CPUID 80000008  	00003024-00000000-00000000-00000000
CPUID Registers (CPU #6 Virtual):
CPUID 00000000  	0000000B-756E6547-6C65746E-49656E69
CPUID 00000001  	000106E5-05100800-0098E3FD-BFEBFBFF
CPUID 00000002  	55035A01-00F0B2DE-00000000-09CA212C
CPUID 00000003  	00000000-00000000-00000000-00000000
CPUID 00000004  	1C004121-01C0003F-0000003F-00000000
CPUID 00000004  	1C004122-00C0003F-0000007F-00000000
CPUID 00000004  	1C004143-01C0003F-000001FF-00000000
CPUID 00000004  	1C03C163-02C0003F-00001FFF-00000002
CPUID 00000005  	00000040-00000040-00000003-00001120
CPUID 00000006  	00000003-00000002-00000001-00000000
CPUID 00000007  	00000000-00000000-00000000-00000000
CPUID 00000008  	00000000-00000000-00000000-00000000
CPUID 00000009  	00000000-00000000-00000000-00000000
CPUID 0000000A  	07300403-00000044-00000000-00000603
CPUID 0000000B  	00000001-00000002-00000100-00000005
CPUID 0000000B  	00000004-00000008-00000201-00000005
CPUID 80000000  	80000008-00000000-00000000-00000000
CPUID 80000001  	00000000-00000000-00000001-28100000
CPUID 80000002  	65746E49-2952286C-726F4320-4D542865
CPUID 80000003  	37692029-55504320-20202020-51202020
CPUID 80000004  	30323720-20402020-30362E31-007A4847
CPUID 80000005  	00000000-00000000-00000000-00000000
CPUID 80000006  	00000000-00000000-01006040-00000000
CPUID 80000007  	00000000-00000000-00000000-00000100
CPUID 80000008  	00003024-00000000-00000000-00000000
CPUID Registers (CPU #7):
CPUID 00000000  	0000000B-756E6547-6C65746E-49656E69
CPUID 00000001  	000106E5-06100800-0098E3FD-BFEBFBFF
CPUID 00000002  	55035A01-00F0B2DE-00000000-09CA212C
CPUID 00000003  	00000000-00000000-00000000-00000000
CPUID 00000004  	1C004121-01C0003F-0000003F-00000000
CPUID 00000004  	1C004122-00C0003F-0000007F-00000000
CPUID 00000004  	1C004143-01C0003F-000001FF-00000000
CPUID 00000004  	1C03C163-02C0003F-00001FFF-00000002
CPUID 00000005  	00000040-00000040-00000003-00001120
CPUID 00000006  	00000003-00000002-00000001-00000000
CPUID 00000007  	00000000-00000000-00000000-00000000
CPUID 00000008  	00000000-00000000-00000000-00000000
CPUID 00000009  	00000000-00000000-00000000-00000000
CPUID 0000000A  	07300403-00000044-00000000-00000603
CPUID 0000000B  	00000001-00000002-00000100-00000006
CPUID 0000000B  	00000004-00000008-00000201-00000006
CPUID 80000000  	80000008-00000000-00000000-00000000
CPUID 80000001  	00000000-00000000-00000001-28100000
CPUID 80000002  	65746E49-2952286C-726F4320-4D542865
CPUID 80000003  	37692029-55504320-20202020-51202020
CPUID 80000004  	30323720-20402020-30362E31-007A4847
CPUID 80000005  	00000000-00000000-00000000-00000000
CPUID 80000006  	00000000-00000000-01006040-00000000
CPUID 80000007  	00000000-00000000-00000000-00000100
CPUID 80000008  	00003024-00000000-00000000-00000000
CPUID Registers (CPU #8 Virtual):
CPUID 00000000  	0000000B-756E6547-6C65746E-49656E69
CPUID 00000001  	000106E5-07100800-0098E3FD-BFEBFBFF
CPUID 00000002  	55035A01-00F0B2DE-00000000-09CA212C
CPUID 00000003  	00000000-00000000-00000000-00000000
CPUID 00000004  	1C004121-01C0003F-0000003F-00000000
CPUID 00000004  	1C004122-00C0003F-0000007F-00000000
CPUID 00000004  	1C004143-01C0003F-000001FF-00000000
CPUID 00000004  	1C03C163-02C0003F-00001FFF-00000002
CPUID 00000005  	00000040-00000040-00000003-00001120
CPUID 00000006  	00000003-00000002-00000001-00000000
CPUID 00000007  	00000000-00000000-00000000-00000000
CPUID 00000008  	00000000-00000000-00000000-00000000
CPUID 00000009  	00000000-00000000-00000000-00000000
CPUID 0000000A  	07300403-00000044-00000000-00000603
CPUID 0000000B  	00000001-00000002-00000100-00000007
CPUID 0000000B  	00000004-00000008-00000201-00000007
CPUID 80000000  	80000008-00000000-00000000-00000000
CPUID 80000001  	00000000-00000000-00000001-28100000
CPUID 80000002  	65746E49-2952286C-726F4320-4D542865
CPUID 80000003  	37692029-55504320-20202020-51202020
CPUID 80000004  	30323720-20402020-30362E31-007A4847
CPUID 80000005  	00000000-00000000-00000000-00000000
CPUID 80000006  	00000000-00000000-01006040-00000000
CPUID 80000007  	00000000-00000000-00000000-00000100
CPUID 80000008  	00003024-00000000-00000000-00000000
--------------------------------------------------------------------------------
x86
x86-64-v2
general
6
14
5
6
30
8
8
-1
-1
-1
-1
-1
-1
-1
-1
-1
-1
-1
-1
-1
-1
-1
-1
-1
-1
-1
-1
128 (non-authoritative)
Core i7 (Clarksfield)
45 nm
fpu vme de pse tsc msr pae mce cx8 apic mtrr sep pge mca cmov pat pse36 clflush dts acpi mmx fxsr sse sse2 ss ht tm pbe pni dts64 monitor ds_cpl vmx smx est tm2 ssse3 cx16 xtpr pdcm sse4_1 sse4_2 xd popcnt rdtscp lm lahf_lm constant_tsc
