------[ CPUID Registers / Logical CPU #0 ]------
CPUID 00000000: 00000015-756E6547-6C65746E-49656E69 [GenuineIntel]
CPUID 00000001: 000506CA-00200800-4FF8EBB7-BFEBFBFF
CPUID 00000002: 6164A001-0000FFC4-00000000-00000000
CPUID 00000003: 00000000-00000000-00000000-00000000
CPUID 00000004: 3C000121-0140003F-0000003F-00000001 [SL 00] [L1D: 24 KB]
CPUID 00000004: 3C000122-01C0003F-0000003F-00000001 [SL 01] [L1I: 32 KB]
CPUID 00000004: 3C00C143-03C0003F-000003FF-00000001 [SL 02] [L2U: 1 MB]
CPUID 00000005: 00000000-00000000-00000000-11242020
CPUID 00000006: 00000057-00000002-00000001-00000000
CPUID 00000007: 00000000-2294E283-00000000-AC000400 [SL 00]
CPUID 00000008: 00000000-00000000-00000000-00000000
CPUID 00000009: 00000000-00000000-00000000-00000000
CPUID 0000000A: 07300404-00000000-00000000-00000603
CPUID 0000000B: 00000001-00000001-00000100-00000000 [SL 00]
CPUID 0000000B: 00000005-00000002-00000201-00000000 [SL 01]
CPUID 0000000C: 00000000-00000000-00000000-00000000
CPUID 0000000D: 0000001B-00000440-00000440-00000000 [SL 00] [x87]
CPUID 0000000D: 0000000F-00000340-00000100-00000000 [SL 01] [SSE]
CPUID 0000000D: 00000040-000003C0-00000000-00000000 [SL 03] [MPX BNDREGS]
CPUID 0000000D: 00000040-00000400-00000000-00000000 [SL 04] [MPX BNDCSR]
CPUID 0000000D: 00000080-00000000-00000001-00000000 [SL 08] [PT]
CPUID 0000000E: 00000000-00000000-00000000-00000000
CPUID 0000000F: 00000000-00000000-00000000-00000000 [SL 00]
CPUID 0000000F: 00000000-00000000-00000000-00000000 [SL 01]
CPUID 00000010: 00000000-00000004-00000000-00000000 [SL 00]
CPUID 00000010: 00000000-00000000-00000000-00000000 [SL 01]
CPUID 00000011: 00000000-00000000-00000000-00000000
CPUID 00000012: 00000000-00000000-00000000-00000000 [SL 00]
CPUID 00000012: 00000000-00000000-00000000-00000000 [SL 01]
CPUID 00000013: 00000000-00000000-00000000-00000000
CPUID 00000014: 00000001-0000000F-80000007-00000000 [SL 00]
CPUID 00000014: 02490002-003FFFFF-00000000-00000000 [SL 01]
CPUID 00000015: 00000003-000000C9-0124F800-00000000 [67.00x / 19200000 / 1286.40]
CPUID 80000000: 80000008-00000000-00000000-00000000
CPUID 80000001: 00000000-00000000-00000101-2C100000
CPUID 80000002: 65746E49-2952286C-6F744120-4D54286D [Intel(R) Atom(TM]
CPUID 80000003: 72502029-7365636F-20726F73-33393345 [) Processor E393]
CPUID 80000004: 20402030-30332E31-007A4847-00000000 [0 @ 1.30GHz]
CPUID 80000005: 00000000-00000000-00000000-00000000 [L1D: 0 KB / L1I: 0 KB]
CPUID 80000006: 00000000-00000000-04008040-00000000 [L2: 1024 KB] / L3: 0 KB]
CPUID 80000007: 00000000-00000000-00000000-00000100
CPUID 80000008: 00003027-00000000-00000000-00000000
------[ CPUID Registers / Logical CPU #1 ]------
CPUID 00000000: 00000015-756E6547-6C65746E-49656E69 [GenuineIntel]
CPUID 00000001: 000506CA-04200800-4FF8EBB7-BFEBFBFF
CPUID 00000002: 6164A001-0000FFC4-00000000-00000000
CPUID 00000003: 00000000-00000000-00000000-00000000
CPUID 00000004: 3C000121-0140003F-0000003F-00000001 [SL 00] [L1D: 24 KB]
CPUID 00000004: 3C000122-01C0003F-0000003F-00000001 [SL 01] [L1I: 32 KB]
CPUID 00000004: 3C00C143-03C0003F-000003FF-00000001 [SL 02] [L2U: 1 MB]
CPUID 00000005: 00000000-00000000-00000000-11242020
CPUID 00000006: 00000057-00000002-00000001-00000000
CPUID 00000007: 00000000-2294E283-00000000-AC000400 [SL 00]
CPUID 00000008: 00000000-00000000-00000000-00000000
CPUID 00000009: 00000000-00000000-00000000-00000000
CPUID 0000000A: 07300404-00000000-00000000-00000603
CPUID 0000000B: 00000001-00000001-00000100-00000004 [SL 00]
CPUID 0000000B: 00000005-00000002-00000201-00000004 [SL 01]
CPUID 0000000C: 00000000-00000000-00000000-00000000
CPUID 0000000D: 0000001B-00000440-00000440-00000000 [SL 00] [x87]
CPUID 0000000D: 0000000F-00000340-00000100-00000000 [SL 01] [SSE]
CPUID 0000000D: 00000040-000003C0-00000000-00000000 [SL 03] [MPX BNDREGS]
CPUID 0000000D: 00000040-00000400-00000000-00000000 [SL 04] [MPX BNDCSR]
CPUID 0000000D: 00000080-00000000-00000001-00000000 [SL 08] [PT]
CPUID 0000000E: 00000000-00000000-00000000-00000000
CPUID 0000000F: 00000000-00000000-00000000-00000000 [SL 00]
CPUID 0000000F: 00000000-00000000-00000000-00000000 [SL 01]
CPUID 00000010: 00000000-00000004-00000000-00000000 [SL 00]
CPUID 00000010: 00000000-00000000-00000000-00000000 [SL 01]
CPUID 00000011: 00000000-00000000-00000000-00000000
CPUID 00000012: 00000000-00000000-00000000-00000000 [SL 00]
CPUID 00000012: 00000000-00000000-00000000-00000000 [SL 01]
CPUID 00000013: 00000000-00000000-00000000-00000000
CPUID 00000014: 00000001-0000000F-80000007-00000000 [SL 00]
CPUID 00000014: 02490002-003FFFFF-00000000-00000000 [SL 01]
CPUID 00000015: 00000003-000000C9-0124F800-00000000 [67.00x / 19200000 / 1286.40]
CPUID 80000000: 80000008-00000000-00000000-00000000
CPUID 80000001: 00000000-00000000-00000101-2C100000
CPUID 80000002: 65746E49-2952286C-6F744120-4D54286D [Intel(R) Atom(TM]
CPUID 80000003: 72502029-7365636F-20726F73-33393345 [) Processor E393]
CPUID 80000004: 20402030-30332E31-007A4847-00000000 [0 @ 1.30GHz]
CPUID 80000005: 00000000-00000000-00000000-00000000 [L1D: 0 KB / L1I: 0 KB]
CPUID 80000006: 00000000-00000000-04008040-00000000 [L2: 1024 KB] / L3: 0 KB]
CPUID 80000007: 00000000-00000000-00000000-00000100
CPUID 80000008: 00003027-00000000-00000000-00000000
--------------------------------------------------------------------------------
x86
general
6
12
10
6
92
2
2
24
32
1024
-1
-1
6
8
16
-1
-1
64
64
64
-1
-1
2
2
2
0
0
128 (non-authoritative)
Apollo Lake (Atom)
fpu vme de pse tsc msr pae mce cx8 apic mtrr sep pge mca cmov pat pse36 clflush dts acpi mmx fxsr sse sse2 ss ht tm pbe pni pclmul dts64 ds_cpl vmx est tm2 ssse3 cx16 xtpr pdcm sse4_1 sse4_2 xd movbe popcnt aes xsave osxsave rdtscp lm lahf_lm constant_tsc rdrand x2apic sha_ni rdseed
