basic_cpuid[0]=00000018 756e6547 6c65746e 49656e69
basic_cpuid[1]=000706a1 02400800 4ff8ebbf bfebfbff
basic_cpuid[2]=00feff01 00000000 00000000 00000000
basic_cpuid[3]=00000000 00000000 00000000 00000000
basic_cpuid[4]=7c000121 0140003f 0000003f 00000001
basic_cpuid[5]=00000040 00000040 00000003 11242020
basic_cpuid[6]=00000057 00000002 00000001 00000000
basic_cpuid[7]=00000000 2294e287 40400004 2c000000
basic_cpuid[8]=00000000 00000000 00000000 00000000
basic_cpuid[9]=00000000 00000000 00000000 00000000
basic_cpuid[10]=07300404 00000000 00000000 00008603
basic_cpuid[11]=00000001 00000001 00000100 00000002
basic_cpuid[12]=00000000 00000000 00000000 00000000
basic_cpuid[13]=0000001b 00000440 00000440 00000000
basic_cpuid[14]=00000000 00000000 00000000 00000000
basic_cpuid[15]=00000000 00000000 00000000 00000000
basic_cpuid[16]=00000000 00000004 00000000 00000000
basic_cpuid[17]=00000000 00000000 00000000 00000000
basic_cpuid[18]=00000000 00000000 00000000 00000000
basic_cpuid[19]=00000000 00000000 00000000 00000000
basic_cpuid[20]=00000001 0000003f 80000007 00000000
basic_cpuid[21]=00000003 000000ab 0124f800 00000000
basic_cpuid[22]=00000000 00000000 00000000 00000000
basic_cpuid[23]=00000000 00000000 00000000 00000000
basic_cpuid[24]=00000004 00000000 00000000 00000000
basic_cpuid[25]=00000004 00000000 00000000 00000000
basic_cpuid[26]=00000004 00000000 00000000 00000000
basic_cpuid[27]=00000004 00000000 00000000 00000000
basic_cpuid[28]=00000004 00000000 00000000 00000000
basic_cpuid[29]=00000004 00000000 00000000 00000000
basic_cpuid[30]=00000004 00000000 00000000 00000000
basic_cpuid[31]=00000004 00000000 00000000 00000000
ext_cpuid[0]=80000008 00000000 00000000 00000000
ext_cpuid[1]=00000000 00000000 00000101 2c100800
ext_cpuid[2]=65746e49 2952286c 6c654320 6e6f7265
ext_cpuid[3]=20295228 3031344e 50432030 20402055
ext_cpuid[4]=30312e31 007a4847 00000000 00000000
ext_cpuid[5]=00000000 00000000 00000000 00000000
ext_cpuid[6]=00000000 00000000 10008040 00000000
ext_cpuid[7]=00000000 00000000 00000000 00000100
ext_cpuid[8]=00003027 00000000 00000000 00000000
ext_cpuid[9]=00000004 00000000 00000000 00000000
ext_cpuid[10]=00000004 00000000 00000000 00000000
ext_cpuid[11]=00000004 00000000 00000000 00000000
ext_cpuid[12]=00000004 00000000 00000000 00000000
ext_cpuid[13]=00000004 00000000 00000000 00000000
ext_cpuid[14]=00000004 00000000 00000000 00000000
ext_cpuid[15]=00000004 00000000 00000000 00000000
ext_cpuid[16]=00000004 00000000 00000000 00000000
ext_cpuid[17]=00000004 00000000 00000000 00000000
ext_cpuid[18]=00000004 00000000 00000000 00000000
ext_cpuid[19]=00000004 00000000 00000000 00000000
ext_cpuid[20]=00000004 00000000 00000000 00000000
ext_cpuid[21]=00000004 00000000 00000000 00000000
ext_cpuid[22]=00000004 00000000 00000000 00000000
ext_cpuid[23]=00000004 00000000 00000000 00000000
ext_cpuid[24]=00000004 00000000 00000000 00000000
ext_cpuid[25]=00000004 00000000 00000000 00000000
ext_cpuid[26]=00000004 00000000 00000000 00000000
ext_cpuid[27]=00000004 00000000 00000000 00000000
ext_cpuid[28]=00000004 00000000 00000000 00000000
ext_cpuid[29]=00000004 00000000 00000000 00000000
ext_cpuid[30]=00000004 00000000 00000000 00000000
ext_cpuid[31]=00000004 00000000 00000000 00000000
intel_fn4[0]=7c000121 0140003f 0000003f 00000001
intel_fn4[1]=7c000122 01c0003f 0000003f 00000001
intel_fn4[2]=7c01c143 03c0003f 00000fff 00000001
intel_fn4[3]=00000000 00000000 00000000 00000000
intel_fn4[4]=00000000 00000000 00000000 00000000
intel_fn4[5]=00000000 00000000 00000000 00000000
intel_fn4[6]=00000000 00000000 00000000 00000000
intel_fn4[7]=00000000 00000000 00000000 00000000
intel_fn11[0]=00000001 00000001 00000100 00000002
intel_fn11[1]=00000006 00000004 00000201 00000002
intel_fn11[2]=00000000 00000000 00000002 00000002
intel_fn11[3]=00000000 00000000 00000003 00000002
amd_fn8000001dh[0]=00000004 00000000 00000000 00000000
amd_fn8000001dh[1]=00000000 00200001 00000001 00000121
amd_fn8000001dh[2]=00000000 00040001 00000080 00000043
amd_fn8000001dh[3]=00000000 00040006 00000008 00000043
--------------------------------------------------------------------------------
x86
general
6
10
1
6
122
4
4
24
32
4096
-1
-1
6
8
16
-1
-1
64
64
64
-1
-1
-1
-1
-1
-1
-1
128 (non-authoritative)
Gemini Lake (Celeron)
fpu vme de pse tsc msr pae mce cx8 apic mtrr sep pge mca cmov pat pse36 clflush dts acpi mmx fxsr sse sse2 ss ht tm pbe pni pclmul dts64 monitor ds_cpl vmx est tm2 ssse3 cx16 xtpr pdcm sse4_1 sse4_2 syscall xd movbe popcnt aes xsave osxsave rdtscp lm lahf_lm constant_tsc rdrand x2apic sha_ni sgx rdseed
