------[ Logical CPU #0 ]------
CPUID 00000000: 00000018-756E6547-6C65746E-49656E69 [GenuineIntel]
CPUID 00000001: 000706A8-00400800-4FF8EBBF-BFEBFBFF
CPUID 00000002: 00FEFF01-00000000-00000000-00000000
CPUID 00000003: 00000000-00000000-00000000-00000000
CPUID 00000004: 7C000121-0140003F-0000003F-00000001 [SL 00] [L1D: 24 KB]
CPUID 00000004: 7C000122-01C0003F-0000003F-00000001 [SL 01] [L1I: 32 KB]
CPUID 00000004: 7C01C143-03C0003F-00000FFF-00000001 [SL 02] [L2U: 4 MB]
CPUID 00000005: 00000040-00000040-00000003-11242020
CPUID 00000006: 00000057-00000002-00000001-00000000
CPUID 00000007: 00000000-2294E287-40400004-AC000400
CPUID 00000008: 00000000-00000000-00000000-00000000
CPUID 00000009: 00000000-00000000-00000000-00000000
CPUID 0000000A: 07300404-00000000-00000000-00008603
CPUID 0000000B: 00000001-00000001-00000100-00000000 [SL 00]
CPUID 0000000B: 00000006-00000004-00000201-00000000 [SL 01]
CPUID 0000000C: 00000000-00000000-00000000-00000000
CPUID 0000000D: 0000001B-00000440-00000440-00000000 [SL 00] [x87]
CPUID 0000000D: 0000000F-00000340-00000100-00000000 [SL 01] [SSE]
CPUID 0000000D: 00000040-000003C0-00000000-00000000 [SL 03] [MPX BNDREGS]
CPUID 0000000D: 00000040-00000400-00000000-00000000 [SL 04] [MPX BNDCSR]
CPUID 0000000D: 00000080-00000000-00000001-00000000 [SL 08] [PT]
CPUID 0000000E: 00000000-00000000-00000000-00000000
CPUID 0000000F: 00000000-00000000-00000000-00000000 [SL 00]
CPUID 0000000F: 00000000-00000000-00000000-00000000 [SL 01]
CPUID 00000010: 00000000-00000004-00000000-00000000 [SL 00]
CPUID 00000010: 00000000-00000000-00000000-00000000 [SL 01]
CPUID 00000011: 00000000-00000000-00000000-00000000
CPUID 00000012: 00000000-00000000-00000000-00000000 [SL 00]
CPUID 00000012: 00000000-00000000-00000000-00000000 [SL 01]
CPUID 00000013: 00000000-00000000-00000000-00000000
CPUID 00000014: 00000001-0000003F-80000007-00000000 [SL 00]
CPUID 00000014: 02490002-003FFFFF-00000000-00000000 [SL 01]
CPUID 00000015: 00000003-00000138-0124F800-00000000 [104.00x / 19200000]
CPUID 00000016: 00000000-00000000-00000000-00000000 [0 / 0 / 0]
CPUID 00000017: 00000000-00000000-00000000-00000000 [SL 00]
CPUID 00000018: 00000004-00000000-00000000-00000000 [SL 00]
CPUID 00000018: 00000000-00200001-00000001-00000121 [SL 01]
CPUID 00000018: 00000000-00040001-00000080-00000043 [SL 02]
CPUID 00000018: 00000000-00040006-00000008-00000043 [SL 03]
CPUID 00000018: 00000000-00300001-00000001-00000122 [SL 04]
CPUID 80000000: 80000008-00000000-00000000-00000000
CPUID 80000001: 00000000-00000000-00000101-2C100000
CPUID 80000002: 65746E49-2952286C-6E655020-6D756974 [Intel(R) Pentium]
CPUID 80000003: 20295228-766C6953-4A207265-30343035 [(R) Silver J5040]
CPUID 80000004: 55504320-32204020-4730302E-00007A48 [ CPU @ 2.00GHz]
CPUID 80000005: 00000000-00000000-00000000-00000000 [L1D: 0 KB / L1I: 0 KB]
CPUID 80000006: 00000000-00000000-10008040-00000000 [L2: 4096 KB] / L3: 0 KB]
CPUID 80000007: 00000000-00000000-00000000-00000100
CPUID 80000008: 00003027-00000000-00000000-00000000
------[ Logical CPU #1 ]------
CPUID 00000000: 00000018-756E6547-6C65746E-49656E69 [GenuineIntel]
CPUID 00000001: 000706A8-02400800-4FF8EBBF-BFEBFBFF
CPUID 00000002: 00FEFF01-00000000-00000000-00000000
CPUID 00000003: 00000000-00000000-00000000-00000000
CPUID 00000004: 7C000121-0140003F-0000003F-00000001 [SL 00] [L1D: 24 KB]
CPUID 00000004: 7C000122-01C0003F-0000003F-00000001 [SL 01] [L1I: 32 KB]
CPUID 00000004: 7C01C143-03C0003F-00000FFF-00000001 [SL 02] [L2U: 4 MB]
CPUID 00000005: 00000040-00000040-00000003-11242020
CPUID 00000006: 00000057-00000002-00000001-00000000
CPUID 00000007: 00000000-2294E287-40400004-AC000400
CPUID 00000008: 00000000-00000000-00000000-00000000
CPUID 00000009: 00000000-00000000-00000000-00000000
CPUID 0000000A: 07300404-00000000-00000000-00008603
CPUID 0000000B: 00000001-00000001-00000100-00000002 [SL 00]
CPUID 0000000B: 00000006-00000004-00000201-00000002 [SL 01]
CPUID 0000000C: 00000000-00000000-00000000-00000000
CPUID 0000000D: 0000001B-00000440-00000440-00000000 [SL 00] [x87]
CPUID 0000000D: 0000000F-00000340-00000100-00000000 [SL 01] [SSE]
CPUID 0000000D: 00000040-000003C0-00000000-00000000 [SL 03] [MPX BNDREGS]
CPUID 0000000D: 00000040-00000400-00000000-00000000 [SL 04] [MPX BNDCSR]
CPUID 0000000D: 00000080-00000000-00000001-00000000 [SL 08] [PT]
CPUID 0000000E: 00000000-00000000-00000000-00000000
CPUID 0000000F: 00000000-00000000-00000000-00000000 [SL 00]
CPUID 0000000F: 00000000-00000000-00000000-00000000 [SL 01]
CPUID 00000010: 00000000-00000004-00000000-00000000 [SL 00]
CPUID 00000010: 00000000-00000000-00000000-00000000 [SL 01]
CPUID 00000011: 00000000-00000000-00000000-00000000
CPUID 00000012: 00000000-00000000-00000000-00000000 [SL 00]
CPUID 00000012: 00000000-00000000-00000000-00000000 [SL 01]
CPUID 00000013: 00000000-00000000-00000000-00000000
CPUID 00000014: 00000001-0000003F-80000007-00000000 [SL 00]
CPUID 00000014: 02490002-003FFFFF-00000000-00000000 [SL 01]
CPUID 00000015: 00000003-00000138-0124F800-00000000 [104.00x / 19200000]
CPUID 00000016: 00000000-00000000-00000000-00000000 [0 / 0 / 0]
CPUID 00000017: 00000000-00000000-00000000-00000000 [SL 00]
CPUID 00000018: 00000004-00000000-00000000-00000000 [SL 00]
CPUID 00000018: 00000000-00200001-00000001-00000121 [SL 01]
CPUID 00000018: 00000000-00040001-00000080-00000043 [SL 02]
CPUID 00000018: 00000000-00040006-00000008-00000043 [SL 03]
CPUID 00000018: 00000000-00300001-00000001-00000122 [SL 04]
CPUID 80000000: 80000008-00000000-00000000-00000000
CPUID 80000001: 00000000-00000000-00000101-2C100000
CPUID 80000002: 65746E49-2952286C-6E655020-6D756974 [Intel(R) Pentium]
CPUID 80000003: 20295228-766C6953-4A207265-30343035 [(R) Silver J5040]
CPUID 80000004: 55504320-32204020-4730302E-00007A48 [ CPU @ 2.00GHz]
CPUID 80000005: 00000000-00000000-00000000-00000000 [L1D: 0 KB / L1I: 0 KB]
CPUID 80000006: 00000000-00000000-10008040-00000000 [L2: 4096 KB] / L3: 0 KB]
CPUID 80000007: 00000000-00000000-00000000-00000100
CPUID 80000008: 00003027-00000000-00000000-00000000
------[ Logical CPU #2 ]------
CPUID 00000000: 00000018-756E6547-6C65746E-49656E69 [GenuineIntel]
CPUID 00000001: 000706A8-04400800-4FF8EBBF-BFEBFBFF
CPUID 00000002: 00FEFF01-00000000-00000000-00000000
CPUID 00000003: 00000000-00000000-00000000-00000000
CPUID 00000004: 7C000121-0140003F-0000003F-00000001 [SL 00] [L1D: 24 KB]
CPUID 00000004: 7C000122-01C0003F-0000003F-00000001 [SL 01] [L1I: 32 KB]
CPUID 00000004: 7C01C143-03C0003F-00000FFF-00000001 [SL 02] [L2U: 4 MB]
CPUID 00000005: 00000040-00000040-00000003-11242020
CPUID 00000006: 00000057-00000002-00000001-00000000
CPUID 00000007: 00000000-2294E287-40400004-AC000400
CPUID 00000008: 00000000-00000000-00000000-00000000
CPUID 00000009: 00000000-00000000-00000000-00000000
CPUID 0000000A: 07300404-00000000-00000000-00008603
CPUID 0000000B: 00000001-00000001-00000100-00000004 [SL 00]
CPUID 0000000B: 00000006-00000004-00000201-00000004 [SL 01]
CPUID 0000000C: 00000000-00000000-00000000-00000000
CPUID 0000000D: 0000001B-00000440-00000440-00000000 [SL 00] [x87]
CPUID 0000000D: 0000000F-00000340-00000100-00000000 [SL 01] [SSE]
CPUID 0000000D: 00000040-000003C0-00000000-00000000 [SL 03] [MPX BNDREGS]
CPUID 0000000D: 00000040-00000400-00000000-00000000 [SL 04] [MPX BNDCSR]
CPUID 0000000D: 00000080-00000000-00000001-00000000 [SL 08] [PT]
CPUID 0000000E: 00000000-00000000-00000000-00000000
CPUID 0000000F: 00000000-00000000-00000000-00000000 [SL 00]
CPUID 0000000F: 00000000-00000000-00000000-00000000 [SL 01]
CPUID 00000010: 00000000-00000004-00000000-00000000 [SL 00]
CPUID 00000010: 00000000-00000000-00000000-00000000 [SL 01]
CPUID 00000011: 00000000-00000000-00000000-00000000
CPUID 00000012: 00000000-00000000-00000000-00000000 [SL 00]
CPUID 00000012: 00000000-00000000-00000000-00000000 [SL 01]
CPUID 00000013: 00000000-00000000-00000000-00000000
CPUID 00000014: 00000001-0000003F-80000007-00000000 [SL 00]
CPUID 00000014: 02490002-003FFFFF-00000000-00000000 [SL 01]
CPUID 00000015: 00000003-00000138-0124F800-00000000 [104.00x / 19200000]
CPUID 00000016: 00000000-00000000-00000000-00000000 [0 / 0 / 0]
CPUID 00000017: 00000000-00000000-00000000-00000000 [SL 00]
CPUID 00000018: 00000004-00000000-00000000-00000000 [SL 00]
CPUID 00000018: 00000000-00200001-00000001-00000121 [SL 01]
CPUID 00000018: 00000000-00040001-00000080-00000043 [SL 02]
CPUID 00000018: 00000000-00040006-00000008-00000043 [SL 03]
CPUID 00000018: 00000000-00300001-00000001-00000122 [SL 04]
CPUID 80000000: 80000008-00000000-00000000-00000000
CPUID 80000001: 00000000-00000000-00000101-2C100000
CPUID 80000002: 65746E49-2952286C-6E655020-6D756974 [Intel(R) Pentium]
CPUID 80000003: 20295228-766C6953-4A207265-30343035 [(R) Silver J5040]
CPUID 80000004: 55504320-32204020-4730302E-00007A48 [ CPU @ 2.00GHz]
CPUID 80000005: 00000000-00000000-00000000-00000000 [L1D: 0 KB / L1I: 0 KB]
CPUID 80000006: 00000000-00000000-10008040-00000000 [L2: 4096 KB] / L3: 0 KB]
CPUID 80000007: 00000000-00000000-00000000-00000100
CPUID 80000008: 00003027-00000000-00000000-00000000
------[ Logical CPU #3 ]------
CPUID 00000000: 00000018-756E6547-6C65746E-49656E69 [GenuineIntel]
CPUID 00000001: 000706A8-06400800-4FF8EBBF-BFEBFBFF
CPUID 00000002: 00FEFF01-00000000-00000000-00000000
CPUID 00000003: 00000000-00000000-00000000-00000000
CPUID 00000004: 7C000121-0140003F-0000003F-00000001 [SL 00] [L1D: 24 KB]
CPUID 00000004: 7C000122-01C0003F-0000003F-00000001 [SL 01] [L1I: 32 KB]
CPUID 00000004: 7C01C143-03C0003F-00000FFF-00000001 [SL 02] [L2U: 4 MB]
CPUID 00000005: 00000040-00000040-00000003-11242020
CPUID 00000006: 00000057-00000002-00000001-00000000
CPUID 00000007: 00000000-2294E287-40400004-AC000400
CPUID 00000008: 00000000-00000000-00000000-00000000
CPUID 00000009: 00000000-00000000-00000000-00000000
CPUID 0000000A: 07300404-00000000-00000000-00008603
CPUID 0000000B: 00000001-00000001-00000100-00000006 [SL 00]
CPUID 0000000B: 00000006-00000004-00000201-00000006 [SL 01]
CPUID 0000000C: 00000000-00000000-00000000-00000000
CPUID 0000000D: 0000001B-00000440-00000440-00000000 [SL 00] [x87]
CPUID 0000000D: 0000000F-00000340-00000100-00000000 [SL 01] [SSE]
CPUID 0000000D: 00000040-000003C0-00000000-00000000 [SL 03] [MPX BNDREGS]
CPUID 0000000D: 00000040-00000400-00000000-00000000 [SL 04] [MPX BNDCSR]
CPUID 0000000D: 00000080-00000000-00000001-00000000 [SL 08] [PT]
CPUID 0000000E: 00000000-00000000-00000000-00000000
CPUID 0000000F: 00000000-00000000-00000000-00000000 [SL 00]
CPUID 0000000F: 00000000-00000000-00000000-00000000 [SL 01]
CPUID 00000010: 00000000-00000004-00000000-00000000 [SL 00]
CPUID 00000010: 00000000-00000000-00000000-00000000 [SL 01]
CPUID 00000011: 00000000-00000000-00000000-00000000
CPUID 00000012: 00000000-00000000-00000000-00000000 [SL 00]
CPUID 00000012: 00000000-00000000-00000000-00000000 [SL 01]
CPUID 00000013: 00000000-00000000-00000000-00000000
CPUID 00000014: 00000001-0000003F-80000007-00000000 [SL 00]
CPUID 00000014: 02490002-003FFFFF-00000000-00000000 [SL 01]
CPUID 00000015: 00000003-00000138-0124F800-00000000 [104.00x / 19200000]
CPUID 00000016: 00000000-00000000-00000000-00000000 [0 / 0 / 0]
CPUID 00000017: 00000000-00000000-00000000-00000000 [SL 00]
CPUID 00000018: 00000004-00000000-00000000-00000000 [SL 00]
CPUID 00000018: 00000000-00200001-00000001-00000121 [SL 01]
CPUID 00000018: 00000000-00040001-00000080-00000043 [SL 02]
CPUID 00000018: 00000000-00040006-00000008-00000043 [SL 03]
CPUID 00000018: 00000000-00300001-00000001-00000122 [SL 04]
CPUID 80000000: 80000008-00000000-00000000-00000000
CPUID 80000001: 00000000-00000000-00000101-2C100000
CPUID 80000002: 65746E49-2952286C-6E655020-6D756974 [Intel(R) Pentium]
CPUID 80000003: 20295228-766C6953-4A207265-30343035 [(R) Silver J5040]
CPUID 80000004: 55504320-32204020-4730302E-00007A48 [ CPU @ 2.00GHz]
CPUID 80000005: 00000000-00000000-00000000-00000000 [L1D: 0 KB / L1I: 0 KB]
CPUID 80000006: 00000000-00000000-10008040-00000000 [L2: 4096 KB] / L3: 0 KB]
CPUID 80000007: 00000000-00000000-00000000-00000100
CPUID 80000008: 00003027-00000000-00000000-00000000
--------------------------------------------------------------------------------
x86
x86-64-v3
general
6
10
8
6
122
4
4
24
32
4096
-1
-1
6
8
16
-1
-1
64
64
64
-1
-1
4
4
1
0
0
128 (non-authoritative)
Pentium Silver (Gemini Lake)
14 nm
fpu vme de pse tsc msr pae mce cx8 apic mtrr sep pge mca cmov pat pse36 clflush dts acpi mmx fxsr sse sse2 ss ht tm pbe pni pclmul dts64 monitor ds_cpl vmx est tm2 ssse3 cx16 xtpr pdcm sse4_1 sse4_2 xd movbe popcnt aes xsave osxsave rdtscp lm lahf_lm constant_tsc rdrand x2apic sha_ni sgx rdseed
