_________________ Logical CPU #0 _________________
basic_cpuid[0]=0000000d 68747541 444d4163 69746e65
basic_cpuid[1]=00660f01 00040800 3ed8320b 178bfbff
basic_cpuid[2]=00000000 00000000 00000000 00000000
basic_cpuid[3]=00000000 00000000 00000000 00000000
basic_cpuid[4]=00000000 00000000 00000000 00000000
basic_cpuid[5]=00000040 00000040 00000003 00000000
basic_cpuid[6]=00000004 00000000 00000001 00000000
basic_cpuid[7]=00000000 000001a9 00000000 00000000
basic_cpuid[8]=00000000 00000000 00000000 00000000
basic_cpuid[9]=00000000 00000000 00000000 00000000
basic_cpuid[10]=00000000 00000000 00000000 00000000
basic_cpuid[11]=00000000 00000000 00000000 00000000
basic_cpuid[12]=00000000 00000000 00000000 00000000
basic_cpuid[13]=00000007 00000340 000003c0 40000000
basic_cpuid[14]=00000000 00000000 00000000 00000000
basic_cpuid[15]=00000000 00000000 00000000 00000000
basic_cpuid[16]=00000000 00000000 00000000 00000000
basic_cpuid[17]=00000000 00000000 00000000 00000000
basic_cpuid[18]=00000000 00000000 00000000 00000000
basic_cpuid[19]=00000000 00000000 00000000 00000000
basic_cpuid[20]=00000000 00000000 00000000 00000000
basic_cpuid[21]=00000000 00000000 00000000 00000000
basic_cpuid[22]=00000000 00000000 00000000 00000000
basic_cpuid[23]=00000000 00000000 00000000 00000000
basic_cpuid[24]=00000000 00000000 00000000 00000000
basic_cpuid[25]=00000000 00000000 00000000 00000000
basic_cpuid[26]=00000000 00000000 00000000 00000000
basic_cpuid[27]=00000000 00000000 00000000 00000000
basic_cpuid[28]=00000000 00000000 00000000 00000000
basic_cpuid[29]=00000000 00000000 00000000 00000000
basic_cpuid[30]=00000000 00000000 00000000 00000000
basic_cpuid[31]=00000000 00000000 00000000 00000000
ext_cpuid[0]=8000001e 68747541 444d4163 69746e65
ext_cpuid[1]=00660f01 30000000 2febbfff 2fd3fbff
ext_cpuid[2]=20444d41 372d3841 20303836 65646152
ext_cpuid[3]=52206e6f 31202c37 6f432030 7475706d
ext_cpuid[4]=6f432065 20736572 362b4334 00202047
ext_cpuid[5]=ff40ff18 ff40ff30 20080140 60030140
ext_cpuid[6]=64006400 64004200 04008140 00000000
ext_cpuid[7]=00000000 00000005 00000400 000037d9
ext_cpuid[8]=00003030 00001000 00004003 00000000
ext_cpuid[9]=00000000 00000000 00000000 00000000
ext_cpuid[10]=00000001 00008000 00000000 00013cff
ext_cpuid[11]=00000000 00000000 00000000 00000000
ext_cpuid[12]=00000000 00000000 00000000 00000000
ext_cpuid[13]=00000000 00000000 00000000 00000000
ext_cpuid[14]=00000000 00000000 00000000 00000000
ext_cpuid[15]=00000000 00000000 00000000 00000000
ext_cpuid[16]=00000000 00000000 00000000 00000000
ext_cpuid[17]=00000000 00000000 00000000 00000000
ext_cpuid[18]=00000000 00000000 00000000 00000000
ext_cpuid[19]=00000000 00000000 00000000 00000000
ext_cpuid[20]=00000000 00000000 00000000 00000000
ext_cpuid[21]=00000000 00000000 00000000 00000000
ext_cpuid[22]=00000000 00000000 00000000 00000000
ext_cpuid[23]=00000000 00000000 00000000 00000000
ext_cpuid[24]=00000000 00000000 00000000 00000000
ext_cpuid[25]=f040f018 64006400 00000000 00000000
ext_cpuid[26]=00000003 00000000 00000000 00000000
ext_cpuid[27]=000007ff 00000000 00000000 00000000
ext_cpuid[28]=00000000 80032013 00010200 e000000f
ext_cpuid[29]=00000121 01c0003f 0000003f 00000000
ext_cpuid[30]=00000010 00000100 00000000 00000000
ext_cpuid[31]=00000000 00000000 00000000 00000000
intel_fn4[0]=00000000 00000000 00000000 00000000
intel_fn4[1]=00000000 00000000 00000000 00000000
intel_fn4[2]=00000000 00000000 00000000 00000000
intel_fn4[3]=00000000 00000000 00000000 00000000
intel_fn4[4]=00000000 00000000 00000000 00000000
intel_fn4[5]=00000000 00000000 00000000 00000000
intel_fn4[6]=00000000 00000000 00000000 00000000
intel_fn4[7]=00000000 00000000 00000000 00000000
intel_fn11[0]=00000000 00000000 00000000 00000000
intel_fn11[1]=00000000 00000000 00000000 00000000
intel_fn11[2]=00000000 00000000 00000000 00000000
intel_fn11[3]=00000000 00000000 00000000 00000000
amd_fn8000001dh[0]=00000121 01c0003f 0000003f 00000000
amd_fn8000001dh[1]=00004122 0080003f 000001ff 00000000
amd_fn8000001dh[2]=00004143 03c0003f 000003ff 00000001
amd_fn8000001dh[3]=00000000 00000000 00000000 00000000
_________________ Logical CPU #1 _________________
basic_cpuid[0]=0000000d 68747541 444d4163 69746e65
basic_cpuid[1]=00660f01 01040800 3ed8320b 178bfbff
basic_cpuid[2]=00000000 00000000 00000000 00000000
basic_cpuid[3]=00000000 00000000 00000000 00000000
basic_cpuid[4]=00000000 00000000 00000000 00000000
basic_cpuid[5]=00000040 00000040 00000003 00000000
basic_cpuid[6]=00000004 00000000 00000001 00000000
basic_cpuid[7]=00000000 000001a9 00000000 00000000
basic_cpuid[8]=00000000 00000000 00000000 00000000
basic_cpuid[9]=00000000 00000000 00000000 00000000
basic_cpuid[10]=00000000 00000000 00000000 00000000
basic_cpuid[11]=00000000 00000000 00000000 00000000
basic_cpuid[12]=00000000 00000000 00000000 00000000
basic_cpuid[13]=00000007 00000340 000003c0 40000000
basic_cpuid[14]=00000000 00000000 00000000 00000000
basic_cpuid[15]=00000000 00000000 00000000 00000000
basic_cpuid[16]=00000000 00000000 00000000 00000000
basic_cpuid[17]=00000000 00000000 00000000 00000000
basic_cpuid[18]=00000000 00000000 00000000 00000000
basic_cpuid[19]=00000000 00000000 00000000 00000000
basic_cpuid[20]=00000000 00000000 00000000 00000000
basic_cpuid[21]=00000000 00000000 00000000 00000000
basic_cpuid[22]=00000000 00000000 00000000 00000000
basic_cpuid[23]=00000000 00000000 00000000 00000000
basic_cpuid[24]=00000000 00000000 00000000 00000000
basic_cpuid[25]=00000000 00000000 00000000 00000000
basic_cpuid[26]=00000000 00000000 00000000 00000000
basic_cpuid[27]=00000000 00000000 00000000 00000000
basic_cpuid[28]=00000000 00000000 00000000 00000000
basic_cpuid[29]=00000000 00000000 00000000 00000000
basic_cpuid[30]=00000000 00000000 00000000 00000000
basic_cpuid[31]=00000000 00000000 00000000 00000000
ext_cpuid[0]=8000001e 68747541 444d4163 69746e65
ext_cpuid[1]=00660f01 30000000 2febbfff 2fd3fbff
ext_cpuid[2]=20444d41 372d3841 20303836 65646152
ext_cpuid[3]=52206e6f 31202c37 6f432030 7475706d
ext_cpuid[4]=6f432065 20736572 362b4334 00202047
ext_cpuid[5]=ff40ff18 ff40ff30 20080140 60030140
ext_cpuid[6]=64006400 64004200 04008140 00000000
ext_cpuid[7]=00000000 00000005 00000400 000037d9
ext_cpuid[8]=00003030 00001000 00004003 00000000
ext_cpuid[9]=00000000 00000000 00000000 00000000
ext_cpuid[10]=00000001 00008000 00000000 00013cff
ext_cpuid[11]=00000000 00000000 00000000 00000000
ext_cpuid[12]=00000000 00000000 00000000 00000000
ext_cpuid[13]=00000000 00000000 00000000 00000000
ext_cpuid[14]=00000000 00000000 00000000 00000000
ext_cpuid[15]=00000000 00000000 00000000 00000000
ext_cpuid[16]=00000000 00000000 00000000 00000000
ext_cpuid[17]=00000000 00000000 00000000 00000000
ext_cpuid[18]=00000000 00000000 00000000 00000000
ext_cpuid[19]=00000000 00000000 00000000 00000000
ext_cpuid[20]=00000000 00000000 00000000 00000000
ext_cpuid[21]=00000000 00000000 00000000 00000000
ext_cpuid[22]=00000000 00000000 00000000 00000000
ext_cpuid[23]=00000000 00000000 00000000 00000000
ext_cpuid[24]=00000000 00000000 00000000 00000000
ext_cpuid[25]=f040f018 64006400 00000000 00000000
ext_cpuid[26]=00000003 00000000 00000000 00000000
ext_cpuid[27]=000007ff 00000000 00000000 00000000
ext_cpuid[28]=00000000 80032013 00010200 e000000f
ext_cpuid[29]=00000121 01c0003f 0000003f 00000000
ext_cpuid[30]=00000011 00000100 00000000 00000000
ext_cpuid[31]=00000000 00000000 00000000 00000000
intel_fn4[0]=00000000 00000000 00000000 00000000
intel_fn4[1]=00000000 00000000 00000000 00000000
intel_fn4[2]=00000000 00000000 00000000 00000000
intel_fn4[3]=00000000 00000000 00000000 00000000
intel_fn4[4]=00000000 00000000 00000000 00000000
intel_fn4[5]=00000000 00000000 00000000 00000000
intel_fn4[6]=00000000 00000000 00000000 00000000
intel_fn4[7]=00000000 00000000 00000000 00000000
intel_fn11[0]=00000000 00000000 00000000 00000000
intel_fn11[1]=00000000 00000000 00000000 00000000
intel_fn11[2]=00000000 00000000 00000000 00000000
intel_fn11[3]=00000000 00000000 00000000 00000000
amd_fn8000001dh[0]=00000121 01c0003f 0000003f 00000000
amd_fn8000001dh[1]=00004122 0080003f 000001ff 00000000
amd_fn8000001dh[2]=00004143 03c0003f 000003ff 00000001
amd_fn8000001dh[3]=00000000 00000000 00000000 00000000
_________________ Logical CPU #2 _________________
basic_cpuid[0]=0000000d 68747541 444d4163 69746e65
basic_cpuid[1]=00660f01 02040800 3ed8320b 178bfbff
basic_cpuid[2]=00000000 00000000 00000000 00000000
basic_cpuid[3]=00000000 00000000 00000000 00000000
basic_cpuid[4]=00000000 00000000 00000000 00000000
basic_cpuid[5]=00000040 00000040 00000003 00000000
basic_cpuid[6]=00000004 00000000 00000001 00000000
basic_cpuid[7]=00000000 000001a9 00000000 00000000
basic_cpuid[8]=00000000 00000000 00000000 00000000
basic_cpuid[9]=00000000 00000000 00000000 00000000
basic_cpuid[10]=00000000 00000000 00000000 00000000
basic_cpuid[11]=00000000 00000000 00000000 00000000
basic_cpuid[12]=00000000 00000000 00000000 00000000
basic_cpuid[13]=00000007 00000340 000003c0 40000000
basic_cpuid[14]=00000000 00000000 00000000 00000000
basic_cpuid[15]=00000000 00000000 00000000 00000000
basic_cpuid[16]=00000000 00000000 00000000 00000000
basic_cpuid[17]=00000000 00000000 00000000 00000000
basic_cpuid[18]=00000000 00000000 00000000 00000000
basic_cpuid[19]=00000000 00000000 00000000 00000000
basic_cpuid[20]=00000000 00000000 00000000 00000000
basic_cpuid[21]=00000000 00000000 00000000 00000000
basic_cpuid[22]=00000000 00000000 00000000 00000000
basic_cpuid[23]=00000000 00000000 00000000 00000000
basic_cpuid[24]=00000000 00000000 00000000 00000000
basic_cpuid[25]=00000000 00000000 00000000 00000000
basic_cpuid[26]=00000000 00000000 00000000 00000000
basic_cpuid[27]=00000000 00000000 00000000 00000000
basic_cpuid[28]=00000000 00000000 00000000 00000000
basic_cpuid[29]=00000000 00000000 00000000 00000000
basic_cpuid[30]=00000000 00000000 00000000 00000000
basic_cpuid[31]=00000000 00000000 00000000 00000000
ext_cpuid[0]=8000001e 68747541 444d4163 69746e65
ext_cpuid[1]=00660f01 30000000 2febbfff 2fd3fbff
ext_cpuid[2]=20444d41 372d3841 20303836 65646152
ext_cpuid[3]=52206e6f 31202c37 6f432030 7475706d
ext_cpuid[4]=6f432065 20736572 362b4334 00202047
ext_cpuid[5]=ff40ff18 ff40ff30 20080140 60030140
ext_cpuid[6]=64006400 64004200 04008140 00000000
ext_cpuid[7]=00000000 00000005 00000400 000037d9
ext_cpuid[8]=00003030 00001000 00004003 00000000
ext_cpuid[9]=00000000 00000000 00000000 00000000
ext_cpuid[10]=00000001 00008000 00000000 00013cff
ext_cpuid[11]=00000000 00000000 00000000 00000000
ext_cpuid[12]=00000000 00000000 00000000 00000000
ext_cpuid[13]=00000000 00000000 00000000 00000000
ext_cpuid[14]=00000000 00000000 00000000 00000000
ext_cpuid[15]=00000000 00000000 00000000 00000000
ext_cpuid[16]=00000000 00000000 00000000 00000000
ext_cpuid[17]=00000000 00000000 00000000 00000000
ext_cpuid[18]=00000000 00000000 00000000 00000000
ext_cpuid[19]=00000000 00000000 00000000 00000000
ext_cpuid[20]=00000000 00000000 00000000 00000000
ext_cpuid[21]=00000000 00000000 00000000 00000000
ext_cpuid[22]=00000000 00000000 00000000 00000000
ext_cpuid[23]=00000000 00000000 00000000 00000000
ext_cpuid[24]=00000000 00000000 00000000 00000000
ext_cpuid[25]=f040f018 64006400 00000000 00000000
ext_cpuid[26]=00000003 00000000 00000000 00000000
ext_cpuid[27]=000007ff 00000000 00000000 00000000
ext_cpuid[28]=00000000 80032013 00010200 e000000f
ext_cpuid[29]=00000121 01c0003f 0000003f 00000000
ext_cpuid[30]=00000012 00000101 00000000 00000000
ext_cpuid[31]=00000000 00000000 00000000 00000000
intel_fn4[0]=00000000 00000000 00000000 00000000
intel_fn4[1]=00000000 00000000 00000000 00000000
intel_fn4[2]=00000000 00000000 00000000 00000000
intel_fn4[3]=00000000 00000000 00000000 00000000
intel_fn4[4]=00000000 00000000 00000000 00000000
intel_fn4[5]=00000000 00000000 00000000 00000000
intel_fn4[6]=00000000 00000000 00000000 00000000
intel_fn4[7]=00000000 00000000 00000000 00000000
intel_fn11[0]=00000000 00000000 00000000 00000000
intel_fn11[1]=00000000 00000000 00000000 00000000
intel_fn11[2]=00000000 00000000 00000000 00000000
intel_fn11[3]=00000000 00000000 00000000 00000000
amd_fn8000001dh[0]=00000121 01c0003f 0000003f 00000000
amd_fn8000001dh[1]=00004122 0080003f 000001ff 00000000
amd_fn8000001dh[2]=00004143 03c0003f 000003ff 00000001
amd_fn8000001dh[3]=00000000 00000000 00000000 00000000
_________________ Logical CPU #3 _________________
basic_cpuid[0]=0000000d 68747541 444d4163 69746e65
basic_cpuid[1]=00660f01 03040800 3ed8320b 178bfbff
basic_cpuid[2]=00000000 00000000 00000000 00000000
basic_cpuid[3]=00000000 00000000 00000000 00000000
basic_cpuid[4]=00000000 00000000 00000000 00000000
basic_cpuid[5]=00000040 00000040 00000003 00000000
basic_cpuid[6]=00000004 00000000 00000001 00000000
basic_cpuid[7]=00000000 000001a9 00000000 00000000
basic_cpuid[8]=00000000 00000000 00000000 00000000
basic_cpuid[9]=00000000 00000000 00000000 00000000
basic_cpuid[10]=00000000 00000000 00000000 00000000
basic_cpuid[11]=00000000 00000000 00000000 00000000
basic_cpuid[12]=00000000 00000000 00000000 00000000
basic_cpuid[13]=00000007 00000340 000003c0 40000000
basic_cpuid[14]=00000000 00000000 00000000 00000000
basic_cpuid[15]=00000000 00000000 00000000 00000000
basic_cpuid[16]=00000000 00000000 00000000 00000000
basic_cpuid[17]=00000000 00000000 00000000 00000000
basic_cpuid[18]=00000000 00000000 00000000 00000000
basic_cpuid[19]=00000000 00000000 00000000 00000000
basic_cpuid[20]=00000000 00000000 00000000 00000000
basic_cpuid[21]=00000000 00000000 00000000 00000000
basic_cpuid[22]=00000000 00000000 00000000 00000000
basic_cpuid[23]=00000000 00000000 00000000 00000000
basic_cpuid[24]=00000000 00000000 00000000 00000000
basic_cpuid[25]=00000000 00000000 00000000 00000000
basic_cpuid[26]=00000000 00000000 00000000 00000000
basic_cpuid[27]=00000000 00000000 00000000 00000000
basic_cpuid[28]=00000000 00000000 00000000 00000000
basic_cpuid[29]=00000000 00000000 00000000 00000000
basic_cpuid[30]=00000000 00000000 00000000 00000000
basic_cpuid[31]=00000000 00000000 00000000 00000000
ext_cpuid[0]=8000001e 68747541 444d4163 69746e65
ext_cpuid[1]=00660f01 30000000 2febbfff 2fd3fbff
ext_cpuid[2]=20444d41 372d3841 20303836 65646152
ext_cpuid[3]=52206e6f 31202c37 6f432030 7475706d
ext_cpuid[4]=6f432065 20736572 362b4334 00202047
ext_cpuid[5]=ff40ff18 ff40ff30 20080140 60030140
ext_cpuid[6]=64006400 64004200 04008140 00000000
ext_cpuid[7]=00000000 00000005 00000400 000037d9
ext_cpuid[8]=00003030 00001000 00004003 00000000
ext_cpuid[9]=00000000 00000000 00000000 00000000
ext_cpuid[10]=00000001 00008000 00000000 00013cff
ext_cpuid[11]=00000000 00000000 00000000 00000000
ext_cpuid[12]=00000000 00000000 00000000 00000000
ext_cpuid[13]=00000000 00000000 00000000 00000000
ext_cpuid[14]=00000000 00000000 00000000 00000000
ext_cpuid[15]=00000000 00000000 00000000 00000000
ext_cpuid[16]=00000000 00000000 00000000 00000000
ext_cpuid[17]=00000000 00000000 00000000 00000000
ext_cpuid[18]=00000000 00000000 00000000 00000000
ext_cpuid[19]=00000000 00000000 00000000 00000000
ext_cpuid[20]=00000000 00000000 00000000 00000000
ext_cpuid[21]=00000000 00000000 00000000 00000000
ext_cpuid[22]=00000000 00000000 00000000 00000000
ext_cpuid[23]=00000000 00000000 00000000 00000000
ext_cpuid[24]=00000000 00000000 00000000 00000000
ext_cpuid[25]=f040f018 64006400 00000000 00000000
ext_cpuid[26]=00000003 00000000 00000000 00000000
ext_cpuid[27]=000007ff 00000000 00000000 00000000
ext_cpuid[28]=00000000 80032013 00010200 e000000f
ext_cpuid[29]=00000121 01c0003f 0000003f 00000000
ext_cpuid[30]=00000013 00000101 00000000 00000000
ext_cpuid[31]=00000000 00000000 00000000 00000000
intel_fn4[0]=00000000 00000000 00000000 00000000
intel_fn4[1]=00000000 00000000 00000000 00000000
intel_fn4[2]=00000000 00000000 00000000 00000000
intel_fn4[3]=00000000 00000000 00000000 00000000
intel_fn4[4]=00000000 00000000 00000000 00000000
intel_fn4[5]=00000000 00000000 00000000 00000000
intel_fn4[6]=00000000 00000000 00000000 00000000
intel_fn4[7]=00000000 00000000 00000000 00000000
intel_fn11[0]=00000000 00000000 00000000 00000000
intel_fn11[1]=00000000 00000000 00000000 00000000
intel_fn11[2]=00000000 00000000 00000000 00000000
intel_fn11[3]=00000000 00000000 00000000 00000000
amd_fn8000001dh[0]=00000121 01c0003f 0000003f 00000000
amd_fn8000001dh[1]=00004122 0080003f 000001ff 00000000
amd_fn8000001dh[2]=00004143 03c0003f 000003ff 00000001
amd_fn8000001dh[3]=00000000 00000000 00000000 00000000
--------------------------------------------------------------------------------
x86
x86-64-v3
general
15
0
1
21
96
4
4
32
96
1024
-1
-1
8
3
16
-1
-1
64
64
64
-1
-1
-1
-1
-1
-1
-1
128 (authoritative)
A-Series (Carrizo)
GF 28SHP
fpu vme de pse tsc msr pae mce cx8 apic mtrr sep pge mca cmov pat pse36 clflush mmx fxsr sse sse2 ht pni pclmul monitor ssse3 cx16 sse4_1 sse4_2 syscall movbe popcnt aes xsave osxsave avx mmxext nx fxsr_opt rdtscp lm lahf_lm cmp_legacy svm abm misalignsse sse4a 3dnowprefetch osvw ibs skinit wdt ts ttp tm_amd 100mhzsteps hwpstate constant_tsc xop fma3 fma4 tbm f16c cpb aperfmperf pa avx2 bmi1 bmi2
