------[ Logical CPU #0 ]------
CPUID 00000000: 0000000D-68747541-444D4163-69746E65 [AuthenticAMD]
CPUID 00000001: 00660F01-00040800-7ED8320B-178BFBFF
CPUID 00000002: 00000000-00000000-00000000-00000000
CPUID 00000003: 00000000-00000000-00000000-00000000
CPUID 00000005: 00000040-00000040-00000003-00000000
CPUID 00000006: 00000004-00000000-00000001-00000000
CPUID 00000007: 00000000-000001A9-00000000-00000000
CPUID 00000008: 00000000-00000000-00000000-00000000
CPUID 00000009: 00000000-00000000-00000000-00000000
CPUID 0000000A: 00000000-00000000-00000000-00000000
CPUID 0000000C: 00000000-00000000-00000000-00000000
CPUID 0000000D: 00000007-00000340-000003C0-40000000 [SL 00]
CPUID 0000000D: 00000001-00000000-00000000-00000000 [SL 01]
CPUID 0000000D: 00000100-00000240-00000000-00000000 [SL 02]
CPUID 0000000D: 00000080-00000340-00000000-00000000 [SL 3E]
CPUID 80000000: 8000001E-68747541-444D4163-69746E65 [AuthenticAMD]
CPUID 80000001: 00660F01-00000000-2FEBBFFF-2FD3FBFF
CPUID 80000002: 20444D41-382D5846-50303038-64615220 [AMD FX-8800P Rad]
CPUID 80000003: 206E6F65-202C3752-43203231-75706D6F [eon R7, 12 Compu]
CPUID 80000004: 43206574-7365726F-2B433420-00204738 [te Cores 4C+8G ]
CPUID 80000005: FF40FF18-FF40FF30-20080140-60030140
CPUID 80000006: 64006400-64004200-04008140-00000000
CPUID 80000007: 00000000-00000005-00000400-000037D9
CPUID 80000008: 00003030-00000000-00004003-00000000
CPUID 80000009: 00000000-00000000-00000000-00000000
CPUID 8000000A: 00000001-00008000-00000000-0001BCFF
CPUID 8000000B: 00000000-00000000-00000000-00000000
CPUID 8000000C: 00000000-00000000-00000000-00000000
CPUID 8000000D: 00000000-00000000-00000000-00000000
CPUID 8000000E: 00000000-00000000-00000000-00000000
CPUID 8000000F: 00000000-00000000-00000000-00000000
CPUID 80000010: 00000000-00000000-00000000-00000000
CPUID 80000011: 00000000-00000000-00000000-00000000
CPUID 80000012: 00000000-00000000-00000000-00000000
CPUID 80000013: 00000000-00000000-00000000-00000000
CPUID 80000014: 00000000-00000000-00000000-00000000
CPUID 80000015: 00000000-00000000-00000000-00000000
CPUID 80000016: 00000000-00000000-00000000-00000000
CPUID 80000017: 00000000-00000000-00000000-00000000
CPUID 80000018: 00000000-00000000-00000000-00000000
CPUID 80000019: F040F018-64006400-00000000-00000000
CPUID 8000001A: 00000003-00000000-00000000-00000000
CPUID 8000001B: 000007FF-00000000-00000000-00000000
CPUID 8000001C: 00000000-80032013-00010200-E000000F
CPUID 8000001D: 00000121-01C0003F-0000003F-00000000 [SL 00]
CPUID 8000001D: 00004122-0080003F-000001FF-00000000 [SL 01]
CPUID 8000001D: 00004143-03C0003F-000003FF-00000001 [SL 02]
CPUID 8000001E: 00000010-00000100-00000000-00000000
CPUID 8FFFFFFF: 00000000-00000000-00000000-00000000
------[ Logical CPU #1 ]------
CPUID 00000000: 0000000D-68747541-444D4163-69746E65 [AuthenticAMD]
CPUID 00000001: 00660F01-01040800-7ED8320B-178BFBFF
CPUID 00000002: 00000000-00000000-00000000-00000000
CPUID 00000003: 00000000-00000000-00000000-00000000
CPUID 00000005: 00000040-00000040-00000003-00000000
CPUID 00000006: 00000004-00000000-00000001-00000000
CPUID 00000007: 00000000-000001A9-00000000-00000000
CPUID 00000008: 00000000-00000000-00000000-00000000
CPUID 00000009: 00000000-00000000-00000000-00000000
CPUID 0000000A: 00000000-00000000-00000000-00000000
CPUID 0000000C: 00000000-00000000-00000000-00000000
CPUID 0000000D: 00000007-00000340-000003C0-40000000 [SL 00]
CPUID 0000000D: 00000001-00000000-00000000-00000000 [SL 01]
CPUID 0000000D: 00000100-00000240-00000000-00000000 [SL 02]
CPUID 0000000D: 00000080-00000340-00000000-00000000 [SL 3E]
CPUID 80000000: 8000001E-68747541-444D4163-69746E65 [AuthenticAMD]
CPUID 80000001: 00660F01-00000000-2FEBBFFF-2FD3FBFF
CPUID 80000002: 20444D41-382D5846-50303038-64615220 [AMD FX-8800P Rad]
CPUID 80000003: 206E6F65-202C3752-43203231-75706D6F [eon R7, 12 Compu]
CPUID 80000004: 43206574-7365726F-2B433420-00204738 [te Cores 4C+8G ]
CPUID 80000005: FF40FF18-FF40FF30-20080140-60030140
CPUID 80000006: 64006400-64004200-04008140-00000000
CPUID 80000007: 00000000-00000005-00000400-000037D9
CPUID 80000008: 00003030-00000000-00004003-00000000
CPUID 80000009: 00000000-00000000-00000000-00000000
CPUID 8000000A: 00000001-00008000-00000000-0001BCFF
CPUID 8000000B: 00000000-00000000-00000000-00000000
CPUID 8000000C: 00000000-00000000-00000000-00000000
CPUID 8000000D: 00000000-00000000-00000000-00000000
CPUID 8000000E: 00000000-00000000-00000000-00000000
CPUID 8000000F: 00000000-00000000-00000000-00000000
CPUID 80000010: 00000000-00000000-00000000-00000000
CPUID 80000011: 00000000-00000000-00000000-00000000
CPUID 80000012: 00000000-00000000-00000000-00000000
CPUID 80000013: 00000000-00000000-00000000-00000000
CPUID 80000014: 00000000-00000000-00000000-00000000
CPUID 80000015: 00000000-00000000-00000000-00000000
CPUID 80000016: 00000000-00000000-00000000-00000000
CPUID 80000017: 00000000-00000000-00000000-00000000
CPUID 80000018: 00000000-00000000-00000000-00000000
CPUID 80000019: F040F018-64006400-00000000-00000000
CPUID 8000001A: 00000003-00000000-00000000-00000000
CPUID 8000001B: 000007FF-00000000-00000000-00000000
CPUID 8000001C: 00000000-80032013-00010200-E000000F
CPUID 8000001D: 00000121-01C0003F-0000003F-00000000 [SL 00]
CPUID 8000001D: 00004122-0080003F-000001FF-00000000 [SL 01]
CPUID 8000001D: 00004143-03C0003F-000003FF-00000001 [SL 02]
CPUID 8000001E: 00000011-00000100-00000000-00000000
CPUID 8FFFFFFF: 00000000-00000000-00000000-00000000
------[ Logical CPU #2 ]------
CPUID 00000000: 0000000D-68747541-444D4163-69746E65 [AuthenticAMD]
CPUID 00000001: 00660F01-02040800-7ED8320B-178BFBFF
CPUID 00000002: 00000000-00000000-00000000-00000000
CPUID 00000003: 00000000-00000000-00000000-00000000
CPUID 00000005: 00000040-00000040-00000003-00000000
CPUID 00000006: 00000004-00000000-00000001-00000000
CPUID 00000007: 00000000-000001A9-00000000-00000000
CPUID 00000008: 00000000-00000000-00000000-00000000
CPUID 00000009: 00000000-00000000-00000000-00000000
CPUID 0000000A: 00000000-00000000-00000000-00000000
CPUID 0000000C: 00000000-00000000-00000000-00000000
CPUID 0000000D: 00000007-00000340-000003C0-40000000 [SL 00]
CPUID 0000000D: 00000001-00000000-00000000-00000000 [SL 01]
CPUID 0000000D: 00000100-00000240-00000000-00000000 [SL 02]
CPUID 0000000D: 00000080-00000340-00000000-00000000 [SL 3E]
CPUID 80000000: 8000001E-68747541-444D4163-69746E65 [AuthenticAMD]
CPUID 80000001: 00660F01-00000000-2FEBBFFF-2FD3FBFF
CPUID 80000002: 20444D41-382D5846-50303038-64615220 [AMD FX-8800P Rad]
CPUID 80000003: 206E6F65-202C3752-43203231-75706D6F [eon R7, 12 Compu]
CPUID 80000004: 43206574-7365726F-2B433420-00204738 [te Cores 4C+8G ]
CPUID 80000005: FF40FF18-FF40FF30-20080140-60030140
CPUID 80000006: 64006400-64004200-04008140-00000000
CPUID 80000007: 00000000-00000005-00000400-000037D9
CPUID 80000008: 00003030-00000000-00004003-00000000
CPUID 80000009: 00000000-00000000-00000000-00000000
CPUID 8000000A: 00000001-00008000-00000000-0001BCFF
CPUID 8000000B: 00000000-00000000-00000000-00000000
CPUID 8000000C: 00000000-00000000-00000000-00000000
CPUID 8000000D: 00000000-00000000-00000000-00000000
CPUID 8000000E: 00000000-00000000-00000000-00000000
CPUID 8000000F: 00000000-00000000-00000000-00000000
CPUID 80000010: 00000000-00000000-00000000-00000000
CPUID 80000011: 00000000-00000000-00000000-00000000
CPUID 80000012: 00000000-00000000-00000000-00000000
CPUID 80000013: 00000000-00000000-00000000-00000000
CPUID 80000014: 00000000-00000000-00000000-00000000
CPUID 80000015: 00000000-00000000-00000000-00000000
CPUID 80000016: 00000000-00000000-00000000-00000000
CPUID 80000017: 00000000-00000000-00000000-00000000
CPUID 80000018: 00000000-00000000-00000000-00000000
CPUID 80000019: F040F018-64006400-00000000-00000000
CPUID 8000001A: 00000003-00000000-00000000-00000000
CPUID 8000001B: 000007FF-00000000-00000000-00000000
CPUID 8000001C: 00000000-80032013-00010200-E000000F
CPUID 8000001D: 00000121-01C0003F-0000003F-00000000 [SL 00]
CPUID 8000001D: 00004122-0080003F-000001FF-00000000 [SL 01]
CPUID 8000001D: 00004143-03C0003F-000003FF-00000001 [SL 02]
CPUID 8000001E: 00000012-00000101-00000000-00000000
CPUID 8FFFFFFF: 00000000-00000000-00000000-00000000
------[ Logical CPU #3 ]------
CPUID 00000000: 0000000D-68747541-444D4163-69746E65 [AuthenticAMD]
CPUID 00000001: 00660F01-03040800-7ED8320B-178BFBFF
CPUID 00000002: 00000000-00000000-00000000-00000000
CPUID 00000003: 00000000-00000000-00000000-00000000
CPUID 00000005: 00000040-00000040-00000003-00000000
CPUID 00000006: 00000004-00000000-00000001-00000000
CPUID 00000007: 00000000-000001A9-00000000-00000000
CPUID 00000008: 00000000-00000000-00000000-00000000
CPUID 00000009: 00000000-00000000-00000000-00000000
CPUID 0000000A: 00000000-00000000-00000000-00000000
CPUID 0000000C: 00000000-00000000-00000000-00000000
CPUID 0000000D: 00000007-00000340-000003C0-40000000 [SL 00]
CPUID 0000000D: 00000001-00000000-00000000-00000000 [SL 01]
CPUID 0000000D: 00000100-00000240-00000000-00000000 [SL 02]
CPUID 0000000D: 00000080-00000340-00000000-00000000 [SL 3E]
CPUID 80000000: 8000001E-68747541-444D4163-69746E65 [AuthenticAMD]
CPUID 80000001: 00660F01-00000000-2FEBBFFF-2FD3FBFF
CPUID 80000002: 20444D41-382D5846-50303038-64615220 [AMD FX-8800P Rad]
CPUID 80000003: 206E6F65-202C3752-43203231-75706D6F [eon R7, 12 Compu]
CPUID 80000004: 43206574-7365726F-2B433420-00204738 [te Cores 4C+8G ]
CPUID 80000005: FF40FF18-FF40FF30-20080140-60030140
CPUID 80000006: 64006400-64004200-04008140-00000000
CPUID 80000007: 00000000-00000005-00000400-000037D9
CPUID 80000008: 00003030-00000000-00004003-00000000
CPUID 80000009: 00000000-00000000-00000000-00000000
CPUID 8000000A: 00000001-00008000-00000000-0001BCFF
CPUID 8000000B: 00000000-00000000-00000000-00000000
CPUID 8000000C: 00000000-00000000-00000000-00000000
CPUID 8000000D: 00000000-00000000-00000000-00000000
CPUID 8000000E: 00000000-00000000-00000000-00000000
CPUID 8000000F: 00000000-00000000-00000000-00000000
CPUID 80000010: 00000000-00000000-00000000-00000000
CPUID 80000011: 00000000-00000000-00000000-00000000
CPUID 80000012: 00000000-00000000-00000000-00000000
CPUID 80000013: 00000000-00000000-00000000-00000000
CPUID 80000014: 00000000-00000000-00000000-00000000
CPUID 80000015: 00000000-00000000-00000000-00000000
CPUID 80000016: 00000000-00000000-00000000-00000000
CPUID 80000017: 00000000-00000000-00000000-00000000
CPUID 80000018: 00000000-00000000-00000000-00000000
CPUID 80000019: F040F018-64006400-00000000-00000000
CPUID 8000001A: 00000003-00000000-00000000-00000000
CPUID 8000001B: 000007FF-00000000-00000000-00000000
CPUID 8000001C: 00000000-80032013-00010200-E000000F
CPUID 8000001D: 00000121-01C0003F-0000003F-00000000 [SL 00]
CPUID 8000001D: 00004122-0080003F-000001FF-00000000 [SL 01]
CPUID 8000001D: 00004143-03C0003F-000003FF-00000001 [SL 02]
CPUID 8000001E: 00000013-00000101-00000000-00000000
CPUID 8FFFFFFF: 00000000-00000000-00000000-00000000
--------------------------------------------------------------------------------
x86
x86-64-v3
general
15
0
1
21
96
4
4
32
96
1024
-1
-1
8
3
16
-1
-1
64
64
64
-1
-1
-1
-1
-1
-1
-1
128 (authoritative)
FX (Carrizo)
GF 28SHP
fpu vme de pse tsc msr pae mce cx8 apic mtrr sep pge mca cmov pat pse36 clflush mmx fxsr sse sse2 ht pni pclmul monitor ssse3 cx16 sse4_1 sse4_2 syscall movbe popcnt aes xsave osxsave avx mmxext nx fxsr_opt rdtscp lm lahf_lm cmp_legacy svm abm misalignsse sse4a 3dnowprefetch osvw ibs skinit wdt ts ttp tm_amd 100mhzsteps hwpstate constant_tsc xop fma3 fma4 tbm f16c rdrand cpb aperfmperf pa avx2 bmi1 bmi2
