------[ Logical CPU #0 ]------
CPUID 00000000: 00000001-68747541-444D4163-69746E65
CPUID 00000001: 00000680-00000000-00000000-0383FBFF
CPUID 80000000: 80000008-68747541-444D4163-69746E65
CPUID 80000001: 00000780-00000000-00000000-C1C3FBFF
CPUID 80000002: 20444D41-6C687441-74286E6F-5820296D
CPUID 80000003: 32322050-002B3030-00000000-00000000
CPUID 80000004: 00000000-00000000-00000000-00000000
CPUID 80000005: 0408FF08-FF20FF10-40020140-40020140
CPUID 80000006: 00000000-41004100-01008140-00000000
CPUID 80000007: 00000000-00000000-00000000-00000001
CPUID 80000008: 00002022-00000000-00000000-00000000
--------------------------------------------------------------------------------
x86
i686
general
6
8
0
6
8
1
1
64
64
256
-1
-1
2
2
16
-1
-1
64
64
64
-1
-1
-1
-1
-1
-1
-1
64 (non-authoritative)
Athlon XP (Thoroughbred)
130 nm
fpu vme de pse tsc msr pae mce cx8 apic mtrr sep pge mca cmov pat pse36 mmx fxsr sse syscall mmxext 3dnow 3dnowext ts
