------[ Logical CPU #0 ]------
CPUID 00000000: 0000000A-756E6547-6C65746E-49656E69 [GenuineIntel]
CPUID 00000001: 00020661-00020800-0040E3BD-BFE9FBFF
CPUID 00000002: 4FBA5901-0E3080C0-00000000-00000000
CPUID 00000003: 00000000-00000000-00000000-00000000
CPUID 00000004: 00004121-0140003F-0000003F-00000001 [SL 00] [L1D: 24 KB]
CPUID 00000004: 00004122-01C0003F-0000003F-00000001 [SL 01] [L1I: 32 KB]
CPUID 00000004: 00004143-01C0003F-000003FF-00000001 [SL 02] [L2U: 512 KB]
CPUID 00000005: 00000040-00000040-00000003-03020220
CPUID 00000006: 00000001-00000002-00000001-00000000
CPUID 00000007: 00000000-00000000-00000000-00000000
CPUID 00000008: 00000000-00000000-00000000-00000000
CPUID 00000009: 00000000-00000000-00000000-00000000
CPUID 0000000A: 07280203-00000000-00000000-00000503
CPUID 80000000: 80000008-00000000-00000000-00000000
CPUID 80000001: 00000000-00000000-00000001-20100000
CPUID 80000002: 20202020-20202020-746E4920-52286C65 [         Intel(R]
CPUID 80000003: 74412029-54286D6F-4320294D-45205550 [) Atom(TM) CPU E]
CPUID 80000004: 20303836-20402020-30362E31-007A4847 [680   @ 1.60GHz]
CPUID 80000005: 00000000-00000000-00000000-00000000 [L1D: 0 KB / L1I: 0 KB]
CPUID 80000006: 00000000-00000000-02006040-00000000 [L2: 512 KB] / L3: 0 KB]
CPUID 80000007: 00000000-00000000-00000000-00000000
CPUID 80000008: 00003020-00000000-00000000-00000000
------[ Logical CPU #1 ]------
CPUID 00000000: 0000000A-756E6547-6C65746E-49656E69 [GenuineIntel]
CPUID 00000001: 00020661-01020800-0040E3BD-BFE9FBFF
CPUID 00000002: 4FBA5901-0E3080C0-00000000-00000000
CPUID 00000003: 00000000-00000000-00000000-00000000
CPUID 00000004: 00004121-0140003F-0000003F-00000001 [SL 00] [L1D: 24 KB]
CPUID 00000004: 00004122-01C0003F-0000003F-00000001 [SL 01] [L1I: 32 KB]
CPUID 00000004: 00004143-01C0003F-000003FF-00000001 [SL 02] [L2U: 512 KB]
CPUID 00000005: 00000040-00000040-00000003-03020220
CPUID 00000006: 00000001-00000002-00000001-00000000
CPUID 00000007: 00000000-00000000-00000000-00000000
CPUID 00000008: 00000000-00000000-00000000-00000000
CPUID 00000009: 00000000-00000000-00000000-00000000
CPUID 0000000A: 07280203-00000000-00000000-00000503
CPUID 80000000: 80000008-00000000-00000000-00000000
CPUID 80000001: 00000000-00000000-00000001-20100000
CPUID 80000002: 20202020-20202020-746E4920-52286C65 [         Intel(R]
CPUID 80000003: 74412029-54286D6F-4320294D-45205550 [) Atom(TM) CPU E]
CPUID 80000004: 20303836-20402020-30362E31-007A4847 [680   @ 1.60GHz]
CPUID 80000005: 00000000-00000000-00000000-00000000 [L1D: 0 KB / L1I: 0 KB]
CPUID 80000006: 00000000-00000000-02006040-00000000 [L2: 512 KB] / L3: 0 KB]
CPUID 80000007: 00000000-00000000-00000000-00000000
CPUID 80000008: 00003020-00000000-00000000-00000000
--------------------------------------------------------------------------------
x86
x86-64-v2
general
6
6
1
6
38
1
2
24
32
512
-1
-1
6
8
8
-1
-1
64
64
64
-1
-1
-1
-1
-1
-1
-1
128 (non-authoritative)
Atom (Tunnel Creek)
45 nm
fpu vme de pse tsc msr pae mce cx8 apic mtrr sep pge mca cmov pat clflush dts acpi mmx fxsr sse sse2 ss ht tm pbe pni dts64 monitor ds_cpl vmx est tm2 ssse3 cx16 xtpr pdcm xd movbe lm lahf_lm
