CPU#000 AffMask: 0x0000000000000001
CPUID 00000000: 0000000D-68747541-444D4163-69746E65 [AuthenticAMD]
CPUID 00000001: 00700F01-00040800-BED82203-178BFBFF
CPUID 00000002: 00000000-00000000-00000000-00000000
CPUID 00000003: 00000000-00000000-00000000-00000000
CPUID 00000004: 00000000-00000000-00000000-00000000 [SL 00]
CPUID 00000005: 00000000-00000000-00000000-00000000
CPUID 00000006: 00000000-00000000-00000001-00000000
CPUID 00000007: 00000000-00000008-00000000-00000000 [SL 00]
CPUID 00000008: 00000000-00000000-00000000-00000000
CPUID 00000009: 00000000-00000000-00000000-00000000
CPUID 0000000A: 00000000-00000000-00000000-00000000
CPUID 0000000B: 00000000-00000000-00000000-00000000 [SL 00]
CPUID 0000000C: 00000000-00000000-00000000-00000000
CPUID 0000000D: 00000007-00000340-00000340-00000000 [SL 00]
CPUID 0000000D: 00000001-00000000-00000000-00000000 [SL 01]
CPUID 0000000D: 00000000-00000000-00000000-00000000 [SL 02]
CPUID 40000000: 4000000B-7263694D-666F736F-76482074
CPUID 40000001: 31237648-00000000-00000000-00000000
CPUID 40000002: 000047BA-000A0000-00000001-00000473
CPUID 40000003: 00003FFF-002BB9FF-00000002-10FFFBF2
CPUID 40000004: 00042D1C-00000000-00000000-00000000
CPUID 40000005: 00000140-00000200-00000324-00000000
CPUID 40000006: 0002020E-00000000-00000000-00000000
CPUID 40000007: 80000007-00000003-00000000-00000000
CPUID 40000008: 00000000-00000000-00000000-00000000
CPUID 40000009: 00000000-00000000-00000000-00000000
CPUID 4000000A: 00000000-00000000-00000000-00000000
CPUID 4000000B: 00000000-00000000-00000000-00000000
CPUID 80000000: 8000001E-68747541-444D4163-69746E65
CPUID 80000001: 00700F01-10000000-004023F3-2FD3FBFF
CPUID 80000002: 20444D41-6C687441-35206E6F-20303733 [AMD Athlon 5370 ]
CPUID 80000003: 20555041-68746977-64615220-206E6F65 [APU with Radeon ]
CPUID 80000004: 20203352-20202020-20202020-00202020 [R3             ]
CPUID 80000005: FF08FF08-FF28FF20-20080140-20020140
CPUID 80000006: 21000000-42004200-08008140-00000000
CPUID 80000007: 00000000-00000000-00000000-000001C9
CPUID 80000008: 00003028-02000000-00003003-00000000
CPUID 80000009: 00000000-00000000-00000000-00000000
CPUID 8000000A: 00000000-00000000-00000000-00000000
CPUID 8000000B: 00000000-00000000-00000000-00000000
CPUID 8000000C: 00000000-00000000-00000000-00000000
CPUID 8000000D: 00000000-00000000-00000000-00000000
CPUID 8000000E: 00000000-00000000-00000000-00000000
CPUID 8000000F: 00000000-00000000-00000000-00000000
CPUID 80000010: 00000000-00000000-00000000-00000000
CPUID 80000011: 00000000-00000000-00000000-00000000
CPUID 80000012: 00000000-00000000-00000000-00000000
CPUID 80000013: 00000000-00000000-00000000-00000000
CPUID 80000014: 00000000-00000000-00000000-00000000
CPUID 80000015: 00000000-00000000-00000000-00000000
CPUID 80000016: 00000000-00000000-00000000-00000000
CPUID 80000017: 00000000-00000000-00000000-00000000
CPUID 80000018: 00000000-00000000-00000000-00000000
CPUID 80000019: 00000000-00000000-00000000-00000000
CPUID 8000001A: 00000003-00000000-00000000-00000000
CPUID 8000001B: 00000000-00000000-00000000-00000000
CPUID 8000001C: 00000000-00000000-00000000-00000000
CPUID 8000001D: 00000121-01C0003F-0000003F-00000000 [SL 00]
CPUID 8000001D: 00000122-0040003F-000000FF-00000000 [SL 01]
CPUID 8000001D: 0000C143-03C0003F-000007FF-00000002 [SL 02]
CPUID 8000001E: 00000000-00000000-00000000-00000000
CPU#001 AffMask: 0x0000000000000002
CPUID 00000000: 0000000D-68747541-444D4163-69746E65 [AuthenticAMD]
CPUID 00000001: 00700F01-01040800-BED82203-178BFBFF
CPUID 00000002: 00000000-00000000-00000000-00000000
CPUID 00000003: 00000000-00000000-00000000-00000000
CPUID 00000004: 00000000-00000000-00000000-00000000 [SL 00]
CPUID 00000005: 00000000-00000000-00000000-00000000
CPUID 00000006: 00000000-00000000-00000001-00000000
CPUID 00000007: 00000000-00000008-00000000-00000000 [SL 00]
CPUID 00000008: 00000000-00000000-00000000-00000000
CPUID 00000009: 00000000-00000000-00000000-00000000
CPUID 0000000A: 00000000-00000000-00000000-00000000
CPUID 0000000B: 00000000-00000000-00000000-00000000 [SL 00]
CPUID 0000000C: 00000000-00000000-00000000-00000000
CPUID 0000000D: 00000007-00000340-00000340-00000000 [SL 00]
CPUID 0000000D: 00000001-00000000-00000000-00000000 [SL 01]
CPUID 0000000D: 00000000-00000000-00000000-00000000 [SL 02]
CPUID 40000000: 4000000B-7263694D-666F736F-76482074
CPUID 40000001: 31237648-00000000-00000000-00000000
CPUID 40000002: 000047BA-000A0000-00000001-00000473
CPUID 40000003: 00003FFF-002BB9FF-00000002-10FFFBF2
CPUID 40000004: 00042D1C-00000000-00000000-00000000
CPUID 40000005: 00000140-00000200-00000324-00000000
CPUID 40000006: 0002020E-00000000-00000000-00000000
CPUID 40000007: 80000007-00000003-00000000-00000000
CPUID 40000008: 00000000-00000000-00000000-00000000
CPUID 40000009: 00000000-00000000-00000000-00000000
CPUID 4000000A: 00000000-00000000-00000000-00000000
CPUID 4000000B: 00000000-00000000-00000000-00000000
CPUID 80000000: 8000001E-68747541-444D4163-69746E65
CPUID 80000001: 00700F01-10000000-004023F3-2FD3FBFF
CPUID 80000002: 20444D41-6C687441-35206E6F-20303733 [AMD Athlon 5370 ]
CPUID 80000003: 20555041-68746977-64615220-206E6F65 [APU with Radeon ]
CPUID 80000004: 20203352-20202020-20202020-00202020 [R3             ]
CPUID 80000005: FF08FF08-FF28FF20-20080140-20020140
CPUID 80000006: 21000000-42004200-08008140-00000000
CPUID 80000007: 00000000-00000000-00000000-000001C9
CPUID 80000008: 00003028-02000000-00003003-00000000
CPUID 80000009: 00000000-00000000-00000000-00000000
CPUID 8000000A: 00000000-00000000-00000000-00000000
CPUID 8000000B: 00000000-00000000-00000000-00000000
CPUID 8000000C: 00000000-00000000-00000000-00000000
CPUID 8000000D: 00000000-00000000-00000000-00000000
CPUID 8000000E: 00000000-00000000-00000000-00000000
CPUID 8000000F: 00000000-00000000-00000000-00000000
CPUID 80000010: 00000000-00000000-00000000-00000000
CPUID 80000011: 00000000-00000000-00000000-00000000
CPUID 80000012: 00000000-00000000-00000000-00000000
CPUID 80000013: 00000000-00000000-00000000-00000000
CPUID 80000014: 00000000-00000000-00000000-00000000
CPUID 80000015: 00000000-00000000-00000000-00000000
CPUID 80000016: 00000000-00000000-00000000-00000000
CPUID 80000017: 00000000-00000000-00000000-00000000
CPUID 80000018: 00000000-00000000-00000000-00000000
CPUID 80000019: 00000000-00000000-00000000-00000000
CPUID 8000001A: 00000003-00000000-00000000-00000000
CPUID 8000001B: 00000000-00000000-00000000-00000000
CPUID 8000001C: 00000000-00000000-00000000-00000000
CPUID 8000001D: 00000121-01C0003F-0000003F-00000000 [SL 00]
CPUID 8000001D: 00000122-0040003F-000000FF-00000000 [SL 01]
CPUID 8000001D: 0000C143-03C0003F-000007FF-00000002 [SL 02]
CPUID 8000001E: 00000001-00000001-00000000-00000000
CPU#002 AffMask: 0x0000000000000004
CPUID 00000000: 0000000D-68747541-444D4163-69746E65 [AuthenticAMD]
CPUID 00000001: 00700F01-02040800-BED82203-178BFBFF
CPUID 00000002: 00000000-00000000-00000000-00000000
CPUID 00000003: 00000000-00000000-00000000-00000000
CPUID 00000004: 00000000-00000000-00000000-00000000 [SL 00]
CPUID 00000005: 00000000-00000000-00000000-00000000
CPUID 00000006: 00000000-00000000-00000001-00000000
CPUID 00000007: 00000000-00000008-00000000-00000000 [SL 00]
CPUID 00000008: 00000000-00000000-00000000-00000000
CPUID 00000009: 00000000-00000000-00000000-00000000
CPUID 0000000A: 00000000-00000000-00000000-00000000
CPUID 0000000B: 00000000-00000000-00000000-00000000 [SL 00]
CPUID 0000000C: 00000000-00000000-00000000-00000000
CPUID 0000000D: 00000007-00000340-00000340-00000000 [SL 00]
CPUID 0000000D: 00000001-00000000-00000000-00000000 [SL 01]
CPUID 0000000D: 00000000-00000000-00000000-00000000 [SL 02]
CPUID 40000000: 4000000B-7263694D-666F736F-76482074
CPUID 40000001: 31237648-00000000-00000000-00000000
CPUID 40000002: 000047BA-000A0000-00000001-00000473
CPUID 40000003: 00003FFF-002BB9FF-00000002-10FFFBF2
CPUID 40000004: 00042D1C-00000000-00000000-00000000
CPUID 40000005: 00000140-00000200-00000324-00000000
CPUID 40000006: 0002020E-00000000-00000000-00000000
CPUID 40000007: 80000007-00000003-00000000-00000000
CPUID 40000008: 00000000-00000000-00000000-00000000
CPUID 40000009: 00000000-00000000-00000000-00000000
CPUID 4000000A: 00000000-00000000-00000000-00000000
CPUID 4000000B: 00000000-00000000-00000000-00000000
CPUID 80000000: 8000001E-68747541-444D4163-69746E65
CPUID 80000001: 00700F01-10000000-004023F3-2FD3FBFF
CPUID 80000002: 20444D41-6C687441-35206E6F-20303733 [AMD Athlon 5370 ]
CPUID 80000003: 20555041-68746977-64615220-206E6F65 [APU with Radeon ]
CPUID 80000004: 20203352-20202020-20202020-00202020 [R3             ]
CPUID 80000005: FF08FF08-FF28FF20-20080140-20020140
CPUID 80000006: 21000000-42004200-08008140-00000000
CPUID 80000007: 00000000-00000000-00000000-000001C9
CPUID 80000008: 00003028-02000000-00003003-00000000
CPUID 80000009: 00000000-00000000-00000000-00000000
CPUID 8000000A: 00000000-00000000-00000000-00000000
CPUID 8000000B: 00000000-00000000-00000000-00000000
CPUID 8000000C: 00000000-00000000-00000000-00000000
CPUID 8000000D: 00000000-00000000-00000000-00000000
CPUID 8000000E: 00000000-00000000-00000000-00000000
CPUID 8000000F: 00000000-00000000-00000000-00000000
CPUID 80000010: 00000000-00000000-00000000-00000000
CPUID 80000011: 00000000-00000000-00000000-00000000
CPUID 80000012: 00000000-00000000-00000000-00000000
CPUID 80000013: 00000000-00000000-00000000-00000000
CPUID 80000014: 00000000-00000000-00000000-00000000
CPUID 80000015: 00000000-00000000-00000000-00000000
CPUID 80000016: 00000000-00000000-00000000-00000000
CPUID 80000017: 00000000-00000000-00000000-00000000
CPUID 80000018: 00000000-00000000-00000000-00000000
CPUID 80000019: 00000000-00000000-00000000-00000000
CPUID 8000001A: 00000003-00000000-00000000-00000000
CPUID 8000001B: 00000000-00000000-00000000-00000000
CPUID 8000001C: 00000000-00000000-00000000-00000000
CPUID 8000001D: 00000121-01C0003F-0000003F-00000000 [SL 00]
CPUID 8000001D: 00000122-0040003F-000000FF-00000000 [SL 01]
CPUID 8000001D: 0000C143-03C0003F-000007FF-00000002 [SL 02]
CPUID 8000001E: 00000002-00000002-00000000-00000000
CPU#003 AffMask: 0x0000000000000008
CPUID 00000000: 0000000D-68747541-444D4163-69746E65 [AuthenticAMD]
CPUID 00000001: 00700F01-03040800-BED82203-178BFBFF
CPUID 00000002: 00000000-00000000-00000000-00000000
CPUID 00000003: 00000000-00000000-00000000-00000000
CPUID 00000004: 00000000-00000000-00000000-00000000 [SL 00]
CPUID 00000005: 00000000-00000000-00000000-00000000
CPUID 00000006: 00000000-00000000-00000001-00000000
CPUID 00000007: 00000000-00000008-00000000-00000000 [SL 00]
CPUID 00000008: 00000000-00000000-00000000-00000000
CPUID 00000009: 00000000-00000000-00000000-00000000
CPUID 0000000A: 00000000-00000000-00000000-00000000
CPUID 0000000B: 00000000-00000000-00000000-00000000 [SL 00]
CPUID 0000000C: 00000000-00000000-00000000-00000000
CPUID 0000000D: 00000007-00000340-00000340-00000000 [SL 00]
CPUID 0000000D: 00000001-00000000-00000000-00000000 [SL 01]
CPUID 0000000D: 00000000-00000000-00000000-00000000 [SL 02]
CPUID 40000000: 4000000B-7263694D-666F736F-76482074
CPUID 40000001: 31237648-00000000-00000000-00000000
CPUID 40000002: 000047BA-000A0000-00000001-00000473
CPUID 40000003: 00003FFF-002BB9FF-00000002-10FFFBF2
CPUID 40000004: 00042D1C-00000000-00000000-00000000
CPUID 40000005: 00000140-00000200-00000324-00000000
CPUID 40000006: 0002020E-00000000-00000000-00000000
CPUID 40000007: 80000007-00000003-00000000-00000000
CPUID 40000008: 00000000-00000000-00000000-00000000
CPUID 40000009: 00000000-00000000-00000000-00000000
CPUID 4000000A: 00000000-00000000-00000000-00000000
CPUID 4000000B: 00000000-00000000-00000000-00000000
CPUID 80000000: 8000001E-68747541-444D4163-69746E65
CPUID 80000001: 00700F01-10000000-004023F3-2FD3FBFF
CPUID 80000002: 20444D41-6C687441-35206E6F-20303733 [AMD Athlon 5370 ]
CPUID 80000003: 20555041-68746977-64615220-206E6F65 [APU with Radeon ]
CPUID 80000004: 20203352-20202020-20202020-00202020 [R3             ]
CPUID 80000005: FF08FF08-FF28FF20-20080140-20020140
CPUID 80000006: 21000000-42004200-08008140-00000000
CPUID 80000007: 00000000-00000000-00000000-000001C9
CPUID 80000008: 00003028-02000000-00003003-00000000
CPUID 80000009: 00000000-00000000-00000000-00000000
CPUID 8000000A: 00000000-00000000-00000000-00000000
CPUID 8000000B: 00000000-00000000-00000000-00000000
CPUID 8000000C: 00000000-00000000-00000000-00000000
CPUID 8000000D: 00000000-00000000-00000000-00000000
CPUID 8000000E: 00000000-00000000-00000000-00000000
CPUID 8000000F: 00000000-00000000-00000000-00000000
CPUID 80000010: 00000000-00000000-00000000-00000000
CPUID 80000011: 00000000-00000000-00000000-00000000
CPUID 80000012: 00000000-00000000-00000000-00000000
CPUID 80000013: 00000000-00000000-00000000-00000000
CPUID 80000014: 00000000-00000000-00000000-00000000
CPUID 80000015: 00000000-00000000-00000000-00000000
CPUID 80000016: 00000000-00000000-00000000-00000000
CPUID 80000017: 00000000-00000000-00000000-00000000
CPUID 80000018: 00000000-00000000-00000000-00000000
CPUID 80000019: 00000000-00000000-00000000-00000000
CPUID 8000001A: 00000003-00000000-00000000-00000000
CPUID 8000001B: 00000000-00000000-00000000-00000000
CPUID 8000001C: 00000000-00000000-00000000-00000000
CPUID 8000001D: 00000121-01C0003F-0000003F-00000000 [SL 00]
CPUID 8000001D: 00000122-0040003F-000000FF-00000000 [SL 01]
CPUID 8000001D: 0000C143-03C0003F-000007FF-00000002 [SL 02]
CPUID 8000001E: 00000003-00000003-00000000-00000000
--------------------------------------------------------------------------------
x86
x86-64-v3
general
15
0
1
22
0
4
4
32
32
2048
-1
-1
8
2
16
-1
-1
64
64
64
-1
-1
-1
-1
-1
-1
-1
128 (authoritative)
Athlon X4 (Kabini)
TSMC N28
fpu vme de pse tsc msr pae mce cx8 apic mtrr sep pge mca cmov pat pse36 clflush mmx fxsr sse sse2 ht pni pclmul ssse3 cx16 sse4_1 sse4_2 syscall movbe popcnt aes xsave osxsave avx mmxext nx fxsr_opt rdtscp lm lahf_lm cmp_legacy abm misalignsse sse4a 3dnowprefetch osvw wdt ts ttp 100mhzsteps hwpstate constant_tsc f16c bmi1 hypervisor
