------[ Logical CPU #0 ]------
CPUID 00000000: 0000000D-68747541-444D4163-69746E65 [AuthenticAMD]
CPUID 00000001: 00700F01-00040800-3ED8220B-178BFBFF
CPUID 00000002: 00000000-00000000-00000000-00000000
CPUID 00000003: 00000000-00000000-00000000-00000000
CPUID 00000005: 00000040-00000040-00000003-00000000
CPUID 00000006: 00000000-00000000-00000001-00000000
CPUID 00000007: 00000000-00000008-00000000-00000000
CPUID 00000008: 00000000-00000000-00000000-00000000
CPUID 00000009: 00000000-00000000-00000000-00000000
CPUID 0000000A: 00000000-00000000-00000000-00000000
CPUID 0000000C: 00000000-00000000-00000000-00000000
CPUID 0000000D: 00000007-00000340-00000340-00000000
CPUID 0000000D: 00000100-00000240-00000000-00000000
CPUID 80000000: 8000001E-68747541-444D4163-69746E65
CPUID 80000001: 00700F01-00000000-154037FF-2FD3FBFF
CPUID 80000002: 20444D41-352D3441-20303030-20555041 [AMD A4-5000 APU ]
CPUID 80000003: 68746977-64615220-286E6F65-20294D54 [with Radeon(TM) ]
CPUID 80000004: 47204448-68706172-20736369-00202020 [HD Graphics    ]
CPUID 80000005: FF08FF08-FF28FF20-20080140-20020140
CPUID 80000006: 21000000-42004200-08008140-00000000
CPUID 80000007: 0D6B0101-00000001-00000000-000009D9
CPUID 80000008: 00003028-00000000-00003003-00000000
CPUID 80000009: 00000000-00000000-00000000-00000000
CPUID 8000000A: 00000001-00000008-00000000-00001CDF
CPUID 8000000B: 00000000-00000000-00000000-00000000
CPUID 8000000C: 00000000-00000000-00000000-00000000
CPUID 8000000D: 00000000-00000000-00000000-00000000
CPUID 8000000E: 00000000-00000000-00000000-00000000
CPUID 8000000F: 00000000-00000000-00000000-00000000
CPUID 80000010: 00000000-00000000-00000000-00000000
CPUID 80000011: 00000000-00000000-00000000-00000000
CPUID 80000012: 00000000-00000000-00000000-00000000
CPUID 80000013: 00000000-00000000-00000000-00000000
CPUID 80000014: 00000000-00000000-00000000-00000000
CPUID 80000015: 00000000-00000000-00000000-00000000
CPUID 80000016: 00000000-00000000-00000000-00000000
CPUID 80000017: 00000000-00000000-00000000-00000000
CPUID 80000018: 00000000-00000000-00000000-00000000
CPUID 80000019: 00000000-00000000-00000000-00000000
CPUID 8000001A: 00000003-00000000-00000000-00000000
CPUID 8000001B: 000000FF-00000000-00000000-00000000
CPUID 8000001C: 00000000-00000000-00000000-00000000
CPUID 8000001D: 00000121-01C0003F-0000003F-00000000
CPUID 8000001D: 00000122-0040003F-000000FF-00000000
CPUID 8000001D: 0000C143-03C0003F-000007FF-00000002
CPUID 8000001E: 00000000-00000000-00000000-00000000
CPUID 8FFFFFFF: 4C4C4548-494B204F-21595454-5E2D5E20 [HELLO KITTY! ^-^]
------[ Logical CPU #1 ]------
CPUID 00000000: 0000000D-68747541-444D4163-69746E65 [AuthenticAMD]
CPUID 00000001: 00700F01-01040800-3ED8220B-178BFBFF
CPUID 00000002: 00000000-00000000-00000000-00000000
CPUID 00000003: 00000000-00000000-00000000-00000000
CPUID 00000005: 00000040-00000040-00000003-00000000
CPUID 00000006: 00000000-00000000-00000001-00000000
CPUID 00000007: 00000000-00000008-00000000-00000000
CPUID 00000008: 00000000-00000000-00000000-00000000
CPUID 00000009: 00000000-00000000-00000000-00000000
CPUID 0000000A: 00000000-00000000-00000000-00000000
CPUID 0000000C: 00000000-00000000-00000000-00000000
CPUID 0000000D: 00000007-00000340-00000340-00000000
CPUID 0000000D: 00000100-00000240-00000000-00000000
CPUID 80000000: 8000001E-68747541-444D4163-69746E65
CPUID 80000001: 00700F01-00000000-154037FF-2FD3FBFF
CPUID 80000002: 20444D41-352D3441-20303030-20555041 [AMD A4-5000 APU ]
CPUID 80000003: 68746977-64615220-286E6F65-20294D54 [with Radeon(TM) ]
CPUID 80000004: 47204448-68706172-20736369-00202020 [HD Graphics    ]
CPUID 80000005: FF08FF08-FF28FF20-20080140-20020140
CPUID 80000006: 21000000-42004200-08008140-00000000
CPUID 80000007: 0D6B0101-00000001-00000000-000009D9
CPUID 80000008: 00003028-00000000-00003003-00000000
CPUID 80000009: 00000000-00000000-00000000-00000000
CPUID 8000000A: 00000001-00000008-00000000-00001CDF
CPUID 8000000B: 00000000-00000000-00000000-00000000
CPUID 8000000C: 00000000-00000000-00000000-00000000
CPUID 8000000D: 00000000-00000000-00000000-00000000
CPUID 8000000E: 00000000-00000000-00000000-00000000
CPUID 8000000F: 00000000-00000000-00000000-00000000
CPUID 80000010: 00000000-00000000-00000000-00000000
CPUID 80000011: 00000000-00000000-00000000-00000000
CPUID 80000012: 00000000-00000000-00000000-00000000
CPUID 80000013: 00000000-00000000-00000000-00000000
CPUID 80000014: 00000000-00000000-00000000-00000000
CPUID 80000015: 00000000-00000000-00000000-00000000
CPUID 80000016: 00000000-00000000-00000000-00000000
CPUID 80000017: 00000000-00000000-00000000-00000000
CPUID 80000018: 00000000-00000000-00000000-00000000
CPUID 80000019: 00000000-00000000-00000000-00000000
CPUID 8000001A: 00000003-00000000-00000000-00000000
CPUID 8000001B: 000000FF-00000000-00000000-00000000
CPUID 8000001C: 00000000-00000000-00000000-00000000
CPUID 8000001D: 00000121-01C0003F-0000003F-00000000
CPUID 8000001D: 00000122-0040003F-000000FF-00000000
CPUID 8000001D: 0000C143-03C0003F-000007FF-00000002
CPUID 8000001E: 00000001-00000001-00000000-00000000
CPUID 8FFFFFFF: 4C4C4548-494B204F-21595454-5E2D5E20 [HELLO KITTY! ^-^]
------[ Logical CPU #2 ]------
CPUID 00000000: 0000000D-68747541-444D4163-69746E65 [AuthenticAMD]
CPUID 00000001: 00700F01-02040800-3ED8220B-178BFBFF
CPUID 00000002: 00000000-00000000-00000000-00000000
CPUID 00000003: 00000000-00000000-00000000-00000000
CPUID 00000005: 00000040-00000040-00000003-00000000
CPUID 00000006: 00000000-00000000-00000001-00000000
CPUID 00000007: 00000000-00000008-00000000-00000000
CPUID 00000008: 00000000-00000000-00000000-00000000
CPUID 00000009: 00000000-00000000-00000000-00000000
CPUID 0000000A: 00000000-00000000-00000000-00000000
CPUID 0000000C: 00000000-00000000-00000000-00000000
CPUID 0000000D: 00000007-00000340-00000340-00000000
CPUID 0000000D: 00000100-00000240-00000000-00000000
CPUID 80000000: 8000001E-68747541-444D4163-69746E65
CPUID 80000001: 00700F01-00000000-154037FF-2FD3FBFF
CPUID 80000002: 20444D41-352D3441-20303030-20555041 [AMD A4-5000 APU ]
CPUID 80000003: 68746977-64615220-286E6F65-20294D54 [with Radeon(TM) ]
CPUID 80000004: 47204448-68706172-20736369-00202020 [HD Graphics    ]
CPUID 80000005: FF08FF08-FF28FF20-20080140-20020140
CPUID 80000006: 21000000-42004200-08008140-00000000
CPUID 80000007: 0D6B0101-00000001-00000000-000009D9
CPUID 80000008: 00003028-00000000-00003003-00000000
CPUID 80000009: 00000000-00000000-00000000-00000000
CPUID 8000000A: 00000001-00000008-00000000-00001CDF
CPUID 8000000B: 00000000-00000000-00000000-00000000
CPUID 8000000C: 00000000-00000000-00000000-00000000
CPUID 8000000D: 00000000-00000000-00000000-00000000
CPUID 8000000E: 00000000-00000000-00000000-00000000
CPUID 8000000F: 00000000-00000000-00000000-00000000
CPUID 80000010: 00000000-00000000-00000000-00000000
CPUID 80000011: 00000000-00000000-00000000-00000000
CPUID 80000012: 00000000-00000000-00000000-00000000
CPUID 80000013: 00000000-00000000-00000000-00000000
CPUID 80000014: 00000000-00000000-00000000-00000000
CPUID 80000015: 00000000-00000000-00000000-00000000
CPUID 80000016: 00000000-00000000-00000000-00000000
CPUID 80000017: 00000000-00000000-00000000-00000000
CPUID 80000018: 00000000-00000000-00000000-00000000
CPUID 80000019: 00000000-00000000-00000000-00000000
CPUID 8000001A: 00000003-00000000-00000000-00000000
CPUID 8000001B: 000000FF-00000000-00000000-00000000
CPUID 8000001C: 00000000-00000000-00000000-00000000
CPUID 8000001D: 00000121-01C0003F-0000003F-00000000
CPUID 8000001D: 00000122-0040003F-000000FF-00000000
CPUID 8000001D: 0000C143-03C0003F-000007FF-00000002
CPUID 8000001E: 00000002-00000002-00000000-00000000
CPUID 8FFFFFFF: 4C4C4548-494B204F-21595454-5E2D5E20 [HELLO KITTY! ^-^]
------[ Logical CPU #3 ]------
CPUID 00000000: 0000000D-68747541-444D4163-69746E65 [AuthenticAMD]
CPUID 00000001: 00700F01-03040800-3ED8220B-178BFBFF
CPUID 00000002: 00000000-00000000-00000000-00000000
CPUID 00000003: 00000000-00000000-00000000-00000000
CPUID 00000005: 00000040-00000040-00000003-00000000
CPUID 00000006: 00000000-00000000-00000001-00000000
CPUID 00000007: 00000000-00000008-00000000-00000000
CPUID 00000008: 00000000-00000000-00000000-00000000
CPUID 00000009: 00000000-00000000-00000000-00000000
CPUID 0000000A: 00000000-00000000-00000000-00000000
CPUID 0000000C: 00000000-00000000-00000000-00000000
CPUID 0000000D: 00000007-00000340-00000340-00000000
CPUID 0000000D: 00000100-00000240-00000000-00000000
CPUID 80000000: 8000001E-68747541-444D4163-69746E65
CPUID 80000001: 00700F01-00000000-154037FF-2FD3FBFF
CPUID 80000002: 20444D41-352D3441-20303030-20555041 [AMD A4-5000 APU ]
CPUID 80000003: 68746977-64615220-286E6F65-20294D54 [with Radeon(TM) ]
CPUID 80000004: 47204448-68706172-20736369-00202020 [HD Graphics    ]
CPUID 80000005: FF08FF08-FF28FF20-20080140-20020140
CPUID 80000006: 21000000-42004200-08008140-00000000
CPUID 80000007: 0D6B0101-00000001-00000000-000009D9
CPUID 80000008: 00003028-00000000-00003003-00000000
CPUID 80000009: 00000000-00000000-00000000-00000000
CPUID 8000000A: 00000001-00000008-00000000-00001CDF
CPUID 8000000B: 00000000-00000000-00000000-00000000
CPUID 8000000C: 00000000-00000000-00000000-00000000
CPUID 8000000D: 00000000-00000000-00000000-00000000
CPUID 8000000E: 00000000-00000000-00000000-00000000
CPUID 8000000F: 00000000-00000000-00000000-00000000
CPUID 80000010: 00000000-00000000-00000000-00000000
CPUID 80000011: 00000000-00000000-00000000-00000000
CPUID 80000012: 00000000-00000000-00000000-00000000
CPUID 80000013: 00000000-00000000-00000000-00000000
CPUID 80000014: 00000000-00000000-00000000-00000000
CPUID 80000015: 00000000-00000000-00000000-00000000
CPUID 80000016: 00000000-00000000-00000000-00000000
CPUID 80000017: 00000000-00000000-00000000-00000000
CPUID 80000018: 00000000-00000000-00000000-00000000
CPUID 80000019: 00000000-00000000-00000000-00000000
CPUID 8000001A: 00000003-00000000-00000000-00000000
CPUID 8000001B: 000000FF-00000000-00000000-00000000
CPUID 8000001C: 00000000-00000000-00000000-00000000
CPUID 8000001D: 00000121-01C0003F-0000003F-00000000
CPUID 8000001D: 00000122-0040003F-000000FF-00000000
CPUID 8000001D: 0000C143-03C0003F-000007FF-00000002
CPUID 8000001E: 00000003-00000003-00000000-00000000
CPUID 8FFFFFFF: 4C4C4548-494B204F-21595454-5E2D5E20 [HELLO KITTY! ^-^]
--------------------------------------------------------------------------------
x86
general
15
0
1
22
0
4
4
32
32
2048
-1
-1
8
2
16
-1
-1
64
64
64
-1
-1
-1
-1
-1
-1
-1
128 (authoritative)
Kabini X4
fpu vme de pse tsc msr pae mce cx8 apic mtrr sep pge mca cmov pat pse36 clflush mmx fxsr sse sse2 ht pni pclmul monitor ssse3 cx16 sse4_1 sse4_2 syscall movbe popcnt aes xsave osxsave avx mmxext nx fxsr_opt rdtscp lm lahf_lm cmp_legacy svm abm misalignsse sse4a 3dnowprefetch osvw ibs skinit wdt ts ttp tm_amd 100mhzsteps hwpstate constant_tsc f16c pfi bmi1
