basic_cpuid[0]=0000000a 756e6547 6c65746e 49656e69
basic_cpuid[1]=000006fd 01020800 0000e39d bfebfbff
basic_cpuid[2]=05b0b101 005657f0 00000000 2cb43078
basic_cpuid[3]=00000000 00000000 00000000 00000000
basic_cpuid[4]=04000121 01c0003f 0000003f 00000001
basic_cpuid[5]=00000040 00000040 00000003 00000220
basic_cpuid[6]=00000001 00000002 00000001 00000000
basic_cpuid[7]=00000000 00000000 00000000 00000000
basic_cpuid[8]=00000400 00000000 00000000 00000000
basic_cpuid[9]=00000000 00000000 00000000 00000000
basic_cpuid[10]=07280202 00000000 00000000 00000503
basic_cpuid[11]=07280202 00000000 00000000 00000503
basic_cpuid[12]=07280202 00000000 00000000 00000503
basic_cpuid[13]=07280202 00000000 00000000 00000503
basic_cpuid[14]=07280202 00000000 00000000 00000503
basic_cpuid[15]=07280202 00000000 00000000 00000503
basic_cpuid[16]=07280202 00000000 00000000 00000503
basic_cpuid[17]=07280202 00000000 00000000 00000503
basic_cpuid[18]=07280202 00000000 00000000 00000503
basic_cpuid[19]=07280202 00000000 00000000 00000503
basic_cpuid[20]=07280202 00000000 00000000 00000503
basic_cpuid[21]=07280202 00000000 00000000 00000503
basic_cpuid[22]=07280202 00000000 00000000 00000503
basic_cpuid[23]=07280202 00000000 00000000 00000503
basic_cpuid[24]=07280202 00000000 00000000 00000503
basic_cpuid[25]=07280202 00000000 00000000 00000503
basic_cpuid[26]=07280202 00000000 00000000 00000503
basic_cpuid[27]=07280202 00000000 00000000 00000503
basic_cpuid[28]=07280202 00000000 00000000 00000503
basic_cpuid[29]=07280202 00000000 00000000 00000503
basic_cpuid[30]=07280202 00000000 00000000 00000503
basic_cpuid[31]=07280202 00000000 00000000 00000503
ext_cpuid[0]=80000008 00000000 00000000 00000000
ext_cpuid[1]=00000000 00000000 00000001 20100000
ext_cpuid[2]=65746e49 2952286c 6e655020 6d756974
ext_cpuid[3]=20295228 6c617544 50432020 45202055
ext_cpuid[4]=30363132 20402020 30382e31 007a4847
ext_cpuid[5]=00000000 00000000 00000000 00000000
ext_cpuid[6]=00000000 00000000 04004040 00000000
ext_cpuid[7]=00000000 00000000 00000000 00000000
ext_cpuid[8]=00003024 00000000 00000000 00000000
ext_cpuid[9]=07280202 00000000 00000000 00000503
ext_cpuid[10]=07280202 00000000 00000000 00000503
ext_cpuid[11]=07280202 00000000 00000000 00000503
ext_cpuid[12]=07280202 00000000 00000000 00000503
ext_cpuid[13]=07280202 00000000 00000000 00000503
ext_cpuid[14]=07280202 00000000 00000000 00000503
ext_cpuid[15]=07280202 00000000 00000000 00000503
ext_cpuid[16]=07280202 00000000 00000000 00000503
ext_cpuid[17]=07280202 00000000 00000000 00000503
ext_cpuid[18]=07280202 00000000 00000000 00000503
ext_cpuid[19]=07280202 00000000 00000000 00000503
ext_cpuid[20]=07280202 00000000 00000000 00000503
ext_cpuid[21]=07280202 00000000 00000000 00000503
ext_cpuid[22]=07280202 00000000 00000000 00000503
ext_cpuid[23]=07280202 00000000 00000000 00000503
ext_cpuid[24]=07280202 00000000 00000000 00000503
ext_cpuid[25]=07280202 00000000 00000000 00000503
ext_cpuid[26]=07280202 00000000 00000000 00000503
ext_cpuid[27]=07280202 00000000 00000000 00000503
ext_cpuid[28]=07280202 00000000 00000000 00000503
ext_cpuid[29]=07280202 00000000 00000000 00000503
ext_cpuid[30]=07280202 00000000 00000000 00000503
ext_cpuid[31]=07280202 00000000 00000000 00000503
intel_fn4[0]=04000121 01c0003f 0000003f 00000001
intel_fn4[1]=04000122 01c0003f 0000003f 00000001
intel_fn4[2]=04004143 00c0003f 00000fff 00000001
intel_fn4[3]=00000000 00000000 00000000 00000000
--------------------------------------------------------------------------------
6
15
13
6
15
2
2
32
32
1024
-1
-1
8
4
-1
-1
64
64
-1
-1
128 (non-authoritative)
Conroe (Core 2 Duo) 1024K
fpu vme de pse tsc msr pae mce cx8 apic mtrr sep pge mca cmov pat pse36 clflush dts acpi mmx fxsr sse sse2 ss ht tm pbe pni dts64 monitor ds_cpl est tm2 ssse3 cx16 xtpr pdcm xd lm lahf_lm
