basic_cpuid[0]=00000006 756e6547 6c65746e 49656e69
basic_cpuid[1]=000006e8 00020800 0000c1a9 bfe9fbff
basic_cpuid[2]=02b3b001 000000f0 00000000 2c04307d
basic_cpuid[3]=00000000 00000000 00000000 00000000
basic_cpuid[4]=04000121 01c0003f 0000003f 00000001
basic_cpuid[5]=00000040 00000040 00000003 00022220
basic_cpuid[6]=00000001 00000002 00000001 00000000
basic_cpuid[7]=00000001 00000002 00000001 00000000
basic_cpuid[8]=00000001 00000002 00000001 00000000
basic_cpuid[9]=00000001 00000002 00000001 00000000
basic_cpuid[10]=00000001 00000002 00000001 00000000
basic_cpuid[11]=00000001 00000002 00000001 00000000
basic_cpuid[12]=00000001 00000002 00000001 00000000
basic_cpuid[13]=00000001 00000002 00000001 00000000
basic_cpuid[14]=00000001 00000002 00000001 00000000
basic_cpuid[15]=00000001 00000002 00000001 00000000
basic_cpuid[16]=00000001 00000002 00000001 00000000
basic_cpuid[17]=00000001 00000002 00000001 00000000
basic_cpuid[18]=00000001 00000002 00000001 00000000
basic_cpuid[19]=00000001 00000002 00000001 00000000
basic_cpuid[20]=00000001 00000002 00000001 00000000
basic_cpuid[21]=00000001 00000002 00000001 00000000
basic_cpuid[22]=00000001 00000002 00000001 00000000
basic_cpuid[23]=00000001 00000002 00000001 00000000
basic_cpuid[24]=00000001 00000002 00000001 00000000
basic_cpuid[25]=00000001 00000002 00000001 00000000
basic_cpuid[26]=00000001 00000002 00000001 00000000
basic_cpuid[27]=00000001 00000002 00000001 00000000
basic_cpuid[28]=00000001 00000002 00000001 00000000
basic_cpuid[29]=00000001 00000002 00000001 00000000
basic_cpuid[30]=00000001 00000002 00000001 00000000
basic_cpuid[31]=00000001 00000002 00000001 00000000
ext_cpuid[0]=80000008 00000000 00000000 00000000
ext_cpuid[1]=00000000 00000000 00000000 00100000
ext_cpuid[2]=756e6547 20656e69 65746e49 2952286c
ext_cpuid[3]=55504320 20202020 20202020 20202020
ext_cpuid[4]=30303331 20402020 36362e31 007a4847
ext_cpuid[5]=00000000 00000000 00000000 00000000
ext_cpuid[6]=00000000 00000000 08006040 00000000
ext_cpuid[7]=00000000 00000000 00000000 00000000
ext_cpuid[8]=00002020 00000000 00000000 00000000
ext_cpuid[9]=00000001 00000002 00000001 00000000
ext_cpuid[10]=00000001 00000002 00000001 00000000
ext_cpuid[11]=00000001 00000002 00000001 00000000
ext_cpuid[12]=00000001 00000002 00000001 00000000
ext_cpuid[13]=00000001 00000002 00000001 00000000
ext_cpuid[14]=00000001 00000002 00000001 00000000
ext_cpuid[15]=00000001 00000002 00000001 00000000
ext_cpuid[16]=00000001 00000002 00000001 00000000
ext_cpuid[17]=00000001 00000002 00000001 00000000
ext_cpuid[18]=00000001 00000002 00000001 00000000
ext_cpuid[19]=00000001 00000002 00000001 00000000
ext_cpuid[20]=00000001 00000002 00000001 00000000
ext_cpuid[21]=00000001 00000002 00000001 00000000
ext_cpuid[22]=00000001 00000002 00000001 00000000
ext_cpuid[23]=00000001 00000002 00000001 00000000
ext_cpuid[24]=00000001 00000002 00000001 00000000
ext_cpuid[25]=00000001 00000002 00000001 00000000
ext_cpuid[26]=00000001 00000002 00000001 00000000
ext_cpuid[27]=00000001 00000002 00000001 00000000
ext_cpuid[28]=00000001 00000002 00000001 00000000
ext_cpuid[29]=00000001 00000002 00000001 00000000
ext_cpuid[30]=00000001 00000002 00000001 00000000
ext_cpuid[31]=00000001 00000002 00000001 00000000
intel_fn4[0]=04000121 01c0003f 0000003f 00000001
intel_fn4[1]=04000122 01c0003f 0000003f 00000001
intel_fn4[2]=04004143 01c0003f 00000fff 00000001
intel_fn4[3]=00000000 00000000 00000000 00000000
--------------------------------------------------------------------------------
6
14
8
6
14
2
2
32
32
2048
-1
-1
8
8
-1
-1
64
64
-1
-1
64 (non-authoritative)
Yonah (Core Duo)
fpu vme de pse tsc msr pae mce cx8 apic mtrr sep pge mca cmov pat clflush dts acpi mmx fxsr sse sse2 ss ht tm pbe pni monitor vmx est tm2 xtpr pdcm xd
