basic_cpuid[0]=0000000d 756e6547 6c65746e 49656e69
basic_cpuid[1]=0001067a 00040800 0c08e3bd bfebfbff
basic_cpuid[2]=05b0b101 005657f0 00000000 2cb4307d
basic_cpuid[3]=00000000 00000000 00000000 00000000
basic_cpuid[4]=0c000121 01c0003f 0000003f 00000001
basic_cpuid[5]=00000040 00000040 00000003 00022220
basic_cpuid[6]=00000001 00000002 00000003 00000000
basic_cpuid[7]=00000000 00000000 00000000 00000000
basic_cpuid[8]=00000400 00000000 00000000 00000000
basic_cpuid[9]=00000000 00000000 00000000 00000000
basic_cpuid[10]=07280202 00000000 00000000 00000503
basic_cpuid[11]=00000000 00000000 00000000 00000000
basic_cpuid[12]=00000000 00000000 00000000 00000000
basic_cpuid[13]=00000003 00000240 00000240 00000000
basic_cpuid[14]=00000003 00000240 00000240 00000000
basic_cpuid[15]=00000003 00000240 00000240 00000000
basic_cpuid[16]=00000003 00000240 00000240 00000000
basic_cpuid[17]=00000003 00000240 00000240 00000000
basic_cpuid[18]=00000003 00000240 00000240 00000000
basic_cpuid[19]=00000003 00000240 00000240 00000000
basic_cpuid[20]=00000003 00000240 00000240 00000000
basic_cpuid[21]=00000003 00000240 00000240 00000000
basic_cpuid[22]=00000003 00000240 00000240 00000000
basic_cpuid[23]=00000003 00000240 00000240 00000000
basic_cpuid[24]=00000003 00000240 00000240 00000000
basic_cpuid[25]=00000003 00000240 00000240 00000000
basic_cpuid[26]=00000003 00000240 00000240 00000000
basic_cpuid[27]=00000003 00000240 00000240 00000000
basic_cpuid[28]=00000003 00000240 00000240 00000000
basic_cpuid[29]=00000003 00000240 00000240 00000000
basic_cpuid[30]=00000003 00000240 00000240 00000000
basic_cpuid[31]=00000003 00000240 00000240 00000000
ext_cpuid[0]=80000008 00000000 00000000 00000000
ext_cpuid[1]=00000000 00000000 00000001 20100000
ext_cpuid[2]=00000000 00000000 00000000 00000000
ext_cpuid[3]=00000000 00000000 00000000 51000000
ext_cpuid[4]=30303338 20402020 30352e32 007a4847
ext_cpuid[5]=00000000 00000000 00000000 00000000
ext_cpuid[6]=00000000 00000000 08006040 00000000
ext_cpuid[7]=00000000 00000000 00000000 00000000
ext_cpuid[8]=00003024 00000000 00000000 00000000
ext_cpuid[9]=00000003 00000240 00000240 00000000
ext_cpuid[10]=00000003 00000240 00000240 00000000
ext_cpuid[11]=00000003 00000240 00000240 00000000
ext_cpuid[12]=00000003 00000240 00000240 00000000
ext_cpuid[13]=00000003 00000240 00000240 00000000
ext_cpuid[14]=00000003 00000240 00000240 00000000
ext_cpuid[15]=00000003 00000240 00000240 00000000
ext_cpuid[16]=00000003 00000240 00000240 00000000
ext_cpuid[17]=00000003 00000240 00000240 00000000
ext_cpuid[18]=00000003 00000240 00000240 00000000
ext_cpuid[19]=00000003 00000240 00000240 00000000
ext_cpuid[20]=00000003 00000240 00000240 00000000
ext_cpuid[21]=00000003 00000240 00000240 00000000
ext_cpuid[22]=00000003 00000240 00000240 00000000
ext_cpuid[23]=00000003 00000240 00000240 00000000
ext_cpuid[24]=00000003 00000240 00000240 00000000
ext_cpuid[25]=00000003 00000240 00000240 00000000
ext_cpuid[26]=00000003 00000240 00000240 00000000
ext_cpuid[27]=00000003 00000240 00000240 00000000
ext_cpuid[28]=00000003 00000240 00000240 00000000
ext_cpuid[29]=00000003 00000240 00000240 00000000
ext_cpuid[30]=00000003 00000240 00000240 00000000
ext_cpuid[31]=00000003 00000240 00000240 00000000
intel_fn4[0]=0c000121 01c0003f 0000003f 00000001
intel_fn4[1]=0c000122 01c0003f 0000003f 00000001
intel_fn4[2]=0c004143 01c0003f 00000fff 00000001
intel_fn4[3]=00000000 00000000 00000000 00000000
intel_fn11[0]=00000000 00000000 00000000 00000000
intel_fn11[1]=00000000 00000000 00000000 00000000
intel_fn11[2]=00000000 00000000 00000000 00000000
intel_fn11[3]=00000000 00000000 00000000 00000000
--------------------------------------------------------------------------------
6
7
10
6
23
4
4
32
32
2048
-1
-1
8
8
-1
-1
64
64
-1
-1
128 (non-authoritative)
Yorkfield (Core 2 Quad) 2M
fpu vme de pse tsc msr pae mce cx8 apic mtrr sep pge mca cmov pat pse36 clflush dts acpi mmx fxsr sse sse2 ss ht tm pbe pni dts64 monitor ds_cpl vmx est tm2 ssse3 cx16 xtpr pdcm sse4_1 xd xsave osxsave lm lahf_lm
