------[ Logical CPU #0 ]------
CPUID 00000000: 00000001-746e6543-736c7561-48727561
CPUID 00000001: 00000693-00000000-00000000-0380b13d
CPUID 80000000: 80000006-00000000-00000000-00000000
CPUID 80000001: 00000000-00000000-00000000-00000000
CPUID 80000002: 20414956-6568654e-6861696d-00000000
CPUID 80000003: 00000000-00000000-00000000-00000000
CPUID 80000004: 00000000-00000000-00000000-00000000
CPUID 80000005: 00000000-08800880-40040120-40040120
CPUID 80000006: 00000000-00000000-00408120-00000000
CPUID c0000000: c0000001-00000000-00000000-00000000
CPUID c0000001: 00000000-00000000-00000000-0000001d
--------------------------------------------------------------------------------
x86
general
6
9
3
6
9
1
1
-1
-1
-1
-1
-1
-1
-1
-1
-1
-1
-1
-1
-1
-1
-1
-1
-1
-1
-1
-1
-1 (non-authoritative)
VIA C3 (Nehemiah)
fpu de pse tsc msr cx8 mtrr pge cmov mmx fxsr sse
