basic_cpuid[0]=00000016 756e6547 6c65746e 49656e69
basic_cpuid[1]=000406e3 03100800 4ffaebbf bfebfbff
basic_cpuid[2]=76036301 00f0b5ff 00000000 00c30000
basic_cpuid[3]=00000000 00000000 00000000 00000000
basic_cpuid[4]=1c004121 01c0003f 0000003f 00000000
basic_cpuid[5]=00000040 00000040 00000003 11142120
basic_cpuid[6]=000027f7 00000002 00000009 00000000
basic_cpuid[7]=00000000 02942607 00000000 0c000000
basic_cpuid[8]=00000000 00000000 00000000 00000000
basic_cpuid[9]=00000000 00000000 00000000 00000000
basic_cpuid[10]=07300404 00000000 00000000 00000603
basic_cpuid[11]=00000001 00000002 00000100 00000003
basic_cpuid[12]=00000000 00000000 00000000 00000000
basic_cpuid[13]=00000003 00000240 00000240 00000000
basic_cpuid[14]=00000000 00000000 00000000 00000000
basic_cpuid[15]=00000000 00000000 00000000 00000000
basic_cpuid[16]=00000000 00000000 00000000 00000000
basic_cpuid[17]=00000000 00000000 00000000 00000000
basic_cpuid[18]=00000000 00000000 00000000 00000000
basic_cpuid[19]=00000000 00000000 00000000 00000000
basic_cpuid[20]=00000001 0000000f 00000007 00000000
basic_cpuid[21]=00000002 000000b0 00000000 00000000
basic_cpuid[22]=00000834 00000834 00000064 00000000
basic_cpuid[23]=00000834 00000834 00000064 00000000
basic_cpuid[24]=00000834 00000834 00000064 00000000
basic_cpuid[25]=00000834 00000834 00000064 00000000
basic_cpuid[26]=00000834 00000834 00000064 00000000
basic_cpuid[27]=00000834 00000834 00000064 00000000
basic_cpuid[28]=00000834 00000834 00000064 00000000
basic_cpuid[29]=00000834 00000834 00000064 00000000
basic_cpuid[30]=00000834 00000834 00000064 00000000
basic_cpuid[31]=00000834 00000834 00000064 00000000
ext_cpuid[0]=80000008 00000000 00000000 00000000
ext_cpuid[1]=00000000 00000000 00000121 2c100800
ext_cpuid[2]=65746e49 2952286c 6e655020 6d756974
ext_cpuid[3]=20295228 20555043 35303434 20402055
ext_cpuid[4]=30312e32 007a4847 00000000 00000000
ext_cpuid[5]=00000000 00000000 00000000 00000000
ext_cpuid[6]=00000000 00000000 01006040 00000000
ext_cpuid[7]=00000000 00000000 00000000 00000100
ext_cpuid[8]=00003027 00000000 00000000 00000000
ext_cpuid[9]=00000834 00000834 00000064 00000000
ext_cpuid[10]=00000834 00000834 00000064 00000000
ext_cpuid[11]=00000834 00000834 00000064 00000000
ext_cpuid[12]=00000834 00000834 00000064 00000000
ext_cpuid[13]=00000834 00000834 00000064 00000000
ext_cpuid[14]=00000834 00000834 00000064 00000000
ext_cpuid[15]=00000834 00000834 00000064 00000000
ext_cpuid[16]=00000834 00000834 00000064 00000000
ext_cpuid[17]=00000834 00000834 00000064 00000000
ext_cpuid[18]=00000834 00000834 00000064 00000000
ext_cpuid[19]=00000834 00000834 00000064 00000000
ext_cpuid[20]=00000834 00000834 00000064 00000000
ext_cpuid[21]=00000834 00000834 00000064 00000000
ext_cpuid[22]=00000834 00000834 00000064 00000000
ext_cpuid[23]=00000834 00000834 00000064 00000000
ext_cpuid[24]=00000834 00000834 00000064 00000000
ext_cpuid[25]=00000834 00000834 00000064 00000000
ext_cpuid[26]=00000834 00000834 00000064 00000000
ext_cpuid[27]=00000834 00000834 00000064 00000000
ext_cpuid[28]=00000834 00000834 00000064 00000000
ext_cpuid[29]=00000834 00000834 00000064 00000000
ext_cpuid[30]=00000834 00000834 00000064 00000000
ext_cpuid[31]=00000834 00000834 00000064 00000000
intel_fn4[0]=1c004121 01c0003f 0000003f 00000000
intel_fn4[1]=1c004122 01c0003f 0000003f 00000000
intel_fn4[2]=1c004143 00c0003f 000003ff 00000000
intel_fn4[3]=1c03c163 01c0003f 00000fff 00000006
intel_fn4[4]=00000000 00000000 00000000 00000000
intel_fn4[5]=00000000 00000000 00000000 00000000
intel_fn4[6]=00000000 00000000 00000000 00000000
intel_fn4[7]=00000000 00000000 00000000 00000000
intel_fn11[0]=00000001 00000002 00000100 00000003
intel_fn11[1]=00000004 00000004 00000201 00000003
intel_fn11[2]=00000000 00000000 00000002 00000003
intel_fn11[3]=00000000 00000000 00000003 00000003
--------------------------------------------------------------------------------
6
14
3
6
78
2
4
32
32
256
2048
-1
8
4
8
-1
64
64
64
-1
128 (non-authoritative)
Skylake (Pentium)
fpu vme de pse tsc msr pae mce cx8 apic mtrr sep pge mca cmov pat pse36 clflush dts acpi mmx fxsr sse sse2 ss ht tm pbe pni pclmul dts64 monitor ds_cpl vmx est tm2 ssse3 cx16 xtpr pdcm sse4_1 sse4_2 syscall xd movbe popcnt aes xsave osxsave rdtscp lm lahf_lm constant_tsc rdrand x2apic sgx rdseed
