basic_cpuid[0]=00000016 756e6547 6c65746e 49656e69
basic_cpuid[1]=00050654 0a100800 7ffefbbf bfebfbff
basic_cpuid[2]=76036301 00f0b5ff 00000000 00c30000
basic_cpuid[3]=00000000 00000000 00000000 00000000
basic_cpuid[4]=1c004121 01c0003f 0000003f 00000000
basic_cpuid[5]=00000040 00000040 00000003 00002020
basic_cpuid[6]=00000077 00000002 00000009 00000000
basic_cpuid[7]=00000000 d39ffffb 00000000 0c000000
basic_cpuid[8]=00000000 00000000 00000000 00000000
basic_cpuid[9]=00000000 00000000 00000000 00000000
basic_cpuid[10]=07300404 00000000 00000000 00000603
basic_cpuid[11]=00000001 00000002 00000100 0000000a
basic_cpuid[12]=00000000 00000000 00000000 00000000
basic_cpuid[13]=000000ff 00000a80 00000a80 00000000
basic_cpuid[14]=00000000 00000000 00000000 00000000
basic_cpuid[15]=00000000 0000002f 00000000 00000002
basic_cpuid[16]=00000000 0000000a 00000000 00000000
basic_cpuid[17]=00000000 00000000 00000000 00000000
basic_cpuid[18]=00000000 00000000 00000000 00000000
basic_cpuid[19]=00000000 00000000 00000000 00000000
basic_cpuid[20]=00000001 0000000f 00000007 00000000
basic_cpuid[21]=00000002 00000124 00000000 00000000
basic_cpuid[22]=00000dac 00000fa0 00000064 00000000
basic_cpuid[23]=00000dac 00000fa0 00000064 00000000
basic_cpuid[24]=00000dac 00000fa0 00000064 00000000
basic_cpuid[25]=00000dac 00000fa0 00000064 00000000
basic_cpuid[26]=00000dac 00000fa0 00000064 00000000
basic_cpuid[27]=00000dac 00000fa0 00000064 00000000
basic_cpuid[28]=00000dac 00000fa0 00000064 00000000
basic_cpuid[29]=00000dac 00000fa0 00000064 00000000
basic_cpuid[30]=00000dac 00000fa0 00000064 00000000
basic_cpuid[31]=00000dac 00000fa0 00000064 00000000
ext_cpuid[0]=80000008 00000000 00000000 00000000
ext_cpuid[1]=00000000 00000000 00000121 2c100800
ext_cpuid[2]=65746e49 2952286c 726f4320 4d542865
ext_cpuid[3]=37692029 3038372d 43205830 40205550
ext_cpuid[4]=352e3320 7a484730 00000000 00000000
ext_cpuid[5]=00000000 00000000 00000000 00000000
ext_cpuid[6]=00000000 00000000 01006040 00000000
ext_cpuid[7]=00000000 00000000 00000000 00000100
ext_cpuid[8]=0000302e 00000000 00000000 00000000
ext_cpuid[9]=00000dac 00000fa0 00000064 00000000
ext_cpuid[10]=00000dac 00000fa0 00000064 00000000
ext_cpuid[11]=00000dac 00000fa0 00000064 00000000
ext_cpuid[12]=00000dac 00000fa0 00000064 00000000
ext_cpuid[13]=00000dac 00000fa0 00000064 00000000
ext_cpuid[14]=00000dac 00000fa0 00000064 00000000
ext_cpuid[15]=00000dac 00000fa0 00000064 00000000
ext_cpuid[16]=00000dac 00000fa0 00000064 00000000
ext_cpuid[17]=00000dac 00000fa0 00000064 00000000
ext_cpuid[18]=00000dac 00000fa0 00000064 00000000
ext_cpuid[19]=00000dac 00000fa0 00000064 00000000
ext_cpuid[20]=00000dac 00000fa0 00000064 00000000
ext_cpuid[21]=00000dac 00000fa0 00000064 00000000
ext_cpuid[22]=00000dac 00000fa0 00000064 00000000
ext_cpuid[23]=00000dac 00000fa0 00000064 00000000
ext_cpuid[24]=00000dac 00000fa0 00000064 00000000
ext_cpuid[25]=00000dac 00000fa0 00000064 00000000
ext_cpuid[26]=00000dac 00000fa0 00000064 00000000
ext_cpuid[27]=00000dac 00000fa0 00000064 00000000
ext_cpuid[28]=00000dac 00000fa0 00000064 00000000
ext_cpuid[29]=00000dac 00000fa0 00000064 00000000
ext_cpuid[30]=00000dac 00000fa0 00000064 00000000
ext_cpuid[31]=00000dac 00000fa0 00000064 00000000
intel_fn4[0]=1c004121 01c0003f 0000003f 00000000
intel_fn4[1]=1c004122 01c0003f 0000003f 00000000
intel_fn4[2]=1c004143 03c0003f 000003ff 00000000
intel_fn4[3]=1c03c163 0280003f 00002fff 00000004
intel_fn4[4]=00000000 00000000 00000000 00000000
intel_fn4[5]=00000000 00000000 00000000 00000000
intel_fn4[6]=00000000 00000000 00000000 00000000
intel_fn4[7]=00000000 00000000 00000000 00000000
intel_fn11[0]=00000001 00000002 00000100 0000000a
intel_fn11[1]=00000004 0000000c 00000201 0000000a
intel_fn11[2]=00000000 00000000 00000002 0000000a
intel_fn11[3]=00000000 00000000 00000003 0000000a
--------------------------------------------------------------------------------
6
5
4
6
85
6
12
32
32
1024
8448
-1
8
16
11
-1
64
64
64
-1
128 (non-authoritative)
Skylake-X (Core i7)
fpu vme de pse tsc msr pae mce cx8 apic mtrr sep pge mca cmov pat pse36 clflush dts acpi mmx fxsr sse sse2 ss ht tm pbe pni pclmul dts64 monitor ds_cpl vmx est tm2 ssse3 cx16 xtpr pdcm dca sse4_1 sse4_2 syscall xd movbe popcnt aes xsave osxsave avx rdtscp lm lahf_lm constant_tsc fma3 f16c rdrand x2apic avx2 bmi1 bmi2 hle rtm avx512f avx512dq avx512cd avx512bw avx512vl rdseed adx
