basic_cpuid[0]=00000016 756e6547 6c65746e 49656e69
basic_cpuid[1]=00050656 56400800 7ffefbff bfebfbff
basic_cpuid[2]=76036301 00f0b5ff 00000000 00c30000
basic_cpuid[3]=00000000 00000000 00000000 00000000
basic_cpuid[4]=7c004121 01c0003f 0000003f 00000000
basic_cpuid[5]=00000040 00000040 00000003 00002020
basic_cpuid[6]=00000ef7 00000002 00000009 00000000
basic_cpuid[7]=00000000 d39ffffb 00000818 bc000400
basic_cpuid[8]=00000000 00000000 00000000 00000000
basic_cpuid[9]=00000000 00000000 00000000 00000000
basic_cpuid[10]=07300404 00000000 00000000 00000603
basic_cpuid[11]=00000001 00000002 00000100 00000056
basic_cpuid[12]=00000000 00000000 00000000 00000000
basic_cpuid[13]=000002ff 00000a88 00000a88 00000000
basic_cpuid[14]=00000000 00000000 00000000 00000000
basic_cpuid[15]=00000000 000000cf 00000000 00000002
basic_cpuid[16]=00000000 0000000a 00000000 00000000
basic_cpuid[17]=00000000 00000000 00000000 00000000
basic_cpuid[18]=00000000 00000000 00000000 00000000
basic_cpuid[19]=00000000 00000000 00000000 00000000
basic_cpuid[20]=00000001 0000000f 00000007 00000000
basic_cpuid[21]=00000002 000000c8 00000000 00000000
basic_cpuid[22]=000009c4 00000ed8 00000064 00000000
basic_cpuid[23]=000009c4 00000ed8 00000064 00000000
basic_cpuid[24]=000009c4 00000ed8 00000064 00000000
basic_cpuid[25]=000009c4 00000ed8 00000064 00000000
basic_cpuid[26]=000009c4 00000ed8 00000064 00000000
basic_cpuid[27]=000009c4 00000ed8 00000064 00000000
basic_cpuid[28]=000009c4 00000ed8 00000064 00000000
basic_cpuid[29]=000009c4 00000ed8 00000064 00000000
basic_cpuid[30]=000009c4 00000ed8 00000064 00000000
basic_cpuid[31]=000009c4 00000ed8 00000064 00000000
ext_cpuid[0]=80000008 00000000 00000000 00000000
ext_cpuid[1]=00000000 00000000 00000121 2c100800
ext_cpuid[2]=65746e49 2952286c 6f655820 2952286e
ext_cpuid[3]=616c5020 756e6974 3238206d 20433936
ext_cpuid[4]=20555043 2e322040 48473035 0000007a
ext_cpuid[5]=00000000 00000000 00000000 00000000
ext_cpuid[6]=00000000 00000000 01006040 00000000
ext_cpuid[7]=00000000 00000000 00000000 00000100
ext_cpuid[8]=0000302e 00000000 00000000 00000000
ext_cpuid[9]=000009c4 00000ed8 00000064 00000000
ext_cpuid[10]=000009c4 00000ed8 00000064 00000000
ext_cpuid[11]=000009c4 00000ed8 00000064 00000000
ext_cpuid[12]=000009c4 00000ed8 00000064 00000000
ext_cpuid[13]=000009c4 00000ed8 00000064 00000000
ext_cpuid[14]=000009c4 00000ed8 00000064 00000000
ext_cpuid[15]=000009c4 00000ed8 00000064 00000000
ext_cpuid[16]=000009c4 00000ed8 00000064 00000000
ext_cpuid[17]=000009c4 00000ed8 00000064 00000000
ext_cpuid[18]=000009c4 00000ed8 00000064 00000000
ext_cpuid[19]=000009c4 00000ed8 00000064 00000000
ext_cpuid[20]=000009c4 00000ed8 00000064 00000000
ext_cpuid[21]=000009c4 00000ed8 00000064 00000000
ext_cpuid[22]=000009c4 00000ed8 00000064 00000000
ext_cpuid[23]=000009c4 00000ed8 00000064 00000000
ext_cpuid[24]=000009c4 00000ed8 00000064 00000000
ext_cpuid[25]=000009c4 00000ed8 00000064 00000000
ext_cpuid[26]=000009c4 00000ed8 00000064 00000000
ext_cpuid[27]=000009c4 00000ed8 00000064 00000000
ext_cpuid[28]=000009c4 00000ed8 00000064 00000000
ext_cpuid[29]=000009c4 00000ed8 00000064 00000000
ext_cpuid[30]=000009c4 00000ed8 00000064 00000000
ext_cpuid[31]=000009c4 00000ed8 00000064 00000000
intel_fn4[0]=7c004121 01c0003f 0000003f 00000000
intel_fn4[1]=7c004122 01c0003f 0000003f 00000000
intel_fn4[2]=7c004143 03c0003f 000003ff 00000000
intel_fn4[3]=7c0fc163 0280003f 0000cfff 00000005
intel_fn4[4]=00000000 00000000 00000000 00000000
intel_fn4[5]=00000000 00000000 00000000 00000000
intel_fn4[6]=00000000 00000000 00000000 00000000
intel_fn4[7]=00000000 00000000 00000000 00000000
intel_fn11[0]=00000001 00000002 00000100 00000056
intel_fn11[1]=00000006 00000034 00000201 00000056
intel_fn11[2]=00000000 00000000 00000002 00000056
intel_fn11[3]=00000000 00000000 00000003 00000056
--------------------------------------------------------------------------------
6
5
6
6
85
26
52
32
32
1024
36608
-1
8
16
11
-1
64
64
64
-1
128 (non-authoritative)
Skylake (Xeon Scalable)
fpu vme de pse tsc msr pae mce cx8 apic mtrr sep pge mca cmov pat pse36 clflush dts acpi mmx fxsr sse sse2 ss ht tm pbe pni pclmul dts64 monitor ds_cpl vmx smx est tm2 ssse3 cx16 xtpr pdcm dca sse4_1 sse4_2 syscall xd movbe popcnt aes xsave osxsave avx rdtscp lm lahf_lm constant_tsc fma3 f16c rdrand x2apic avx2 bmi1 bmi2 hle rtm avx512f avx512dq avx512cd avx512bw avx512vl rdseed adx avx512_vnni
