------[ Logical CPU #0 ]------
CPUID 00000000: 0000000A-756E6547-6C65746E-49656E69 [GenuineIntel]
CPUID 00000001: 000006F6-00020800-0000E3BD-BFEBFBFF
CPUID 00000002: 05B0B101-005657F0-00000000-2CB43049
CPUID 00000003: 00000000-00000000-00000000-00000000
CPUID 00000004: 04000121-01C0003F-0000003F-00000001 [SL 00]
CPUID 00000004: 04000122-01C0003F-0000003F-00000001 [SL 01]
CPUID 00000004: 04004143-03C0003F-00000FFF-00000001 [SL 02]
CPUID 00000005: 00000040-00000040-00000003-00000020
CPUID 00000006: 00000001-00000002-00000001-00000000
CPUID 00000007: 00000000-00000000-00000000-00000000
CPUID 00000008: 00000400-00000000-00000000-00000000
CPUID 00000009: 00000000-00000000-00000000-00000000
CPUID 0000000A: 07280202-00000000-00000000-00000000
CPUID 80000000: 80000008-00000000-00000000-00000000
CPUID 80000001: 00000000-00000000-00000001-20100000
CPUID 80000002: 65746E49-2952286C-726F4320-4D542865 [Intel(R) Core(TM]
CPUID 80000003: 43203229-20205550-20202020-58202020 [)2 CPU         X]
CPUID 80000004: 30303836-20402020-33392E32-007A4847 [6800  @ 2.93GHz]
CPUID 80000005: 00000000-00000000-00000000-00000000
CPUID 80000006: 00000000-00000000-10008040-00000000
CPUID 80000007: 00000000-00000000-00000000-00000000
CPUID 80000008: 00003024-00000000-00000000-00000000
------[ Logical CPU #1 ]------
CPUID 00000000: 0000000A-756E6547-6C65746E-49656E69 [GenuineIntel]
CPUID 00000001: 000006F6-01020800-0000E3BD-BFEBFBFF
CPUID 00000002: 05B0B101-005657F0-00000000-2CB43049
CPUID 00000003: 00000000-00000000-00000000-00000000
CPUID 00000004: 04000121-01C0003F-0000003F-00000001 [SL 00]
CPUID 00000004: 04000122-01C0003F-0000003F-00000001 [SL 01]
CPUID 00000004: 04004143-03C0003F-00000FFF-00000001 [SL 02]
CPUID 00000005: 00000040-00000040-00000003-00000020
CPUID 00000006: 00000001-00000002-00000001-00000000
CPUID 00000007: 00000000-00000000-00000000-00000000
CPUID 00000008: 00000400-00000000-00000000-00000000
CPUID 00000009: 00000000-00000000-00000000-00000000
CPUID 0000000A: 07280202-00000000-00000000-00000000
CPUID 80000000: 80000008-00000000-00000000-00000000
CPUID 80000001: 00000000-00000000-00000001-20100000
CPUID 80000002: 65746E49-2952286C-726F4320-4D542865 [Intel(R) Core(TM]
CPUID 80000003: 43203229-20205550-20202020-58202020 [)2 CPU         X]
CPUID 80000004: 30303836-20402020-33392E32-007A4847 [6800  @ 2.93GHz]
CPUID 80000005: 00000000-00000000-00000000-00000000
CPUID 80000006: 00000000-00000000-10008040-00000000
CPUID 80000007: 00000000-00000000-00000000-00000000
CPUID 80000008: 00003024-00000000-00000000-00000000
--------------------------------------------------------------------------------
x86
x86-64-v2
general
6
15
6
6
15
2
2
32
32
4096
-1
-1
8
8
16
-1
-1
64
64
64
-1
-1
-1
-1
-1
-1
-1
128 (non-authoritative)
Core 2 Extreme (Conroe XE)
65 nm
fpu vme de pse tsc msr pae mce cx8 apic mtrr sep pge mca cmov pat pse36 clflush dts acpi mmx fxsr sse sse2 ss ht tm pbe pni dts64 monitor ds_cpl vmx est tm2 ssse3 cx16 xtpr pdcm xd lm lahf_lm
