------[ Logical CPU #0 ]------
CPUID 00000000: 0000000A-756E6547-6C65746E-49656E69
CPUID 00000001: 000006F7-00040800-0004E33D-BFEBFBFF
CPUID 00000002: 05B0B101-005657F0-00000000-2CB43049
CPUID 00000003: 00000000-00000000-00000000-00000000
CPUID 00000004: 0C000121-01C0003F-0000003F-00000001
CPUID 00000004: 0C000122-01C0003F-0000003F-00000001
CPUID 00000004: 0C004143-03C0003F-00000FFF-00000001
CPUID 00000005: 00000040-00000040-00000003-00000020
CPUID 00000006: 00000001-00000002-00000001-00000000
CPUID 00000007: 00000000-00000000-00000000-00000000
CPUID 00000008: 00000400-00000000-00000000-00000000
CPUID 00000009: 00000000-00000000-00000000-00000000
CPUID 0000000A: 07280202-00000000-00000000-00000000
CPUID 80000000: 80000008-00000000-00000000-00000000
CPUID 80000001: 00000000-00000000-00000001-20100000
CPUID 80000002: 65746E49-2952286C-6F655820-2952286E
CPUID 80000003: 55504320-20202020-20202020-4C202020
CPUID 80000004: 30323335-20402020-36382E31-007A4847
CPUID 80000005: 00000000-00000000-00000000-00000000
CPUID 80000006: 00000000-00000000-10008040-00000000
CPUID 80000007: 00000000-00000000-00000000-00000000
CPUID 80000008: 00003024-00000000-00000000-00000000
------[ Logical CPU #1 ]------
CPUID 00000000: 0000000A-756E6547-6C65746E-49656E69
CPUID 00000001: 000006F7-02040800-0004E33D-BFEBFBFF
CPUID 00000002: 05B0B101-005657F0-00000000-2CB43049
CPUID 00000003: 00000000-00000000-00000000-00000000
CPUID 00000004: 0C000121-01C0003F-0000003F-00000001
CPUID 00000004: 0C000122-01C0003F-0000003F-00000001
CPUID 00000004: 0C004143-03C0003F-00000FFF-00000001
CPUID 00000005: 00000040-00000040-00000003-00000020
CPUID 00000006: 00000001-00000002-00000001-00000000
CPUID 00000007: 00000000-00000000-00000000-00000000
CPUID 00000008: 00000400-00000000-00000000-00000000
CPUID 00000009: 00000000-00000000-00000000-00000000
CPUID 0000000A: 07280202-00000000-00000000-00000000
CPUID 80000000: 80000008-00000000-00000000-00000000
CPUID 80000001: 00000000-00000000-00000001-20100000
CPUID 80000002: 65746E49-2952286C-6F655820-2952286E
CPUID 80000003: 55504320-20202020-20202020-4C202020
CPUID 80000004: 30323335-20402020-36382E31-007A4847
CPUID 80000005: 00000000-00000000-00000000-00000000
CPUID 80000006: 00000000-00000000-10008040-00000000
CPUID 80000007: 00000000-00000000-00000000-00000000
CPUID 80000008: 00003024-00000000-00000000-00000000
------[ Logical CPU #2 ]------
CPUID 00000000: 0000000A-756E6547-6C65746E-49656E69
CPUID 00000001: 000006F7-04040800-0004E33D-BFEBFBFF
CPUID 00000002: 05B0B101-005657F0-00000000-2CB43049
CPUID 00000003: 00000000-00000000-00000000-00000000
CPUID 00000004: 0C000121-01C0003F-0000003F-00000001
CPUID 00000004: 0C000122-01C0003F-0000003F-00000001
CPUID 00000004: 0C004143-03C0003F-00000FFF-00000001
CPUID 00000005: 00000040-00000040-00000003-00000020
CPUID 00000006: 00000001-00000002-00000001-00000000
CPUID 00000007: 00000000-00000000-00000000-00000000
CPUID 00000008: 00000400-00000000-00000000-00000000
CPUID 00000009: 00000000-00000000-00000000-00000000
CPUID 0000000A: 07280202-00000000-00000000-00000000
CPUID 80000000: 80000008-00000000-00000000-00000000
CPUID 80000001: 00000000-00000000-00000001-20100000
CPUID 80000002: 65746E49-2952286C-6F655820-2952286E
CPUID 80000003: 55504320-20202020-20202020-4C202020
CPUID 80000004: 30323335-20402020-36382E31-007A4847
CPUID 80000005: 00000000-00000000-00000000-00000000
CPUID 80000006: 00000000-00000000-10008040-00000000
CPUID 80000007: 00000000-00000000-00000000-00000000
CPUID 80000008: 00003024-00000000-00000000-00000000
------[ Logical CPU #3 ]------
CPUID 00000000: 0000000A-756E6547-6C65746E-49656E69
CPUID 00000001: 000006F7-06040800-0004E33D-BFEBFBFF
CPUID 00000002: 05B0B101-005657F0-00000000-2CB43049
CPUID 00000003: 00000000-00000000-00000000-00000000
CPUID 00000004: 0C000121-01C0003F-0000003F-00000001
CPUID 00000004: 0C000122-01C0003F-0000003F-00000001
CPUID 00000004: 0C004143-03C0003F-00000FFF-00000001
CPUID 00000005: 00000040-00000040-00000003-00000020
CPUID 00000006: 00000001-00000002-00000001-00000000
CPUID 00000007: 00000000-00000000-00000000-00000000
CPUID 00000008: 00000400-00000000-00000000-00000000
CPUID 00000009: 00000000-00000000-00000000-00000000
CPUID 0000000A: 07280202-00000000-00000000-00000000
CPUID 80000000: 80000008-00000000-00000000-00000000
CPUID 80000001: 00000000-00000000-00000001-20100000
CPUID 80000002: 65746E49-2952286C-6F655820-2952286E
CPUID 80000003: 55504320-20202020-20202020-4C202020
CPUID 80000004: 30323335-20402020-36382E31-007A4847
CPUID 80000005: 00000000-00000000-00000000-00000000
CPUID 80000006: 00000000-00000000-10008040-00000000
CPUID 80000007: 00000000-00000000-00000000-00000000
CPUID 80000008: 00003024-00000000-00000000-00000000
------[ Logical CPU #4 ]------
CPUID 00000000: 0000000A-756E6547-6C65746E-49656E69
CPUID 00000001: 000006F7-01040800-0004E33D-BFEBFBFF
CPUID 00000002: 05B0B101-005657F0-00000000-2CB43049
CPUID 00000003: 00000000-00000000-00000000-00000000
CPUID 00000004: 0C000121-01C0003F-0000003F-00000001
CPUID 00000004: 0C000122-01C0003F-0000003F-00000001
CPUID 00000004: 0C004143-03C0003F-00000FFF-00000001
CPUID 00000005: 00000040-00000040-00000003-00000020
CPUID 00000006: 00000001-00000002-00000001-00000000
CPUID 00000007: 00000000-00000000-00000000-00000000
CPUID 00000008: 00000400-00000000-00000000-00000000
CPUID 00000009: 00000000-00000000-00000000-00000000
CPUID 0000000A: 07280202-00000000-00000000-00000000
CPUID 80000000: 80000008-00000000-00000000-00000000
CPUID 80000001: 00000000-00000000-00000001-20100000
CPUID 80000002: 65746E49-2952286C-6F655820-2952286E
CPUID 80000003: 55504320-20202020-20202020-4C202020
CPUID 80000004: 30323335-20402020-36382E31-007A4847
CPUID 80000005: 00000000-00000000-00000000-00000000
CPUID 80000006: 00000000-00000000-10008040-00000000
CPUID 80000007: 00000000-00000000-00000000-00000000
CPUID 80000008: 00003024-00000000-00000000-00000000
------[ Logical CPU #5 ]------
CPUID 00000000: 0000000A-756E6547-6C65746E-49656E69
CPUID 00000001: 000006F7-03040800-0004E33D-BFEBFBFF
CPUID 00000002: 05B0B101-005657F0-00000000-2CB43049
CPUID 00000003: 00000000-00000000-00000000-00000000
CPUID 00000004: 0C000121-01C0003F-0000003F-00000001
CPUID 00000004: 0C000122-01C0003F-0000003F-00000001
CPUID 00000004: 0C004143-03C0003F-00000FFF-00000001
CPUID 00000005: 00000040-00000040-00000003-00000020
CPUID 00000006: 00000001-00000002-00000001-00000000
CPUID 00000007: 00000000-00000000-00000000-00000000
CPUID 00000008: 00000400-00000000-00000000-00000000
CPUID 00000009: 00000000-00000000-00000000-00000000
CPUID 0000000A: 07280202-00000000-00000000-00000000
CPUID 80000000: 80000008-00000000-00000000-00000000
CPUID 80000001: 00000000-00000000-00000001-20100000
CPUID 80000002: 65746E49-2952286C-6F655820-2952286E
CPUID 80000003: 55504320-20202020-20202020-4C202020
CPUID 80000004: 30323335-20402020-36382E31-007A4847
CPUID 80000005: 00000000-00000000-00000000-00000000
CPUID 80000006: 00000000-00000000-10008040-00000000
CPUID 80000007: 00000000-00000000-00000000-00000000
CPUID 80000008: 00003024-00000000-00000000-00000000
------[ Logical CPU #6 ]------
CPUID 00000000: 0000000A-756E6547-6C65746E-49656E69
CPUID 00000001: 000006F7-05040800-0004E33D-BFEBFBFF
CPUID 00000002: 05B0B101-005657F0-00000000-2CB43049
CPUID 00000003: 00000000-00000000-00000000-00000000
CPUID 00000004: 0C000121-01C0003F-0000003F-00000001
CPUID 00000004: 0C000122-01C0003F-0000003F-00000001
CPUID 00000004: 0C004143-03C0003F-00000FFF-00000001
CPUID 00000005: 00000040-00000040-00000003-00000020
CPUID 00000006: 00000001-00000002-00000001-00000000
CPUID 00000007: 00000000-00000000-00000000-00000000
CPUID 00000008: 00000400-00000000-00000000-00000000
CPUID 00000009: 00000000-00000000-00000000-00000000
CPUID 0000000A: 07280202-00000000-00000000-00000000
CPUID 80000000: 80000008-00000000-00000000-00000000
CPUID 80000001: 00000000-00000000-00000001-20100000
CPUID 80000002: 65746E49-2952286C-6F655820-2952286E
CPUID 80000003: 55504320-20202020-20202020-4C202020
CPUID 80000004: 30323335-20402020-36382E31-007A4847
CPUID 80000005: 00000000-00000000-00000000-00000000
CPUID 80000006: 00000000-00000000-10008040-00000000
CPUID 80000007: 00000000-00000000-00000000-00000000
CPUID 80000008: 00003024-00000000-00000000-00000000
------[ Logical CPU #7 ]------
CPUID 00000000: 0000000A-756E6547-6C65746E-49656E69
CPUID 00000001: 000006F7-07040800-0004E33D-BFEBFBFF
CPUID 00000002: 05B0B101-005657F0-00000000-2CB43049
CPUID 00000003: 00000000-00000000-00000000-00000000
CPUID 00000004: 0C000121-01C0003F-0000003F-00000001
CPUID 00000004: 0C000122-01C0003F-0000003F-00000001
CPUID 00000004: 0C004143-03C0003F-00000FFF-00000001
CPUID 00000005: 00000040-00000040-00000003-00000020
CPUID 00000006: 00000001-00000002-00000001-00000000
CPUID 00000007: 00000000-00000000-00000000-00000000
CPUID 00000008: 00000400-00000000-00000000-00000000
CPUID 00000009: 00000000-00000000-00000000-00000000
CPUID 0000000A: 07280202-00000000-00000000-00000000
CPUID 80000000: 80000008-00000000-00000000-00000000
CPUID 80000001: 00000000-00000000-00000001-20100000
CPUID 80000002: 65746E49-2952286C-6F655820-2952286E
CPUID 80000003: 55504320-20202020-20202020-4C202020
CPUID 80000004: 30323335-20402020-36382E31-007A4847
CPUID 80000005: 00000000-00000000-00000000-00000000
CPUID 80000006: 00000000-00000000-10008040-00000000
CPUID 80000007: 00000000-00000000-00000000-00000000
CPUID 80000008: 00003024-00000000-00000000-00000000
--------------------------------------------------------------------------------
x86
x86-64-v2
general
6
15
7
6
15
4
8
-1
-1
-1
-1
-1
-1
-1
-1
-1
-1
-1
-1
-1
-1
-1
-1
-1
-1
-1
-1
128 (non-authoritative)
Xeon (Clovertown)
65 nm
fpu vme de pse tsc msr pae mce cx8 apic mtrr sep pge mca cmov pat pse36 clflush dts acpi mmx fxsr sse sse2 ss ht tm pbe pni dts64 monitor ds_cpl vmx tm2 ssse3 cx16 xtpr pdcm dca xd lm lahf_lm
