CPUID Registers (CPU #1):
CPUID 00000000  	0000000A-756E6547-6C65746E-49656E69
CPUID 00000001  	00010677-00040800-0008E3FD-BFEBFBFF
CPUID 00000002  	05B0B101-005657F0-00000000-2CB43048
CPUID 00000003  	00000000-00000000-00000000-00000000
CPUID 00000004  	0C000121-01C0003F-0000003F-00000000
CPUID 00000004  	0C000122-01C0003F-0000003F-00000000
CPUID 00000004  	0C004143-02C0003F-00000FFF-00000000
CPUID 00000005  	00000040-00000040-00000003-00000020
CPUID 00000006  	00000001-00000002-00000001-00000000
CPUID 00000007  	00000000-00000000-00000000-00000000
CPUID 00000008  	00000400-00000000-00000000-00000000
CPUID 00000009  	00000000-00000000-00000000-00000000
CPUID 0000000A  	07280202-00000000-00000000-00000503
CPUID 80000000  	80000008-00000000-00000000-00000000
CPUID 80000001  	00000000-00000000-00000001-20100000
CPUID 80000002  	65746E49-2952286C-726F4320-4D542865
CPUID 80000003  	51203229-20646175-55504320-51202020
CPUID 80000004  	30303339-20402020-30352E32-007A4847
CPUID 80000005  	00000000-00000000-00000000-00000000
CPUID 80000006  	00000000-00000000-0C006040-00000000
CPUID 80000007  	00000000-00000000-00000000-00000000
CPUID 80000008  	00003024-00000000-00000000-00000000
CPUID Registers (CPU #2):
CPUID 00000000  	0000000A-756E6547-6C65746E-49656E69
CPUID 00000001  	00010677-01040800-0008E3FD-BFEBFBFF
CPUID 00000002  	05B0B101-005657F0-00000000-2CB43048
CPUID 00000003  	00000000-00000000-00000000-00000000
CPUID 00000004  	0C000121-01C0003F-0000003F-00000000
CPUID 00000004  	0C000122-01C0003F-0000003F-00000000
CPUID 00000004  	0C004143-02C0003F-00000FFF-00000000
CPUID 00000005  	00000040-00000040-00000003-00000020
CPUID 00000006  	00000001-00000002-00000001-00000000
CPUID 00000007  	00000000-00000000-00000000-00000000
CPUID 00000008  	00000400-00000000-00000000-00000000
CPUID 00000009  	00000000-00000000-00000000-00000000
CPUID 0000000A  	07280202-00000000-00000000-00000503
CPUID 80000000  	80000008-00000000-00000000-00000000
CPUID 80000001  	00000000-00000000-00000001-20100000
CPUID 80000002  	65746E49-2952286C-726F4320-4D542865
CPUID 80000003  	51203229-20646175-55504320-51202020
CPUID 80000004  	30303339-20402020-30352E32-007A4847
CPUID 80000005  	00000000-00000000-00000000-00000000
CPUID 80000006  	00000000-00000000-0C006040-00000000
CPUID 80000007  	00000000-00000000-00000000-00000000
CPUID 80000008  	00003024-00000000-00000000-00000000
CPUID Registers (CPU #3):
CPUID 00000000  	0000000A-756E6547-6C65746E-49656E69
CPUID 00000001  	00010677-02040800-0008E3FD-BFEBFBFF
CPUID 00000002  	05B0B101-005657F0-00000000-2CB43048
CPUID 00000003  	00000000-00000000-00000000-00000000
CPUID 00000004  	0C000121-01C0003F-0000003F-00000000
CPUID 00000004  	0C000122-01C0003F-0000003F-00000000
CPUID 00000004  	0C004143-02C0003F-00000FFF-00000000
CPUID 00000005  	00000040-00000040-00000003-00000020
CPUID 00000006  	00000001-00000002-00000001-00000000
CPUID 00000007  	00000000-00000000-00000000-00000000
CPUID 00000008  	00000400-00000000-00000000-00000000
CPUID 00000009  	00000000-00000000-00000000-00000000
CPUID 0000000A  	07280202-00000000-00000000-00000503
CPUID 80000000  	80000008-00000000-00000000-00000000
CPUID 80000001  	00000000-00000000-00000001-20100000
CPUID 80000002  	65746E49-2952286C-726F4320-4D542865
CPUID 80000003  	51203229-20646175-55504320-51202020
CPUID 80000004  	30303339-20402020-30352E32-007A4847
CPUID 80000005  	00000000-00000000-00000000-00000000
CPUID 80000006  	00000000-00000000-0C006040-00000000
CPUID 80000007  	00000000-00000000-00000000-00000000
CPUID 80000008  	00003024-00000000-00000000-00000000
CPUID Registers (CPU #4):
CPUID 00000000  	0000000A-756E6547-6C65746E-49656E69
CPUID 00000001  	00010677-03040800-0008E3FD-BFEBFBFF
CPUID 00000002  	05B0B101-005657F0-00000000-2CB43048
CPUID 00000003  	00000000-00000000-00000000-00000000
CPUID 00000004  	0C000121-01C0003F-0000003F-00000000
CPUID 00000004  	0C000122-01C0003F-0000003F-00000000
CPUID 00000004  	0C004143-02C0003F-00000FFF-00000000
CPUID 00000005  	00000040-00000040-00000003-00000020
CPUID 00000006  	00000001-00000002-00000001-00000000
CPUID 00000007  	00000000-00000000-00000000-00000000
CPUID 00000008  	00000400-00000000-00000000-00000000
CPUID 00000009  	00000000-00000000-00000000-00000000
CPUID 0000000A  	07280202-00000000-00000000-00000503
CPUID 80000000  	80000008-00000000-00000000-00000000
CPUID 80000001  	00000000-00000000-00000001-20100000
CPUID 80000002  	65746E49-2952286C-726F4320-4D542865
CPUID 80000003  	51203229-20646175-55504320-51202020
CPUID 80000004  	30303339-20402020-30352E32-007A4847
CPUID 80000005  	00000000-00000000-00000000-00000000
CPUID 80000006  	00000000-00000000-0C006040-00000000
CPUID 80000007  	00000000-00000000-00000000-00000000
CPUID 80000008  	00003024-00000000-00000000-00000000
--------------------------------------------------------------------------------
x86
x86-64-v2
general
6
7
7
6
23
4
4
-1
-1
-1
-1
-1
-1
-1
-1
-1
-1
-1
-1
-1
-1
-1
-1
-1
-1
-1
-1
128 (non-authoritative)
Core 2 Quad (Yorkfield-6M)
45 nm
fpu vme de pse tsc msr pae mce cx8 apic mtrr sep pge mca cmov pat pse36 clflush dts acpi mmx fxsr sse sse2 ss ht tm pbe pni dts64 monitor ds_cpl vmx smx est tm2 ssse3 cx16 xtpr pdcm sse4_1 xd lm lahf_lm
