_________________ Logical CPU #0 _________________
basic_cpuid[0]=0000000d 756e6547 6c65746e 49656e69
basic_cpuid[1]=0001067a 00010800 0c00e31d afebfbff
basic_cpuid[2]=05b0b101 005657f0 00000000 2cb43078
basic_cpuid[3]=00000000 00000000 00000000 00000000
basic_cpuid[4]=00000121 01c0003f 0000003f 00000001
basic_cpuid[5]=00000040 00000040 00000003 00002220
basic_cpuid[6]=00000001 00000002 00000003 00000000
basic_cpuid[7]=00000000 00000000 00000000 00000000
basic_cpuid[8]=00000400 00000000 00000000 00000000
basic_cpuid[9]=00000000 00000000 00000000 00000000
basic_cpuid[10]=07280202 00000000 00000000 00000503
basic_cpuid[11]=00000000 00000000 00000000 00000000
basic_cpuid[12]=00000000 00000000 00000000 00000000
basic_cpuid[13]=00000003 00000240 00000240 00000000
basic_cpuid[14]=00000003 00000240 00000240 00000000
basic_cpuid[15]=00000003 00000240 00000240 00000000
basic_cpuid[16]=00000003 00000240 00000240 00000000
basic_cpuid[17]=00000003 00000240 00000240 00000000
basic_cpuid[18]=00000003 00000240 00000240 00000000
basic_cpuid[19]=00000003 00000240 00000240 00000000
basic_cpuid[20]=00000003 00000240 00000240 00000000
basic_cpuid[21]=00000003 00000240 00000240 00000000
basic_cpuid[22]=00000003 00000240 00000240 00000000
basic_cpuid[23]=00000003 00000240 00000240 00000000
basic_cpuid[24]=00000003 00000240 00000240 00000000
basic_cpuid[25]=00000003 00000240 00000240 00000000
basic_cpuid[26]=00000003 00000240 00000240 00000000
basic_cpuid[27]=00000003 00000240 00000240 00000000
basic_cpuid[28]=00000003 00000240 00000240 00000000
basic_cpuid[29]=00000003 00000240 00000240 00000000
basic_cpuid[30]=00000003 00000240 00000240 00000000
basic_cpuid[31]=00000003 00000240 00000240 00000000
ext_cpuid[0]=80000008 00000000 00000000 00000000
ext_cpuid[1]=00000000 00000000 00000001 20100800
ext_cpuid[2]=65746e49 2952286c 6c654320 6e6f7265
ext_cpuid[3]=20295228 20555043 20202020 20202020
ext_cpuid[4]=30303920 20402020 30322e32 007a4847
ext_cpuid[5]=00000000 00000000 00000000 00000000
ext_cpuid[6]=00000000 00000000 04004040 00000000
ext_cpuid[7]=00000000 00000000 00000000 00000000
ext_cpuid[8]=00003024 00000000 00000000 00000000
ext_cpuid[9]=00000003 00000240 00000240 00000000
ext_cpuid[10]=00000003 00000240 00000240 00000000
ext_cpuid[11]=00000003 00000240 00000240 00000000
ext_cpuid[12]=00000003 00000240 00000240 00000000
ext_cpuid[13]=00000003 00000240 00000240 00000000
ext_cpuid[14]=00000003 00000240 00000240 00000000
ext_cpuid[15]=00000003 00000240 00000240 00000000
ext_cpuid[16]=00000003 00000240 00000240 00000000
ext_cpuid[17]=00000003 00000240 00000240 00000000
ext_cpuid[18]=00000003 00000240 00000240 00000000
ext_cpuid[19]=00000003 00000240 00000240 00000000
ext_cpuid[20]=00000003 00000240 00000240 00000000
ext_cpuid[21]=00000003 00000240 00000240 00000000
ext_cpuid[22]=00000003 00000240 00000240 00000000
ext_cpuid[23]=00000003 00000240 00000240 00000000
ext_cpuid[24]=00000003 00000240 00000240 00000000
ext_cpuid[25]=00000003 00000240 00000240 00000000
ext_cpuid[26]=00000003 00000240 00000240 00000000
ext_cpuid[27]=00000003 00000240 00000240 00000000
ext_cpuid[28]=00000003 00000240 00000240 00000000
ext_cpuid[29]=00000003 00000240 00000240 00000000
ext_cpuid[30]=00000003 00000240 00000240 00000000
ext_cpuid[31]=00000003 00000240 00000240 00000000
intel_fn4[0]=00000121 01c0003f 0000003f 00000001
intel_fn4[1]=00000122 01c0003f 0000003f 00000001
intel_fn4[2]=00000143 00c0003f 00000fff 00000001
intel_fn4[3]=00000000 00000000 00000000 00000000
intel_fn4[4]=00000000 00000000 00000000 00000000
intel_fn4[5]=00000000 00000000 00000000 00000000
intel_fn4[6]=00000000 00000000 00000000 00000000
intel_fn4[7]=00000000 00000000 00000000 00000000
intel_fn11[0]=00000000 00000000 00000000 00000000
intel_fn11[1]=00000000 00000000 00000000 00000000
intel_fn11[2]=00000000 00000000 00000000 00000000
intel_fn11[3]=00000000 00000000 00000000 00000000
amd_fn8000001dh[0]=00000003 00000240 00000240 00000000
amd_fn8000001dh[1]=00000000 00000000 00000000 00000000
amd_fn8000001dh[2]=00000000 00000000 00000000 00000000
amd_fn8000001dh[3]=00000000 00000000 00000000 00000000
--------------------------------------------------------------------------------
x86
general
6
7
10
6
23
1
1
32
32
1024
-1
-1
8
8
4
-1
-1
64
64
64
-1
-1
-1
-1
-1
-1
-1
128 (non-authoritative)
Celeron Penryn L
fpu vme de pse tsc msr pae mce cx8 apic mtrr sep pge mca cmov pat pse36 clflush dts acpi mmx fxsr sse sse2 ss tm pbe pni dts64 monitor ds_cpl tm2 ssse3 cx16 xtpr pdcm syscall xd xsave osxsave lm lahf_lm
