CPUID Registers (CPU #1):
CPUID 00000000: 0000000D-756E6547-6C65746E-49656E69
CPUID 00000001: 0001067A-00020800-0400E39D-BFEBFBFF
CPUID 00000002: 05B0B101-005657F0-00000000-2CB43078
CPUID 00000003: 00000000-00000000-00000000-00000000
CPUID 00000004: 04000121-01C0003F-0000003F-00000001
CPUID 00000004: 04000122-01C0003F-0000003F-00000001
CPUID 00000004: 04004143-00C0003F-00000FFF-00000001
CPUID 00000005: 00000040-00000040-00000003-00002220
CPUID 00000006: 00000001-00000002-00000003-00000000
CPUID 00000007: 00000000-00000000-00000000-00000000
CPUID 00000008: 00000400-00000000-00000000-00000000
CPUID 00000009: 00000000-00000000-00000000-00000000
CPUID 0000000A: 07280202-00000000-00000000-00000503
CPUID 0000000C: 00000000-00000000-00000000-00000000
CPUID 0000000D: 00000003-00000240-00000240-00000000
CPUID 80000000: 80000008-00000000-00000000-00000000
CPUID 80000001: 00000000-00000000-00000001-20100000
CPUID 80000002: 746E6550-286D7569-44202952-2D6C6175
CPUID 80000003: 65726F43-55504320-20202020-54202020
CPUID 80000004: 30303234-20402020-30302E32-007A4847
CPUID 80000005: 00000000-00000000-00000000-00000000
CPUID 80000006: 00000000-00000000-04004040-00000000
CPUID 80000007: 00000000-00000000-00000000-00000000
CPUID 80000008: 00003024-00000000-00000000-00000000
CPUID Registers (CPU #2):
CPUID 00000000: 0000000D-756E6547-6C65746E-49656E69
CPUID 00000001: 0001067A-01020800-0400E39D-BFEBFBFF
CPUID 00000002: 05B0B101-005657F0-00000000-2CB43078
CPUID 00000003: 00000000-00000000-00000000-00000000
CPUID 00000004: 04000121-01C0003F-0000003F-00000001
CPUID 00000004: 04000122-01C0003F-0000003F-00000001
CPUID 00000004: 04004143-00C0003F-00000FFF-00000001
CPUID 00000005: 00000040-00000040-00000003-00002220
CPUID 00000006: 00000001-00000002-00000003-00000000
CPUID 00000007: 00000000-00000000-00000000-00000000
CPUID 00000008: 00000400-00000000-00000000-00000000
CPUID 00000009: 00000000-00000000-00000000-00000000
CPUID 0000000A: 07280202-00000000-00000000-00000503
CPUID 0000000C: 00000000-00000000-00000000-00000000
CPUID 0000000D: 00000003-00000240-00000240-00000000
CPUID 80000000: 80000008-00000000-00000000-00000000
CPUID 80000001: 00000000-00000000-00000001-20100000
CPUID 80000002: 746E6550-286D7569-44202952-2D6C6175
CPUID 80000003: 65726F43-55504320-20202020-54202020
CPUID 80000004: 30303234-20402020-30302E32-007A4847
CPUID 80000005: 00000000-00000000-00000000-00000000
CPUID 80000006: 00000000-00000000-04004040-00000000
CPUID 80000007: 00000000-00000000-00000000-00000000
CPUID 80000008: 00003024-00000000-00000000-00000000
--------------------------------------------------------------------------------
x86
x86-64-v2
general
6
7
10
6
23
2
2
-1
-1
-1
-1
-1
-1
-1
-1
-1
-1
-1
-1
-1
-1
-1
-1
-1
-1
-1
-1
128 (non-authoritative)
Pentium Dual-Core (Penryn-L)
45 nm
fpu vme de pse tsc msr pae mce cx8 apic mtrr sep pge mca cmov pat pse36 clflush dts acpi mmx fxsr sse sse2 ss ht tm pbe pni dts64 monitor ds_cpl est tm2 ssse3 cx16 xtpr pdcm xd xsave lm lahf_lm
