basic_cpuid[0]=00000002 756e6547 6c65746e 49656e69
basic_cpuid[1]=000006d6 00000816 00000180 afe9f9bf
basic_cpuid[2]=02b3b001 000000f0 00000000 2c04307d
basic_cpuid[3]=02b3b001 000000f0 00000000 2c04307d
basic_cpuid[4]=02b3b001 000000f0 00000000 2c04307d
basic_cpuid[5]=02b3b001 000000f0 00000000 2c04307d
basic_cpuid[6]=02b3b001 000000f0 00000000 2c04307d
basic_cpuid[7]=02b3b001 000000f0 00000000 2c04307d
basic_cpuid[8]=02b3b001 000000f0 00000000 2c04307d
basic_cpuid[9]=02b3b001 000000f0 00000000 2c04307d
basic_cpuid[10]=02b3b001 000000f0 00000000 2c04307d
basic_cpuid[11]=02b3b001 000000f0 00000000 2c04307d
basic_cpuid[12]=02b3b001 000000f0 00000000 2c04307d
basic_cpuid[13]=02b3b001 000000f0 00000000 2c04307d
basic_cpuid[14]=02b3b001 000000f0 00000000 2c04307d
basic_cpuid[15]=02b3b001 000000f0 00000000 2c04307d
basic_cpuid[16]=02b3b001 000000f0 00000000 2c04307d
basic_cpuid[17]=02b3b001 000000f0 00000000 2c04307d
basic_cpuid[18]=02b3b001 000000f0 00000000 2c04307d
basic_cpuid[19]=02b3b001 000000f0 00000000 2c04307d
basic_cpuid[20]=02b3b001 000000f0 00000000 2c04307d
basic_cpuid[21]=02b3b001 000000f0 00000000 2c04307d
basic_cpuid[22]=02b3b001 000000f0 00000000 2c04307d
basic_cpuid[23]=02b3b001 000000f0 00000000 2c04307d
basic_cpuid[24]=02b3b001 000000f0 00000000 2c04307d
basic_cpuid[25]=02b3b001 000000f0 00000000 2c04307d
basic_cpuid[26]=02b3b001 000000f0 00000000 2c04307d
basic_cpuid[27]=02b3b001 000000f0 00000000 2c04307d
basic_cpuid[28]=02b3b001 000000f0 00000000 2c04307d
basic_cpuid[29]=02b3b001 000000f0 00000000 2c04307d
basic_cpuid[30]=02b3b001 000000f0 00000000 2c04307d
basic_cpuid[31]=02b3b001 000000f0 00000000 2c04307d
ext_cpuid[0]=80000004 00000000 00000000 00000000
ext_cpuid[1]=00000000 00000000 00000000 00000000
ext_cpuid[2]=20202020 20202020 65746e49 2952286c
ext_cpuid[3]=6e655020 6d756974 20295228 7270204d
ext_cpuid[4]=7365636f 20726f73 30362e31 007a4847
ext_cpuid[5]=02b3b001 000000f0 00000000 2c04307d
ext_cpuid[6]=02b3b001 000000f0 00000000 2c04307d
ext_cpuid[7]=02b3b001 000000f0 00000000 2c04307d
ext_cpuid[8]=02b3b001 000000f0 00000000 2c04307d
ext_cpuid[9]=02b3b001 000000f0 00000000 2c04307d
ext_cpuid[10]=02b3b001 000000f0 00000000 2c04307d
ext_cpuid[11]=02b3b001 000000f0 00000000 2c04307d
ext_cpuid[12]=02b3b001 000000f0 00000000 2c04307d
ext_cpuid[13]=02b3b001 000000f0 00000000 2c04307d
ext_cpuid[14]=02b3b001 000000f0 00000000 2c04307d
ext_cpuid[15]=02b3b001 000000f0 00000000 2c04307d
ext_cpuid[16]=02b3b001 000000f0 00000000 2c04307d
ext_cpuid[17]=02b3b001 000000f0 00000000 2c04307d
ext_cpuid[18]=02b3b001 000000f0 00000000 2c04307d
ext_cpuid[19]=02b3b001 000000f0 00000000 2c04307d
ext_cpuid[20]=02b3b001 000000f0 00000000 2c04307d
ext_cpuid[21]=02b3b001 000000f0 00000000 2c04307d
ext_cpuid[22]=02b3b001 000000f0 00000000 2c04307d
ext_cpuid[23]=02b3b001 000000f0 00000000 2c04307d
ext_cpuid[24]=02b3b001 000000f0 00000000 2c04307d
ext_cpuid[25]=02b3b001 000000f0 00000000 2c04307d
ext_cpuid[26]=02b3b001 000000f0 00000000 2c04307d
ext_cpuid[27]=02b3b001 000000f0 00000000 2c04307d
ext_cpuid[28]=02b3b001 000000f0 00000000 2c04307d
ext_cpuid[29]=02b3b001 000000f0 00000000 2c04307d
ext_cpuid[30]=02b3b001 000000f0 00000000 2c04307d
ext_cpuid[31]=02b3b001 000000f0 00000000 2c04307d
intel_fn4[0]=02b3b001 000000f0 00000000 2c04307d
intel_fn4[1]=02b3b001 000000f0 00000000 2c04307d
intel_fn4[2]=02b3b001 000000f0 00000000 2c04307d
intel_fn4[3]=02b3b001 000000f0 00000000 2c04307d
--------------------------------------------------------------------------------
6
13
6
6
13
1
1
32
32
2048
-1
-1
8
8
-1
-1
64
64
-1
-1
64 (non-authoritative)
Pentium M (Dothan)
fpu vme de pse tsc msr mce cx8 mtrr sep pge mca cmov pat clflush dts acpi mmx fxsr sse sse2 ss tm pbe est tm2
