------[ Logical CPU #0 ]------
CPUID 00000000: 00000006-756E6547-6C65746E-49656E69
CPUID 00000001: 00000F65-00010800-0000E41D-BFEBFBFF
CPUID 00000002: 605B5101-00000000-00000000-007B7040
CPUID 00000003: 00000000-00000000-00000000-00000000
CPUID 00000004: 00000121-01C0003F-0000001F-00000000
CPUID 00000004: 00000143-01C0103F-000001FF-00000000
CPUID 00000005: 00000040-00000040-00000000-00000000
CPUID 00000006: 00000000-00000000-00000000-00000000
CPUID 80000000: 80000008-00000000-00000000-00000000
CPUID 80000001: 00000000-00000000-00000001-20100000
CPUID 80000002: 20202020-20202020-20202020-6E492020
CPUID 80000003: 286C6574-43202952-72656C65-52286E6F
CPUID 80000004: 20442029-20555043-36302E33-007A4847
CPUID 80000005: 00000000-00000000-00000000-00000000
CPUID 80000006: 00000000-00000000-02006040-00000000
CPUID 80000007: 00000000-00000000-00000000-00000000
--------------------------------------------------------------------------------
x86
x86-64-v1
general
15
6
5
15
6
1
1
-1
-1
-1
-1
-1
-1
-1
-1
-1
-1
-1
-1
-1
-1
-1
-1
-1
-1
-1
-1
64 (non-authoritative)
P-4 Celeron D (Cedar Mill)
65 nm
fpu vme de pse tsc msr pae mce cx8 apic mtrr sep pge mca cmov pat pse36 clflush dts acpi mmx fxsr sse sse2 ss tm pbe pni dts64 monitor ds_cpl cid cx16 xtpr pdcm xd lm lahf_lm
