------[ Logical CPU #0 ]------
CPUID 00000000: 00000006-756E6547-6C65746E-49656E69
CPUID 00000001: 00000F68-00040800-0000E5BD-BFEBFBFF
CPUID 00000002: 605B5001-00000000-00000000-007C704D
CPUID 00000003: 00000000-00000000-00000000-00000000
CPUID 00000004: 04004121-01C0003F-0000001F-00000000
CPUID 00000004: 04004143-01C0103F-000003FF-00000000
CPUID 00000004: 0400C963-03C0003F-00003FFF-00000000
CPUID 00000005: 00000040-00000040-00000000-00000000
CPUID 00000006: 00000000-00000000-00000000-00000000
CPUID 80000000: 80000008-00000000-00000000-00000000
CPUID 80000001: 00000000-00000000-00000001-20100000
CPUID 80000002: 20202020-20202020-20202020-20202020
CPUID 80000003: 6E492020-286C6574-58202952-286E6F65
CPUID 80000004: 20294D54-20555043-30342E33-007A4847
CPUID 80000005: 00000000-00000000-00000000-00000000
CPUID 80000006: 00000000-00000000-04006040-00000000
CPUID 80000007: 00000000-00000000-00000000-00000000
CPUID 80000008: 00003028-00000000-00000000-00000000
------[ Logical CPU #1 ]------
CPUID 00000000: 00000006-756E6547-6C65746E-49656E69
CPUID 00000001: 00000F68-01040800-0000E5BD-BFEBFBFF
CPUID 00000002: 605B5001-00000000-00000000-007C704D
CPUID 00000003: 00000000-00000000-00000000-00000000
CPUID 00000004: 04004121-01C0003F-0000001F-00000000
CPUID 00000004: 04004143-01C0103F-000003FF-00000000
CPUID 00000004: 0400C963-03C0003F-00003FFF-00000000
CPUID 00000005: 00000040-00000040-00000000-00000000
CPUID 00000006: 00000000-00000000-00000000-00000000
CPUID 80000000: 80000008-00000000-00000000-00000000
CPUID 80000001: 00000000-00000000-00000001-20100000
CPUID 80000002: 20202020-20202020-20202020-20202020
CPUID 80000003: 6E492020-286C6574-58202952-286E6F65
CPUID 80000004: 20294D54-20555043-30342E33-007A4847
CPUID 80000005: 00000000-00000000-00000000-00000000
CPUID 80000006: 00000000-00000000-04006040-00000000
CPUID 80000007: 00000000-00000000-00000000-00000000
CPUID 80000008: 00003028-00000000-00000000-00000000
------[ Logical CPU #2 ]------
CPUID 00000000: 00000006-756E6547-6C65746E-49656E69
CPUID 00000001: 00000F68-02040800-0000E5BD-BFEBFBFF
CPUID 00000002: 605B5001-00000000-00000000-007C704D
CPUID 00000003: 00000000-00000000-00000000-00000000
CPUID 00000004: 04004121-01C0003F-0000001F-00000000
CPUID 00000004: 04004143-01C0103F-000003FF-00000000
CPUID 00000004: 0400C963-03C0003F-00003FFF-00000000
CPUID 00000005: 00000040-00000040-00000000-00000000
CPUID 00000006: 00000000-00000000-00000000-00000000
CPUID 80000000: 80000008-00000000-00000000-00000000
CPUID 80000001: 00000000-00000000-00000001-20100000
CPUID 80000002: 20202020-20202020-20202020-20202020
CPUID 80000003: 6E492020-286C6574-58202952-286E6F65
CPUID 80000004: 20294D54-20555043-30342E33-007A4847
CPUID 80000005: 00000000-00000000-00000000-00000000
CPUID 80000006: 00000000-00000000-04006040-00000000
CPUID 80000007: 00000000-00000000-00000000-00000000
CPUID 80000008: 00003028-00000000-00000000-00000000
------[ Logical CPU #3 ]------
CPUID 00000000: 00000006-756E6547-6C65746E-49656E69
CPUID 00000001: 00000F68-03040800-0000E5BD-BFEBFBFF
CPUID 00000002: 605B5001-00000000-00000000-007C704D
CPUID 00000003: 00000000-00000000-00000000-00000000
CPUID 00000004: 04004121-01C0003F-0000001F-00000000
CPUID 00000004: 04004143-01C0103F-000003FF-00000000
CPUID 00000004: 0400C963-03C0003F-00003FFF-00000000
CPUID 00000005: 00000040-00000040-00000000-00000000
CPUID 00000006: 00000000-00000000-00000000-00000000
CPUID 80000000: 80000008-00000000-00000000-00000000
CPUID 80000001: 00000000-00000000-00000001-20100000
CPUID 80000002: 20202020-20202020-20202020-20202020
CPUID 80000003: 6E492020-286C6574-58202952-286E6F65
CPUID 80000004: 20294D54-20555043-30342E33-007A4847
CPUID 80000005: 00000000-00000000-00000000-00000000
CPUID 80000006: 00000000-00000000-04006040-00000000
CPUID 80000007: 00000000-00000000-00000000-00000000
CPUID 80000008: 00003028-00000000-00000000-00000000
------[ Logical CPU #4 ]------
CPUID 00000000: 00000006-756E6547-6C65746E-49656E69
CPUID 00000001: 00000F68-04040800-0000E5BD-BFEBFBFF
CPUID 00000002: 605B5001-00000000-00000000-007C704D
CPUID 00000003: 00000000-00000000-00000000-00000000
CPUID 00000004: 04004121-01C0003F-0000001F-00000000
CPUID 00000004: 04004143-01C0103F-000003FF-00000000
CPUID 00000004: 0400C963-03C0003F-00003FFF-00000000
CPUID 00000005: 00000040-00000040-00000000-00000000
CPUID 00000006: 00000000-00000000-00000000-00000000
CPUID 80000000: 80000008-00000000-00000000-00000000
CPUID 80000001: 00000000-00000000-00000001-20100000
CPUID 80000002: 20202020-20202020-20202020-20202020
CPUID 80000003: 6E492020-286C6574-58202952-286E6F65
CPUID 80000004: 20294D54-20555043-30342E33-007A4847
CPUID 80000005: 00000000-00000000-00000000-00000000
CPUID 80000006: 00000000-00000000-04006040-00000000
CPUID 80000007: 00000000-00000000-00000000-00000000
CPUID 80000008: 00003028-00000000-00000000-00000000
------[ Logical CPU #5 ]------
CPUID 00000000: 00000006-756E6547-6C65746E-49656E69
CPUID 00000001: 00000F68-05040800-0000E5BD-BFEBFBFF
CPUID 00000002: 605B5001-00000000-00000000-007C704D
CPUID 00000003: 00000000-00000000-00000000-00000000
CPUID 00000004: 04004121-01C0003F-0000001F-00000000
CPUID 00000004: 04004143-01C0103F-000003FF-00000000
CPUID 00000004: 0400C963-03C0003F-00003FFF-00000000
CPUID 00000005: 00000040-00000040-00000000-00000000
CPUID 00000006: 00000000-00000000-00000000-00000000
CPUID 80000000: 80000008-00000000-00000000-00000000
CPUID 80000001: 00000000-00000000-00000001-20100000
CPUID 80000002: 20202020-20202020-20202020-20202020
CPUID 80000003: 6E492020-286C6574-58202952-286E6F65
CPUID 80000004: 20294D54-20555043-30342E33-007A4847
CPUID 80000005: 00000000-00000000-00000000-00000000
CPUID 80000006: 00000000-00000000-04006040-00000000
CPUID 80000007: 00000000-00000000-00000000-00000000
CPUID 80000008: 00003028-00000000-00000000-00000000
------[ Logical CPU #6 ]------
CPUID 00000000: 00000006-756E6547-6C65746E-49656E69
CPUID 00000001: 00000F68-06040800-0000E5BD-BFEBFBFF
CPUID 00000002: 605B5001-00000000-00000000-007C704D
CPUID 00000003: 00000000-00000000-00000000-00000000
CPUID 00000004: 04004121-01C0003F-0000001F-00000000
CPUID 00000004: 04004143-01C0103F-000003FF-00000000
CPUID 00000004: 0400C963-03C0003F-00003FFF-00000000
CPUID 00000005: 00000040-00000040-00000000-00000000
CPUID 00000006: 00000000-00000000-00000000-00000000
CPUID 80000000: 80000008-00000000-00000000-00000000
CPUID 80000001: 00000000-00000000-00000001-20100000
CPUID 80000002: 20202020-20202020-20202020-20202020
CPUID 80000003: 6E492020-286C6574-58202952-286E6F65
CPUID 80000004: 20294D54-20555043-30342E33-007A4847
CPUID 80000005: 00000000-00000000-00000000-00000000
CPUID 80000006: 00000000-00000000-04006040-00000000
CPUID 80000007: 00000000-00000000-00000000-00000000
CPUID 80000008: 00003028-00000000-00000000-00000000
------[ Logical CPU #7 ]------
CPUID 00000000: 00000006-756E6547-6C65746E-49656E69
CPUID 00000001: 00000F68-07040800-0000E5BD-BFEBFBFF
CPUID 00000002: 605B5001-00000000-00000000-007C704D
CPUID 00000003: 00000000-00000000-00000000-00000000
CPUID 00000004: 04004121-01C0003F-0000001F-00000000
CPUID 00000004: 04004143-01C0103F-000003FF-00000000
CPUID 00000004: 0400C963-03C0003F-00003FFF-00000000
CPUID 00000005: 00000040-00000040-00000000-00000000
CPUID 00000006: 00000000-00000000-00000000-00000000
CPUID 80000000: 80000008-00000000-00000000-00000000
CPUID 80000001: 00000000-00000000-00000001-20100000
CPUID 80000002: 20202020-20202020-20202020-20202020
CPUID 80000003: 6E492020-286C6574-58202952-286E6F65
CPUID 80000004: 20294D54-20555043-30342E33-007A4847
CPUID 80000005: 00000000-00000000-00000000-00000000
CPUID 80000006: 00000000-00000000-04006040-00000000
CPUID 80000007: 00000000-00000000-00000000-00000000
--------------------------------------------------------------------------------
x86
x86-64-v1
general
15
6
8
15
6
2
8
-1
-1
-1
-1
-1
-1
-1
-1
-1
-1
-1
-1
-1
-1
-1
-1
-1
-1
-1
-1
64 (non-authoritative)
Xeon (Tulsa)
65 nm
fpu vme de pse tsc msr pae mce cx8 apic mtrr sep pge mca cmov pat pse36 clflush dts acpi mmx fxsr sse sse2 ss ht tm pbe pni dts64 monitor ds_cpl vmx est tm2 cid cx16 xtpr pdcm xd lm lahf_lm
