------[ Logical CPU #0 ]------
CPUID 00000000: 00000005-756E6547-6C65746E-49656E69
CPUID 00000001: 00000F48-00040800-000064BD-BFEBFBFF
CPUID 00000002: 605B5001-00000000-00000000-007C7040
CPUID 00000003: 00000000-00000000-00000000-00000000
CPUID 00000004: 04004121-01C0003F-0000001F-00000000
CPUID 00000004: 04004143-01C0103F-000003FF-00000000
CPUID 00000005: 00000040-00000040-00000000-00000000
CPUID 80000000: 80000008-00000000-00000000-00000000
CPUID 80000001: 00000000-00000000-00000001-20100000
CPUID 80000002: 20202020-20202020-20202020-20202020
CPUID 80000003: 6E492020-286C6574-58202952-286E6F65
CPUID 80000004: 20294D54-20555043-36362E32-007A4847
CPUID 80000005: 00000000-00000000-00000000-00000000
CPUID 80000006: 00000000-00000000-04006040-00000000
CPUID 80000007: 00000000-00000000-00000000-00000000
CPUID 80000008: 00003028-00000000-00000000-00000000
------[ Logical CPU #1 ]------
CPUID 00000000: 00000005-756E6547-6C65746E-49656E69
CPUID 00000001: 00000F48-04040800-000064BD-BFEBFBFF
CPUID 00000002: 605B5001-00000000-00000000-007C7040
CPUID 00000003: 00000000-00000000-00000000-00000000
CPUID 00000004: 04004121-01C0003F-0000001F-00000000
CPUID 00000004: 04004143-01C0103F-000003FF-00000000
CPUID 00000005: 00000040-00000040-00000000-00000000
CPUID 80000000: 80000008-00000000-00000000-00000000
CPUID 80000001: 00000000-00000000-00000001-20100000
CPUID 80000002: 20202020-20202020-20202020-20202020
CPUID 80000003: 6E492020-286C6574-58202952-286E6F65
CPUID 80000004: 20294D54-20555043-36362E32-007A4847
CPUID 80000005: 00000000-00000000-00000000-00000000
CPUID 80000006: 00000000-00000000-04006040-00000000
CPUID 80000007: 00000000-00000000-00000000-00000000
CPUID 80000008: 00003028-00000000-00000000-00000000
------[ Logical CPU #2 ]------
CPUID 00000000: 00000005-756E6547-6C65746E-49656E69
CPUID 00000001: 00000F48-0C040800-000064BD-BFEBFBFF
CPUID 00000002: 605B5001-00000000-00000000-007C7040
CPUID 00000003: 00000000-00000000-00000000-00000000
CPUID 00000004: 04004121-01C0003F-0000001F-00000000
CPUID 00000004: 04004143-01C0103F-000003FF-00000000
CPUID 00000005: 00000040-00000040-00000000-00000000
CPUID 80000000: 80000008-00000000-00000000-00000000
CPUID 80000001: 00000000-00000000-00000001-20100000
CPUID 80000002: 20202020-20202020-20202020-20202020
CPUID 80000003: 6E492020-286C6574-58202952-286E6F65
CPUID 80000004: 20294D54-20555043-36362E32-007A4847
CPUID 80000005: 00000000-00000000-00000000-00000000
CPUID 80000006: 00000000-00000000-04006040-00000000
CPUID 80000007: 00000000-00000000-00000000-00000000
CPUID 80000008: 00003028-00000000-00000000-00000000
------[ Logical CPU #3 ]------
CPUID 00000000: 00000005-756E6547-6C65746E-49656E69
CPUID 00000001: 00000F48-08040800-000064BD-BFEBFBFF
CPUID 00000002: 605B5001-00000000-00000000-007C7040
CPUID 00000003: 00000000-00000000-00000000-00000000
CPUID 00000004: 04004121-01C0003F-0000001F-00000000
CPUID 00000004: 04004143-01C0103F-000003FF-00000000
CPUID 00000005: 00000040-00000040-00000000-00000000
CPUID 80000000: 80000008-00000000-00000000-00000000
CPUID 80000001: 00000000-00000000-00000001-20100000
CPUID 80000002: 20202020-20202020-20202020-20202020
CPUID 80000003: 6E492020-286C6574-58202952-286E6F65
CPUID 80000004: 20294D54-20555043-36362E32-007A4847
CPUID 80000005: 00000000-00000000-00000000-00000000
CPUID 80000006: 00000000-00000000-04006040-00000000
CPUID 80000007: 00000000-00000000-00000000-00000000
CPUID 80000008: 00003028-00000000-00000000-00000000
------[ Logical CPU #4 ]------
CPUID 00000000: 00000005-756E6547-6C65746E-49656E69
CPUID 00000001: 00000F48-02040800-000064BD-BFEBFBFF
CPUID 00000002: 605B5001-00000000-00000000-007C7040
CPUID 00000003: 00000000-00000000-00000000-00000000
CPUID 00000004: 04004121-01C0003F-0000001F-00000000
CPUID 00000004: 04004143-01C0103F-000003FF-00000000
CPUID 00000005: 00000040-00000040-00000000-00000000
CPUID 80000000: 80000008-00000000-00000000-00000000
CPUID 80000001: 00000000-00000000-00000001-20100000
CPUID 80000002: 20202020-20202020-20202020-20202020
CPUID 80000003: 6E492020-286C6574-58202952-286E6F65
CPUID 80000004: 20294D54-20555043-36362E32-007A4847
CPUID 80000005: 00000000-00000000-00000000-00000000
CPUID 80000006: 00000000-00000000-04006040-00000000
CPUID 80000007: 00000000-00000000-00000000-00000000
CPUID 80000008: 00003028-00000000-00000000-00000000
------[ Logical CPU #5 ]------
CPUID 00000000: 00000005-756E6547-6C65746E-49656E69
CPUID 00000001: 00000F48-06040800-000064BD-BFEBFBFF
CPUID 00000002: 605B5001-00000000-00000000-007C7040
CPUID 00000003: 00000000-00000000-00000000-00000000
CPUID 00000004: 04004121-01C0003F-0000001F-00000000
CPUID 00000004: 04004143-01C0103F-000003FF-00000000
CPUID 00000005: 00000040-00000040-00000000-00000000
CPUID 80000000: 80000008-00000000-00000000-00000000
CPUID 80000001: 00000000-00000000-00000001-20100000
CPUID 80000002: 20202020-20202020-20202020-20202020
CPUID 80000003: 6E492020-286C6574-58202952-286E6F65
CPUID 80000004: 20294D54-20555043-36362E32-007A4847
CPUID 80000005: 00000000-00000000-00000000-00000000
CPUID 80000006: 00000000-00000000-04006040-00000000
CPUID 80000007: 00000000-00000000-00000000-00000000
CPUID 80000008: 00003028-00000000-00000000-00000000
------[ Logical CPU #6 ]------
CPUID 00000000: 00000005-756E6547-6C65746E-49656E69
CPUID 00000001: 00000F48-0E040800-000064BD-BFEBFBFF
CPUID 00000002: 605B5001-00000000-00000000-007C7040
CPUID 00000003: 00000000-00000000-00000000-00000000
CPUID 00000004: 04004121-01C0003F-0000001F-00000000
CPUID 00000004: 04004143-01C0103F-000003FF-00000000
CPUID 00000005: 00000040-00000040-00000000-00000000
CPUID 80000000: 80000008-00000000-00000000-00000000
CPUID 80000001: 00000000-00000000-00000001-20100000
CPUID 80000002: 20202020-20202020-20202020-20202020
CPUID 80000003: 6E492020-286C6574-58202952-286E6F65
CPUID 80000004: 20294D54-20555043-36362E32-007A4847
CPUID 80000005: 00000000-00000000-00000000-00000000
CPUID 80000006: 00000000-00000000-04006040-00000000
CPUID 80000007: 00000000-00000000-00000000-00000000
CPUID 80000008: 00003028-00000000-00000000-00000000
------[ Logical CPU #7 ]------
CPUID 00000000: 00000005-756E6547-6C65746E-49656E69
CPUID 00000001: 00000F48-0A040800-000064BD-BFEBFBFF
CPUID 00000002: 605B5001-00000000-00000000-007C7040
CPUID 00000003: 00000000-00000000-00000000-00000000
CPUID 00000004: 04004121-01C0003F-0000001F-00000000
CPUID 00000004: 04004143-01C0103F-000003FF-00000000
CPUID 00000005: 00000040-00000040-00000000-00000000
CPUID 80000000: 80000008-00000000-00000000-00000000
CPUID 80000001: 00000000-00000000-00000001-20100000
CPUID 80000002: 20202020-20202020-20202020-20202020
CPUID 80000003: 6E492020-286C6574-58202952-286E6F65
CPUID 80000004: 20294D54-20555043-36362E32-007A4847
CPUID 80000005: 00000000-00000000-00000000-00000000
CPUID 80000006: 00000000-00000000-04006040-00000000
CPUID 80000007: 00000000-00000000-00000000-00000000
CPUID 80000008: 00003028-00000000-00000000-00000000
------[ Logical CPU #8 ]------
CPUID 00000000: 00000005-756E6547-6C65746E-49656E69
CPUID 00000001: 00000F48-01040800-000064BD-BFEBFBFF
CPUID 00000002: 605B5001-00000000-00000000-007C7040
CPUID 00000003: 00000000-00000000-00000000-00000000
CPUID 00000004: 04004121-01C0003F-0000001F-00000000
CPUID 00000004: 04004143-01C0103F-000003FF-00000000
CPUID 00000005: 00000040-00000040-00000000-00000000
CPUID 80000000: 80000008-00000000-00000000-00000000
CPUID 80000001: 00000000-00000000-00000001-20100000
CPUID 80000002: 20202020-20202020-20202020-20202020
CPUID 80000003: 6E492020-286C6574-58202952-286E6F65
CPUID 80000004: 20294D54-20555043-36362E32-007A4847
CPUID 80000005: 00000000-00000000-00000000-00000000
CPUID 80000006: 00000000-00000000-04006040-00000000
CPUID 80000007: 00000000-00000000-00000000-00000000
CPUID 80000008: 00003028-00000000-00000000-00000000
------[ Logical CPU #9 ]------
CPUID 00000000: 00000005-756E6547-6C65746E-49656E69
CPUID 00000001: 00000F48-05040800-000064BD-BFEBFBFF
CPUID 00000002: 605B5001-00000000-00000000-007C7040
CPUID 00000003: 00000000-00000000-00000000-00000000
CPUID 00000004: 04004121-01C0003F-0000001F-00000000
CPUID 00000004: 04004143-01C0103F-000003FF-00000000
CPUID 00000005: 00000040-00000040-00000000-00000000
CPUID 80000000: 80000008-00000000-00000000-00000000
CPUID 80000001: 00000000-00000000-00000001-20100000
CPUID 80000002: 20202020-20202020-20202020-20202020
CPUID 80000003: 6E492020-286C6574-58202952-286E6F65
CPUID 80000004: 20294D54-20555043-36362E32-007A4847
CPUID 80000005: 00000000-00000000-00000000-00000000
CPUID 80000006: 00000000-00000000-04006040-00000000
CPUID 80000007: 00000000-00000000-00000000-00000000
CPUID 80000008: 00003028-00000000-00000000-00000000
------[ Logical CPU #10 ]------
CPUID 00000000: 00000005-756E6547-6C65746E-49656E69
CPUID 00000001: 00000F48-0D040800-000064BD-BFEBFBFF
CPUID 00000002: 605B5001-00000000-00000000-007C7040
CPUID 00000003: 00000000-00000000-00000000-00000000
CPUID 00000004: 04004121-01C0003F-0000001F-00000000
CPUID 00000004: 04004143-01C0103F-000003FF-00000000
CPUID 00000005: 00000040-00000040-00000000-00000000
CPUID 80000000: 80000008-00000000-00000000-00000000
CPUID 80000001: 00000000-00000000-00000001-20100000
CPUID 80000002: 20202020-20202020-20202020-20202020
CPUID 80000003: 6E492020-286C6574-58202952-286E6F65
CPUID 80000004: 20294D54-20555043-36362E32-007A4847
CPUID 80000005: 00000000-00000000-00000000-00000000
CPUID 80000006: 00000000-00000000-04006040-00000000
CPUID 80000007: 00000000-00000000-00000000-00000000
CPUID 80000008: 00003028-00000000-00000000-00000000
------[ Logical CPU #11 ]------
CPUID 00000000: 00000005-756E6547-6C65746E-49656E69
CPUID 00000001: 00000F48-09040800-000064BD-BFEBFBFF
CPUID 00000002: 605B5001-00000000-00000000-007C7040
CPUID 00000003: 00000000-00000000-00000000-00000000
CPUID 00000004: 04004121-01C0003F-0000001F-00000000
CPUID 00000004: 04004143-01C0103F-000003FF-00000000
CPUID 00000005: 00000040-00000040-00000000-00000000
CPUID 80000000: 80000008-00000000-00000000-00000000
CPUID 80000001: 00000000-00000000-00000001-20100000
CPUID 80000002: 20202020-20202020-20202020-20202020
CPUID 80000003: 6E492020-286C6574-58202952-286E6F65
CPUID 80000004: 20294D54-20555043-36362E32-007A4847
CPUID 80000005: 00000000-00000000-00000000-00000000
CPUID 80000006: 00000000-00000000-04006040-00000000
CPUID 80000007: 00000000-00000000-00000000-00000000
CPUID 80000008: 00003028-00000000-00000000-00000000
------[ Logical CPU #12 ]------
CPUID 00000000: 00000005-756E6547-6C65746E-49656E69
CPUID 00000001: 00000F48-03040800-000064BD-BFEBFBFF
CPUID 00000002: 605B5001-00000000-00000000-007C7040
CPUID 00000003: 00000000-00000000-00000000-00000000
CPUID 00000004: 04004121-01C0003F-0000001F-00000000
CPUID 00000004: 04004143-01C0103F-000003FF-00000000
CPUID 00000005: 00000040-00000040-00000000-00000000
CPUID 80000000: 80000008-00000000-00000000-00000000
CPUID 80000001: 00000000-00000000-00000001-20100000
CPUID 80000002: 20202020-20202020-20202020-20202020
CPUID 80000003: 6E492020-286C6574-58202952-286E6F65
CPUID 80000004: 20294D54-20555043-36362E32-007A4847
CPUID 80000005: 00000000-00000000-00000000-00000000
CPUID 80000006: 00000000-00000000-04006040-00000000
CPUID 80000007: 00000000-00000000-00000000-00000000
CPUID 80000008: 00003028-00000000-00000000-00000000
------[ Logical CPU #13 ]------
CPUID 00000000: 00000005-756E6547-6C65746E-49656E69
CPUID 00000001: 00000F48-07040800-000064BD-BFEBFBFF
CPUID 00000002: 605B5001-00000000-00000000-007C7040
CPUID 00000003: 00000000-00000000-00000000-00000000
CPUID 00000004: 04004121-01C0003F-0000001F-00000000
CPUID 00000004: 04004143-01C0103F-000003FF-00000000
CPUID 00000005: 00000040-00000040-00000000-00000000
CPUID 80000000: 80000008-00000000-00000000-00000000
CPUID 80000001: 00000000-00000000-00000001-20100000
CPUID 80000002: 20202020-20202020-20202020-20202020
CPUID 80000003: 6E492020-286C6574-58202952-286E6F65
CPUID 80000004: 20294D54-20555043-36362E32-007A4847
CPUID 80000005: 00000000-00000000-00000000-00000000
CPUID 80000006: 00000000-00000000-04006040-00000000
CPUID 80000007: 00000000-00000000-00000000-00000000
CPUID 80000008: 00003028-00000000-00000000-00000000
------[ Logical CPU #14 ]------
CPUID 00000000: 00000005-756E6547-6C65746E-49656E69
CPUID 00000001: 00000F48-0F040800-000064BD-BFEBFBFF
CPUID 00000002: 605B5001-00000000-00000000-007C7040
CPUID 00000003: 00000000-00000000-00000000-00000000
CPUID 00000004: 04004121-01C0003F-0000001F-00000000
CPUID 00000004: 04004143-01C0103F-000003FF-00000000
CPUID 00000005: 00000040-00000040-00000000-00000000
CPUID 80000000: 80000008-00000000-00000000-00000000
CPUID 80000001: 00000000-00000000-00000001-20100000
CPUID 80000002: 20202020-20202020-20202020-20202020
CPUID 80000003: 6E492020-286C6574-58202952-286E6F65
CPUID 80000004: 20294D54-20555043-36362E32-007A4847
CPUID 80000005: 00000000-00000000-00000000-00000000
CPUID 80000006: 00000000-00000000-04006040-00000000
CPUID 80000007: 00000000-00000000-00000000-00000000
CPUID 80000008: 00003028-00000000-00000000-00000000
------[ Logical CPU #15 ]------
CPUID 00000000: 00000005-756E6547-6C65746E-49656E69
CPUID 00000001: 00000F48-0B040800-000064BD-BFEBFBFF
CPUID 00000002: 605B5001-00000000-00000000-007C7040
CPUID 00000003: 00000000-00000000-00000000-00000000
CPUID 00000004: 04004121-01C0003F-0000001F-00000000
CPUID 00000004: 04004143-01C0103F-000003FF-00000000
CPUID 00000005: 00000040-00000040-00000000-00000000
CPUID 80000000: 80000008-00000000-00000000-00000000
CPUID 80000001: 00000000-00000000-00000001-20100000
CPUID 80000002: 20202020-20202020-20202020-20202020
CPUID 80000003: 6E492020-286C6574-58202952-286E6F65
CPUID 80000004: 20294D54-20555043-36362E32-007A4847
CPUID 80000005: 00000000-00000000-00000000-00000000
CPUID 80000006: 00000000-00000000-04006040-00000000
CPUID 80000007: 00000000-00000000-00000000-00000000
--------------------------------------------------------------------------------
x86
x86-64-v1
general
15
4
8
15
4
2
16
-1
-1
-1
-1
-1
-1
-1
-1
-1
-1
-1
-1
-1
-1
-1
-1
-1
-1
-1
-1
64 (non-authoritative)
Xeon (Paxville)
90 nm
fpu vme de pse tsc msr pae mce cx8 apic mtrr sep pge mca cmov pat pse36 clflush dts acpi mmx fxsr sse sse2 ss ht tm pbe pni dts64 monitor ds_cpl vmx est cid cx16 xtpr xd lm lahf_lm
