------[ Logical CPU #0 ]------
CPUID 00000000: 00000005-756E6547-6C65746E-49656E69
CPUID 00000001: 00000F41-00010800-0000651D-BFEBFBFF
CPUID 00000002: 605B5101-00000000-00000000-003C7040
CPUID 00000003: 00000000-00000000-00000000-00000000
CPUID 00000004: 00000121-01C0003F-0000001F-00000000
CPUID 00000004: 00000143-00C0103F-000001FF-00000000
CPUID 00000005: 00000040-00000040-00000000-00000000
CPUID 80000000: 80000008-00000000-00000000-00000000
CPUID 80000001: 00000000-00000000-00000000-20100000
CPUID 80000002: 20202020-20202020-20202020-20202020
CPUID 80000003: 65746E49-2952286C-6C654320-6E6F7265
CPUID 80000004: 20295228-20555043-33352E32-007A4847
CPUID 80000005: 00000000-00000000-00000000-00000000
CPUID 80000006: 00000000-00000000-01004040-00000000
CPUID 80000007: 00000000-00000000-00000000-00000000
CPUID 80000008: 00003024-00000000-00000000-00000000
--------------------------------------------------------------------------------
x86
x86-64-v1
general
15
4
1
15
4
1
1
-1
-1
-1
-1
-1
-1
-1
-1
-1
-1
-1
-1
-1
-1
-1
-1
-1
-1
-1
-1
64 (non-authoritative)
P-4 Celeron D (Prescott)
90 nm
fpu vme de pse tsc msr pae mce cx8 apic mtrr sep pge mca cmov pat pse36 clflush dts acpi mmx fxsr sse sse2 ss tm pbe pni dts64 monitor ds_cpl tm2 cid cx16 xtpr xd lm
