------[ CPUID Registers / Logical CPU #0 ]------
CPUID 00000000: 00000020-756E6547-6C65746E-49656E69 [GenuineIntel]
CPUID 00000001: 000906A4-00400800-7FFAFBBF-BFEBFBFF
CPUID 00000002: 00FEFF01-000000F0-00000000-00000000
CPUID 00000003: 00000000-00000000-00000000-00000000
CPUID 00000004: 7C004121-02C0003F-0000003F-00000000 [SL 00] [L1D: 48 KB]
CPUID 00000004: 7C004122-01C0003F-0000003F-00000000 [SL 01] [L1I: 32 KB]
CPUID 00000004: 7C01C143-0240003F-000007FF-00000000 [SL 02] [L2U: 1280 KB]
CPUID 00000004: 7C0FC163-01C0003F-00003FFF-00000004 [SL 03] [L3U: 8 MB]
CPUID 00000005: 00000040-00000040-00000003-10102020
CPUID 00000006: 00DF8FF7-00000002-00000409-00000003
CPUID 00000007: 00000002-239C27EB-984007AC-FC18C410 [SL 00]
CPUID 00000007: 00400810-00000000-00000000-00000000 [SL 01]
CPUID 00000007: 00000000-00000000-00000000-00000017 [SL 02]
CPUID 00000008: 00000000-00000000-00000000-00000000
CPUID 00000009: 00000000-00000000-00000000-00000000
CPUID 0000000A: 07300605-00000000-00000007-00008603
CPUID 0000000B: 00000001-00000002-00000100-00000000 [SL 00]
CPUID 0000000B: 00000006-00000006-00000201-00000000 [SL 01]
CPUID 0000000C: 00000000-00000000-00000000-00000000
CPUID 0000000D: 00000207-00000340-00000A88-00000000 [SL 00] [x87]
CPUID 0000000D: 0000000F-000003D0-00019900-00000000 [SL 01] [SSE]
CPUID 0000000D: 00000100-00000240-00000000-00000000 [SL 02] [AVX]
CPUID 0000000D: 00000080-00000000-00000001-00000000 [SL 08] [PT]
CPUID 0000000D: 00000008-00000A80-00000000-00000000 [SL 09] [PKRU]
CPUID 0000000D: 00000010-00000000-00000001-00000000 [SL 0B]
CPUID 0000000D: 00000018-00000000-00000001-00000000 [SL 0C]
CPUID 0000000D: 00000328-00000000-00000001-00000000 [SL 0F]
CPUID 0000000D: 00000008-00000000-00000001-00000000 [SL 10]
CPUID 0000000E: 00000000-00000000-00000000-00000000
CPUID 0000000F: 00000000-00000000-00000000-00000000 [SL 00]
CPUID 0000000F: 00000000-00000000-00000000-00000000 [SL 01]
CPUID 00000010: 00000000-00000000-00000000-00000000 [SL 00]
CPUID 00000010: 00000000-00000000-00000000-00000000 [SL 01]
CPUID 00000011: 00000000-00000000-00000000-00000000
CPUID 00000012: 00000000-00000000-00000000-00000000 [SL 00]
CPUID 00000012: 00000000-00000000-00000000-00000000 [SL 01]
CPUID 00000013: 00000000-00000000-00000000-00000000
CPUID 00000014: 00000001-0000005F-00000007-00000000 [SL 00]
CPUID 00000014: 02490002-003F003F-00000000-00000000 [SL 01]
CPUID 00000015: 00000002-00000082-0249F000-00000000 [65.00x / 38400000]
CPUID 00000016: 000009C4-00001130-00000064-00000000 [2500 / 4400 / 100]
CPUID 00000017: 00000000-00000000-00000000-00000000 [SL 00]
CPUID 00000018: 00000008-00000000-00000000-00000000 [SL 00]
CPUID 00000018: 00000000-00080001-00000020-00004022 [SL 01]
CPUID 00000018: 00000000-00080006-00000004-00004022 [SL 02]
CPUID 00000018: 00000000-0010000F-00000001-00004125 [SL 03]
CPUID 00000018: 00000000-00040001-00000010-00004024 [SL 04]
CPUID 00000018: 00000000-00040006-00000008-00004024 [SL 05]
CPUID 00000018: 00000000-00080008-00000001-00004124 [SL 06]
CPUID 00000018: 00000000-00080007-00000080-00004043 [SL 07]
CPUID 00000018: 00000000-00080009-00000080-00004043 [SL 08]
CPUID 00000019: 00000000-00000000-00000000-00000000
CPUID 0000001A: 40000001-00000000-00000000-00000000 [Core]
CPUID 0000001B: 00000000-00000000-00000000-00000000
CPUID 0000001C: 4000000B-00000007-00000007-00000000
CPUID 0000001D: 00000000-00000000-00000000-00000000 [SL 00]
CPUID 0000001E: 00000000-00000000-00000000-00000000 [SL 00]
CPUID 0000001F: 00000001-00000002-00000100-00000000 [SL 00]
CPUID 0000001F: 00000006-00000006-00000201-00000000 [SL 01]
CPUID 00000020: 00000000-00000001-00000000-00000000 [SL 00]
CPUID 80000000: 80000008-00000000-00000000-00000000
CPUID 80000001: 00000000-00000000-00000121-2C100000
CPUID 80000002: 65746E49-2952286C-6E655020-6D756974 [Intel(R) Pentium]
CPUID 80000003: 20295228-646C6F47-30353820-00000035 [(R) Gold 8505]
CPUID 80000004: 00000000-00000000-00000000-00000000 []
CPUID 80000005: 00000000-00000000-00000000-00000000 [L1D: 0 KB / L1I: 0 KB]
CPUID 80000006: 00000000-00000000-05007040-00000000 [L2: 1280 KB] / L3: 0 KB]
CPUID 80000007: 00000000-00000000-00000000-00000100
CPUID 80000008: 00003027-00000000-00000000-00000000
------[ CPUID Registers / Logical CPU #1 ]------
CPUID 00000000: 00000020-756E6547-6C65746E-49656E69 [GenuineIntel]
CPUID 00000001: 000906A4-01400800-7FFAFBBF-BFEBFBFF
CPUID 00000002: 00FEFF01-000000F0-00000000-00000000
CPUID 00000003: 00000000-00000000-00000000-00000000
CPUID 00000004: 7C004121-02C0003F-0000003F-00000000 [SL 00] [L1D: 48 KB]
CPUID 00000004: 7C004122-01C0003F-0000003F-00000000 [SL 01] [L1I: 32 KB]
CPUID 00000004: 7C01C143-0240003F-000007FF-00000000 [SL 02] [L2U: 1280 KB]
CPUID 00000004: 7C0FC163-01C0003F-00003FFF-00000004 [SL 03] [L3U: 8 MB]
CPUID 00000005: 00000040-00000040-00000003-10102020
CPUID 00000006: 00DF8FF7-00000002-00000409-00000003
CPUID 00000007: 00000002-239C27EB-984007AC-FC18C410 [SL 00]
CPUID 00000007: 00400810-00000000-00000000-00000000 [SL 01]
CPUID 00000007: 00000000-00000000-00000000-00000017 [SL 02]
CPUID 00000008: 00000000-00000000-00000000-00000000
CPUID 00000009: 00000000-00000000-00000000-00000000
CPUID 0000000A: 07300605-00000000-00000007-00008603
CPUID 0000000B: 00000001-00000002-00000100-00000001 [SL 00]
CPUID 0000000B: 00000006-00000006-00000201-00000001 [SL 01]
CPUID 0000000C: 00000000-00000000-00000000-00000000
CPUID 0000000D: 00000207-00000340-00000A88-00000000 [SL 00] [x87]
CPUID 0000000D: 0000000F-000003D0-00019900-00000000 [SL 01] [SSE]
CPUID 0000000D: 00000100-00000240-00000000-00000000 [SL 02] [AVX]
CPUID 0000000D: 00000080-00000000-00000001-00000000 [SL 08] [PT]
CPUID 0000000D: 00000008-00000A80-00000000-00000000 [SL 09] [PKRU]
CPUID 0000000D: 00000010-00000000-00000001-00000000 [SL 0B]
CPUID 0000000D: 00000018-00000000-00000001-00000000 [SL 0C]
CPUID 0000000D: 00000328-00000000-00000001-00000000 [SL 0F]
CPUID 0000000D: 00000008-00000000-00000001-00000000 [SL 10]
CPUID 0000000E: 00000000-00000000-00000000-00000000
CPUID 0000000F: 00000000-00000000-00000000-00000000 [SL 00]
CPUID 0000000F: 00000000-00000000-00000000-00000000 [SL 01]
CPUID 00000010: 00000000-00000000-00000000-00000000 [SL 00]
CPUID 00000010: 00000000-00000000-00000000-00000000 [SL 01]
CPUID 00000011: 00000000-00000000-00000000-00000000
CPUID 00000012: 00000000-00000000-00000000-00000000 [SL 00]
CPUID 00000012: 00000000-00000000-00000000-00000000 [SL 01]
CPUID 00000013: 00000000-00000000-00000000-00000000
CPUID 00000014: 00000001-0000005F-00000007-00000000 [SL 00]
CPUID 00000014: 02490002-003F003F-00000000-00000000 [SL 01]
CPUID 00000015: 00000002-00000082-0249F000-00000000 [65.00x / 38400000]
CPUID 00000016: 000009C4-00001130-00000064-00000000 [2500 / 4400 / 100]
CPUID 00000017: 00000000-00000000-00000000-00000000 [SL 00]
CPUID 00000018: 00000008-00000000-00000000-00000000 [SL 00]
CPUID 00000018: 00000000-00080001-00000020-00004022 [SL 01]
CPUID 00000018: 00000000-00080006-00000004-00004022 [SL 02]
CPUID 00000018: 00000000-0010000F-00000001-00004125 [SL 03]
CPUID 00000018: 00000000-00040001-00000010-00004024 [SL 04]
CPUID 00000018: 00000000-00040006-00000008-00004024 [SL 05]
CPUID 00000018: 00000000-00080008-00000001-00004124 [SL 06]
CPUID 00000018: 00000000-00080007-00000080-00004043 [SL 07]
CPUID 00000018: 00000000-00080009-00000080-00004043 [SL 08]
CPUID 00000019: 00000000-00000000-00000000-00000000
CPUID 0000001A: 40000001-00000000-00000000-00000000 [Core]
CPUID 0000001B: 00000000-00000000-00000000-00000000
CPUID 0000001C: 4000000B-00000007-00000007-00000000
CPUID 0000001D: 00000000-00000000-00000000-00000000 [SL 00]
CPUID 0000001E: 00000000-00000000-00000000-00000000 [SL 00]
CPUID 0000001F: 00000001-00000002-00000100-00000001 [SL 00]
CPUID 0000001F: 00000006-00000006-00000201-00000001 [SL 01]
CPUID 00000020: 00000000-00000001-00000000-00000000 [SL 00]
CPUID 80000000: 80000008-00000000-00000000-00000000
CPUID 80000001: 00000000-00000000-00000121-2C100000
CPUID 80000002: 65746E49-2952286C-6E655020-6D756974 [Intel(R) Pentium]
CPUID 80000003: 20295228-646C6F47-30353820-00000035 [(R) Gold 8505]
CPUID 80000004: 00000000-00000000-00000000-00000000 []
CPUID 80000005: 00000000-00000000-00000000-00000000 [L1D: 0 KB / L1I: 0 KB]
CPUID 80000006: 00000000-00000000-05007040-00000000 [L2: 1280 KB] / L3: 0 KB]
CPUID 80000007: 00000000-00000000-00000000-00000100
CPUID 80000008: 00003027-00000000-00000000-00000000
------[ CPUID Registers / Logical CPU #2 ]------
CPUID 00000000: 00000020-756E6547-6C65746E-49656E69 [GenuineIntel]
CPUID 00000001: 000906A4-10400800-7FFAFBBF-BFEBFBFF
CPUID 00000002: 00FEFF01-00000000-00000000-00000000
CPUID 00000003: 00000000-00000000-00000000-00000000
CPUID 00000004: 7C004121-01C0003F-0000003F-00000000 [SL 00] [L1D: 32 KB]
CPUID 00000004: 7C004122-01C0003F-0000007F-00000000 [SL 01] [L1I: 64 KB]
CPUID 00000004: 7C01C143-03C0003F-000007FF-00000000 [SL 02] [L2U: 2 MB]
CPUID 00000004: 7C0FC163-01C0003F-00003FFF-00000004 [SL 03] [L3U: 8 MB]
CPUID 00000005: 00000040-00000040-00000003-10102020
CPUID 00000006: 00DF8FF7-00000002-00000409-00020003
CPUID 00000007: 00000002-239C27EB-984007AC-FC18C410 [SL 00]
CPUID 00000007: 00400810-00000000-00000000-00000000 [SL 01]
CPUID 00000007: 00000000-00000000-00000000-00000017 [SL 02]
CPUID 00000008: 00000000-00000000-00000000-00000000
CPUID 00000009: 00000000-00000000-00000000-00000000
CPUID 0000000A: 07300605-00000000-00000007-00008603
CPUID 0000000B: 00000001-00000001-00000100-00000010 [SL 00]
CPUID 0000000B: 00000006-00000006-00000201-00000010 [SL 01]
CPUID 0000000C: 00000000-00000000-00000000-00000000
CPUID 0000000D: 00000207-00000340-00000A88-00000000 [SL 00] [x87]
CPUID 0000000D: 0000000F-000003D0-00019900-00000000 [SL 01] [SSE]
CPUID 0000000D: 00000100-00000240-00000000-00000000 [SL 02] [AVX]
CPUID 0000000D: 00000080-00000000-00000001-00000000 [SL 08] [PT]
CPUID 0000000D: 00000008-00000A80-00000000-00000000 [SL 09] [PKRU]
CPUID 0000000D: 00000010-00000000-00000001-00000000 [SL 0B]
CPUID 0000000D: 00000018-00000000-00000001-00000000 [SL 0C]
CPUID 0000000D: 00000328-00000000-00000001-00000000 [SL 0F]
CPUID 0000000D: 00000008-00000000-00000001-00000000 [SL 10]
CPUID 0000000E: 00000000-00000000-00000000-00000000
CPUID 0000000F: 00000000-00000000-00000000-00000000 [SL 00]
CPUID 0000000F: 00000000-00000000-00000000-00000000 [SL 01]
CPUID 00000010: 00000000-00000000-00000000-00000000 [SL 00]
CPUID 00000010: 00000000-00000000-00000000-00000000 [SL 01]
CPUID 00000011: 00000000-00000000-00000000-00000000
CPUID 00000012: 00000000-00000000-00000000-00000000 [SL 00]
CPUID 00000012: 00000000-00000000-00000000-00000000 [SL 01]
CPUID 00000013: 00000000-00000000-00000000-00000000
CPUID 00000014: 00000001-0000005F-80000007-00000000 [SL 00]
CPUID 00000014: 02490002-003F003F-00000000-00000000 [SL 01]
CPUID 00000015: 00000002-00000082-0249F000-00000000 [65.00x / 38400000]
CPUID 00000016: 000009C4-00000CE4-00000064-00000000 [2500 / 3300 / 100]
CPUID 00000017: 00000000-00000000-00000000-00000000 [SL 00]
CPUID 00000018: 00000004-00000000-00000000-00000000 [SL 00]
CPUID 00000018: 00000000-00300001-00000001-00000121 [SL 01]
CPUID 00000018: 00000000-00040003-00000200-00000043 [SL 02]
CPUID 00000018: 00000000-00400001-00000001-00000122 [SL 03]
CPUID 00000018: 00000000-00080008-00000001-00000143 [SL 04]
CPUID 00000019: 00000000-00000000-00000000-00000000
CPUID 0000001A: 20000001-00000000-00000000-00000000 [Atom]
CPUID 0000001B: 00000000-00000000-00000000-00000000
CPUID 0000001C: C000000B-00000007-00000007-00000000
CPUID 0000001D: 00000000-00000000-00000000-00000000 [SL 00]
CPUID 0000001E: 00000000-00000000-00000000-00000000 [SL 00]
CPUID 0000001F: 00000001-00000001-00000100-00000010 [SL 00]
CPUID 0000001F: 00000006-00000006-00000201-00000010 [SL 01]
CPUID 00000020: 00000000-00000001-00000000-00000000 [SL 00]
CPUID 80000000: 80000008-00000000-00000000-00000000
CPUID 80000001: 00000000-00000000-00000121-2C100000
CPUID 80000002: 65746E49-2952286C-6E655020-6D756974 [Intel(R) Pentium]
CPUID 80000003: 20295228-646C6F47-30353820-00000035 [(R) Gold 8505]
CPUID 80000004: 00000000-00000000-00000000-00000000 []
CPUID 80000005: 00000000-00000000-00000000-00000000 [L1D: 0 KB / L1I: 0 KB]
CPUID 80000006: 00000000-00000000-08008040-00000000 [L2: 2048 KB] / L3: 0 KB]
CPUID 80000007: 00000000-00000000-00000000-00000100
CPUID 80000008: 00003027-00000000-00000000-00000000
------[ CPUID Registers / Logical CPU #3 ]------
CPUID 00000000: 00000020-756E6547-6C65746E-49656E69 [GenuineIntel]
CPUID 00000001: 000906A4-12400800-7FFAFBBF-BFEBFBFF
CPUID 00000002: 00FEFF01-00000000-00000000-00000000
CPUID 00000003: 00000000-00000000-00000000-00000000
CPUID 00000004: 7C004121-01C0003F-0000003F-00000000 [SL 00] [L1D: 32 KB]
CPUID 00000004: 7C004122-01C0003F-0000007F-00000000 [SL 01] [L1I: 64 KB]
CPUID 00000004: 7C01C143-03C0003F-000007FF-00000000 [SL 02] [L2U: 2 MB]
CPUID 00000004: 7C0FC163-01C0003F-00003FFF-00000004 [SL 03] [L3U: 8 MB]
CPUID 00000005: 00000040-00000040-00000003-10102020
CPUID 00000006: 00DF8FF7-00000002-00000409-00020003
CPUID 00000007: 00000002-239C27EB-984007AC-FC18C410 [SL 00]
CPUID 00000007: 00400810-00000000-00000000-00000000 [SL 01]
CPUID 00000007: 00000000-00000000-00000000-00000017 [SL 02]
CPUID 00000008: 00000000-00000000-00000000-00000000
CPUID 00000009: 00000000-00000000-00000000-00000000
CPUID 0000000A: 07300605-00000000-00000007-00008603
CPUID 0000000B: 00000001-00000001-00000100-00000012 [SL 00]
CPUID 0000000B: 00000006-00000006-00000201-00000012 [SL 01]
CPUID 0000000C: 00000000-00000000-00000000-00000000
CPUID 0000000D: 00000207-00000340-00000A88-00000000 [SL 00] [x87]
CPUID 0000000D: 0000000F-000003D0-00019900-00000000 [SL 01] [SSE]
CPUID 0000000D: 00000100-00000240-00000000-00000000 [SL 02] [AVX]
CPUID 0000000D: 00000080-00000000-00000001-00000000 [SL 08] [PT]
CPUID 0000000D: 00000008-00000A80-00000000-00000000 [SL 09] [PKRU]
CPUID 0000000D: 00000010-00000000-00000001-00000000 [SL 0B]
CPUID 0000000D: 00000018-00000000-00000001-00000000 [SL 0C]
CPUID 0000000D: 00000328-00000000-00000001-00000000 [SL 0F]
CPUID 0000000D: 00000008-00000000-00000001-00000000 [SL 10]
CPUID 0000000E: 00000000-00000000-00000000-00000000
CPUID 0000000F: 00000000-00000000-00000000-00000000 [SL 00]
CPUID 0000000F: 00000000-00000000-00000000-00000000 [SL 01]
CPUID 00000010: 00000000-00000000-00000000-00000000 [SL 00]
CPUID 00000010: 00000000-00000000-00000000-00000000 [SL 01]
CPUID 00000011: 00000000-00000000-00000000-00000000
CPUID 00000012: 00000000-00000000-00000000-00000000 [SL 00]
CPUID 00000012: 00000000-00000000-00000000-00000000 [SL 01]
CPUID 00000013: 00000000-00000000-00000000-00000000
CPUID 00000014: 00000001-0000005F-80000007-00000000 [SL 00]
CPUID 00000014: 02490002-003F003F-00000000-00000000 [SL 01]
CPUID 00000015: 00000002-00000082-0249F000-00000000 [65.00x / 38400000]
CPUID 00000016: 000009C4-00000CE4-00000064-00000000 [2500 / 3300 / 100]
CPUID 00000017: 00000000-00000000-00000000-00000000 [SL 00]
CPUID 00000018: 00000004-00000000-00000000-00000000 [SL 00]
CPUID 00000018: 00000000-00300001-00000001-00000121 [SL 01]
CPUID 00000018: 00000000-00040003-00000200-00000043 [SL 02]
CPUID 00000018: 00000000-00400001-00000001-00000122 [SL 03]
CPUID 00000018: 00000000-00080008-00000001-00000143 [SL 04]
CPUID 00000019: 00000000-00000000-00000000-00000000
CPUID 0000001A: 20000001-00000000-00000000-00000000 [Atom]
CPUID 0000001B: 00000000-00000000-00000000-00000000
CPUID 0000001C: C000000B-00000007-00000007-00000000
CPUID 0000001D: 00000000-00000000-00000000-00000000 [SL 00]
CPUID 0000001E: 00000000-00000000-00000000-00000000 [SL 00]
CPUID 0000001F: 00000001-00000001-00000100-00000012 [SL 00]
CPUID 0000001F: 00000006-00000006-00000201-00000012 [SL 01]
CPUID 00000020: 00000000-00000001-00000000-00000000 [SL 00]
CPUID 80000000: 80000008-00000000-00000000-00000000
CPUID 80000001: 00000000-00000000-00000121-2C100000
CPUID 80000002: 65746E49-2952286C-6E655020-6D756974 [Intel(R) Pentium]
CPUID 80000003: 20295228-646C6F47-30353820-00000035 [(R) Gold 8505]
CPUID 80000004: 00000000-00000000-00000000-00000000 []
CPUID 80000005: 00000000-00000000-00000000-00000000 [L1D: 0 KB / L1I: 0 KB]
CPUID 80000006: 00000000-00000000-08008040-00000000 [L2: 2048 KB] / L3: 0 KB]
CPUID 80000007: 00000000-00000000-00000000-00000100
CPUID 80000008: 00003027-00000000-00000000-00000000
------[ CPUID Registers / Logical CPU #4 ]------
CPUID 00000000: 00000020-756E6547-6C65746E-49656E69 [GenuineIntel]
CPUID 00000001: 000906A4-14400800-7FFAFBBF-BFEBFBFF
CPUID 00000002: 00FEFF01-00000000-00000000-00000000
CPUID 00000003: 00000000-00000000-00000000-00000000
CPUID 00000004: 7C004121-01C0003F-0000003F-00000000 [SL 00] [L1D: 32 KB]
CPUID 00000004: 7C004122-01C0003F-0000007F-00000000 [SL 01] [L1I: 64 KB]
CPUID 00000004: 7C01C143-03C0003F-000007FF-00000000 [SL 02] [L2U: 2 MB]
CPUID 00000004: 7C0FC163-01C0003F-00003FFF-00000004 [SL 03] [L3U: 8 MB]
CPUID 00000005: 00000040-00000040-00000003-10102020
CPUID 00000006: 00DF8FF7-00000002-00000409-00020003
CPUID 00000007: 00000002-239C27EB-984007AC-FC18C410 [SL 00]
CPUID 00000007: 00400810-00000000-00000000-00000000 [SL 01]
CPUID 00000007: 00000000-00000000-00000000-00000017 [SL 02]
CPUID 00000008: 00000000-00000000-00000000-00000000
CPUID 00000009: 00000000-00000000-00000000-00000000
CPUID 0000000A: 07300605-00000000-00000007-00008603
CPUID 0000000B: 00000001-00000001-00000100-00000014 [SL 00]
CPUID 0000000B: 00000006-00000006-00000201-00000014 [SL 01]
CPUID 0000000C: 00000000-00000000-00000000-00000000
CPUID 0000000D: 00000207-00000340-00000A88-00000000 [SL 00] [x87]
CPUID 0000000D: 0000000F-000003D0-00019900-00000000 [SL 01] [SSE]
CPUID 0000000D: 00000100-00000240-00000000-00000000 [SL 02] [AVX]
CPUID 0000000D: 00000080-00000000-00000001-00000000 [SL 08] [PT]
CPUID 0000000D: 00000008-00000A80-00000000-00000000 [SL 09] [PKRU]
CPUID 0000000D: 00000010-00000000-00000001-00000000 [SL 0B]
CPUID 0000000D: 00000018-00000000-00000001-00000000 [SL 0C]
CPUID 0000000D: 00000328-00000000-00000001-00000000 [SL 0F]
CPUID 0000000D: 00000008-00000000-00000001-00000000 [SL 10]
CPUID 0000000E: 00000000-00000000-00000000-00000000
CPUID 0000000F: 00000000-00000000-00000000-00000000 [SL 00]
CPUID 0000000F: 00000000-00000000-00000000-00000000 [SL 01]
CPUID 00000010: 00000000-00000000-00000000-00000000 [SL 00]
CPUID 00000010: 00000000-00000000-00000000-00000000 [SL 01]
CPUID 00000011: 00000000-00000000-00000000-00000000
CPUID 00000012: 00000000-00000000-00000000-00000000 [SL 00]
CPUID 00000012: 00000000-00000000-00000000-00000000 [SL 01]
CPUID 00000013: 00000000-00000000-00000000-00000000
CPUID 00000014: 00000001-0000005F-80000007-00000000 [SL 00]
CPUID 00000014: 02490002-003F003F-00000000-00000000 [SL 01]
CPUID 00000015: 00000002-00000082-0249F000-00000000 [65.00x / 38400000]
CPUID 00000016: 000009C4-00000CE4-00000064-00000000 [2500 / 3300 / 100]
CPUID 00000017: 00000000-00000000-00000000-00000000 [SL 00]
CPUID 00000018: 00000004-00000000-00000000-00000000 [SL 00]
CPUID 00000018: 00000000-00300001-00000001-00000121 [SL 01]
CPUID 00000018: 00000000-00040003-00000200-00000043 [SL 02]
CPUID 00000018: 00000000-00400001-00000001-00000122 [SL 03]
CPUID 00000018: 00000000-00080008-00000001-00000143 [SL 04]
CPUID 00000019: 00000000-00000000-00000000-00000000
CPUID 0000001A: 20000001-00000000-00000000-00000000 [Atom]
CPUID 0000001B: 00000000-00000000-00000000-00000000
CPUID 0000001C: C000000B-00000007-00000007-00000000
CPUID 0000001D: 00000000-00000000-00000000-00000000 [SL 00]
CPUID 0000001E: 00000000-00000000-00000000-00000000 [SL 00]
CPUID 0000001F: 00000001-00000001-00000100-00000014 [SL 00]
CPUID 0000001F: 00000006-00000006-00000201-00000014 [SL 01]
CPUID 00000020: 00000000-00000001-00000000-00000000 [SL 00]
CPUID 80000000: 80000008-00000000-00000000-00000000
CPUID 80000001: 00000000-00000000-00000121-2C100000
CPUID 80000002: 65746E49-2952286C-6E655020-6D756974 [Intel(R) Pentium]
CPUID 80000003: 20295228-646C6F47-30353820-00000035 [(R) Gold 8505]
CPUID 80000004: 00000000-00000000-00000000-00000000 []
CPUID 80000005: 00000000-00000000-00000000-00000000 [L1D: 0 KB / L1I: 0 KB]
CPUID 80000006: 00000000-00000000-08008040-00000000 [L2: 2048 KB] / L3: 0 KB]
CPUID 80000007: 00000000-00000000-00000000-00000100
CPUID 80000008: 00003027-00000000-00000000-00000000
------[ CPUID Registers / Logical CPU #5 ]------
CPUID 00000000: 00000020-756E6547-6C65746E-49656E69 [GenuineIntel]
CPUID 00000001: 000906A4-16400800-7FFAFBBF-BFEBFBFF
CPUID 00000002: 00FEFF01-00000000-00000000-00000000
CPUID 00000003: 00000000-00000000-00000000-00000000
CPUID 00000004: 7C004121-01C0003F-0000003F-00000000 [SL 00] [L1D: 32 KB]
CPUID 00000004: 7C004122-01C0003F-0000007F-00000000 [SL 01] [L1I: 64 KB]
CPUID 00000004: 7C01C143-03C0003F-000007FF-00000000 [SL 02] [L2U: 2 MB]
CPUID 00000004: 7C0FC163-01C0003F-00003FFF-00000004 [SL 03] [L3U: 8 MB]
CPUID 00000005: 00000040-00000040-00000003-10102020
CPUID 00000006: 00DF8FF7-00000002-00000409-00020003
CPUID 00000007: 00000002-239C27EB-984007AC-FC18C410 [SL 00]
CPUID 00000007: 00400810-00000000-00000000-00000000 [SL 01]
CPUID 00000007: 00000000-00000000-00000000-00000017 [SL 02]
CPUID 00000008: 00000000-00000000-00000000-00000000
CPUID 00000009: 00000000-00000000-00000000-00000000
CPUID 0000000A: 07300605-00000000-00000007-00008603
CPUID 0000000B: 00000001-00000001-00000100-00000016 [SL 00]
CPUID 0000000B: 00000006-00000006-00000201-00000016 [SL 01]
CPUID 0000000C: 00000000-00000000-00000000-00000000
CPUID 0000000D: 00000207-00000340-00000A88-00000000 [SL 00] [x87]
CPUID 0000000D: 0000000F-000003D0-00019900-00000000 [SL 01] [SSE]
CPUID 0000000D: 00000100-00000240-00000000-00000000 [SL 02] [AVX]
CPUID 0000000D: 00000080-00000000-00000001-00000000 [SL 08] [PT]
CPUID 0000000D: 00000008-00000A80-00000000-00000000 [SL 09] [PKRU]
CPUID 0000000D: 00000010-00000000-00000001-00000000 [SL 0B]
CPUID 0000000D: 00000018-00000000-00000001-00000000 [SL 0C]
CPUID 0000000D: 00000328-00000000-00000001-00000000 [SL 0F]
CPUID 0000000D: 00000008-00000000-00000001-00000000 [SL 10]
CPUID 0000000E: 00000000-00000000-00000000-00000000
CPUID 0000000F: 00000000-00000000-00000000-00000000 [SL 00]
CPUID 0000000F: 00000000-00000000-00000000-00000000 [SL 01]
CPUID 00000010: 00000000-00000000-00000000-00000000 [SL 00]
CPUID 00000010: 00000000-00000000-00000000-00000000 [SL 01]
CPUID 00000011: 00000000-00000000-00000000-00000000
CPUID 00000012: 00000000-00000000-00000000-00000000 [SL 00]
CPUID 00000012: 00000000-00000000-00000000-00000000 [SL 01]
CPUID 00000013: 00000000-00000000-00000000-00000000
CPUID 00000014: 00000001-0000005F-80000007-00000000 [SL 00]
CPUID 00000014: 02490002-003F003F-00000000-00000000 [SL 01]
CPUID 00000015: 00000002-00000082-0249F000-00000000 [65.00x / 38400000]
CPUID 00000016: 000009C4-00000CE4-00000064-00000000 [2500 / 3300 / 100]
CPUID 00000017: 00000000-00000000-00000000-00000000 [SL 00]
CPUID 00000018: 00000004-00000000-00000000-00000000 [SL 00]
CPUID 00000018: 00000000-00300001-00000001-00000121 [SL 01]
CPUID 00000018: 00000000-00040003-00000200-00000043 [SL 02]
CPUID 00000018: 00000000-00400001-00000001-00000122 [SL 03]
CPUID 00000018: 00000000-00080008-00000001-00000143 [SL 04]
CPUID 00000019: 00000000-00000000-00000000-00000000
CPUID 0000001A: 20000001-00000000-00000000-00000000 [Atom]
CPUID 0000001B: 00000000-00000000-00000000-00000000
CPUID 0000001C: C000000B-00000007-00000007-00000000
CPUID 0000001D: 00000000-00000000-00000000-00000000 [SL 00]
CPUID 0000001E: 00000000-00000000-00000000-00000000 [SL 00]
CPUID 0000001F: 00000001-00000001-00000100-00000016 [SL 00]
CPUID 0000001F: 00000006-00000006-00000201-00000016 [SL 01]
CPUID 00000020: 00000000-00000001-00000000-00000000 [SL 00]
CPUID 80000000: 80000008-00000000-00000000-00000000
CPUID 80000001: 00000000-00000000-00000121-2C100000
CPUID 80000002: 65746E49-2952286C-6E655020-6D756974 [Intel(R) Pentium]
CPUID 80000003: 20295228-646C6F47-30353820-00000035 [(R) Gold 8505]
CPUID 80000004: 00000000-00000000-00000000-00000000 []
CPUID 80000005: 00000000-00000000-00000000-00000000 [L1D: 0 KB / L1I: 0 KB]
CPUID 80000006: 00000000-00000000-08008040-00000000 [L2: 2048 KB] / L3: 0 KB]
CPUID 80000007: 00000000-00000000-00000000-00000100
CPUID 80000008: 00003027-00000000-00000000-00000000
--------------------------------------------------------------------------------
x86
performance
6
10
4
6
154
1
2
48
32
1280
8192
-1
12
8
10
8
-1
64
64
64
64
-1
1
1
1
1
0
128 (non-authoritative)
Alder Lake-U (Pentium)
fpu vme de pse tsc msr pae mce cx8 apic mtrr sep pge mca cmov pat pse36 clflush dts acpi mmx fxsr sse sse2 ss ht tm pbe pni pclmul dts64 monitor ds_cpl vmx est tm2 ssse3 cx16 xtpr pdcm sse4_1 sse4_2 xd movbe popcnt aes xsave osxsave avx rdtscp lm lahf_lm abm constant_tsc fma3 f16c rdrand x2apic avx2 bmi1 bmi2 sha_ni rdseed adx
--------------------------------------------------------------------------------
x86
efficiency
6
10
4
6
154
4
4
32
64
2048
8192
-1
8
8
16
8
-1
64
64
64
64
-1
4
4
1
1
0
128 (non-authoritative)
Alder Lake-U (Pentium)
fpu vme de pse tsc msr pae mce cx8 apic mtrr sep pge mca cmov pat pse36 clflush dts acpi mmx fxsr sse sse2 ss ht tm pbe pni pclmul dts64 monitor ds_cpl vmx est tm2 ssse3 cx16 xtpr pdcm sse4_1 sse4_2 xd movbe popcnt aes xsave osxsave avx rdtscp lm lahf_lm abm constant_tsc fma3 f16c rdrand x2apic avx2 bmi1 bmi2 sha_ni rdseed adx
