------[ CPUID Registers / Logical CPU #0 ]------
CPUID 00000000: 00000020-756E6547-6C65746E-49656E69 [GenuineIntel]
CPUID 00000001: 000B06E0-00800800-7FFAFBBF-BFEBFBFF
CPUID 00000002: 00FEFF01-000000F0-00000000-00000000
CPUID 00000003: 00000000-00000000-00000000-00000000
CPUID 00000004: FC004121-01C0003F-0000003F-00000000 [SL 00] [L1D: 32 KB]
CPUID 00000004: FC004122-01C0003F-0000007F-00000000 [SL 01] [L1I: 64 KB]
CPUID 00000004: FC01C143-03C0003F-000007FF-00000000 [SL 02] [L2U: 2 MB]
CPUID 00000004: FC1FC163-02C0003F-00001FFF-00000004 [SL 03] [L3U: 6 MB]
CPUID 00000005: 00000040-00000040-00000003-10102020
CPUID 00000006: 00578FF7-00000002-00000009-00000000
CPUID 00000007: 00000002-239CA7EB-98C007AC-FC184410 [SL 00]
CPUID 00000007: 00000810-00000000-00000000-00000000 [SL 01]
CPUID 00000007: 00000000-00000000-00000000-00000037 [SL 02]
CPUID 00000008: 00000000-00000000-00000000-00000000
CPUID 00000009: 00000000-00000000-00000000-00000000
CPUID 0000000A: 07300605-00000000-00000007-00008603
CPUID 0000000B: 00000001-00000001-00000100-00000000 [SL 00]
CPUID 0000000B: 00000007-00000004-00000201-00000000 [SL 01]
CPUID 0000000C: 00000000-00000000-00000000-00000000
CPUID 0000000D: 00000207-00000340-00000A88-00000000 [SL 00] [x87]
CPUID 0000000D: 0000000F-000003D0-00019900-00000000 [SL 01] [SSE]
CPUID 0000000D: 00000100-00000240-00000000-00000000 [SL 02] [AVX]
CPUID 0000000D: 00000080-00000000-00000001-00000000 [SL 08] [PT]
CPUID 0000000D: 00000008-00000A80-00000000-00000000 [SL 09] [PKRU]
CPUID 0000000D: 00000010-00000000-00000001-00000000 [SL 0B]
CPUID 0000000D: 00000018-00000000-00000001-00000000 [SL 0C]
CPUID 0000000D: 00000328-00000000-00000001-00000000 [SL 0F]
CPUID 0000000D: 00000008-00000000-00000001-00000000 [SL 10]
CPUID 0000000E: 00000000-00000000-00000000-00000000
CPUID 0000000F: 00000000-00000000-00000000-00000000 [SL 00]
CPUID 0000000F: 00000000-00000000-00000000-00000000 [SL 01]
CPUID 00000010: 00000000-00000004-00000000-00000000 [SL 00]
CPUID 00000010: 00000000-00000000-00000000-00000000 [SL 01]
CPUID 00000011: 00000000-00000000-00000000-00000000
CPUID 00000012: 00000000-00000000-00000000-00000000 [SL 00]
CPUID 00000012: 00000000-00000000-00000000-00000000 [SL 01]
CPUID 00000013: 00000000-00000000-00000000-00000000
CPUID 00000014: 00000001-000001FF-80000007-00000000 [SL 00]
CPUID 00000014: 02490002-003FFFFF-00000000-00000000 [SL 01]
CPUID 00000015: 00000002-00000058-0249F000-00000000 [44.00x / 38400000]
CPUID 00000016: 000006A4-00000D48-00000064-00000000 [1700 / 3400 / 100]
CPUID 00000017: 00000000-00000000-00000000-00000000 [SL 00]
CPUID 00000018: 00000004-00000000-00000000-00000000 [SL 00]
CPUID 00000018: 00000000-00300001-00000001-00000121 [SL 01]
CPUID 00000018: 00000000-00040003-00000200-00000043 [SL 02]
CPUID 00000018: 00000000-00400001-00000001-00000122 [SL 03]
CPUID 00000018: 00000000-00080008-00000001-00000143 [SL 04]
CPUID 00000019: 00000007-00000014-00000003-00000000
CPUID 0000001A: 20000001-00000000-00000000-00000000 [Atom]
CPUID 0000001B: 00000000-00000000-00000000-00000000
CPUID 0000001C: C000000B-00000007-00000007-00000000
CPUID 0000001D: 00000000-00000000-00000000-00000000 [SL 00]
CPUID 0000001E: 00000000-00000000-00000000-00000000 [SL 00]
CPUID 0000001F: 00000001-00000001-00000100-00000000 [SL 00]
CPUID 0000001F: 00000003-00000004-00000201-00000000 [SL 01]
CPUID 0000001F: 00000007-00000004-00000302-00000000 [SL 02]
CPUID 00000020: 00000000-00000000-00000000-00000000 [SL 00]
CPUID 80000000: 80000008-00000000-00000000-00000000
CPUID 80000001: 00000000-00000000-00000121-2C100000
CPUID 80000002: 65746E49-2952286C-35394E20-00000000 [Intel(R) N95]
CPUID 80000003: 00000000-00000000-00000000-00000000 []
CPUID 80000004: 00000000-00000000-00000000-00000000 []
CPUID 80000005: 00000000-00000000-00000000-00000000 [L1D: 0 KB / L1I: 0 KB]
CPUID 80000006: 00000000-00000000-08008040-00000000 [L2: 2048 KB] / L3: 0 KB]
CPUID 80000007: 00000000-00000000-00000000-00000100
CPUID 80000008: 00003027-00000000-00000000-00000000
------[ CPUID Registers / Logical CPU #1 ]------
CPUID 00000000: 00000020-756E6547-6C65746E-49656E69 [GenuineIntel]
CPUID 00000001: 000B06E0-02800800-7FFAFBBF-BFEBFBFF
CPUID 00000002: 00FEFF01-000000F0-00000000-00000000
CPUID 00000003: 00000000-00000000-00000000-00000000
CPUID 00000004: FC004121-01C0003F-0000003F-00000000 [SL 00] [L1D: 32 KB]
CPUID 00000004: FC004122-01C0003F-0000007F-00000000 [SL 01] [L1I: 64 KB]
CPUID 00000004: FC01C143-03C0003F-000007FF-00000000 [SL 02] [L2U: 2 MB]
CPUID 00000004: FC1FC163-02C0003F-00001FFF-00000004 [SL 03] [L3U: 6 MB]
CPUID 00000005: 00000040-00000040-00000003-10102020
CPUID 00000006: 00578FF7-00000002-00000009-00000000
CPUID 00000007: 00000002-239CA7EB-98C007AC-FC184410 [SL 00]
CPUID 00000007: 00000810-00000000-00000000-00000000 [SL 01]
CPUID 00000007: 00000000-00000000-00000000-00000037 [SL 02]
CPUID 00000008: 00000000-00000000-00000000-00000000
CPUID 00000009: 00000000-00000000-00000000-00000000
CPUID 0000000A: 07300605-00000000-00000007-00008603
CPUID 0000000B: 00000001-00000001-00000100-00000002 [SL 00]
CPUID 0000000B: 00000007-00000004-00000201-00000002 [SL 01]
CPUID 0000000C: 00000000-00000000-00000000-00000000
CPUID 0000000D: 00000207-00000340-00000A88-00000000 [SL 00] [x87]
CPUID 0000000D: 0000000F-000003D0-00019900-00000000 [SL 01] [SSE]
CPUID 0000000D: 00000100-00000240-00000000-00000000 [SL 02] [AVX]
CPUID 0000000D: 00000080-00000000-00000001-00000000 [SL 08] [PT]
CPUID 0000000D: 00000008-00000A80-00000000-00000000 [SL 09] [PKRU]
CPUID 0000000D: 00000010-00000000-00000001-00000000 [SL 0B]
CPUID 0000000D: 00000018-00000000-00000001-00000000 [SL 0C]
CPUID 0000000D: 00000328-00000000-00000001-00000000 [SL 0F]
CPUID 0000000D: 00000008-00000000-00000001-00000000 [SL 10]
CPUID 0000000E: 00000000-00000000-00000000-00000000
CPUID 0000000F: 00000000-00000000-00000000-00000000 [SL 00]
CPUID 0000000F: 00000000-00000000-00000000-00000000 [SL 01]
CPUID 00000010: 00000000-00000004-00000000-00000000 [SL 00]
CPUID 00000010: 00000000-00000000-00000000-00000000 [SL 01]
CPUID 00000011: 00000000-00000000-00000000-00000000
CPUID 00000012: 00000000-00000000-00000000-00000000 [SL 00]
CPUID 00000012: 00000000-00000000-00000000-00000000 [SL 01]
CPUID 00000013: 00000000-00000000-00000000-00000000
CPUID 00000014: 00000001-000001FF-80000007-00000000 [SL 00]
CPUID 00000014: 02490002-003FFFFF-00000000-00000000 [SL 01]
CPUID 00000015: 00000002-00000058-0249F000-00000000 [44.00x / 38400000]
CPUID 00000016: 000006A4-00000D48-00000064-00000000 [1700 / 3400 / 100]
CPUID 00000017: 00000000-00000000-00000000-00000000 [SL 00]
CPUID 00000018: 00000004-00000000-00000000-00000000 [SL 00]
CPUID 00000018: 00000000-00300001-00000001-00000121 [SL 01]
CPUID 00000018: 00000000-00040003-00000200-00000043 [SL 02]
CPUID 00000018: 00000000-00400001-00000001-00000122 [SL 03]
CPUID 00000018: 00000000-00080008-00000001-00000143 [SL 04]
CPUID 00000019: 00000007-00000014-00000003-00000000
CPUID 0000001A: 20000001-00000000-00000000-00000000 [Atom]
CPUID 0000001B: 00000000-00000000-00000000-00000000
CPUID 0000001C: C000000B-00000007-00000007-00000000
CPUID 0000001D: 00000000-00000000-00000000-00000000 [SL 00]
CPUID 0000001E: 00000000-00000000-00000000-00000000 [SL 00]
CPUID 0000001F: 00000001-00000001-00000100-00000002 [SL 00]
CPUID 0000001F: 00000003-00000004-00000201-00000002 [SL 01]
CPUID 0000001F: 00000007-00000004-00000302-00000002 [SL 02]
CPUID 00000020: 00000000-00000000-00000000-00000000 [SL 00]
CPUID 80000000: 80000008-00000000-00000000-00000000
CPUID 80000001: 00000000-00000000-00000121-2C100000
CPUID 80000002: 65746E49-2952286C-35394E20-00000000 [Intel(R) N95]
CPUID 80000003: 00000000-00000000-00000000-00000000 []
CPUID 80000004: 00000000-00000000-00000000-00000000 []
CPUID 80000005: 00000000-00000000-00000000-00000000 [L1D: 0 KB / L1I: 0 KB]
CPUID 80000006: 00000000-00000000-08008040-00000000 [L2: 2048 KB] / L3: 0 KB]
CPUID 80000007: 00000000-00000000-00000000-00000100
CPUID 80000008: 00003027-00000000-00000000-00000000
------[ CPUID Registers / Logical CPU #2 ]------
CPUID 00000000: 00000020-756E6547-6C65746E-49656E69 [GenuineIntel]
CPUID 00000001: 000B06E0-04800800-7FFAFBBF-BFEBFBFF
CPUID 00000002: 00FEFF01-000000F0-00000000-00000000
CPUID 00000003: 00000000-00000000-00000000-00000000
CPUID 00000004: FC004121-01C0003F-0000003F-00000000 [SL 00] [L1D: 32 KB]
CPUID 00000004: FC004122-01C0003F-0000007F-00000000 [SL 01] [L1I: 64 KB]
CPUID 00000004: FC01C143-03C0003F-000007FF-00000000 [SL 02] [L2U: 2 MB]
CPUID 00000004: FC1FC163-02C0003F-00001FFF-00000004 [SL 03] [L3U: 6 MB]
CPUID 00000005: 00000040-00000040-00000003-10102020
CPUID 00000006: 00578FF7-00000002-00000009-00000000
CPUID 00000007: 00000002-239CA7EB-98C007AC-FC184410 [SL 00]
CPUID 00000007: 00000810-00000000-00000000-00000000 [SL 01]
CPUID 00000007: 00000000-00000000-00000000-00000037 [SL 02]
CPUID 00000008: 00000000-00000000-00000000-00000000
CPUID 00000009: 00000000-00000000-00000000-00000000
CPUID 0000000A: 07300605-00000000-00000007-00008603
CPUID 0000000B: 00000001-00000001-00000100-00000004 [SL 00]
CPUID 0000000B: 00000007-00000004-00000201-00000004 [SL 01]
CPUID 0000000C: 00000000-00000000-00000000-00000000
CPUID 0000000D: 00000207-00000340-00000A88-00000000 [SL 00] [x87]
CPUID 0000000D: 0000000F-000003D0-00019900-00000000 [SL 01] [SSE]
CPUID 0000000D: 00000100-00000240-00000000-00000000 [SL 02] [AVX]
CPUID 0000000D: 00000080-00000000-00000001-00000000 [SL 08] [PT]
CPUID 0000000D: 00000008-00000A80-00000000-00000000 [SL 09] [PKRU]
CPUID 0000000D: 00000010-00000000-00000001-00000000 [SL 0B]
CPUID 0000000D: 00000018-00000000-00000001-00000000 [SL 0C]
CPUID 0000000D: 00000328-00000000-00000001-00000000 [SL 0F]
CPUID 0000000D: 00000008-00000000-00000001-00000000 [SL 10]
CPUID 0000000E: 00000000-00000000-00000000-00000000
CPUID 0000000F: 00000000-00000000-00000000-00000000 [SL 00]
CPUID 0000000F: 00000000-00000000-00000000-00000000 [SL 01]
CPUID 00000010: 00000000-00000004-00000000-00000000 [SL 00]
CPUID 00000010: 00000000-00000000-00000000-00000000 [SL 01]
CPUID 00000011: 00000000-00000000-00000000-00000000
CPUID 00000012: 00000000-00000000-00000000-00000000 [SL 00]
CPUID 00000012: 00000000-00000000-00000000-00000000 [SL 01]
CPUID 00000013: 00000000-00000000-00000000-00000000
CPUID 00000014: 00000001-000001FF-80000007-00000000 [SL 00]
CPUID 00000014: 02490002-003FFFFF-00000000-00000000 [SL 01]
CPUID 00000015: 00000002-00000058-0249F000-00000000 [44.00x / 38400000]
CPUID 00000016: 000006A4-00000D48-00000064-00000000 [1700 / 3400 / 100]
CPUID 00000017: 00000000-00000000-00000000-00000000 [SL 00]
CPUID 00000018: 00000004-00000000-00000000-00000000 [SL 00]
CPUID 00000018: 00000000-00300001-00000001-00000121 [SL 01]
CPUID 00000018: 00000000-00040003-00000200-00000043 [SL 02]
CPUID 00000018: 00000000-00400001-00000001-00000122 [SL 03]
CPUID 00000018: 00000000-00080008-00000001-00000143 [SL 04]
CPUID 00000019: 00000007-00000014-00000003-00000000
CPUID 0000001A: 20000001-00000000-00000000-00000000 [Atom]
CPUID 0000001B: 00000000-00000000-00000000-00000000
CPUID 0000001C: C000000B-00000007-00000007-00000000
CPUID 0000001D: 00000000-00000000-00000000-00000000 [SL 00]
CPUID 0000001E: 00000000-00000000-00000000-00000000 [SL 00]
CPUID 0000001F: 00000001-00000001-00000100-00000004 [SL 00]
CPUID 0000001F: 00000003-00000004-00000201-00000004 [SL 01]
CPUID 0000001F: 00000007-00000004-00000302-00000004 [SL 02]
CPUID 00000020: 00000000-00000000-00000000-00000000 [SL 00]
CPUID 80000000: 80000008-00000000-00000000-00000000
CPUID 80000001: 00000000-00000000-00000121-2C100000
CPUID 80000002: 65746E49-2952286C-35394E20-00000000 [Intel(R) N95]
CPUID 80000003: 00000000-00000000-00000000-00000000 []
CPUID 80000004: 00000000-00000000-00000000-00000000 []
CPUID 80000005: 00000000-00000000-00000000-00000000 [L1D: 0 KB / L1I: 0 KB]
CPUID 80000006: 00000000-00000000-08008040-00000000 [L2: 2048 KB] / L3: 0 KB]
CPUID 80000007: 00000000-00000000-00000000-00000100
CPUID 80000008: 00003027-00000000-00000000-00000000
------[ CPUID Registers / Logical CPU #3 ]------
CPUID 00000000: 00000020-756E6547-6C65746E-49656E69 [GenuineIntel]
CPUID 00000001: 000B06E0-06800800-7FFAFBBF-BFEBFBFF
CPUID 00000002: 00FEFF01-000000F0-00000000-00000000
CPUID 00000003: 00000000-00000000-00000000-00000000
CPUID 00000004: FC004121-01C0003F-0000003F-00000000 [SL 00] [L1D: 32 KB]
CPUID 00000004: FC004122-01C0003F-0000007F-00000000 [SL 01] [L1I: 64 KB]
CPUID 00000004: FC01C143-03C0003F-000007FF-00000000 [SL 02] [L2U: 2 MB]
CPUID 00000004: FC1FC163-02C0003F-00001FFF-00000004 [SL 03] [L3U: 6 MB]
CPUID 00000005: 00000040-00000040-00000003-10102020
CPUID 00000006: 00578FF7-00000002-00000009-00000000
CPUID 00000007: 00000002-239CA7EB-98C007AC-FC184410 [SL 00]
CPUID 00000007: 00000810-00000000-00000000-00000000 [SL 01]
CPUID 00000007: 00000000-00000000-00000000-00000037 [SL 02]
CPUID 00000008: 00000000-00000000-00000000-00000000
CPUID 00000009: 00000000-00000000-00000000-00000000
CPUID 0000000A: 07300605-00000000-00000007-00008603
CPUID 0000000B: 00000001-00000001-00000100-00000006 [SL 00]
CPUID 0000000B: 00000007-00000004-00000201-00000006 [SL 01]
CPUID 0000000C: 00000000-00000000-00000000-00000000
CPUID 0000000D: 00000207-00000340-00000A88-00000000 [SL 00] [x87]
CPUID 0000000D: 0000000F-000003D0-00019900-00000000 [SL 01] [SSE]
CPUID 0000000D: 00000100-00000240-00000000-00000000 [SL 02] [AVX]
CPUID 0000000D: 00000080-00000000-00000001-00000000 [SL 08] [PT]
CPUID 0000000D: 00000008-00000A80-00000000-00000000 [SL 09] [PKRU]
CPUID 0000000D: 00000010-00000000-00000001-00000000 [SL 0B]
CPUID 0000000D: 00000018-00000000-00000001-00000000 [SL 0C]
CPUID 0000000D: 00000328-00000000-00000001-00000000 [SL 0F]
CPUID 0000000D: 00000008-00000000-00000001-00000000 [SL 10]
CPUID 0000000E: 00000000-00000000-00000000-00000000
CPUID 0000000F: 00000000-00000000-00000000-00000000 [SL 00]
CPUID 0000000F: 00000000-00000000-00000000-00000000 [SL 01]
CPUID 00000010: 00000000-00000004-00000000-00000000 [SL 00]
CPUID 00000010: 00000000-00000000-00000000-00000000 [SL 01]
CPUID 00000011: 00000000-00000000-00000000-00000000
CPUID 00000012: 00000000-00000000-00000000-00000000 [SL 00]
CPUID 00000012: 00000000-00000000-00000000-00000000 [SL 01]
CPUID 00000013: 00000000-00000000-00000000-00000000
CPUID 00000014: 00000001-000001FF-80000007-00000000 [SL 00]
CPUID 00000014: 02490002-003FFFFF-00000000-00000000 [SL 01]
CPUID 00000015: 00000002-00000058-0249F000-00000000 [44.00x / 38400000]
CPUID 00000016: 000006A4-00000D48-00000064-00000000 [1700 / 3400 / 100]
CPUID 00000017: 00000000-00000000-00000000-00000000 [SL 00]
CPUID 00000018: 00000004-00000000-00000000-00000000 [SL 00]
CPUID 00000018: 00000000-00300001-00000001-00000121 [SL 01]
CPUID 00000018: 00000000-00040003-00000200-00000043 [SL 02]
CPUID 00000018: 00000000-00400001-00000001-00000122 [SL 03]
CPUID 00000018: 00000000-00080008-00000001-00000143 [SL 04]
CPUID 00000019: 00000007-00000014-00000003-00000000
CPUID 0000001A: 20000001-00000000-00000000-00000000 [Atom]
CPUID 0000001B: 00000000-00000000-00000000-00000000
CPUID 0000001C: C000000B-00000007-00000007-00000000
CPUID 0000001D: 00000000-00000000-00000000-00000000 [SL 00]
CPUID 0000001E: 00000000-00000000-00000000-00000000 [SL 00]
CPUID 0000001F: 00000001-00000001-00000100-00000006 [SL 00]
CPUID 0000001F: 00000003-00000004-00000201-00000006 [SL 01]
CPUID 0000001F: 00000007-00000004-00000302-00000006 [SL 02]
CPUID 00000020: 00000000-00000000-00000000-00000000 [SL 00]
CPUID 80000000: 80000008-00000000-00000000-00000000
CPUID 80000001: 00000000-00000000-00000121-2C100000
CPUID 80000002: 65746E49-2952286C-35394E20-00000000 [Intel(R) N95]
CPUID 80000003: 00000000-00000000-00000000-00000000 []
CPUID 80000004: 00000000-00000000-00000000-00000000 []
CPUID 80000005: 00000000-00000000-00000000-00000000 [L1D: 0 KB / L1I: 0 KB]
CPUID 80000006: 00000000-00000000-08008040-00000000 [L2: 2048 KB] / L3: 0 KB]
CPUID 80000007: 00000000-00000000-00000000-00000100
CPUID 80000008: 00003027-00000000-00000000-00000000
--------------------------------------------------------------------------------
x86
general
6
14
0
6
190
4
4
32
64
2048
6144
-1
8
8
16
12
-1
64
64
64
64
-1
4
4
1
1
0
128 (non-authoritative)
Alder Lake-N
fpu vme de pse tsc msr pae mce cx8 apic mtrr sep pge mca cmov pat pse36 clflush dts acpi mmx fxsr sse sse2 ss ht tm pbe pni pclmul dts64 monitor ds_cpl vmx est tm2 ssse3 cx16 xtpr pdcm sse4_1 sse4_2 xd movbe popcnt aes xsave osxsave avx rdtscp lm lahf_lm abm constant_tsc fma3 f16c rdrand x2apic avx2 bmi1 bmi2 sha_ni rdseed adx
