------[ Logical CPU #0 ]------
CPUID 00000000: 00000001-746E6543-736C7561-48727561
CPUID 00000001: 000006D0-00000800-00004181-A7C9BBFF
CPUID 80000000: 80000006-00000000-00000000-00000000
CPUID 80000001: 00000000-00000000-00000000-00100000
CPUID 80000002: 20202020-20202020-20202020-20202020
CPUID 80000003: 20202020-41495620-2D374320-7250204D
CPUID 80000004: 7365636F-20726F73-30303231-007A484D
CPUID 80000005: 00000000-08800880-40040140-40040140
CPUID 80000006: 00000000-00000000-0080A140-00000000
CPUID C0000000: C0000003-00000000-00000000-00000000
CPUID C0000001: 00000000-00000001-00000000-0000FFCC
CPUID C0000002: 00003A00-04000C09-04060C09-43040000
CPUID C0000003: 94D53FDE-7980BEBF-366B736B-ED908777
--------------------------------------------------------------------------------
x86
general
6
13
0
6
13
1
1
-1
-1
-1
-1
-1
-1
-1
-1
-1
-1
-1
-1
-1
-1
-1
-1
-1
-1
-1
-1
-1 (non-authoritative)
VIA C7-M (Esther)
fpu vme de pse tsc msr pae mce cx8 apic mtrr sep pge cmov pat clflush mmx fxsr sse sse2 pni
