------[ Logical CPU #0 ]------
CPUID 00000000: 00000001-746E6543-736C7561-48727561
CPUID 00000001: 000006A9-00010800-00000181-A7C9BBFF
CPUID 80000000: 80000006-00000000-00000000-00000000
CPUID 80000001: 00000000-00000000-00000000-00100000
CPUID 80000002: 20202020-20202020-20202020-20202020
CPUID 80000003: 56202020-45204149-65687473-72702072
CPUID 80000004: 7365636F-20726F73-30303531-007A484D
CPUID 80000005: 00000000-08800880-40040140-40040140
CPUID 80000006: 00000000-00000000-0080A140-00000000
CPUID C0000000: C0000002-00000000-00000000-00000000
CPUID C0000001: 00000000-00000000-00000000-00003FCC
CPUID C0000002: 00002C00-08000F13-08100F13-43C00000
--------------------------------------------------------------------------------
x86
general
6
10
9
6
10
1
1
-1
-1
-1
-1
-1
-1
-1
-1
-1
-1
-1
-1
-1
-1
-1
-1
-1
-1
-1
-1
-1 (non-authoritative)
VIA C7 (Esther)
fpu vme de pse tsc msr pae mce cx8 apic mtrr sep pge cmov pat clflush mmx fxsr sse sse2 pni
