CPUID Registers (CPU #1):
CPUID 00000000: 00000006-68747541-444D4163-69746E65
CPUID 00000001: 00500F10-00020800-00802209-178BFBFF
CPUID 00000002: 00000000-00000000-00000000-00000000
CPUID 00000003: 00000000-00000000-00000000-00000000
CPUID 00000005: 00000040-00000040-00000003-00000000
CPUID 00000006: 00000000-00000000-00000001-00000000
CPUID 80000000: 8000001B-68747541-444D4163-69746E65
CPUID 80000001: 00500F10-00000B31-000035FF-2FD3FBFF
CPUID 80000002: 20444D41-30352D43-6F725020-73736563
CPUID 80000003: 0000726F-00000000-00000000-00000000
CPUID 80000004: 00000000-00000000-00000000-00000000
CPUID 80000005: FF08FF08-FF280000-20080140-20020140
CPUID 80000006: 00000000-42004200-02008140-00000000
CPUID 80000007: 00000000-00000000-00000000-000001F9
CPUID 80000008: 00003024-00000000-00001001-00000000
CPUID 80000009: 00000000-00000000-00000000-00000000
CPUID 8000000A: 00000001-00000008-00000000-0000060F
CPUID 8000000B: 00000000-00000000-00000000-00000000
CPUID 8000000C: 00000000-00000000-00000000-00000000
CPUID 8000000D: 00000000-00000000-00000000-00000000
CPUID 8000000E: 00000000-00000000-00000000-00000000
CPUID 8000000F: 00000000-00000000-00000000-00000000
CPUID 80000010: 00000000-00000000-00000000-00000000
CPUID 80000011: 00000000-00000000-00000000-00000000
CPUID 80000012: 00000000-00000000-00000000-00000000
CPUID 80000013: 00000000-00000000-00000000-00000000
CPUID 80000014: 00000000-00000000-00000000-00000000
CPUID 80000015: 00000000-00000000-00000000-00000000
CPUID 80000016: 00000000-00000000-00000000-00000000
CPUID 80000017: 00000000-00000000-00000000-00000000
CPUID 80000018: 00000000-00000000-00000000-00000000
CPUID 80000019: 00000000-00000000-00000000-00000000
CPUID 8000001A: 00000000-00000000-00000000-00000000
CPUID 8000001B: 000000FF-00000000-00000000-00000000
CPUID Registers (CPU #2):
CPUID 00000000: 00000006-68747541-444D4163-69746E65
CPUID 00000001: 00500F10-01020800-00802209-178BFBFF
CPUID 00000002: 00000000-00000000-00000000-00000000
CPUID 00000003: 00000000-00000000-00000000-00000000
CPUID 00000005: 00000040-00000040-00000003-00000000
CPUID 00000006: 00000000-00000000-00000001-00000000
CPUID 80000000: 8000001B-68747541-444D4163-69746E65
CPUID 80000001: 00500F10-00000B31-000035FF-2FD3FBFF
CPUID 80000002: 20444D41-30352D43-6F725020-73736563
CPUID 80000003: 0000726F-00000000-00000000-00000000
CPUID 80000004: 00000000-00000000-00000000-00000000
CPUID 80000005: FF08FF08-FF280000-20080140-20020140
CPUID 80000006: 00000000-42004200-02008140-00000000
CPUID 80000007: 00000000-00000000-00000000-000001F9
CPUID 80000008: 00003024-00000000-00001001-00000000
CPUID 80000009: 00000000-00000000-00000000-00000000
CPUID 8000000A: 00000001-00000008-00000000-0000060F
CPUID 8000000B: 00000000-00000000-00000000-00000000
CPUID 8000000C: 00000000-00000000-00000000-00000000
CPUID 8000000D: 00000000-00000000-00000000-00000000
CPUID 8000000E: 00000000-00000000-00000000-00000000
CPUID 8000000F: 00000000-00000000-00000000-00000000
CPUID 80000010: 00000000-00000000-00000000-00000000
CPUID 80000011: 00000000-00000000-00000000-00000000
CPUID 80000012: 00000000-00000000-00000000-00000000
CPUID 80000013: 00000000-00000000-00000000-00000000
CPUID 80000014: 00000000-00000000-00000000-00000000
CPUID 80000015: 00000000-00000000-00000000-00000000
CPUID 80000016: 00000000-00000000-00000000-00000000
CPUID 80000017: 00000000-00000000-00000000-00000000
CPUID 80000018: 00000000-00000000-00000000-00000000
CPUID 80000019: 00000000-00000000-00000000-00000000
CPUID 8000001A: 00000000-00000000-00000000-00000000
CPUID 8000001B: 000000FF-00000000-00000000-00000000
--------------------------------------------------------------------------------
x86
x86-64-v2
general
15
1
0
20
1
2
2
32
32
512
-1
-1
8
2
16
-1
-1
64
64
64
-1
-1
-1
-1
-1
-1
-1
64 (authoritative)
C-Series (Ontario)
TSMC N40
fpu vme de pse tsc msr pae mce cx8 apic mtrr sep pge mca cmov pat pse36 clflush mmx fxsr sse sse2 ht pni monitor ssse3 cx16 syscall popcnt mmxext nx fxsr_opt rdtscp lm lahf_lm cmp_legacy svm abm misalignsse sse4a 3dnowprefetch ibs skinit wdt ts ttp tm_amd stc 100mhzsteps hwpstate constant_tsc
