basic_cpuid[0]=00000006 68747541 444d4163 69746e65
basic_cpuid[1]=00500f10 00020800 00802209 178bfbff
basic_cpuid[2]=00000000 00000000 00000000 00000000
basic_cpuid[3]=00000000 00000000 00000000 00000000
basic_cpuid[4]=00000000 00000000 00000000 00000000
basic_cpuid[5]=00000040 00000040 00000003 00000000
basic_cpuid[6]=00000000 00000000 00000001 00000000
basic_cpuid[7]=00000000 00000000 00000000 00000000
basic_cpuid[8]=00000000 00000000 00000000 00000000
basic_cpuid[9]=00000000 00000000 00000000 00000000
basic_cpuid[10]=00000000 00000000 00000000 00000000
basic_cpuid[11]=00000000 00000000 00000000 00000000
basic_cpuid[12]=00000000 00000000 00000000 00000000
basic_cpuid[13]=00000000 00000000 00000000 00000000
basic_cpuid[14]=00000000 00000000 00000000 00000000
basic_cpuid[15]=00000000 00000000 00000000 00000000
basic_cpuid[16]=00000000 00000000 00000000 00000000
basic_cpuid[17]=00000000 00000000 00000000 00000000
basic_cpuid[18]=00000000 00000000 00000000 00000000
basic_cpuid[19]=00000000 00000000 00000000 00000000
basic_cpuid[20]=00000000 00000000 00000000 00000000
basic_cpuid[21]=00000000 00000000 00000000 00000000
basic_cpuid[22]=00000000 00000000 00000000 00000000
basic_cpuid[23]=00000000 00000000 00000000 00000000
basic_cpuid[24]=00000000 00000000 00000000 00000000
basic_cpuid[25]=00000000 00000000 00000000 00000000
basic_cpuid[26]=00000000 00000000 00000000 00000000
basic_cpuid[27]=00000000 00000000 00000000 00000000
basic_cpuid[28]=00000000 00000000 00000000 00000000
basic_cpuid[29]=00000000 00000000 00000000 00000000
basic_cpuid[30]=00000000 00000000 00000000 00000000
basic_cpuid[31]=00000000 00000000 00000000 00000000
ext_cpuid[0]=8000001b 68747541 444d4163 69746e65
ext_cpuid[1]=00500f10 00001242 000035ff 2fd3fbff
ext_cpuid[2]=20444d41 35332d45 72502030 7365636f
ext_cpuid[3]=00726f73 00000000 00000000 00000000
ext_cpuid[4]=00000000 00000000 00000000 00000000
ext_cpuid[5]=ff08ff08 ff280000 20080140 20020140
ext_cpuid[6]=00000000 42004200 02008140 00000000
ext_cpuid[7]=00000000 00000000 00000000 000001f9
ext_cpuid[8]=00003024 00000000 00001001 00000000
ext_cpuid[9]=00000000 00000000 00000000 00000000
ext_cpuid[10]=00000001 00000008 00000000 0000060f
ext_cpuid[11]=00000000 00000000 00000000 00000000
ext_cpuid[12]=00000000 00000000 00000000 00000000
ext_cpuid[13]=00000000 00000000 00000000 00000000
ext_cpuid[14]=00000000 00000000 00000000 00000000
ext_cpuid[15]=00000000 00000000 00000000 00000000
ext_cpuid[16]=00000000 00000000 00000000 00000000
ext_cpuid[17]=00000000 00000000 00000000 00000000
ext_cpuid[18]=00000000 00000000 00000000 00000000
ext_cpuid[19]=00000000 00000000 00000000 00000000
ext_cpuid[20]=00000000 00000000 00000000 00000000
ext_cpuid[21]=00000000 00000000 00000000 00000000
ext_cpuid[22]=00000000 00000000 00000000 00000000
ext_cpuid[23]=00000000 00000000 00000000 00000000
ext_cpuid[24]=00000000 00000000 00000000 00000000
ext_cpuid[25]=00000000 00000000 00000000 00000000
ext_cpuid[26]=00000000 00000000 00000000 00000000
ext_cpuid[27]=000000ff 00000000 00000000 00000000
ext_cpuid[28]=00000000 00000000 00000000 00000000
ext_cpuid[29]=00000000 00000000 00000000 00000000
ext_cpuid[30]=00000000 00000000 00000000 00000000
ext_cpuid[31]=00000000 00000000 00000000 00000000
intel_fn4[0]=00000000 00000000 00000000 00000000
intel_fn4[1]=00000000 00000000 00000000 00000000
intel_fn4[2]=00000000 00000000 00000000 00000000
intel_fn4[3]=00000000 00000000 00000000 00000000
intel_fn11[0]=00000000 00000000 00000000 00000000
intel_fn11[1]=00000000 00000000 00000000 00000000
intel_fn11[2]=00000000 00000000 00000000 00000000
intel_fn11[3]=00000000 00000000 00000000 00000000
--------------------------------------------------------------------------------
15
1
0
20
1
2
2
32
32
512
0
-1
8
16
-1
-1
64
64
-1
-1
64 (authoritative)
Brazos Zacate (Dual-core)
fpu vme de pse tsc msr pae mce cx8 apic mtrr sep pge mca cmov pat pse36 clflush mmx fxsr sse sse2 ht pni monitor ssse3 cx16 syscall popcnt mmxext nx fxsr_opt rdtscp lm lahf_lm cmp_legacy svm abm misalignsse sse4a 3dnowprefetch ibs skinit wdt ts ttp tm_amd stc 100mhzsteps hwpstate constant_tsc
