basic_cpuid[0]=0000000b 756e6547 6c65746e 49656e69
basic_cpuid[1]=00020655 00100800 029ae3ff bfebfbff
basic_cpuid[2]=55035a01 00f0b2dd 00000000 09ca212c
basic_cpuid[3]=00000000 00000000 00000000 00000000
basic_cpuid[4]=1c004121 01c0003f 0000003f 00000000
basic_cpuid[5]=00000040 00000040 00000003 00001120
basic_cpuid[6]=00000007 00000002 00000001 00000000
basic_cpuid[7]=00000000 00000000 00000000 9c000000
basic_cpuid[8]=00000000 00000000 00000000 00000000
basic_cpuid[9]=00000000 00000000 00000000 00000000
basic_cpuid[10]=07300403 00000004 00000000 00000603
basic_cpuid[11]=00000001 00000002 00000100 00000000
basic_cpuid[12]=00000001 00000002 00000100 00000000
basic_cpuid[13]=00000001 00000002 00000100 00000000
basic_cpuid[14]=00000001 00000002 00000100 00000000
basic_cpuid[15]=00000001 00000002 00000100 00000000
basic_cpuid[16]=00000001 00000002 00000100 00000000
basic_cpuid[17]=00000001 00000002 00000100 00000000
basic_cpuid[18]=00000001 00000002 00000100 00000000
basic_cpuid[19]=00000001 00000002 00000100 00000000
basic_cpuid[20]=00000001 00000002 00000100 00000000
basic_cpuid[21]=00000001 00000002 00000100 00000000
basic_cpuid[22]=00000001 00000002 00000100 00000000
basic_cpuid[23]=00000001 00000002 00000100 00000000
basic_cpuid[24]=00000001 00000002 00000100 00000000
basic_cpuid[25]=00000001 00000002 00000100 00000000
basic_cpuid[26]=00000001 00000002 00000100 00000000
basic_cpuid[27]=00000001 00000002 00000100 00000000
basic_cpuid[28]=00000001 00000002 00000100 00000000
basic_cpuid[29]=00000001 00000002 00000100 00000000
basic_cpuid[30]=00000001 00000002 00000100 00000000
basic_cpuid[31]=00000001 00000002 00000100 00000000
ext_cpuid[0]=80000008 00000000 00000000 00000000
ext_cpuid[1]=00000000 00000000 00000001 28100800
ext_cpuid[2]=65746e49 2952286c 726f4320 4d542865
ext_cpuid[3]=35692029 55504320 20202020 4d202020
ext_cpuid[4]=30323520 20402020 30342e32 007a4847
ext_cpuid[5]=00000000 00000000 00000000 00000000
ext_cpuid[6]=00000000 00000000 01006040 00000000
ext_cpuid[7]=00000000 00000000 00000000 00000100
ext_cpuid[8]=00003024 00000000 00000000 00000000
ext_cpuid[9]=00000001 00000002 00000100 00000000
ext_cpuid[10]=00000001 00000002 00000100 00000000
ext_cpuid[11]=00000001 00000002 00000100 00000000
ext_cpuid[12]=00000001 00000002 00000100 00000000
ext_cpuid[13]=00000001 00000002 00000100 00000000
ext_cpuid[14]=00000001 00000002 00000100 00000000
ext_cpuid[15]=00000001 00000002 00000100 00000000
ext_cpuid[16]=00000001 00000002 00000100 00000000
ext_cpuid[17]=00000001 00000002 00000100 00000000
ext_cpuid[18]=00000001 00000002 00000100 00000000
ext_cpuid[19]=00000001 00000002 00000100 00000000
ext_cpuid[20]=00000001 00000002 00000100 00000000
ext_cpuid[21]=00000001 00000002 00000100 00000000
ext_cpuid[22]=00000001 00000002 00000100 00000000
ext_cpuid[23]=00000001 00000002 00000100 00000000
ext_cpuid[24]=00000001 00000002 00000100 00000000
ext_cpuid[25]=00000001 00000002 00000100 00000000
ext_cpuid[26]=00000001 00000002 00000100 00000000
ext_cpuid[27]=00000001 00000002 00000100 00000000
ext_cpuid[28]=00000001 00000002 00000100 00000000
ext_cpuid[29]=00000001 00000002 00000100 00000000
ext_cpuid[30]=00000001 00000002 00000100 00000000
ext_cpuid[31]=00000001 00000002 00000100 00000000
intel_fn4[0]=1c004121 01c0003f 0000003f 00000000
intel_fn4[1]=1c004122 00c0003f 0000007f 00000000
intel_fn4[2]=1c004143 01c0003f 000001ff 00000000
intel_fn4[3]=1c03c163 02c0003f 00000fff 00000002
intel_fn4[4]=00000000 00000000 00000000 00000000
intel_fn4[5]=00000000 00000000 00000000 00000000
intel_fn4[6]=00000000 00000000 00000000 00000000
intel_fn4[7]=00000000 00000000 00000000 00000000
intel_fn11[0]=00000001 00000002 00000100 00000000
intel_fn11[1]=00000004 00000004 00000201 00000000
intel_fn11[2]=00000000 00000000 00000002 00000000
intel_fn11[3]=00000000 00000000 00000003 00000000
--------------------------------------------------------------------------------
6
5
5
6
37
2
4
32
32
256
3072
-1
8
4
8
12
-1
64
64
64
64
-1
128 (non-authoritative)
Arrandale (Core i5)
fpu vme de pse tsc msr pae mce cx8 apic mtrr sep pge mca cmov pat pse36 clflush dts acpi mmx fxsr sse sse2 ss ht tm pbe pni pclmul dts64 monitor ds_cpl vmx smx est tm2 ssse3 cx16 xtpr pdcm sse4_1 sse4_2 syscall xd popcnt aes rdtscp lm lahf_lm constant_tsc
