basic_cpuid[0]=00000004 756e6547 6c65746e 49656e69
basic_cpuid[1]=000006d3 00000800 80002001 078bfbfd
basic_cpuid[2]=00000001 00000000 00000000 002c307d
basic_cpuid[3]=00000000 00000000 00000000 00000000
basic_cpuid[4]=00000121 01c0003f 0000003f 00000001
basic_cpuid[5]=00000121 01c0003f 0000003f 00000001
basic_cpuid[6]=00000121 01c0003f 0000003f 00000001
basic_cpuid[7]=00000121 01c0003f 0000003f 00000001
basic_cpuid[8]=00000121 01c0003f 0000003f 00000001
basic_cpuid[9]=00000121 01c0003f 0000003f 00000001
basic_cpuid[10]=00000121 01c0003f 0000003f 00000001
basic_cpuid[11]=00000121 01c0003f 0000003f 00000001
basic_cpuid[12]=00000121 01c0003f 0000003f 00000001
basic_cpuid[13]=00000121 01c0003f 0000003f 00000001
basic_cpuid[14]=00000121 01c0003f 0000003f 00000001
basic_cpuid[15]=00000121 01c0003f 0000003f 00000001
basic_cpuid[16]=00000121 01c0003f 0000003f 00000001
basic_cpuid[17]=00000121 01c0003f 0000003f 00000001
basic_cpuid[18]=00000121 01c0003f 0000003f 00000001
basic_cpuid[19]=00000121 01c0003f 0000003f 00000001
basic_cpuid[20]=00000121 01c0003f 0000003f 00000001
basic_cpuid[21]=00000121 01c0003f 0000003f 00000001
basic_cpuid[22]=00000121 01c0003f 0000003f 00000001
basic_cpuid[23]=00000121 01c0003f 0000003f 00000001
basic_cpuid[24]=00000121 01c0003f 0000003f 00000001
basic_cpuid[25]=00000121 01c0003f 0000003f 00000001
basic_cpuid[26]=00000121 01c0003f 0000003f 00000001
basic_cpuid[27]=00000121 01c0003f 0000003f 00000001
basic_cpuid[28]=00000121 01c0003f 0000003f 00000001
basic_cpuid[29]=00000121 01c0003f 0000003f 00000001
basic_cpuid[30]=00000121 01c0003f 0000003f 00000001
basic_cpuid[31]=00000121 01c0003f 0000003f 00000001
ext_cpuid[0]=8000000a 68747541 444d4163 69746e65
ext_cpuid[1]=000006d3 00000000 00000001 2191abfd
ext_cpuid[2]=554d4551 72695620 6c617574 55504320
ext_cpuid[3]=72657620 6e6f6973 70632820 2d343675
ext_cpuid[4]=6c656872 00002936 00000000 00000000
ext_cpuid[5]=01ff01ff 01ff01ff 40020140 40020140
ext_cpuid[6]=00000000 42004200 02008140 00000000
ext_cpuid[7]=00000000 00000000 00000000 00000000
ext_cpuid[8]=0000302e 00000000 00000000 00000000
ext_cpuid[9]=00000000 00000000 00000000 00000000
ext_cpuid[10]=00000001 00000010 00000000 00000000
ext_cpuid[11]=00000121 01c0003f 0000003f 00000001
ext_cpuid[12]=00000121 01c0003f 0000003f 00000001
ext_cpuid[13]=00000121 01c0003f 0000003f 00000001
ext_cpuid[14]=00000121 01c0003f 0000003f 00000001
ext_cpuid[15]=00000121 01c0003f 0000003f 00000001
ext_cpuid[16]=00000121 01c0003f 0000003f 00000001
ext_cpuid[17]=00000121 01c0003f 0000003f 00000001
ext_cpuid[18]=00000121 01c0003f 0000003f 00000001
ext_cpuid[19]=00000121 01c0003f 0000003f 00000001
ext_cpuid[20]=00000121 01c0003f 0000003f 00000001
ext_cpuid[21]=00000121 01c0003f 0000003f 00000001
ext_cpuid[22]=00000121 01c0003f 0000003f 00000001
ext_cpuid[23]=00000121 01c0003f 0000003f 00000001
ext_cpuid[24]=00000121 01c0003f 0000003f 00000001
ext_cpuid[25]=00000121 01c0003f 0000003f 00000001
ext_cpuid[26]=00000121 01c0003f 0000003f 00000001
ext_cpuid[27]=00000121 01c0003f 0000003f 00000001
ext_cpuid[28]=00000121 01c0003f 0000003f 00000001
ext_cpuid[29]=00000121 01c0003f 0000003f 00000001
ext_cpuid[30]=00000121 01c0003f 0000003f 00000001
ext_cpuid[31]=00000121 01c0003f 0000003f 00000001
intel_fn4[0]=00000121 01c0003f 0000003f 00000001
intel_fn4[1]=00000122 01c0003f 0000003f 00000001
intel_fn4[2]=00000143 03c0003f 00000fff 00000001
intel_fn4[3]=00000000 00000000 00000000 00000000
intel_fn4[4]=00000000 00000000 00000000 00000000
intel_fn4[5]=00000000 00000000 00000000 00000000
intel_fn4[6]=00000000 00000000 00000000 00000000
intel_fn4[7]=00000000 00000000 00000000 00000000
intel_fn11[0]=00000121 01c0003f 0000003f 00000001
intel_fn11[1]=00000122 01c0003f 0000003f 00000001
intel_fn11[2]=00000143 03c0003f 00000fff 00000001
intel_fn11[3]=00000000 00000000 00000000 00000000
--------------------------------------------------------------------------------
6
13
3
6
13
1
1
32
32
4096
-1
-1
8
16
-1
-1
64
64
-1
-1
64 (non-authoritative)
Pentium M (Dothan)
fpu de pse tsc msr pae mce cx8 apic mtrr sep pge mca cmov pat pse36 clflush mmx fxsr sse sse2 pni cx16 syscall xd lm lahf_lm
