------[ Logical CPU #0 ]------
CPUID 00000000: 0000000D-756E6547-6C65746E-49656E69 [GenuineIntel]
CPUID 00000001: 000306A9-00100800-7F9AE3BF-BFEBFBFF
CPUID 00000002: 76035A01-00F0B2FF-00000000-00CA0000
CPUID 00000003: 00000000-00000000-00000000-00000000
CPUID 00000004: 1C004121-01C0003F-0000003F-00000000
CPUID 00000004: 1C004122-01C0003F-0000003F-00000000
CPUID 00000004: 1C004143-01C0003F-000001FF-00000000
CPUID 00000004: 1C03C163-03C0003F-00001FFF-00000006
CPUID 00000005: 00000040-00000040-00000003-00001120
CPUID 00000006: 00000077-00000002-00000009-00000000
CPUID 00000007: 00000000-00000281-00000000-00000000
CPUID 00000008: 00000000-00000000-00000000-00000000
CPUID 00000009: 00000000-00000000-00000000-00000000
CPUID 0000000A: 07300403-00000000-00000000-00000603
CPUID 0000000B: 00000001-00000002-00000100-00000000
CPUID 0000000B: 00000004-00000008-00000201-00000000
CPUID 0000000C: 00000000-00000000-00000000-00000000
CPUID 0000000D: 00000007-00000340-00000340-00000000
CPUID 0000000D: 00000100-00000240-00000000-00000000
CPUID 80000000: 80000008-00000000-00000000-00000000
CPUID 80000001: 00000000-00000000-00000001-28100000
CPUID 80000002: 20202020-49202020-6C65746E-20295228 [       Intel(R) ]
CPUID 80000003: 65726F43-294D5428-2D376920-30373733 [Core(TM) i7-3770]
CPUID 80000004: 5043204B-20402055-30352E33-007A4847 [K CPU @ 3.50GHz]
CPUID 80000005: 00000000-00000000-00000000-00000000
CPUID 80000006: 00000000-00000000-01006040-00000000
CPUID 80000007: 00000000-00000000-00000000-00000100
CPUID 80000008: 00003024-00000000-00000000-00000000
------[ Logical CPU #1 ]------
CPUID 00000000: 0000000D-756E6547-6C65746E-49656E69 [GenuineIntel]
CPUID 00000001: 000306A9-01100800-7F9AE3BF-BFEBFBFF
CPUID 00000002: 76035A01-00F0B2FF-00000000-00CA0000
CPUID 00000003: 00000000-00000000-00000000-00000000
CPUID 00000004: 1C004121-01C0003F-0000003F-00000000
CPUID 00000004: 1C004122-01C0003F-0000003F-00000000
CPUID 00000004: 1C004143-01C0003F-000001FF-00000000
CPUID 00000004: 1C03C163-03C0003F-00001FFF-00000006
CPUID 00000005: 00000040-00000040-00000003-00001120
CPUID 00000006: 00000077-00000002-00000009-00000000
CPUID 00000007: 00000000-00000281-00000000-00000000
CPUID 00000008: 00000000-00000000-00000000-00000000
CPUID 00000009: 00000000-00000000-00000000-00000000
CPUID 0000000A: 07300403-00000000-00000000-00000603
CPUID 0000000B: 00000001-00000002-00000100-00000001
CPUID 0000000B: 00000004-00000008-00000201-00000001
CPUID 0000000C: 00000000-00000000-00000000-00000000
CPUID 0000000D: 00000007-00000340-00000340-00000000
CPUID 0000000D: 00000100-00000240-00000000-00000000
CPUID 80000000: 80000008-00000000-00000000-00000000
CPUID 80000001: 00000000-00000000-00000001-28100000
CPUID 80000002: 20202020-49202020-6C65746E-20295228 [       Intel(R) ]
CPUID 80000003: 65726F43-294D5428-2D376920-30373733 [Core(TM) i7-3770]
CPUID 80000004: 5043204B-20402055-30352E33-007A4847 [K CPU @ 3.50GHz]
CPUID 80000005: 00000000-00000000-00000000-00000000
CPUID 80000006: 00000000-00000000-01006040-00000000
CPUID 80000007: 00000000-00000000-00000000-00000100
CPUID 80000008: 00003024-00000000-00000000-00000000
------[ Logical CPU #2 ]------
CPUID 00000000: 0000000D-756E6547-6C65746E-49656E69 [GenuineIntel]
CPUID 00000001: 000306A9-02100800-7F9AE3BF-BFEBFBFF
CPUID 00000002: 76035A01-00F0B2FF-00000000-00CA0000
CPUID 00000003: 00000000-00000000-00000000-00000000
CPUID 00000004: 1C004121-01C0003F-0000003F-00000000
CPUID 00000004: 1C004122-01C0003F-0000003F-00000000
CPUID 00000004: 1C004143-01C0003F-000001FF-00000000
CPUID 00000004: 1C03C163-03C0003F-00001FFF-00000006
CPUID 00000005: 00000040-00000040-00000003-00001120
CPUID 00000006: 00000077-00000002-00000009-00000000
CPUID 00000007: 00000000-00000281-00000000-00000000
CPUID 00000008: 00000000-00000000-00000000-00000000
CPUID 00000009: 00000000-00000000-00000000-00000000
CPUID 0000000A: 07300403-00000000-00000000-00000603
CPUID 0000000B: 00000001-00000002-00000100-00000002
CPUID 0000000B: 00000004-00000008-00000201-00000002
CPUID 0000000C: 00000000-00000000-00000000-00000000
CPUID 0000000D: 00000007-00000340-00000340-00000000
CPUID 0000000D: 00000100-00000240-00000000-00000000
CPUID 80000000: 80000008-00000000-00000000-00000000
CPUID 80000001: 00000000-00000000-00000001-28100000
CPUID 80000002: 20202020-49202020-6C65746E-20295228 [       Intel(R) ]
CPUID 80000003: 65726F43-294D5428-2D376920-30373733 [Core(TM) i7-3770]
CPUID 80000004: 5043204B-20402055-30352E33-007A4847 [K CPU @ 3.50GHz]
CPUID 80000005: 00000000-00000000-00000000-00000000
CPUID 80000006: 00000000-00000000-01006040-00000000
CPUID 80000007: 00000000-00000000-00000000-00000100
CPUID 80000008: 00003024-00000000-00000000-00000000
------[ Logical CPU #3 ]------
CPUID 00000000: 0000000D-756E6547-6C65746E-49656E69 [GenuineIntel]
CPUID 00000001: 000306A9-03100800-7F9AE3BF-BFEBFBFF
CPUID 00000002: 76035A01-00F0B2FF-00000000-00CA0000
CPUID 00000003: 00000000-00000000-00000000-00000000
CPUID 00000004: 1C004121-01C0003F-0000003F-00000000
CPUID 00000004: 1C004122-01C0003F-0000003F-00000000
CPUID 00000004: 1C004143-01C0003F-000001FF-00000000
CPUID 00000004: 1C03C163-03C0003F-00001FFF-00000006
CPUID 00000005: 00000040-00000040-00000003-00001120
CPUID 00000006: 00000077-00000002-00000009-00000000
CPUID 00000007: 00000000-00000281-00000000-00000000
CPUID 00000008: 00000000-00000000-00000000-00000000
CPUID 00000009: 00000000-00000000-00000000-00000000
CPUID 0000000A: 07300403-00000000-00000000-00000603
CPUID 0000000B: 00000001-00000002-00000100-00000003
CPUID 0000000B: 00000004-00000008-00000201-00000003
CPUID 0000000C: 00000000-00000000-00000000-00000000
CPUID 0000000D: 00000007-00000340-00000340-00000000
CPUID 0000000D: 00000100-00000240-00000000-00000000
CPUID 80000000: 80000008-00000000-00000000-00000000
CPUID 80000001: 00000000-00000000-00000001-28100000
CPUID 80000002: 20202020-49202020-6C65746E-20295228 [       Intel(R) ]
CPUID 80000003: 65726F43-294D5428-2D376920-30373733 [Core(TM) i7-3770]
CPUID 80000004: 5043204B-20402055-30352E33-007A4847 [K CPU @ 3.50GHz]
CPUID 80000005: 00000000-00000000-00000000-00000000
CPUID 80000006: 00000000-00000000-01006040-00000000
CPUID 80000007: 00000000-00000000-00000000-00000100
CPUID 80000008: 00003024-00000000-00000000-00000000
------[ Logical CPU #4 ]------
CPUID 00000000: 0000000D-756E6547-6C65746E-49656E69 [GenuineIntel]
CPUID 00000001: 000306A9-04100800-7F9AE3BF-BFEBFBFF
CPUID 00000002: 76035A01-00F0B2FF-00000000-00CA0000
CPUID 00000003: 00000000-00000000-00000000-00000000
CPUID 00000004: 1C004121-01C0003F-0000003F-00000000
CPUID 00000004: 1C004122-01C0003F-0000003F-00000000
CPUID 00000004: 1C004143-01C0003F-000001FF-00000000
CPUID 00000004: 1C03C163-03C0003F-00001FFF-00000006
CPUID 00000005: 00000040-00000040-00000003-00001120
CPUID 00000006: 00000077-00000002-00000009-00000000
CPUID 00000007: 00000000-00000281-00000000-00000000
CPUID 00000008: 00000000-00000000-00000000-00000000
CPUID 00000009: 00000000-00000000-00000000-00000000
CPUID 0000000A: 07300403-00000000-00000000-00000603
CPUID 0000000B: 00000001-00000002-00000100-00000004
CPUID 0000000B: 00000004-00000008-00000201-00000004
CPUID 0000000C: 00000000-00000000-00000000-00000000
CPUID 0000000D: 00000007-00000340-00000340-00000000
CPUID 0000000D: 00000100-00000240-00000000-00000000
CPUID 80000000: 80000008-00000000-00000000-00000000
CPUID 80000001: 00000000-00000000-00000001-28100000
CPUID 80000002: 20202020-49202020-6C65746E-20295228 [       Intel(R) ]
CPUID 80000003: 65726F43-294D5428-2D376920-30373733 [Core(TM) i7-3770]
CPUID 80000004: 5043204B-20402055-30352E33-007A4847 [K CPU @ 3.50GHz]
CPUID 80000005: 00000000-00000000-00000000-00000000
CPUID 80000006: 00000000-00000000-01006040-00000000
CPUID 80000007: 00000000-00000000-00000000-00000100
CPUID 80000008: 00003024-00000000-00000000-00000000
------[ Logical CPU #5 ]------
CPUID 00000000: 0000000D-756E6547-6C65746E-49656E69 [GenuineIntel]
CPUID 00000001: 000306A9-05100800-7F9AE3BF-BFEBFBFF
CPUID 00000002: 76035A01-00F0B2FF-00000000-00CA0000
CPUID 00000003: 00000000-00000000-00000000-00000000
CPUID 00000004: 1C004121-01C0003F-0000003F-00000000
CPUID 00000004: 1C004122-01C0003F-0000003F-00000000
CPUID 00000004: 1C004143-01C0003F-000001FF-00000000
CPUID 00000004: 1C03C163-03C0003F-00001FFF-00000006
CPUID 00000005: 00000040-00000040-00000003-00001120
CPUID 00000006: 00000077-00000002-00000009-00000000
CPUID 00000007: 00000000-00000281-00000000-00000000
CPUID 00000008: 00000000-00000000-00000000-00000000
CPUID 00000009: 00000000-00000000-00000000-00000000
CPUID 0000000A: 07300403-00000000-00000000-00000603
CPUID 0000000B: 00000001-00000002-00000100-00000005
CPUID 0000000B: 00000004-00000008-00000201-00000005
CPUID 0000000C: 00000000-00000000-00000000-00000000
CPUID 0000000D: 00000007-00000340-00000340-00000000
CPUID 0000000D: 00000100-00000240-00000000-00000000
CPUID 80000000: 80000008-00000000-00000000-00000000
CPUID 80000001: 00000000-00000000-00000001-28100000
CPUID 80000002: 20202020-49202020-6C65746E-20295228 [       Intel(R) ]
CPUID 80000003: 65726F43-294D5428-2D376920-30373733 [Core(TM) i7-3770]
CPUID 80000004: 5043204B-20402055-30352E33-007A4847 [K CPU @ 3.50GHz]
CPUID 80000005: 00000000-00000000-00000000-00000000
CPUID 80000006: 00000000-00000000-01006040-00000000
CPUID 80000007: 00000000-00000000-00000000-00000100
CPUID 80000008: 00003024-00000000-00000000-00000000
------[ Logical CPU #6 ]------
CPUID 00000000: 0000000D-756E6547-6C65746E-49656E69 [GenuineIntel]
CPUID 00000001: 000306A9-06100800-7F9AE3BF-BFEBFBFF
CPUID 00000002: 76035A01-00F0B2FF-00000000-00CA0000
CPUID 00000003: 00000000-00000000-00000000-00000000
CPUID 00000004: 1C004121-01C0003F-0000003F-00000000
CPUID 00000004: 1C004122-01C0003F-0000003F-00000000
CPUID 00000004: 1C004143-01C0003F-000001FF-00000000
CPUID 00000004: 1C03C163-03C0003F-00001FFF-00000006
CPUID 00000005: 00000040-00000040-00000003-00001120
CPUID 00000006: 00000077-00000002-00000009-00000000
CPUID 00000007: 00000000-00000281-00000000-00000000
CPUID 00000008: 00000000-00000000-00000000-00000000
CPUID 00000009: 00000000-00000000-00000000-00000000
CPUID 0000000A: 07300403-00000000-00000000-00000603
CPUID 0000000B: 00000001-00000002-00000100-00000006
CPUID 0000000B: 00000004-00000008-00000201-00000006
CPUID 0000000C: 00000000-00000000-00000000-00000000
CPUID 0000000D: 00000007-00000340-00000340-00000000
CPUID 0000000D: 00000100-00000240-00000000-00000000
CPUID 80000000: 80000008-00000000-00000000-00000000
CPUID 80000001: 00000000-00000000-00000001-28100000
CPUID 80000002: 20202020-49202020-6C65746E-20295228 [       Intel(R) ]
CPUID 80000003: 65726F43-294D5428-2D376920-30373733 [Core(TM) i7-3770]
CPUID 80000004: 5043204B-20402055-30352E33-007A4847 [K CPU @ 3.50GHz]
CPUID 80000005: 00000000-00000000-00000000-00000000
CPUID 80000006: 00000000-00000000-01006040-00000000
CPUID 80000007: 00000000-00000000-00000000-00000100
CPUID 80000008: 00003024-00000000-00000000-00000000
------[ Logical CPU #7 ]------
CPUID 00000000: 0000000D-756E6547-6C65746E-49656E69 [GenuineIntel]
CPUID 00000001: 000306A9-07100800-7F9AE3BF-BFEBFBFF
CPUID 00000002: 76035A01-00F0B2FF-00000000-00CA0000
CPUID 00000003: 00000000-00000000-00000000-00000000
CPUID 00000004: 1C004121-01C0003F-0000003F-00000000
CPUID 00000004: 1C004122-01C0003F-0000003F-00000000
CPUID 00000004: 1C004143-01C0003F-000001FF-00000000
CPUID 00000004: 1C03C163-03C0003F-00001FFF-00000006
CPUID 00000005: 00000040-00000040-00000003-00001120
CPUID 00000006: 00000077-00000002-00000009-00000000
CPUID 00000007: 00000000-00000281-00000000-00000000
CPUID 00000008: 00000000-00000000-00000000-00000000
CPUID 00000009: 00000000-00000000-00000000-00000000
CPUID 0000000A: 07300403-00000000-00000000-00000603
CPUID 0000000B: 00000001-00000002-00000100-00000007
CPUID 0000000B: 00000004-00000008-00000201-00000007
CPUID 0000000C: 00000000-00000000-00000000-00000000
CPUID 0000000D: 00000007-00000340-00000340-00000000
CPUID 0000000D: 00000100-00000240-00000000-00000000
CPUID 80000000: 80000008-00000000-00000000-00000000
CPUID 80000001: 00000000-00000000-00000001-28100000
CPUID 80000002: 20202020-49202020-6C65746E-20295228 [       Intel(R) ]
CPUID 80000003: 65726F43-294D5428-2D376920-30373733 [Core(TM) i7-3770]
CPUID 80000004: 5043204B-20402055-30352E33-007A4847 [K CPU @ 3.50GHz]
CPUID 80000005: 00000000-00000000-00000000-00000000
CPUID 80000006: 00000000-00000000-01006040-00000000
CPUID 80000007: 00000000-00000000-00000000-00000100
CPUID 80000008: 00003024-00000000-00000000-00000000
--------------------------------------------------------------------------------
x86
x86-64-v3
general
6
10
9
6
58
8
8
-1
-1
-1
-1
-1
-1
-1
-1
-1
-1
-1
-1
-1
-1
-1
-1
-1
-1
-1
-1
128 (non-authoritative)
Core i7 (Ivy Bridge)
22 nm
fpu vme de pse tsc msr pae mce cx8 apic mtrr sep pge mca cmov pat pse36 clflush dts acpi mmx fxsr sse sse2 ss ht tm pbe pni pclmul dts64 monitor ds_cpl vmx est tm2 ssse3 cx16 xtpr pdcm sse4_1 sse4_2 xd popcnt aes xsave osxsave avx rdtscp lm lahf_lm constant_tsc f16c rdrand
