------[ Logical CPU #0 ]------
CPUID 00000000: 0000000A-746E6543-736C7561-48727561
CPUID 00000001: 000006FA-00020800-008863A9-AFC9FBFF
CPUID 00000002: 02B3B001-00000000-00000000-2C04307D
CPUID 00000003: 00000000-00000000-00000000-00000000
CPUID 00000004: 00000000-00000000-00000000-00000000
CPUID 00000005: 00000040-00000040-00000003-00022220
CPUID 00000006: 00000002-00000000-00000000-00000000
CPUID 00000007: 00000000-00000000-00000000-00000000
CPUID 00000008: 00000000-00000000-00000000-00000000
CPUID 00000009: 00000000-00000000-00000000-00000000
CPUID 0000000A: 06280202-00000000-00000000-00000503
CPUID 80000000: 80000008-00000000-00000000-00000000
CPUID 80000001: 00000000-00000000-00000001-20100800
CPUID 80000002: 20202020-20202020-20202020-56202020
CPUID 80000003: 4E204149-206F6E61-636F7270-6F737365
CPUID 80000004: 20202072-40202020-30303831-007A484D
CPUID 80000005: 00000000-08800880-40100140-40100140
CPUID 80000006: 00000000-00000000-04008140-00000000
CPUID 80000007: 00000000-00000000-00000000-00000000
CPUID 80000008: 00003024-00000000-00000000-00000000
CPUID C0000000: C0000004-00000000-00000000-00000000
CPUID C0000001: 000006FA-00000000-00000000-1EC13DCC
CPUID C0000002: 00000000-00000000-00000000-00000000
CPUID C0000003: 00000000-00000000-00000000-00000000
CPUID C0000004: 0000001C-08001263-08471263-00000000
------[ Logical CPU #1 ]------
CPUID 00000000: 0000000A-746E6543-736C7561-48727561
CPUID 00000001: 000006FA-02020800-008863A9-AFC9FBFF
CPUID 00000002: 02B3B001-00000000-00000000-2C04307D
CPUID 00000003: 00000000-00000000-00000000-00000000
CPUID 00000004: 00000000-00000000-00000000-00000000
CPUID 00000005: 00000040-00000040-00000003-00022220
CPUID 00000006: 00000002-00000000-00000000-00000000
CPUID 00000007: 00000000-00000000-00000000-00000000
CPUID 00000008: 00000000-00000000-00000000-00000000
CPUID 00000009: 00000000-00000000-00000000-00000000
CPUID 0000000A: 06280202-00000000-00000000-00000503
CPUID 80000000: 80000008-00000000-00000000-00000000
CPUID 80000001: 00000000-00000000-00000001-20100800
CPUID 80000002: 20202020-20202020-20202020-56202020
CPUID 80000003: 4E204149-206F6E61-636F7270-6F737365
CPUID 80000004: 20202072-40202020-30303831-007A484D
CPUID 80000005: 00000000-08800880-40100140-40100140
CPUID 80000006: 00000000-00000000-04008140-00000000
CPUID 80000007: 00000000-00000000-00000000-00000000
CPUID 80000008: 00003024-00000000-00000000-00000000
CPUID C0000000: C0000004-00000000-00000000-00000000
CPUID C0000001: 000006FA-00000000-00000000-1EC13DCC
CPUID C0000002: 00000000-00000000-00000000-00000000
CPUID C0000003: 00000000-00000000-00000000-00000000
CPUID C0000004: 00000026-08001263-08471263-00000000
--------------------------------------------------------------------------------
x86
general
6
15
10
6
15
2
2
-1
-1
-1
-1
-1
-1
-1
-1
-1
-1
-1
-1
-1
-1
-1
-1
-1
-1
-1
-1
-1 (non-authoritative)
VIA Nano X2 (Isaiah)
fpu vme de pse tsc msr pae mce cx8 apic mtrr sep pge mca cmov pat clflush mmx fxsr sse sse2 pni monitor ssse3 cx16 sse4_1 syscall popcnt lm lahf_lm
