------[ Logical CPU #0 ]------
CPUID 00000000: 0000000A-746E6543-736C7561-48727561
CPUID 00000001: 000006FC-00080800-008863A9-BFC9FBFF
CPUID 00000002: 02B3B001-00000000-00000000-2C04307D
CPUID 00000003: 00000000-00000000-00000000-00000000
CPUID 00000004: 1C000021-03C0003F-0000003F-00000000
CPUID 00000004: 1C000022-03C0003F-0000003F-00000000
CPUID 00000004: 1C000043-07C0003F-000001FF-00000000
CPUID 00000005: 00000040-00000040-00000003-00022220
CPUID 00000006: 00000002-00000000-00000000-00000000
CPUID 00000007: 00000000-00000000-00000000-00000000
CPUID 00000008: 00000000-00000000-00000000-00000000
CPUID 00000009: 00000000-00000000-00000000-00000000
CPUID 0000000A: 06280202-00000000-00000000-00000503
CPUID 80000000: 80000008-00000000-00000000-00000000
CPUID 80000001: 00000000-00000000-00000001-20100800
CPUID 80000002: 20202020-20202020-20202020-20202020
CPUID 80000003: 49562020-75512041-6F436461-4C206572
CPUID 80000004: 30303734-31204020-202B322E-007A4847
CPUID 80000005: 00000000-08800880-40100140-40100140
CPUID 80000006: 00000000-00000000-04008140-00000000
CPUID 80000007: 00000000-00000000-00000000-00000000
CPUID 80000008: 00003024-00000000-00000000-00000000
CPUID C0000000: C0000004-00000000-00000000-00000000
CPUID C0000001: 000006FC-00000000-00000000-1EC33DCC
CPUID C0000002: 00000000-00000000-00000000-00000000
CPUID C0000003: 00000000-00000000-00000000-00000000
CPUID C0000004: 0000001F-08000B67-08540B66-00000000
------[ Logical CPU #1 ]------
CPUID 00000000: 0000000A-746E6543-736C7561-48727561
CPUID 00000001: 000006FC-02080800-008863A9-BFC9FBFF
CPUID 00000002: 02B3B001-00000000-00000000-2C04307D
CPUID 00000003: 00000000-00000000-00000000-00000000
CPUID 00000004: 1C000021-03C0003F-0000003F-00000000
CPUID 00000004: 1C000022-03C0003F-0000003F-00000000
CPUID 00000004: 1C000043-07C0003F-000001FF-00000000
CPUID 00000005: 00000040-00000040-00000003-00022220
CPUID 00000006: 00000002-00000000-00000000-00000000
CPUID 00000007: 00000000-00000000-00000000-00000000
CPUID 00000008: 00000000-00000000-00000000-00000000
CPUID 00000009: 00000000-00000000-00000000-00000000
CPUID 0000000A: 06280202-00000000-00000000-00000503
CPUID 80000000: 80000008-00000000-00000000-00000000
CPUID 80000001: 00000000-00000000-00000001-20100800
CPUID 80000002: 20202020-20202020-20202020-20202020
CPUID 80000003: 49562020-75512041-6F436461-4C206572
CPUID 80000004: 30303734-31204020-202B322E-007A4847
CPUID 80000005: 00000000-08800880-40100140-40100140
CPUID 80000006: 00000000-00000000-04008140-00000000
CPUID 80000007: 00000000-00000000-00000000-00000000
CPUID 80000008: 00003024-00000000-00000000-00000000
CPUID C0000000: C0000004-00000000-00000000-00000000
CPUID C0000001: 000006FC-00000000-00000000-1EC33DCC
CPUID C0000002: 00000000-00000000-00000000-00000000
CPUID C0000003: 00000000-00000000-00000000-00000000
CPUID C0000004: 0000001E-08000B67-08540B66-00000000
------[ Logical CPU #2 ]------
CPUID 00000000: 0000000A-746E6543-736C7561-48727561
CPUID 00000001: 000006FC-04080800-008863A9-BFC9FBFF
CPUID 00000002: 02B3B001-00000000-00000000-2C04307D
CPUID 00000003: 00000000-00000000-00000000-00000000
CPUID 00000004: 1C000021-03C0003F-0000003F-00000000
CPUID 00000004: 1C000022-03C0003F-0000003F-00000000
CPUID 00000004: 1C000043-07C0003F-000001FF-00000000
CPUID 00000005: 00000040-00000040-00000003-00022220
CPUID 00000006: 00000002-00000000-00000000-00000000
CPUID 00000007: 00000000-00000000-00000000-00000000
CPUID 00000008: 00000000-00000000-00000000-00000000
CPUID 00000009: 00000000-00000000-00000000-00000000
CPUID 0000000A: 06280202-00000000-00000000-00000503
CPUID 80000000: 80000008-00000000-00000000-00000000
CPUID 80000001: 00000000-00000000-00000001-20100800
CPUID 80000002: 20202020-20202020-20202020-20202020
CPUID 80000003: 49562020-75512041-6F436461-4C206572
CPUID 80000004: 30303734-31204020-202B322E-007A4847
CPUID 80000005: 00000000-08800880-40100140-40100140
CPUID 80000006: 00000000-00000000-04008140-00000000
CPUID 80000007: 00000000-00000000-00000000-00000000
CPUID 80000008: 00003024-00000000-00000000-00000000
CPUID C0000000: C0000004-00000000-00000000-00000000
CPUID C0000001: 000006FC-00000000-00000000-1EC33DCC
CPUID C0000002: 00000000-00000000-00000000-00000000
CPUID C0000003: 00000000-00000000-00000000-00000000
CPUID C0000004: 0000001E-08000B67-08540B66-00000000
------[ Logical CPU #3 ]------
CPUID 00000000: 0000000A-746E6543-736C7561-48727561
CPUID 00000001: 000006FC-06080800-008863A9-BFC9FBFF
CPUID 00000002: 02B3B001-00000000-00000000-2C04307D
CPUID 00000003: 00000000-00000000-00000000-00000000
CPUID 00000004: 1C000021-03C0003F-0000003F-00000000
CPUID 00000004: 1C000022-03C0003F-0000003F-00000000
CPUID 00000004: 1C000043-07C0003F-000001FF-00000000
CPUID 00000005: 00000040-00000040-00000003-00022220
CPUID 00000006: 00000002-00000000-00000000-00000000
CPUID 00000007: 00000000-00000000-00000000-00000000
CPUID 00000008: 00000000-00000000-00000000-00000000
CPUID 00000009: 00000000-00000000-00000000-00000000
CPUID 0000000A: 06280202-00000000-00000000-00000503
CPUID 80000000: 80000008-00000000-00000000-00000000
CPUID 80000001: 00000000-00000000-00000001-20100800
CPUID 80000002: 20202020-20202020-20202020-20202020
CPUID 80000003: 49562020-75512041-6F436461-4C206572
CPUID 80000004: 30303734-31204020-202B322E-007A4847
CPUID 80000005: 00000000-08800880-40100140-40100140
CPUID 80000006: 00000000-00000000-04008140-00000000
CPUID 80000007: 00000000-00000000-00000000-00000000
CPUID 80000008: 00003024-00000000-00000000-00000000
CPUID C0000000: C0000004-00000000-00000000-00000000
CPUID C0000001: 000006FC-00000000-00000000-1EC33DCC
CPUID C0000002: 00000000-00000000-00000000-00000000
CPUID C0000003: 00000000-00000000-00000000-00000000
CPUID C0000004: 0000001E-08000B67-08540B66-00000000
--------------------------------------------------------------------------------
x86
general
6
15
12
6
15
4
4
-1
-1
-1
-1
-1
-1
-1
-1
-1
-1
-1
-1
-1
-1
-1
-1
-1
-1
-1
-1
-1 (non-authoritative)
VIA Nano X4 (Isaiah)
fpu vme de pse tsc msr pae mce cx8 apic mtrr sep pge mca cmov pat clflush mmx fxsr sse sse2 ht pni monitor ssse3 cx16 sse4_1 syscall popcnt lm lahf_lm
