------[ Logical CPU #0 ]------
CPUID 00000000: 0000000A-746E6543-736C7561-48727561
CPUID 00000001: 000006F8-00010800-008863A9-AFC9FBFF
CPUID 00000002: 02B3B001-00000000-00000000-2C04307D
CPUID 00000003: 00000000-00000000-00000000-00000000
CPUID 00000005: 00000040-00000040-00000003-00022220
CPUID 00000006: 00000000-00000000-00000000-00000000
CPUID 00000007: 00000000-00000000-00000000-00000000
CPUID 00000008: 00000000-00000000-00000000-00000000
CPUID 00000009: 00000000-00000000-00000000-00000000
CPUID 0000000A: 06280202-00000000-00000000-00000503
CPUID 80000000: 80000008-00000000-00000000-00000000
CPUID 80000001: 00000000-00000000-00000001-20100800
CPUID 80000002: 20202020-20202020-20202020-20202020
CPUID 80000003: 20202020-20202020-41495620-6E614E20
CPUID 80000004: 334C206F-40303530-30303831-007A484D
CPUID 80000005: 00000000-08800880-40100140-40100140
CPUID 80000006: 00000000-00000000-04008140-00000000
CPUID 80000007: 00000000-00000000-00000000-00000000
CPUID 80000008: 00003024-00000000-00000000-00000000
CPUID C0000000: C0000004-00000000-00000000-00000000
CPUID C0000001: 000006F8-00000000-00000000-1EC33DCC
CPUID C0000002: 00000000-00000000-00000000-00000000
CPUID C0000003: 00000000-00000000-00000000-00000000
CPUID C0000004: 0000002A-08001265-08571265-00000000
--------------------------------------------------------------------------------
x86
general
6
15
8
6
15
1
1
-1
-1
-1
-1
-1
-1
-1
-1
-1
-1
-1
-1
-1
-1
-1
-1
-1
-1
-1
-1
-1 (non-authoritative)
VIA Nano (Isaiah)
fpu vme de pse tsc msr pae mce cx8 apic mtrr sep pge mca cmov pat clflush mmx fxsr sse sse2 pni monitor ssse3 cx16 sse4_1 syscall popcnt lm lahf_lm
