------[ CPUID Registers / Logical CPU #0 ]------
CPUID 00000000: 0000000D-746E6543-736C7561-48727561 [CentaurHauls]
CPUID 00000001: 000307B2-00040800-7FDA63EB-BFCBFBFF
CPUID 00000002: 635AF001-00000000-00000000-000000FF
CPUID 00000003: 00000000-00000000-00000000-00000000
CPUID 00000004: 0C000121-01C0003F-0000003F-00000000 [SL 00] [L1D: 32 KB]
CPUID 00000004: 0C000122-01C0003F-0000003F-00000000 [SL 01] [L1I: 32 KB]
CPUID 00000004: 0C00C143-03C0003F-00000FFF-00000002 [SL 02] [L2U: 4 MB]
CPUID 00000005: 00000040-00000040-00000003-00022220
CPUID 00000006: 00000E81-00000000-00000001-00000000
CPUID 00000007: 00000000-201C258B-0040000C-24000000 [SL 00]
CPUID 00000008: 00000000-00000000-00000000-00000000
CPUID 00000009: 00000000-00000000-00000000-00000000
CPUID 0000000A: 07300402-00000000-00000000-00000603
CPUID 0000000B: 00000000-00000001-00000100-00000000 [SL 00]
CPUID 0000000B: 00000002-00000004-00000201-00000000 [SL 01]
CPUID 0000000C: 00000000-00000000-00000000-00000000
CPUID 0000000D: 00000207-00000340-00000A88-00000000 [SL 00] [x87]
CPUID 0000000D: 00000001-00000000-00000000-00000000 [SL 01] [SSE]
CPUID 0000000D: 00000100-00000240-00000000-00000000 [SL 02] [AVX]
CPUID 0000000D: 00000008-00000A80-00000000-00000000 [SL 09] [PKRU]
CPUID 80000000: 80000008-00000000-00000000-00000000
CPUID 80000001: 00000000-00000000-00000121-2C100800
CPUID 80000002: 20202020-20202020-20202020-485A2020 [              ZH]
CPUID 80000003: 49584F41-614B204E-61695869-584B206E [AOXIN KaiXian KX]
CPUID 80000004: 3030362D-342F4730-362E3240-007A4847 [-6000G/4@2.6GHz]
CPUID 80000005: 04200420-06600660-20080140-20080140 [L1D: 32 KB / L1I: 32 KB]
CPUID 80000006: 00000000-00000000-10008140-00000000 [L2: 4096 KB] / L3: 0 KB]
CPUID 80000007: 00000000-00000000-00000000-00000100
CPUID 80000008: 00003028-00000000-00000000-00000000
CPUID C0000000: C0000005-00000000-00000000-00000000
CPUID C0000001: 000307B2-00000000-00000000-1EC03DFF
CPUID C0000002: 00000000-00000000-00000000-00000000
CPUID C0000003: 00000000-00000000-00000000-00000000
CPUID C0000004: 0000002B-1000105B-105B42C7-00000000
CPUID C0000005: 00000082-00000000-00000000-00000000
------[ CPUID Registers / Logical CPU #1 ]------
CPUID 00000000: 0000000D-746E6543-736C7561-48727561 [CentaurHauls]
CPUID 00000001: 000307B2-01040800-7FDA63EB-BFCBFBFF
CPUID 00000002: 635AF001-00000000-00000000-000000FF
CPUID 00000003: 00000000-00000000-00000000-00000000
CPUID 00000004: 0C000121-01C0003F-0000003F-00000000 [SL 00] [L1D: 32 KB]
CPUID 00000004: 0C000122-01C0003F-0000003F-00000000 [SL 01] [L1I: 32 KB]
CPUID 00000004: 0C00C143-03C0003F-00000FFF-00000002 [SL 02] [L2U: 4 MB]
CPUID 00000005: 00000040-00000040-00000003-00022220
CPUID 00000006: 00000E81-00000000-00000001-00000000
CPUID 00000007: 00000000-201C258B-0040000C-24000000 [SL 00]
CPUID 00000008: 00000000-00000000-00000000-00000000
CPUID 00000009: 00000000-00000000-00000000-00000000
CPUID 0000000A: 07300402-00000000-00000000-00000603
CPUID 0000000B: 00000000-00000001-00000100-00000001 [SL 00]
CPUID 0000000B: 00000002-00000004-00000201-00000001 [SL 01]
CPUID 0000000C: 00000000-00000000-00000000-00000000
CPUID 0000000D: 00000207-00000340-00000A88-00000000 [SL 00] [x87]
CPUID 0000000D: 00000001-00000000-00000000-00000000 [SL 01] [SSE]
CPUID 0000000D: 00000100-00000240-00000000-00000000 [SL 02] [AVX]
CPUID 0000000D: 00000008-00000A80-00000000-00000000 [SL 09] [PKRU]
CPUID 80000000: 80000008-00000000-00000000-00000000
CPUID 80000001: 00000000-00000000-00000121-2C100800
CPUID 80000002: 20202020-20202020-20202020-485A2020 [              ZH]
CPUID 80000003: 49584F41-614B204E-61695869-584B206E [AOXIN KaiXian KX]
CPUID 80000004: 3030362D-342F4730-362E3240-007A4847 [-6000G/4@2.6GHz]
CPUID 80000005: 04200420-06600660-20080140-20080140 [L1D: 32 KB / L1I: 32 KB]
CPUID 80000006: 00000000-00000000-10008140-00000000 [L2: 4096 KB] / L3: 0 KB]
CPUID 80000007: 00000000-00000000-00000000-00000100
CPUID 80000008: 00003028-00000000-00000000-00000000
CPUID C0000000: C0000005-00000000-00000000-00000000
CPUID C0000001: 000307B2-00000000-00000000-1EC03DFF
CPUID C0000002: 00000000-00000000-00000000-00000000
CPUID C0000003: 00000000-00000000-00000000-00000000
CPUID C0000004: 0000002B-1000105B-105B42C7-00000000
CPUID C0000005: 00000082-00000000-00000000-00000000
------[ CPUID Registers / Logical CPU #2 ]------
CPUID 00000000: 0000000D-746E6543-736C7561-48727561 [CentaurHauls]
CPUID 00000001: 000307B2-02040800-7FDA63EB-BFCBFBFF
CPUID 00000002: 635AF001-00000000-00000000-000000FF
CPUID 00000003: 00000000-00000000-00000000-00000000
CPUID 00000004: 0C000121-01C0003F-0000003F-00000000 [SL 00] [L1D: 32 KB]
CPUID 00000004: 0C000122-01C0003F-0000003F-00000000 [SL 01] [L1I: 32 KB]
CPUID 00000004: 0C00C143-03C0003F-00000FFF-00000002 [SL 02] [L2U: 4 MB]
CPUID 00000005: 00000040-00000040-00000003-00022220
CPUID 00000006: 00000E81-00000000-00000001-00000000
CPUID 00000007: 00000000-201C258B-0040000C-24000000 [SL 00]
CPUID 00000008: 00000000-00000000-00000000-00000000
CPUID 00000009: 00000000-00000000-00000000-00000000
CPUID 0000000A: 07300402-00000000-00000000-00000603
CPUID 0000000B: 00000000-00000001-00000100-00000002 [SL 00]
CPUID 0000000B: 00000002-00000004-00000201-00000002 [SL 01]
CPUID 0000000C: 00000000-00000000-00000000-00000000
CPUID 0000000D: 00000207-00000340-00000A88-00000000 [SL 00] [x87]
CPUID 0000000D: 00000001-00000000-00000000-00000000 [SL 01] [SSE]
CPUID 0000000D: 00000100-00000240-00000000-00000000 [SL 02] [AVX]
CPUID 0000000D: 00000008-00000A80-00000000-00000000 [SL 09] [PKRU]
CPUID 80000000: 80000008-00000000-00000000-00000000
CPUID 80000001: 00000000-00000000-00000121-2C100800
CPUID 80000002: 20202020-20202020-20202020-485A2020 [              ZH]
CPUID 80000003: 49584F41-614B204E-61695869-584B206E [AOXIN KaiXian KX]
CPUID 80000004: 3030362D-342F4730-362E3240-007A4847 [-6000G/4@2.6GHz]
CPUID 80000005: 04200420-06600660-20080140-20080140 [L1D: 32 KB / L1I: 32 KB]
CPUID 80000006: 00000000-00000000-10008140-00000000 [L2: 4096 KB] / L3: 0 KB]
CPUID 80000007: 00000000-00000000-00000000-00000100
CPUID 80000008: 00003028-00000000-00000000-00000000
CPUID C0000000: C0000005-00000000-00000000-00000000
CPUID C0000001: 000307B2-00000000-00000000-1EC03DFF
CPUID C0000002: 00000000-00000000-00000000-00000000
CPUID C0000003: 00000000-00000000-00000000-00000000
CPUID C0000004: 0000002A-1000105B-105B42C7-00000000
CPUID C0000005: 00000082-00000000-00000000-00000000
------[ CPUID Registers / Logical CPU #3 ]------
CPUID 00000000: 0000000D-746E6543-736C7561-48727561 [CentaurHauls]
CPUID 00000001: 000307B2-03040800-7FDA63EB-BFCBFBFF
CPUID 00000002: 635AF001-00000000-00000000-000000FF
CPUID 00000003: 00000000-00000000-00000000-00000000
CPUID 00000004: 0C000121-01C0003F-0000003F-00000000 [SL 00] [L1D: 32 KB]
CPUID 00000004: 0C000122-01C0003F-0000003F-00000000 [SL 01] [L1I: 32 KB]
CPUID 00000004: 0C00C143-03C0003F-00000FFF-00000002 [SL 02] [L2U: 4 MB]
CPUID 00000005: 00000040-00000040-00000003-00022220
CPUID 00000006: 00000E81-00000000-00000001-00000000
CPUID 00000007: 00000000-201C258B-0040000C-24000000 [SL 00]
CPUID 00000008: 00000000-00000000-00000000-00000000
CPUID 00000009: 00000000-00000000-00000000-00000000
CPUID 0000000A: 07300402-00000000-00000000-00000603
CPUID 0000000B: 00000000-00000001-00000100-00000003 [SL 00]
CPUID 0000000B: 00000002-00000004-00000201-00000003 [SL 01]
CPUID 0000000C: 00000000-00000000-00000000-00000000
CPUID 0000000D: 00000207-00000340-00000A88-00000000 [SL 00] [x87]
CPUID 0000000D: 00000001-00000000-00000000-00000000 [SL 01] [SSE]
CPUID 0000000D: 00000100-00000240-00000000-00000000 [SL 02] [AVX]
CPUID 0000000D: 00000008-00000A80-00000000-00000000 [SL 09] [PKRU]
CPUID 80000000: 80000008-00000000-00000000-00000000
CPUID 80000001: 00000000-00000000-00000121-2C100800
CPUID 80000002: 20202020-20202020-20202020-485A2020 [              ZH]
CPUID 80000003: 49584F41-614B204E-61695869-584B206E [AOXIN KaiXian KX]
CPUID 80000004: 3030362D-342F4730-362E3240-007A4847 [-6000G/4@2.6GHz]
CPUID 80000005: 04200420-06600660-20080140-20080140 [L1D: 32 KB / L1I: 32 KB]
CPUID 80000006: 00000000-00000000-10008140-00000000 [L2: 4096 KB] / L3: 0 KB]
CPUID 80000007: 00000000-00000000-00000000-00000100
CPUID 80000008: 00003028-00000000-00000000-00000000
CPUID C0000000: C0000005-00000000-00000000-00000000
CPUID C0000001: 000307B2-00000000-00000000-1EC03DFF
CPUID C0000002: 00000000-00000000-00000000-00000000
CPUID C0000003: 00000000-00000000-00000000-00000000
CPUID C0000004: 0000002A-1000105B-105B42C7-00000000
CPUID C0000005: 00000082-00000000-00000000-00000000
--------------------------------------------------------------------------------
x86
general
7
11
2
7
59
4
4
32
32
4096
-1
-1
8
8
16
-1
-1
64
64
64
-1
-1
-1
-1
-1
-1
-1
-1 (non-authoritative)
Zhaoxin KaiXian (LuJiaZui)
fpu vme de pse tsc msr pae mce cx8 apic mtrr sep pge mca cmov pat pse36 clflush mmx fxsr sse sse2 ht pni pclmul monitor ssse3 cx16 sse4_1 sse4_2 syscall movbe popcnt aes xsave osxsave avx rdtscp lm lahf_lm abm constant_tsc f16c rdrand bmi1 bmi2 sha_ni rdseed adx
