_________________ Logical CPU #0 _________________
basic_cpuid[0]=0000000b 756e6547 6c65746e 49656e69
basic_cpuid[1]=00030678 00100800 41d8e3bf bfebfbff
basic_cpuid[2]=61b3a001 0000ffc2 00000000 00000000
basic_cpuid[3]=00000000 00000000 00000000 00000000
basic_cpuid[4]=1c000121 0140003f 0000003f 00000001
basic_cpuid[5]=00000040 00000040 00000003 33000020
basic_cpuid[6]=00000007 00000002 00000009 00000000
basic_cpuid[7]=00000000 00002282 00000000 0c000400
basic_cpuid[8]=00000000 00000000 00000000 00000000
basic_cpuid[9]=00000000 00000000 00000000 00000000
basic_cpuid[10]=07280203 00000000 00000000 00004503
basic_cpuid[11]=00000001 00000001 00000100 00000000
basic_cpuid[12]=00000001 00000001 00000100 00000000
basic_cpuid[13]=00000001 00000001 00000100 00000000
basic_cpuid[14]=00000001 00000001 00000100 00000000
basic_cpuid[15]=00000001 00000001 00000100 00000000
basic_cpuid[16]=00000001 00000001 00000100 00000000
basic_cpuid[17]=00000001 00000001 00000100 00000000
basic_cpuid[18]=00000001 00000001 00000100 00000000
basic_cpuid[19]=00000001 00000001 00000100 00000000
basic_cpuid[20]=00000001 00000001 00000100 00000000
basic_cpuid[21]=00000001 00000001 00000100 00000000
basic_cpuid[22]=00000001 00000001 00000100 00000000
basic_cpuid[23]=00000001 00000001 00000100 00000000
basic_cpuid[24]=00000001 00000001 00000100 00000000
basic_cpuid[25]=00000001 00000001 00000100 00000000
basic_cpuid[26]=00000001 00000001 00000100 00000000
basic_cpuid[27]=00000001 00000001 00000100 00000000
basic_cpuid[28]=00000001 00000001 00000100 00000000
basic_cpuid[29]=00000001 00000001 00000100 00000000
basic_cpuid[30]=00000001 00000001 00000100 00000000
basic_cpuid[31]=00000001 00000001 00000100 00000000
ext_cpuid[0]=80000008 00000000 00000000 00000000
ext_cpuid[1]=00000000 00000000 00000101 28100800
ext_cpuid[2]=20202020 6e492020 286c6574 43202952
ext_cpuid[3]=72656c65 52286e6f 50432029 4e202055
ext_cpuid[4]=30333932 20402020 33382e31 007a4847
ext_cpuid[5]=00000000 00000000 00000000 00000000
ext_cpuid[6]=00000000 00000000 04008040 00000000
ext_cpuid[7]=00000000 00000000 00000000 00000100
ext_cpuid[8]=00003024 00000000 00000000 00000000
ext_cpuid[9]=00000001 00000001 00000100 00000000
ext_cpuid[10]=00000001 00000001 00000100 00000000
ext_cpuid[11]=00000001 00000001 00000100 00000000
ext_cpuid[12]=00000001 00000001 00000100 00000000
ext_cpuid[13]=00000001 00000001 00000100 00000000
ext_cpuid[14]=00000001 00000001 00000100 00000000
ext_cpuid[15]=00000001 00000001 00000100 00000000
ext_cpuid[16]=00000001 00000001 00000100 00000000
ext_cpuid[17]=00000001 00000001 00000100 00000000
ext_cpuid[18]=00000001 00000001 00000100 00000000
ext_cpuid[19]=00000001 00000001 00000100 00000000
ext_cpuid[20]=00000001 00000001 00000100 00000000
ext_cpuid[21]=00000001 00000001 00000100 00000000
ext_cpuid[22]=00000001 00000001 00000100 00000000
ext_cpuid[23]=00000001 00000001 00000100 00000000
ext_cpuid[24]=00000001 00000001 00000100 00000000
ext_cpuid[25]=00000001 00000001 00000100 00000000
ext_cpuid[26]=00000001 00000001 00000100 00000000
ext_cpuid[27]=00000001 00000001 00000100 00000000
ext_cpuid[28]=00000001 00000001 00000100 00000000
ext_cpuid[29]=00000001 00000001 00000100 00000000
ext_cpuid[30]=00000001 00000001 00000100 00000000
ext_cpuid[31]=00000001 00000001 00000100 00000000
intel_fn4[0]=1c000121 0140003f 0000003f 00000001
intel_fn4[1]=1c000122 01c0003f 0000003f 00000001
intel_fn4[2]=1c00c143 03c0003f 000003ff 00000001
intel_fn4[3]=00000000 00000000 00000000 00000000
intel_fn4[4]=00000000 00000000 00000000 00000000
intel_fn4[5]=00000000 00000000 00000000 00000000
intel_fn4[6]=00000000 00000000 00000000 00000000
intel_fn4[7]=00000000 00000000 00000000 00000000
intel_fn11[0]=00000001 00000001 00000100 00000000
intel_fn11[1]=00000004 00000004 00000201 00000000
intel_fn11[2]=00000000 00000000 00000002 00000000
intel_fn11[3]=00000000 00000000 00000003 00000000
amd_fn8000001dh[0]=00000001 00000001 00000100 00000000
amd_fn8000001dh[1]=00000004 00000004 00000201 00000000
amd_fn8000001dh[2]=00000000 00000000 00000002 00000000
amd_fn8000001dh[3]=00000000 00000000 00000003 00000000
_________________ Logical CPU #1 _________________
basic_cpuid[0]=0000000b 756e6547 6c65746e 49656e69
basic_cpuid[1]=00030678 02100800 41d8e3bf bfebfbff
basic_cpuid[2]=61b3a001 0000ffc2 00000000 00000000
basic_cpuid[3]=00000000 00000000 00000000 00000000
basic_cpuid[4]=1c000121 0140003f 0000003f 00000001
basic_cpuid[5]=00000040 00000040 00000003 33000020
basic_cpuid[6]=00000007 00000002 00000009 00000000
basic_cpuid[7]=00000000 00002282 00000000 0c000400
basic_cpuid[8]=00000000 00000000 00000000 00000000
basic_cpuid[9]=00000000 00000000 00000000 00000000
basic_cpuid[10]=07280203 00000000 00000000 00004503
basic_cpuid[11]=00000001 00000001 00000100 00000002
basic_cpuid[12]=00000001 00000001 00000100 00000002
basic_cpuid[13]=00000001 00000001 00000100 00000002
basic_cpuid[14]=00000001 00000001 00000100 00000002
basic_cpuid[15]=00000001 00000001 00000100 00000002
basic_cpuid[16]=00000001 00000001 00000100 00000002
basic_cpuid[17]=00000001 00000001 00000100 00000002
basic_cpuid[18]=00000001 00000001 00000100 00000002
basic_cpuid[19]=00000001 00000001 00000100 00000002
basic_cpuid[20]=00000001 00000001 00000100 00000002
basic_cpuid[21]=00000001 00000001 00000100 00000002
basic_cpuid[22]=00000001 00000001 00000100 00000002
basic_cpuid[23]=00000001 00000001 00000100 00000002
basic_cpuid[24]=00000001 00000001 00000100 00000002
basic_cpuid[25]=00000001 00000001 00000100 00000002
basic_cpuid[26]=00000001 00000001 00000100 00000002
basic_cpuid[27]=00000001 00000001 00000100 00000002
basic_cpuid[28]=00000001 00000001 00000100 00000002
basic_cpuid[29]=00000001 00000001 00000100 00000002
basic_cpuid[30]=00000001 00000001 00000100 00000002
basic_cpuid[31]=00000001 00000001 00000100 00000002
ext_cpuid[0]=80000008 00000000 00000000 00000000
ext_cpuid[1]=00000000 00000000 00000101 28100800
ext_cpuid[2]=20202020 6e492020 286c6574 43202952
ext_cpuid[3]=72656c65 52286e6f 50432029 4e202055
ext_cpuid[4]=30333932 20402020 33382e31 007a4847
ext_cpuid[5]=00000000 00000000 00000000 00000000
ext_cpuid[6]=00000000 00000000 04008040 00000000
ext_cpuid[7]=00000000 00000000 00000000 00000100
ext_cpuid[8]=00003024 00000000 00000000 00000000
ext_cpuid[9]=00000001 00000001 00000100 00000002
ext_cpuid[10]=00000001 00000001 00000100 00000002
ext_cpuid[11]=00000001 00000001 00000100 00000002
ext_cpuid[12]=00000001 00000001 00000100 00000002
ext_cpuid[13]=00000001 00000001 00000100 00000002
ext_cpuid[14]=00000001 00000001 00000100 00000002
ext_cpuid[15]=00000001 00000001 00000100 00000002
ext_cpuid[16]=00000001 00000001 00000100 00000002
ext_cpuid[17]=00000001 00000001 00000100 00000002
ext_cpuid[18]=00000001 00000001 00000100 00000002
ext_cpuid[19]=00000001 00000001 00000100 00000002
ext_cpuid[20]=00000001 00000001 00000100 00000002
ext_cpuid[21]=00000001 00000001 00000100 00000002
ext_cpuid[22]=00000001 00000001 00000100 00000002
ext_cpuid[23]=00000001 00000001 00000100 00000002
ext_cpuid[24]=00000001 00000001 00000100 00000002
ext_cpuid[25]=00000001 00000001 00000100 00000002
ext_cpuid[26]=00000001 00000001 00000100 00000002
ext_cpuid[27]=00000001 00000001 00000100 00000002
ext_cpuid[28]=00000001 00000001 00000100 00000002
ext_cpuid[29]=00000001 00000001 00000100 00000002
ext_cpuid[30]=00000001 00000001 00000100 00000002
ext_cpuid[31]=00000001 00000001 00000100 00000002
intel_fn4[0]=1c000121 0140003f 0000003f 00000001
intel_fn4[1]=1c000122 01c0003f 0000003f 00000001
intel_fn4[2]=1c00c143 03c0003f 000003ff 00000001
intel_fn4[3]=00000000 00000000 00000000 00000000
intel_fn4[4]=00000000 00000000 00000000 00000000
intel_fn4[5]=00000000 00000000 00000000 00000000
intel_fn4[6]=00000000 00000000 00000000 00000000
intel_fn4[7]=00000000 00000000 00000000 00000000
intel_fn11[0]=00000001 00000001 00000100 00000002
intel_fn11[1]=00000004 00000004 00000201 00000002
intel_fn11[2]=00000000 00000000 00000002 00000002
intel_fn11[3]=00000000 00000000 00000003 00000002
amd_fn8000001dh[0]=00000001 00000001 00000100 00000002
amd_fn8000001dh[1]=00000004 00000004 00000201 00000002
amd_fn8000001dh[2]=00000000 00000000 00000002 00000002
amd_fn8000001dh[3]=00000000 00000000 00000003 00000002
_________________ Logical CPU #2 _________________
basic_cpuid[0]=0000000b 756e6547 6c65746e 49656e69
basic_cpuid[1]=00030678 04100800 41d8e3bf bfebfbff
basic_cpuid[2]=61b3a001 0000ffc2 00000000 00000000
basic_cpuid[3]=00000000 00000000 00000000 00000000
basic_cpuid[4]=1c000121 0140003f 0000003f 00000001
basic_cpuid[5]=00000040 00000040 00000003 33000020
basic_cpuid[6]=00000007 00000002 00000009 00000000
basic_cpuid[7]=00000000 00002282 00000000 0c000400
basic_cpuid[8]=00000000 00000000 00000000 00000000
basic_cpuid[9]=00000000 00000000 00000000 00000000
basic_cpuid[10]=07280203 00000000 00000000 00004503
basic_cpuid[11]=00000001 00000001 00000100 00000004
basic_cpuid[12]=00000001 00000001 00000100 00000004
basic_cpuid[13]=00000001 00000001 00000100 00000004
basic_cpuid[14]=00000001 00000001 00000100 00000004
basic_cpuid[15]=00000001 00000001 00000100 00000004
basic_cpuid[16]=00000001 00000001 00000100 00000004
basic_cpuid[17]=00000001 00000001 00000100 00000004
basic_cpuid[18]=00000001 00000001 00000100 00000004
basic_cpuid[19]=00000001 00000001 00000100 00000004
basic_cpuid[20]=00000001 00000001 00000100 00000004
basic_cpuid[21]=00000001 00000001 00000100 00000004
basic_cpuid[22]=00000001 00000001 00000100 00000004
basic_cpuid[23]=00000001 00000001 00000100 00000004
basic_cpuid[24]=00000001 00000001 00000100 00000004
basic_cpuid[25]=00000001 00000001 00000100 00000004
basic_cpuid[26]=00000001 00000001 00000100 00000004
basic_cpuid[27]=00000001 00000001 00000100 00000004
basic_cpuid[28]=00000001 00000001 00000100 00000004
basic_cpuid[29]=00000001 00000001 00000100 00000004
basic_cpuid[30]=00000001 00000001 00000100 00000004
basic_cpuid[31]=00000001 00000001 00000100 00000004
ext_cpuid[0]=80000008 00000000 00000000 00000000
ext_cpuid[1]=00000000 00000000 00000101 28100800
ext_cpuid[2]=20202020 6e492020 286c6574 43202952
ext_cpuid[3]=72656c65 52286e6f 50432029 4e202055
ext_cpuid[4]=30333932 20402020 33382e31 007a4847
ext_cpuid[5]=00000000 00000000 00000000 00000000
ext_cpuid[6]=00000000 00000000 04008040 00000000
ext_cpuid[7]=00000000 00000000 00000000 00000100
ext_cpuid[8]=00003024 00000000 00000000 00000000
ext_cpuid[9]=00000001 00000001 00000100 00000004
ext_cpuid[10]=00000001 00000001 00000100 00000004
ext_cpuid[11]=00000001 00000001 00000100 00000004
ext_cpuid[12]=00000001 00000001 00000100 00000004
ext_cpuid[13]=00000001 00000001 00000100 00000004
ext_cpuid[14]=00000001 00000001 00000100 00000004
ext_cpuid[15]=00000001 00000001 00000100 00000004
ext_cpuid[16]=00000001 00000001 00000100 00000004
ext_cpuid[17]=00000001 00000001 00000100 00000004
ext_cpuid[18]=00000001 00000001 00000100 00000004
ext_cpuid[19]=00000001 00000001 00000100 00000004
ext_cpuid[20]=00000001 00000001 00000100 00000004
ext_cpuid[21]=00000001 00000001 00000100 00000004
ext_cpuid[22]=00000001 00000001 00000100 00000004
ext_cpuid[23]=00000001 00000001 00000100 00000004
ext_cpuid[24]=00000001 00000001 00000100 00000004
ext_cpuid[25]=00000001 00000001 00000100 00000004
ext_cpuid[26]=00000001 00000001 00000100 00000004
ext_cpuid[27]=00000001 00000001 00000100 00000004
ext_cpuid[28]=00000001 00000001 00000100 00000004
ext_cpuid[29]=00000001 00000001 00000100 00000004
ext_cpuid[30]=00000001 00000001 00000100 00000004
ext_cpuid[31]=00000001 00000001 00000100 00000004
intel_fn4[0]=1c000121 0140003f 0000003f 00000001
intel_fn4[1]=1c000122 01c0003f 0000003f 00000001
intel_fn4[2]=1c00c143 03c0003f 000003ff 00000001
intel_fn4[3]=00000000 00000000 00000000 00000000
intel_fn4[4]=00000000 00000000 00000000 00000000
intel_fn4[5]=00000000 00000000 00000000 00000000
intel_fn4[6]=00000000 00000000 00000000 00000000
intel_fn4[7]=00000000 00000000 00000000 00000000
intel_fn11[0]=00000001 00000001 00000100 00000004
intel_fn11[1]=00000004 00000004 00000201 00000004
intel_fn11[2]=00000000 00000000 00000002 00000004
intel_fn11[3]=00000000 00000000 00000003 00000004
amd_fn8000001dh[0]=00000001 00000001 00000100 00000004
amd_fn8000001dh[1]=00000004 00000004 00000201 00000004
amd_fn8000001dh[2]=00000000 00000000 00000002 00000004
amd_fn8000001dh[3]=00000000 00000000 00000003 00000004
_________________ Logical CPU #3 _________________
basic_cpuid[0]=0000000b 756e6547 6c65746e 49656e69
basic_cpuid[1]=00030678 06100800 41d8e3bf bfebfbff
basic_cpuid[2]=61b3a001 0000ffc2 00000000 00000000
basic_cpuid[3]=00000000 00000000 00000000 00000000
basic_cpuid[4]=1c000121 0140003f 0000003f 00000001
basic_cpuid[5]=00000040 00000040 00000003 33000020
basic_cpuid[6]=00000007 00000002 00000009 00000000
basic_cpuid[7]=00000000 00002282 00000000 0c000400
basic_cpuid[8]=00000000 00000000 00000000 00000000
basic_cpuid[9]=00000000 00000000 00000000 00000000
basic_cpuid[10]=07280203 00000000 00000000 00004503
basic_cpuid[11]=00000001 00000001 00000100 00000006
basic_cpuid[12]=00000001 00000001 00000100 00000006
basic_cpuid[13]=00000001 00000001 00000100 00000006
basic_cpuid[14]=00000001 00000001 00000100 00000006
basic_cpuid[15]=00000001 00000001 00000100 00000006
basic_cpuid[16]=00000001 00000001 00000100 00000006
basic_cpuid[17]=00000001 00000001 00000100 00000006
basic_cpuid[18]=00000001 00000001 00000100 00000006
basic_cpuid[19]=00000001 00000001 00000100 00000006
basic_cpuid[20]=00000001 00000001 00000100 00000006
basic_cpuid[21]=00000001 00000001 00000100 00000006
basic_cpuid[22]=00000001 00000001 00000100 00000006
basic_cpuid[23]=00000001 00000001 00000100 00000006
basic_cpuid[24]=00000001 00000001 00000100 00000006
basic_cpuid[25]=00000001 00000001 00000100 00000006
basic_cpuid[26]=00000001 00000001 00000100 00000006
basic_cpuid[27]=00000001 00000001 00000100 00000006
basic_cpuid[28]=00000001 00000001 00000100 00000006
basic_cpuid[29]=00000001 00000001 00000100 00000006
basic_cpuid[30]=00000001 00000001 00000100 00000006
basic_cpuid[31]=00000001 00000001 00000100 00000006
ext_cpuid[0]=80000008 00000000 00000000 00000000
ext_cpuid[1]=00000000 00000000 00000101 28100800
ext_cpuid[2]=20202020 6e492020 286c6574 43202952
ext_cpuid[3]=72656c65 52286e6f 50432029 4e202055
ext_cpuid[4]=30333932 20402020 33382e31 007a4847
ext_cpuid[5]=00000000 00000000 00000000 00000000
ext_cpuid[6]=00000000 00000000 04008040 00000000
ext_cpuid[7]=00000000 00000000 00000000 00000100
ext_cpuid[8]=00003024 00000000 00000000 00000000
ext_cpuid[9]=00000001 00000001 00000100 00000006
ext_cpuid[10]=00000001 00000001 00000100 00000006
ext_cpuid[11]=00000001 00000001 00000100 00000006
ext_cpuid[12]=00000001 00000001 00000100 00000006
ext_cpuid[13]=00000001 00000001 00000100 00000006
ext_cpuid[14]=00000001 00000001 00000100 00000006
ext_cpuid[15]=00000001 00000001 00000100 00000006
ext_cpuid[16]=00000001 00000001 00000100 00000006
ext_cpuid[17]=00000001 00000001 00000100 00000006
ext_cpuid[18]=00000001 00000001 00000100 00000006
ext_cpuid[19]=00000001 00000001 00000100 00000006
ext_cpuid[20]=00000001 00000001 00000100 00000006
ext_cpuid[21]=00000001 00000001 00000100 00000006
ext_cpuid[22]=00000001 00000001 00000100 00000006
ext_cpuid[23]=00000001 00000001 00000100 00000006
ext_cpuid[24]=00000001 00000001 00000100 00000006
ext_cpuid[25]=00000001 00000001 00000100 00000006
ext_cpuid[26]=00000001 00000001 00000100 00000006
ext_cpuid[27]=00000001 00000001 00000100 00000006
ext_cpuid[28]=00000001 00000001 00000100 00000006
ext_cpuid[29]=00000001 00000001 00000100 00000006
ext_cpuid[30]=00000001 00000001 00000100 00000006
ext_cpuid[31]=00000001 00000001 00000100 00000006
intel_fn4[0]=1c000121 0140003f 0000003f 00000001
intel_fn4[1]=1c000122 01c0003f 0000003f 00000001
intel_fn4[2]=1c00c143 03c0003f 000003ff 00000001
intel_fn4[3]=00000000 00000000 00000000 00000000
intel_fn4[4]=00000000 00000000 00000000 00000000
intel_fn4[5]=00000000 00000000 00000000 00000000
intel_fn4[6]=00000000 00000000 00000000 00000000
intel_fn4[7]=00000000 00000000 00000000 00000000
intel_fn11[0]=00000001 00000001 00000100 00000006
intel_fn11[1]=00000004 00000004 00000201 00000006
intel_fn11[2]=00000000 00000000 00000002 00000006
intel_fn11[3]=00000000 00000000 00000003 00000006
amd_fn8000001dh[0]=00000001 00000001 00000100 00000006
amd_fn8000001dh[1]=00000004 00000004 00000201 00000006
amd_fn8000001dh[2]=00000000 00000000 00000002 00000006
amd_fn8000001dh[3]=00000000 00000000 00000003 00000006
--------------------------------------------------------------------------------
x86
general
6
7
8
6
55
4
4
24
32
1024
-1
-1
6
8
16
-1
-1
64
64
64
-1
-1
4
4
2
0
0
128 (non-authoritative)
Bay Trail-M (Celeron)
fpu vme de pse tsc msr pae mce cx8 apic mtrr sep pge mca cmov pat pse36 clflush dts acpi mmx fxsr sse sse2 ss ht tm pbe pni pclmul dts64 monitor ds_cpl vmx est tm2 ssse3 cx16 xtpr pdcm sse4_1 sse4_2 syscall xd movbe popcnt rdtscp lm lahf_lm constant_tsc rdrand
