------[ Logical CPU #0 ]------
CPUID 00000000: 0000000B-756E6547-6C65746E-49656E69 [GenuineIntel]
CPUID 00000001: 00030673-00100800-41D8E3BF-BFEBFBFF
CPUID 00000002: 61B3A001-0000FFC2-00000000-00000000
CPUID 00000003: 00000000-00000000-00000000-00000000
CPUID 00000004: 1C000121-0140003F-0000003F-00000001
CPUID 00000004: 1C000122-01C0003F-0000003F-00000001
CPUID 00000004: 1C00C143-03C0003F-000003FF-00000001
CPUID 00000005: 00000040-00000040-00000003-33000020
CPUID 00000006: 00000005-00000002-00000009-00000000
CPUID 00000007: 00000000-00002282-00000000-00000000
CPUID 00000008: 00000000-00000000-00000000-00000000
CPUID 00000009: 00000000-00000000-00000000-00000000
CPUID 0000000A: 07280203-00000000-00000000-00004503
CPUID 0000000B: 00000001-00000001-00000100-00000000
CPUID 0000000B: 00000004-00000004-00000201-00000000
CPUID 80000000: 80000008-00000000-00000000-00000000
CPUID 80000001: 00000000-00000000-00000101-28100000
CPUID 80000002: 20202020-6E492020-286C6574-43202952 [      Intel(R) C]
CPUID 80000003: 72656C65-52286E6F-50432029-4A202055 [eleron(R) CPU  J]
CPUID 80000004: 30303931-20402020-39392E31-007A4847 [1900  @ 1.99GHz]
CPUID 80000005: 00000000-00000000-00000000-00000000
CPUID 80000006: 00000000-00000000-04008040-00000000
CPUID 80000007: 00000000-00000000-00000000-00000100
CPUID 80000008: 00003024-00000000-00000000-00000000
------[ Logical CPU #1 ]------
CPUID 00000000: 0000000B-756E6547-6C65746E-49656E69 [GenuineIntel]
CPUID 00000001: 00030673-02100800-41D8E3BF-BFEBFBFF
CPUID 00000002: 61B3A001-0000FFC2-00000000-00000000
CPUID 00000003: 00000000-00000000-00000000-00000000
CPUID 00000004: 1C000121-0140003F-0000003F-00000001
CPUID 00000004: 1C000122-01C0003F-0000003F-00000001
CPUID 00000004: 1C00C143-03C0003F-000003FF-00000001
CPUID 00000005: 00000040-00000040-00000003-33000020
CPUID 00000006: 00000005-00000002-00000009-00000000
CPUID 00000007: 00000000-00002282-00000000-00000000
CPUID 00000008: 00000000-00000000-00000000-00000000
CPUID 00000009: 00000000-00000000-00000000-00000000
CPUID 0000000A: 07280203-00000000-00000000-00004503
CPUID 0000000B: 00000001-00000001-00000100-00000002
CPUID 0000000B: 00000004-00000004-00000201-00000002
CPUID 80000000: 80000008-00000000-00000000-00000000
CPUID 80000001: 00000000-00000000-00000101-28100000
CPUID 80000002: 20202020-6E492020-286C6574-43202952 [      Intel(R) C]
CPUID 80000003: 72656C65-52286E6F-50432029-4A202055 [eleron(R) CPU  J]
CPUID 80000004: 30303931-20402020-39392E31-007A4847 [1900  @ 1.99GHz]
CPUID 80000005: 00000000-00000000-00000000-00000000
CPUID 80000006: 00000000-00000000-04008040-00000000
CPUID 80000007: 00000000-00000000-00000000-00000100
CPUID 80000008: 00003024-00000000-00000000-00000000
------[ Logical CPU #2 ]------
CPUID 00000000: 0000000B-756E6547-6C65746E-49656E69 [GenuineIntel]
CPUID 00000001: 00030673-04100800-41D8E3BF-BFEBFBFF
CPUID 00000002: 61B3A001-0000FFC2-00000000-00000000
CPUID 00000003: 00000000-00000000-00000000-00000000
CPUID 00000004: 1C000121-0140003F-0000003F-00000001
CPUID 00000004: 1C000122-01C0003F-0000003F-00000001
CPUID 00000004: 1C00C143-03C0003F-000003FF-00000001
CPUID 00000005: 00000040-00000040-00000003-33000020
CPUID 00000006: 00000005-00000002-00000009-00000000
CPUID 00000007: 00000000-00002282-00000000-00000000
CPUID 00000008: 00000000-00000000-00000000-00000000
CPUID 00000009: 00000000-00000000-00000000-00000000
CPUID 0000000A: 07280203-00000000-00000000-00004503
CPUID 0000000B: 00000001-00000001-00000100-00000004
CPUID 0000000B: 00000004-00000004-00000201-00000004
CPUID 80000000: 80000008-00000000-00000000-00000000
CPUID 80000001: 00000000-00000000-00000101-28100000
CPUID 80000002: 20202020-6E492020-286C6574-43202952 [      Intel(R) C]
CPUID 80000003: 72656C65-52286E6F-50432029-4A202055 [eleron(R) CPU  J]
CPUID 80000004: 30303931-20402020-39392E31-007A4847 [1900  @ 1.99GHz]
CPUID 80000005: 00000000-00000000-00000000-00000000
CPUID 80000006: 00000000-00000000-04008040-00000000
CPUID 80000007: 00000000-00000000-00000000-00000100
CPUID 80000008: 00003024-00000000-00000000-00000000
------[ Logical CPU #3 ]------
CPUID 00000000: 0000000B-756E6547-6C65746E-49656E69 [GenuineIntel]
CPUID 00000001: 00030673-06100800-41D8E3BF-BFEBFBFF
CPUID 00000002: 61B3A001-0000FFC2-00000000-00000000
CPUID 00000003: 00000000-00000000-00000000-00000000
CPUID 00000004: 1C000121-0140003F-0000003F-00000001
CPUID 00000004: 1C000122-01C0003F-0000003F-00000001
CPUID 00000004: 1C00C143-03C0003F-000003FF-00000001
CPUID 00000005: 00000040-00000040-00000003-33000020
CPUID 00000006: 00000005-00000002-00000009-00000000
CPUID 00000007: 00000000-00002282-00000000-00000000
CPUID 00000008: 00000000-00000000-00000000-00000000
CPUID 00000009: 00000000-00000000-00000000-00000000
CPUID 0000000A: 07280203-00000000-00000000-00004503
CPUID 0000000B: 00000001-00000001-00000100-00000006
CPUID 0000000B: 00000004-00000004-00000201-00000006
CPUID 80000000: 80000008-00000000-00000000-00000000
CPUID 80000001: 00000000-00000000-00000101-28100000
CPUID 80000002: 20202020-6E492020-286C6574-43202952 [      Intel(R) C]
CPUID 80000003: 72656C65-52286E6F-50432029-4A202055 [eleron(R) CPU  J]
CPUID 80000004: 30303931-20402020-39392E31-007A4847 [1900  @ 1.99GHz]
CPUID 80000005: 00000000-00000000-00000000-00000000
CPUID 80000006: 00000000-00000000-04008040-00000000
CPUID 80000007: 00000000-00000000-00000000-00000100
CPUID 80000008: 00003024-00000000-00000000-00000000
--------------------------------------------------------------------------------
x86
general
6
7
3
6
55
2
4
-1
-1
-1
-1
-1
-1
-1
-1
-1
-1
-1
-1
-1
-1
-1
-1
-1
-1
-1
-1
128 (non-authoritative)
Bay Trail-D (Celeron)
fpu vme de pse tsc msr pae mce cx8 apic mtrr sep pge mca cmov pat pse36 clflush dts acpi mmx fxsr sse sse2 ss ht tm pbe pni pclmul dts64 monitor ds_cpl vmx est tm2 ssse3 cx16 xtpr pdcm sse4_1 sse4_2 xd movbe popcnt rdtscp lm lahf_lm constant_tsc rdrand
