------[ CPUID Registers / Logical CPU #0 ]------
CPUID 00000000: 0000000B-756E6547-6C65746E-49656E69 [GenuineIntel]
CPUID 00000001: 000406D8-00100800-43D8E3BF-BFEBFBFF
CPUID 00000002: 61B3A001-0000FFC2-00000000-00000000
CPUID 00000003: 00000000-00000000-00000000-00000000
CPUID 00000004: 1C000121-0140003F-0000003F-00000001 [SL 00]
CPUID 00000004: 1C000122-01C0003F-0000003F-00000001 [SL 01]
CPUID 00000004: 1C00C143-03C0003F-000003FF-00000001 [SL 02]
CPUID 00000005: 00000040-00000040-00000003-03000020
CPUID 00000006: 00000005-00000002-00000009-00000000
CPUID 00000007: 00000000-00002282-00000000-00000000
CPUID 00000008: 00000000-00000000-00000000-00000000
CPUID 00000009: 00000000-00000000-00000000-00000000
CPUID 0000000A: 07280203-00000000-00000000-00004503
CPUID 0000000B: 00000001-00000001-00000100-00000000 [SL 00]
CPUID 0000000B: 00000004-00000008-00000201-00000000 [SL 01]
CPUID 80000000: 80000008-00000000-00000000-00000000
CPUID 80000001: 00000000-00000000-00000101-28100000
CPUID 80000002: 20202020-20202020-65746E49-2952286C [ Intel(R)]
CPUID 80000003: 6F744120-4D54286D-50432029-43202055 [ Atom(TM) CPU C]
CPUID 80000004: 38353732-20402020-30342E32-007A4847 [2758 @ 2.40GHz]
CPUID 80000005: 00000000-00000000-00000000-00000000
CPUID 80000006: 00000000-00000000-04008040-00000000
CPUID 80000007: 00000000-00000000-00000000-00000100
CPUID 80000008: 00003024-00000000-00000000-00000000
------[ CPUID Registers / Logical CPU #1 ]------
CPUID 00000000: 0000000B-756E6547-6C65746E-49656E69 [GenuineIntel]
CPUID 00000001: 000406D8-02100800-43D8E3BF-BFEBFBFF
CPUID 00000002: 61B3A001-0000FFC2-00000000-00000000
CPUID 00000003: 00000000-00000000-00000000-00000000
CPUID 00000004: 1C000121-0140003F-0000003F-00000001 [SL 00]
CPUID 00000004: 1C000122-01C0003F-0000003F-00000001 [SL 01]
CPUID 00000004: 1C00C143-03C0003F-000003FF-00000001 [SL 02]
CPUID 00000005: 00000040-00000040-00000003-03000020
CPUID 00000006: 00000005-00000002-00000009-00000000
CPUID 00000007: 00000000-00002282-00000000-00000000
CPUID 00000008: 00000000-00000000-00000000-00000000
CPUID 00000009: 00000000-00000000-00000000-00000000
CPUID 0000000A: 07280203-00000000-00000000-00004503
CPUID 0000000B: 00000001-00000001-00000100-00000002 [SL 00]
CPUID 0000000B: 00000004-00000008-00000201-00000002 [SL 01]
CPUID 80000000: 80000008-00000000-00000000-00000000
CPUID 80000001: 00000000-00000000-00000101-28100000
CPUID 80000002: 20202020-20202020-65746E49-2952286C [ Intel(R)]
CPUID 80000003: 6F744120-4D54286D-50432029-43202055 [ Atom(TM) CPU C]
CPUID 80000004: 38353732-20402020-30342E32-007A4847 [2758 @ 2.40GHz]
CPUID 80000005: 00000000-00000000-00000000-00000000
CPUID 80000006: 00000000-00000000-04008040-00000000
CPUID 80000007: 00000000-00000000-00000000-00000100
CPUID 80000008: 00003024-00000000-00000000-00000000
------[ CPUID Registers / Logical CPU #2 ]------
CPUID 00000000: 0000000B-756E6547-6C65746E-49656E69 [GenuineIntel]
CPUID 00000001: 000406D8-04100800-43D8E3BF-BFEBFBFF
CPUID 00000002: 61B3A001-0000FFC2-00000000-00000000
CPUID 00000003: 00000000-00000000-00000000-00000000
CPUID 00000004: 1C000121-0140003F-0000003F-00000001 [SL 00]
CPUID 00000004: 1C000122-01C0003F-0000003F-00000001 [SL 01]
CPUID 00000004: 1C00C143-03C0003F-000003FF-00000001 [SL 02]
CPUID 00000005: 00000040-00000040-00000003-03000020
CPUID 00000006: 00000005-00000002-00000009-00000000
CPUID 00000007: 00000000-00002282-00000000-00000000
CPUID 00000008: 00000000-00000000-00000000-00000000
CPUID 00000009: 00000000-00000000-00000000-00000000
CPUID 0000000A: 07280203-00000000-00000000-00004503
CPUID 0000000B: 00000001-00000001-00000100-00000004 [SL 00]
CPUID 0000000B: 00000004-00000008-00000201-00000004 [SL 01]
CPUID 80000000: 80000008-00000000-00000000-00000000
CPUID 80000001: 00000000-00000000-00000101-28100000
CPUID 80000002: 20202020-20202020-65746E49-2952286C [ Intel(R)]
CPUID 80000003: 6F744120-4D54286D-50432029-43202055 [ Atom(TM) CPU C]
CPUID 80000004: 38353732-20402020-30342E32-007A4847 [2758 @ 2.40GHz]
CPUID 80000005: 00000000-00000000-00000000-00000000
CPUID 80000006: 00000000-00000000-04008040-00000000
CPUID 80000007: 00000000-00000000-00000000-00000100
CPUID 80000008: 00003024-00000000-00000000-00000000
------[ CPUID Registers / Logical CPU #3 ]------
CPUID 00000000: 0000000B-756E6547-6C65746E-49656E69 [GenuineIntel]
CPUID 00000001: 000406D8-06100800-43D8E3BF-BFEBFBFF
CPUID 00000002: 61B3A001-0000FFC2-00000000-00000000
CPUID 00000003: 00000000-00000000-00000000-00000000
CPUID 00000004: 1C000121-0140003F-0000003F-00000001 [SL 00]
CPUID 00000004: 1C000122-01C0003F-0000003F-00000001 [SL 01]
CPUID 00000004: 1C00C143-03C0003F-000003FF-00000001 [SL 02]
CPUID 00000005: 00000040-00000040-00000003-03000020
CPUID 00000006: 00000005-00000002-00000009-00000000
CPUID 00000007: 00000000-00002282-00000000-00000000
CPUID 00000008: 00000000-00000000-00000000-00000000
CPUID 00000009: 00000000-00000000-00000000-00000000
CPUID 0000000A: 07280203-00000000-00000000-00004503
CPUID 0000000B: 00000001-00000001-00000100-00000006 [SL 00]
CPUID 0000000B: 00000004-00000008-00000201-00000006 [SL 01]
CPUID 80000000: 80000008-00000000-00000000-00000000
CPUID 80000001: 00000000-00000000-00000101-28100000
CPUID 80000002: 20202020-20202020-65746E49-2952286C [ Intel(R)]
CPUID 80000003: 6F744120-4D54286D-50432029-43202055 [ Atom(TM) CPU C]
CPUID 80000004: 38353732-20402020-30342E32-007A4847 [2758 @ 2.40GHz]
CPUID 80000005: 00000000-00000000-00000000-00000000
CPUID 80000006: 00000000-00000000-04008040-00000000
CPUID 80000007: 00000000-00000000-00000000-00000100
CPUID 80000008: 00003024-00000000-00000000-00000000
------[ CPUID Registers / Logical CPU #4 ]------
CPUID 00000000: 0000000B-756E6547-6C65746E-49656E69 [GenuineIntel]
CPUID 00000001: 000406D8-08100800-43D8E3BF-BFEBFBFF
CPUID 00000002: 61B3A001-0000FFC2-00000000-00000000
CPUID 00000003: 00000000-00000000-00000000-00000000
CPUID 00000004: 1C000121-0140003F-0000003F-00000001 [SL 00]
CPUID 00000004: 1C000122-01C0003F-0000003F-00000001 [SL 01]
CPUID 00000004: 1C00C143-03C0003F-000003FF-00000001 [SL 02]
CPUID 00000005: 00000040-00000040-00000003-03000020
CPUID 00000006: 00000005-00000002-00000009-00000000
CPUID 00000007: 00000000-00002282-00000000-00000000
CPUID 00000008: 00000000-00000000-00000000-00000000
CPUID 00000009: 00000000-00000000-00000000-00000000
CPUID 0000000A: 07280203-00000000-00000000-00004503
CPUID 0000000B: 00000001-00000001-00000100-00000008 [SL 00]
CPUID 0000000B: 00000004-00000008-00000201-00000008 [SL 01]
CPUID 80000000: 80000008-00000000-00000000-00000000
CPUID 80000001: 00000000-00000000-00000101-28100000
CPUID 80000002: 20202020-20202020-65746E49-2952286C [ Intel(R)]
CPUID 80000003: 6F744120-4D54286D-50432029-43202055 [ Atom(TM) CPU C]
CPUID 80000004: 38353732-20402020-30342E32-007A4847 [2758 @ 2.40GHz]
CPUID 80000005: 00000000-00000000-00000000-00000000
CPUID 80000006: 00000000-00000000-04008040-00000000
CPUID 80000007: 00000000-00000000-00000000-00000100
CPUID 80000008: 00003024-00000000-00000000-00000000
------[ CPUID Registers / Logical CPU #5 ]------
CPUID 00000000: 0000000B-756E6547-6C65746E-49656E69 [GenuineIntel]
CPUID 00000001: 000406D8-0A100800-43D8E3BF-BFEBFBFF
CPUID 00000002: 61B3A001-0000FFC2-00000000-00000000
CPUID 00000003: 00000000-00000000-00000000-00000000
CPUID 00000004: 1C000121-0140003F-0000003F-00000001 [SL 00]
CPUID 00000004: 1C000122-01C0003F-0000003F-00000001 [SL 01]
CPUID 00000004: 1C00C143-03C0003F-000003FF-00000001 [SL 02]
CPUID 00000005: 00000040-00000040-00000003-03000020
CPUID 00000006: 00000005-00000002-00000009-00000000
CPUID 00000007: 00000000-00002282-00000000-00000000
CPUID 00000008: 00000000-00000000-00000000-00000000
CPUID 00000009: 00000000-00000000-00000000-00000000
CPUID 0000000A: 07280203-00000000-00000000-00004503
CPUID 0000000B: 00000001-00000001-00000100-0000000A [SL 00]
CPUID 0000000B: 00000004-00000008-00000201-0000000A [SL 01]
CPUID 80000000: 80000008-00000000-00000000-00000000
CPUID 80000001: 00000000-00000000-00000101-28100000
CPUID 80000002: 20202020-20202020-65746E49-2952286C [ Intel(R)]
CPUID 80000003: 6F744120-4D54286D-50432029-43202055 [ Atom(TM) CPU C]
CPUID 80000004: 38353732-20402020-30342E32-007A4847 [2758 @ 2.40GHz]
CPUID 80000005: 00000000-00000000-00000000-00000000
CPUID 80000006: 00000000-00000000-04008040-00000000
CPUID 80000007: 00000000-00000000-00000000-00000100
CPUID 80000008: 00003024-00000000-00000000-00000000
------[ CPUID Registers / Logical CPU #6 ]------
CPUID 00000000: 0000000B-756E6547-6C65746E-49656E69 [GenuineIntel]
CPUID 00000001: 000406D8-0C100800-43D8E3BF-BFEBFBFF
CPUID 00000002: 61B3A001-0000FFC2-00000000-00000000
CPUID 00000003: 00000000-00000000-00000000-00000000
CPUID 00000004: 1C000121-0140003F-0000003F-00000001 [SL 00]
CPUID 00000004: 1C000122-01C0003F-0000003F-00000001 [SL 01]
CPUID 00000004: 1C00C143-03C0003F-000003FF-00000001 [SL 02]
CPUID 00000005: 00000040-00000040-00000003-03000020
CPUID 00000006: 00000005-00000002-00000009-00000000
CPUID 00000007: 00000000-00002282-00000000-00000000
CPUID 00000008: 00000000-00000000-00000000-00000000
CPUID 00000009: 00000000-00000000-00000000-00000000
CPUID 0000000A: 07280203-00000000-00000000-00004503
CPUID 0000000B: 00000001-00000001-00000100-0000000C [SL 00]
CPUID 0000000B: 00000004-00000008-00000201-0000000C [SL 01]
CPUID 80000000: 80000008-00000000-00000000-00000000
CPUID 80000001: 00000000-00000000-00000101-28100000
CPUID 80000002: 20202020-20202020-65746E49-2952286C [ Intel(R)]
CPUID 80000003: 6F744120-4D54286D-50432029-43202055 [ Atom(TM) CPU C]
CPUID 80000004: 38353732-20402020-30342E32-007A4847 [2758 @ 2.40GHz]
CPUID 80000005: 00000000-00000000-00000000-00000000
CPUID 80000006: 00000000-00000000-04008040-00000000
CPUID 80000007: 00000000-00000000-00000000-00000100
CPUID 80000008: 00003024-00000000-00000000-00000000
------[ CPUID Registers / Logical CPU #7 ]------
CPUID 00000000: 0000000B-756E6547-6C65746E-49656E69 [GenuineIntel]
CPUID 00000001: 000406D8-0E100800-43D8E3BF-BFEBFBFF
CPUID 00000002: 61B3A001-0000FFC2-00000000-00000000
CPUID 00000003: 00000000-00000000-00000000-00000000
CPUID 00000004: 1C000121-0140003F-0000003F-00000001 [SL 00]
CPUID 00000004: 1C000122-01C0003F-0000003F-00000001 [SL 01]
CPUID 00000004: 1C00C143-03C0003F-000003FF-00000001 [SL 02]
CPUID 00000005: 00000040-00000040-00000003-03000020
CPUID 00000006: 00000005-00000002-00000009-00000000
CPUID 00000007: 00000000-00002282-00000000-00000000
CPUID 00000008: 00000000-00000000-00000000-00000000
CPUID 00000009: 00000000-00000000-00000000-00000000
CPUID 0000000A: 07280203-00000000-00000000-00004503
CPUID 0000000B: 00000001-00000001-00000100-0000000E [SL 00]
CPUID 0000000B: 00000004-00000008-00000201-0000000E [SL 01]
CPUID 80000000: 80000008-00000000-00000000-00000000
CPUID 80000001: 00000000-00000000-00000101-28100000
CPUID 80000002: 20202020-20202020-65746E49-2952286C [ Intel(R)]
CPUID 80000003: 6F744120-4D54286D-50432029-43202055 [ Atom(TM) CPU C]
CPUID 80000004: 38353732-20402020-30342E32-007A4847 [2758 @ 2.40GHz]
CPUID 80000005: 00000000-00000000-00000000-00000000
CPUID 80000006: 00000000-00000000-04008040-00000000
CPUID 80000007: 00000000-00000000-00000000-00000100
CPUID 80000008: 00003024-00000000-00000000-00000000
--------------------------------------------------------------------------------
x86
x86-64-v2
general
6
13
8
6
77
8
8
24
32
1024
-1
-1
6
8
16
-1
-1
64
64
64
-1
-1
8
8
4
0
0
128 (non-authoritative)
Atom (Rangeley)
22 nm
fpu vme de pse tsc msr pae mce cx8 apic mtrr sep pge mca cmov pat pse36 clflush dts acpi mmx fxsr sse sse2 ss ht tm pbe pni pclmul dts64 monitor ds_cpl vmx est tm2 ssse3 cx16 xtpr pdcm sse4_1 sse4_2 xd movbe popcnt aes rdtscp lm lahf_lm constant_tsc rdrand
